job_titles,job_description,images,locations,salaries,companies
Dean of Industrial Engineering and Innovation Sciences,"Eindhoven University of Technology: where innovation starts, and people matter
In service to society, Eindhoven University of Technology (TU/e) strives for excellence in academic research, education, innovation, and impact, contributing to several of the United Nations’ sustainable development goals. At the heart of TU/e is an inspiring, open, diverse, and tight-knit international community of talented and bright people; with 13,000 students, close to 7,000 staff, and countless partners. Some 4,500 TU/e researchers thrive, in collaboration with academic peers and partners, in top-notch labs and off-campus settings all over the world. TU/e is at the heart of a unique ecosystem for innovation and growth, Brainport Eindhoven; one of Europe’s leading innovative top technology regions. It is fast becoming the number one motor of the economy of The Netherlands, making further growth of TU/e inevitable in the years to come.
The Department of Industrial Engineering & Innovation Sciences (IE & IS), one of the nine departments at the TU/e, aims to take a leadership role in supporting industry, government and society in their responsible adoption and effective implementation of key enabling technologies that address grand societal challenges. The mission of the Department is to generate high-quality scientific progress and output, offer excellent educational programs, and create technology-based impact for society and industry, combining disciplinary and multidisciplinary excellence at the interplay of technological sciences, social sciences and the humanities. The Department hosts a rich collection of disciplinary perspectives from social sciences and humanities, including philosophy, sociology, psychology, economics up to operations research, management, and entrepreneurship.
Dean of the department of Industrial Engineering & Innovation Sciences
TU/e is seeking to appoint a new Dean who will further build upon the strengths of the Department of Industrial Engineering & Innovation Sciences through an inspiring vision to effectively guide the Department through growth, and stimulate effective cooperation and interactions between research, education, impact, and supporting processes.
As a member of the Consultative Council and the Doctorate Board, the Dean contributes to determining the strategy, course and development of TU/e. The Dean acts together with the Executive Board and fellow Deans. The TU/e mission, vision and strategy are translated into a multi-year policy for the Department.
The Dean implements the Department agenda together with the Department Board. The Department Board consists of the Dean, two Vice Deans and a Managing Director. The Dean chairs the Department Board, which holds final and integral responsibility for the Department’s education, research, societal impact, and operations.
The Dean represents the TU/e and the Department to various internal and external stakeholders, acts in a diplomatic way within the force field of the university and maintains good contacts with adjacent disciplines. To the outside world, the Dean improves the national and international visibility. This also calls for modern leadership by creating a broad base of research program leaders to represent the department.
The Dean is keen to represent the Department within and outside the university and position it as an internationally leading department in Industrial Engineering & Innovation Sciences with respect to research and education. The successful candidate takes responsibility for department and university initiatives and works on the further development and implementation of the strategy within the department. The Dean takes the lead and contributes your own vision that is consistent with the overarching university vision and strategy. They contribute proactively and constructively to the governance and strategic development of TU/e and have an affinity with organisational development.
As a leader, the Dean stimulates mutual involvement in the department by being visible and investing in an open and good relationship with the academic community, with professional staff members and with the department council. The Dean takes the interests of all groups into consideration when making decisions. Through connecting leadership, they encourage collaboration among people and different parts of the department and collaboration with other departments, institutions, and support services and create synergy across disciplinary borders.
The Dean is an established scientist (full professor) with an active engineering background, experience in one of the domains of the department and affinity with all domains. The successful candidate has an existing strong track record in shaping multi-disciplinary research on the basis of disciplinary excellence to further strengthen the systems approach of the department. They have an existing international and national network within and outside of academia and they can make new connections between departments and academic and societal actors. In previous career steps, the Dean has developed managerial qualities and has shown that you can lead in a complex, knowledge-intensive environment. The management and leadership style is characterised by integrity, empathy, open dialogue, transparency, and the ability to build bridges as well as cut through knots. The Dean listens to various perspectives, weighs them, makes informed decisions, and creates broad support. The successful candidate has a natural focus on talent scouting and strongly encourages talent and leadership development with a warm heart for diversity and inclusion, and an eye for social safety. The Dean encourages team spirit, collegiality and academic citizenship to create a thriving community.
Appointment: The appointment is for a period of four years, with the possibility of reappointment. In addition, the Dean will be appointed to the position of permanent Professor by the Executive Board. TU/e has adopted an active policy to increase the number of female scientists across all disciplines of the university. Equally, TU/e strives for a diverse composition of Department Boards. Therefore, female candidates are especially encouraged to apply.
Remuneration: The position is valued according to the associated professor salary scale, and will, in addition, receive an administration allowance for fulfilling the role of Dean.
Appointment Process and How to Apply
An executive search exercise is being undertaken by Perrett Laver to assist the Appointment Advisory Committee in the discharge of its duties, both to assist in the assessment of candidates against the requirements of the role and to identify the widest possible field of candidates. Applications should consist of a covering letter addressing suitability against the person specification and a full curriculum vitae.
Perrett Laver may be contacted for a more detailed profile, informal enquiries and questions on +31 (0) 202 409 340 or by emailing Carla.Posch@perrettlaver.com. Applications can be uploaded at https://candidates.perrettlaver.com/vacancies/, quoting reference 6473.
The closing date for applications is at 9 am CET on Monday 24th April 2023.
Applications will be considered by the selection committee at the beginning of May and shortlisted candidates will be selected by mid-May. The interviews with the appointment committee and a selection assessment will take place in June. The appointment process, including the appointment decision, is expected to occur expeditiously.
As defined under the General Data Protection Regulation (GDPR) Perrett Laver is a Data Controller and a Data Processor, and our legal basis for processing your personal data is ‘Legitimate Interest’. For more information about this, your rights, and our approach to Data Protection and Privacy,",https://media.glassdoor.com/sql/1103698/perrett-laver-squarelogo-1502373037268.png,Eindhoven,nan,Perrett Laver
(Sr) Manager Manufacturing Engineering,"Manager Engineering | Biotech | Pharma | GMP | Engineering | Amsterdam |

Your new role

We are looking for Sr Manager Manufacturing Engineering, to join an international company in biotech that is growing fast. Does the idea of contributing to company’s ultimate mission, to cure cancer, motivate you? Would you describe yourself as team player, calm demeanor with helicopter view? This might be your next career step. As (Sr) Manager Manufacturing Engineering, you lead the day-to-day activities of the engineering department and serve as a senior people manager with focus on operational resource management.

Responsibilities
May manage external contractors in addition to internal line reports.Oversight of progress of multiple projects.Builds and manages an effective Engineering team and ensure that all personnel are fully aligned to their customer needs and requirements, providing an excellent level of service.Responsible for staff development, and managing high performing teams budgeting and cost control, talent mapping, succession planning, the development of strong leaders within the function, and multi-function for long-term planningLeads the day-to-day activities of an engineering department.Resolves people management issues and provide expert advice to managers regarding technical, operations or people management issues.Manages the site Capital Project Portfolio and budget for the Engineering department.Manages the site Capital Project execution process and delivery in alignment with organizational goalsProvides oversight and support for Engineering Programs to ensure Safety and GMP ComplianceDevelops, reviews, modifies, implements and recommends modifications to company- wide Engineering policies and procedures to achieve corporate goals and objectives.Exercises judgment within defined practices and policies in selecting methods, techniques and evaluation criteria for obtaining results.Develops requirements and specifications for projects and ensures that business drivers are clearly defined and communicated.Analyses industry trends and anticipates changes in the competitive or regulatory landscape to adjust plans as appropriate.Ensures projects are executed safely, efficiently, and in accordance with all applicable codes and company standards.Serves as team representative in strategic planning and operating discussions with senior leadership.Collaborates with the Global Facilities and Engineering Network to enable development and implementation of company best practice for engineering.Additional duties as assigned.These duties can be delegated to designated deputies of a satisfactory qualification level as needed.

What you'll need to succeed
Master’s or Bachelor degree in Engineering.
At least 5 years of relevant work experience, ideally in a big, international company.
Experience in the life sciences sector (biotech/pharma/devices).
cGMP experience.
Good communication in English, Dutch is pre.
You have a helicopter view – capable of overseeing work.
You are team player, structured and calm demeanor.

Your new company

The company is dedicated to achieving one of the most ambitious goals of 21st century medicine: curing cancer. This mission is at the heart of everything they do, from early research to product development. With an unrelenting drive and a singular focus on cell therapy, our team is executing on our strategy to bring life-saving therapies to patients

What you need to do now
If you're interested in this role, click 'apply now' to forward an up-to-date copy of your CV, or call us now.
If this job isn't quite right for you but you are looking for a new position, please contact us for a confidential discussion on your career. #1045889",https://media.glassdoor.com/sql/10166/hays-squareLogo-1656914533819.png,Amsterdam,nan,HAYS
Chair in International Relations and Security Studies,"Chair in International Relations and Security Studies
Situated in the bustling economic and cultural capital of the region, the University of Groningen is a research-intensive university with a truly global outlook that attracts a large number of staff and students from the Netherlands and internationally.
Since its foundation in 1614, the University of Groningen has established an international reputation as a dynamic and innovative university offering high quality teaching and research. Its 30,000 students are encouraged to develop their own individual talents through challenging study and career paths. The University of Groningen is an international centre of knowledge: it belongs to the best research universities in Europe and is allied with prestigious partner universities and networks worldwide. The University of Groningen has a strong commitment to the principles and practices of diversity and inclusion throughout the University community and welcomes candidates who enhance that diversity.
Building the State of the Arts together
The Faculty of Arts is building on a longstanding tradition of four centuries and their mission is to create positive societal and academic impact through relevant, high-quality teaching and research. The faculty strives to remain an ambitious top-ranking faculty with excellent education and state of the art research, with a strong international orientation, firmly rooted in the North of The Netherlands. The faculty builds and shares knowledge which benefits society, and educates over 5.000 Dutch and international students to become forward-looking, articulate and independent academics.
The Faculty offers a multidisciplinary environment and a wide range of degree programmes. Its research, which is internationally acclaimed, covers the fields of Archaeology, Cultural Studies, History, International Relations, Journalism, Language and Literary Studies, and Linguistics.
The Faculty of Arts is seeking to appoint a Chair in International Relations and Security Studies with an established reputation for excellence in research, teaching, and impact. The Chair will further develop the pioneering research in the field of Security Studies within International Relations and will bring a clear vision on the future of the field. The new Chair may come from all areas of expertise within the realm of International Relation, with a preference for empirically informed theoretical approaches to Security Studies. The Chair will lead a diverse and dynamic team of researchers with wide-ranging research and disciplinary backgrounds, including history, political science, economics, sociology, and spatial sciences. This team consist of ambitious scholars who view security creatively through the prisms of problems of order, power and governance in time and in space. The successful candidate will create and strengthen collaborations within the Faculty of Arts and University of Groningen and with the broader research field and society. The Chair has a strong societal network and demonstrable experience with knowledge valorisation, being capable of translating research and teaching to societal partners and a general audience.
Person Specification
The successful appointee will evidence:
a PhD degree in International Relations or a closely related field;
a clear vision on the future of Security Studies within International Relations, and International Relations in general;
proven excellence in academic research, as demonstrated by publications in leading international journals and books published by high-ranking publishers;
successfully obtained research grants from national and/or international funding agencies;
a relevant, strategic international network, demonstrated by, for example, participation in internationally relevant conferences and leading roles on editorial boards;
extensive experience in and a passion for education, as well as an innovative view on teaching, including active learning and interdisciplinary teaching;
excellent leadership skills and organisational competences, including proven experience in supervising PhD students mentoring junior and more senior academic staff members;
the willingness to collaborate in teaching and research.
a strong societal network and demonstrable experience with societal impact;
fluency in English and Dutch or a willingness to learn the Dutch language, for which support is available.
Conditions of Employment
The position is offered on a full-time basis and candidate will reside near Groningen. Remuneration depends on previous qualifications and experience and ranges between €6,099 and €8,881 per month (scale H2 Collective Labour Agreement Dutch Universities). Salaries are supplemented with a holiday bonus of 8 % of annual salary and a year-end bonus of 8.3 % of annual salary per year.
The University of Groningen provides career services for partners of new faculty members moving to Groningen (http://www.rug.nl/about-us/work-with-us/that-is-why/dual-career-support/).
The University of Groningen has adopted an active policy to increase the number of female scientists across all disciplines of the University. Therefore, female candidates are especially encouraged to apply.
For more information on the terms of employment, please visit: https://www.rug.nl/about-ug/work-with-us/new-staff/https://www.rug.nl/about-ug/work-with-us/new-staff/
Appointment Process and How to Apply
An executive search exercise is being undertaken by Perrett Laver to support the university in identifying the widest possible field of qualified candidates and assisting in the assessment of candidates against the requirements for the role. Queries can be directed to Feride Yetis via Feride.Yetis@perrettlaver.com or +31 (0) 202 409 344.
Applications should consist of the following:
A curriculum vitae, including a list of publications, teaching overview, external funding, as well as managerial activities.
A cover letter, not longer than two pages, outlining their motivation and suitability for the role and demonstrating how they meet the eligibility criteria outlined above

These can be uploaded at https://candidates.perrettlaver.com/vacancies quoting reference 6236.
The closing date for applications is Friday 14th April 2023 at 09:00am CET.
Applications will be considered by the selection committee in April and shortlisted candidates will be invited to interview in May and June. Selection of and negotiations with the preferred candidate and final campus visits will take place thereafter.
As defined under the General Data Protection Regulation (GDPR) Perrett Laver is a Data Controller and a Data Processor, and our legal basis for processing your personal data is ‘Legitimate Interest’. For more information about this, your rights, and our approach to Data Protection and Privacy,",https://media.glassdoor.com/sql/1103698/perrett-laver-squarelogo-1502373037268.png,Groningen,€6K - €9K (Employer est.),Perrett Laver
SOC Lead,"This role is part of Group IT Function and has a main responsibility for supporting Group IT Security with activities related to Security Operations Centre. This role will be accountable for the daily SOC Operations from supervision of L1/L2 analyst; lead, organize and control investigation, provides know how and expert advice of the escalated security events. The individual requires full coordination with the various team on the detected and escalated security events ensuring proper follow up until resolution. Act as the management point of contact for any incident and initiate actions in response to incidents.
Functie
Manage the security monitoring, detecting and analysis of events related to security, ensuring proactive and appropriate defence.
Lead the investigation and remediation of the existing threats arising from central event monitoring tools.
Participate on the Use Case Development supported by the SIEM and security tools.
Act as a point of escalation for detected security events within and outside the team.
Support the SOC Managers from designing and building an effective SOC. Including but not limited to developing new ideas on how to improve the security Operations, creates technical procedures, handling guidelines and playbooks.
Work with the global SOC on responding and resolving events generated by the SIEM.
Security Projects & Deployments
Drives the implementation of the central event monitoring tools.
Coordinates the implementation of the other projects when necessary. Lead the integration, deployment, and various testing.
Daily Operations
Ensure various tickets and escalated security issues are being handled in a timely manner
When needed, conduct forensic investigations, malware analysis, reverse engineering, advanced investigation utilizing various in-house and open-source security tools.
Prepares various reports and metrics as defined by the management.
Attends meeting and participate to various cyber exercises.
Bedrijf

Our client has grown into the world’s largest international health and beauty retailer, they strive to connect their international network of 12 retail brands to make the world a happier and healthier place together.﻿

Aanbod
A strong market-based salary via YER, matching your education and experience;
Minimum 25 vacation days and 8% vacation allowance;
Hybrid works;
Travel allowance;
Good pension scheme;
Very fringe benefits;
9 out of 10 YER professionals enter into permanent employment with the client after their hiring period via YER;
Profiel
Person Specification
Degree holder in Computer Science or related disciplines. GIAC Cyber Security Cert or CISSP qualification is a big plus.
5+ years of experience in information security incident handling and SOC operations.
Experience supervising a medium-sized Security Team
Hands on Cyber security solution implementation and operation, especially in SIEM and various security tools.
Microsoft SC-200 Certification (Microsoft Security Operations Analyst) Strong problem-solving skills and fast learner.
Liaison skill & teamwork, passion & commitment mentality
Good interpersonal and communication skills.
Good command of written and spoken English
Technical Requirements
Solid support experiences on Splunk operations and project implementations including the integration of other enterprise security tools such as SOAR, EDR, Enterprise Anti-virus, Vulnerability Management, and other supporting tools.
Broad experience on Splunk systems maintenance and troubleshooting (Splunk components like Heavy Forwarders and Deployment Servers)
Experience working with scripting languages for Microsoft Suite (MDE, Sentinel)
Basic events handling experience in EDR (MS MDE), NDR (Vetra AI), MS Sentinel interface.
Experience analysing
Well experienced in security incident handling.
Broad knowledge of cyber security concepts including vulnerabilities, web and application security, access controls and secure architectures.
Experience in ITSM tools.",https://media.glassdoor.com/sql/414902/yer-squarelogo-1520331483682.png,Abcoude,nan,YER
