job_titles,job_description,images,locations,salaries,companies
Fiscaal student-stage 2023 (Rotterdam/ Amsterdam),"Wil jij weten hoe de praktijk en de sfeer is bij Loyens & Loeff? Een uitdagende full-time stage van twee maanden biedt de mogelijkheid om wederzijds kennis te maken!

Tijdens een binnenlandse stage draai je volledig mee binnen de praktijk. Je werkt samen met fiscalisten, advocaten en kandidaat-notarissen en voert diverse werkzaamheden uit: denk aan het opstellen van memo’s, het doen van jurisprudentieonderzoeken maar ook het bijwonen van gesprekken met cliënten. Je persoonlijke mentor begeleidt jou tijdens je stage. Je leert ons kantoor goed kennen en je ontmoet veel andere stagiairs en werkstudenten tijdens de verschillende sociale activiteiten die we organiseren.

Als fiscale student-stagiair kom je te werken binnen één van onze praktijkgroepen:

ITS Americas;

Employment Taxes;

Family Owned Business & Private Wealth;

Indirect Tax;

Investment Management;

Multinationals;

Transactional Tax;

Transfer Pricing.

Waar:
Je kunt kiezen of je op onze Amsterdamse of Rotterdamse vestiging stage wilt lopen. In Rotterdam kun je kosteloos gebruik maken van het Loyens & Loeff appartement wanneer je buiten Rotterdam woont.

Voor wie:
Derdejaars bachelor- en masterstudenten Fiscaal Recht en/of Fiscale Economie.

Duur:
Twee maanden, full-time.

Vergoeding:
€ 750,- bruto per maand.

Sollicitatieprocedure

De procedure bestaat uit een schriftelijke voorselectie (motivatiebrief, cv, cijferlijsten en eventuele stagebeoordelingen), gevolgd door een gesprek met twee leden uit de student-stagiair commissie.

Wie zijn wij?

Loyens & Loeff is een onafhankelijke aanbieder van juridische diensten waar fiscalisten, advocaten en notarissen samenwerken aan geïntegreerde dienstverlening op het gebied van recht in de Benelux en Zwitserland. Zowel grote en middelgrote, nationaal en internationaal opererende ondernemingen als particulieren worden op juridisch gebied bediend. Wereldwijd werken er 1600 medewerkers waarvan ruim 1000 fiscalisten, advocaten en notarissen in 5 kantoren in de thuismarkt en in 6 vestigingen in de belangrijkste financiële centra in Europa, Azië en de Verenigde Staten. Onze organisatie onderhoudt intensieve relaties met gerenommeerde internationale advocatenkantoren en belastingadvieskantoren.

Voor meer vragen omtrent deze stage kun je contact opnemen met Elisabeth Visser (Recruiter) via onderstaande gegevens.

We zien je sollicitatie graag verschijnen!
Share",https://media.glassdoor.com/sql/883482/loyens-and-loeff-squarelogo-1519305426396.png,Amsterdam,nan,Loyens & Loeff
Werkstudentschap Tax,"Bedrijf
Baker McKenzie
Type
Stage
Locatie
Amsterdam
Branche / Vakgebied
Advocatuur, Fiscaliteit, Juridisch, Juridisch advies
Vereiste taal
Engels, Nederlands
Omschrijving
Informatie
Baker McKenzie is één van 's werelds grootste en meest toonaangevende advocatenkantoor, met 77 kantoren in 47 landen. Als eerste advocatenkantoor in Nederland met een internationale praktijk, heeft Baker McKenzie Amsterdam de meeste ervaring in de grensoverschrijdende advocatuur. In Amsterdam werken circa 200 advocaten, fiscalisten en notarissen voor internationale en Nederlandse topcliënten. Wil jij écht weten hoe het eraan toegaat op een internationaal advocatenkantoor? Kom dan student-stage lopen! Wij bieden je de mogelijkheid om twee maanden fulltime mee te lopen op ons kantoor.
Fiscale praktijk
De fiscale sectie binnen Baker McKenzie heeft een naam hoog te houden. Al vele jaren combineert de sectie gedegen fiscale kennis met praktische slagvaardigheid. Zij adviseert, assisteert en procedeert waar nodig, vaak in nauwe samenwerking met de Notariële en juridische collega's van de sectie Corporate en met buitenlandse Baker McKenzie kantoren. In de fiscale praktijk van Baker McKenzie in Amsterdam werken ongeveer 75 professionals verdeeld over verschillende specialisaties:
Onze sectie Corporate & International Tax verleent bijstand aan Nederlandse en buitenlandse cliënten op fiscaal gebied zowel bij transacties (waaronder fusies, overnames en reorganisaties) als in het beslechten of voorkomen van fiscale geschillen.
Onze afdeling Indirect Tax bedient beursgenoteerde multinationals en grote en middelgrote ondernemingen op het gebied van omzetbelasting. Het team vervult binnen Baker McKenzie een voortrekkersrol bij de verdere uitbouw van een wereldwijde BTW- en douanepraktijk.
Het team Transfer Pricing bestaat uit belastingadviseurs, economen en analisten van over de hele wereld. Zij houden zich bezig met tax planning en transacties en bieden naast uitgebreid economisch belastingadvies, innovatieve zakelijke oplossingen aan onze internationale klanten.
Daarnaast houdt onze afdeling Employee Benefits zich voornamelijk bezig met loonbelastingen en sociale verzekeringen. Onze collega's adviseren onder andere over zaken van arbeidsvoorwaarden tot en met belastingcontroles en zijn betrokken bij de fiscale aspecten van reorganisaties en internationale uitzendingen van werknemers.
De baanbrekende praktijk staat nummer één op internationale juridische ranglijsten en valt regelmatig in de prijzen. Zo zijn wij meerdere malen uitgeroepen door International Tax Review tot Tax Firm én Transfer Pricing Firm of the Year.
Functie
Als student-stagiaire werk je mee aan projecten met de Baker McKenzie collega's en lever je o.a. bijdrage door het doen van due diligence en het schrijven van memo's. Je wordt uitgedaagd om je kennis en ervaring creatief in te zetten op een specifiek werkgebied. Uiteraard dragen wij zorg voor goede begeleiding en ben je ook van harte welkom bij sociale kantoor en/of sectie gerelateerde evenementen.
Eisen
Baker McKenzie is altijd op zoek naar gemotiveerde student-stagiaires. Je kiest bewust voor een stage bij een groot, internationaal kantoor en kunt dit goed motiveren. Je zit minimaal in het derde jaar van je universitaire studie Fiscaal Recht of Fiscale Economie en beschikt over een goed CV (met nevenactiviteiten) evenals een goede cijferlijst. Daarnaast heb je een goede beheersing van de Nederlandse- en Engelse taal en wil je graag stage komen lopen in een team om te werken aan grensoverschrijdende zaken. Je wilt jezelf ontwikkelen en je kennis verdiepen en verbreden in een internationale omgeving. Ook vind je het leuk om op sociaal vlak actief te zijn binnen de sectie.
Interesse
Ben jij klaar voor deze uitdaging en herken jij jezelf in bovengenoemde functieomschrijving? Solliciteer dan middels het sollicitatieformulier via www.werkenbijbaker.nl.
We hebben gedurende het hele jaar ruimte voor student-stagiaires. Voor vragen over deze vacature kun je contact opnemen met onze recruiter Anne Lubbers via anne.lubbers@bakermckenzie.com of via 020 551 7135.",https://media.glassdoor.com/sql/2724/baker-and-mckenzie-squarelogo-1481558079809.png,Amsterdam,nan,Baker McKenzie
Employment Taxes Compliance Adviser,"Wil je werken in een unieke functie waarin de aangifte- en adviespraktijk worden gecombineerd? En wil jij werken voor cliënten die behoren tot de top van het bedrijfsleven? Solliciteer dan nu!
Dit ga je doen als Compliance Adviser Employment Taxes
Als Compliance Advisor Employment Taxes maak je deel uit van het loonheffingen team van de afdeling Employment & Benefits. Dit team bestaat uit ongeveer 15 medewerkers en houdt zich bezig met loonbelasting en sociale zekerheid ten aanzien van het management en de werknemers van multinationals en het grotere Nederlandse bedrijfsleven. Het team is zeer gedreven en de verkregen kennis wordt actief en enthousiast met elkaar en de cliënten gedeeld.
Als Compliance Advisor Employment Taxes bestaat je werk uit een unieke mix van aangifte- en advieswerkzaamheden en je werkt nauw samen met je aangifte- en adviescollega’s uit het team en andere praktijkgroepen aan uitdagende zaken. Binnen ons team combineren wij namelijk de nationale en internationale praktijk. Hiermee gaat hand in hand dat jij al snel het aanspreekpunt bent voor cliënten op de dossiers waar jij verantwoordelijkheid voor draagt. Je verdiept je dagelijks in de maatschappelijke ontwikkelingen op jouw vakgebied, evenals nieuwe nationale en Europese wetgeving, zodat jij de cliënt altijd voorziet van actuele kennis. Voordat je het weet heb jij je ontwikkeld tot een ervaren specialist.
In deze rol ga je je bezighouden met:
Het bepalen van de fiscale positie van werknemers en bestuurders van internationale ondernemingen en het opstellen van hun (complexe) aangiften inkomstenbelasting, met de daarbij behorende toelichtingen op de aangifte;
Het begeleiden van inkomende en uitgaande expats ten aanzien van hun fiscale positie, inclusief het aanvragen van 30%-regelingen en A1-verklaringen;
Het maken van tax equalization berekeningen en (complexe) payroll berekeningen;
In teamverband meewerken aan belastingadvies voor Nederlandse en buitenlandse ondernemingen ten aanzien van hun beloningsbeleid en fiscale procesbeheersing.
Deze vacature is echt iets voor jou, want jij
Hebt een afgeronde opleiding Fiscaal Recht en/of Fiscale Economie op minimaal HBO niveau;
Hebt 1 tot 4 jaar werkervaring met loonheffingen en het opstellen van aangiften inkomstenbelasting, opgedaan binnen een accountants- of advieskantoor of in het bedrijfsleven;
Wil graag werken in een inhoudelijk brede en gecombineerde nationale en internationale praktijk;
Beschikt over uitstekende spreek- en schrijfvaardigheden in de Nederlandse en Engelse taal;
Bent resultaatgericht, kwaliteit- en cliëntgericht, consciëntieus en een teamspeler;
Beschikt over sterke communicatieve en analytische vaardigheden en over een uitstekend cijfermatig inzicht.
Dit bieden we je
Een gevarieerde en uitdagende functie in een inspirerende en ‘top-notch’ omgeving;
Goede doorgroeimogelijkheden en een ruim aanbod aan interne trainingen en opleidingen;
Een hoge mate van autonomie;
Een sector die duurzaam is en continue in beweging;
Uitstekende primaire arbeidsvoorwaarden;
Een moderne werkomgeving, inclusief thuiswerkbeleid;
Een iPhone en een fietsregeling;
Een volle maand vakantiegeld en een feestdagenuitkering in december.
Wie zijn wij?
Loyens & Loeff is een onafhankelijke aanbieder van juridische diensten waar fiscalisten, advocaten en notarissen samenwerken aan geïntegreerde dienstverlening. Wij bedienen zowel grote als middelgrote, nationaal en internationaal opererende ondernemingen. Wereldwijd werken er 1500 medewerkers waarvan ruim 850 fiscalisten, advocaten en notarissen in onze thuismarkten (de Benelux en Zwitserland) en de belangrijke financiële centra in Europa, Azië en de Verenigde Staten. Wij onderhouden wereldwijd intensieve relaties met gerenommeerde internationale advocatenkantoren en belastingadvieskantoren.
Solliciteer op deze vacature in Amsterdam
Enthousiast geworden?
Reageer via de button ‘apply'. Neem bij inhoudelijke vragen contact op met Jan Bart Schober (partner) via: jan.bart.schober@loyensloeff.com of +31622122993
Vragen over het proces kun je stellen aan Elisabeth Visser (Campus Recruiter) via onderstaande gegevens.
Note: De integriteit van Loyens & Loeff als kantoor en van onze medewerkers is essentieel. Screening van onze medewerkers maakt daarom deel uit van de indiensttreding. De screening vindt plaats op basis van de rol die u gaat vervullen bij Loyens & Loeff. Afhankelijk van het functieniveau kan de screening bestaan uit een VOG. Uw arbeidsovereenkomst treedt pas in werking onder de opschortende voorwaarde dat de screening volledig en positief is afgerond. Neem contact op met de desbetreffende recruiter voor meer informatie over deze screening.
Share",https://media.glassdoor.com/sql/883482/loyens-and-loeff-squarelogo-1519305426396.png,Amsterdam,nan,Loyens & Loeff
Ervaren belastingadviseur,"Position
AKD is een full-service Benelux kantoor met ruim 500 advocaten, fiscalisten, notarissen en staf in Nederland, België en Luxemburg. Wij zijn voor onze cliënten de gateway in, van en naar de Benelux.

Voor ons kantoor in Amsterdam zijn wij op zoek naar een ervaren belastingadviseur.
Het werkterrein van de praktijkgroep Tax (bestaande uit ongeveer 25 fiscalisten) bestrijkt vrijwel alle belastingsoorten, met de nadruk op vennootschapsbelasting en de diverse daarmee samenhangende internationale fiscale regelingen. Een groot deel van onze cliënten is onderdeel van een internationaal operationeel concern met veelal grensoverschrijdende werkzaamheden. Daarnaast adviseren wij ook diverse Nederlandse familiebedrijven en hun aandeelhouders.
Als ervaren belastingadviseur bij AKD ga jij

je bezighouden met allround fiscale advisering, met de nadruk op vennootschapsbelasting/ dividendbelasting en de diverse internationale fiscale regelingen.
Je adviseert bij het opzetten van (inter)nationale structuren, reorganisaties, fusies en splitsingen. Je werkt samen met onze junior fiscalisten en partners en hebt hierin een trekkende rol waarin jij verantwoordelijk bent voor alle correspondentie met en advisering van cliënten.
Omdat we een brede praktijk hebben, zul je ook betrokken zijn bij de fiscale advisering van private clients, stichtingen en non-profit organisaties.
Bij je fiscale advisering schakel je met advocaten en notarissen binnen AKD om cliënten van een zo volledig mogelijk advies op maat te voorzien. Daarnaast ondersteun je als adviseur ook onze aangiftepraktijk, door middel van het reviewen van aangiftes en denk je mee welke aangifteposities in te nemen. Je zal regelmatig contact onderhouden met de Belastingdienst, zowel in het kader van de aanslagregeling en bezwaar/beroep als ook het verkrijgen van zekerheid vooraf door middel van rulings.
Op vaktechnisch vlak hou je de (inter)nationale ontwikkelingen in de gaten en zal je regelmatig nieuwe wetgeving presenteren in het vaktechnisch overleg.
Onze praktijk heeft een echte ondernemersmentaliteit en jouw initiatief op dit vlak wordt ook op prijs gesteld. Naast de uitstekende middelen om je op vaktechnisch vlak verder te ontwikkelen, bieden we ook andere mogelijkheden om je verder te ontwikkelen. Je zit bij AKD niet vast aan het stramien van ‘up or out’, omdat AKD talenten duurzaam aan zich wil binden. Uiteraard zijn er mogelijkheden om door te groeien naar de positie van counsel of partner.
Fiscale team
Je wordt onderdeel van ons kantoor in Amsterdam, waar naast onze btw- en loonbelasting-afdeling ongeveer 13 fiscale collega’s werken (waarvan 2 tax compliance managers, 4 (junior) belastingadviseurs, 1 transfer pricing specialist en 4 partners). De overige fiscale collega’s werken op onze andere kantoren in Nederland (Rotterdam en Eindhoven) en België en Luxemburg. Ons fiscale team werkt over de grenzen van de verschillende kantoren, waardoor je op verschillende dossiers zult werken met je collega fiscalisten in Amsterdam, Rotterdam en Eindhoven, België en Luxemburg.
Van AKD krijg jij

mooie uitdagende positie met ontwikkelmogelijkheid (doorgroeien naar counsel/partner)
een marktconform arbeidsvoorwaardenpakket, inclusief alle secundaire voorwaarden die je daarbij anno 2022 mag verwachten.
AKD is een ambitieuze organisatie, maar zorgt goed voor (de onderlinge binding tussen) haar medewerkers. Daarnaast ontvang je van ons een iPhone, laptop en een uitgebreid pakket aan thuiswerkmiddelen (o.a. zit-sta bureau en bureaustoel)
Job requirements
De ideale kandidaat voor deze positie

is in het bezit van een LLM Fiscale Economie of Fiscaal Recht;
heeft minimaal 3 – 6 jaar ervaring als belastingadviseur binnen een (gerenommeerd) advocatenkantoor of belastingadvieskantoor;
is in staat cliënten zelfstandig te bedienen;
heeft een passie voor de fiscaliteit;
heeft zich vaktechnisch ontwikkeld op een bepaald (internationaal) terrein binnen de fiscaliteit;
heeft een innemende, clientgerichte persoonlijkheid;
is toegankelijk, communicatief, ondernemend, betrokken en ambitieus;
beheerst de Nederlandse en Engelse taal uitstekende, in woord en geschrift.
Diversiteit en inclusiviteit

AKD is een omgeving waar je jezelf kunt zijn en het beste uit jezelf kunt halen. Wij zijn een kantoor dat ruimte biedt aan diversiteit en inclusiviteit en vinden het belangrijk om onze talenten te laten groeien.
AKD's centrale legal selectieproces

Meer informatie over ons centrale legal selectieproces vind je hier. Een selectieassessment maakt onderdeel uit van deze procedure.
Het overleggen van een Verklaring Omtrent Gedrag (op basis van het juridisch screeningsprofiel) maakt deel uit van de procedure.
Details
Amsterdam/Rotterdam, Netherlands
Tax",https://media.glassdoor.com/sql/1073804/akd-squarelogo-1450805846845.png,Amsterdam,nan,AKD
Werkstudent Tax,"Keen to become part of a truly global, collaborative team of professionals? Your journey begins here.
Waar ga je werken?
Hogan Lovells behoort tot de grootste internationale advocatenkantoren en heeft meer dan 47 kantoren in Afrika, Azië, Europa, Latijns Amerika, het Midden Oosten en de Verenigde Staten. Wereldwijd werken meer dan 2600 juristen bij Hogan Lovells waarvan circa 60 advocaten, (kandidaat-) notarissen, fiscalisten en paralegals in Amsterdam.
Hierdoor biedt Hogan Lovells Amsterdam “the best of both worlds”; het combineert een high quality global omgeving met de voordelen van een kantoor met een informele sfeer en korte lijnen. Wij voorzien onze cliënten van helder, praktisch en hoogwaardig advies door middel van een gezamenlijke aanpak. Wij ontwikkelen snel uitvoerbare en haalbare oplossingen voor de complexe uitdagingen waarmee onze cliënten worden geconfronteerd.
Innovation, Diversity & Inclusion en Responsible Business zijn belangrijke prioriteiten voor ons kantoor. Hogan Lovells behoort tot de top 5 van meest innovatieve advocatenkantoren in Noord-Amerika en Europa. Wij blijven ervoor zorgen dat de samenstelling van onze medewerkers een goede weerspiegeling is van de rijke diversiteit van onze cliënten en de maatschappij. Het doen van pro bono- en vrijwilligerswerk zit in het DNA van onze mensen. Op deze manier nemen we onze verantwoordelijkheid om iets terug te geven aan de maatschappij.
Onze mensen zijn de sleutel tot succes en daarom proberen wij in alle regio’s van onze wereldwijde praktijk de meest getalenteerde mensen aan te trekken en te behouden.
Wat kun je verwachten?
Als werkstudent ben je gedurende drie maanden circa twee dagen in de week onderdeel van onze Taks unit. De unit houdt zich bezig met zowel de advisering en begeleiding van transacties als algemene fiscale advisering van vaste relaties, waarbij zowel zelfstandig gewerkt wordt als in multidisciplinair verband, samen met andere business units. Het team begeleidt het nationale en internationale bedrijfsleven en heeft diepgaande kennis en ervaring op het gebied van o.a. internationale (her)structurering, M&A, securitisatie, financieringen en derivaten, het opzetten van beleggingsfondsen en werknemersparticipatievormen.
Je taken zijn breed en divers en bestaan onder andere uit het analyseren van fiscale vraagstukken, het opstellen van memo’s en concept adviezen, het assisteren bij fiscale compliance werkzaamheden, het voorbereiden van presentaties en aanverwante zaken. Daarnaast ben je uiteraard welkom bij al onze sociale activiteiten. Hierdoor komt alles aan bod tijdens je werkstudentschap waardoor je een goed beeld krijgt van hoe het is om onderdeel te zijn van Hogan Lovells.
Wie ben jij?
Je bent een intelligente en gemotiveerde student in de laatste fase van je studie fiscaal recht of fiscale economie;
Je neemt initiatief en beschikt over goede communicatieve en sociale vaardigheden;
Je hebt een sterk relativeringsvermogen en oog voor detail;
Je beheerst de Nederlandse en Engelse taal uitstekend in woord en geschrift.
Geïnteresseerd?
Indien je wilt solliciteren klik je op de ‘apply’ button. Nadat je een account hebt aangemaakt kan je je gegevens invullen en je stukken uploaden. We ontvangen graag je CV, motivatiebrief, cijferlijsten en eventuele (stage)beoordelingen.
Vergeet niet in je motivatiebrief te vermelden per wanneer je beschikbaar bent. Op dit moment hebben wij plek vanaf maart 2023.
Voor vragen kun je contact opnemen met onze recruiter Naomi Bunt via telefoonnummer 020-5533660 of per mail: amsterdam.recruitment@hoganlovells.com",https://media.glassdoor.com/sql/322733/hogan-lovells-squarelogo.png,Amsterdam,nan,Hogan Lovells
