job_titles,job_description,images,locations,salaries,companies
TAX MASTERCLASS 2023,"In het voorjaar van 2023 organiseert Loyens & Loeff een Tax Masterclass voor gemotiveerde studenten die een brug willen slaan tussen de studiestof en de praktijk. Tijdens je deelname aan deze twee bijeenkomsten, kun je samen met de aan Loyens & Loeff verbonden hoogleraren kennismaken met onze inhoudelijke fiscale praktijk. Je verdiept je in verschillende fiscale onderwerpen zodat je nét dat stapje extra kunt zetten op je tentamen.

Na deelname ontvang je een Loyens & Loeff Tax Masterclass certificaat.

WAAR: kantoor Amsterdam

WANNEER: 13 april en 15 juni 2023

WIE: derdejaars- en masterstudenten Fiscaal Recht en Fiscale Economie

Tijdens de Masterclass word je intellectueel uitgedaagd en klaargestoomd voor de praktijk. Er is ook voldoende mogelijkheid om kennis te maken met onze medewerkers en fiscale praktijkgroepen.

Dus studeer jij Fiscaal Recht of Fiscale Economie en ben je de gemotiveerde student die wij zoeken? Meld je dan vóór 3 april aan via de knop ‘apply’. Wij ontvangen graag jouw cv en cijferlijst(en).

Met vragen kun je terecht bij Elisabeth Visser (Campus Recruiter Tax) via elisabeth.visser@loyensloeff.com/ 020-5785321.
Share",https://media.glassdoor.com/sql/883482/loyens-and-loeff-squarelogo-1519305426396.png,Amsterdam,nan,Loyens & Loeff
"Studentstage (advocatuur, notarieel en fiscaal)","Position
Klaar om jouw kennis te toetsen in de praktijk? AKD heeft het hele jaar door op alle zes vestigingen plek voor student-stagiaires. Een student-stage bij ons is een mooie kans om kennis te maken met het werken binnen de advocatuur, het notariaat of de fiscale praktijk, en meer in het bijzonder om de dynamiek binnen een full service BeNeLuxkantoor met ruim 500 medewerkers te ervaren.

Wat zul je gaan ervaren als student-stagiaire?

Tijdens je stage leer je onder andere juridische memo’s schrijven, vraagstukken van onze cliënten te interpreteren, en je ervaart hoe we binnen AKD (multidisciplinair) met elkaar samenwerken. Je krijgt te maken met alles wat er speelt binnen jouw vakgroep van voorkeur en de vestiging waar je stage loopt.

Je wordt inhoudelijk en persoonlijk begeleid door één van onze studentstagecoördinatoren (met wie je ook op de kamer zit). Bij AKD werken vanuit vertrouwen en begrip in hechte teams en de deur staat altijd voor elkaar open. We lachen samen, vieren successen samen en steunen elkaar.
Vanaf dag één ben je onderdeel van AKD en bieden we jou de volledige experience: een uitgebreide onboarding, en iedere laatste vrijdag van de maand rouleert de afsluitende borrel per vestiging.

Tijdens je student-stage bij AKD draai je twee maanden fulltime mee in onze dagelijkse praktijk. Je ontvangt een bruto vergoeding van €850 per maand.
Job requirements
Voor wie is een studentstage bij AKD?

Zit jij in de afrondende fase van je bachelor Rechtsgeleerdheid, bachelor Notarieel recht of bachelor Fiscaal recht / Fiscale economie of ben je gestart met een juridische master (WO), en wil je gaan onderzoeken of de advocatuur, het notariaat of de fiscale praktijk iets voor jou is? Leg je – net als alle AKD’ers – de lat hoog voor jezelf? Dan maken we graag kennis met jou! Overigens kun je ook binnen drie maanden nadat je bent afgestudeerd nog stage lopen bij ons.

Wil je een studentstage bij AKD komen lopen?
Vul onderstaande gegevens in en geef daarbij ook aan welke vakgroep(en) jouw voorkeur heeft. De motivatie hiervoor zien wij graag terug in jouw brief en ook de periode waarin jij de stage zou willen plannen. We zien jouw sollicitatie met plezier tegemoet!
Na een papieren selectie volgt één sollicitatiegesprek met onze Campus Recruiter en een studentstagecoördinator. Verder maakt een uitgebreide pre-employmentscreening onderdeel uit van onze (selectie)procedure.
AKD Benelux Lawyers schenkt aandacht aan het versterken van Diversity, Equality and Inclusion (DEI). Iedereen mag bij ons zichzelf zijn en wij schenken aandacht aan ieders talent.
Details
All offices, Netherlands
€850 per month
Legal, Student",https://media.glassdoor.com/sql/1073804/akd-squarelogo-1450805846845.png,Netherlands,nan,AKD
Junior Belastingadviseur,"Position
Voor ons fiscale team in Amsterdam/Rotterdam zijn wij op zoek naar een junior belastingadviseur (0-3 jaar ervaring) voor de internationale fiscale praktijk.


AKD is een full-service Benelux kantoor met ruim 500 advocaten, fiscalisten, notarissen en staf in Nederland, België en Luxemburg. Wij zijn voor onze cliënten de gateway in, van en naar de Benelux. Je wordt in deze functie onderdeel van ons fiscale team met standplaats Amsterdam of Rotterdam, maar ons fiscale team werkt juist over de grenzen van de verschillende kantoren, waardoor je op dossiers zal werken met andere fiscalisten op onze kantoren in Amsterdam, Rotterdam, Eindhoven (en soms ook België en Luxemburg).

Het werkterrein van de praktijkgroep Tax (bestaande uit ongeveer 25 fiscalisten) bestrijkt vrijwel alle belastingsoorten, met de nadruk op vennootschapsbelasting en de diverse daarmee samenhangende internationale fiscale regelingen. Een groot deel van onze cliënten is onderdeel van een internationaal operationeel concern met veelal grensoverschrijdende werkzaamheden. Daarnaast adviseren wij ook diverse Nederlandse familiebedrijven en hun aandeelhouders.
Als (junior) belastingadviseur ga jij

je bezighouden met allround advisering, met de nadruk op vennootschapsbelasting, waaronder het opzetten van (inter)nationale structuren, reorganisaties, fusies en splitsingen en dividendbelasting. Dit doe je samen met senior fiscalisten en partners.
Je begint direct aan je -Nederlandse Orde van Belastingadviseurs-opleiding en onze fiscalisten ondersteunen en stimuleren jou met als doel om zoveel mogelijk ervaring op te doen en jouw leercurve zo steil mogelijk te houden. Naarmate je meer ervaring opdoet, zul je ook meer verantwoordelijkheden krijgen totdat jij volledig zelfstandig cliënten kunt adviseren.
Omdat we een brede praktijk hebben, ben je soms ook betrokken bij de fiscale advisering van private clients, stichtingen of non-profit organisaties. Veelal heeft een advies ook niet-fiscale elementen in zich, waardoor je zal schakelen met advocaten en notarissen binnen AKD om cliënten van een zo volledig mogelijk advies op maat te voorzien.
Daarnaast ondersteun je als adviseur ook onze aangiftepraktijk en zul je regelmatig contact hebben met de Belastingdienst, zowel in het kader van de aanslagregeling en bezwaar/beroep als ook in verband met het verkrijgen van zekerheid vooraf door middel van een ruling.

Je wordt onderdeel van ons fiscale team met standplaats Amsterdam of Rotterdam, maar ons fiscale team werkt juist over de grenzen van de verschillende kantoren, waardoor je op dossiers zult werken met andere fiscalisten op onze kantoren in Amsterdam, Rotterdam, Eindhoven (en soms ook België en Luxemburg).
Van AKD krijg jij

dus écht een mooie baan in een energieke omgeving met leuke collega’s en met mooie ontwikkelmogelijkheden. Je gaat de NOB -opleiding volgen waarbij je in korte tijd een expert zal worden op jouw gebied. Daarnaast ontvang je een marktconform salaris mét goede secundaire arbeidsvoorwaarden. Ook ontvang je van ons een iPhone, laptop en een uitgebreid pakket aan thuiswerkmiddelen (o.a. zit-sta bureau en bureaustoel)
AKD is een ambitieuze organisatie, maar zorgt goed voor (de onderlinge binding tussen) haar medewerkers.
Job requirements
De ideale kandidaat voor deze positie

is afgestudeerd in de richting fiscaal recht of fiscale economie met goede studieresultaten;
heeft bij voorkeur al enige praktijkervaring opgedaan binnen een (gerenommeerd) advocatenkantoor of belastingadvieskantoor, in de vorm van bijvoorbeeld stages, bijbanen en/of full-time werk (0-3 jaar ervaring);
heeft een innemende, cliëntgerichte persoonlijkheid;
beschikt over een frisse blik en bent toegankelijk, energiek, betrokken en ambitieus;
beheerst de Nederlandse en Engelse taal uitstekend, in woord en geschrift;
is accuraat en beschikt over een goed analytisch vermogen.

Diversiteit en inclusiviteit

AKD is een omgeving waar je jezelf kunt zijn en het beste uit jezelf kunt halen. Wij zijn een kantoor dat ruimte biedt aan diversiteit en inclusiviteit en vinden het belangrijk om onze talenten te laten groeien.
AKD's centrale legal selectieproces

Meer informatie over ons centrale legal selectieproces vind je hier. Een selectieassessment maakt onderdeel uit van deze procedure.
Het overleggen van een Verklaring Omtrent Gedrag (op basis van het juridisch screeningsprofiel) maakt deel uit van de procedure.
Details
Amsterdam/Rotterdam, Netherlands
Tax",https://media.glassdoor.com/sql/1073804/akd-squarelogo-1450805846845.png,Amsterdam,nan,AKD
Werkstudent Tax Knowledge Centre 2023,"Ben jij (bijna) begonnen met je master Fiscaal Recht en/of Fiscale Economie en ben jij op zoek naar een uitdagende bijbaan waarin jij kennis maakt met de werkzaamheden van het Tax Knowledge Centre? Solliciteer dan nu!
Voor ons Tax Knowledge Centre in Amsterdam zoeken wij werkstudenten voor twee of drie dagen per week gedurende een periode van minimaal drie maanden.
Het TKC bestaat hoofdzakelijk uit hoogleraren en universiteitsdocenten alsmede medewerkers met een achtergrond in de fiscale adviespraktijk. De werkzaamheden van het TKC bestaan, naast uiteraard het ontsluiten van kennis, onder meer uit het informeren van de belastingadviseurs over nationale en internationale fiscale ontwikkelingen, bijvoorbeeld in de vorm van interne memo’s of presentaties, en het fungeren als klankbord voor vaktechnische kwesties die opkomen binnen de fiscale praktijk.
Als werkstudent bij het TKC zul je bij al deze werkzaamheden betrokken worden en bestaat er de mogelijkheid om mee te schrijven aan artikelen voor de fiscale vakliteratuur. Daarnaast zal je ook aansluiten bij de (vaktechnische) vergaderingen van één van onze fiscale praktijkgroepen, zodat je ook ervaart wat het werken als belastingadviseur bij Loyens & Loeff inhoudt en collega’s buiten het TKC leert kennen.
Deze vacature is echt iets voor jou, want jij
Bent (bijna) begonnen aan je master Fiscaal Recht en/of Fiscale Economie.
Beschikt over uitstekende spreek- en schrijfvaardigheden in de Nederlandse en Engelse taal.
Beschikt over zeer sterke analytische vaardigheden en over een uitstekend cijfermatig inzicht.
Bent in staat om zelfstandig te werken, pro-actief en een teamplayer.
Vindt het leuk om in nationale en internationale fiscale wetgeving te duiken en complexe vraagstukken uit te zoeken.
Dit bieden wij jou naast het werkstudentschap,
Een mentor, die jou gedurende je werkstudentschap begeleidt.
Een moderne, informele en internationale werkomgeving.
Wie zijn wij?
Loyens & Loeff is een onafhankelijke aanbieder van juridische diensten waar fiscalisten, advocaten en notarissen samenwerken aan geïntegreerde dienstverlening op het gebied van recht in de Benelux en Zwitserland. Zowel grote en middelgrote, nationaal en internationaal opererende ondernemingen als particulieren worden op juridisch gebied ondersteund. Wereldwijd werken er 1500 medewerkers waarvan ruim 850 fiscalisten, advocaten en notarissen in 6 kantoren in de thuismarkt en in 8 vestigingen in de belangrijkste financiële centra in Europa, Azië en de Verenigde Staten.
Solliciteer op deze vacature in Amsterdam
Ben jij de ambitieuze student die wij zoeken? Solliciteer dan nu via de 'Apply'-button. Vragen over het proces of wil je meer weten over de vacature? Neem dan contact op met Elisabeth Visser (Recruiter) via onderstaande gegevens. Voor inhoudelijke vragen kun je terecht bij Liesbeth Hendrix (TKC Tax Adviser: liesbeth.hendrix@loyensloeff.com).
Share",https://media.glassdoor.com/sql/883482/loyens-and-loeff-squarelogo-1519305426396.png,Amsterdam,nan,Loyens & Loeff
Junior Employment Tax Adviser,"Voor ons Employment & Benefits team zoeken wij junior belastingadviseurs met interesse in loonheffingen. Wil jij de mooiste bedrijven van Nederland en ver daarbuiten adviseren over alle fiscale zaken die hun personeel raken? Solliciteer dan nu!
Als beginnende Employment Tax Adviser werk je enerzijds aan inhoudelijk complexe vraagstukken binnen onze fiscale praktijk, anderzijds verruim je je blikveld door samen te werken met onze advocaten en notarissen. Tezamen met onze uitstekende opleidingsmogelijkheden en informele werksfeer biedt Loyens & Loeff je de beste basis voor je fiscale carrière.
Dit ga je doen als Employment Tax Adviser
Je helpt cliënten door het opstellen van fiscale adviezen;
Je schrijft verzoek- en bezwaarschriften aan de Belastingdienst;
Je werkt samen met fiscalisten en advocaten aan uitdagende transacties;
Je bent al snel het aanspreekpunt voor (inter-)nationale cliënten op de dossiers waar jij verantwoordelijkheid voor draagt.
Deze vacature is echt iets voor jou, want jij
Hebt affiniteit met fiscale vraagstukken die mensen direct raken;
Hebt een afgeronde master Fiscaal Recht en/of Fiscale Economie;
Werkt graag in een team;
Bent proactief en ondernemend;
Bent resultaat- en kwaliteitsgericht.
Hier ga je werken als Employment Tax Adviser
Als Employment Tax Adviser maak je deel uit van het loonheffingen team van de afdeling Employment & Benefits. Dit team houdt zich bezig met het volledige terrein van de loonbelasting en premieheffingskant van de sociale zekerheid ten aanzien van het management en de werknemers van multinationals en het grotere Nederlandse bedrijfsleven. Het team werkt nauw samen met andere fiscale praktijkgroepen en advocaten aan bijvoorbeeld fusies en overnames, reorganisaties en aandelenparticipaties door management of werknemers. Daarnaast adviseert het team cliënten op een doorlopende basis over loonbelastingvraagstukken op een hoogstaand niveau. Wij maken daarbij geen onderscheid tussen de nationale en de internationale praktijk, waardoor je werk zeer gevarieerd is en je je breed kan ontwikkelen.
Loyens & Loeff is een van origine Nederlands kantoor met de grootste full service praktijk van Nederland. Je maakt deel uit van een collegiaal team van fiscalisten waarin intensief wordt samengewerkt. Je wordt omringd door een groot aantal professionals in een dynamische werkomgeving waar jouw werk geen dag hetzelfde is.
Dit bieden we je
Een moderne, informele en internationale werkomgeving;
Een ruim aanbod aan interne trainingen en opleidingen;
Goede doorgroeimogelijkheden;
Een volle maand vakantiegeld en een feestdagenuitkering in december;
Een iPhone, een fietsregeling en een auto leaseregeling;
Uitstekende extra’s, zoals korting op een sportschool abonnement;
Onze vestigingen zijn goed bereikbaar met het OV.
Wie zijn wij?
Loyens & Loeff is een onafhankelijke aanbieder van juridische diensten waar fiscalisten, advocaten en notarissen samenwerken aan geïntegreerde dienstverlening op het gebied van recht in de Benelux en Zwitserland. Zowel grote en middelgrote, nationaal en internationaal opererende ondernemingen als particulieren worden op juridisch gebied ondersteund. Wereldwijd werken er 1650 medewerkers waarvan ruim 850 fiscalisten, advocaten en notarissen in 6 kantoren in de thuismarkt en in 8 vestigingen in de belangrijkste financiële centra in Europa, Azië en de Verenigde Staten.
Solliciteer op deze Employment Tax Adviser vacature
Enthousiast geworden? Reageer via de button ‘apply'. Vragen over het sollicitatieproces of wil je meer weten over de vacature? Neem dan contact op met Elisabeth Visser (Recruiter) via onderstaande gegevens.
Neem bij inhoudelijke vragen contact op met Jan Bart Schober (Partner) via: jan.bart.schober@loyensloeff.com of +31622122993.
Share",https://media.glassdoor.com/sql/883482/loyens-and-loeff-squarelogo-1519305426396.png,Amsterdam,nan,Loyens & Loeff
Starter - Tax Compliance Adviser,"We zijn voor diverse fiscale praktijkgroepen op zoek naar Tax Compliance Advisers met 0-3 jaar ervaring. Ben jij toe aan de eerste stap in je carrière en ben jij een ambitieuze en enthousiaste student? Lees dan verder!
Als Tax Compliance Adviser bij Loyens & Loeff bestaat je werk uit een unieke mix van aangifte- en advieswerkzaamheden. Je werkt nauw samen met de Tax Advisers aan uitdagende zaken. Het team is zeer gedreven en de verkregen kennis wordt actief en enthousiast met elkaar en de cliënten gedeeld. Je krijgt de ruimte om zelfstandig te werken met een goede balans tussen werk en privé.
De functie
Opstellen van aangiften vennootschapsbelasting voor o.a. grote fiscale eenheden en fondsstructuren, alsmede het verzorgen van de rapportage over de ingenomen standpunten en de daarmee gemoeide risico’s.
Opstellen en beoordelen van de overzichten bij de aangifte vennootschapsbelasting, zoals latentieberekeningen, verloop acute en latente vennootschapsbelasting, aansluiting belastbare grondslag in de jaarrekening met het belastbaar bedrag in de aangifte.
Opstellen en beoordelen van vennootschapsbelasting posities ten behoeve van de jaarrekening, zoals latenties berekenen, acute vennootschapsbelasting bepalen, effectieve belastingdruk berekenen, vereiste documentatie en toelichtingen in de jaarrekening verzorgen.
Assisteren bij de fiscale advisering aan en de implementatie van het advies bij cliënten.
Eerste aanspreekpunt voor onze cliënten voor alle tax compliance werkzaamheden.
Begeleiden van cliënten bij het opzetten van een tax control framework.
Het ondersteunen van cliënten in het kader van transfer pricing en andere documentatieverplichtingen.
Deze vacature is echt iets voor jou, want jij
Hebt een (bijna) afgeronde hbo opleiding Fiscaal Recht en Economie/Finance Tax & Advice of een afgeronde wo bachelor fiscale economie;
Hebt een gedegen kennis van het fiscale recht, aangevuld met kennis van de verschillende verslaggevingsregels;
Wilt excelleren in je vak en je graag verder ontwikkelen;
Bent nauwkeurig, ambitieus, resultaatgericht, analytisch sterk en hebt een goed cijfermatig inzicht;
Beschikt over uitstekende spreek- en schrijfvaardigheden in de Nederlandse en Engelse taal;
Wil graag in hetzelfde team zitten als je collega-adviseurs en deelnemen aan dezelfde vaktechnische overleggen om je fiscale kennis helemaal bij de tijd te houden.
Hier ga je werken als Tax Compliance Adviser
Loyens & Loeff is een onafhankelijke aanbieder van juridische diensten waar fiscalisten, advocaten en notarissen samenwerken aan geïntegreerde dienstverlening op het gebied van recht in de Benelux en Zwitserland. Zowel grote en middelgrote, nationaal en internationaal opererende ondernemingen als particulieren worden op juridisch gebied ondersteund. Wereldwijd werken er 1500 medewerkers waarvan ruim 850 fiscalisten, advocaten en notarissen in 6 kantoren in de thuismarkten en in 8 vestigingen in de belangrijkste financiële centra in Europa, Azië en de Verenigde Staten. Loyens & Loeff is een kantoor met de grootste full service praktijk van Nederland.
In afwijking van de andere advocatenkantoren, heeft Loyens & Loeff een zeer brede fiscale praktijk, met veel specialisten op alle fiscale gebieden. Dit betekent dat ruim 40% van onze professionals werkzaam zijn als fiscalist. Je werkt nauw samen met de fiscale adviseurs, advocatuur en notariële praktijk voor cliënten die behoren tot de top van het bedrijfsleven. Je bent omringd door een groot aantal gedreven professionals in een dynamische werkomgeving waar jouw werk geen dag hetzelfde is.
Als Tax Compliance Adviser kom je te werken binnen een van onze praktijkgroepen:
ITS Americas;
Employment & Benefits;
Family Owned Business &; Private Wealth;
Indirect Tax;
Investment Management;
Multinationals;
Transactional Tax;
Transfer Pricing.
Wat bieden wij?
Een prachtige mogelijkheid om je verder te ontwikkelen bij een toonaangevend internationaal belastingadvieskantoor, op een fantastische werk locatie in Amsterdam en Rotterdam met een sterke identiteit, collegiale sfeer en een uitstekend arbeidsvoorwaardenpakket. Een gezonde work-life balance en zelfontplooiing wordt bij ons erg belangrijk gevonden en ambitieuze doelstellingen worden aangemoedigd.
Onze Tax Compliance Advisers zijn een integraal onderdeel van dezelfde praktijkgroep als de andere fiscale adviseurs, dus ook voor jou is er geen afstand tussen de fiscale advies- en aangiftewerkzaamheden.

Naast de werkzaamheden is er daarom ruimte om je te ontwikkelen door het volgen van verschillende interne opleidingen en cursussen, eventueel aangevuld met externe opleidingen, vanzelfsprekend mede afhankelijk van je ervaring en interesse.
Solliciteren op deze vacature?
Enthousiast geworden? Neem bij vragen gerust contact op met Elisabeth (Recruiter) via onderstaande gegevens.
Share",https://media.glassdoor.com/sql/883482/loyens-and-loeff-squarelogo-1519305426396.png,Amsterdam,nan,Loyens & Loeff
Starter - Indirect Tax Compliance Adviser,"Wil je werken in een unieke functie waarin de aangifte- en adviespraktijk worden gecombineerd? Wil jij werken voor de mooiste bedrijven van Nederland? Solliciteer dan nu!
Dit ga je doen als Starter - Indirect Tax Compliance Adviser:
Opstellen van (complexe) btw-aangiften en de bijbehorende EC Sales Listings.
Opstellen en indienen van Intrastat rapportages.
Adviseren van cliënten over de btw-aangifteverplichtingen.
Signaleren van fiscale aandachtspunten en in teamverband meewerken aan belastingadvies voor bedrijven.
Contact onderhouden met onze cliënten en de Belastingdienst.
Deze vacature is echt iets voor jou, want jij
Hebt een (bijna) afgeronde hbo opleiding Fiscaal Recht en Economie/Finance Tax & Advice of een afgeronde wo bachelor fiscale economie of fiscaal recht.
Hebt affiniteit met btw.
Hebt plezier in het werken met cijfers en het leggen van verbanden.
Werkt graag in een team.
Bent proactief en ondernemend.
Bent resultaatgericht, kwaliteit- en cliëntgericht en consciëntieus.
Hier ga je werken als Indirect Tax Compliance Adviser
Als Indirect Tax Compliance Adviser maak je deel uit van de afdeling Indirect Tax. Deze afdeling bestaat uit ongeveer 40 medewerkers en maakt onderdeel uit van een team van zo’n 350 fiscalisten. Je werkt intensief samen met de Indirect Tax adviseurs. Vanwege de sterke groei van onze afdeling Indirect Tax zijn we op zoek naar een Indirect Tax Compliance Adviser.
Loyens & Loeff is een van origine Nederlands kantoor met de grootste full service praktijk van Nederland. Je maakt deel uit van een collegiaal team van fiscalisten waarin intensief wordt samengewerkt. Je bent omringd door een groot aantal professionals in een dynamische werkomgeving waar jouw werk geen dag hetzelfde is.
Wat bieden wij jou?
Een moderne, informele en internationale werkomgeving.
Goede doorgroeimogelijkheden en een ruim aanbod aan interne trainingen en opleidingen.
Een volle maand vakantiegeld en een feestdagenuitkering in december.
Een iPhone, een fietsregeling en een auto leaseregeling.
Uitstekende extra’s zoals: korting op een sportschool abonnement en gratis fruit op het werk.
Onze vestigingen zijn goed bereikbaar met het OV.
Wie zijn wij?
Loyens & Loeff is een onafhankelijke aanbieder van juridische diensten in de Benelux en Zwitserland. Fiscalisten, advocaten en notarissen werken naadloos samen en bieden geïntegreerde dienstverlening aan zowel grote en middelgrote, nationaal en internationaal opererende ondernemingen als aan particulieren. Wereldwijd werken ruim 850 fiscalisten, advocaten en notarissen) en ongeveer 750 medewerkers op zes kantoren in onze thuismarkten: Nederland, België, Luxemburg en Zwitserland. Ook heeft Loyens & Loeff acht vestigingen in de belangrijke financiële centra in Europa, Azië en de Verenigde Staten.
Solliciteer op deze vacature in Amsterdam
Enthousiast geworden?
Reageer via de button ‘apply'. Vragen over het proces? Neem dan contact op met Elisabeth Visser (Recruiter) via onderstaande gegevens.
Inhoudelijke vragen? Neem dan contact op met Marianne de Graaf: +3120 578 5026 of marianne.de.graaf@loyensloeff.com.
Share",https://media.glassdoor.com/sql/883482/loyens-and-loeff-squarelogo-1519305426396.png,Amsterdam,nan,Loyens & Loeff
