job_titles,job_description,images,locations,salaries,companies
Scientist host-microbe interacties Leiden 32-40u,"Over deze vacature
Innovatie op het vlak van gezondheid start bij een goede samenwerking. Tussen overheden, bedrijven, universiteiten en andere onderzoeksinstituten bijvoorbeeld. Dit is dé tijd om samen veilige, duurzame, gezonde en digitale oplossingen te ontwikkelen voor de maatschappij van de toekomst. En als Scientist host-microbe interacties draag jij hieraan bij.
Wat ga je doen?
Als Scientist host-microbe interacties ga je aan de slag binnen de unit Healthy Living & Work, in de Researchgroep Microbiologie & Systeem Biologie (MSB). Je werkt vooral vanuit het team Microbiologie aan projecten rondom het thema ‘microbiologie en humane gezondheid”. Je zal daarbij een belangrijke bijdrage leveren aan studies naar gezondheid van de luchtwegen, mond en keelholte of de huid door het beter begrijpen van interacties tussen het microbioom en de humane gastheer. Hierbij creëren we innovaties voor onze partners op gebied van preventie en genezing van infectie ziekten, allergieën en ander aandoeningen.

Samen met collega’s en partners buiten TNO ontwikkel je nieuwe kennis en innovaties zoals geavanceerde ‘host-microbiome’ laboratorium modellen en innovatieve strategieën om door middel van microbioom modulatie gezondheid te bevorderen.

Als Scientist host-microbe interacties werk je samen met collega’s in projectteams aan verschillende onderzoeksvragen. Naast het doen van onderzoek schrijf je mee aan projectvoorstellen, offertes, rapportages en je schrijft (wetenschappelijk) publicaties over het onderzoek. Ook presenteer je je werk op wetenschappelijke congressen, bij klanten of bij andere stakeholders. Zo draag je bij aan een succesvol verloop van innovatie- en samenwerkingsprojecten.
Wat wij van jou verwachten
Je bent een wetenschapper in hart en nieren en gedreven om nieuwe kennis en inzichten toepasbaar te maken en te vertalen naar de praktijk. Je hebt een interesse in microbiologie en gezondheid en wilt bijdragen aan een betere gezondheid voor iedereen. Je voelt je thuis in multidisciplinaire teams waarin je samenwerkt met experts uit verschillende disciplines. Je bent pro-actief en nieuwsgierig ingesteld. Verder kan je voor divers publiek vertellen over je onderzoek.

Wat je nog meer in huis hebt?
Je hebt 2-5 jaar ervaring in multidisciplinair onderzoek naar microbiologie en gezondheid.
Je hebt ervaring met het opzetten of gebruiken van ‘host-microbiome’ laboratorium modellen.
Je hebt een wo-diploma of PhD in een relevante richting, zoals biologie, geneeskunde, life sciences of biomedische wetenschappen.
Je hebt affiniteit met het thema microbiologie en gezond leven.
Je hebt een goede beheersing van Nederlands en Engels.
Wat wij jou bieden
Uitdagend én afwisselend werk met serieuze impact. En volop kansen, want bij TNO heb je grotendeels zelf de regie over je carrière. Naast een bruto (fulltime) maandsalaris tussen € 4.500,- en € 6.000,- (afhankelijk van je kennis en ervaring), vakantiegeld (8%), een dertiende maand (8,33%) en een flexbudget (5,58% + €180), krijg je alle mogelijkheden om jezelf te ontwikkelen.

Daarnaast kun je bij TNO een ‘menu’ aan arbeidsvoorwaarden samenstellen dat bij jouw persoonlijke situatie past. Wat je ook mag verwachten:
Een uiterst professionele, innovatieve werkomgeving, met topexperts als collega’s.
Mogelijkheid om cursussen, opleidingen en workshops te volgen en congressen te bezoeken, en coaching als je daar behoefte aan hebt.
33 vakantiedagen (bij een fulltime dienstverband).
Een werkgever die divers talent waardeert en stimuleert, met initiatieven als het Female Leadership Programma, onze Rainbow Community en round tables over inclusiethema’s.
Een uitgebreide en flexibele mobiliteitsregeling, inclusief volledige vergoeding van openbaar vervoer voor woon-werk en zakelijke reizen [OPTIONEEL] of een leaseauto.
Gezellige activiteiten met je team en andere TNO'ers. Zo leer je snel veel mensen kennen.
Flexibele werktijden, de mogelijkheid om parttime (32 of 36 uur) te werken en de mogelijkheid om thuis te werken.
Een goede pensioenregeling.
Lees hier uit welke arbeidsvoorwaarden je verder kunt kiezen.
TNO als werkgever
Bij TNO innoveren we voor een gezonder, veiliger en duurzamer leven. En voor een sterke economie. Sinds 1932 ontwikkelen wij kennis en technologie voor het algemeen belang. We vinden elkaar in verwondering en vindingrijkheid, en we zijn gedreven om grenzen te verleggen. Voor jouw talent en ambitie is er alle ruimte en ondersteuning. Je werkt samen met mensen die aan je gewaagd zijn, die jou inspireren én van jou willen leren. Onze state-of-the-art-faciliteiten zijn er om jouw visie te verwezenlijken. Wat je bij TNO doet, doet ertoe: impact maakt het verschil. Want met elke innovatie draag je bij aan het leven van morgen. Lees meer over TNO als werkgever.

Bij TNO stimuleren we een inclusieve werkomgeving, waar jij jezelf kunt zijn. Wat je verhaal ook is en welke unieke eigenschappen je ook meebrengt. Juist door onze unieke krachten en perspectieven te bundelen zijn we in staat om innovaties te ontwikkelen die een wezenlijk verschil maken in de samenleving. Meer weten? Lees welke stappen wij zetten op het gebied van diversiteit en inclusie.
Hoe ziet het proces eruit?
Reageren kan tot en met 30 april 2023. De sollicitatieprocedure bestaat uit twee gespreksrondes. Het eerste gesprek zal op 9 of 11 mei zijn. Het tweede gesprek is op 22 of 25 mei. In een laatste gesprek bespreken we de arbeidsvoorwaarden die je zelf samenstelt. We streven ernaar de hele procedure binnen vier weken af te ronden.

Als je bij ons komt werken vragen wij je ook een Verklaring Omtrent het Gedrag (VOG) te overleggen.",https://media.glassdoor.com/sql/257744/tno-squareLogo-1680252396978.png,Leiden,€5K - €6K (Employer est.),TNO
Senior healthcare adviseur (7+ jaar) voor high-end boutique,"Duurzaam realiseren van doorbraken en prestatieverbeteringen in de zorg én een reeds succesvolle zorgpractice uitbouwen? Specialist in strategie-executie biedt een mooie opportunity voor ondernemende healthcare adviseur: sterke merknaam, de juiste recources en een groeiend team. Over de opdrachtgever
Dit adviesbureau onderscheidt zich als specialist in strategie-executie met zijn toonaangevende trackrecord bij middelgrote en beursgenoteerde ondernemingen. Hun missie: het duurzaam realiseren van maatschappelijke, financiële en operationele prestatieverbeteringen van organisaties met grote aandacht voor de mensen die er werken. Het advies levert nooit enkel een rapport op, maar ook realisatie van gewenste doorbraken en altijd concreet resultaat.
De circa 60 adviseurs zijn stuk voor stuk thought leaders in strategie-executie, digital commercial excellence, operational excellence, synergy excellence of organizational excellence. Kenmerkend is hun inhoudelijke scherpte, business sense en sterk ontwikkelde vaardigheden. Stuk voor stuk analytische denkers, die worden gewaardeerd om hun gevoel, energie en betrokkenheid. De gedeelde visie: resultaat voor alle stakeholders is alleen duurzaam door inhoudelijke oplossingen en impactvol verandermanagement. Hun dedicated focus resulteert in een sterk merk en hoge klantevaluaties.
Het bureau is een gevestigde naam binnen de zorg, maar ook binnen de financiële dienstverlening, onderwijs, professionele dienstverlening en media. Vrijheid en aandacht voor persoonlijke- en professionele ontwikkeling zijn vanzelfsprekend. Net als volop ruimte voor ondernemerschap en uitzicht op partnerschap, dat heb je hier dan ook meer in de hand dan bij grote bureaus.
Over de functie
Als senior healthcare adviseur ben je medeverantwoordelijk voor het verder uitbouwen van de bestaande propositie binnen de zorg, zowel cure als care. Mooie kans voor een ondernemende adviseur om als meewerkend voorman(/vrouw) van de practice lead een stempel te drukken op de ontwikkeling van een adviesbureau in een sfeer van vrijheid en ondernemerschap.
Je werkt aan complexe strategie-executietrajecten op het snijvlak van strategie en organisatie, processen, mens en ICT en je bent sparringpartner van directie en raad van bestuur. Je begeleidt bestuurders binnen de zorg in het effectief en efficiënt toewerken naar resultaten in hun veranderprogramma’s en –projecten. Je realiseert gewenste doorbraken met een scherpe focus op executie. Hierin ben jij een trusted advisor van je opdrachtgever en ontwikkel en onderhoud je duurzame relaties.
Verschillende actuele thema’s vormen de rode draad van de projecten waaraan je werkt, denk hierbij aan waardegedreven zorg, health intelligence en de juiste zorg op de juiste plaats. Hierin worden verscheidene uitdagingen gevat, van capaciteit tot OK-logistiek en patiëntdifferentiatie. Binnen elke opdracht krijg jij zowel bestuurders en manager als medische professionals in beweging. Niet alleen vanuit de inhoud en je vaardigheden, juist ook door jouw persoonlijkheid en de juiste balans tussen hoofd en hart.
Belangrijkste criteria
Je hebt circa 7 jaar ervaring, waarvan minimaal 4-5 jaar als extern (strategisch of bedrijfskundig) adviseur bij een gerenommeerd adviesbureau. Een combinatie met een geneeskunde-opleiding is een pre.
Je hebt een actief en relevant netwerk binnen het Nederlands zorglandschap en kent de dynamieken van deze sector door en door.
Je bent inhoudelijk en analytisch sterk (zowel kwantitatief als kwalitatief) en werkt multidisciplinair.
Je creëert verandering en draagvlak op alle organisatieniveaus.
Reden van de vacature
Wegens groei door succes is extra mankracht zeer welkom.
De procedure
Na een gesprek bij Badenoch + Clark volgen er drie bij deze opdrachtgever. Een business case maakt onderdeel uit van de procedure.
Contact
Ben je een ervaren adviseur mét de ambitie om een eigen consultancy-tak op te zetten en herken je jezelf in de visie van deze opdrachtgever? Mail je cv en korte motivatie naar Merel Fennema (merel.fennema@badenochandclark.nl). Of solliciteer op onze website.
#healthcare",https://media.glassdoor.com/sql/14964/lee-hecht-harrison-squarelogo-1579682548778.png,Amersfoort,nan,Badenoch & Clark
Sales Development Manager (m/v/x),"Sales Development Manager (m/v/x)
medisch mBCA, België en Nederland
Wil jij voor Nederland en België als Accountmanager van een wereldmarktleider verantwoordelijk zijn voor de verkoop van medische producten en de totstandkoming van innovaties bevorderen? Dan zit je hier precies goed!

seca is wereldmarktleider in medische meetsystemen en weegschalen, waar kwaliteit, innovatie en betrouwbaarheid van het grootste belang zijn. Met name de kunst van de medische precisie ""made in Germany"", die seca al meer dan 180 jaar onderscheidt, wordt door onze klanten in meer dan 110 landen gewaardeerd.

Een deel van de innovaties van seca is medische lichaamssamenstellingsanalyse (mBCA). Onze mBCA-meetapparaten kunnen binnen enkele seconden de lichaamssamenstelling berekenen, uitgesplitst naar waterpercentage, spiermassa en lichaamsvet voor de romp en ledematen. Naast belangrijke informatie en gegevens voor het bepalen van de persoonlijke voedingsstatus, bieden onze apparaten ook de mogelijkheid om succes en voortgang te volgen en zo een indicator te worden voor preventie en therapie voor artsen, fysiotherapeuten of voedingsdeskundigen.

Voor de operationele ontwikkeling en vergroting van ons verkoopgebied Nederland en België zijn wij op zoek naar een toegewijde

Sales Development Manager, mBCA medisch (m/v/x)

Jouw specifieke taken:
Via een gestructureerd trainingsprogramma leiden we je op tot specialist in gevalideerde lichaamssamenstellingsmeting (BIA) en het gebruik ervan in de medische omgeving.
Je bent dan grotendeels verantwoordelijk voor de ontwikkeling en inrichting van de medische verkoopmarkt voor mBCA-meetapparatuur in België en Nederland en neemt de volledige verkoopverantwoordelijkheid op je.
Als voorstander van medische BIA-meettechnologie bouw je verkoopnetwerken op en zoek je geschikte verkoopkanalen
Je gebruikt professionele digitale apparatuur voor onlinepresentaties, live webinars en de productie van YouTube-content om je potentiële klanten effectief te adviseren
Vanaf het eerste contact tot het sluiten van de verkoop begeleid je geïnteresseerden en word je intensief ondersteund door ons marketingteam
Daarnaast ben je aanwezig in de markt en neem je als salesexpert deel aan beurzen en congressen, woon je netwerkevents bij of voer je productdemonstraties uit op locatie bij onze klanten (reisactiviteit tot 30%)
Je komt terecht op ons kantoor in Naarden, Nederland en maakt deel uit van een internationaal team van Sales Specialisten Hier profiteer je van competente internationale verkoopcollega's en hun jarenlange ervaring.
Jouw kwalificatie:
Je hebt een afgeronde commerciële opleiding of een diploma bedrijfskunde, geneeskunde of diëtetiek
Je bruist van de motivatie en hebt een passie voor sales
Wij zoeken een Hunter met relevante ervaring, dus je hebt minimaal 3 jaar direct sales ervaring
Je bent een netwerker en voelt je ook thuis in digitale kanalen
Je hebt uitstekende presentatievaardigheden en overtuigingskracht
Je brengt enthousiasme mee voor hoogwaardige technische producten die uitleg behoeven
Je spreekt Nederlands (Frans is een pré)
Ons aanbod:

Je kunt rekenen op een gemotiveerd internationaal team, een prestatiegerichte beloning en moderne technische apparatuur, waaronder smartphone en tablet. Je ntvangt ook een bedrijfsauto voor privégebruik (middenklasse). Daarnaast biedt seca je een goede pensioenregeling, 27 vakantiedagen per jaar en een dynamische en innovatieve werksfeer met gezamenlijke evenementen en nog veel meer...

Hebben we je interesse gewekt? Dan zien wij graag jouw motivatiebrief en C.V. tegemoet, inclusief salarisverwachtingen en roegst mogelijke startdatum. recruitment.de@seca.com",https://media.glassdoor.com/sql/813813/seca-north-america-squarelogo-1502969984025.png,Netherlands,nan,seca services
Backoffice medewerker - Parttime,"Vacaturebeschrijving:

Zoals Spiderman zijn web heeft, heb jij je klantvriendelijkheid en het vermogen om snel te schakelen. Ieder zijn of haar kwaliteiten. Gelukkig komen die van jou uitstekend van pas in een rol als backoffice medewerker. Wat er in deze functie op je ligt te wachten? Alles wat je van een administratieve job mag verwachten. Van gebruikelijke werkzaamheden als het beantwoorden van mail en telefoon tot het opstellen en controleren van uiteenlopende contracten en documenten. Schrijf je graag aan teksten voor op de website of andere vormen van content? Dan is ook dit steeds frequenter in te passen in je functie.
Zoals het hoort blijft het leveren van goed werk nooit lang zonder gevolgen. In deze rol verzeker jij jezelf o.a. van een loon tot €16.- per uur en de vrijheid om je eigen werkdagen de bijbehorende tijden te bepalen.
Tot zover de wat, tijd voor de waar. Ook daar vertel ik je graag meer over.

Waar kom jij te werken?
Jij treft je nieuwe werkplek aan in Amersfoort. Dat zag je al. Wat je nog niet wist is dat het een club betreft waar natuurkundige therapie centraal staat. De interesse in deze vorm van genezing vormt op de werkvloer een gemeenschappelijke factor. De werksfeer valt het beste samen te vatten als gezellig, open en gedreven. In je team zelf tref je 1 ander lid waarmee je voornamelijk en nauw gaat samenwerken.
Hoe ziet jouw werkdag eruit?

09:00 uur: na een korte dagstart met je team duik jij achter je laptop om alle binnengekomen mail te beantwoorden. Ook als de telefoon gaat ben jij het die opneemt
10:30 uur: de rest van je ochtend gaat op aan het beoordelen en controleren van meerdere nieuwe aanmeldingen. Nieuwe leden sluiten zich graag aan en jij zoekt uit of men juist geschoold en officieel gecertificeerd is
12:15 uur: tijd voor de lunch en na afloop een wandeling buiten. De zon schijnt, tijd voor een frisse neus
13:30 uur: om het aanmeldproces voor meerdere partijen in gang te zetten stel je meerdere documenten op welke je toestuurt zodra ze compleet zijn
16:00 uur: het laatste uurtje van je dag ben je kwijt aan het schrijven van een nieuwe tekst voor op de huidige website
17:15 uur: op naar huis. Anders is er later deze week niks meer te doen;)

Herken jij jezelf hierin?

Om er zeker van te zijn dat jij hier straks volledig op je plek zit is het belangrijk dat jij:
graag 8 tot 24 uur per week aan de slag gaat
een hbo studie volgt of succesvol hebt afgerond
de weg kent binnen MS Office en affiniteit met geneeskunde je niet vreemd is
bekend staat als nieuwsgierig, sociaal en pro-actief
planmatig sterk plus communicatief vaardig bent en je sneller schakelt dan Max Verstappen
in het Nederlands een 10 scoort voor taal
Wat krijg je ervoor terug?

De tegenprestatie? Die mag er hier zeker zijn en ziet er als volgt uit:
een lekker salaris dankzij een loon tot €16.- voor ieder uur dat je werkt
extra ontwikkeling dankzij gratis toegang tot de Work-on Talent Academy
tijd voor jezelf. In de vorm van 24 vakantiedagen per jaar op fulltime basis
sparen 2.0 dankzij 8,33% vakantiegeld
vergoeding van je reiskosten per auto of ov
Zo, dat was 'm. Van mijn kant dan. Nu is het aan jou. Solliciteren kan nu via de site, door te bellen naar 030 636 50 09 of mail je motivatie naar charlotte@work-on.nl en dan spreek ik je snel.",https://media.glassdoor.com/sql/1926627/work-on-squarelogo-1525772284299.png,Amersfoort,€2K - €3K (Employer est.),Work-on
Embedded software engineer,"Beschrijving van vacature
Technologie in het hart van de esthetische geneeskunde en professionele beauty industrie, geleverd door een klein maar sterk team van 23 die jaren bij Innofaith werken. Dat geeft aan dat we erin zitten om te blijven. Bij Innofaith delen we een mentaliteit van innovatief ontwerpen en vervaardigen van ultramoderne high-tech scan- en beeldvormende diagnostische apparaten. Bekijk ons op sylton.com en ontdek snel meer.
Wij van Innofaith zijn op zoek naar een belangrijke schakel in ons huidige team. Onlangs hebben we een nieuw product gelanceerd die de markt aan het veroveren is. Op software vlak valt nog wat winst te behalen. We zoeken daarom een embedded software engineer die de minder ervaren collega’s ook gaat begeleiden. Het team bestaat uit zowel man als vrouw. Sterker nog, er werken meer vrouwen dan mannen in ons club! Het systeem bestaat uit een iPad voor de user interface en een embedded systeem met alle hardware en software. We vinden het belangrijk dat je gevoel hebt voor hardware, computer vision en embedded software. Een voordeel als je kennis hebt van AWS en geautomatiseerd testen.
Wat bieden wij jou
In een zich snel ontwikkelende industrie zijn we een groeiend bedrijf dat onszelf ziet als betrokken en gepassioneerd, dat als één team samenwerkt om aan de behoeften van onze klanten te voldoen, evenals onze eigen drang naar innovatie. Sluit je bij ons aan en je zult een ondersteunende en open omgeving ontdekken waar je wordt aangemoedigd om deel uit te maken van een community. Dit betekent dat je met collega's in de verschillende bedrijfsgebieden werkt en de manier waarop we dingen doen uitdaagt en je innovatieve denkwijze in daden omzet. We kijken uit naar je profiel en motivatie.

Een salaris tussen de € 4000 – € 5000
25 vakantiedagen en 8% vakantiegeld
Reiskostenvergoeding of OV-lidmaatschap
Onkostenvergoeding van € 50
Laptop naar keuze
Gezamenlijke lunch
Geweldig team van gedreven collega’s die elkaar verder helpen!
Ben jij wie wij zoeken?
HBO werk en denkvermogen
Senior op het gebied embedded software
Ervaring met C++
Eerder ervaring met het begeleiden van junioren en medioren",https://media.glassdoor.com/sql/1492395/starapple-squarelogo-1495692983804.png,Eindhoven,€4K - €5K (Employer est.),StarApple
R&D Engineer,"Beschrijving van vacature
Technologie in het hart van de esthetische geneeskunde en professionele beauty industrie, geleverd door een klein maar sterk team van 23 die jaren bij Innofaith werken. Dat geeft aan dat we erin zitten om te blijven. Bij Innofaith delen we een mentaliteit van innovatief ontwerpen en vervaardigen van ultramoderne high-tech scan- en beeldvormende diagnostische apparaten. Bekijk ons op sylton.com en ontdek snel meer.
Ben jij de R&D engineer waar wij naar op zoek zijn? Voor ons onderzoeksteam zoeken wij versterking! Wij hebben een klein team dat zich bezighoudt met het ontwikkelen, testen en het creëren van nieuwe ideeën. Wil jij als engineer de ultieme vrijheid hebben waarin jij jouw creativiteit kwijt kunt? Dit is namelijk precies wat wij zoeken. Iemand die juist nieuwe dingen wilt proberen, iemand die niet bang is dat zijn idee niet gaat werken én iemand die zichzelf in het diepe gooit. Voor deze rol zijn wij op zoek naar een starter of junior. Iemand die op school of in zijn vrije tijd al het een en ander heeft geprobeerd en dus in hart en nieren een ‘onderzoeker’ van nature is. Ons product bestaat uit een iPad voor de userinterface, een tastbaar apparaat dat draait op C++, dat gebruik maakt van Computer vision én AWS. In dit kleine team ga je dus samen nieuwe ideeën uitwerken, testen en opzetten. Wij hebben sinds kort de ruimte in ons team jou hierin te ondersteunen.
Wat bieden wij jou
In een zich snel ontwikkelende industrie zijn we een groeiend bedrijf dat onszelf ziet als betrokken en gepassioneerd, dat als één team samenwerkt om aan de behoeften van onze klanten te voldoen, evenals onze eigen drang naar innovatie. Sluit je bij ons aan en je zult een ondersteunende en open omgeving ontdekken waar je wordt aangemoedigd om deel uit te maken van een community. Dit betekent dat je met collega's in de verschillende bedrijfsgebieden werkt en de manier waarop we dingen doen uitdaagt en je innovatieve denkwijze in daden omzet. We kijken uit naar je profiel en motivatie.

Een salaris tussen de € 2500– € 3500
25 vakantiedagen en 8% vakantiegeld
Reiskostenvergoeding of OV-lidmaatschap
Onkostenvergoeding van € 50
Laptop naar keuze
Gezamenlijke lunch
Geweldig team van gedreven collega’s die elkaar verder helpen!
Ben jij wie wij zoeken?
BSc elektrotechniek of BSc Embedded systems
Engineer in hart en nieren
Onderzoekers mentaliteit",https://media.glassdoor.com/sql/1492395/starapple-squarelogo-1495692983804.png,Eindhoven,€3K - €4K (Employer est.),StarApple
C++ Developer,"Beschrijving van vacature
Technologie in het hart van de esthetische geneeskunde en professionele beauty industrie, geleverd door een klein maar sterk team van 23 die jaren bij Innofaith werken. Dat geeft aan dat we erin zitten om te blijven. Bij Innofaith delen we een mentaliteit van innovatief ontwerpen en vervaardigen van ultramoderne high-tech scan- en beeldvormende diagnostische apparaten. Bekijk ons op sylton.com en ontdek snel meer.
Wij van Innofaith zijn op zoek naar een belangrijke schakel in ons huidige team. Onlangs hebben we een nieuw product gelanceerd die de markt aan het veroveren is. Op software vlak valt nog wat winst te behalen. We zoeken daarom een ervaren C++ developer die de minder ervaren collega’s ook gaat begeleiden. Het team bestaat uit zowel man als vrouw. Sterker nog, er werken meer vrouwen dan mannen in ons club! Het systeem bestaat uit een iPad voor de user interface en een embedded systeem met alle hardware en software. We vinden het belangrijk dat je kennis hebt van software patterns. Een voordeel als je kennis hebt van AWS en geautomatiseerd testen.
Wat bieden wij jou
In een zich snel ontwikkelende industrie zijn we een groeiend bedrijf dat onszelf ziet als betrokken en gepassioneerd, dat als één team samenwerkt om aan de behoeften van onze klanten te voldoen, evenals onze eigen drang naar innovatie. Sluit je bij ons aan en je zult een ondersteunende en open omgeving ontdekken waar je wordt aangemoedigd om deel uit te maken van een community. Dit betekent dat je met collega's in de verschillende bedrijfsgebieden werkt en de manier waarop we dingen doen uitdaagt en je innovatieve denkwijze in daden omzet. We kijken uit naar je profiel en motivatie.

Een salaris tussen de € 3800 – € 5000
25 vakantiedagen en 8% vakantiegeld
Reiskostenvergoeding of OV-lidmaatschap
Onkostenvergoeding van € 50
Laptop naar keuze
Gezamenlijke lunch
Geweldig team van gedreven collega’s die elkaar verder helpen!
Ben jij wie wij zoeken?
HBO werk en denkvermogen
Senior op het gebied van C++
Eerder ervaring met het begeleiden van junioren en medioren",https://media.glassdoor.com/sql/1492395/starapple-squarelogo-1495692983804.png,Eindhoven,€4K - €5K (Employer est.),StarApple
