job_titles,job_description,images,locations,salaries,companies
Medewerker administratie - Parttime,"Vacaturebeschrijving:

Een lekker salaris tussen de €14 en €16 per uur, zelf je eigen werkdagen kiezen en veel vrijheid in je takenpakket. 3 redenen om nu al enthousiast te worden van deze parttime job als medewerker administratie. Enthousiasme dat je hopelijk weet vast te houden wanneer je leest wat je precies gaat doen. Namelijk alles wat je van een administratieve bijbaan mag verwachten. Van gebruikelijke werkzaamheden als het beantwoorden van mail en telefoon tot het opstellen en controleren van uiteenlopende contracten en documenten. Schrijf je graag aan teksten voor op de website of andere vormen van content? Dan is ook dit steeds frequenter in te passen in je functie.
Tot zover de wat, tijd voor de waar. Ook daar vertel ik je graag meer over.

Waar kom jij te werken?
Jij treft je nieuwe werkplek aan in Amersfoort. Dat zag je al. Wat je nog niet wist is dat het een club betreft waar natuurkundige therapie centraal staat. De interesse in deze vorm van genezing vormt op de werkvloer een gemeenschappelijke factor. De werksfeer valt het beste samen te vatten als gezellig, open en gedreven. In je team zelf tref je 1 ander lid waarmee je voornamelijk en nauw gaat samenwerken.
Hoe ziet jouw werkdag eruit?

09:00 uur: na een korte dagstart met je team duik jij achter je laptop om alle binnengekomen mail te beantwoorden. Ook als de telefoon gaat ben jij het die opneemt
10:30 uur: de rest van je ochtend gaat op aan het beoordelen en controleren van meerdere nieuwe aanmeldingen. Nieuwe leden sluiten zich graag aan en jij zoekt uit of men juist geschoold en officieel gecertificeerd is
12:15 uur: tijd voor de lunch en na afloop een wandeling buiten. De zon schijnt, tijd voor een frisse neus
13:30 uur: om het aanmeldproces voor meerdere partijen in gang te zetten stel je meerdere documenten op welke je toestuurt zodra ze compleet zijn
16:00 uur: het laatste uurtje van je dag ben je kwijt aan het schrijven van een nieuwe tekst voor op de huidige website
17:15 uur: op naar huis. Anders is er later deze week niks meer te doen;)

Herken jij jezelf hierin?

Om er zeker van te zijn dat jij hier straks volledig op je plek zit is het belangrijk dat jij:
graag 8 tot 24 uur per week aan de slag gaat
een WO studie volgt of succesvol hebt afgerond
de weg kent binnen MS Office en affiniteit met geneeskunde je niet vreemd is
bekend staat als nieuwsgierig, sociaal en pro-actief
planmatig sterk plus communicatief vaardig bent en je sneller schakelt dan Max Verstappen
in het Nederlands een 10 scoort voor taal
Wat krijg je ervoor terug?

De tegenprestatie? Die mag er hier zeker zijn en ziet er als volgt uit:
een lekker salaris dankzij een loon tot €16.- voor ieder uur dat je werkt
extra ontwikkeling dankzij gratis toegang tot de Work-on Talent Academy
tijd voor jezelf. In de vorm van 24 vakantiedagen per jaar op fulltime basis
sparen 2.0 dankzij 8,33% vakantiegeld
vergoeding van je reiskosten per auto of ov
Zo, dat was 'm. Van mijn kant dan. Nu is het aan jou. Solliciteren kan nu via de site, door te bellen naar 030 636 50 09 of mail je motivatie naar charlotte@work-on.nl en dan spreek ik je snel.",https://media.glassdoor.com/sql/1926627/work-on-squarelogo-1525772284299.png,Amersfoort,€2K - €3K (Employer est.),Work-on
