job_titles,job_description,images,locations,salaries,companies
Assistant/Associate Professor Energy-efficient Software Development,"Key takeaways
Hours
40 hr.
Salary indication
Salary gross/monthly
based on full-time
€ 3,974 - € 7,362
Deadline
14 Apr 2023

The Context

The Computer Science department of the University of Twente is expanding. Therefore, we are hiring 6 new faculty members, to strengthen our research in Artificial Intelligence, Cyberphysical systems and Software Engineering in the domains of (1) e-Health and (2) energy and sustainability. These new faculty members will be assigned in different research groups, but inter-group collaboration with other researchers working on these themes is considered essential to reach our overall ambitions. One of the six positions is in the Formal Methods and Tools group (FMT) and focusses on research in energy and sustainability.


The Position

The Formal Methods and Tools group develops and implements mathematical methods, high-performance data structures and algorithms, and suitable programming languages for the design of reliable software- and data-intensive control systems. One important aspect that we would like to consider more prominently in our work is the energy consumption of such systems. Therefore, we are looking for somebody with expertise on energy-efficient software development. Areas that we are interested in are for example the modelling of energy usage of software (possibly considering different hardware models for execution), techniques to estimate the energy consumption of software, and techniques that can be used to (automatically) reduce the energy consumption of software. We are interested in integrating such techniques in many of the techniques that we develop within FMT. We also are interested in collaborating with the other groups within the CS department on this topic.


The Formal Methods and Tools group is an internationally well-known group of researchers in the area of formal methods and software engineering. Their research covers a wide range of different tools and techniques. The group is quickly growing: it currently consists of 4 full-time full professors, 2 associate professors and 8 assistant professors. In addition, several part-time full professors are associated to the group. The FMT group has an open and welcoming atmosphere, where there is room for both scientific and social interactions.

Your profile
You have a strong interest and have shown ability to collaborate in an academic, multidisciplinary environment;
You have a PhD degree in Computer Science, Electrical Engineering, or related discipline;
You have demonstrated the ability to perform high-quality research in a field relevant to the theme of energy and sustainability and to research done in the FMT group;
You have shown a willingness to acquire external funding and are prepared to expand your skills in this respect;
You have good communication skills and are a team player;
You are fluent in English (knowledge of, or willingness to learn Dutch is an advantage);
You have a University Teaching Qualification (Dutch: BKO) or equivalent, or you are willing to acquire one within three years.
Our offer
We offer a permanent position with a one-year probationary period (formally a 1-year contract with prospect of permanent contract).
The position comes with a start-up package that will be allow you to appoint one PhD student.
Our terms of employment are in accordance with the Dutch Collective Labor Agreement for Universities (CAO) and include a holiday allowance of 8% of the gross annual salary and a year-end bonus of 8.3%.
Depending on your relevant background and experience, the gross monthly salary on a full-time basis ranges from € 3974,- (scale 11) to € 7362,- (scale 14) gross per month.
A minimum of 29 leave days in case of full-time employment based on a formal workweek of 38 hours. A fulltime employment in practice means 40 hours a week, therefore resulting in 96 extra leave hours on an annual basis.
A solid pension scheme.
Free access to sport facilities on campus.
We are a family-friendly institution, which offers parental leave for both parents (both paid and unpaid) and career support for partners.
We appreciate diversity of profiles, cultures, and backgrounds, and promote an inclusive working culture.
Furthermore, we offer excellent professional and personal development programs.
Finally, you will work in a lively, inspiring, and dynamic working environment in an organization focusing on internationalization, where you will have a high degree of responsibility and independence.
Information and application

Are you interested in joining our team? Please submit your application before April 15, 2023 via the ""Apply Now"" button below, including:

a curriculum vitae (including, list of publications, research and teaching statement);
a cover letter in which you describe your motivation and qualifications for the position.
2 or 3 of your publications which you deem most relevant to this vacancy.
We are an equal opportunity employer and value diversity and inclusion at our university. We encourage applications from all sections of society.

Short online interviews are planned in the middle of May. Full job interviews are scheduled on campus in June.

You are welcome to contact Marieke Huisman (m.huisman@utwente.nl) for any questions you might have.

Related vacancies

The other open positions of the Computer Science department related to e-Health and energy and sustainability are:

Energy-efficient communication networks
Machine Learning and AI in e-Health
AI for (health) Coaching
Data, systems and network security for critical infrastructures
Energy-efficient computing continuum (IoT-edge-cloud)

About the organisation

The faculty of Electrical Engineering, Mathematics and Computer Science (EEMCS) uses mathematics, electronics and computer technology to contribute to the development of Information and Communication Technology (ICT). With ICT present in almost every device and product we use nowadays, we embrace our role as contributors to a broad range of societal activities and as pioneers of tomorrow's digital society. As part of a people-first tech university that aims to shape society, individuals and connections, our faculty works together intensively with industrial partners and researchers in the Netherlands and abroad, and conducts extensive research for external commissioning parties and funders. Our research has a high profile both in the Netherlands and internationally. It has been accommodated in three multidisciplinary UT research institutes: Mesa+ Institute, TechMed Centre and Digital Society Institute.

Want to know more?
Huisman, M. (Marieke)
Full Professor
Huisman, M. (Marieke)
Full Professor
Do you have questions about this vacancy? Then you can contact Marieke for all substantive questions about this position and the application procedure. For general questions about working for the UT, please refer to the chatbot.
Contact
Phone:+31534894662
Email:m.huisman@utwente.nl",https://media.glassdoor.com/sql/320105/university-of-twente-squarelogo-1433290124874.png,Enschede,€4K - €7K (Employer est.),Universiteit Twente
PhD in Network Statistics and Machine Learning,"PhD in Network Statistics and Machine Learning
Faculteit/Dienst: Faculteit Economie & Bedrijfskunde
Opleidingsniveau: Master
Functie type: Wetenschappelijk Personeel
Sluitingsdatum: 1 May 2023
Vacaturenummer: 11265
Are you interested in studying networks and using methodology at the cross-section of business analytics, econometrics and computer science? The Business Analytics section at the University of Amsterdam Business School invites applications for a PhD position in Network Statistics and Machine Learning. We are looking for candidates with the ambition to work and succeed at the highest international academic level.

The main topic of research is network analysis and modelling using statistical and machine learning tools. Network data are ubiquitous in finance, social media, the economy, and business. Social networks play an increasingly important role in society. For example, the Reddit community WallStreetBets hyped the stock of GameStop (GME), causing a short squeeze and extremely volatile stock prices in early 2021. Similarly, statements made on social networks such as Twitter have been shown to impact public and voter opinions. Exemplifying how social networks directly affect the economy, this project focusses on studying network data with a specific interest in modelling and understanding how networks change over time. Change detection in an online fashion is a challenging task in networks of large size, a common property of social networks.

In this research, the candidate will first investigate and develop interpretable network analysis approaches using statistical models and test them on real-life data. Then geometric deep learning approaches for the tasks like node classification, link prediction and graph classification will be developed with change detection ability. In the final phase of the project, the candidate should bring together two families of methods and design an optimized algorithm that is both interpretable and yields a high performance in network change detection.

The PhD student will work in close collaboration with the supervisory team and other faculty on the tasks.
The supervisory team will consist of dr. Inez Zwetsloot (ABS), dr. Simon Trimborn (ASE) and dr. Stevan Rudinac (ABS).

What are you going to do?

Develop novel interpretable statistical models for network analysis;
develop novel deep-learning approaches for node classification, link prediction, and community detection in network data;
create open data and software tools for the envisioned network analysis tasks;
present research findings at international conferences;
write up findings for publication in international journals;
pursue and complete a PhD thesis within the appointed duration of four years;
attend classes and seminars (including those offered at other universities) to develop thinking and research skills further;
participate in and contribute to departmental research functions (PhD Day, research seminars, and research meetings);
assist in knowledge dissemination activities;
participate in teaching-related activities (to a limited degree), including undergraduate tutorials and the supervision of MSc and/or BSc thesis projects.

What do we require?

Formal requirements:
Masters’ degree in Statistics, Econometrics, Computer Science, Artificial Intelligence, Data Science, Mathematics, or a related field (expected to finish by September 2023)

Task-related requirements:
Excellent communication skills in English, both oral and written, ideally with experience writing for a scientific audience;
willingness and motivation to independently formulate research projects and carry them through to completion;
mathematical skills, data analytics skills, and a strong willingness to develop these skills further;
excellent programming skills in one or more of the following languages: Python, R, C, C++;
preferably experience with at least one of the following: network data analysis, deep learning libraries such as PyTorch or TensorFlow, timeseries modeling and prediction, high-performance computing.3

Additional requirements:
Preference is given to candidates with some research experience (e.g., Master thesis and/or research assistant experience);
strong commitment to methodological rigor and scientific integrity;
energy and passion for statistics and machine learning;
intellectual curiosity, eagerness to learn, and openness to criticism;
willingness to participate in disseminating research results and valorization.

Our offer

The employment contract will be for four years with an initial period of 18 months, with an intermediate evaluation after 18 months and a possibility to extend it for 30 months (in total, four years). End-result should be a PhD thesis. An educational plan will be drafted that includes attendance of courses and (international) conferences. Preferred starting date is 1 September 2023.

The gross monthly salary will range from €2,541 in the first year to €3,247 in the last year. The Collective Labor Agreement for Dutch Universities is applicable.

Additionally, the University of Amsterdam offers excellent benefits and various schemes and regulations to promote a good work/life balance, such as:
232 hours of annual leave based on full-time employment;
8% holiday allowance and 8.3% end-of-year bonus;
Solid pension scheme (ABP);
Contribution to commuting expenses.

The compensation package is competitive at the European level and includes several secondary benefits. Favorable tax agreements may apply to non-Dutch applicants. To learn more about working at the University of Amsterdam, please check uva.nl/working-at-eb.

What else do we offer?
A function in which your own initiative and input are strongly valued;
an enthusiastic and warm team that is open to new colleagues;
collaboration opportunities in an active and vibrant research environment;
an inspiring academic and international work environment at the center of Amsterdam;
opportunities to visit international conferences and research centers;
opportunity to work from home flexibly.

About the employer

About UvA
With over 5,000 employees, 30,000 students and a budget of more than 600 million euros, the University of Amsterdam (UvA) is an intellectual hub within the Netherlands.

About UvA Economics and Business
Education and research at UvA Economics and Business (EB) cover a wide range of fields, including economics, data science, business administration, business analytics, accountancy, control, econometrics, finance, and entrepreneurship. This is organized in 2 Schools: the Amsterdam Business School (ABS) and the Amsterdam School of Economics (ASE). Over 7,000 students are enrolled in our UvA Economics and Business programs, and around 500 employees provide education and support. You will primarily work in the Amsterdam Business School that acquired the triple-crown accreditation (AACSB, AMBA, EQUIS), awarded to only 1% of business schools worldwide.

Find more information about Economics and Business on uva.nl/eb.
Find more information about the Amsterdam Business School on abs.uva.nl.
Find more information about the Amsterdam School of Economics on ase.uva.nl.

About the department
The department of Business Analytics of the Amsterdam Business School focuses on research in a wide range of areas of business analytics, including artificial intelligence, digital business, statistics and operations research.
The members of the department have published their research in the top-tier academic journals, such as Operations Research, Management Science, Mathematical Programming, Journal of Machine Learning Research.

The members of the section are also involved in teaching in undergraduate, master, and research master level programs, as well as in executive education, and uphold strong relationships with industry, business, and public sectors.

Our staff is associated with various research initiatives and platforms, e.g. the Analytics Academy, the brand new Analytics for a Better World initiative, the Institute of Business and Industrial Statistics (IBIS UvA).

Questions

Do you have any questions, or do you require additional information? Please contact: Dr. Inez Zwetsloot (i.m.zwetsloot@uva.nl).

Job application

Do you recognize yourself in the job profile? Then we look forward to receiving your application by 1 May 2023. The application should include:
A letter of motivation
A recent curriculum vitae (CV)
A publication list (if applicable)
A grade list of your Bachelor’s and Master’s degrees

All documents should be combined and submitted as one pdf.

Shortlisted candidates will be invited for a job interview on an ongoing basis. They will be asked to submit additionally a sample of their research work (e.g., thesis proposal) and two reference letters. They will be asked to present their (thesis) research work. The closing date is 1st May 2023.

The UvA is an equal-opportunity employer. We prioritise diversity and are committed to creating an inclusive environment for everyone. We value a spirit of enquiry and perseverance, provide the space to keep asking questions, and promote a culture of curiosity and creativity.

No agencies please.",https://media.glassdoor.com/sql/987673/universiteit-van-amsterdam-squarelogo-1430982599318.png,Amsterdam,€3K (Employer est.),Universiteit van Amsterdam
Assistant Professor AI for (health) Coaching,"Key takeaways
Hours
40 hr.
Salary indication
Salary gross/monthly
based on full-time
€ 3,974 - € 6,181
Deadline
14 Apr 2023

The Context

The Computer Science department of the University of Twente is expanding. Therefore, we are hiring 6 new faculty members, to strengthen our research in Artificial Intelligence, Cyberphysical systems and Software Engineering in the domains of (1) e-Health and (2) energy and sustainability. These new faculty members will be assigned in different research groups, but inter-group collaboration with other researchers working on these themes is considered essential to reach our overall ambitions. One of the six positions is in the Human Media Interaction (HMI) group and focusses on research in e-Health.


The Position

Research into multimodal conversational systems such as chatbots, virtual humans, or social robots to coach people to live a healthier lifestyle, both from a physical and mental perspective, has seen a steady growth in the past couple of years. With the introduction of conversational systems such as ChatGPT and Bard, it looks as if smooth natural language conversations with an AI system have become possible. However, lifestyle coaching systems need a more sensitive and controlled mechanism to decide on what personalized advice to give. They need to be sensitive to the possibly vulnerable physical and mental state of the user and be aware of the possible effects of their advice. Furthermore, the information they provide should be communicated in a convincing way, but also be reliable and trustworthy. We are looking for a candidate with an AI background that can contribute to intelligent systems that can realise these goals.

Human Media Interaction (HMI) is a diverse and interdisciplinary research group that studies and designs interactive systems that users can intuitively interact with, ranging from Brain Computer Interfaces to Conversational Systems and Ambient Intelligence applications. In the area of Conversational Systems, HMI has expertise on speech technology, dialogue systems, embodied conversational agents and social robots. On the theme of e-Health, HMI has a strong tradition in contributing to a variety of coaching systems such as applications to increase physical fitness, advice on particular conditions (asthma, diabetes), or helping people to stop smoking or drinking. Research is conducted in coalitions with other research groups from inside and outside the University of Twente and with external stakeholders such as hospitals, rehabilitation centers, elderly homes, etcetera.

Your profile
You have a strong interest and have shown ability to collaborate in an academic, multidisciplinary environment;
You have a PhD degree in Computer Science, or related discipline with a focus on relevant areas in Artificial Intelligence;
You have demonstrated the ability to perform high-quality research in one of the fields relevant to the topic: natural language processing, dialogue systems, virtual humans, or social robots;
You have shown a willingness to acquire external funding and are prepared to expand your skills in this respect;
You have good communication skills and are a team player;
You are fluent in English (knowledge of, or willingness to learn Dutch is an advantage);
You have a University Teaching Qualification (Dutch: BKO) or equivalent or you are willing to acquire one within three years.
Our offer
We offer a permanent position with a one-year probationary period (formally a 1-year contract with prospect of permanent contract).
The position comes with a start-up package that will be allow you to appoint one PhD student.
Our terms of employment are in accordance with the Dutch Collective Labor Agreement for Universities (CAO) and include a holiday allowance of 8% of the gross annual salary and a year-end bonus of 8.3%.
Depending on your relevant background and experience, the gross monthly salary on a full-time basis ranges from € 3974,- (scale 11) to € 6181,- (scale 12) gross per month.
A minimum of 29 leave days in case of full-time employment based on a formal workweek of 38 hours. A fulltime employment in practice means 40 hours a week, therefore resulting in 96 extra leave hours on an annual basis.
A solid pension scheme.
Free access to sport facilities on campus.
We are a family-friendly institution, which offers parental leave for both parents (both paid and unpaid) and career support for partners.
We appreciate diversity of profiles, cultures, and backgrounds, and promote an inclusive working culture.
Furthermore, we offer excellent professional and personal development programs.
Finally, you will work in a lively, inspiring, and dynamic working environment in an organization focusing on internationalization, where you will have a high degree of responsibility and independence.
Information and application

Are you interested in joining our team? Please submit your application before April 15, 2023 via the ""Apply Now"" button below, including:

a curriculum vitae (including, list of publications, research and teaching statement);
a cover letter in which you describe your motivation and qualifications for the position.
2 or 3 of your publications which you deem most relevant to this vacancy.
We are an equal opportunity employer and value diversity and inclusion at our university. We encourage applications from all sections of society.

Short online interviews are planned in the middle of May. Full job interviews are scheduled on campus in June.

You are welcome to contact Dirk Heylen (d.k.j.heylen@utwente.nl) for any questions you might have.

Related vacancies

The other open positions of the Computer Science department related to e-Health and energy and sustainability are:

Energy-efficient communication networks
Machine Learning and AI in e-Health
Energy-efficient Software Development
Data, systems and network security for critical infrastructures
Energy-efficient computing continuum (IoT-edge-cloud)

About the organisation

The faculty of Electrical Engineering, Mathematics and Computer Science (EEMCS) uses mathematics, electronics and computer technology to contribute to the development of Information and Communication Technology (ICT). With ICT present in almost every device and product we use nowadays, we embrace our role as contributors to a broad range of societal activities and as pioneers of tomorrow's digital society. As part of a people-first tech university that aims to shape society, individuals and connections, our faculty works together intensively with industrial partners and researchers in the Netherlands and abroad, and conducts extensive research for external commissioning parties and funders. Our research has a high profile both in the Netherlands and internationally. It has been accommodated in three multidisciplinary UT research institutes: Mesa+ Institute, TechMed Centre and Digital Society Institute.

Want to know more?
Heylen, D.K.J. (Dirk)
Full Professor
Heylen, D.K.J. (Dirk)
Full Professor
Do you have questions about this vacancy? Then you can contact Dirk for all substantive questions about this position and the application procedure. For general questions about working for the UT, please refer to the chatbot.
Contact
Phone:+31534893745
Email:d.k.j.heylen@utwente.nl",https://media.glassdoor.com/sql/320105/university-of-twente-squarelogo-1433290124874.png,Enschede,€4K - €6K (Employer est.),Universiteit Twente
