job_titles,job_description,images,locations,salaries,companies
"Assistant Professor (UD, 1fte) in the field of International Justice and Global Challenges","Vacaturenr.
13566
Functie-categorie
Wetenschappelijke functies
Omvang (fte)
1
Extern/intern
Intern , Extern
Locatie
Den Haag
Geplaatst op
28 maart 2023
Sluitingsdatum
25 april 2023
Leiden University College (LUC) The Hague, part of theFaculty of Governance and Global Affairsis looking for an

Assistant Professor (UD, 1fte) in the field of International Justice and Global Challenges
LUC seeks to appoint a new Assistant Professor to join the staff for teaching and research in the International Justice major as well as potentially contributing to other majors within our international Liberal Arts & Sciences honours Bachelor programme centred around ‘Global Challenges’. The starting date is July 2023.
The position
The Assistant Professor will be responsible, inter alia, for teaching undergraduate students and conducting research in fields of law that are particularly relevant to current global challenges, in particular Migration and Refugee Law and Law of the Sea. In addition to teaching and research within your field of expertise, interest in engaging in interdisciplinary scholarship related to law as well as more broadly across the college, is desired.This appointment may also involve teaching in the first-year Global Challenges programme. Contributing to the Global Citizenship programme, which engages with societal stakeholders, is also an option.

The Assistant Professor should show clear affinity with the ‘Global Challenges’ focus of our programme, which is linked to the profile of The Hague as ‘International City of Peace and Justice’. In addition to the core international academic staff based at LUC, leading scholars from the other faculties of Leiden University participate in the teaching of the programme. LUC staff are able to take advantage of being part of Leiden University while also contributing actively to the energetic and stimulating atmosphere of our college community in The Hague. Moreover, the Assistant Professor will be encouraged to develop links and synergies between LUC and other institutions and societal partners relevant to the International Justice major.

LUC is a small-scale and student-centred college and hence strong commitment to teaching excellence is essential. Furthermore, the ideal candidate will have an active research agenda that illustrates independent scholarship demonstrated by peer reviewed publications. The ideal candidate will actively contribute to a dynamic college culture of research-led teaching. This includes integrating students in research projects, integrating research into all levels of the curriculum, and advising students on Capstone research projects (senior honours theses).
Key responsibilities
Teach undergraduate students in our interdisciplinary honours programme at both introductory and advanced levels;
Supervise bachelor research theses (Capstone);
Carry out research, publish, and work towards obtaining external research grants. Research time is 20% of the appointment, the remainder is dedicated to teaching and administrative duties.
Connect to other institutes within Leiden University, regarding both teaching and research, as relevant to the BA International Justice major;
Connect to other national, international, and non-governmental organizations to facilitate cooperation and internship possibilities;
Participate in and contribute to LUC’s service tasks such as recruitment and admissions, academic advice and/or membership of various councils or boards;
Participate in and contribute to the social and academic life of LUC;

Selection criteria
A PhD degree in International Law or another field of law (e.g., EU or comparative law) relevant to current global challenges;
Demonstrable expertise in Migration and Refugee Law and Law of the Sea is essential;
Knowledge of EU Law and/or socio-legal approaches will be considered an asset;
Affinity with interdisciplinary work and methodological issues in legal research;
Affinity with the concept of Liberal Arts & Sciences honours education at university level will be considered an asset;
Excellent command of English and commitment to learn the Dutch language within two years (if not yet mastered);
A passion and vision for teaching in an international environment;
Outstanding teaching skills evidenced by formal evaluations, and a clear interest in innovative teaching methods and approaches;
Genuine interest in students’ development and providing academic guidance;
Very good research skills evidenced by publication record, and the willingness to apply for competitive grants;
Excellent social skills and ability to work constructively in an international/intercultural team; committed to contribute to an inclusive working and learning environment, through research, teaching and/or service.

Our organisation
The Faculty of Governance and Global Affairs offers academic education in the field of Public Administration, Safety and Security, and International Relations, as well as in-depth post-academic programmes for professionals. In addition, the Faculty is also home to Leiden University College. For more information, see Governance and Global Affairs.
Leiden University College The Hague was founded in 2010 as the international honours college of Leiden University in The Netherlands for a select group of excellent and highly motivated students from around the world. The LUC academic staff consists of highly ambitious and international scholars recruited from top institutes across the globe, who combine excellent teaching skills with conducting innovative multidisciplinary research. LUC has been consistently ranked as a ‘Top Rated Programme’ seal from the Dutch University Guide (Keuzegids Universiteiten).

Terms and conditions
The successful candidate will be part of an ambitious and dynamic team. Initially, the successful candidate will be appointed for one year. Depending on performance, after that the position can be extended to a permanent position. The salary range will be at UD2 level between € 3,974.- and € 5,439.- (scale 11 according to the terms of the Collective Labour Agreement of Dutch Universities), gross per month on the basis of a full-time appointment.

Leiden University offers an attractive benefits package with additional holiday (8%) and end-of-year bonuses (8.3 %), and training and career development opportunities. Our individual choices model gives you some freedom to assemble your own set of terms and conditions. For international spouses we have set up a dual career programme. Candidates from outside the Netherlands may be eligible for a substantial tax break. For more information, see the website.

Leiden University requires teaching staff to obtain the University Teaching Qualification (UTQ). If the successful applicant does not already possess this qualification or its equivalent, he/ she must be willing to obtain this Qualification within two years.

Diversity
Leiden University is strongly committed to diversity within its community and especially welcomes applications from members of underrepresented groups.

Information
For further enquiries, please contact Dr. Joris Larik, j.e.larik@luc.leidenuniv.nl

Application
Please submit your application online no later than 25 April 2023 via the blue button in our application system. Applicants should submit the following documents online:
A letter of motivation, outlining how you intend to contribute to the academic environment of LUC;
A Curriculum vitae including a detailed teaching CV (including teaching evaluations), experience with supervision of students, international experience, and list of publications;
The names and contact details of three potential referees (no letters required at this stage).",https://media.glassdoor.com/sql/239477/leiden-university-squarelogo.png,Den Haag,nan,Universiteit Leiden
Assistant Professor in corporate and/or organizational communication,"Tilburg University | Tilburg School of Humanities and Digital Sciences is looking for an Assistant Professor in corporate and/or organizational communication

Department: Department of Communication and Cognition
Location: Tilburg
Full time equivalent: 0,8 – 1,0 fte (32-40 hours per week)
Monthly full-time salary: € 3.974 - € 5.439
Duration of employment contract: 12 or 18 months with intention of a permanent position
Start date: 1-9-2023
Closing date vacancy: 7-4-2023
Job description
The Department of Communication and Cognition in the Tilburg School of Humanities and Digital Sciences is looking for an enthusiastic Assistant Professor, with a background in corporate and/or organizational communication.

The successful candidate is expected to initiate and conduct research in the Tilburg Center for Cognition and Communication (TiCC). Researchers in TiCC explore cognitive and social aspects of human communication through a multidisciplinary approach, combining careful experimentation with survey methods, interviews, content analyses and computational modelling. We value methodological innovation and focus on and aim to further develop our research on themes such as: the human mind in a communicative context; communication, resilience and empowerment; social responsibility and effective communication design; ethics and responsible human-centered AI design; inclusion, language, and well-being in a changing (digital) society; health and climate communication; interpersonal and multimodal communication in innovative contexts. The candidate is expected to develop new lines of research fitting within this research program, with a particular focus on how strategic organizational and corporate communication can responsibly contribute to current societal issues such as climate change, globalization, digitalization, sustainability, diversity and (in-)equality.

The successful candidate will contribute to one of the leading programs in the Netherlands in Communication and Information Sciences (CIS), consisting of three tracks: Business Communication and Digital Media (BDM), Communication and Cognition (CC), and New Media Design (NMD). The candidate will mainly teach courses in the BDM track such as CSR, contribute to the new, interdisciplinary minor Sustainability, and will also supervise bachelor and master theses.

Requirements position
As a successful candidate, you:
Hold a PhD in a relevant discipline;
Have published in international journals or proceedings;
Possess excellent methodological skills;
Have the intention and ability to write research grants;
Combine a professional attitude with a strong commitment to integrity and (research) ethics;
Collaborate with scholars with other disciplinary backgrounds;
Have obtained the Dutch University Teaching Qualification (UTQ) certificate, or are willing to acquire such;
Are able to teach in Dutch as well as in English.

You also show personal leadership, possess a good level of self-knowledge, and are able to critically reflect on the (societal) implications of your research. In addition, you enjoy sharing knowledge and experiences, and are motivated to contribute to an open and inclusive work environment with a strong focus on team science.

Terms of employment
This is a position for 0,8 – 1,0 fte (32 - 40 hours per week) of full working hours. This is a vacancy for a permanent position in accordance with article 2.3 paragraph 1 of the CLA for Dutch Universities. You will be given a temporary employment contract for the duration of 12 to 18 months. After this period, if your suitability has been proven and you continue in the same position, you will receive an employment contract for an indefinite period of time.

Tilburg University offers excellent employment conditions with attention to flexibility and (personal)development and attractive fringe benefits. The salary amounts to a minimum of € 3.974 and a maximum of € 5.439 gross per month for full-time employment, based on UFO profile Assistant Professor 2 and salary scale 11 of the Collective Labour Agreement for Dutch Universities. Tilburg University uses a neutral remuneration system for salary scaling that is based on work experience.

You are entitled to a vacation allowance of 8% and a year-end bonus of 8.3% of your gross annual income. If you work 40 hours per week, you will receive 41 paid days of leave per year.
Researchers from outside the Netherlands may qualify for a tax-free allowance of 30% of their taxable salary if they meet the relevant conditions. The university applies for this allowance on their behalf. Successful candidates must remain at least 80% of their working days in the Netherlands (as a requirement of tax and social security laws).

We make clear agreements about career paths and offer all kinds of facilities and arrangement to maintain an optimal balance between work and private life. You can also follow numerous training courses, for example, in the areas of leadership skills, personal effectiveness, and career development.
All employees of the university are covered by the so-called General Pension Fund for Public Employers (Stichting Pensioenfonds ABP).

Tilburg University values an open and inclusive culture. We embrace diversity and encourage the mutual integration of groups of employees and students. We focus on creating equal opportunities for all our employees and students so that everyone feels at home in our university community.
Tilburg University has a lively campus in beautiful green surroundings that is easily accessible by public transport. We are committed to a sustainable society and challenge you to make an active contribution.

Please visit working at Tilburg University for more information on our terms of employment.

Further information and application
For inquiries about the positions and the project, please contact dr. Nadine Bol (Nadine.Bol@tilburguniversity.edu).

Applications should include a cover letter in English (max 1 page), a concise Curriculum Vitae (max 4 pages, including the names and contact details of two references), a brief research statement (max half a page) plus the two publications you are most proud of.
The application deadline is April 7 2023. Interviews will probably be held in the week of April 17 2023. The starting date is negotiable, but a starting date no later than September 1, 2023 is desirable.
Applications must be submitted online.
Tilburg School of Humanities and Digital Sciences
Onderzoek en onderwijs aan de Tilburg School of Humanities and Digital Sciences (TSHD) heeft een unieke focus op de mens in de context van de globaliserende digitale samenleving, op de ontwikkeling van kunstmatige intelligentie en interactieve technologieën, op de impact ervan op communicatie, cultuur en maatschappij, en op morele en existentiële uitdagingen die zich voordoen. De School of Humanities and Digital Sciences bestaat uit vier departementen: Communicatie en Cognitie, Cognitieve en Kunstmatige Intelligentie, Cultuurstudies en Filosofie; verschillende onderzoeksinstituten en een faculteitsbureau. Ook het University College Tilburg is onderdeel van de School. Jaarlijks starten ongeveer 275 studenten met een Bachelor- of (Pre)Masteropleiding. De School telt ongeveer 2000 studenten en 250 medewerkers.
Tilburg School of Humanities and Digital Sciences

Sollicitatiecode
Tilburg University hanteert de NVP-sollicitatiecode van de Nederlandse Vereniging voor Personeelsmanagement & Organisatieontwikkeling.

Disclaimer
De tekst in deze vacatureadvertentie is auteursrechtelijk beschermd eigendom van Tilburg University. Gebruik, verspreiding en verdere openbaarmaking van de advertentie zonder uitdrukkelijke toestemming van Tilburg University is niet toegestaan en dat geldt expliciet voor gebruik door werving- en selectiebureaus welke niet rechtstreeks handelen in opdracht van de Tilburg University. Reacties naar aanleiding van werving door niet-opdrachtnemers van Tilburg University worden niet in behandeling genomen.",https://media.glassdoor.com/sql/384527/tilburg-university-squarelogo-1426681542506.png,Tilburg,nan,Tilburg University
Assistant Professor of Climate and Data Studies,"Campus Fryslân is the newest faculty of the University of Groningen, located in Leeuwarden. The faculty is dedicated to interdisciplinary and transdisciplinary education and research. We conduct cutting-edge research where local themes are connected to global issues. Technology and data related issues represent a fast-growing aspect of our research and education. You will work at a state-of-the-art facility at one of the oldest and most prestigious European universities, located in the European Capital of Culture 2018. The Campus’ motivated staff values teamwork and provides a stimulating working environment in which mutual support is combined with room for individual initiative. You will become a member of our high-standing academic and international community. We challenge our staff and students to approach issues from multiple disciplines and encourage them to take a different view. We are curious about yours!

Programme coordination and teaching
Within Campus Fryslân, you will have a key role in doing research, pursuing engagement activities and teaching and coordinating courses in the major Energy, Ecology and Climate (formerly known as the Resposible Planet Major) and Data Track of the bachelor programme Global Responsibility and Leadership. GRL is a highly regarded programme, as evidenced by high rankings in Dutch Higher Education Guide. This teaching programme is highly innovative, stimulates teaching innovation and excellence and involves collaboration with stakeholders and societal partners. The programme also has a strong emphasis on digital skills, responsible use of data, and leadership development. The position has a profile of 60% teaching and 40% research.

Research
With regard to research, you will be part of the Knowledge Infrastructures Department at Campus Fryslân, and join an interdisciplinary team whose core concern is to develop knowledge infrastructures that can contribute to sustainability and liveable futures. The KI department participates in a range of international research projects and actively contribute to the development of novel research practices around data in the areas of ecology, climate change and sustainable energy among others. Membership of the Data Research Centre is also an option. Supervision of bachelor theses, of Living Labs and student advisement are also part of this position. Co-supervisions of PhD projects are also possible, depending on affinity and team composition.

Campus Fryslân invites applications for a motivated colleague at the level of assistant professor of Climate and Data. Specifically, you will be teaching the following courses, from foundation to upper level: Earth System, Climate Data and Services, Introduction to Sustainable Energy Transition and Data Science and Causal Inference.

The position is particularly suited for someone with clear interest in interdisciplinary approaches to climate and data, with a desire to shape the future of climate data expertise and possessing infrastructural imagination.

Qualifications

The following qualifications are important for the candidate who will fulfill this position:
a PhD in Climate-related discipline, Data Science, Science and Technology Studies, or a comparable domain;ability to develop and teach the courses listed above from an interdisciplinary and critical perspectiveaffinity with STS work in the area of climate and data and experience with transdisciplinary research projects;ability to function well in an interdisciplinary academic environment;research interests in the area of climate, data and knowledge productionan international and proactive outlook fitting a dynamic organisation;excellent command of the English language, including good communication skills.command of the Dutch Language at CEFR B2-level or prepared to obtain this within two yearsin possession of an University Teaching Qualification or prepared to obtain this within two years.

Organisation
Conditions of employment

We offer you in accordance with the Collective Labour Agreement for Dutch Universities:

a minimum salary of €3,974 (salary scale 11.0, assistant professor 2) up to a maximum of € 5,439 (salary scale 11.max, assistant professor 2) gross per month.
an holiday allowance of 8% and an end-of-year bonus of 8.3%
an appointment for an initial fixed term period of 18 months, with the possibility for a permanent appointment upon positive evaluation. The position has a 60-40 percent distribution with regard to teaching-research.

The starting date for this position is August 2023.

Application

Applications should include:

1) a letter of motivation
2) a curriculum vitae
3) a teaching statement
4) email and telephone contact information of at least two referees.

Only complete applications submitted by the deadline will be taken into consideration.

You may apply for this position until 16 April 11:59pm / before 17 April 2023 Dutch local time (CET) by means of the application form (click on ""Apply"" below on the advertisement on the university website).

The University of Groningen strives to be a university in which students and staff are respected and feel at home, regardless of differences in background, experiences, perspectives, and identities. We believe that working on our core values of inclusion and equality are a joint responsibility and we are constructively working on creating a socially safe environment. Diversity among students and staff members enriches academic debate and contributes to the quality of our teaching and research. We therefore invite applicants from underrepresented groups in particular to apply. For more information, see also our diversity policy webpage: https://www.rug.nl/about-ug/policy-and-strategy/diversity-and-inclusion/

Our selection procedure follows the guidelines of the Recruitment code (NVP): https://www.nvp-hrnetwerk.nl/nl/sollicitatiecode and European Commission's European Code of Conduct for recruitment of researchers: https://euraxess.ec.europa.eu/jobs/charter/code

We provide career services for partners of new faculty members moving to Groningen.

Unsolicited marketing is not appreciated.

Information

For information you can contact:

Anne Beaulieu (for more information about this position), j.a.beaulieu rug.nl

Please do not use the e-mail address(es) above for applications.

Additional information
University College Fryslân
Campus Fryslân",https://media.glassdoor.com/sql/305779/university-of-groningen-squarelogo.png,Groningen,€4K (Employer est.),Rijksuniversiteit Groningen
