job_titles,job_description,images,locations,salaries,companies
"Lecturer in International, Political and/or Social History","Employment
0.5 FTE
Gross monthly salary
€ 2,960 - € 5,439
Required background
PhD
Organizational unit
Faculty of Arts
Application deadline
02 April 2023
Apply now
Today's world requires critical thinkers. People who can define new directions for research and teaching that respond to the changes and challenges of our times. As one of the two lecturers in Political and/or Social History at Radboud University, you will join a diverse group of dedicated scholars, shape the field of history, and flourish in a friendly and vibrant academic community.


The Political History expertise group is welcoming applications from specialists in (early) modern international, political and/or social history who can strengthen and complement our profile and reputation in teaching and in terms of societal impact.


As a lecturer you will be part of the Department of History, Art History and Classics and participate at all levels of its educational programme, both in Dutch and English. You will provide education for the Dutch and English BA programmes in History, in Political History courses, and in general courses. At Master's degree level, you will participate in the Dutch taught specialisations Geschiedenis & Actualiteit and Politiek & Parlement. You will supervise students writing their papers and theses, participate in educational support activities such as tutoring, and actively contribute to the development of the curriculum.
Profile
You are a postgraduate candidate with expertise in the field of international, political and/or social history.
A completed or nearly completed PhD in History is recommended.
You are a team player, able to establish innovative connections with other staff members of the expertise group and beyond.
You are an inspiring lecturer with teaching experience in Dutch at at least BA level, preferably including thesis supervision, and you will be expected to contribute to curriculum development.
You have a university teaching qualification (UTQ) or an equivalent qualification, or are prepared to obtain a UTQ within two years (*).
You have ambition and talent for advanced research, as evidenced by publications, initiatives and an international network of academic contacts.
You have demonstrable experience in reaching out to non-academic audiences.
(*) For these qualifications and certifications, we provide the necessary infrastructure and resources to acquire them.
We are
The Faculty of Arts is committed to knowledge production that will have a significant scientific and social impact. With over 500 academic and support staff, we teach and conduct research in the fields of history and art, languages and cultures, and linguistics and communication, using innovative methodologies and working in close collaboration between the disciplines. Our research is embedded in two research institutes: the Centre for Language Studies (CLS) and the Radboud Institute for Culture & History (RICH). We currently have approximatively 2,500 students, enrolled in three departments: the Department of History, Art History and Classics, the Department of Modern Languages and Cultures, and the Department of Language and Communication. We aim to contribute to a more sustainable and inclusive world, which is why we especially seek applications from candidates who bring diverse perspectives, backgrounds, and skills that will be assets to our study programmes and research profiles.

Radboud University
We want to get the best out of science, others and ourselves. Why? Because this is what the world around us desperately needs. Leading research and education make an indispensable contribution to a healthy, free world with equal opportunities for all. This is what unites the more than 24,000 students and 5,600 employees at Radboud University. And this requires even more talent, collaboration and lifelong learning. You have a part to play!
We offer
It concerns an employment for 0.5 FTE.
The gross monthly salary amounts to a minimum of €2,960 and a maximum of €5,439 based on a 38-hour working week, depending on previous education and number of years of relevant work experience (salary scale 10 or 11).
You will receive 8% holiday allowance and 8.3% end-of-year bonus.
It concerns a temporary employment for 1 year. Upon a positive performance evaluation at the end of this period, the contract may be extended for two more years.
You will be able to use our Dual Career and Family Care Services. Our Dual Career and Family Care Officer can assist you with family-related support, help your partner or spouse prepare for the local labour market, provide customized support in their search for employment and help your family settle in Nijmegen.
Working for us means getting extra days off. In case of full-time employment, you can choose between 30 or 41 days of annual leave instead of the legally allotted 20.
Additional employment conditions
Work and science require good employment practices. This is reflected in Radboud University's primary and secondary employment conditions. You can make arrangements for the best possible work-life balance with flexible working hours, various leave arrangements and working from home. You are also able to compose part of your employment conditions yourself, for example, exchange income for extra leave days and receive a reimbursement for your sports subscription. And of course, we offer a good pension plan. You are given plenty of room and responsibility to develop your talents and realise your ambitions. Therefore, we provide various training and development schemes.
Would you like more information?
For questions about the position, please contact Dr Marieke Oprel, Assistant Professor of Political History at +31 6 31 13 26 28 or marieke.oprel@ru.nl. Alternatively, you can contact Prof. Wim van Meurs, Chair in Political History at 024 36 11 811 or wim.vanmeurs@ru.nl.
Practical information and applying
You can apply until 2 April 2023, exclusively using the button below. Kindly address your application to Marieke Oprel. Please fill in the application form and attach the following documents:
A letter of motivation.
Your CV, including a list of publications and the contact details of two references.
Both attachments may be written either in Dutch or in English.

The first round of interviews will take place on either 11, 12, 13 or 14 April. The second round of interviews will take place on 24, 25, 26, 27 or 28 April. You would preferably begin employment on 15 August 2023.

We can imagine you're curious about our application procedure. It offers a rough outline of what you can expect during the application process, how we handle your personal data and how we deal with internal and external candidates.
Apply now Application deadline 02 April 2023",https://media.glassdoor.com/sql/651704/radboud-university-nijmegen-squareLogo-1633358102615.png,Nijmegen,€3K - €5K (Employer est.),Radboud Universiteit
"Assistant, Associate, and Full Professors - Mathematics and Computer Science","Job description
The Department of Mathematics and Computer Science (M&CS) at Eindhoven University of Technology (TU/e) is hiring!
We are looking for 25 new colleagues to complement our department, and we welcome applications in all areas of computer science, mathematics, data science, and artificial intelligence. Appointments can be at Assistant, Associate, or Full Professor level, depending on the seniority of your profile.
Our university
TU/e is an internationally top-ranking university in the Netherlands that combines scientific curiosity with a hands-on attitude. Our spirit of collaboration translates into an open culture and a global top-5-position in collaborating with advanced industries. Fundamental knowledge enables us to design solutions for the highly complex problems of today and tomorrow. Eindhoven and the Brainport technology region, one of the globally leading innovation hubs, are a hotbed of cross-pollination and creativity were pure science is given real world meaning. TU/e currently has nine departments, with over 13,000 students in total.
Department of Mathematics and Computer Science
With over 110 (assistant, associate and full) professors, almost 300 PhD and EngD students, about 1500 Bachelor students and 1000 Master students, the Department of Mathematics and Computer Science (M&CS) is the largest department of the TU/e. By performing top-level fundamental and applied research, and maintaining strong ties with industry, M&CS aims to contribute to science and innovation in and beyond the region.
The department’s relationship with the high-tech industry in the Brainport region means that interested staff and students can contribute directly to the development of technological innovations with real-world relevance. Several successful spin-offs have originated from the department and our staff participates in many national and international research consortia.
M&CS is offering highly ranked bachelor and master-level programs in mathematics, computer science, and data science and artificial intelligence, all taught in English. Our department places great value on a diverse work force and an inclusive work environment; nearly 50% of our staff is international.
Please find more information about our research on our website.

Job requirements
Who are we looking for
To further strengthen and complement our department we are looking for talented researchers in all fundamental and applied areas of mathematics, computer science, data science, and artificial intelligence. We are particularly interested in topics that create synergy with our current research, or that could bridge the research between our clusters and TU/e institutes. As teaching is an essential part of academic tasks, we are searching for candidates who are not only passionate researchers but also motivated and inspiring teachers.
We specifically also invite part-time (0.6 - 0.8 fte) candidates to apply.
Your tasks will include:
Conduct research using generally accepted methods in your field, together with a team of PhD students and your colleagues in the department.
Publishing your work in peer-reviewed outlets.
Serving as a responsible lecturer for courses taught in our educational programs and provide educational support to your colleague’s courses.
Supervise (groups of) Bachelor, Master and post-Master students doing projects with
(or without) industry involvement in your area of expertise.
Membership of the various departmental committees that ensure continuous improvement of internal processes, education and research.

As English is the main language at TU/e, proficiency in the English language is a hard requirement. You do not need to speak Dutch. Furthermore, we require experience in scientific research, proven by a PhD in a relevant discipline and by publications in leading international conferences and journals in your area. Some experience as a post-doc is highly recommended.

Conditions of employment
Our offer
You will join a dynamic and internationally oriented department in a thriving and growing university. You will work on a beautiful, green campus within walking distance of Eindhoven city center and the central train station.
Furthermore, we offer you:
An 18-month temporary contract, followed by a tenured position on the same employment level after positive evaluation. Parttime (0.6 - 0.8 fte) appointments are also possible. If you have a more senior profile, a tailor-made career proposal will be considered.
Salary in accordance with the Collective Labor Agreement for Dutch Universities. Gross monthly salary ranges are for Assistant Professors: € 4,000 - € 6,000, for Associate Professors: € 5,000 - € 7,500, and for Full Professors: € 6,000 - € 10,000. For international candidates, a tax-compensation scheme may be available, leading to a higher net income for a period of five years (the Dutch 30% facility).
A year-end bonus of 8.3% and annual vacation pay of 8%.
A start-up package which includes a reduced teaching load for two years and a 5-year fully funded PhD TA position (30% teaching duties).
You will have an annual budget for (international) travel, a personal computer or laptop as needed, and access to our state-of-the-art technical infrastructure, including High Performance Computing.
A dedicated mentoring program to help you get to know the university and the Dutch (research) environment.
High-quality training programs for academic leadership and teaching.
Partially paid parental leave and an allowance for commuting, working from home and internet costs.
TU/e has on-campus children's day care and sports facilities.
A dedicated Staff Immigration Team is available for international candidates, including a relocation consultant and dual-career support.
Information and application
Information

Do you recognize yourself in this profile and would you like to know more?
Please contact Hella Ploegmakers, Senior Recruiter, h.a.m.ploegmakers[at]tue.nl or +31 643559625.
For more information on our department and the positions, you may contact prof.dr. Bettina Speckmann (computer science) b.speckmann[at]tue.nl, prof.dr.ir. Boudewijn van Dongen (data science and artificial intelligence) b.f.v.dongen[at]tue.nl, or prof.dr. Frits Spieksma (mathematics) f.c.r.spieksma[at]tue.nl.
Visit our website for more information about the application process or the terms of employment. Curious to hear more about what it is like as a professor at TU/e?
Please view the video.
Application

Please enclose:
a cover letter describing your motivation and qualifications for this position; please comment on how your research connects to our research and interests;
a full academic curriculum vitae, including a list of publications;
contact details of 3 references;
a research statement (max two pages) which describes your research interests and plans;
a teaching statement (max two pages) which describes your teaching vision and prior experience;

Please find more information about the application process here.
We look forward to receiving your application. We will be interviewing candidates from mid March, 2023.",https://media.glassdoor.com/sql/156538/tu-e-squarelogo-1413235358456.png,Eindhoven,nan,TU Eindhoven
Assistant Professor Social Practice in Contemporary Art and Culture,"Assistant Professor Social Practice in Contemporary Art and Culture
Faculteit/Dienst: Faculteit der Geesteswetenschappen
Opleidingsniveau: Gepromoveerd
Functie type: Wetenschappelijk Personeel
Sluitingsdatum: 24 April 2023
Vacaturenummer: 11397
What are you going to do?

You will provide education in a dynamic context with ample opportunities for the development of innovative teaching methods. Your research will be part of the Amsterdam School for Heritage, Memory and Material Culture (AHM), one of the five research schools of the Amsterdam Institute for Humanities Research. AHM, as a thematic research school, is the research base for a broad spread of disciplines from Heritage, Memory and Museum Studies, to Archaeology, Conservation and Restoration, Media studies and Art History. Museums and heritage sites are privileged sites of preserving, valuing, contesting and reinterpreting memory, often by means of material culture

The Department of Art and Culture Studies in the Faculty of Humanities is looking for an Assistant professor ‘Social Practice in Contemporary Art and Culture’ to build upon extend existing research strengths on this topic. You will provide education in a dynamic context with ample opportunities for the development of innovative teaching methods. You will develop and provide modules within the field of Social Practice in Contemporary Art and Culture such as in the context of the interdisciplinary Bachelor Global Arts, Culture and Politics, with the majors ‘Art, Media and Visual Culture’, ‘Culture and Social Justice’, and ‘Reimagining Sustainability’. Important is proven flexibility in teaching on topics beyond your own research focus, a willingness to work in interdisciplinary teams of teachers and the ability to offer inspiring lectures and tutorials in BA, MA and minor programmes that attract a wide range of students. You will contribute to teaching at all levels in relevant domains. Among the relevant BA and MA programmes the post holder will likely be asked to contribute by providing interdisciplinary core or elective module(s) are Cultural Studies and Art History. Your research will be part of the Amsterdam School for Heritage, Memory and Material Culture (AHM). Research School members collaborate in and across many thematic groups, including in AHM: ‘Artistic Knowing: Research in and on Cultural Practices’, ‘Museums and Interpretation’, and ‘Global Trajectories of Thought and Memory. In this setting, you will be expected to bring your theoretical and potentially also practice-based contributions and your situated investment in the field of contemporary culture, art and social practice to bear on UvA research and teaching. We are particularly keen to hear from candidates whose research addresses contemporary art and culture studies with a focus on social practice / socially engaged art, artists’ instituting practices / cultural workers-run institutions / institutional critique, and art activism and musealization. Within the area of social practice or socially engaged art and culture mobilized for social change and empowerment, we value candidates with transnational expertise and those adopting a global perspective.

Tasks and responsibilities:
Designing and conducting independent research on, in and through contemporary culture and institutions, broadly conceived, in relation to issues such as social practice, art(istic) research, curating, and/or activism. This will include work on the practical, societal, and epistemological dimensions of contemporary culture, art and social practices, resulting in contributions to academic peer-reviewed international journals and books, as well as exhibition curation / art practice and the various forms in which social practice materializes and is communicated;
actively pursuing external funding for research and creative endeavours, notably funding from research councils, national as well as European;
actively contributing to and developing national and international research networks and other forms of cooperation;
actively contributing to the research activities of AHM;
developing, coordinating and teaching courses in both Dutch and English, in the BA and MA programmes of Art History, Art and Performance Research Studies and related fields;
supervising BA and MA theses and tutoring students; co-supervising PhD theses;
actively contributing to the development and improvement of teaching programmes in the department;
taking part in committees and working groups, and carrying out departmental administrative tasks as directed.

What do you have to offer?

You are a dynamic and ambitious researcher with a strong profile, demonstrable by international publications / exhibitions and an international academic / social practice / artistic / art institutional network. Your outputs show broad, transnational knowledge of the ways in which contemporary culture and art and its exhibitions / institutions critically engage with society and the academy. You are familiar with and theoretically contribute to expert discourses on the link between aesthetics and the social, contemporary social practice / socially engaged art, art(istic) research, curating and contemporary art history from a global perspective. You have a strong investment in and contribute to contemporary art, social practice, art theory, curation, and other innovative methods at the intersection of art and humanities research, particularly those that challenge traditional epistemological categories. Your research matches the profile of AHM, and in particular the themes named above.

You are able to develop and provide modules on e.g. art and / as research; contemporary culture and art, its production, exhibition, functions in society, institutionalization / musealization and reception. Important is proven flexibility in teaching on topics beyond your own research focus, a willingness to work in interdisciplinary teams of teachers and the ability to offer inspiring lectures and tutorials in the BA, MA and minor programmes that aspire to a wide range of students.

Your experience and profile:
a PhD in the Arts / Humanities / Cultural Studies with a research focus on social practice in art;
international academic network in the relevant research areas;
research output commensurate with the level of the position;
active and ambitious researcher with a strong publication record;
affinity and experience with collaborating with public, private, and civil society partners in field of arts and the creative industries;
demonstrable ability and ambition to obtain external research grants;
wide and relevant teaching experience at BA and MA level;
excellent command (near-native fluency) of both Dutch and English: Non-native Dutch speakers must achieve both active and passive command of Dutch within two years (passing the state examination for Dutch as a Second Language programme II is a prerequisite for a permanent employment contract);
experience with digital and audiovisual teaching facilities and affinity with ICT in university teaching;
experience with valorization and practice-based education and/or research;
good team worker and versatile at all levels, capable of multidisciplinary co-operation;
excellent organisational experience and skills;
a University Teaching Qualification (UTQ), or willingness to acquire this within the first two years of the employment contract.

Research that entails collaboration with non-academic institutions and agencies in the Netherlands, Europe, and beyond is highly welcome.

What can we offer you?

We offer permanent employment upon a satisfactory evaluation following a temporary employment contract of a maximum of 18 months with a probationary period of two months. If you already have an employment contract with the UvA, we offer permanent employment upon a satisfactory evaluation following a temporary employment contract of a maximum of 12 months. The employment is for 38 hours per week. Preferred starting date is 01 September 2023.

The gross monthly salary, based on 38 hours per week, ranges between € 3.974 (scale 11) to € 6.181 (scale 12) dependent on relevant experience. This sum does not include the 8% holiday allowance and the 8,3% year-end allowance. A favourable tax agreement, the ‘30% ruling’, may apply to non-Dutch applicants. The Collective Labour Agreement of Dutch Universities is applicable.

We additionally offer:
the opportunity to collaborate in interdisciplinary teams;
excellent opportunities for study and personal development;
an inspiring academic and international working environment in the heart of Amsterdam.

About us

The University of Amsterdam is the Netherlands' largest university, offering the widest range of academic programmes. At the UvA, 42,000 students, 6,000 staff members and 3,000 PhD candidates study and work in a diverse range of fields, connected by a culture of curiosity.

The Faculty of Humanities provides education and conducts research with a strong international profile in a large number of disciplines in de field of language and culture. Located in the heart of Amsterdam, the faculty maintains close ties with many cultural institutes in the capital city. Research and teaching staff focus on interdisciplinary collaboration and are active in several teaching programmes.

Any questions?

For questions about this position or the department you may contact:
Prof. Kati Röttger, chair of the department Art and Culture

Job Application

If you feel the profile fits you, and you are interested in the job, we look forward to receiving your application. You can apply online . The deadline for applying for this vacancy is 24 April 2023.

Applications should include the following information (submitted in one .pdf):
a letter of motivation;
a detailed CV;
a list of publications;
the names and email addresses of two references who can provide letters of recommendation.

Only complete applications received within the response period will be considered.

The interviews will be held in the course of May 2023. A trial lecture may be part of the application procedure.

The UvA is an equal-opportunity employer. We prioritize diversity and are committed to creating an inclusive environment for everyone. We value a spirit of enquiry and perseverance, provide the space to keep asking questions, and promote a culture of curiosity and creativity.

No agencies please.",https://media.glassdoor.com/sql/987673/universiteit-van-amsterdam-squarelogo-1430982599318.png,Amsterdam,nan,Universiteit van Amsterdam
