job_titles,job_description,images,locations,salaries,companies
Professor of Architectural and Urban History,"Professor of Architectural and Urban History
Faculteit/Dienst: Faculteit der Geesteswetenschappen
Opleidingsniveau: Gepromoveerd
Functie type: Wetenschappelijk Personeel
Sluitingsdatum: 26 April 2023
Vacaturenummer: 11325
The Faculty of Humanities employs just under 1,000 employees, and approximately 8,000 students study there. The faculty consists of eight departments: Philosophy, Dutch Studies, Media Studies, Art and Cultural Studies, History, European Studies and Religious Studies, Amsterdam Centre for Ancient Studies and Archaeology, Modern Foreign Languages and Cultures, and Literature and Linguistics. Each department is composed of capacity groups, which consist of one or more professors and a number of employees who work in the relevant field.

The Department of Art and Cultural Studies has a vacancy for a full professorship in:

Architectural and Urban History 1,0 FTE (permanent position)

What will you do?

Context of the chair
The Professor of Architectural and Urban History is affiliated with the Amsterdam School of Historical Studies (ASH) and the Arts and Culture department (more specifically the Art History chair group). The basis for the chair is the historical approach of architecture from an art history perspective: this is of fundamental importance in order to ensure the necessary broad Humanities outlook for interdisciplinary research and teaching within and outside the UvA. In addition, the perspective will be broadened to include urban history, with special attention in the research dedicated to the experience of the urban environment; a more international interpretation that does not yet exist in the Netherlands. The new colleague to be appointed will therefore have architectural history experience with an added focus on contemporary urban history and urban design history, as well as the interplay between the built and natural environment, in which environmental history experience (the role of the historical city in its natural environment) is extremely desirable. The focus in this regard will be on a historical perspective that can be linked to modern-day problems of the urban and architectural living environment. This means that expertise in various approaches to the built environment, for example based on experience of the living environment (perception of the environment) will be expected.
The professor will be responsible, in particular, for teaching in the Bachelor’s and Master’s degrees in Art History, as well as in the Bachelor in Global Arts, Culture and Politics. The professor will play a significant role in both the teaching for the Master’s track Stadsgeschiedenis (Urban History) within the department of History, European Studies and Religious Studies and for various other degree programmes. In addition, the new professor is expected to undertake administrative tasks.

The chair will provide a strong starting point for the aforementioned collaborations within the University, but also with researchers and external institutions, such as Arcam, Het Nieuwe Instituut, the Cultural Heritage Agency, urban authorities and NGOs. The professor is expected to play a leading role in these types of collaborations.

Teaching
The professor will first be responsible for the Architectural History components within the Art History capacity group (capaciteitsgroep Kunstgeschiedenis). Architectural History is one of the four chair groups within the Art History capacity group, in addition to Medieval Art History (Middeleeuwse kunstgeschiedenis), Art History of the Early Modern Period (Kunstgeschiedenis van de nieuwere tijd), and Modern and Contemporary Art History (Moderne en hedendaagse kunstgeschiedenis). Approximately a quarter of the compulsory curriculum of the BA is therefore provided by the Architectural History chair group. In addition to these components, Architectural History also provides three successful BA specialisations, which can also be taken as electives (see also Minor): Ontwerpen voor de moderne stad (Designing for the Modern City); Dit is Amsterdam: identiteit en beeldvorming in kunst en architectuur (This is Amsterdam: identity and perception in art and architecture) and Reparatie en imitatie. Over het gebouwde erfgoed in het ‘eigentijdse’ Amsterdam. Over het gebouwde erfgoed in het 'eigentijdse' Amsterdam. (Repair and imitation. About the built heritage in ‘contemporary Amsterdam).

Secondly, the professor will make an important contribution to the minor Architectuur en Stedenbouw (minor in Architecture and Urban Planning). This is taken annually by approx. 20 students (mostly Human Geography, Urban and Regional Planning, and Geography students, in addition to students from other studies, including English, Economics, Communication Science, Philosophy, Sociology and Anthropology). The minor also provides a basis for the interdisciplinary Master’s track Stadsgeschiedenis (Urban History, department of History, European Studies and Religious Studies: approx. 5 minor students move on to this track annually. Finally, the professor will play an important role in the BA programme Global Arts, Culture and Politics, particularly the major in Sustainability).

Research
The professor will conduct research within the research school Amsterdam School of Historical Studies (ASH). It is important for the research school that the professor’s research ties in with the new methodological and theoretical developments within architectural history that also considers, in addition to the built environment, the urban perception of the environment from a social perspective and sensory experience. An additional expertise in the interplay between the built and natural environment is desirable. The new professor will take a central position within the Centre for Urban History within ASH. This centre has developed into an important pillar within ASH for interdisciplinary research into the history of the city from antiquity to the present day, with approximately 35 staff members from various disciplines. The professor is expected to assume a connecting and guiding role within this centre. In addition, the professor will be responsible for setting up broad interdisciplinary collaborations with researchers within the Faculty of Humanities (FGw) and the University of Amsterdam (UvA), for example with Urban Studies within the Faculty of Social and Behavioural Sciences (FMG), leading to individual or group applications for research financing (ERC, NWO, NWA, etc.). In addition, an international orientation (with corresponding network) is desirable in order to guarantee the leading role of the chair in Amsterdam within a field that is increasingly globally oriented.
The newly appointed professor is further expected to have knowledge of contemporary, innovative and digital research methods, which provide insight into issues about the digital built environment, the digital city (also an important theme within the MA track Urban History) and the living environment, and to collaborate with researchers in Creative Amsterdam: An E-Humanities perspective, and the 4D-Research Lab.

It is expected that the professor to be appointed will be able to enthuse and mentor young researchers; that the professor will have experience in PhD supervision and be able to contribute to creating a safe and stimulating environment for PhD candidates. The professor will also bear responsibility for actively recruiting PhD candidates by means of submitting grant applications in the Netherlands and abroad.

Leadership
The professor to be appointed will preside over the Architectural History chair group with five staff members, which will include two lecturers, a professor by special appointment and two assistant professors, and will have to perform administrative duties at the level of the educational administration (programme director BA of MA), research organisation (e.g. research director of ASH or the national research school for art history) and/or at departmental level (capacity group chair Art History, departmental chair Arts and Culture). Expansion of the administrative capacity is needed within these various levels. Given the desire to create an environment for employees and students that is safe and inclusive, it is of vital importance that the professor to be appointed possesses organisational sensitivity and exercises leadership that is appropriate in this regard.

Your tasks and responsibilities:
teaching Architectural and Urban History, including supervising Bachelor’s and Master’s theses;
contributing to innovation and improvement of the curriculum in the field of Architectural and Urban History;
addressing research themes and projects within the chair group and research groups;
actively pursuing external funding for research, notably funding from research councils, on national as well as European level;
carrying out HR responsibilities within the Architectural History chair group;
carrying out administrative and management tasks within the Department and Faculty.

What expertise do we require of you?

Successful candidates for the position are expected to meet the following requirements.
You:
hold a PhD in Architectural History or a related academic field;
have an excellent international academic reputation and publication profile, which match the research themes of ASH;
have an affinity with inclusive, polyphonous historical scholarship and digital methods;
are an experienced and engaged teacher at all levels of academic training;
have expertise in developing and renewing teaching programmes at Bachelor’s and Master’s levels;
can show a track record of applying for/acquiring external research funding;
have experience with attracting and supervising PhD projects and junior researchers;
have proven management and leadership qualities and are a dedicated administrator;
have a broad national and international network with academic and cultural institutions;
have an affinity with outreach and knowledge exchange beyond academic settings;
have a Dutch Basic Teaching Qualification, or a willingness to acquire one within the first two years of your appointment;
have a good command of Dutch and English. If you are not fluent in Dutch, you have a willingness to pass the State Exam Dutch as a Second Language (NT2), programme II within two years of the employment contract. The Faculty will assist in this process.

Please also check the document ‘Information about chairs at the Faculty of Humanities’ for more information.
We are committed to a culturally and intellectually diverse academic community and are especially interested in candidates who can contribute, through their research, teaching and/or service, to this mission. We particularly encourage people from underrepresented groups to apply.

Our offer

The appointment will be permanent. The gross salary will normally conform to professorial scale 2, between € 6,099 and € 8,881 gross per month (€ 85,117 - € 123,943 per annum, including 8% holiday pay and an 8.3% end-of-year payment) on a full-time basis (38 hours per week) in accordance with the Collective Labour Agreement for Dutch Universities (CAO NU). In certain cases, however, different terms of employment may be offered.

Curious about our organisation and attractive fringe benefits, such as a generous holiday arrangement and development opportunities? Read more about working at the University of Amsterdam.

About us

The University of Amsterdam is the Netherlands' largest university, offering the widest range of academic programmes. At the UvA, 42,000 students, 6,000 staff members and 3,000 PhD candidates study and work in a diverse range of fields, connected by a culture of curiosity.

The Faculty of Humanities provides education and conducts research with a strong international profile in a large number of disciplines in the field of language and culture. Located in the heart of Amsterdam, the faculty maintains close ties with many cultural institutes in the capital city. Research and teaching staff focus on interdisciplinary collaboration and are active in several teaching programmes.
Any questions?

Do you have any questions or do you require additional information? Please contact (during office hours):
for questions about the profile: Prof. Kati Röttger, chair of the Department of Art and Cultural Studies;
for procedural questions: Charlotte Jalvingh, secretary of the selection committee.

Job Application

Do you recognise yourself in the job profile? Then we look forward to receiving your application, addressed to The Dean of the Faculty of Humanities, Prof. Marieke de Goede.
You can apply online . Applications in Dutch or English, including a motivation letter, a detailed CV and a list of publications, should be submitted as a single PDF file.
The response period will close on 26 April 2023. Only complete applications received within the response period will be considered.

Applications will be received by a selection committee headed by the chair of the Department of Art and Cultural Studies, Prof. Kati Röttger. Following a procedure which may involve a formal leadership assessment and a trial lecture, the committee will make its final recommendation to the Dean of the Faculty of Humanities. The first interviews will be held around June 2023.

The UvA is an equal-opportunity employer. We prioritize diversity and are committed to creating an inclusive environment for everyone. We value a spirit of enquiry and perseverance, provide the space to keep asking questions, and promote a culture of curiosity and creativity.

No agencies please.",https://media.glassdoor.com/sql/987673/universiteit-van-amsterdam-squarelogo-1430982599318.png,Amsterdam,€6K (Employer est.),Universiteit van Amsterdam
Postdoctoral researcher studying the institutional forms of societal trust in the digital society,"Postdoctoral researcher studying the institutional forms of societal trust in the digital society
Faculteit/Dienst: Faculteit der Rechtsgeleerdheid
Opleidingsniveau: Gepromoveerd
Functie type: Wetenschappelijk Personeel
Sluitingsdatum: 15.04.2023
Vacaturenummer: 11262
The Faculty of Law, Institute for Information Law (IViR), and the University Research Priority Area on Trust in the Digital Society (TRUST RPA: https://www.ivir.nl/trust-in-the-digital-society-new-uva-research-priority-area/ ) is looking for a postdoctoral researcher to study the institutional safeguards of trustworthy centralized and decentralized techno-social infrastructures.

The TRUST RPA is a five year long interdisciplinary research initiative to study how we trust is changing due to the emergence of new trust production technologies, and the disruption of existing trust relations.

The digital society relies on an ever-expanding network of digital infrastructures. This forces us to rethink some of our basic assumptions about one of the most fundamental resources in all interpersonal, social, economic relations: trust.
Despite their widespread use, we know little about the trustworthiness of our digital infrastructures. At best it is difficult to establish their trustworthiness (such as with AI), at worst they are proven to be untrustworthy (as is the case with social media).
Some of these digital infrastructures play key roles in interpersonal and societal trust dynamics. They disrupt existing trust relations and offer new ways to trust each other.
Our scientific methods and theories face serious limits when it comes to the study of change of social structures, institutions, and processes under the conditions of rapid technological transformation. Research on trust in technology and trust by technology is siloed, and focuses on narrowly defined technologies (AI), or problems (system security), and lacks a comprehensive, multidisciplinary, long-term-view.

This postdoctoral position (embedded in the TRUST RPA, supervised by both the Institute for Information Law, at the Amsterdam Law School, and at least one other participating faculty) will use empirical research to study how various new technological infrastructures disrupt or can enhance existing societal (impersonal, institutional) trust relations and strive to establish new forms of trust relations in society.

What are you going to do?

 The successful candidate will:
Conduct empirical, qualitative research (interviews, case studies, discourse analysis) on the dynamics of institutional, impersonal trust with regards to emerging digital technologies, such as digital platforms, web3 technologies, or Machine Learning based automated systems.
Coordinate the development, fieldwork and initial analysis of a large-scale longitudinal survey
Conduct work on the emerging European technology regulation framework (Digital Services Act, AI Act, Digital Markets Act) using doctrinal research, normative research and discourse analysis
Organize events, conferences
Participate in grant proposal development, international network building
Acquiree funding

The Postdoctoral researcher will be hired by the Faculty of Law, closely collaborating with two other postdoctoral researchers in the Trust RPA. The team will be supervised by the PIs of the TRUS RPA: Balazs Bodo, Associate Professor at the Institute of Information Law (IViR) at the Faculty of Law, Jan B. Engelmann, Professor of Neuroeconomics at the Amsterdam School of Economics, Theo Araujo, Associate Professor Communication in the Digital Society at the Amsterdam School of Communication Research (ASCoR), Tom van Engers, Professor in Legal Knowledge Management at the University of Amsterdam, and Marc Tuters, Assistant Professor in the New Media and Digital Culture Division of Media Studies at the Faculty of Humanities.

What do we require of you?

 The successful candidate has:
a PhD degree in law, or social sciences (sociology, economics, political science, communication science, science and technology studies or related fields)
strong empirical research skills;
familiarity with qualitative research methods,
familiarity with doctrinal research or policy research;
good knowledge of current developments in information markets and technology;
academic excellence, as shown in the grade transcripts and curriculum vitae.
a creative mind and analytical intelligence;
an interest in working in a multidisciplinary team;
willingness to learn new knowledge, and acquire new skills required by the project;
excellent written and spoken command of English, and ideally knowledge of Dutch
interest in working on interdisciplinary topics, in interdisciplinary teams.

Candidates, who have:
quantitative skills, including survey development, statistical analysis, and/or
familiarity with R, python or any other programming language, and/or
big data collection and analysis skills, and/or
previous experience in the private or public sector

will be given extra consideration in the application process.

We strongly encourage members of broadly understood minority socio-cultural groups to apply. We believe that there are several traditionally underrepresented, but incredibly forceful perspectives, that have transformed our respective disciplines. Recent scholarship by persons of colour, feminist, intersectionalist scholars, scholars from the Global South have highlighted fundamental issues with the design, operation, and impact of techno-social systems that remained in the blind spots of mainstream scholarship. Without such contributions, serious problems, such as racial bias in AI systems, would have gone unnoticed and left unaddressed by more careful technical design and better regulation.

Our offer

We offer a temporary employment contract for 38 hours per week for a period of 36 months with a probationary period of two months. The preferred starting date is as soon possible.
The gross monthly salary, based on 30,4 -38 (0.8-1 FTE) hours per week and dependent on relevant experience, ranges between € 2,960 to € 4,670 (scale 10). UvA additionally offers an extensive package of secondary benefits, including 8% holiday allowance and a year-end bonus of 8.3%. The UFO profile Researcher 4 is applicable. A favourable tax agreement, the ‘30% ruling’, may apply to non-Dutch applicants. The Collective Labour Agreement of Universities of the Netherlands is applicable.

Besides the salary and a vibrant and challenging environment we offer you multiple fringe benefits:
232 holiday hours per year (based on fulltime) and extra holidays between Christmas and 1 January;
Multiple courses to follow from our Teaching and Learning Centre;
Multiple courses on topics such as leadership for academic staff;
Multiple courses on topics such as time management, handling stress and an online learning platform with 100+ different courses;
7 weeks birth leave (partner leave) with 100% salary;
Partly paid parental leave;
The possibility to set up a workplace at home;
A pension at ABP for which UvA pays two third part of the contribution;
The possibility to follow courses to learn Dutch;

What else do we offer
the possibility to start up and grow a New Research priority Area at the UvA,
close working relations with five faculties of the UvA; and with TU Delft, and Erasmus University, Rotterdam
freedom to develop your own research agenda;
welcoming, international, dynamic teams;
an inspiring academic and professional environment in the heart of Amsterdam;
excellent possibilities for further professional development and education.

About us

The Institute for Information Law (IViR), officially established in 1989, is one of the largest research centers in the field of information law in the world. The Institute employs over 35 researchers who are active in an entire spectrum of information society related legal areas: intellectual property law, patents, telecommunications and broadcasting regulation, media law, Internet regulation, advertising law, domain names, freedom of expression, privacy, digital consumer issues, commercial speech, AI, blockchain, et cetera. The Institute engages in cutting-edge research into fundamental and topical aspects of information law, and provides a forum for critical debate about the social, cultural and political aspects of regulating information markets.

The Amsterdam Law School prides itself on its international orientation and strong social commitment. This is reflected by both its research and educational activities. The Amsterdam Law School offers three Bachelor’s programs, including the interdisciplinary English-language Bachelor Politics, Psychology, Law and Economics (PPLE) in cooperation with two other faculties, as well as a variety of Master's programs, several of which are taught exclusively in English (i.e. International and European Law, European Private Law, International Criminal Law, and Law & Finance). The Amsterdam Law School prepares students for a wide variety of legal careers including law firms, government, business and industry, the national and international judiciary, public service, human rights advocacy, and academia. With 5000 students and over 500 staff members, it is one of the largest law faculties in the Netherlands.

Dr. Balazs Bodo (Associate professor, Institute for Information Law (IViR), FdR) is a social scientist trained in economics and media studies. He has been a Fulbright fellow at Stanford Law School (2006/7) and the Berkman Center for Internet and Society at Harvard Law School (2012/13). He is currently leading the Blockchain and Society Policy Research Lab, an ERC Starting Grant-funded research group focusing on the legal and policy issues around decentralised techno-social infrastructures. Dr. Bodo regularly conducts big data-based qualitative studies, and is among the few socio-legal researchers at FdR who publish data sets and software code he develops in his empirical research.

Please read more about the Trust Research Priority Area here: https://www.ivir.nl/trust-in-the-digital-society-new-uva-research-priority-area/

Questions?

Do you have any questions, or do you require additional information? Please contact: Dr. Balazs Bodo

Job application

Do you recognize yourself in the job profile? Then we look forward to receiving your application by April 15th 2023.
Applications in .pdf should include:
a curriculum vitae;
a letter of motivation;
An academic writing sample in English (e.g., published book, journal article, PhD dissertation).
Draft research plan (2 pages maximum) on the topic of the call, including possible research questions, relevant literature, methods.

We will invite potential candidates for interviews within four weeks after the closing date.

The UvA is an equal-opportunity employer. We prioritise diversity and are committed to creating an inclusive environment for everyone. We value a spirit of enquiry and perseverance, provide the space to keep asking questions, and promote a culture of curiosity and creativity.

No agencies please.",https://media.glassdoor.com/sql/987673/universiteit-van-amsterdam-squarelogo-1430982599318.png,Amsterdam,€3K (Employer est.),Universiteit van Amsterdam
