job_titles,job_description,images,locations,salaries,companies
ASSOCIATE PROFESSOR (TENURE TRACK) IN HYBRID INTELLIGENCE,"Are you an enthusiastic researcher in topics related to AI systems that collaborate with people instead of replacing them? Then Vrije Universiteit Amsterdam would like to get to know you.


Location: AMSTERDAM

FTE: 0.8 - 1
Job description
Hybrid Intelligence is the discipline within AI research that studies the theory and development of intelligent systems that collaborate with people instead of replacing them. We are looking for a new colleague at the associate professor level to strengthen our research in Hybrid Intelligence. Examples of relevant areas of expertise are conversational AI, formal argumentation, computational social choice theory, multi-agent systems, plan recognition, safe and explainable reinforcement learning, explainable AI, computational game theory, causality, common-sense reasoning and AI in game playing, among others. Do not hesitate to apply if you have another area of expertise beyond this indicative list that is relevant to the study of Hybrid Intelligence. You will be closely aligned with the large 10 year, 20m€ Dutch national research programme on Hybrid Intelligence ( https://hybrid-intelligence-center.nl/ )
We are looking for a colleague who is a leader in the field, and can contribute to a stream of high quality publications in this area, acquire external research grants, conduct excellent teaching, and act as a bridge builder to other research groups in the Department. The position involves setting up a research line in this area. Hybrid Intelligence is also the distinguishing signature for our BSc and MSc programmes.

Your duties
You duties will involve research, education, and management (40%:40%:20%), including the following:
Setting up and leading a research line in the area of Hybrid Intelligence
Performing research in this field and be or become visible in the international community
Teaching courses in the Bachelor and Master Artificial Intelligence and other relevant programs
Supervision of Bachelor, Master, and PhD students
Initiating and contributing to research grant proposals and
Contributing to management tasks
Requirements
We will base our selection on the following components:
A PhD degree in Artificial Intelligence, Computer Science, or another relevant area;
An international research profile, demonstrated by publications in relevant journals and conferences;
Academic teaching experience including experience in the supervision of BSc and MSc theses;
Experience in the supervision of PhD students;
Experience with attracting research funding.
What are we offering?
A challenging position in a socially involved organization. On full-time basis the remuneration amounts to a minimum gross monthly salary of €5,506 (scale 13) and a maximum €6,702 (scale 13), depending on your education and experience. The job profile is based on the university job ranking system and is vacant for at least 0.8 FTE.
We offer a tenure track/career track position at the level of Associate Professor. A career plan to grow from Associate Professor 2 (profile Universitair Hoofddocent 2, salary scale 13) to Associate Professor 1 (profile Universitair Hoofddocent 1, salary scale 14) will be made and formalised in a tailored tenure track/career track agreement (with specific performance indicators).
The initial appointment will be for a period of 18 months (including 2 months probation) , which will be turned into a tenured position after the initial period when the performance indicators agreed at the start of the appointment are met.
The starting package will include:
Two PhD students in the Innovation PhD scheme (i.e., all our PhD-students are co-supervised with another member of the Department or equivalent).
Depending on seniority of the candidate, one career-track assistant professor position to be hired as part of the novel group.
Two Innovation PhD students per new permanent staff member.
The Department will apply for an AiNed Fellowship Grant for this position. This grant aims to attract internationally much sought after AI talent to Dutch academic research organizations by supporting universities in offering an attractive starting package. When granted, this will lead to three additional PhD student and/or PostDoc positions.
The further career growth trajectory may include the possibility to negotiate the assignment of an additional career-track assistant professor.
Additionally, Vrije Universiteit Amsterdam offers excellent fringe benefits and various schemes and regulations to promote a good work/life balance, such as:
a maximum of 41 days of annual leave based on full-time employment;
8% holiday allowance and 8.3% end-of-year bonus;
solid pension scheme (ABP);
contribution to commuting expenses;
good paid parental leave arrangement;
the possibility to work partly from home (hybrid working);
on campus child daycare, sport facilities, family support programs including: dual career workshops, Dutch language class, tax & insurance workshop (some might have additional costs);
certain tax benefits (30% ruling) might apply to international candidates;
help and assistance with relocation (international candidates).

About Vrije Universiteit Amsterdam
The ambition of Vrije Universiteit Amsterdam is clear: to contribute to a better world through outstanding education and ground-breaking research. We strive to be a university where personal development and commitment to society play a leading role. A university where people from different disciplines and backgrounds collaborate to achieve innovations and to generate new knowledge. Our teaching and research encompass the entire spectrum of academic endeavor – from the humanities, the social sciences and the natural sciences through to the life sciences and the medical sciences.


Vrije Universiteit Amsterdam is home to more than 30,000 students. We employ over 5,500 individuals. The VU campus is easily accessible and located in the heart of Amsterdam’s Zuidas district, a truly inspiring environment for teaching and research.


Diversity

We are an inclusive university community. Diversity is one of our most important values. We believe that engaging in international activities and welcoming students and staff from a wide variety of backgrounds enhances the quality of our education and research. We are always looking for people who can enrich our world with their own unique perspectives and experiences.


The Faculty of Science

The Faculty of Science inspires researchers and students to find sustainable solutions for complex societal issues. From forest fires to big data, from obesity to medicines and from molecules to the moon: our teaching and research programmes cover the full spectrum of the natural sciences. We share knowledge and experience with leading research institutes and industries, both here in the Netherlands and abroad.


Working at the Faculty of Science means working with students, PhD candidates and researchers, all with a clear focus on their field and a broad view of the world. We employ more than 1,250 staff members, and we are home to more than 11,000 students.


About the department

The VUA Department of Computer Science has approximately 250 members, including 50 tenured staff members and 90 PhD students. The tenured staff members form the basis for the functioning of the department. A tenured staff member is required to make significant contributions to the research and education programmes, and to spend effort on specific tasks at the department level.
Application
Are you interested in this position? Please apply via the application button and upload your curriculum vitae and cover letter until 13/04/2023. Please include in your application a motivation letter, your CV, a 1 page research statement and a 1 page teaching statement.


“We are looking to optimize diversity and gender-balance among our staff. In the case of equal suitability of candidates, we therefore will give preference to individuals who are complementary.”


Applications received by e-mail will not be processed.


Vacancy questions


If you have any questions regarding this vacancy, you may contact:


Name: Prof. Dr. Annette ten Teije

Position: Full Professor

E-mail: annette.ten.teije@vu.nl
Relocation support
If you have any questions regarding moving to Amsterdam and working at VU Amsterdam, you may contact:
Name: Sara Veldhorst

Position: Relocation Advisor

E-mail: internationalstaffsupport@vu.nl

No agencies",https://media.glassdoor.com/sql/140437/free-university-amsterdam-squarelogo.png,Amsterdam,€7K (Employer est.),Vrije Universiteit Amsterdam
PhD Candidate: Putting Transformative Theories of Education for Sustainability into Academic Practice,"Employment
0.8 - 1.0 FTE
Gross monthly salary
€ 2,541 - € 3,247
Required background
Research University Degree
Organizational unit
Faculty of Social Sciences
Application deadline
23 April 2023
Apply now
Are you interested in how higher education institutes (HEIs) can create an environment that promotes student well-being and learning? Are you interested in how university programmes can play their part in current planetary crises through education for sustainability? We have an opening for a PhD candidate devoted to transcending the disciplinary boundaries between transformative learning theories, the philosophy of social sciences and education for sustainability. Are you ready to play your part?


For decades, debates have stressed the various crises HEIs are currently facing. On the one hand, student well-being has come under pressure, as recent reports show that many students experience stress, academic pressure, and little attention for personal development. On the other, there is a vast discrepancy between knowledge building and building of wisdom or action, the so-called knowledge-action gap, particularly in the field of sustainability. While transformative education approaches have been designed to meet these challenges, they are often implemented outside of the regular programmes of HEIs and based on project funding, limiting their long-lasting potential.


This PhD project focuses on the design, implementation and impact on students of transformative education practices for sustainability at HEIs. In these practices, learning is conceptualised as action, taking place in context, and conducted together. In this project you will conceptualise and co-create learning environments by putting transformative theories of education for sustainability into regular academic practice. You will use both quantitative and qualitative methods. A more elaborate description of this project can be requested from Petrie or Saskia (see contact details below).


You will be employed at the Behavioural Science Institute (BSI), embedded in the Learning & Plasticity research programme. As a PhD candidate, you will work together with four researchers who have diverse disciplinary backgrounds (sustainability pedagogy, philosophy of behavioural sciences, student success and diversity in higher education, educational sciences). You will be asked to bridge these paradigms and you will have ample opportunity to further design your own PhD project.


As a PhD candidate, you will initiate, develop and execute several studies. You will write a PhD thesis to complete your project. You will participate in supervision meetings as well as staff meetings of the Learning & Plasticity department and other relevant research meetings. As part of the BSI Graduate School PhD programme, you will be expected to complete several courses related to the basic professional skills of scientific researchers such as presentation skills, scientific integrity, and data management. We will also encourage you to attend and present your work at relevant workshops and conferences. As part of your PhD position, you will have a 10% teaching load and the opportunity to work towards a university teaching qualification.
Profile
You hold a Master's or Research Master's degree in behavioural science, educational sciences, pedagogical sciences, philosophy of behavioural sciences, biology, or a related field.
You are able to critically reflect on theories in the field of social sciences and you are strong in conceptualisation.
You have an affinity for various research methods.
You have an affinity for interdisciplinary or transdisciplinary problems/work.
You are familiar with or would like to become familiar with research in higher education, transformative education and education for sustainability, student well-being and diversity.
You are a team player with good social skills, but are also able to work independently and proactively.
You have excellent written and spoken English language skills (required for scientific publishing).
We are
You will join the Learning and Plasticity group. The Learning and Plasticity group conducts fundamental and applied research on individual differences in the learning and development of children, teenagers and adolescents.

Individual differences lie at the heart of our research. We study variations between and within homogeneous age samples in order to describe, predict and explain how people learn and develop. We focus on both typically developing groups and samples with an atypical development in one or more areas (e.g. attention deficits, visual impairment, coordination disorder, giftedness).

Our research relates individual differences in learning and development to characteristics of the individual, the knowledge and skills they have to acquire and the context in which their learning and development takes place.

The outer ring of the doughnut chart represents the main application areas of our research. Each area comes with specific themes, which are prompted by either academic or societal relevance and shape the research questions we seek to answer. Examples include differentiated forms of teaching, learning, treatment and intervention, adaptive and dynamic assessments, and policy measures regarding equal opportunities and inclusive education.

The Learning and Plasticity group is part of the Behavioural Science Institute (BSI). BSI is a multidisciplinary research institute and one of three research institutes in the Faculty of Social Sciences at Radboud University.

Our researchers collaborate across the boundaries of psychology, educational science, and communication science. Our mission is to strengthen people through understanding the foundations of human behaviour, by creating synergy between different paradigms and by facilitating craftsmanship, curiosity and connection in academic research. BSI has seven research programmes covering three major research themes, namely human development, connection and health. BSI conducts fundamental as well as applied/translational research and has excellent facilities and support for lab and field research. Moreover, BSI is known for its successful graduate school and strong commitment to open science.

Radboud University
We want to get the best out of science, others and ourselves. Why? Because this is what the world around us desperately needs. Leading research and education make an indispensable contribution to a healthy, free world with equal opportunities for all. This is what unites the more than 24,000 students and 5,600 employees at Radboud University. And this requires even more talent, collaboration and lifelong learning. You have a part to play!
We offer
It concerns an employment for 0.8 (5 year contract) - 1.0 FTE (4 year contract).
The gross starting salary amounts to €2,541 per month based on a 38-hour working week, and will increase to €3,247 from the fourth year onwards (salary scale P).
You will receive 8% holiday allowance and 8.3% end-of-year bonus.
You will be employed for an initial period of 18 months, after which your performance will be evaluated. If the evaluation is positive, the contract will be extended by 2.5 years (4 year contract) or 3.5 years (5 year contract).
You will be able to use our Dual Career and Family Care Services. Our Dual Career and Family Care Officer can assist you with family-related support, help your partner or spouse prepare for the local labour market, provide customized support in their search for employment and help your family settle in Nijmegen.
Working for us means getting extra days off. In case of full-time employment, you can choose between 30 or 41 days of annual leave instead of the legally allotted 20.
Additional employment conditions
Work and science require good employment practices. This is reflected in Radboud University's primary and secondary employment conditions. You can make arrangements for the best possible work-life balance with flexible working hours, various leave arrangements and working from home. You are also able to compose part of your employment conditions yourself, for example, exchange income for extra leave days and receive a reimbursement for your sports subscription. And of course, we offer a good pension plan. You are given plenty of room and responsibility to develop your talents and realise your ambitions. Therefore, we provide various training and development schemes.
You have not yet given permission to place the required cookies. Accept the required cookies to view this content.
Show content
Would you like more information?
For questions about the position, please contact Saskia van Schaik, Assistant Professor at saskia.vanschaik@ru.nl. Alternatively, you can contact Petrie van der Zanden, Assistant Professor at petrie.vanderzanden@ru.nl.
Practical information and applying
You can apply until 23 April 2023, exclusively using the button below. Kindly address your application to Saskia van Schaik. Please fill in the application form and attach the following documents:
A letter of motivation.
Your CV.
The first round of interviews will take place on Monday 8 May. The second round of interviews will take place on Thursday 25 May. You would preferably begin employment on 1 September 2023.

We can imagine you're curious about our application procedure. It offers a rough outline of what you can expect during the application process, how we handle your personal data and how we deal with internal and external candidates.
Apply now Application deadline 23 April 2023",https://media.glassdoor.com/sql/651704/radboud-university-nijmegen-squareLogo-1633358102615.png,Nijmegen,€3K - €3K (Employer est.),Radboud Universiteit
