job_titles,job_description,images,locations,salaries,companies
Full Professor of History of Art and Architecture,"Employment
0.8 - 1.0 FTE
Gross monthly salary
€ 6,099 - € 8,881
Required background
PhD
Organizational unit
Faculty of Arts
Application deadline
02 May 2023
Apply now
Are you an innovative, experienced and inspiring scholar in the field of the history of art and architecture between 500-1500? Do your research and teaching explore cross-cultural connections and expand or complicate the geographical and cultural boundaries of the 'medieval'? As a full professor at Radboud University, you will join and lead a diverse group of dedicated scholars, shape the field of art and architectural history, and flourish in a friendly and vibrant academic community.

The History of Art section at Radboud University is looking for a Full Professor of History of Art and Architecture between 500-1500 CE (1,0 FTE). The position builds on the section's existing strengths, which includes visual and material culture of Europe after 1500 CE, architecture, and global modern and contemporary art.
You are an art historian whose research explores cross-cultural connections and links historical research to contemporary issues and practices, such as cultural heritage. Our section is especially interested in scholars whose research and teaching expand or complicate the geographical and cultural boundaries of the 'medieval', who incorporate new methodologies, and whose interests include Islamic Art and Architecture, materiality and craft (including modern material-technical research), or the social uses and sensory experiences of works of art.

As a Professor of History of Art and Architecture at Radboud University, you will build on your robust and innovative research agenda, track record of outstanding scholarly publications, and other academic achievements on an international level. You will develop cross-disciplinary collaborations through innovative teaching and research, mentoring, and forging links with students and faculty across the university and beyond. You will contribute to the development of courses on all levels, teach both introductory and specialised courses, and take part in study trips, which are integral to the curriculum. You will also participate in teaching in Faculty-wide minor programmes, such as Cultural Heritage and the Public, or Conflict and Cooperation in the Mediterranean World.

At Radboud University, you will take on a leadership role in your field of expertise and present a strong vision of its future development. You will play a dynamic and proactive role in the Radboud Institute for Culture and History (RICH), one of the Faculty's research institutes, contributing to its mission and research programme by participating in and further stimulating its research activities, publishing in high-impact journals and other research outlets, recruiting and supervising PhD candidates, mentoring junior faculty members, and applying for grants.

The professorship is part of the Department of History, Art History and Classics, one of three departments comprising the Faculty of Arts. You will represent the Art History section within the university and beyond, serve as its head in a rotating fashion with one other full professor, and work in close connection with its staff members and with the Department as a whole. You will be joining a university with expertise in Mediterranean Studies (both in the Faculty of Arts and the Faculty of Philosophy, Theology and Religious Studies). You will be expected to serve as a standard bearer for student recruitment, and take on a crucial role in the promotion and visibility of medieval visual and material cultures, both nationally and internationally.
Profile
You are an art historian with a specialisation in Art and Architecture between 500 and 1500 CE, who incorporates new methodologies as well as issues of cross-cultural connections and cultural heritage. You have a track record of international publications that demonstrate these interests.
You occupy a leadership position in your field(s) of expertise and have a global network of contacts in the academic and museum worlds.
You are committed to collaboration and forging connections between various art historical fields and institutes nationally and internationally, and between various sections and departments within the university.
You have been a recipient of important research grants and have clear plans for applying for grants in the near future.
You have ample experience in managing, mentoring and facilitating academic staff. You are familiar with the Dutch university system and are motivated to take on larger leadership roles in administration and management in accordance with the applicable rules and customs.
You are an inspiring lecturer with a strong teaching philosophy and experience in curriculum development at the undergraduate and graduate levels.
You have a university teaching qualification (UTQ) or an equivalent qualification, or are prepared to obtain a UTQ within two years.(*)
If Dutch is not your mother tongue, you should be willing to learn Dutch and obtain level B2 after 1 year and reach level C1 in the following year.(*)
(*) For both the UTQ and the Dutch language certification, we provide the necessary infrastructure and resources to acquire them.
We are
The Faculty of Arts is committed to knowledge production that will have a significant scientific and social impact. With over 500 academic and support staff, we teach and conduct research in the fields of history and art, languages and cultures, and linguistics and communication, using innovative methodologies and working in close collaboration between the disciplines. Our research is embedded in two research institutes: the Centre for Language Studies (CLS) and the Radboud Institute for Culture & History (RICH). We currently have approximatively 2,500 students, enrolled in three departments: the Department of History, Art History and Classics, the Department of Modern Languages and Cultures, and the Department of Language and Communication. We aim to contribute to a more sustainable and inclusive world, which is why we especially seek applications from candidates who bring diverse perspectives, backgrounds, and skills that will be assets to our study programmes and research profiles.

Radboud University
We want to get the best out of science, others and ourselves. Why? Because this is what the world around us desperately needs. Leading research and education make an indispensable contribution to a healthy, free world with equal opportunities for all. This is what unites the more than 24,000 students and 5,600 employees at Radboud University. And this requires even more talent, collaboration and lifelong learning. You have a part to play!
We offer
It concerns an employment for 0.8 - 1.0 FTE.
The gross monthly salary amounts to a minimum of €6,099 and a maximum of €8,881 based on a 38-hour working week, depending on previous education and number of years of relevant work experience (salary scale H2).
You will receive 8% holiday allowance and 8.3% end-of-year bonus.
It concerns a temporary contract of 18 months, followed by permanent employment after positive evaluation.
You will be able to use our Dual Career and Family Care Services. Our Dual Career and Family Care Officer can assist you with family-related support, help your partner or spouse prepare for the local labour market, provide customized support in their search for employment and help your family settle in Nijmegen.
Working for us means getting extra days off. In case of full-time employment, you can choose between 30 or 41 days of annual leave instead of the legally allotted 20.
Additional employment conditions
Work and science require good employment practices. This is reflected in Radboud University's primary and secondary employment conditions. You can make arrangements for the best possible work-life balance with flexible working hours, various leave arrangements and working from home. You are also able to compose part of your employment conditions yourself, for example, exchange income for extra leave days and receive a reimbursement for your sports subscription. And of course, we offer a good pension plan. You are given plenty of room and responsibility to develop your talents and realise your ambitions. Therefore, we provide various training and development schemes.
Would you like more information?
For questions about the position, please contact Prof. Jan Hein Furnée, Head of the Department History, Art History and Classics at or janhein.furnee@ru.nl.
Practical information and applying
You can apply until 2 May 2023, exclusively using the button below. Kindly address your application to Prof. Jan Hein Furnée. Please fill in the application form and attach the following documents:
A letter of motivation.
Your CV including a list of publications and the contact details of three references.
The first rounds of interviews will take place on Thursday 1 June. The second round of interviews will take place on Thursday 15 June. You would preferably begin employment between 1 September 2023 and 1 January 2024.

We can imagine you're curious about our application procedure. It offers a rough outline of what you can expect during the application process, how we handle your personal data and how we deal with internal and external candidates.
Apply now Application deadline 02 May 2023",https://media.glassdoor.com/sql/651704/radboud-university-nijmegen-squareLogo-1633358102615.png,Nijmegen,€6K - €9K (Employer est.),Radboud Universiteit
Assistant Professor Technology Enhanced Learning,"Key takeaways
Hours
38 hr.
Salary indication
Salary gross/monthly
based on full-time
€ 3,974 - € 6,181
Deadline
8 May 2023

We are looking for an excellent enthusiastic scholar to join the research and education at the section Instructional Technology (IST) and strengthen the area of Technology Enhanced Learning (TEL).

Research at IST is situated at the intersection of educational psychology, instructional design, and educational technology. The group distinguishes itself with a focus on innovative technology supported learning arrangements for learning STEM topics.

The general aim is to build an understanding of how educational psychological theory and innovative technologies can be combined to come to strong instructional designs that benefit student learning.

For example research at IST addresses the design and evaluation of instructional technology (e.g., reflection tools, virtual agents, learning dashboards) to support inquiry learning, collaborative learning, game-based and gamified learning, and self-regulated learning. Aside from the above there is a focus on the design of effective learning environments to accommodate differences between learners and improve outcomes. In general, educational psychological theories and principles of multimedia learning are employed to explain findings and extend theory. Expertise in these or closely related fields is very welcome.

We contribute to research, teaching, and knowledge valorisation. You will:

(co-)teach in our leading Master programmes of educational psychology (EP) and Educational Science and Technology (EST) and the Bachelor Psychology programme
guide students from these programmes in their graduation assignments
engage in cross-disciplinary collaboration with other groups in the department, the faculty and university
develop a network of academic and industrial research partners in the fields of technology enhanced learning
develop new lines of funded research with an emphasis on designing and investigating the effectiveness of technology enhanced learning environments
contribute towards the supervision of PhD students
Your profile
You have an education background (master) in a relevant area of research, such as Learning Sciences, Cognitive Psychology, Human-Computer Interaction, or a related subject area
You hold a PhD degree in a relevant field and have experience in research, which is apparent from publications in reputable academic journals, presentations in international scientific conferences, and other academic activities
You have experience acquiring external funding and possessing the drive to apply for external projects
You possess good communication skills and an excellent command of English (C1 or C2) and preferably also of the Dutch language
You possess a (equivalent of) University Teaching Qualification certificate, or are willing to obtain this, and have a real passion for, and the ambition to become a creative and effective teacher
Our offer
We offer a fulltime position (1.0 FTE) with a one-year probationary period with the prospect of a permanent contract
The starting salary, depending on your experience, ranges between € 3.974 to € 6.181 gross per month (in accordance with the Collective Labour Agreement for Dutch Universities), based on the job profile of Assistant Professor
Extras such as an 8,3% end-of-year bonus and 8% holiday allowance
Minimum of 29 holidays in case of full-time employment
An attractive pension scheme
Possibilities to save up holidays for sabbatical leave
Professional and personal development programmes
A family friendly institution, offering support for dual hiring
Information and application

Additional information regarding the position can be obtained from Prof. dr. Ton de Jong (a.j.m.dejong@utwente.nl, +31534893613). You are also invited to visit our homepage).

Please submit your application until May 8, by filling in the form including a motivation letter and current CV (choose ‘apply now’). Screening is part of the application process.

About the organisation

The Faculty of Behavioral, Management and Social sciences (BMS) aims to play a key role in understanding, jointly developing and evaluating innovations in society. Technological developments are the engine of innovation. As a technical university that puts people first, we tailor them to human needs and behavior and use social engineering to integrate them into society. We also ensure adequate governance at public and private level, and robust, inclusive and fair organizational structures. We do this by developing, sharing and applying high-quality knowledge in Psychology, Business Administration, Public Administration, Communication Sciences, Philosophy, Educational Sciences and Health Sciences. Our research and education in these disciplines revolves around tackling and solving societal challenges. The research programs of BMS are closely linked to the research of the UT institutes Mesa+ Institute for Nanotechnology, TechMed Center and Digital Society Institute.

As an employer, the Faculty of BMS offers work that matters. We equip you to create new possibilities for yourself and for our society. With us, you will become part of a leading technical university with increasing, positive social impact. We offer an open, inclusive and entrepreneurial atmosphere, in which we encourage you to make healthy choices, for example through our flexible, adaptable benefits.

Want to know more?
Jong, A.J.M. de (Ton)
Full Professor
Jong, A.J.M. de (Ton)
Full Professor
Do you have questions about this vacancy? Then you can contact Ton for all substantive questions about this position and the application procedure. For general questions about working for the UT, please refer to the chatbot.
Contact
Phone:+31534893613
Email:a.j.m.dejong@utwente.nl",https://media.glassdoor.com/sql/320105/university-of-twente-squarelogo-1433290124874.png,Enschede,€4K - €6K (Employer est.),Universiteit Twente
Lecturer of Modern Standard and Moroccan Arabic,"Vacaturenr.
13591
Functie-categorie
Wetenschappelijke functies
Omvang (fte)
1
Extern/intern
Extern
Locatie
Leiden
Geplaatst op
4 april 2023
Sluitingsdatum
30 april 2023
Lecturer of Modern Standard and Moroccan Arabic (1,0 fte)
Leiden University seeks to appoint a lecturer of Modern Standard and Moroccan Arabic (1,0 fte). We are looking for someone with native or near-native fluency in Modern Standard and Moroccan Arabic as well as English or Dutch, and experience in teaching Moroccan and Modern Standard Arabic language courses of all levels as well as for specific purposes at the university level.
Requirements
Applicants must have a Master’s degree, and preferably a Ph.D. in Arabic linguistics, literature, second-language pedagogy, North-African studies or a related field.
We seek candidates committed to excellence in teaching, who are collegial and well able to work in a team.
Demonstrated proficiency in current second/foreign language teaching methodologies (TAFL, and especially content-based and project-based instruction and the integration of culture in the curriculum) and meaningful application of technologies in language instruction are highly desirable. Candidates who have additional proficiency and experience in teaching Egyptian Arabic (besides Moroccan) and courses on North-African culture are especially encouraged to apply.
Tasks
designing and teaching Modern Standard and Moroccan Arabic language courses in cooperation with other faculty;
designing and administrating tests in cooperation with other faculty;
teaching courses in different programmes and at different levels;
participating in regular meetings of the Arabic language program and Middle East studies department, and engaging in professional development activities;
working in collaboration with faculty to develop and design the curriculum, to evaluate teaching goals, student outcomes and programmatic effectiveness;
contributing actively to the academic and social environment of the department.
Our organisation

The Faculty of Humanities is rich in expertise in fields such as philosophy, religious studies, history, art history, literature, linguistics and area studies covering nearly every region of the world. With its staff of 995, the faculty provides 27 master’s and 25 bachelor’s programmes for over 7,000 students based at locations in Leiden’s historic city centre and in modern buildings in The Hague. For more information: https://www.universiteitleiden.nl/en/humanities.

The Leiden Institute for Area Studies (https://www.hum.leiden.edu/lias/) is comprised of a School of Asian Studies, a School of Middle-Eastern Studies and a School of Religious Studies, with international staff and student populations. The institute is committed to a present-day vision of area studies, integrating disciplinary and regional-historical perspectives on a solid foundation of excellent language skills. Current staff in LIAS has expertise in the fields of Anthropology, Archaeology, Art Studies, Buddhist Studies, Film Studies, History, International Relations, Language Pedagogy, Law, Linguistics, Literary Studies, Material Culture Studies, Performance Studies, Philology, Philosophy, Political Economy, Religious Studies, Sociology, and Visual Culture.
Terms of employment
We offer a 12 months fulltime (38 hours per week) position as a lecturer to be taken up 1 August 2023.
Upon good performance the position will be converted into a permanent postion. Salary range from €2.960.- to €4.670.- gross per month (pay scale 10), in accordance with the Collective Labour Agreement for Dutch Universities.
Diversity
Leiden University is strongly committed to diversity within its community and especially welcomes applications from members of underrepresented groups.
Information
Enquiries can be made to Dr. H.I.A.A. Ahmed (h.i.a.a.ahmed@hum.leidenuniv.nl) and to prof.dr. P.M. Sijpesteijn (p.m.sijpesteijn@hum.leidenuniv.nl).
Please submit online your application no later than 30 April 2023 via the blue button inour application system.
The interviews with shortlisted candidates are tentatively scheduled for the second week of May 2023.
Applications should be in English. Please ensure that you include the following documents in a single PDF document named ‘FAMILY NAME – Given name – vacancy number and in this order:
Cover letter addressing the motivation to join our teacher-scholar community;
Curriculum vitae including contact information for three professional references who have agreed to write reference letters;
Teaching statement including a plan to establish an inclusive learning environment;
Sample undergraduate courses for at least two courses in Arabic language acquisition that you have taught;
Teaching evaluations including written comments or other evidence of effective student engagement.",https://media.glassdoor.com/sql/239477/leiden-university-squarelogo.png,Leiden,nan,Universiteit Leiden
