job_titles,job_description,images,locations,salaries,companies
Social & Content Marketeer bij Urban Arrow,"Company Name
 Urban Arrow
Categorie
 Marketing & Communicatie
Plaats
 Amsterdam, Nederland
Werktijden
 40
Education
 HBO
Wat ga je doen
Team Marketing
Amsterdam, 40 uur
Ben jij die energieke en enthousiaste zelfstarter die alles weet van social en content marketing? Ben je daarnaast creatief, een vlotte schrijver en werk jij graag mee aan onze internationale groeistrategie? Leuk!
Dan zien wij een match aankomen.
Binnen het marketing team zijn we op zoek naar een enthousiaste aanpakker voor de rol van Social en Content Marketeer.
In deze rol ga jij on-brand content creëren en implementeren in de kanalen van Urban Arrow.
Verantwoordelijkheden en taken
In deze rol ben je verantwoordelijk voor de groei- en contentstrategie van de Urban Arrow social media kanalen binnen de totale marketingstrategie.
Je creëert content voor onze verschillende communicatiedoelgroepen, van blogs en social media posts tot content voor onze website en nieuwsbrieven.
Je vindt het leuk om te schrijven én creatieve content te bedenken en bent owner van de contentkalender.
Je blijft in direct contact met onze online community.
Je bent verantwoordelijk voor onze influencer strategie en hiervoor zorg je uiteraard voor gave samenwerkingen met relevante influencers.
Je weet precies wat er over Urban Arrow geschreven en gepubliceerd wordt en analyseert elk kwartaal onze social media resultaten in de vorm van een kwartaalrapportage.
Heb je sterke projectmanagement skills? Mooi, deze kan je goed gebruiken bij het zelf organiseren van foto- en video shoots, uiteraard passend bij de merkstrategie van Urban Arrow. Hiervoor werk je samen met externe bureaus en fotografen en ben jij uiteindelijk verantwoordelijk voor de implementatie van alle hieruit voortkomende content binnen de kanalen van Urban Arrow én onze dealers.
Oftewel; een mega veelzijdige en creatieve functie waarbij je veel ballen in de lucht kan en mag houden.
Wat vragen we van jou
Wat breng je mee?
Je hebt een afgeronde HBO/WO opleiding in de richting van marketing, communicatie en/of journalistiek.
Je hebt 3 – 5 jaar relevante werkervaring in social media en content marketing.
Je hebt ervaring in het bouwen van campagnes, community management en content creatie.
Je hebt ervaring met het opzetten en het monitoren van een social media strategie voor onder andere Instagram, Facebook en LinkedIn.
Je bent verantwoordelijk voor maandelijkse rapportages en initiëren van bijsturende acties op basis vastgestelde KPI's.
Je bent zowel in het Nederlands als Engels creatief met taal en je bent in staat om onze tone-of-voice eigen te maken en toe te passen.
Kennis van de Duitse taal is een pré.
Je bent sterk in project management en hebt ervaring in het organiseren van kleinere en grotere producties voor fotografie en video.
Je zal gaan werken voor onze Family producten én onze Business Bikes. Er zijn dus meerdere doelgroepen waarvoor je content gaat bedenken en creëren.
In deze rol rapporteer je aan de Marketing Manager.
Hier herken jij je in:
Je beschikt over uitstekende communicatieve vaardigheden met een positieve tone of voice
Je communiceert makkelijk, zowel intern als extern
Jouw werkwijze is inspirerend en enthousiasmerend
Creatief en resultaatgericht
Sociaal, optimistisch en zelfverzekerd vormen een deal van jouw DNA
Wat bieden wij
Wat bieden wij?
Je wordt onderdeel van de snelst groeiende producent van elektrische transportfietsen ter wereld.
Een kans om bij te dragen aan de stad van de toekomst; het terugdringen van busjes en auto's en het bereikbaar houden van de stad.
Een team met zeer gemotiveerde en enthousiaste collega's waarbinnen we naast hard werken ook dagelijks een lolletje maken.
Een open en eerlijke bedrijfscultuur waarbinnen we ruimte bieden voor jouw talent en ontwikkeling.
Laptop / telefoon
Pensioen
De mogelijkheid om extra vakantiedagen te kopen.
Toffe Vrimibo en gave team / bedrijfsuitjes.
Een Urban Arrow family of Shorty lease fiets voor eigen gebruik;
Een spiksplinternieuw kantoor met eigen dakterras, gezonde lunch en goeie koffie.
Over de organisatie
Nieuwsgierig geworden naar wie wij zijn?
Sinds 2010 heeft Urban Arrow de markt voor Smart Urban Mobility opengebroken. Met de introductie van onze elektrische transportfiets bouwen wij hèt stedelijke voertuig voor de toekomst, en daar zijn we trots op!
Om voorloper te blijven moeten we onszelf opnieuw willen en durven uitvinden. Dit doen we door te blijven innoveren en kwaliteit voorop te stellen. Onze doelstelling is duidelijk; werken met Urban Arrow is tof; a pleasure to deal with.
Overige informatie
Iets voor jou?
Ben je enthousiast geworden? Leuk!
Laat ons weten wie je bent en solliciteer met je cv en een korte, persoonlijke motivatie.
Doe vooral niet te formeel; wij zijn benieuwd naar jou!
Deel vooral alles waarvan je denkt dat wij het moeten weten. Projecten waar je trots op bent, je favoriete hobby... Kom maar door!
Wij kijken uit naar je sollicitatie!
Vragen? Neem gerust contact op met onze Recruiter Linda via jobs@urbanarrow.com
Je kan voor deze rol alleen solliciteren als je in Nederland woont en de Nederlandse taal uitstekend beheerst.",https://media.glassdoor.com/sql/20558/pon-squarelogo.png,Amsterdam,nan,Urban Arrow
Stagiair(e) Brand & Content,"Heb je een passie voor interieur en content marketing, heb je gevoel voor stijl en ben je daarnaast gek op mooie producten voor in huis? Team Brand & Content heeft 3 stageplekken beschikbaar: Communicatie & PR, Graphic Design en Content Creatie & Productie.

Het team Brand & Content bestaat momenteel uit zeven gedreven enthousiaste collega's die net als jij passie hebben voor communicatie, beeld, design, marketing, drukwerk, fotografie, digitale media, e-commerce en alles wat daarmee te maken heeft. Dit creatieve team bewaakt de merkbeleving en huisstijl van fonQ, staat regelmatig in de fotostudio om mooie plaatjes en video’s te schieten en runt de redactie van inspiratieplatform en fonQ magazine.

Over fonQ
Specialistisch, inspirerend en behulpzaam: als dé online woonspecialist van Nederland en Vlaanderen willen we alle huizen wat fonQ geven. Wij zorgen met elkaar voor de leukste klantreis binnen Home & Living en onze specialisten helpen je graag bij het inrichten van je huis. Want met onze uitgebreide collectie, inspiratie, advies en excellente service maken wij het shoppen in Home & Living leuk en gemakkelijk! Als ambitieuze e-commerce organisatie in Home & Living zijn wij continu op zoek naar de beste specialisten in hun vakgebied. Ook als je dat nog niet (helemaal) bent, helpen wij jou graag om jouw potentieel te ontdekken en verder te ontwikkelen. Wij bieden je een fijne werkplek in een dynamische omgeving, waarin geen week hetzelfde is. Geef jezelf én je carrière wat fonQ!
Communicatie & PR
Tijdens deze stage ben je onderdeel van de redactie voor het fonQ inspiratieplatform en het magazine. Je volgt een studie in de richting van communicatie, marketing of journalistiek, hebt een vlotte pen en een goed gevoel voor beeld en merk. Je schrijft blogs en persberichten, denkt mee over de inhoud van artikelen en houd je bezig met de planning en copy op de social media kanalen.

Graphic Design

Tijdens deze meewerkstage leer je creatieve concepten op te maken voor o.a. de merkuitingen en campagnes van fonQ. Naast creatieve designs, voor bijvoorbeeld social media en drukwerk, ondersteun je ook de (design)afdeling met de dagelijkse bezigheden. Het is de uitdaging om commerciële briefings te vertalen naar frisse en aantrekkelijke designs. Je volgt een creatieve design opleiding zoals Communicatie en Multimedia Design en hebt al kennis van Indesign, Photoshop en Illustrator.

Content Creatie & Productie
Deze stage is voor de echte creatieve duizendpoot: je ontwikkelt creatieve concepten en draait mee met de productie van fotoshoots en video-content. Je bent de rechterhand van onze Content Creators, hebt gevoel voor styling en werkt projectmatig mee aan onze producties. Je maakt draaiboeken, productlijsten en moodboards en schakelt met interne en externe stakeholders. Je volgt een creatieve opleiding en staat zelf ook graag achter de camera, zodat je ook zelfstandig aan de slag kan met content voor social media, zoals Reels en TikTok video’s.
Hier herken jij jezelf in
Je volgt een passende hbo-opleiding, in de richting van communicatie, media of design
Een goed gevoel voor marketing, beeld en oog voor (woon)trends
Ervaring met verschillende social media kanalen
Goede beheersing van de Nederlandse taal
Zelfstandig en proactief
Minimaal 4 dagen in de week beschikbaar

Beschikbaar voor een meewerkstage van september tot en met januari 2024

Herken jij jezelf in één van deze profielen en wil jij onderdeel zijn van team Brand & Content? Reageer dan snel en laat in je motivatie weten welke richting (Communicatie & PR, Graphic Design of Content Creatie & Productie) het beste bij jou past!",https://media.glassdoor.com/sql/703334/fonq-squarelogo-1580979801843.png,Utrecht,nan,fonQ
Copywriter,"Hoi copywriter! Maak jij van al onze webshop zoekers, blije boekers? Oftewel: halen jouw vlijmscherpe, wakkere (product)teksten onze consumenten sneller over die streep voor een aankoop? Dan begrijp jij dat schrijven meer is dan een paar letters op papier kwakken. Daarom zoeken wij jou voor onze vacature.

Jij weet als geen ander dat copywriting beïnvloeden, overtuigen, optimaliseren en verleiden is. Wat jij daarom het allerliefste doet? Converterende copy en sturende teksten creëren die écht binnenkomen in het brein van consumenten.
Als copywriter in de creatieve studio van het Beter Bed Marketing Team draait alles om jouw allround skills met woorden. Rake copy, geschreven zoals maar weinigen dat kunnen. Jij bijt je vooral vast in de productteksten van onze verschillende webshops en marketplace kanalen zoals Bol, Wehkamp en Amazon. Jij vertaalt saaie productspecificaties en vaktermen om naar killerteksten. Hoi conversieboost!
Voor het schrijven van deze tot de verbeelding sprekende copy, vind jij je weg bij collega-afdelingen voor de juiste input. Sterker nog, jij verbetert dit proces waar kan, omdat hier dé basis van jouw vingerlikkende copy ligt.
Naast converterende productcopy tik jij met liefde een blogartikel over snurkende bedpartners, broed je samen met je collega copywriter op een ijzersterke pay off voor een nieuw matrassenmerk óf verdiep je je in een videoscript voor een rake productvideo. Lekker divers.
Wat ga je doen?
Jij bent copy eindbaas over alle productteksten van de verschillende webshops én marketplace kanalen
Je schrijft converterende copy voor nieuwe producten op basis van productspecificaties
Je optimaliseert bestaande productteksten
Je coördineert en verbetert de afstemming met andere afdelingen voor de benodigde input van jouw killerteksten
Je houdt rekening met de tone of voice per formule en past deze piekfijn toe in je copy
Je ondersteunt bij de creatie van diverse, inspirerende copy die onze doelgroepen écht raakt zoals blogartikelen, social media teksten, nieuwsbrieven en SEO teksten.
Wie ben jij?
Jij hebt een afgeronde mbo of hbo opleiding, studierichting journalistiek, communicatie of marketing
Jij hebt minimaal 3 jaar werkervaring als copywriter/tekstschrijver
Jij bent creatief en geniaal met woorden
Jij bent niet te genieten wanneer iemand een spel of tikfout uit je copy vist
Jij wordt niet zenuwachtig van deadlines en snel schakelen
Heb jij ervaring in productcopy? Worden wij extra blij van!
Jij hebt ervaring met het schrijven van verschillende copy zoals blogartikelen, social media teksten, copy voor websites, SEO teksten of nieuwsbrieven.
Wij bieden jou:
Een enthousiast en leuk team vol specialisten (al zeggen we het zelf)
Afwisseling, uitdaging en verantwoordelijkheid
Altijd ruimte voor eigen initiatieven en ideeën. Kom maar doorrr!
Een marktconform salaris en reiskostenvergoeding
Een goede nachtrust ;-)
Over Beter Bed


Werken bij Beter Bed betekent werken bij dé marktleider op het gebied van slapen. Een succesvolle, groeiende onderneming waarin we samen werken in een open en resultaatgerichte omgeving. Of het nu gaat om ons hoofdkantoor, de winkels, het magazijn of onze vrachtwagens. Er is volop ruimte voor nieuwe initiatieven en ideeën met aandacht voor ieders ontwikkeling én veel gezelligheid. Wil jij samen met ons bouwen aan onze succesformule en het verschil maken om onze klanten iedere dag beter te laten slapen?
Beter Bed is begin jaren '80 opgericht met de opening van twee slaapspeciaalzaken in Nederland. Sinds 1996 zijn we beursgenoteerd en in de jaren die volgden groeiden we uit tot toonaangevende slaapspecialist voor de beste rust- en slaapbeleving. Met persoonlijke aandacht en een uitgebreid, innovatief en slim gepositioneerd assortiment creëren we voor iedereen de beste rust- en slaapbeleving. Dag en nacht.
Dit doen we dagelijks samen met ruim 1100 collega’s vanuit 90 winkels in Nederland en België, 3 distributiecentra en het hoofdkantoor in Uden. Een superteam waarmee we het beste uit onszelf én anderen halen en waar altijd ruimte is voor meer talent. Want ambitieuze plannen, die hebben we genoeg.
Enthousiast?
Stuur een WhatsApp bericht naar (+31) 413 33 89 35
Of mail naar hr@beterbed.nl
Of solliciteer via www.werkenbijbeterbed.nl",https://media.glassdoor.com/sql/40978/beter-bed-squarelogo-1462883494372.png,Uden,nan,Beterbed
Social stage Metronieuws.nl,"Voor de social functie zoeken we iemand die toffe social-content gaat maken voor onze social kanalen Instagram, Facebook, Twitter en LinkedIn. Je bedenkt en post content op onze social platformen, modereert de reacties op die content en maakt social analyses.
Wat is Metronieuws.nl?
Tijdens het begin van de pandemie is er een einde gekomen aan de krant Metro. Jammer voor de liefhebber van papier, maar het brengt ook veel nieuwe mogelijkheden met zich mee. In het afgelopen jaar hebben we Metro fors kunnen uitbouwen naar een online merk met een miljoenenpubliek. We brengen nieuws dat verbazing, verwondering, vertedering wekt, of een glimlach losmaakt.
Stage lopen bij Metro? Dit ga je doen!
Als social stagiair(e) draai je volop mee in ons redactieteam. Je gaat helpen om ervoor te zorgen dat onze verhalen zo veel mogelijk impact en bereik generen. Je helpt mee met het verzorgen van de content op onze socials. Daarnaast krijg je je eigen verantwoordelijkheden en help je onze platformen verder groeien.
Herken je jezelf in dit profiel?
– Je studeert Journalistiek of een andere relevante HBO- of WO-opleiding;
– Je bent op de hoogte van wat er speelt en hebt creatieve social-ideeën voor content dat past bij het nieuws van de dag;
– Je kunt goed schrijven en social media kent voor jou geen geheimen;
– Je bent enthousiast, gedreven en hebt er bovenal heel veel zin in!
Wat bieden wij jou?
Je maakt onderdeel uit van een klein, maar hecht team. We leren je de kneepjes van de online journalistiek en je krijgt de kans om eigen ideeën/strategieën uit te rollen op een landelijke nieuwssite.
Uiteraard krijg je een stagevergoeding.
Periode:
Ben jij beschikbaar voor een periode van minimaal drie maanden? Dan zien we jouw motivatie, cv en een aantal stukken van jouw hand graag tegemoet. Voor vragen kun je contact opnemen met recruitment@mediahuis.nl of telefonisch via 088 824 7721. Bij interesse zien we jouw sollicitatie graag tegemoet via de solliciteer button.",https://media.glassdoor.com/sql/6527/metro-wholesale-and-food-specialist-squarelogo-1501257804949.png,Amsterdam,nan,Metro
