job_titles,job_description,images,locations,salaries,companies
"Studentstage (advocatuur, notarieel en fiscaal)","Position
Klaar om jouw kennis te toetsen in de praktijk? AKD heeft het hele jaar door op alle zes vestigingen plek voor student-stagiaires. Een student-stage bij ons is een mooie kans om kennis te maken met het werken binnen de advocatuur, het notariaat of de fiscale praktijk, en meer in het bijzonder om de dynamiek binnen een full service BeNeLuxkantoor met ruim 500 medewerkers te ervaren.

Wat zul je gaan ervaren als student-stagiaire?

Tijdens je stage leer je onder andere juridische memo’s schrijven, vraagstukken van onze cliënten te interpreteren, en je ervaart hoe we binnen AKD (multidisciplinair) met elkaar samenwerken. Je krijgt te maken met alles wat er speelt binnen jouw vakgroep van voorkeur en de vestiging waar je stage loopt.

Je wordt inhoudelijk en persoonlijk begeleid door één van onze studentstagecoördinatoren (met wie je ook op de kamer zit). Bij AKD werken vanuit vertrouwen en begrip in hechte teams en de deur staat altijd voor elkaar open. We lachen samen, vieren successen samen en steunen elkaar.
Vanaf dag één ben je onderdeel van AKD en bieden we jou de volledige experience: een uitgebreide onboarding, en iedere laatste vrijdag van de maand rouleert de afsluitende borrel per vestiging.

Tijdens je student-stage bij AKD draai je twee maanden fulltime mee in onze dagelijkse praktijk. Je ontvangt een bruto vergoeding van €850 per maand.
Job requirements
Voor wie is een studentstage bij AKD?

Zit jij in de afrondende fase van je bachelor Rechtsgeleerdheid, bachelor Notarieel recht of bachelor Fiscaal recht / Fiscale economie of ben je gestart met een juridische master (WO), en wil je gaan onderzoeken of de advocatuur, het notariaat of de fiscale praktijk iets voor jou is? Leg je – net als alle AKD’ers – de lat hoog voor jezelf? Dan maken we graag kennis met jou! Overigens kun je ook binnen drie maanden nadat je bent afgestudeerd nog stage lopen bij ons.

Wil je een studentstage bij AKD komen lopen?
Vul onderstaande gegevens in en geef daarbij ook aan welke vakgroep(en) jouw voorkeur heeft. De motivatie hiervoor zien wij graag terug in jouw brief en ook de periode waarin jij de stage zou willen plannen. We zien jouw sollicitatie met plezier tegemoet!
Na een papieren selectie volgt één sollicitatiegesprek met onze Campus Recruiter en een studentstagecoördinator. Verder maakt een uitgebreide pre-employmentscreening onderdeel uit van onze (selectie)procedure.
AKD Benelux Lawyers schenkt aandacht aan het versterken van Diversity, Equality and Inclusion (DEI). Iedereen mag bij ons zichzelf zijn en wij schenken aandacht aan ieders talent.
Details
All offices, Netherlands
€850 per month
Legal, Student",https://media.glassdoor.com/sql/1073804/akd-squarelogo-1450805846845.png,Netherlands,nan,AKD
Startend of ervaren Advocaat-stagiair(e) Privacy & Cybersecurity,"Keen to become part of a truly global, collaborative team of professionals? Your journey begins here.
Hogan Lovells behoort tot de grootste internationale advocatenkantoren en heeft meer dan 47 kantoren in Afrika, Azië, Europa, Latijns Amerika, het Midden Oosten en de Verenigde Staten. Wereldwijd werken meer dan 2600 juristen bij Hogan Lovells waarvan circa 60 advocaten, (kandidaat-) notarissen, fiscalisten en paralegals in Amsterdam.
Hierdoor biedt Hogan Lovells Amsterdam “the best of both worlds”; het combineert een high quality global omgeving met de voordelen van een kantoor met een informele sfeer en korte lijnen. Wij voorzien onze cliënten van helder, praktisch en hoogwaardig advies door middel van een gezamenlijke aanpak. Wij ontwikkelen snel uitvoerbare en haalbare oplossingen voor de complexe uitdagingen waarmee onze cliënten worden geconfronteerd.
Voor onze Amsterdamse Privacy & Cybersecurity praktijk zoeken wij een startend of ervaren advocaat-stagiair(e).
Business unit Privacy & Cybersecurity
Ons Privacy & Cybersecurity team werkt voor grote, internationale bedrijven in verschillende sectoren, maar begeleidt ook Nederlandse ondernemingen en start-ups. We werken zowel in Nederland als internationaal persoonlijk en intensief samen in een goede, informele sfeer aan baanbrekende zaken en complexe strategieën, op het hoogste niveau. Ons team biedt hulp bij wereldwijde cyberaanvallen en assisteert bij handhaving door toezichthouders. Daarnaast geeft het team advies over (internationale) data sharing strategieën, Europees cookiebeleid, gebruik van data uit medische hulpmiddelen, hoog risicoverwerkingen etc.
Wie zoeken we?
Wij zoeken een energieke, ondernemende teamspeler die kansen ziet, proactief is en in oplossingen denkt. We hebben controlerende middenvelders in ons team en zoeken nu een spits. Je draait volledig mee in onze veeleisende praktijk, met eigen verantwoordelijkheden.
Je hebt in ieder geval een afgeronde Master Rechtsgeleerdheid en aantoonbare werkervaring/interesse in de Privacy en Cybersecurity praktijk. Wij zoeken iemand die iedere dag het beste uit zichzelf wil halen en de ambitie heeft een specialist op het gebied van Privacy & Cybersecurity te worden.
Wat bieden we?
We bieden je een leuke werkplek in een internationale werkomgeving met ambitieuze professionals. Je werkzaamheden zijn uitdagend en afwisselend en er is aandacht en ruimte voor persoonlijke groei. We bieden je aantrekkelijke primaire en secundaire arbeidsvoorwaarden, waaronder een goed salaris, vitaliteitsbudget, deelname aan de Law Firm School (wanneer je bij Hogan Lovells start met de beroepsopleiding) en vele gezellige borrels en uitjes.
Geïnteresseerd?
Indien je wilt solliciteren klik je op de ‘apply’ button. Nadat je een account hebt aangemaakt kan je je gegevens invullen en je stukken uploaden. We ontvangen graag in ieder geval je CV en motivatiebrief.
Voor vragen kun je contact opnemen met Sanne Braam (HR-manager) via telefoonnummer 020-5533662, of e-mail naar: amsterdam.recruitment@hoganlovells.com
Innovation, Diversity & Inclusion en Responsible Business zijn belangrijke prioriteiten voor ons kantoor. Hogan Lovells behoort tot de top 5 van meest innovatieve advocatenkantoren in Noord-Amerika en Europa. Wij blijven ervoor zorgen dat de samenstelling van onze medewerkers een goede weerspiegeling is van de rijke diversiteit van onze cliënten en de maatschappij. Het doen van pro bono- en vrijwilligerswerk zit in het DNA van onze mensen. Op deze manier nemen we onze verantwoordelijkheid om iets terug te geven aan de maatschappij.",https://media.glassdoor.com/sql/322733/hogan-lovells-squarelogo.png,Amsterdam,nan,Hogan Lovells
(Ervaren) Paralegal Privacy & Cybersecurity,"Keen to become part of a truly global, collaborative team of professionals? Your journey begins here.
Hogan Lovells behoort tot de grootste internationale advocatenkantoren en heeft meer dan 47 kantoren in Afrika, Azië, Europa, Latijns Amerika, het Midden Oosten en de Verenigde Staten. Wereldwijd werken meer dan 2600 juristen bij Hogan Lovells waarvan circa 60 advocaten, (kandidaat-) notarissen, fiscalisten en paralegals in Amsterdam.
Hierdoor biedt Hogan Lovells Amsterdam “the best of both worlds”; het combineert een high quality global omgeving met de voordelen van een kantoor met een informele sfeer en korte lijnen. Wij voorzien onze cliënten van helder, praktisch en hoogwaardig advies door middel van een gezamenlijke aanpak. Wij ontwikkelen snel uitvoerbare en haalbare oplossingen voor de complexe uitdagingen waarmee onze cliënten worden geconfronteerd.
Innovation, Diversity & Inclusion en Responsible Business zijn belangrijke prioriteiten voor ons kantoor. Hogan Lovells behoort tot de top 5 van meest innovatieve advocatenkantoren in Noord-Amerika en Europa. Wij blijven ervoor zorgen dat de samenstelling van onze medewerkers een goede weerspiegeling is van de rijke diversiteit van onze cliënten en de maatschappij. Het doen van pro bono- en vrijwilligerswerk zit in het DNA van onze mensen. Op deze manier nemen we onze verantwoordelijkheid om iets terug te geven aan de maatschappij.
Voor onze Amsterdamse Privacy & Cybersecurity praktijk zoeken wij een (ervaren) Paralegal.
Business unit Privacy & Cybersecurity
Ons Privacy & Cybersecurity team werkt voor grote, internationale bedrijven in verschillende sectoren, maar begeleidt ook Nederlandse ondernemingen en start-ups. Het team werkt zowel in Nederland als internationaal persoonlijk en intensief samen in een goede, informele sfeer aan baanbrekende zaken en complexe strategieën, op het hoogste niveau. Ons team biedt hulp bij wereldwijde cyberaanvallen en assisteert bij handhaving door toezichthouders. Daarnaast geeft het team advies over (internationale) data sharing strategieën, Europees cookiebeleid, gebruik van data uit medische hulpmiddelen, hoog risicoverwerkingen etc.
Wie zoeken we?
Wij zoeken een energieke, ondernemende teamspeler die kansen ziet, proactief is en in oplossingen denkt. We hebben controlerende middenvelders in ons team en zoeken nu een spits. Je draait volledig mee in onze veeleisende praktijk, met eigen verantwoordelijkheden.
Je hebt in ieder geval een afgeronde Master Rechtsgeleerdheid en aantoonbare interesse/werkervaring in de Privacy en Cybersecurity praktijk, bijvoorbeeld als in-house privacy counsel bij een internationaal opererend bedrijf of als toezichthouder bij de Autoriteit Persoonsgegevens. Wij zoeken iemand die iedere dag het beste uit zichzelf wil halen en de ambitie heeft een specialist op het gebied van Privacy & Cybersecurity te worden.
Wat bieden we?
We bieden je een leuke werkplek in een internationale werkomgeving met ambitieuze professionals. Je werkzaamheden zijn uitdagend en afwisselend en er is aandacht en ruimte voor persoonlijke groei. We bieden je aantrekkelijke primaire en secundaire arbeidsvoorwaarden, waaronder een marktconform salaris, persoonlijk vitaliteitsbudget, en vele gezellige borrels en uitjes. Daarnaast bieden we je alle ruimte om carrière te maken, bijvoorbeeld in senioriteit of door een overstap te maken naar een positie als advocaat
Geïnteresseerd?
Indien je wilt solliciteren klik je op de ‘apply’ button. Nadat je een account hebt aangemaakt kan je je gegevens invullen en je stukken uploaden. We ontvangen graag in ieder geval je CV en motivatiebrief.
Voor vragen kun je contact opnemen met Sanne Braam (HR-manager) via telefoonnummer 020-5533662, of e-mail naar: amsterdam.recruitment@hoganlovells.com",https://media.glassdoor.com/sql/322733/hogan-lovells-squarelogo.png,Amsterdam,nan,Hogan Lovells
