job_titles,job_description,images,locations,salaries,companies
MRA Specialist,"MRA Specialist
Functiegroep: Tandarts
Gewenst aantal uren: 0-8 uur
Locatie:
Schiedam, ZH, NL
Bedrijf: Samenwerkende Tandartsen Schiedam
Wil jij aan de slag in een praktijk waar je samen met een ambitieus en hecht team de beste mondzorg aan patiënten gaat verlenen? Ben jij iemand die bij- en nascholing belangrijk vindt en ga je voor een langdurige samenwerking? Lees dan verder!

Voor samenwerkende tandartsen Schiedam zijn wij op zoek naar een MRA-specialist voor 1 dag in de week. Bij voorkeur op de dinsdag van 07:00u-14:00u óf de woensdag van 07:00u-14:00u
Passen deze shift momenten niet bij jou, maar ben jij wel de specialist die wij zoeken? Ook dan komen wij graag met jou in contact!

Waar ga je werken?
Je gaat aan de slag in een mooie praktijk in Zuid-Holland. Onze tandartsenpraktijk is een praktijk met 8 behandelkamers. Naast algemene tandheelkunde kunnen onze patiënten terecht voor cosmetische tandheelkunde, implantologie, kroon- en brugwerk, slaapapneu, mondhygiene en protheses. Voor andere specialismen zoals orthodontie kunnen we doorverwijzen naar één van onze andere praktijken. Hierdoor kunnen we de patiënt voorzien van een breed pallet aan tandheelkundige behandelingen. Op de praktijk geloven wij in professionaliteit en samenwerking. Deze kernwaarden definiëren onze passie en trots: het leveren van de beste mondzorg aan onze patiënten!

Wat bieden wij jou?
Een salaris gebaseerd op kennis en ervaringEen pensioenregeling en reiskostenvergoedingVakantiedagen
-Uitstekende (gratis) bij- en nascholingsmogelijkheden via onze Colosseum Dental Academy

Onze verwachtingen
Als tandarts ben je trots op jouw vak! Je gaat voor de beste zorg voor de patiënt en bent in staat om de patiënt waar nodig gerust te stellen. Je stelt diagnoses en stelt een behandelplan op. Je stuurt de assistenten aan en zorgt voor een correcte dossiervorming volgens de wet- en regelgeving. Wij zoeken voor ons team een tandarts die een langdurige samenwerking ambieert en zich herkent in het volgende:
Je bent BIG-geregistreerd en hebt enige jaren werkervaring als tandartsJe beschikt over een uitstekende beheersing van de Nederlandse taal
-Je vindt bij- en nascholing belangrijk in je persoonlijke en professionele ontwikkeling
Je kan zowel goed zelfstandig als in teamverband werken

Word jij onze nieuwe collega tandarts in Schiedam?
Herken jij jezelf in deze vacature? Dan maken we graag kennis met jou! Heb je vragen? Dan mag je contact opnemen met Shannon Faber, praktijkmanager, te bereiken via s.faber@samenwerkendetandartsen.nl",https://media.glassdoor.com/sql/2611342/dentconnect-squarelogo-1566885563457.png,Schiedam,nan,Colosseum Dental
Administratief Medewerker,"Functiegroep: Locatiemanagement en support
Gewenst aantal uren: 36-40 uur
Plaats: Zwolle
Bedrijf: 4Dental Zwolle
Ben jij een administratief talent, bij voorkeur bekend met tandtechniek of tandheelkunde, en heb je zin in een nieuwe uitdaging? Dan is 4Dental Zwolle op zoek naar jou!

Wij zijn op zoek naar een nieuwe collega voor 32 tot 38 uur in de week, voorkeur gaat uit naar 38 uur in de week. Ook bij minder uur beschikbaar komen we graag met jou in contact!

Waar ga je werken?
Je gaat aan de slag in een enthousiast team bij 4Dental Zwolle. Onze vestiging maakt deel uit van een groeiende en dynamische organisatie, waar we persoonlijke groei en ontwikkeling van onze medewerkers belangrijk vinden.
Wat bieden wij jou?
Een afwisselende baan, een prettige werksfeer en leuke collega’sHet salaris wordt in overleg bepaaldEen goede pensioenregeling

De werkzaamheden bestaan uit:
In- en uitboeken van binnenkomende en uitgaande opdrachtenTelefonisch te woord staan van klanten (tandartspraktijken) en patiëntenAgendabeheer en planning van behandelingsafsprakenInplannen van werk naar ons partner in binnen en buitenland

Word jij onze nieuwe collega in Zwolle?
Herken jij jezelf in deze vacature? Dan maken we graag kennis met jou! Solliciteer dan via de sollicitatiebutton of per email bij Menno Pot. mpot@4dental.nl",https://media.glassdoor.com/sql/2611342/dentconnect-squarelogo-1566885563457.png,Zwolle,nan,4Dental Zwolle
Tandartsassistent,"Tandartsassistent
Functiegroep: Tandartsassistent
Gewenst aantal uren: 20-24 uur
Locatie:
Vlaardingen, ZH, NL
Bedrijf: Mondzorgcentrum Vlaardingen
Ben jij een tandartsassistent met liefde voor het vak? Staan de patiënt en kwaliteit van mondzorg voor jou op nummer 1? Kom dan eens kennismaken bij Mondzorgcentrum Vlaardingen.
Patiënten vertellen: ""fijn team, er wordt naar je geluisterd""- ""professionele vlotte afhandeling"" - ""prettige sfeer""

Voor onze tandartspraktijk Mondzorgcentrum Vlaardingen zijn wij op zoek naar een tandartsassistent die 24 uur beschikbaar is op maandag, woensdag en vrijdag. Ook als je minder uur beschikbaar bent komen we graag met je in contact!

Waar ga je werken?
Je gaat werken bij MZC Vlaardingen, een tandartspraktijk met een ervaren, professioneel en betrokken team. De praktijk heeft 8 ruim ingerichte behandelkamers waar onze patiënten terecht kunnen voor algemene tandheelkunde, implantologie, prothetiek en esthetische tandheelkunde. Als tandartspraktijk geloven wij in professionaliteit en in samenwerking. Deze kernwaarden definiëren onze passie en trots: het leveren van de beste mondzorg aan onze patiënten! Intercollegiaal overleg vinden we belangrijk, we bespreken casussen en leren op die manier van elkaar.

De praktijk wordt ondersteund door een Praktijk Manager en een Service Center, waardoor jij en de rest van het team zich volledig kunnen focussen op het vakgebied.

Wat bieden wij jou?
Het salaris wordt in overleg bepaaldEen goede pensioenregelingWoon- en werkverkeer regelingUitstekende bij- en nascholingsmogelijkheden via onze Colosseum Dental AcademyJe gaat werken in een inspirerende, professionele werkomgeving als lid van een gemotiveerd team

Onze verwachtingen
Je vindt het leuk om de tandarts te assisteren bij de voorbereiding, uitvoering en afronding van patiënten behandelingen. Je werkt hierbij volgens de klinische protocollen, richtlijnen en afspraken. Samen met het hele team draag je bij aan de patiënttevredenheid!
We zoeken iemand die een langdurige samenwerking ambieert en zich herkent in het volgende:
Je beschikt over een diploma tandartsassistentJe beheerst de Nederlandse taalJe vindt bij- en nascholing belangrijk in je persoonlijke en professionele ontwikkelingJe kan zowel goed zelfstandig als in teamverband werkenJe hebt enige ervaring met assisteren bij ortho behandelingen

Word jij onze nieuwe collega mondhygienist in Vlaardingen?
Herken jij jezelf in deze vacature? Dan maken we graag kennis met jou! Heb je vragen? Dan mag je contact opnemen met Sylvia Schermers (Praktijkmanager), te bereiken op 010-4354594.",https://media.glassdoor.com/sql/2611342/dentconnect-squarelogo-1566885563457.png,Vlaardingen,nan,Colosseum Dental
Anesthesiemedewerker Behandelcentrum,"Wat ga je doen?
“Werken overdag, uitdagend, maar wel met regelmaat, dat kan bij het Behandelcentrum!”
Als anesthesiemedewerker ben je verantwoordelijk voor het anesthesiologische zorgproces.
Je assisteert de anesthesioloog bij alle voorkomende werkzaamheden;
Je ontvangt de patiënt en stelt deze gerust. Tijdens de operatie neem je de zorg en de bewaking van de patiënt zelfstandig voor je rekening;
Daarnaast begeleid je leerlingen en werkt nieuwe collega’s in;
Vanuit je kennis, ervaring en interesses, participeer je in verbetertrajecten. Daarnaast werk je volgens rooster als dagcoördinator.
Je werkt op het Behandelcentrum (BHC) maar daarnaast kan het ook zijn dat je op locatie Meppel wordt ingezet.
Waar ga je werken?
Isala kenmerkt zich door topklinische zorg en hoogcomplexe ingrepen.
In Zwolle hebben we echter ook het Behandelcentrum (BHC). Dit is een zelfstandige unit met een operatie- én een verpleegafdeling. We hebben hier 6 operatiekamers, 55 verpleegbedden en 2 recovery’s met in totaal 16 bedden en een holding. Bij ons opereren de volgende specialismen: algemene chirurgie, plastische chirurgie, gynaecologie, orthopedie, kaakchirurgie, bijzondere tandheelkunde, KNO en oogheelkunde.
We bieden op een efficiënte, kwalitatief hoogwaardige en gastvrije wijze, zorg aan de patiënt die een (laag- tot middencomplexe) operatie moet ondergaan, in dagbehandeling of kortdurend verblijf. Patiënten van alle leeftijden kunnen van maandag tot en met zaterdag bij ons verblijven.
Onze relatieve kleinschaligheid biedt patiënten een veilig gevoel. Dat vinden we belangrijk.

De sfeer binnen het BHC is goed. Er is oog voor elkaar, wat betekent dat je samen plezier hebt, maar elkaar ook steunt als dat nodig is. We houden rekening met de wensen van medewerkers, we zorgen voor een goed inwerktraject en sluiten aan bij je behoefte, zowel professioneel als ten aanzien van de balans werk/privé.
We werken met een groeiend eigen team in goede samenwerking met de collega’s van de RVE Anesthesiologie.
Wie ben je en wat breng je mee?
Je bent een enthousiaste persoonlijkheid die zelfstandig werkt en goed kan samenwerken met anderen;
Je bent patiëntgericht en in staat mensen snel gerust te stellen en vertrouwen te geven;
Je bent communicatief vaardig en goed in staat feedback te geven en te ontvangen;
Je bent een (bijna) afgestudeerde CZO/NVZ-diploma anesthesiemedewerker, die beschikt over een gezonde dosis flexibiliteit. Dit betekent bijvoorbeeld dat je kunt meebewegen met een operatieschema dat opeens wijzigt, omdat de patiëntenzorg hierom vraagt. Je bent bereid om in Zwolle en Meppel te werken.
Wat bieden wij?
Je komt te werken in het BHC in Zwolle, in een team dat hecht is en dat het graag samen iedere dag een beetje beter doet voor de patiënt.
Je krijgt een regelmatige baan voor minimaal 22,5 uur per week. Het exacte aantal uren bepalen we samen in overleg. Je gaat werken, in een 9-uurs dagdienst, wat betekent dat je avonden en weekenden van jou zijn. De werktijden liggen tussen 7:30 en 18:00 uur (onder voorbehoud van organisatieveranderingen);
De Cao Ziekenhuizen is van toepassing. De functie is ingedeeld in FWG 55 met een huidig maximumsalaris van € 4.391,00 bruto per maand bij een fulltime dienstverband (36 uur). Inschaling is afhankelijk van ervaring. We bieden je graag een vast contract;
We hebben goede secundaire arbeidsvoorwaarden en bieden de mogelijkheid (ook online) te werken aan je persoonlijke en professionele ontwikkelingen. Binnen Isala vinden we het belangrijk dat werk en privé goed in balans zijn. Hier proberen we in onze roosters goed rekening mee te houden. En we hebben Isala breed het programma ""Sterk & Fit"" met allerlei trainingen en workshops om zowel mentaal als fysiek fit te blijven;
Woon je nog niet in de omgeving Zwolle? Dan is een nieuwe baan met daarbij een groenrijke woonomgeving een fijn perspectief voor de toekomst.
Wil je meer weten?
In een vacaturetekst kunnen we natuurlijk niet de echte sfeer van ons Behandelcentrum weergeven. Daarom nodigen we je van harte uit voor een kennismakingsmoment. Je kan dan ervaren wie we zijn, hoe we werken en al je vragen stellen. We heten je daarvoor graag van harte welkom.
Je kunt met vragen of voor het maken van een kennismakingsafspraak contact opnemen met de leidinggevenden van het Behandelcentrum. Eric Huizinga, telefoonnummer 088 624 41 87 of Inge Roessink, telefoonnummer 088 624 73 43 staan je graag te woord en beantwoorden al je vragen.

En wil je liever een collega-anesthesiemedewerker spreken? Ook dat kan. Stuur dan even een mailtje aan Inge Alting, email i.l.g.alting@isala.nl en zij neemt contact met je op.",https://media.glassdoor.com/sql/987301/isala-squareLogo-1680252099618.png,Zwolle,€4K (Employer est.),Isala
Business Controller,"Business Controller
Functiegroep: Shared Service Center
Gewenst aantal uren: 36-40 uur
Locatie:
Oosterhout, NB, NL
Bedrijf: DSC - Klinieken
Ben jij een commercieel met affiniteit voor finance skills of een financial met feeling voor commercie? Ben jij op zoek naar een brede job in internationale snelgroeiende organisatie? Wil jij de business optimaliseren en ondersteunen door jouw kennis en ervaring op de juiste manier in te zetten? Dat is dit de rol voor jou!

Voor ons Dental Service Center in Oosterhout zijn wij op zoek naar een Business Controller voor (bij voorkeur) 40 uur per week.

Waar ga je werken?
Colosseum Dental Benelux heeft meer dan 130 moderne, goed uitgeruste tandartspraktijken in Nederland en België. Bij de organisatie werken bijna 2.500 tandheelkundige professionals die jaarlijks meer dan 600.000 patiënten voorzien van kwalitatieve mondzorg met optimale service en gemak. Het is onze ambitie om de eerste keuze te zijn voor zowel patiënten als tandheelkundige professionals. Daarom investeren wij in innovaties, maken we gebruik van moderne technologieën en implementeren we digitale workflows ten behoeve van onze patiënten en praktijkteams.

Colosseum Dental Benelux is onderdeel van Colosseum Dental Group, de grootste dentale zorgverlener van Europa, met meer dan 800 tandartspraktijken in 11 Europese landen waar ruim 13.000 collega’s werken.
De meerderheidsaandeelhouder van Colosseum Dental Group is Jacobs Holding, een investeringsmaatschappij gevestigd in Zürich, Zwitserland. Jacobs Holding heeft een langetermijnstrategie in de tandheelkunde met zijn investeringen in Colosseum Dental Group in Europa en North American Dental Group in de VS.

In deze rol werk je zeer nauw samen en rapporteer je aan de Manager Business Control. Daarnaast heb je veel contact met Finance, de directie en operational management.

Wat zijn je taken in het kort?
Het analyseren en optimaliseren van de business resultaten, waarbij je samen met de business controllers verantwoordelijk bent voor verschillende regio's binnen NederlandOndersteunen en ‘challengen’ van de business met sterke (commerciële) informatieJe bent ondersteunend in de planning & control cycleHet ontwikkelen en analyseren van het KPI dashboard, standaard reportage pack en ad hoc rapportages (kliniek/regio niveau)Ondersteunen van de business bij (maandelijkse) rapportages voor het senior managementHet opstellen en reviewen van de budgetten voor de klinieken

Wat bieden wij jou?
Een salaris passend bij kennis, ervaring en opleidingPrima pensioenregelingVariabele bonusVeel ruimte om ons team en jezelf te ontwikkelenInformele en open werkomgeving
Wat verwachten we van jou?
Hbo (of wo) werk- en denkniveauCirca 2 jaar ervaring (voorkeur commercieel/business gerelateerd)Uitstekende beheersing van de Nederlandse en Engelse taalErvaring met projectmatig werken is een préErvaring binnen een grote organisatie is een préAffiniteit met de healthcare is mooi meegenomen

Word jij onze Business Controller?
Laat het ons weten door een sollicitatie via de sollicitatiebutton of neem contact op met onze Senior Corporate Recruiter Fenn Artz te bereiken op 06 11952546 of Fenn.artz@colosseumdental.nl",https://media.glassdoor.com/sql/2611342/dentconnect-squarelogo-1566885563457.png,Oosterhout,nan,Colosseum Dental
Tandarts assistente,"Tandarts assistente
Functiegroep: Tandartsassistent
Gewenst aantal uren: 24-32 uur
Locatie:
Schiedam, ZH, NL
Bedrijf: Samenwerkende Tandartsen Schiedam
Voor onze tandartspraktijk in schiedam zijn we op zoek naar een tandartsassistent. Ben jij op zoek naar een zeer moderne en middelgrote pratkijk in een gezellige dorpskern? Wil jij jezelf blijven ontwikkelen en de best zorg aan patiënten leveren? Dan is dit de rol voor jou!

Voor onze praktijk in Schiedam zijn wij op zoek naar een nieuwe collega voor de maandagen, dinsdagen (14:00u-21:00u) en de vrijdagen (07:00u-16:00u). Ook bij minder uur beschikbaar komen wij graag met jou in contact!

Waar ga je werken?
De praktijk in schiedam beschikt over alle moderne tools om de patiënten zorg te verlenen die aan alle kwaliteitseisen voldoet. De praktijk is zeer modern ingericht en heeft een licht en fris uiterlijk zowel van binnen als van buiten. Rondom de praktijk is er ruim parkeergelegenheid en ligt op steenworp afstand van het centrum en station. Het team is gemotiveerd, ervaren en goed op elkaar ingesteld. De balie ontvangt altijd iedereen met een glimlach en dit merk je aan de sfeer binnen de praktijk.

De praktijk wordt ondersteunt door het shared service center waardoor jij je volledig kan richten op je vak.

Wat bieden wij jou?
Het salaris wordt in overleg bepaaldEen goede pensioenregelingWoon- en werkverkeer regelingenUitstekende bij- en nascholingsmogelijkheden via onze DentConnect AcademyJe gaat werken in een inspirerende, professionele werkomgeving als lid van een gemotiveerd team

Onze verwachtingen
Je vindt het leuk om in contact te zijn met patiënten en de mensen op de 'vloer'. Daarnaast vind je het leuk om de tandarts te assisteren bij de behandelingen. Je werkt hierbij volgens de klinische protocollen, richtlijnen en afspraken. Samen met het hele team draag je bij aan de patiënttevredenheid!

We zoeken iemand die een langdurige samenwerking ambieert en zich herkent in het volgende:
Je beschikt bij voorkeur over een diploma tandartsassistent of je hebt ervaring binnen de tandheelkundeKennis van Exquise is een préJe beheerst de Nederlandse taalJe vindt bij- en nascholing belangrijk in je persoonlijke en professionele ontwikkelingJe kan zowel goed zelfstandig als in teamverband werken

Word jij onze nieuwe collega tandartsassistent in schiedam?
Herken jij jezelf in deze vacature? Dan maken we graag kennis met jou! Heb je andere vragen? Dan mag je contact opnemen met Shannon.
s.faber@samenwerkendetandartsen.nl",https://media.glassdoor.com/sql/2611342/dentconnect-squarelogo-1566885563457.png,Schiedam,nan,Colosseum Dental
Doktersassistente of Tandartsassistente MKA (Stadskanaal),"Hé dokters- of tandartsassistent(e)! Zet jij graag ergens je tanden in? Dan is dit goedlachse team van Treant polikliniek MKA Stadskanaal op zoek naar jou!

Minimaal aantal uren
24
Maximaal aantal uren
24
Arbeidsovereenkomst voor
Bepaalde tijd, intentie tot vast
Werklocatie(s)
Stadskanaal
CAO
Ziekenhuizen
De functie
Als dokters- en/of tandartsassistent op de polikliniek MKA ben je een ondernemende collega. Wat houdt ondernemend in? Je zorgt ervoor dat spreekuren en behandelprogramma's soepel verlopen, je assisteert bij steriele kaak chirurgische behandelingen die variëren van het verwijderen van een verstandskies tot het plaatsen van implantaten of het nemen van een biopt, en alles wat daar tussen zit. Een deel van het werk bestaat ook uit het maken van verschillende röntgenfoto’s en het aansturen van de behandel en consulten spreekuur. Je bent samen met je collega’s verantwoordelijk voor alle vragen van patiënten die voor uiteenlopende behandelingen komen.
Je overlegt met artsen, administratief medewerkers over afspraken en patiëntenzorg, informeert patiënten over een te plannen behandeling of over nazorg en stelt ze op hun gemak. Je beantwoordt vragen van patiënten telefonisch of mondeling. Daarnaast doe je aanvullende administratieve taken en zorg je voor de administratieve verwerking in ons elektronisch patiëntendossier (EPD). Je treft dus de benodigde voorbereidingen en afhandeling voor een goed en soepel verloop van de spreekuren.
Het team
Je gaat werken in Stadskanaal op de polikliniek MKA (mond-, kaak- en aangezichtschirurgie) wat ook jouw vaste ziekenhuislocatie wordt. Je gaat wisselende dagen werken binnen een gedreven en vrolijk team, waar we zelfstandig werken en elkaar ondersteunen daar waar nodig. Het kan voorkomen dat je zo nu en dan wordt ingezet op de twee andere ziekenhuislocaties in Emmen en Hoogeveen.
Jij bent de ideale kandidaat
Jij bent een enthousiaste dokters- en/of tandartsassistent(e) die weet van aanpakken. Je bent gespecialiseerd en/of geïnteresseerd in de mond-, kaak- en aangezichtschirurgie. Je hebt de opleiding tot tandartsassistent gevolgd – of een vergelijkbare opleiding op MBO-niveau 4 zoals doktersassistente of verpleegkundige en bij voorkeur heb je ervaring in de tandheelkunde of kaakchirurgie. Je houdt ervan om de handen uit de mouwen te steken, je helpt je collega's waar mogelijk en samen zorg je ervoor dat het spreekuur vloeiend verloopt. Je bent gemotiveerd, servicegericht en een echte organisator waarbij je overzicht houdt en snel kunt schakelen. Feedback ontvangen en geven, vinden we hierbij belangrijk. Vanzelfsprekend heb je kennis van de medische terminologie en beheers je de meeste moderne software. Als je je herkent in onze kernwaarden: Toegewijd, Innovatief en Samen en als je het heerlijk vindt dat geen dag hetzelfde is, reageer dan snel!
Ons aanbod
Een arbeidsovereenkomst voor bepaalde tijd (intentie tot vast)
Een salaris van minimaal € 2.134 en maximaal € 3.160 bruto fulltime per maand (CAO ziekenhuizen FWG 40)
Vakantietoeslag (8,33%)
Eindejaarsuitkering (volledige 13e maand)
Kom je met de auto? Bij ons kun je gratis parkeren
Meerkeuzesysteem arbeidsvoorwaarden met daarin aantrekkelijke regelingen zoals extra reiskostenvergoeding en diverse collectieve verzekeringen
Een uitdagende functie in een professioneel team
Diverse online trainingen en cursussen, zoveel jij maar wilt!
Wil je weten wat wij jou nog meer te bieden hebben? Bekijk dan deze 10 redenen om bij ons te werken!

Nieuwsgierig geworden?
Vertel het ons! Solliciteren kan tot en met woensdag 19 april 2023. Ben je nu al werkzaam bij Treant dan solliciteer je via Profit InSite. Ben je niet werkzaam bij Treant dan solliciteer je via de knop ""Solliciteren"". De sollicitatieprocedure bestaat uit een meeloop dagdeel die in overleg met jou wordt gepland.
Wil je graag meer informatie over deze functie? Neem dan contact op met Rian Kuiper, hoofd polikliniek, bereikbaar via telefoonnummer 06 51 51 28 80. Voor meer informatie over de sollicitatieprocedure kun je contact opnemen met de recruiters Floor, Dima of Monique, bereikbaar via
telefoonnummer 06 27 10 28 90.
Ondertussen vragen we ook onze huidige medewerkers of een van hen deze uitdaging aan wil gaan. Als dat het geval is, krijgt deze kandidaat voorrang.
Acquisitie naar aanleiding van deze vacature wordt niet op prijs gesteld.",https://media.glassdoor.com/sql/963108/treant-zorggroep-squarelogo-1426749779993.png,Stadskanaal,€2K - €3K (Employer est.),Treant Zorggroep
Preventie assistent,"Preventie assistent
Functiegroep: Tandartsassistent
Gewenst aantal uren: 0-8 uur
Locatie:
Makkum, FR, NL
Bedrijf: Mondzorg Makkum
Ben jij op zoek naar een baan in een tandartspraktijk in Makkum en wil je aan de slag in een team dat voor elkaar klaar staat? Ben jij iemand die bij- en nascholing belangrijk vindt en ga je voor een langdurige samenwerking? Lees dan verder!

Voor onze tandartspraktijk Makkum zijn wij op zoek naar een preventieassistent voor 1 dag per 2 weken. De exactie dag/week invulling plannen samen.

Waar ga je werken?
De praktijk is een praktijk waar we zowel algemene tandheelkunde aanbieden, evenals verschillende specialisaties waaronder protheses, kroon –en brugwerk en implantologie. Het huidige team bestaat uit verschillende ervaren collega. De praktijk onderscheidt zich door haar goede agendaplanning en ruime behandelkamers.

De praktijk wordt ondersteund door een Service Center, waardoor jij jezelf als mondhygiënist volledig kan focussen op jouw vakgebied!

Wat bieden wij jou?
Marktconform salaris
Een goede pensioenregeling
Uitstekende bij- en nascholingsmogelijkheden via onze Colosseum Dental Academy
Indien nodig is er de mogelijkheid om intern opgeleid te worden tot assistent
Je gaat werken in een inspirerende, professionele werkomgeving als lid van een gemotiveerd team

Onze verwachtingen:
Als preventie assistent haal je energie uit het zelfstandig uitvoeren van preventie werkzaamheden, het assisteren bij de behandelingen van patiënten en het geven van voorlichting en advies over de mondhygiëne. Je vindt de afwisseling en samenwerking belangrijk.
We zoeken iemand die een langdurige samenwerking ambieert en zich herkent in het volgende:
Je beschikt over een diploma preventie assistent
Kennis van exquise is een pré
Je beheerst de Nederlandse taal
Je vindt bij- en nascholing belangrijk in je persoonlijke en professionele ontwikkeling
Je kan zowel goed zelfstandig als in teamverband werken

Word jij onze nieuwe collega tandartsassistent in Makkum?
Herken jij jezelf in deze vacature? Dan maken we graag kennis met jou! Heb je andere vragen? Dan mag je contact opnemen met mevrouw I. Stolk (praktijkcoördinator) te bereiken op 0515 750 576 of via iris.stolk@kraantandheelkunde.nl",https://media.glassdoor.com/sql/2611342/dentconnect-squarelogo-1566885563457.png,Makkum,nan,Colosseum Dental
