job_titles,job_description,images,locations,salaries,companies
Medewerker Expeditie en Administratie,"Functiegroep: Tandtechniek
Gewenst aantal uren: 36-40 uur
Plaats: Amsterdam
Bedrijf: 4Dental Amsterdam
Medewerker expeditie en planning
Ben jij een stressbestendig communicatief talent en ben jij op zoek naar een leuke afwisselende administratieve baan waarbij je veel (telefonisch) in contact bent met mensen? En ben je bekend met tandtechniek of tandheelkunde of heb je zin in een nieuwe uitdaging en ben je leergierig? Dan zijn wij op zoek naar jou! Het gaat om 32-38 uur in de week, voorkeur gaat uit naar 38 uur in de week. Ook bij minder uur beschikbaar komen wij graag met je in contact!

Waar ga je werken?
Je gaat aan de slag in een enthousiast team bij 4Dental Amsterdam. Ons laboratorium maakt deel uit van een groeiende en dynamische organisatie en Amsterdam gaat de komende jaren doorgroeien als regionale hub binnen onze organisatie.
Wij zijn 4Dental Amsterdam momenteel aan het uitbouwen en hebben daarbij versterking nodig op de expeditie/planning.

De werkzaamheden bestaan uit:

In- en uit pakken orders van orders en in- en uitboeken van binnenkomende en uitgaande opdrachtenInplannen van werk naar onze partnerlabs in het buitenlandTelefonisch te woord staan van klanten (tandartspraktijken) en ontvangen patienten in onze praktijkAgendabeheer en planning van behandelingsafsprakenPlanning dagelijkse boderoutes

Wat bieden wij jou?
Veel zelfstandigheid en vrijheid om je werk uit te voeren en door te groeienHet salaris wordt in overleg bepaald volgens cao-tandtechniekEen goede pensioenregelingGezellige werkplek met een prettige sfeer en leuke collega’s

Onze verwachtingen
Je bent zelfstandig, flexibel en proactiefGoede communicatieve vaardigheden in het Nederlands (Engels is een pré) je moet van bellen houden en baliewerkzaamheden niet schuwenNauwkeurige en gestructureerde manier van werkenJe houdt van een uitdaging en bent oplossingsgerichtVaardig in MS-office

Word jij onze nieuwe collega in Amsterdam?
Herken jij jezelf in deze vacature? Dan maken we graag kennis met jou! Solliciteer dan via de sollicitatiebutton. Heb je vragen? Dan mag je contact opnemen met Dick Baartmans via dbaartmans@4dental of op 088 848 4450",https://media.glassdoor.com/sql/2611342/dentconnect-squarelogo-1566885563457.png,Amsterdam,nan,4Dental Amsterdam
Klinisch Prothesetechnicus (KPT-er) M/V. - Zaandam,"Voor onze vestigingen in Zaandam en Amsterdam zijn wij op zoek naar een fulltime (40 uur p/w):Klinisch Prothesetechnicus (KPT-er) M/V.Functieomschrijving Als Klinisch prothesetechnicus bent u verantwoordelijk voor uw eigen patiëntenagenda en werkt u zelfstandig en probleemoplossend. U dient zelfstandig bij de patiënt volledige gebitsprotheses en implantaatprotheses aan te meten en te plaatsen. U begeleidt het vervaardigen van de protheses door de prothesetechnici en u heeft zorgvuldig overleg met de tandartsen/implantologen.Functie eisen:✓ Diploma prothesetechnicus, aangevuld met diploma KPT (klinisch prothesetechnicus);✓ Je hebt enkele jaren relevante werkervaring als Klinisch Prothesetechnicus;✓ Je werkt zelfstandig en levert werkstukken van zeer goede kwaliteit;✓ Je hebt technisch inzicht, twee rechterhanden en doorzettingsvermogen;✓ Je bent enthousiast, leergierig, representatief, nauwkeurig, flexibel en hebt een servicegerichte instelling;✓ Je kunt je mondeling uitstekend uitdrukken in de Nederlandse taal;✓ Precisie en nauwkeurigheid;✓ Stressbestendig;✓ Servicegericht;✓ Goed om kunnen gaan met (angstige) patiënten;✓ Zowel zelfstandig als in teamverband kunnen werken.Wij bieden: Een uitdagende functie binnen een dynamische, informele en goed georganiseerd professionele organisatie.Naast een gezellige werksfeer en goede faciliteiten, bieden wij tevens een uitdagend beloningspakket i.c.m. een aantrekkelijke provisieregeling. Het aanbodpakket bevat tevens o.a.:✓ Bij elke locatie/afdeling wordt de nodige begeleiding aangeboden met een vaste aanspreekpunt;✓ Interne trainingen waarbij de nadruk wordt gelegd op zelfontwikkeling en groei;✓ Mogelijkheden om via de organisatie gefaciliteerde opleidingen/cursussen te volgen;✓ Goed georganiseerd en toegankelijk personeelsmanagementsysteem waarbij arbeid gerelateerde zaken zoals vakanties, salarisspecificatie e.d. goed geregeld zijn;✓ Leuke werkomgeving waarin de veiligheid hoog in het vaandel staat;✓ Duidelijke taakverdeling met regelmatig en structureel werkoverleg.Bedrijfsprofiel Adalat Groep is een familiebedrijf dat zich voornamelijk bezighoudt met het exploiteren en facilitairen van tandheelkunde. Het exploiteren van tandheelkundige klinieken gebeurd onder de naam Dentalzorg.Momenteel telt de groep drie grote praktijken, twee in Amsterdam en één in hartje Zaandam.De praktijken van DentalZorg zijn professioneel uitgerust en goed georganiseerd conform de geldende wet- en regelgeving. Naast een tandtechnisch laboratorium zijn er diverse afdelingen waaronder: orthodontie, implantologie, parodontologie, cosmetische tandheelkunde, prothese en kroon-en brugwerk, mondhygiëne en preventie. Sinds kort is er ook de mogelijkheid om onder narcose te worden behandeld.Doordat de organisatie een familiebedrijf is wordt er veel waarde gehecht aan het sociale menselijke aspect, van zowel de cliënten als van de medewerkers. De missie hierbij is om laagdrempelige en optimale, alsmede verantwoorde tandheelkundige zorg beschikbaar te stellen waarbij in de mondzorgverlening de behoeften en de wensen van patiënten centraal staan. Dit onder een professionele en informele werksfeer.De praktijken worden ondersteund door de afdeling Service Centre op het gebied van o.a. personeelszaken, marketing-en communicatie, administratie, technische dienst en cliënten service. Alle afdelingen zijn goed georganiseerd waarbij veel waarde wordt gehecht aan de geldende wet- en regelgeving. Bij DentalZorg werkenuitsluitend gekwalificeerde, bekwame en gediplomeerde medewerkers waaronder: tandartsen, implantologen, mondhygiënisten, preventie- en tandartsassistenten en klinisch prothese technici.Uw sollicitatie: Bent u de prothesetechnicus die wij zoeken, en spreekt het u aan in een professionele, informele organisatie kwalitatief hoogwaardig tandtechnisch werk af te leveren, dan nodigen wij u van harte uit te solliciteren. Wij ontvangen uw reactie graag in de vorm van uw motivatie en CV via de mail naar prsoneelszaken(at) dentalzorg.nlSoort dienstverband: FulltimeRooster:Dagdienstma-vrWeekendbeschikbaarheidSecundaire arbeidsvoorwaarden:Budget voor professionele ontwikkelingReiskostenvergoedingSoorten aanvullende vergoedingen:VakantiegeldOpleiding:HBO (Gewenst)Werklocatie: Fysiek",https://media.glassdoor.com/sql/1038957/dentalzorg-squarelogo-1438789930398.png,Zaandam,nan,Dentalzorg Tandheelkunde
HR Businesspartner,"HR Businesspartner
Functiegroep: Shared Service Center
Gewenst aantal uren: 36-40 uur
Locatie:
Oosterhout, NB, NL
Bedrijf: DSC - Klinieken
Ben jij op zoek naar een (mobiele) HR functie binnen een organisatie volop in de groei? Wil je jezelf blijven ontwikkelen en verantwoordelijk zijn voor je eigen projecten en portefeuille? Lees dan verder!

Voor ons Dental Service Center in Oosterhout zijn wij op zoek naar een HR Businesspartner bij voorkeur voor 40 uur per week.
Waar ga je werken?
Colosseum Dental Benelux heeft meer dan 130 moderne, goed uitgeruste tandartspraktijken in Nederland en België. Bij de organisatie werken bijna 2.500 tandheelkundige professionals die jaarlijks meer dan 600.000 patiënten voorzien van kwalitatieve mondzorg met optimale service en gemak.

Het is onze ambitie om de eerste keuze te zijn voor zowel patiënten als tandheelkundige professionals. Daarom investeren wij in innovaties, maken we gebruik van moderne technologieën en implementeren we digitale workflows ten behoeve van onze patiënten en praktijkteams.

Colosseum Dental Benelux is onderdeel van Colosseum Dental Group, de grootste dentale zorgverlener van Europa, met meer dan 800 tandartspraktijken in 11 Europese landen waar ruim 13.000 collega’s werken.

De meerderheidsaandeelhouder van Colosseum Dental Group is Jacobs Holding, een investeringsmaatschappij gevestigd in Zürich, Zwitserland. Jacobs Holding heeft een langetermijnstrategie in de tandheelkunde met zijn investeringen in Colosseum Dental Group in Europa en North American Dental Group in de VS.

Wat bieden wij jou?
Een vaste baan met een arbeidsovereenkomst voor onbepaalde tijd
Flexibele werktijden en Hybride werken (ongeveer 50/50 dagen per week op kantoor of op locatie)
Een marktconform salaris dat past bij de relevante werkervaring die je meebrengt
Een leaseauto (categorie Volkswagen Polo)
Telefoonvergoeding
Pensioenregeling
25 vakantiedagen
Ontwikkeling- en trainingsmogelijkheden.

Wat ga je doen?
Colosseum Dental heeft de ambitie om te blijven groeien als organisatie. Dit brengt veel beweging met zich mee en zo ook op het gebied van HR. Samen met je collega’s HR-businesspartners ben je verantwoordelijk voor alle HR-gerelateerde zaken vanaf de indienst- tot uitdienstreding. Daarnaast ben je het eerste aanspreekpunt voor alle interne en externe stakeholders tot aan de regiomanagers van de praktijken, voor HR-gerelateerde zaken. Als sparringspartner peil je waar de behoeften ligt van de medewerkers voor de toekomst. Bij Colosseum Dental is er een informele sfeer met een hands-on mentaliteit. Als HR-businesspartner neem je deel aan projectteams binnen HR, beantwoord je dagelijkse HR-vraagstukken en ben je verantwoordelijk voor het verzuim van jouw regio. Daarnaast houd je je bezig houdt met; employer branding, performance management en het medewerkertevredenheidsonderzoek ‘’Great place to work’’. Andere taken die bij jouw rol horen:
Het organiseren van personeelszaken;
Adviserende rol voor verschillende complexe zaken.
Je neemt deel aan projecten binnen de HR-afdeling;
Regio- en praktijkmanagers ondersteunen bij HR-vraagstukken, zoals casemagement.

Een aantal verantwoordelijkheden
Het organiseren van de personeelszaken
Je houdt personeelsdossiers up to date en houdt hierbij rekening met de AVG
Je verzorgt casemanagement, verzuimcases en hebt veel contact met praktijkmanagers
Je bent eerste aanspreekpunt voor HR gerelateerde zaken
Je draagt zorg voor de juiste afhandeling van verzuimcases
Je neemt deel in verbetertrajecten binnen de HR afdeling
Je draait mee in allerlei soorten projecten binnen HRM

Ter versterking van ons team zijn wij op zoek naar een collega die een langdurige samenwerking ambieert en zich herkent in het volgende:
Minimaal een afgerond Hbo diploma (voorkeur HR gerelateerd)
Circa 3 jaar ervaring binnen HR (als adviseur)
Ervaring met verzuimcases of werkervaring bij een arbodienst
Sterke organisatorische, communicatieve en administratieve skills
Je vraagt door, bent doortastend en bent daarnaast een luisterend oor

Word jij onze nieuwe HR Businesspartner in Oosterhout?
Herken jij jezelf in deze vacature? Dan maken we graag kennis met jou! Heb je andere vragen? Dan mag je contact opnemen met Fenn Artz (Corporate Recruiter), te bereiken op 06-11952546 of fenn.artz@colosseumdental.nl",https://media.glassdoor.com/sql/2611342/dentconnect-squarelogo-1566885563457.png,Oosterhout,nan,Colosseum Dental
Operatieassistent Behandelcentrum (Herintreder),"Wat ga je doen?
Heb jij jaren geleden de opleiding tot OK assistent gevolgd en zou je diep in je hart toch weer dit vak willen uitoefenen dan ben je welkom op de OK van het Behandelcentrum. Na een korte herintrederscursus dat bestaat uit een theoretische- en praktische scholing, kun je weer aan het werk als OK assistent.
We zoeken een bevlogen oud-operatieassistent, die na de herintrederscursus wordt ingezet bij alle voorkomende specialismen, voor zowel instrumenterende-, assisterende- als omloopwerkzaamheden. De werkzaamheden worden voornamelijk op het Behandelcentrum uitgevoerd met de mogelijkheid dat je op een tweede locatie mag werken in de Isala te Meppel.
Waar ga je werken?
Het Behandelcentrum van Isala heeft als doel om op een efficiënte, kwalitatief hoogwaardige en gastvrije wijze, zorg te bieden aan de patiënt die een chirurgische operatie moet ondergaan, in dagbehandeling of kortdurend verblijf. De operaties zijn laag- tot midden complex. De patiënten kunnen hier verblijven van maandag tot en met zaterdag.
Het Behandelcentrum is een zelfstandige unit binnen Isala met een operatie- én een verpleegafdeling. Het bestaat uit 6 operatiekamers, 60 verpleegbedden en 2 recovery’s met in totaal 16 bedden en een holding. Op het Behandelcentrum opereren de volgende specialismen: algemene chirurgie, plastische chirurgie, gynaecologie, orthopedie, kaakchirurgie, bijzondere tandheelkunde, KNO en oogheelkunde.
Wie ben je en wat breng je mee?
Je bent in het bezit van het diploma operatieassistent (CZO-erkend).
Je werkt accuraat, service- en patiëntgericht.
Goede sociale en communicatieve vaardigheden.
Een flexibele werkhouding.
Gastvrije mentaliteit.
Je denkt in mogelijkheden en oplossingen.
Wat bieden wij?
Een regelmatige 9-uurs dagdienst.
De werktijden variëren van 7:30 tot 18:00 uur.
Een salaris vanuit FWG 55 met een huidig maximum salaris van € 4.391,00 bruto per maand bij een fulltime dienstverband (36 uur per week), afhankelijk van leeftijd en ervaring.
Wil je meer weten?
Indien je meer informatie wilt, kun je contact opnemen met de leidinggevenden van het Behandelcentrum, Inge Roessink, telefoon 088 624 73 43 of Eric Huizinga, telefoon 088 624 41 87.
Om een goede indruk te krijgen van het werken op het Behandelcentrum is het mogelijk om een dag wil mee te lopen.
Graag nodigen we je uit voor een kennismakingsgesprek!",https://media.glassdoor.com/sql/987301/isala-squareLogo-1680252099618.png,Zwolle,€4K (Employer est.),Isala
