job_titles,job_description,images,locations,salaries,companies
Supply Chain Planner,"Supply Chain Analyst-DelftAre you looking to join the Global Leader in production and sales of Consumer Electronics? Do you like to work in a dynamic, challenging and international work environment? Then we have a fantastic opportunity for you to join our best-in-class team as: Supply Chain Analyst.The Consumer Electronics industry is evolving rapidly and therefore we are searching for someone who is able to work on a Pan European level for the Spare Parts Supply for our Samsung products. Not only acting as a control tower for the entire Parts Supply Chain, but also in depth operational tasks across the parts SCM, are included in this role. Excellent customer service is our highest priority.The European Parts Depot is covering all of Europe and beyond, and due to our wide scope and product ranges we are looking for people who are agile and like to work in a highly dynamic environment (no day is the same).Your responsibilities will include:· Using historical demand and SPM [forecasting system] to create accurate forecast;· Manage PO and vendors for timely supply & arrival of the Spare parts;· Tracking Back orders and stock levels [maintain an optimum balance];· Internal & external stakeholder management, such as factories, WH 3PL, subsidiaries ;· Support the EU subsidiaries with basic [process] inquiries;· Initiate & execute improvements for existing or new processes;· Start up, launch or support in projects;What we offer:Working at the Global Leader in Consumer Electronics and in a best-in-class team environment comes with hard work, but we also make it rewarding through:· A competitive base salary depending on your profile;· Annual performance related bonuses (twice per year);· 25 holidays (and Good Friday off) and additional loyalty days based on your service period;· Optional hybrid working model and allowances, supporting your daily life balance (2 days per week from home);· Fully compensated health care insurance (extensive coverage);· Well-arranged pension scheme with an extensive employer contribution;· Compensation of your fitness subscription;· Free drinks and fresh fruit at the office;· Employee shop discounts;· Bicycle plan;Who we are looking for:· Preferably a Bachelor/ Master degree in logistics or SCM;· At least 1-5 years of relevant working experience;· Utilizing your analytical skills to support business and/or job scope requirements;· You are curious, able to think out of the box and takes ownership of own actions;· Effective Communication skills & proficient in English;· Preferred experience with SAP, WMS, ERP, must have with MS Office; Excel Advanced skills;What’s next:We hope that we have triggered your interest to join our company. If so, please make sure to apply right away and we will be in touch with you shortly.Soort dienstverband: Fulltime, Vaste baanSalaris: €3.000,00 - €3.800,00 per maandFlexibele taalvereiste:Nederlands niet vereistRooster:DagdienstFlexibele werkurenma-vrSecundaire arbeidsvoorwaarden:BedrijfsfitnessBedrijfsopleidingBudget voor professionele ontwikkelingCollectieve zorgverzekeringDienstreizen vergoedingFietsplanFlexibele werkurenGezondheidsprogrammaKerstpakketMogelijkheid tot promotiePensioenPersoneelskortingProductkorting werknemersReiskostenvergoedingTelefoonplanWerk vanuit huisWinstdelingZorgverzekeringSoorten aanvullende vergoedingen:BonusregelingVakantiegeldWerklocatie: Fysiek",https://media.glassdoor.com/sql/1200935/walters-people-squareLogo-1611226039363.png,Zaandam,€4K - €5K (Employer est.),Walters People3.7 ★
HBO/WO starter Logistiek/Supply Chain Management,"Do you have experience as a Supply Chain Planner or a similar role? Would you like to work for an international company in a dynamic environment where you can truly make a difference? Then you might be the Supply Chain Planner we’re looking for!
The purpose of this role is to ensure that the commitments to their customers are delivered on time in the most efficient way. The Supply Chain Planner will create and execute the mid- and long-term supply plan for their production facility which consist of a fractionation, refinery, and packaging plant. This supply plan involves all production lines and groups relevant to the business. As a Supply Chain Planner, you need to make sure that the plan is aligned with all stakeholders. In this dynamic role you manage both product availability and delivery reliability whilst serving as a point of escalation for sales and operations. You prepare and drive weekly and monthly review meetings in which you align demand against our capabilities, capacities and supply pipeline. Also, you serve as the main interface of the Wormerveer plant within the supply chain organization in general. You are the first point of contact for production, sales, product management, logistics, finance and quality.

Furthermore, as the planning delegate you will join and own strategic projects and meetings. Moreover, you will drive continuous improvement within the supply planning process.

Offer

Salary between 3650 – 4650 gross per month;
40 hours;
Hybrid working;
Walters People Academy;
International company;
Good work environment;
Travel allowance;
24 holidays;
Growing into other roles.

Skills & requirements

Completed engineering or business studies or completed commercial / technical studies. Or vocational training followed by several years of proven professional experience in the supply chain;
Knowledge of S&OP, production planning or supply network planning;
Very good understanding of production and operating processes;
Experience in an industrial production environment, preferably in the food, chemical or pharmaceutical industry;
Well versed in international project work;
Very good user knowledge of ERP systems (SAP);
Confident handling of Office applications, especially Excel;
Pro-active, flexible and persistent;
Proficiency in both Dutch as well as English is mandatory.

Are you the Supply Chain Planner we’re looking for?
Apply now!

Do you have experience as a Supply Chain Planner or a similar role? Would you like to work for an international company in a dynamic environment where you can truly make a difference? Then you might be the Supply Chain Planner we’re looking for!",https://media.glassdoor.com/sql/2913106/via-logistics-professionals-squarelogo-1571982385566.png,Venlo,nan,VIA Logistics Professionals
Junior Supply Chain Management Consultant,"Functieomschrijving
Wij zijn gespecialiseerd in werving en selectie van logistieke professionals en supply chain specialisten en dat merk je. Je hoeft ons niet uit te leggen wat je zo leuk vindt aan deze branche, wij zijn er verliefd op! Wat het voor jou extra interessant maakt, is dat we niet alleen werken voor logistieke dienstverleners, maar ook voor veel verladers die hun logistieke processen in eigen beheer uitvoeren.

Vind jij het leuk om projectmatig te werken, processen te optimaliseren en te implementeren, contacten te onderhouden met diverse stakeholders, aansturen van een team, analyses te maken of de supply chain van A-Z te coördineren? Dan hebben wij diverse startersfuncties die bij jou passen!
Functie-eisen
Je bent in het bezit van een HBO/WO diploma in de richting van Logistiek, Supply Chain Management, Technische Bedrijfskunde of een andere gerelateerde opleiding;
Het is een pre als je werk/stage ervaring hebt in de logistiek/techniek;
Je hebt affiniteit met de logistiek of supply chain management;
Je hebt kennis en ervaring in het werken met MS Office (Word, Excel, Outlook);
Je beheerst de Nederlandse taal in woord en geschrift en spreekt bij voorkeur ook Engels en/of Duits;
Daarnaast heb je een doeners mentaliteit, ben je assertief en wil je graag leren.
Arbeidsvoorwaarden
Je kunt een marktconform salaris verwachten, goede doorgroeimogelijkheden en passende secundaire arbeidsvoorwaarden.
Organisatie
Wij zijn voor meerdere opdrachtgevers in de regio op zoek naar HBO/WO starters Logistiek/Supply Chain Management. Ben jij op zoek naar een uitdagende en dynamische startersfunctie binnen de logistiek en supply chain? Ben jij net afgestudeerd en fulltime beschikbaar? Dan zijn wij op zoek naar jou!
Standplaats
Venlo
Solliciteer nu!
Stappenplan sollicitatieproces
Stap 1
Op basis van je sollicitatie bepalen wij of je past bij onze opdrachtgever en de vacature.

Stap 2
Als je geschikt bent, nodigen wij jou uit voor een kennismakingsgesprek bij ons op kantoor of digitaal.

Stap 3
Vervolgens introduceren wij jou bij onze opdrachtgever en volgen er gesprekken. Is dit positief? Dan bepaalt de opdrachtgever of en wanneer je gaat starten.",https://media.glassdoor.com/sql/3472/ericsson-worldwide-squareLogo-1633528460972.png,Netherlands,nan,IT Solutions Worldwide4.0 ★
Supply Chain Officer,"We are looking for a Junior SCM consultant who wants to develop their skills in the world of supply chain improvements. You will assist in developing strategies and operating models that integrate planning, procurement, product design, manufacturing, logistics and fullfillment functions for our customers. Furthermore, you will prepare deployment by testing solutions and training key users.

Responsibilities :
- Analyzing and assuring quality of the data collected

Assisting in formulating the specific solutions to address prioritized gaps
Assisting in supply chain process design activities
Assisting in development of capabilities and performance measurements / KPI's
Assisting business change and implementation activities
Performing testing and implementation activities for designed solutions
Preparing the client for deployment





Requirements :
- Starter (max 1,5 years working experience)

HBO degree in economics, business management, supply chain management, or equivalent
availability to travel
fluent in Dutch and/or English
Familiar with warehouse management systems, such as SAP and Oracle
Excellent knowledge of MS Office
Likes working with large amount of data
Customer focused and able to work with different levels in an organization
Creative and result oriented
Familiar with Lean and Six Sigma
Fluent in Dutch and English









What we offer:
- Laptop

Mobile phone
International projects
A great learning environment
Growth possibilities



Interested? Send your CV and motivation letter to the following email address: info@itsolutionsworldwide.com and mention the job title in the subject. We aim to contact our candidates within 5 working days.",nan,Zoetermeer,€2K - €3K (Employer est.),Scheidt & Bachmann Parkeersystemen B.V
Supply Chain Planner,"De Supply Chain Officer verzorgt de dagelijkse werkzaamheden in het magazijn. Hij draagt bij aan de optimalisatie van alle administratieve en logistieke processen binnen de Supply Chain.Taken en verantwoordelijkhedenDraagt zorg voor een tijdige en accurate registratie, bewaking en uitvoering het RMA-proces;Draagt zorg voor de controle van alle inkomende en uitgaande goederen alsmede het beheer van opgeslagen spareparts, verbruiks-, onderhouds- en installatiematerialen;Beheren van goederen in opslag en de volledigheid van de administratie (locatie, aantallen, etc.);Draagt zorg voor de tijdige en correcte afhandeling van leverorders, bewaakt de afgesproken levertijden en geeft orders vrij voor facturatie;Onderhoudt contact met de (interne en externe) klant over de status van bestelorders;Draagt zorg voor de orde en netheid in het magazijn en overige opslagruimtes alsmede de buitenruimte van het pand;Draagt zorg voor de aanwezigheid en het beheer van verpakkingsmateriaal en overige benodigheden om goederen op een deugdelijke en (milieu) verantwoorde wijze te verzenden;Maakt op aangeven van de Projectmanager projectleveringen gereed voor verzending;Verzorgt de dagelijkse bevoorrading van de Field Engineers op basis van de geplaatste bestellingen;Draagt primair zorg voor alle fysieke verplaatsing van materialen in het magazijn;Neemt bij afwezigheid van de Teamleader Supply Chain diens taken over en zorgt voor passende ondersteuning tijdens diens afwezigheid.Vereiste kwalificaties / ervaringWerk- en denkniveau: MBO 2 werk- en denkniveauKennis en affiniteit:Techniek (hard- en software)Ervaring: Minimaal 2 jaar in een soortgelijke functieTalen: Nederlands en bij voorkeur ook Engels,ICT-vaardigheden: MS Office, SAPVorkheftruckbewijsWaarom Scheidt & Bachmann?Een baan bij een internationaal succesvolle, groeiende onderneming met het karakter van een familiebedrijf;Aandacht voor jou als mens en ruimte voor jouw ideeën;Een zelfstandige baan in de techniek, vol vrijheid en verantwoordelijkheidUitgebreid opleidingstraject, onder andere op ons hoofdkantoor in DuitslandMogelijkheden tot aanvullende trainingenEen informele werksfeer met enthousiaste collega’sEen prima salaris en uitstekende arbeidsvoorwaardenSoort dienstverband: FulltimeSalaris: €2.000,00 - €2.500,00 per maandRooster:Dagdienstma-vrSecundaire arbeidsvoorwaarden:Auto van de zaakBedrijfsfeestenExtra vakantiedagenKosteloos parkerenPensioenReiskostenvergoedingSoorten aanvullende vergoedingen:Overuren uitbetaaldVakantiegeldSollicitatievragen:Vorkheftruck certificaatWerklocatie: Fysiek",https://media.glassdoor.com/sql/234076/bfg-squarelogo-1488394168317.png,Nijkerk,nan,BFG3.6 ★
Supply Chain Planner,"Ben jij graag de spil in het logistieke web? Lever je graag een waardevolle bijdrage aan het uitbouwen van de logistieke dienstverlening binnen de hele keten? En zoek je een afwisselende baan met volop ontwikkelingsmogelijkheden? Dan zijn wij bij BFG Warehousing in Nijkerk op zoek naar jou!

WAT GA JE DOEN ALS ONZE SUPPLY CHAIN PLANNER?

Als onze Supply Chain Planner sta je continu voor een grote uitdaging: het coördineren van ons logistieke proces. Wanneer komt alles binnen, waar komt het vandaan, arriveert het op tijd en hoe krijg je het op het afgesproken moment bij de klant? Je begeleidt het totale logistieke proces en hebt vooral een actieve rol bij het signaleren en oplossen van logistieke uitdagingen. Jij en je zes collega’s vallen hiërarchisch onder de Teamleider Supply Chain Planning.

Je dagelijkse werkzaamheden bestaan uit het bepalen van de voorraadbehoefte op basis van beschikbare data, parameters en gegenereerde besteladviezen, met behulp van onder andere A/I-tools. Hierbij speel je adequaat in op afzettingsschommelingen en nieuwe producten. Om de samenwerking zo soepel mogelijk te laten verlopen, heb je regelmatig contact met leveranciers over te plaatsen, lopende of al geleverde bestellingen. Je neemt actief deel aan diverse overlegvormen, doet verbetervoorstellen en zorgt waar nodig in overleg met je leidinggevende voor oplossingen. Ook volg je de trends op het gebied van Supply Chain Management en probeer je de organisatie hierin mee te nemen.


WAT MAG JIJ VAN ONS VERWACHTEN?
Een uitdagende baan bij een no-nonsense familiebedrijf met een platte organisatiestructuur.
Samenwerken met een team van enthousiaste collega’s in een prettige en informele werksfeer.
Volop ruimte voor persoonlijke ontwikkeling.
Uitstekende primaire en secundaire arbeidsvoorwaarden.
Over BFG Warehousing

BFG Warehousing B.V. is onderdeel van Bieze Food Group, een familiebedrijf met veel ruimte voor en vraag naar ondernemerschap, zelfstandigheid, verantwoordelijkheidsgevoel, energie, doorzettingsvermogen en humor. Als een van de grootste duurzame en gekoelde distributiecentra van Nederland staat flexibiliteit bij al onze diensten voorop. Meedenken met de ketenpartners en ze in elke situatie de meest ideale logistieke oplossing bieden, dát is waar wij goed in zijn.
WAT VERWACHTEN WE VAN JOU ALS ONZE SUPPLY CHAIN PLANNER?
Je hebt een afgeronde hbo-opleiding, bij voorkeur Supply Chain Management, Bedrijfskunde of Logistiek & Economie.
Je kunt goed omgaan met Microsoft-programma’s zoals Excel, Power BI en Dynamics AX.
Je beheerst de Nederlandse en Engelse taal uitstekend, Duits is een pre.
Je beschikt over goed ontwikkelde analytische vaardigheden, bent klantgericht, oplossingsgericht en een kei in het plannen en managen van logistieke processen.
Mensen kennen jou als een teamspeler die ook goed zelfstandig kan werken, een groot verantwoordelijkheidsgevoel laat zien en zorgvuldigheid hoog op zijn prioriteitenlijst heeft staan.
MEER INFORMATIE OF DIRECT SOLLICITEREN?

Neem voor meer informatie over deze vacature en andere mogelijkheden contact met ons op via +31 (0)33-247 71 00. Ben je zelf (momenteel) niet geïnteresseerd, maar ken je dé persoon voor deze baan? Deel dan de vacature!",https://media.glassdoor.com/sql/3129799/a-moksel-squarelogo-1583387925131.png,Apeldoorn,€2K - €3K (Employer est.),Vion Food Group2.5 ★
Supply Chain Planner,"Wat doe je als supply chain planner?

Als supply chain planner ben je verantwoordelijk voor het maken van een werkbare planning, het beheer van de planning, een goed lopend product-, goederen- en productiestroom met betrekking tot de planning naar aanleiding van salesactiviteiten en aanwezige voorraden en capaciteit. Daarnaast zorg je voor een adequate aflevering van goederen op de juiste plaats, voortgang van het logistieke proces en een optimale inzet van grondstoffen en verwaarding.

Top 100 food bedrijf
Elke dag eten 100 miljoen consumenten wereldwijd een maaltijd met daarin een beetje Vion. Deze hoeveelheid komt met een grote verantwoordelijkheid. Bij Vion werken we iedere dag gedreven aan de wereldwijde voedseluitdaging: 9 miljard mensen voeden in 2050. Hoe kun jij hier onder andere aan bijdragen?
De rol

Je maakt realistische planningen op dag- weekniveau.
Jouw planning ondersteunt het en stuurt het productieproces aan.
Je bewaakt en beheert de voorraden en het artikelenbestand.
Je signaleert en corrigeert de afdeling sales bij overschrijding van de verkoophoeveelheden.
Je verzorgt de orderverwerking.
Je plant de aflevering van orders bij klanten aan de hand van vraag en aanbod.
Je stemt het logistieke traject af met de afdeling sales, lokale planners en eventueel transporteurs.
Je controleert op de juistheid van het transport en stuurt bij indien afwijkingen en mutaties worden geconstateerd.
Jouw planningsadministratie wordt adequaat bijgehouden.
Wat verwachten we van jou?

Je hebt een opleiding op mbo+ niveau richting bijvoorbeeld logistiek of bedrijfskunde.
Je hebt enige ervaring als planner. Binnen de foodsector zou mooi zijn.
Je hebt kennis van ERP systemen en Excel.
Je kan goed werken met strakke deadlines.
Je weet je probleemloos mondeling en schriftelijk uit te drukken in het Nederlands en Engels. Duits zou helemaal mooi zijn.
Wat kan je van ons verwachten?

We starten met een jaarcontract met de intentie deze om te zetten naar een vaste baan.
Een bruto 4-wekelijks salaris tussen € 2.499 en 3.406 op basis van 36 uur per week afhankelijk van jouw kennis en ervaringsniveau.
Naast het salaris ontvang je een eindejaarsuitkering van 2% en 8% vakantiegeld.
Het betreft een functie voor 36 uur per week.
Je krijgt 24 vakantiedagen.
Jouw woon-werk reiskosten worden vergoed vanaf 10 km enkele reis.
Onbeperkt toegang tot de Vion Academy met wel meer dan 600 verschillende trainingen en cursussen voor jouw eigen persoonlijke ontwikkeling en groei.
Mogelijkheden voor het doen van externe opleidingen voor jouw eigen persoonlijke ontwikkeling en groei.
Vion kent diverse interessante werknemers regelingen, zoals een fietsplan en een collectieve zorgverzekering.
Ben jij dit?
Spreekt ons profiel je aan en wil je graag voor Vion komen werken, of wil je graag meer informatie over deze functie? Deel jouw talenten met ons door je motivatie en cv via onderstaande sollicitatiebutton.
Voor deze vacature kiezen wij er bewust voor om rechtstreeks in contact te treden met potentiële kandidaten en stellen wij het op prijs als bedrijven niet ongevraagd hun diensten aan ons aanbieden.
Apeldoorn (GE)
Vacancy overview",https://media.glassdoor.com/sql/4080770/shi-squarelogo-1640087469377.png,Asten,nan,SHI B.V.3.6 ★
Supply Chain & Logistics afstudeeropdracht (open opdracht),"Als Supply Chain Planner ben je, samen met jouw collega’s, verantwoordelijk voor het coördineren, controleren en plannen van de goederenstromen binnen de Supply Chain van SHI. Je helpt hiermee de organisatie een zo hoog mogelijke servicegraad te realiseren door te zorgen voor een tijdige aanwezigheid van de voorraad volgens de gestelde normen. Met jouw gedreven instelling en vlotte persoonlijkheid zorg je voor structuur en realiseer je een goede dienstverlening naar onze klanten toe. Daarnaast ga jij geen uitdaging uit de weg en denk je graag mee over het zo efficiënt mogelijk inrichten van onze logistieke processen.


Verantwoordelijkheden:

Zorgen voor een optimaal voorraadbeheer binnen de vooraf vastgestelde serviceniveaus;
Plaatsen van orders bij leveranciers, daarbij rekening houdend met levertijden en bijzondere condities;
Het bewaken van de afgesproken levertijden;
Overleggen met leveranciers inzake afwijkingen en problemen;
Het maken van relevante analyses en komen met verbetervoorstellen;
Verzorgen van de documentenstroom met betrekking tot bestellingen in het Verre Oosten;
Het opstellen van de forecast ten aanzien van voorraden en de prioritering van binnenkomende goederen.
Jouw profiel:

HBO werk- en denkniveau, bij voorkeur in richting van Supply Chain Management;
Minimaal 2 tot 5 jaar relevante werkervaring;
Kennis van SAP en Slimstock is een grote pré;
Uitstekende kennis van Excel.
Wij bieden:

Een salaris passend bij jouw kennis en ervaringen;
Als je fulltime werkt heb je recht op ruim 6 weken vakantie opgebouwd in verlof- en ATV uren;
Vanaf 10 kilometer enkele reis een reiskostenvergoeding;
Een goede pensioenregeling.
Wie zijn wij:
SHI is een groothandel/specialist voor Home Improvement Essentials: producten en concepten die essentieel zijn voor het verfraaien of vernieuwen van woon- en werkomgevingen. SHI biedt totaaloplossingen voor groothandels, retailers en e-tailers in het professionele, doe-het-zelf, non-food en food kanaal in zowel binnen- als buitenland. Het assortiment van SHI bestaat uit de volgende categorieën: elektra, multimedia, ijzerwaren, schildersgereedschap en sanitair. Eind 2022 zijn wij verhuisd naar ons spiksplinternieuwe bedrijfspand in Asten met moderne faciliteiten. Wij bieden een zelfstandige en veelzijdige functie binnen een prettige en informele werksfeer.
Heb jij interesse in deze vacature?

Spreekt deze vacature je aan? Solliciteer dan direct!

Heb jij vragen of wil je meer informatie over ons bedrijf? Bezoek ons op www.shi.nl of neem voor specifieke vragen contact op met Martin Schreurs (Stock Control Manager) via 0493-680 900.",https://media.glassdoor.com/sql/257903/royal-haskoning-squarelogo.png,Amersfoort,nan,Royal HaskoningDHV4.1 ★
