job_titles,job_description,images,locations,salaries,companies
Supply Chain Planner,"Word jij enthousiast van het optimaliseren van de Supply Chain van een toonaangevende organisatie in de distributie van internationale merken? Dan zijn wij op zoek naar jou! Onze opdrachtgever is op zoek naar een proactieve en oplossingsgerichte Supply Chain Specialist om het team te versterken.Als Supply Chain Specialist ben jij verantwoordelijk voor het inkopen van materialen en onderdelen en het onderhouden van contact met leveranciers om op de hoogte te blijven van bestellingen en tijdige levering te garanderen. Jij werkt nauw samen met de productie-, logistiek- en verkoopafdelingen om de planning van de constructie te optimaliseren en houdt toezicht op voorraadniveaus in verschillende magazijnen. Daarnaast ben jij een belangrijke schakel in het oplossen van capaciteitsproblemen en planningskwesties met betrekking tot ontvangsten.Onze opdrachtgever biedt jou:· Uitdagende functie waar geen dag hetzelfde is· Professionele werkomgeving met ruimte voor persoonlijke inbreng, ontwikkeling en gezelligheid· Aantrekkelijke personeelskortingen en flexibele werktijden· Marktconform salaris en werkweek van 36-40 uurWat breng je mee?· MBO-/HBO werk- en denkniveau met relevante werkervaring· Proactief, oplossingsgericht en in staat om goed te schakelen tussen werkzaamheden· Goede kennis van de Nederlandse- en Engelse taal in woord en geschrift· Fulltime beschikbaar voor 36-40 uur per weekBen jij enthousiast geworden van deze functie en zie jij jezelf al helemaal in deze rol? Wacht dan niet langer en laat van je horen!Vakarbeid B.V. | Enschedesestraat 164 te Hengelo | 06-83539620 | Ruud ScholtenSoort dienstverband: Fulltime, Vaste baanSalaris: €2.731,00 - €3.421,00 per maandRooster:Dagdienstma-vrSecundaire arbeidsvoorwaarden:BedrijfsfeestenBedrijfsfitnessBudget voor professionele ontwikkelingKerstpakketPensioenPersoneelskortingReiskostenvergoedingVrijdagmiddagborrelSoorten aanvullende vergoedingen:Overuren uitbetaaldVakantiegeldWerklocatie: Fysiek",https://media.glassdoor.com/sql/37923/vion-n-v-squarelogo.png,Apeldoorn,€36K - €49K (Employer est.),Vion Foodgroup2.8 ★
Supply chain planner,"Wat doe je als supply chain planner?

Als supply chain planner ben je verantwoordelijk voor het maken van een werkbare planning, het beheer van de planning, een goed lopend product-, goederen- en productiestroom met betrekking tot de planning naar aanleiding van salesactiviteiten en aanwezige voorraden en capaciteit. Daarnaast zorg je voor een adequate aflevering van goederen op de juiste plaats, voortgang van het logistieke proces en een optimale inzet van grondstoffen en verwaarding.

Top 100 food bedrijf
Elke dag eten 100 miljoen consumenten wereldwijd een maaltijd met daarin een beetje Vion. Deze hoeveelheid komt met een grote verantwoordelijkheid. Bij Vion werken we iedere dag gedreven aan de wereldwijde voedseluitdaging: 9 miljard mensen voeden in 2050. Hoe kun jij hier onder andere aan bijdragen?
De rol

Je maakt realistische planningen op dag- weekniveau.
Jouw planning ondersteunt het en stuurt het productieproces aan.
Je bewaakt en beheert de voorraden en het artikelenbestand.
Je signaleert en corrigeert de afdeling sales bij overschrijding van de verkoophoeveelheden.
Je verzorgt de orderverwerking.
Je plant de aflevering van orders bij klanten aan de hand van vraag en aanbod.
Je stemt het logistieke traject af met de afdeling sales, lokale planners en eventueel transporteurs.
Je controleert op de juistheid van het transport en stuurt bij indien afwijkingen en mutaties worden geconstateerd.
Jouw planningsadministratie wordt adequaat bijgehouden.
Wat verwachten we van jou?

Je hebt een opleiding op mbo+ niveau richting bijvoorbeeld logistiek of bedrijfskunde.
Je hebt enige ervaring als planner. Binnen de foodsector zou mooi zijn.
Je hebt kennis van ERP systemen en Excel.
Je kan goed werken met strakke deadlines.
Je weet je probleemloos mondeling en schriftelijk uit te drukken in het Nederlands en Engels. Duits zou helemaal mooi zijn.
Wat kan je van ons verwachten?

We starten met een jaarcontract met de intentie deze om te zetten naar een vaste baan.
Een bruto 4-wekelijks salaris tussen € 2.499 en 3.406 op basis van 36 uur per week afhankelijk van jouw kennis en ervaringsniveau.
Naast het salaris ontvang je een eindejaarsuitkering van 2% en 8% vakantiegeld.
Het betreft een functie voor 36 uur per week.
Je krijgt 24 vakantiedagen.
Jouw woon-werk reiskosten worden vergoed vanaf 10 km enkele reis.
Onbeperkt toegang tot de Vion Academy met wel meer dan 600 verschillende trainingen en cursussen voor jouw eigen persoonlijke ontwikkeling en groei.
Mogelijkheden voor het doen van externe opleidingen voor jouw eigen persoonlijke ontwikkeling en groei.
Vion kent diverse interessante werknemers regelingen, zoals een fietsplan en een collectieve zorgverzekering.
Ben jij dit?
Spreekt ons profiel je aan en wil je graag voor Vion komen werken, of wil je graag meer informatie over deze functie? Deel jouw talenten met ons door je motivatie en cv via onderstaande sollicitatiebutton.
Voor deze vacature kiezen wij er bewust voor om rechtstreeks in contact te treden met potentiële kandidaten en stellen wij het op prijs als bedrijven niet ongevraagd hun diensten aan ons aanbieden.",https://media.glassdoor.com/sql/4803439/logistics-united-squarelogo-1645768473163.png,Helwijk,nan,Logistics United
Supply Planner,"Company profileThis is an organization that recycles various types of glass. This is done in large factories. Glass is endlessly recyclable without loss of quality. A typical example of the circular economy. The company already exist 100 years! Sounds interesting right? They have several locations in Europe and for their location in Heijningen they are now looking for a new colleague as a logistics coordinator. Do you want to start your career in the rising world of circulair recycling? Apply now and boost your career!What will you do?Do you care about the world? Are you administratively strong and do you know how to manage and coordinate matters? Would you like to be part of the Supply Chain /Logistics department at a well know recycle production company, at their location in Heijningen? And do you – last but not least – want to use your knowledge at a company that is in the middle of the circular economy?* Then we are looking for you!*You will start as a supply chain planner and in this role, you ensure that their services will perform optimally. You are responsible for the correct processing and supervision of incoming and outgoing transports, stock management and information systems. You maintain contact with colleagues from various internal departments and externally with processors, transporters and customers / suppliers.What will you do as supply chain planner:Taking care of and processing documentation in the field of incoming and outgoing land and water transports (invoices, consignment notes, etc.).Recording stock movements of, among other things, boats in Navision.Validating container and transport invoices for the Benelux locations.Enter data regarding Sales & Operations.Schedule and supervise daily container changes.Arrange transports.Support in other daily activities where necessaryWhat do you bring with you?You have at least an MBO working and thinking level with preferably a completed education in the direction of logistics or supply chain.You have gained some experience in an administrative position and you work accurately.Feel at home in a working environment in which we deal openly and directly with each other.You communicate easily with colleagues from different levels and departments in the organization and you do not easily get knocked out.You have sufficient knowledge of MS Office and can easily handle computer systems.If you have a good command of the Dutch and English language, French is an advantage.You are eager to learn and feel like learning the process inside and out along the way. Start learning and boost your career!ConditionsYou will start with a gross salary between €2,121.62 - €3,182.43 based on relevant experience and a full-time working weekMinimum 24 vacation days with the option to purchase extra days€0,19 per km surchargeGood pension, insurances e.t.c.8% holiday surcharge per yearA challenging work environment with a lot of space and freedom - which is in full swing and in which you can develop yourself even further and grow1001 online training courses: from Agile Management, Social Media Marketing to Business English, where you can decide when, what and how you learnNice colleagues who contribute to a cleaner world on a daily basisCan't wait to get started as a supply chain planner? Apply nowDo you have any questions?Logistics United specializes in recruiting and selecting logistics professionals. Our goal is to provide as many logistics professionals as possible with the right challenge. With more than 40 years of experience in the transport &logistics sector, we quickly and easily make the right match between you and your new employer. We look beyond your profile and that of the vacancy. We want you to fit together and strengthen each other. Only then will we have done our job.Is your interest aroused? Beautiful! What's next:1. You apply2. You will be invited by us for an introduction. After the introduction, we will introduce you to the employer. They will also invite you for an introduction.3. If, like the employer, you are positive after the introduction, you will be invited for a second interview. During this interview you will go deeper into the position and meet other colleagues4. If there is a click between you and the employer, you will receive a proposal by e-mail5. If the proposal suits your wishes, confirm this by e-mail and visit the employer to sign your contract. Congratulations! You therefore enter into employment directly with the employer. :)We will guide you step by step during the above process and we will have regular contact with each other during this period. For more questions please call us on 06-49967192 or send an e-mail to daria@logistics-united.comJob Types: Full-time, New-GradSalary: €212,162.00 - €318,243.00 per month",https://media.glassdoor.com/sql/35521/innocent-ltd-squarelogo-1447090034446.png,Rotterdam,nan,innocent drinks4.2 ★
Senior Supply Chain Planner,"We’ve come a long way from selling smoothies in West London in 1999. we now make and sell our drinks across Europe and in other continents.
We need someone great to join us in the supply planning team who will be responsible for ensuring operations run smoothly for a few of our drinks portfolio, planning and ordering the right production volume at the right time– ultimately ensuring that we deliver excellent service levels of smoothies and juices to our end customers.

You will be working closely with teams internally, including procurement, commercial, technical, and logistics team and have ownership of operational relationships with our external manufacturing partners; which includes the day-to-day as well as on long term capacities and ways of working. You will help to ensure we have the capacity to manage future demand and deliver growth of the business and also have the opportunity to input into some of our exciting projects such as campaigns or new product launches.

You'll play a pivotal role in ensuring production is moved across the network, and get stuck in with continuous improvement initiatives to drive optimisation - and work with some great people in the process. It's a really exciting time to join the team with a growing supply chain and buckets of personal development opportunities.
What you’ll get:

Experience in the heart of the operations, seeing how all elements of our products come together and get to the shelf
A salary in level 7 (€ 2,994 - € 3,910)
Play a part in the evolution of our very first innocent factory
Improve your stakeholder skills as you'll deal with many teams internally
Be the first point of contact of our key suppliers and partners

A great way to develop your career in supply chain
To succeed in our supply chain team, you’ll be bright, enthusiastic, a brilliant problem solver, with an eye for detail and number crunching. You’ll be ready to develop your career further at innocent - Supply Chain experience is desirable. You will be managing lots of different information sources, new Microsoft D365 systems and Excel, so you’ll have to be highly organised and a whizz at multi-tasking.
You’ll keep on top of everything through your excellent time management and be a natural at building strong relationships with the team here at Fruit Towers and our suppliers, and you’ll be someone who is confident presenting their ideas in front of others.
A really great candidate for this role will have:

Ideally you will have already cut your teeth in the supply chain world and looking for your next development opportunity
The ability to build strong relationships quickly and work cross functionally
A keen interest in supply chain operations and our products
Agile and proficient skills in Excel, and an affinity for numbers
Strong analytical, problem solving and communication skills
Have a degree or equivalent. In our experience people who really enjoy these kind of roles are those with a business, maths, engineering or science background
A keen eye for detail with impeccable organisation skills
The ability to keep several plates spinning at once
Ideally you would also have food industry knowledge.
In return for everything you can bring, we can offer you an exciting, challenging role in a fast-growing and dynamic business, with plenty of career opportunities in Rotterdam and across Europe as well as a competitive rewards package. We also have some great clubs, a free breakfast and as many smoothies as you can shake a stick at. Take a look at our reward page for more details.
If you think you have everything we're looking for and more, then we'd love to hear from you. You'll need to get your skates on though, as applications close soon.",https://media.glassdoor.com/sql/42576/nestle-oil-squarelogo-1427196621822.png,Rotterdam,nan,Neste3.6 ★
Supply Chain Planner,"Senior Supply Chain Planner
Location:
Rotterdam, NL
Country/Region: NL
Job Area: Supply Chain Management
Business Unit: RP Supply Chain Management
Are you a creator of change?

Everything we do at Neste serves one purpose: to create a healthier planet for our children. Over the past ten years, Neste’s transformation journey has taken the company from a local oil refining company to becoming a global leader in renewable and circular solutions.
Our purpose pushes us forward to search for new ways to reduce the amount of carbon released into the atmosphere, and to innovate circular solutions to reuse carbon again and again. Are you going to help us combat climate change?
Neste Netherlands is part of the Finnish parent company Neste. The plant in Rotterdam produces renewable fuels. Together with 200 colleagues we are working everyday to operate, maintain, and improve the plant in an efficient and safe manner.
We are looking for a (senior) Supply Chain Planner to join our Supply Chain Steering team in Rotterdam.
Your part in Neste’s journey

The Supply Chain Steering team provides steering and planning of the whole renewable supply chain to maximize profitability, from supply to production to sales, including blending, quality and inventory management. The Supply Chain Steering team is part of Renewable Platform Supply Chain Management (RP SCM).
Neste is supplying renewable diesel and recently entered the renewable aviation fuel and renewable polymer and chemicals markets. For Europe we are searching for a Supply Chain planner who will be responsible for planning, steering, optimising and developing the supply chains of these business units.

As a Supply Chain Planner in the Neste supply chains you will be part of a global team of logistics, production and supply chain planners (S&OP & S&OE). In this team you will have a view and influence to the whole chain and an opportunity to contribute to the overall efficiency and success of Renewables platform.

In your role, you will focus on but not limited to the following tasks and responsibilities:

Planning, steering and optimization of European Renewable feedstock and product flows
Managing renewable feedstock and product inventories for refineries and external storages
Scheduling of sustainability compliance (biocriteria) of renewable feedstock and product flows
Coordination and communication with production, supply chain planners, sales, supply, businesses, commercial operations, compliance, chartering and shipping operations to steer and execute the global plan
Participating in logistical problem solving and investigations within production and global supply chains
Participating in other projects in cooperation with key internal stakeholders e.g. logistic procurement, strategic development managers, business, technical managers (e.g. entering new markets and business models, implementation of new logistics services suppliers and strategic projects)
Development of planning and reporting tools and processes
Backup for and job rotation within the European supply chain planning team

As the business is growing, we need to continuously renew and develop our ways of working and integrate new initiatives to our business and work processes. In addition to the Supply Chain Steering team, the Supply Chain Planner will be working with colleagues from across the organisation and from different locations.

Keys to success in this role

The best combination of experiences, skills and background is
Masters or Bachelor degree from business studies in Logistics, Supply Chain or Maritime Management
Relevant work experience in supply chain management, logistics, renewable business, commercial or trading operations (wet bulk)
Experience in the aviation and or oil & chemical supply chains is preferred
Strong communication and collaboration skills and fluency in English, both spoken and written.
Team work skills and also ability to steer own and others work independently
Ability to work with complex and changing situations and flexible work attitude
Good interpersonal and networking skills
Decisive and strong solution oriented skills
Analytical and fact driven approach
Experience with SAP, Spiral, PowerBI and Google tools

We also value

Familiarity with vegetable oils, fats and biofuel markets
Experience with optimization, planning or simulation tools
Ability to plan and prioritise one’s own work
Sustainability regulations

In accordance, we believe in people who find new ways of doing things – people for whom safety and sustainability are part of their professional skills. Customer mindset is essential to all of us and we work hard to find the best solutions for our customers. We believe everyone is a leader and share a natural desire for collaboration. If all this, as well as our values of responsibility, cooperation, innovation and excellence resonates with you, you are the talent we are looking for.

Come and do meaningful work in a community that has its eyes set forward!
The recruitment process includes interviews and aptitude tests.
Please submit your application as soon as possible.
If you have any questions, get in touch with our recruiter Jacob Faber via jacob.faber@partners.neste.com.

Join us in creating a healthier planet for our children.

Our success is based on our people who are the driving force behind Neste’s transformation to become a global leader in renewable and circular solutions. We are also committed to carbon neutral production by 2035. The passion that we have for creating a healthier planet for our children is what makes us unique. We have set high standards for biodiversity, human rights and supply chain. We have consistently been included in the Dow Jones Sustainability Indices and the Global 100 list of the world’s most sustainable companies. To carry out our strategy and business growth, our values guide our work. We support, develop and take care of the wellbeing of our people to enable them to grow, innovate and build our future.
We care. We have courage. We cooperate.
At Neste we want our people to feel good and do good. We provide clear and transparent targets, development opportunities, empowering leadership as well as rewards based on role and responsibilities. The world is going through changes. At Neste our strategy reflects the understanding and mindset that we can be in charge of these changes to serve our purpose: to create a healthier planet for our children. In the end, it is the people who make the company.",https://media.glassdoor.com/sql/2356464/ofichem-group-squarelogo-1637320644831.png,Leiden,nan,Ofichem Group
Supply Chain Analyst,"Ofimedicine
Leiden
Fulltime
22 mei 2023
Bedrijfsprofiel
Ofimedicine, gevestigd op het Leiden Bioscience Park, produceert kwalitatief hoogwaardige medicijnen en levert diensten ten behoeve van de Europese markt. Met behulp van ons R&D laboratorium, GCLP-laboratorium en onze GMP-productie-omgeving bieden wij flexibele oplossingen op grote en kleine schaal. We zijn een jong bedrijf dat onderdeel is van de Ofichem Groep.

Functieomschrijving
Als Supply Chain Planner zorg jij ervoor dat onze geneesmiddelen tijdig geleverd worden aan onze klanten.

Jouw belangrijkste taken en verantwoordelijkheden:
Je ontwikkelt en optimaliseert onze Supply Chain Planning aanpak, passend bij de huidige en toekomstige omvang van Ofimedicine.
Je maakt optimaal gebruik van de mogelijkheden die ons ERP systeem QAD biedt, om daarmee de logistieke performance te verhogen.
Je ontwikkelt de farmaceutische productie- en distributieplanning op basis van de binnengekomen bestellingen. Deze planning komt tegemoet aan de klantvraag en sluit aan bij de productiecapaciteiten.
Je controleert en volgt voorraden van grondstoffen, emballage en materialen en zorgt voor tijdige bestelling door Inkoop.
Je controleert en volgt de productievoortgang in samenwerking met de Manager Manufacturing & Technology.
Afstemming en organisatie van distributie naar onze klanten.
Je signaleert proactief issues die een risico vormen voor de productie- en distributieplanning.
Je communiceert op professionele wijze met interne en externe belanghebbenden waardoor je transparantie creëert.
Omdat we een jong bedrijf zijn met een start-up cultuur, kun je worden betrokken bij andere activiteiten die passen bij (het ontwikkelen van) jouw talenten.
Wij vragen:

Je beschikt over minimaal een HBO opleiding
Je hebt in ieder geval affiniteit met productieplanning en MRP
Je hebt ervaring als Supply Chain Planner

Geboden wordt:

Ruimte voor ontwikkeling en persoonlijke groei;
Een afwisselende functie met veel diversiteit, vrijheid en verantwoordelijkheid;
Een dynamische werkomgeving binnen een hard groeiend en internationaal bedrijf;
Een enthousiast team met de ambitie om samen door te groeien;
Een marktconform salaris;
28 vakantiedagen [bij fulltime] en 8% vakantiegeld.

Ben je enthousiast geworden?
Solliciteer dan direct en stuur je CV en motivatiebrief per email naar: recruitment@ofichem.com.",https://media.glassdoor.com/sql/2185871/stroom-squarelogo-1646798234125.png,Delft,€3K - €4K (Employer est.),STROOM Supply Chain Recruitment
