job_titles,job_description,images,locations,salaries,companies
Junior Supply Chain Analyst,"Tactical supply chain planner

(Fulltime, 38 hours per week)

Do you want to join a new international team and are you keen to participate in project that will improve our processes? Then you could be our new Tactical Supply Chain Planner in our Head Office in North-Holland. You will work on our huge logistics challenge of keeping more than 11 million customers happy every week by offering over 6,000 products at the lowest prices in more than 2,000 stores around Europe. At the same time, the number of our stores and distribution centres continues to grow.
This is your daily action

You will act as our senior expert at the heart of our supply chain operation. As a Tactical Supply Chain Planner, you will enable fellow planners to do their jobs in the best possible way. By anticipating and translating future aspects and capacities into planning parameters and a flow of goods strategy, you’re able to plan up to 2 years ahead. You will work closely with the operational supply planners and your colleagues in Capacity, Commerce and Controlling.
As a Tactical Supply Chain Planner :
Drive the optimization of the Action’s supply chain network by setting up a replenishment parameter structure with the goal of optimal utilization of the Network at the lowest cost.
You’re responsible for the replenishment parameters of all inbound flows from Asia and Europe, their optimization and coordination with the operational Supply Planners
You facilitate a continuous improvement process a.o. by setting up a new BI landscape and further developing data driven process decisions.
You act as the go-to person for complex network issues, facilitate and drive discussions and follow-up with internal and external stakeholders in this.
You anticipate internal and external effects affecting the supply chain such as Chinese New Year, commercial seasons, supply chain disruptions, etc. and translate these to the impact on the network through simulations and recurring patterns.
You work on developing Supplier Level Agreements (SLA) regarding delivery performance, reliability, availability, OTIF, etc. and their follow-up.
You participate in and lead improvement projects to make the chain more scalable and manageable such as DC/HUB expansion, Dual sourcing and CFS.
You work closely with both our commercial and logistics departments and suppliers to optimize performance and processes.

Meet your team

High-level planning is achieved with our 70-strong Supply Chain Planning team. With a global scope, a highly dynamic product range and a growing number of distribution centres, stores, hubs and cross-docks, you will face exciting challenges day in, day out. A sense of resilience is needed to deal with these challenges, and that's why we invest heavily in developing innovative tools as well as in everyone who works at Action through extensive training programmes and more. We offer a vibrant work environment that will help you to take the next step. Many colleagues have already led the way and will be happy to guide you through our unique team and our varied work.
This is you

If you see that something could be done more efficient or more effectively, you'll be itching to get started! You also gain energy from structuring and improving processes. Others describe you as organised, flexible and someone who can go the extra mile. You'll also find that teamwork makes the dream work, as the saying goes, which is why you enjoy working with colleagues. You're also able to put your strong communication skills to good use to build a constructive relationship with your stakeholders and incorporate them into your plans.
What else:
You have a bachelor or master degree, preferably in Supply Chain
At least 8 years of experience in Supply Chain Management, for example as a planner or analyst in an (international) retail company
You have an analytical mindset and an expert in Excel
You have experience in project management
Good level of English
How we contribute to society

If you only know Action from the stores, a world will open up for you when you join us. For example, we are working hard behind the scenes to make a positive impact on society and the environment. Did you know, for example, that we sponsor more than 2,000 children worldwide who are growing up in an SOS Children’s Village? That our team reflects the diversity of our customers, including 124 nationalities? That we already source 70% of our wood products and 86% of our cotton sustainably? And that only energy-efficient LED lighting is used in more than half of our stores? Yes, that is also Action. Curious about what other initiatives we’re facilitating? Join our team and find out for yourself.
Interested?

Take action and apply now!
The next steps
Our recruiter will review your application and get back to you as soon as possible.
We invite you for a first job interview.
We would like to get to know you better, which is why we ask you to take an online assessment.
We will invite you for a second interview and we will discuss your assessment
Are will still a great match? Then we will become new colleagues!",https://media.glassdoor.com/sql/1200935/walters-people-squareLogo-1611226039363.png,Rotterdam,€3K (Employer est.),Walters People3.7 ★
Operations Coordinator,"Do you have your bachelor's degree (or masters) in Supply Chain management, Logistics or a related field? Are you excited to make your first step in your career in this industry? Are you intrigued by international companies and want to learn from the best? Do you have strong analytical skills and do you want to use the theory learned in University in practice? Are you as excited as we are?! Keep reading!
For our international client in Rotterdam, we are looking for a Junior Supply Chain Analyst. You will join an international company - a leader in sales, distribution & transportation of specialised raw materials in the pharmaceutical, chemical and food industries. The company's products are all around us: from the snack you eat to the smartphone and laptop we use every day. Besides quality of the products, sustainable partnerships and delivery reliability, the expertise of their own people is valued highly. If you have any ideas in these areas; the company is very open to your ideas!
As a Junior Supply Chain Analyst, you act as a link between various departments. The atmosphere at the company in Rotterdam can be described as 'working hard in a nice informal atmosphere in a driven and open team'. In this role, the days are never boring!

Tasks and responsibilities

Analysing current performance of different departments
Ensuring the execution of cycle counts and troubleshooting in the field of stock differences
Drawing up improvement proposals, new internal goals and Kpi's
Making process analyses and advice for the Management Team

Job requirements

Completed HBO/WO education (preferably in Supply Chain or Logistics)
Strong interest in improving Supply Chain processes
Proactive, driven, analytical and communicatively strong
Good command of the Dutch and English languages (any additional language is an advantage)
Full-time (40 hours) availability
Prospect of an indefinite contract with a large international player with a familiar atmosphere
Salary up to €3300 based on 40 hours

Our offer

Challenging work environment with ample training opportunities and an employer who likes to invest in its own people
Travel allowance
Holidays and pension
Internal career opportunities (horizontal and vertical)
Access to the Walters People Academy (and therefore certified training courses)
Friday afternoon drinks and other fun outings
A communicative, commercial, creative, solution-oriented position where you can use your energy and creativity in a passionate team in an ambitious organisation

Are you ready for this job?! Then I would love to get in touch with you to discuss this position in detail. Press the button to apply or send your CV directly to tessa.smit@walterspeople.nl.

Do you have your bachelor's degree (or masters) in Supply Chain management, Logistics or a related field? Are you excited to make your first step in your career in this industry? Are you intrigued by international companies and want to learn from the best? Do you have strong analytical skills and ...",https://media.glassdoor.com/sql/4206/samsung-electronics-america-squarelogo-1542763337200.png,Delft,nan,Samsung Electronics3.4 ★
Supply Chain Planner,"Position Summary
Are you looking to join the Global Leader in production and sales of Consumer Electronics? Do you like to work in a dynamic, challenging and international work environment? Then we have a fantastic opportunity for you to join our best-in-class team as: Operations Coordinator

Samsung Electronics Europe Logistics (SELS) is the Central European logistics organization of Samsung Electronics based in Delft, The Netherlands. SELS functions as a logistics and financial control tower within Samsung Europe, with a focused role in logistics & supply chain strategy, innovation and governance. SELS has approximately 200 employees located in the Netherlands and Slovakia.

The West Operations team governs and develops the logistics operations and distribution networks in Europe (central, local) in cooperation with our logistics service providers (4PL, 3PL).
By translating voice of customer and business requirements into best practice logistics solutions, initiating advanced logistics innovation, and secure operations excellence.

The West Operations team is monitoring the SCM and logistics operations for the European Supply Chain of Samsung finished goods. The aim of the team is to create an optimal alignment of demand and supply in order for Samsung Sales to be able to provide sufficient service to all customers in Europe. Customers are the Samsung sales organizations in Europe, the products are shipped to 3rd parties.
Role and Responsibilities
Your main responsibilities will include:
[Performance Management] Execute EU Online Operations monitoring & analysis activities in order to maximize efficiencies, on time delivery and customer satisfaction (Net Promoter Score); Perform daily reporting on delivery status of online orders; Monitor and report logistics performance by LSP to achieve KPI targets; Define/measure logistics KPIs of online business and improve them; Support peak season logistics preparations; Direct follow up/resolve issues with LSP/sales subsidiaries; Management reporting on actions and progress; Analyze NPS result and find out the solution to improve NPS;
[Process Innovation] Keep informed and gather business developments and progressing requirements from European
Sales subsidiaries and customers in order to provide agile logistics and supply chain solutions; Propose process improvement plans to SELS management to increase efficiency and improve quality; Initiate and/or develop, in close cooperation with 4PL partners, opportunities to increase service levels and efficiency; Identify, advise and present sales subsidiaries with tailored SCM/logistics solutions and best practice sharing; Expand network (internal & external) to enhance insights in logistics and supply chain trends and developments in order to maintain the organizational competence for initiating or evaluating innovative SCM/logistics solutions; Participate in interdepartmental logistics projects; Occasional travel within Europe may be required;
What we offer:
Working at the Global Leader in Consumer Electronics and in a best-in-class team environment comes with hard work, but we also make it rewarding through:
 A competitive base salary depending on your profile; Annual performance related bonuses (twice per year); 25 holidays (and Good Friday off) and additional loyalty days based on your service period; Fully compensated health care insurance (extensive coverage); Well-arranged pension scheme with an extensive employer contribution; Compensation of your fitness subscription; Free drinks and fresh fruit at the office; Employee shop to purchase Samsung products with discount; Bicycle plan.
Skills and Qualifications
Who we are looking for:
Bachelor degree in Logistics/Supply Chain management (preferred);
1 - 3 years working experience, (operational experience in online business environment preferred, warehousing / transportation);
Proficient in Korean and English (Bi-lingual or Multilingual preferred);
Advanced skills in MS Office (Excel and Access) and ERP system;
Professional with strong analytical and communication skills;
Furthermore, your passion for numbers and analytics is evident as you develop reporting and analytics including and combining a variety of data from multiple sources and systems (cost metrics, cost trends, business analysis, logistics parameters, actual vs. budget, forecast). Your attitude can be described as flexible and hands-on, which is required in the dynamic, challenging and high performance work environment Samsung offers. We are looking for a team player who is result and solution oriented and able to work independently. You have excellent communication skills and cultural understanding. Furthermore, you take ownership and accountability in your role.
What’s next:
We hope that we have triggered your interest to join our company. If so, please make sure to apply right away and we will be in touch with you shortly.Please note that Samsung will treat your application confidential and will process your personal data in line with the applicable EU GDPR. Samsung will not request any information which could be contrary to any confidentiality agreement you may have with your current or any previous employer.",nan,Zwolle,€3K (Employer est.),Uitgekookt - Van Marle BV
Supply Chain Analyst,"Supply Chain PlannerElke week staan er 24 andere maaltijden op het menu bij Uitgekookt en die maaltijden worden meerdere keren per week vers bereid en uiterlijk de volgende dag bezorgd bij onze klanten. Jij bent verantwoordelijk voor het tijdig in huis hebben van de verse ingrediënten. Je bent onderdeel van het bedrijfsbureau waar ook de bezorging van de maaltijden gepland wordt. Je houdt veel ballen in de lucht en geen dag is hetzelfde.PlanningJe bent verantwoordelijk voor de het tijdig bestellen van de ingrediënten. Veel werk daarin wordt uit handen genomen door het systeem. Als leveranciers niet kunnen leveren, te laat leveren of de kwaliteit onvoldoende is, kom jij in je kracht en los je die problemen zelfstandig op. Je houdt overzicht en weet incidenten te managen. Daarbij werk je nauw samen met productontwikkeling. Zij selecteren leveranciers en producten en onderhandelen voorwaarden. Jij denkt daarin mee en signaleert kansen en verbeterpunten.Daarnaast ondersteun je de collega’s op de logistieke planning en kun je deze vervangen.Spin in het webAls supply chain planner ben je de spin in het web. Je hebt het overzicht wat wanneer moet gebeuren in de verschillende keukens en de orderpick. Je kunt in overleg met teamleiders snel schakelen als zaken anders lopen dat gepland. Je bent sterk in communicatie en kan ook onder druk de juiste keuzes maken.Kortom; een afwisselende rol met veel eigen verantwoordelijkheid. Daarnaast zijn er volop mogelijkheden jezelf binnen de organisatie verder te ontwikkelen in de richting die bij jou past.Jouw profielEen afgeronde relevante opleiding bijvoorbeeld HBO AD Management of MBO supply chain plannerAffiniteit met inkoop;Je bent communicatief sterk en past je communicatie aan op de situatie en je gesprekspartnerJe kunt sturend en direct zijn maar bent in de basis sociaal en inlevendJe bent accuraat en werkt gestructureerd om zo het overzicht te houdenJe houdt van afwisseling en speelt soepel in op calamiteiten en ad hoc zakenAanbodJe maakt deel uit van het team logistiek en bedrijfsbureau dat bestaat uit ongeveer 7 collega’sJe voelt je thuis in een organisatie met familiaire cultuur waarbinnen intensief wordt samengewerkt.Uitgekookt biedt volop opleidings- en doorgroeimogelijkhedenEen aantrekkelijke bonusregeling obv het resultaat van Uitgekookt en persoonlijke prestatieSalaris Euro 2.799,- obv 40 uur.Over UitgekooktUitgekookt groeit ongekend hard! Het bedrijf dat ruim 190 jaar geleden begon als een lokale groenteteler is inmiddels uitgegroeid tot de grootste verse maaltijdservice van Nederland. We zijn er met 300 collega’s en 900 bezorgers voor ruim 250.000 klanten in het hele land. Uitgekookt heeft de traditionele markt voor kant-en-klaarmaaltijden veranderd in een verse, gastronomische maaltijdservice voor jong en oud. Door de innovatieve manier van bereiding, met verse ingrediënten en zonder conserveringsmiddelen, blijven de smaak en voedingsstoffen van elk gerecht behouden.Interesse?Stuur dan je motivatie en CV naar Uitgekookt t.a.v. Miranda van MarleSoort dienstverband: Fulltime, Vaste baanSalaris: €2.799,00 per maandRooster:Dagdienstma-vrWeekendbeschikbaarheidSecundaire arbeidsvoorwaarden:BedrijfsfeestenReiskostenvergoedingSoorten aanvullende vergoedingen:BonusregelingOveruren uitbetaaldVakantiegeldWerklocatie: Fysiek",https://media.glassdoor.com/sql/4771926/keser-squarelogo-1636620038128.png,Den Bosch,nan,Keser
Super User,"The Supply Chain Analyst is responsible for inventory management and provides support to achieve the Service, Financial, New Product Launches, Continuous Improvement, and Quality/Compliance objectives and metric goals. Ensures that supply chain activities are well-planned and coordinated to support business needs. Performs analysis of supply chain data, draws appropriate conclusions, makes recommendations for organizational activities, and participates in their implementation.


Responsible for inventory management throughout European stock locationsMonitors and analyzes the usage and forecast inputs to provide a reasonable demand planResponsible for cycle count reconciliation activities for throughout European locationsCoordinates and optimizes service levels with 3PL warehouses and carriersSubmits routine reports of inventory, logistics and sales metrices
Identifies potential business risks and addresses them to managementSupports minimizing excess and obsolete exposure and product write off/scrap
Prepares reports and assesses metrics for periodic Site Management ReviewsCoordinates and prioritizes rework of damaged devicesBack-up Customer Service Representative
Back-up daily sales reporting

For this position of Supply Chain Analyst, our client sets the following requirements:
- Education at Bachelor's level or equivalent
- 2 years experience in Supply Chain 
- Fluent in English
- Able to prioritize and work independently 
- Attention to detail and good problem solving skills 
- Full-time availability 
- No relocation possible

As a Supply Chain Analyst you will be part of an involved, international and ambitious team. In addition, our client offers favourable working conditions. A salary up to €4.500 gross a month based on 40 hours per week, 25 holidays, working from home possibilities, travel allowance and a bonus.",https://media.glassdoor.com/sql/650250/dhl-squareLogo-1685024068530.png,Beringe,€3K - €4K (Employer est.),DHL3.9 ★
Job opportunities with the ICRC,"“Someone who solves a problem, you didn’t know you had in a way you don’t understand. Also known as a WIZARD or a MAGICIAN”.
Herken jij je in bovenstaande uitspraak? Wij zijn op zoek naar een Superuser met bij voorkeur, kennis van JDA. Je geeft in deze rol eerstelijns ondersteuning voor hardware en gebruikersproblemen en verzorgt trainingen aan key-users binnen onze site in Beringe.
Jouw plaats in de organisatie
Jij gaat als Super User aan de slag op één van onze vijf sites in Beringe. Hier zijn wij gericht op klanten vanuit de Technology sector. In dit geval zal jij aan de slag gaan binnen de operatie voor onze klant Cisco. Samen met jouw directe collega Super User ben jij onderdeel van een team van 8 collega’s waaronder engineers. Je rapporteert aan de Business Process Manager.
Dit ga je doen als Super User bij DHL Supply Chain
Na een gedegen inwerkperiode zal jij steeds meer zelfstandig aan de slag gaan. Als Super User ondersteun jij de operatie tijdens kritische issues (zoals bijvoorbeeld systeem uitval en printer problemen). Daarbij log je de IT tickets en ondersteun je de collega’s. Hierin ben jij degene die de complexe issues begrijpt en oplossingsgerichte voorstellen doet.
Daarnaast houd jij je bezig met:
Het trainen en instrueren van key-users conform de behoefte van de site.
Support geven aan gebruikers met betrekking tot de betreffende applicatie(s).
Een bijdrage leveren aan projecten met betrekking tot de betreffende applicatie(s).
Het verzorgen van de implementatie van corporate initiatieven voor verbetering van de datakwaliteit en deze bewaken.
Het tijdig informeren van de key-user betreffende wijzigingen in de applicatie(s) en procedures.
Het identificeren van de risico’s en knelpunten in het gebruik en deze tijdig rapporteren aan de leidinggevende.
Jij ziet erop toe dat standaarden en normen worden opgevolgd en gewaarborgd en geeft gesignaleerde knelpunten aan de leidinggevende door.
Jij stelt voorstellen voor wijzigingen op en meldt deze voor beoordeling aan de leidinggevende
Arbeidsvoorwaarden
Fulltime functie (36 – 40 uur per week)
Werktijden: in de basis tussen 08:00 – 18:00 uur. Dit is flexibel, een andere invulling is ook mogelijk tussen 06:00 – 20:00. 1x per kwartaal is kwartaal-einde, daar werken we met de site in het weekend, ook een potentiële nachtdienst. En soms wordt er op een zaterdag gewerkt.
Salaris in cao schaal 8 (tussen € 2800,- en € 3600,- afhankelijk van kennis en ervaring)
25 vakantiedagen (bij een fulltime dienstverband)
8% vakantiegeld
De mogelijkheid om 8 vakantiedagen per jaar bij te kopen
Reiskostentegemoetkoming
Secundaire arbeidsvoorwaarden, zoals een cao á la carte budget dat je naar eigen inzicht kan besteden (bijvoorbeeld aan extra vakantiedagen)
Werken met nieuwe innovaties en technieken waarmee we voor onze klanten het verschil maken.
Een werkplek binnen een organisatie die de eigen medewerkers waardeert en volop kansen biedt om zichzelf verder te ontwikkelen en door te groeien.
Wat zoekt DHL Supply Chain in een nieuwe Superuser
HBO werk- en denkniveau op het gebied van bijvoorbeeld ICT, Bedrijfskunde, Economie of Logistiek Management.
Kennis van JDA is een pré.
Kennis van ontwikkelingen en mogelijkheden op het gebied van ICT.
Omgaan met medewerkers binnen alle geledingen van de organisatie.
Overtuigingskracht; voor het trainen, instrueren, motiveren en corrigeren van betrokkenen binnen de organisatie / projectteamleden.
Mondeling en schriftelijk uitdrukkingsvaardig in de Engelse taal benodigd om op alle niveaus te kunnen communiceren en te rapporteren. Nederlands is een plus.
Analytisch vermogen en praktisch inzicht om bedrijfsprocessen te analyseren en de afhankelijkheden ervan te doorzien en te komen met oplossingen.
Solliciteren en contact

Ben jij klaar voor deze nieuwe rol? Solliciteer dan door jouw motivatiebrief en cv te sturen via de knop “solliciteer”.
Eerst nog vragen? Neem dan contact op met Susan de Graaff (Corporate Recruiter) via susan.de.graaff@dhl.com .
Acquisitie na aanleiding van deze vacature wordt niet op prijs gesteld",https://media.glassdoor.com/sql/1074834/rode-kruis-squarelogo-1450710892875.png,Netherlands,nan,Rode Kruis3.8 ★
Supply Chain Specialist,"Job opportunities with the ICRC
The International Committee of the Red Cross (ICRC) is the part of the Red Cross and Red Crescent movement, only their mission focusses on protecting and assisting people affected by armed conflicts and other situations of violence. The ICRC also endeavors to prevent suffering by promoting respect for international humanitarian law (IHL). Some of their unique tasks are reuniting families separated because of a conflict, visiting places of detention and promoting and strengthening humanitarian law and universal humanitarian principles.
The ICRC is not looking for volunteers, they only recruit professionals for a wide variety of roles and specialisms to work in 90 countries in the following fields: medicine & health care, forensics, engineering, water & habitat, agronomy, livestock veterinary medicine, logistics, supply-chain management, economic security & relief, finance, IT, HR, international humanitarian law, weapon contamination and & with arms carriers and interpreters in up to 20 languages.
They also offer paid traineeships in headquarters in Switzerland to help young graduates obtain a first work experience. For the job opportunities of the ICRC worldwide: https://careers.icrc.org/
Solliciteren
Solliciteren
Publicatiedatum
24-3-2022
Deel deze baan",https://media.glassdoor.com/sql/5526533/vakarbeid-squarelogo-1646910651003.png,Almelo,€3K (Employer est.),Vakarbeid B.V.
