job_titles,job_description,images,locations,salaries,companies
Betrouwbare productiemedewerker gezocht!,"Werken aan een mooi eigen ontwikkeld product voor in de vee-industrie. Makkelijk bereikbaar, heel veel afwisseling in het werk en een goed salaris.
Wat je doet als productiemedewerkermedewerker metaal
bedienen van de lasrobot
(de) monteren van het eindproduct
Transport klaarzetten van het product
Bevoorraden van de productiehal
meehelpen met voorbereidende werkzaamheden zoals zagen, knippen en boren.

Wat je krijgt als productiemedewerker metaal
Goed salaris
Vakantiegeld 8,33%
25 vakantiedagen en 13 ATV dagen o.b.v. fulltime
Kilometervergoeding volgens CAO M&T
3 x Half uur pauze om op social media te kunnen kijken tijdens het eten ;-)
Gezellige vrijdagmiddag borrel
Zo ziet jouw week als productiemedewerker metaal eruit
Na het nemen van een verrukkelijk bakje koffie ga je samen met de planning de werkdag doornemen. Je begint met het lossen van de vrachtwagen om daarna het product verder af te monteren. De montage bestaat uit het aan monteren van de niet metalen onderdelen, zoals rubberen en plastic onderdelen. Tussendoor bevoorraad je de productiehal en daarna begin je aan het transport klaarzetten van de te laden producten welke naar de verzinkerij moeten. Op vrijdag sluit je de week af met een gezellige borrel.
Waarom je een Happy Worker wordt met deze baan
Naast je veel afwisseling in deze baan hebt werk je aan een mooi uniek eindproduct. Uit ervaring met deze opdrachtgever weten wij dat er een grote kans is op een vaste aanstelling. De locatie is makkelijk bereikbaar en de cultuur is open en eerlijk.
Enthousiast om te solliciteren via Axxent?
Bij Axxent matchen we alleskunners aan banen waar ze gelukkig van worden. Dat doen we in verschillende branches en disciplines met behulp van verschillende diensten. Praktisch ingesteld, betrokken en slagvaardig. We kijken naar ontwikkeling/opleiding en werkgeluk. Ons motto: Good Work, Good Life… een leuk leven is een balans tussen werk dat bij je past en een leuk leven.
Check of je voldoet aan de basiseisen
Als je het verschil weet tussen een bout en een moer dan komt het vast goed
We zoeken iemand die past in een nuchtere boeren cultuur
Solliciteer op de vacature montagemedewerker metaal
Gebruik het formulier, bel, mail of app. We bespreken samen de vacature en daarna brengen we je zo snel mogelijk in contact met jouw mogelijk nieuwe werkgever!",nan,Breda,nan,Lion Laser Systems BV
Productiemedewerker,"Betrouwbare productiemedewerk(st)er gezocht.Weet jij van aanpakken? Dan zijn wij op zoek naar jou.Wie zijn wij?Wij zijn Lion Lasers, een bedrijf met 18 leuke medewerkers.Wij bedenken, maken en verkopen lasersystemen. Met deze lasersystemen kunnen wij producten graveren of snijden.Naast het bedenken en bouwen van de systemen gebruiken wij deze machines ook zelf voor het uitvoeren van productieopdrachten. Bijvoorbeeld lasergraveren van typeplaatjes, machinedelen, bekers, houten tafelbladen enzovoort.Wij zoeken versterking om de producten van onze klanten te graveren en/of snijden. Kennis van onze machines heb je niet nodig, maar een aanpakkersmentaliteit wel! Én je moet zorgvuldig kunnen werken. Ben jij onze leuke, nieuwe collega?Wie ben jij en hoe ziet je werkdag eruit? Je start ‘s morgens tussen 8 uur en 9 uur.Bij binnenkomst begroet je de aanwezige collega’s en pakt een kop koffie.Bij de start van de werkzaamheden klok je jezelf in en kijkt in de productieplanning wat je vandaag kan gaan doen. O leuk, het zijn 500 typeplaatjes waar een QR code op moet komen te staan.De machine staat al ingesteld dus je kan gelijk aan de slag. Jij hebt zin om te knallen!Als alle typeplaatjes gegraveerd en netjes ingepakt zijn, geef je dit door aan de werkvoorbereider.Je kijkt daarna nog een keer in de productieplanning om te zien welke opdracht je nu kan gaan graveren. Het zijn 100 bekers waar een logo op gegraveerd moet worden. Tijdens het graveren valt je op dat je tussendoor best een tijd moet wachten…Je houdt niet van wachten, dus spreekt de werkvoorbereider hier op aan. Samen kijken jullie of er twee orders tegelijkertijd gegraveerd kunnen worden. Hierdoor hoef je niet te wachten en vliegt de tijd voorbij. Natuurlijk zorg je er wel voor dat de kwaliteit van de producten en gravures goed blijft.Zo, jij bent goed bezig geweest. Het is 12:00 uur en dat betekent middagpauze. Gezellig met de collega’s eten en misschien durf je je aanstaande collega’s uit te dagen voor een potje tafelvoetbal.In de pauze is je opgevallen dat er wat vlekken op de vloer in de keuken zitten en dat de ramen ook wel een poetsbeurt kunnen gebruiken. Je vraagt aan je leidinggevende of je dit misschien op kan pakken. Samen plannen jullie dit in.In de middag nog een grote productie opdracht en dan zit je werkdag er weer op. Woow, de dag is omgevlogen en je gaat met een glimlach naar huis.Kortom: weet jij van aanpakken en denk je graag mee hoe iets verbeterd kan worden? Dan ben jij degene die wij zoeken!Jouw taken zijn o.a.:- Werkbonnen en planning bekijken om te zien wat je vandaag gaat doen- Producten netjes uit- en inpakken- Productie van graveerwerk en naambadges- Schoonmaakwerkzaamheden (ca 4u/week)Wat bieden wij?Een leuke combinatie functie voor minimaal 28 uur in een dynamisch bedrijf en hecht team. Wij bieden goede en marktconforme arbeidsvoorwaarden. Werkplezier vinden wij heel belangrijk.Interesse? Stuur je CV en motivatie!Liever nog meer info? Bel met Maartje Hop-Bogers op 076 581 0101.Soort dienstverband: ParttimeParttime uren: 28 per weekRooster:ma-vrSecundaire arbeidsvoorwaarden:KerstpakketKosteloos parkerenPensioenReiskostenvergoedingSoorten aanvullende vergoedingen:BonusregelingVakantiegeldWerklocatie: Fysiek",https://media.glassdoor.com/sql/3049451/4-minutes-squarelogo-1630042065986.png,Almelo,€12.39 - €14.37 Per Hour (Employer est.),4 Minutes2.7 ★
Assemblage medewerker Veenendaal,"Ben jij de aanpakker die ons team kan komen versterken? Ga aan de slag als Productiemedewerker bij ZT! Een werkplek vol uitdaging, doorgroeimogelijkheden en leuke collega's!

Wat wordt er van je verwacht
Bij ZT Netherlands wordt de serverkast van A tot en met Z geproduceerd. Binnen het productieproces zijn hiervoor verschillende afdelingen opgesteld waar jij als productie medewerker aan de slag kan gaan.
Wat zoeken wij
Jij hebt natuurlijk zin om aan de slag te gaan, waarmee je het halve werk al hebt gedaan. Daarnaast is het ook handig als jij:

Woonachting bent in Almelo of omgeving;
Technische ervaring is mooi meegenomen maar geen vereiste;
Beschikbaar bent in de 2 ploegen;
Ochtenddienst is van 6:00 tot 14:30 uur
Middagdienst is van 14:30 tot 23:00 uur

Wat bieden wij
Bij ZT Netherlands bieden wij je een fulltime productie baan van 38 uur per week vol uitdaging en met leuke collega’s. Daarnaast krijg je natuurlijk nog veel meer van ons!

Bruto uurloon van €12,39,- o.b.v. 18 jaar en ouder;
16% ploegentoeslag waarbij je op een bruto uurloon komt van €14,37!
Reiskostenvergoeding vanaf 10km;
Na 52 gewerkte weken heb jij jouw eerste loonsverhoging binnen;
Bij goed functioneren maak je kans op een vast contract bij 4 Minutes.
Over het bedrijf
ZT Netherlands is een internationaal bedrijf dat servers voor dataopslag maakt. De servers worden gemaakt voor de grootste internationale bedrijven ter wereld. Dit doen we elk dag met zo’n 750 collega’s.

Succes begint met mensen. Vanaf de eerste dag hebben de teamleden het bedrijf helpen opbouwen door innovatie, hard werken en relaties. Dit is de basis van het leiderschap van ZT in de sector. Om het succes te behouden, houden ze de lat hoog terwijl ze een respectvolle en lonende omgeving bevorderen waarin mensen zich kunnen ontwikkelen.

Ben jij de geschikte Productiemedewerker voor ZT Netherlands? Solliciteer nu snel en makkelijk via de onderstaande knop en wij zullen binnen 1 werkdag contact met je opnemen.

Heb jij vragen of ben je al ingeschreven bij ons? Je kunt telefonisch contact met ons opnemen via 0546-200055 of per e-mail via almelo@4minutes.nl",https://media.glassdoor.com/sql/3053483/attract-uitzendbureau-squarelogo-1629465366722.png,Veenendaal,€2K (Employer est.),Attract Uitzendbureau4.5 ★
Productiemedewerker(s),"Werken met je handen is jou niet vreemd. Je hebt licht technisch inzicht en zoekt een baan waar je door je inzet en hart voor de zaak kans maakt op een vaste baan.
Wat ga je doen?

Als assemblagemedewerker ben je verantwoordelijk voor het in elkaar zetten van diverse zuilen en toebehoren van de ondergrondse containers. Je werkt in Veenendaal, maar indien nodig vind je het ook leuk om samen met een monteur onderhoud uit te voeren en storingen te verhelpen in de buitendienst. Je test de elektronische onderdelen en verwerkt deze. Voordat het product af is, voer je de eindcontrole uit. Je staat achter je product en weet dat wat er uit jouw handen komt topwerk is. Je werkt in een klein en rustig team en voel je verantwoordelijk voor hetgeen je uitvoert.

Wat vragen we van je?
Je hebt licht technisch inzicht;
Je hebt minimaal een afgeronde vmbo-opleiding;
Je werkt secuur;
Je bent een echte teamplayer.
Wat bieden wij?
Een bruto salaris tussen de € 1.900 en € 2.400 per maand, afhankelijk van leeftijd en relevante werkervaring;
Werken bij een mooi en betrouwbaar familiebedrijf;
Een baan waar je echt een vak mag leren;
Kans op een vast dienstverband;
Veel verantwoordelijkheid dragen voor een mooi eindproduct.

Ben jij op zoek naar een technische productie/assemblage baan, dan is dit misschien wel de baan waar je naar op zoek bent. Neem dan snel contact met ons op. We komen graag met je in contact. Je kan ons bellen via 0318745785 of via veenendaal@attract.nl.",nan,Utrecht,nan,Chiorino Benelux B.V.
Productiemedewerker hout,"Wie is Chiorino BeneluxWij zijn een groeiend en actief bedrijf op het gebied van transportbanden, drijfriemen en service voor deze producten. Ons afzetgebied omvat de gehele Benelux. Chiorino Benelux is een dochteronderneming van een wereldwijd opererende producent van transportbanden. Op onze locatie in Utrecht maken wij transportbanden en voorzien deze van allerlei mogelijke accessoires. Chiorino is een solide en financieel gezonde organisatie waarbij er alle mogelijkheden zijn om door te groeien.Waarom zoeken wij ProductiemedewerkersChiorino is actief binnen de Benelux en vanwege onze jaarlijkse, sterke groei, zijn wij op zoek naar enthousiaste en goed gemotiveerde productiemedewerkers.In onze werkplaats te Utrecht worden kunststof transportbanden op klant specifieke eisen gemaakt. Dit wordt deels machinaal deels handmatig uitgevoerd. Onze producten worden in veel verschillende branches ingezet denk hierbij aan logistiek, voeding en postverwerking.Hoe ziet de functie van Productiemedewerker er precies uitNa een gedegen inwerkperiode kun je zelf alle voorkomende werkzaamheden voor het maken van transportbanden uitvoeren. Dit betreft het eindloos maken van banden, banden voorzien van stuursnaren, meenemers plaatsen enzovoorts. Het betreft een zeer afwisselende functie waarbij je samen met je directe collega’s de gestelde doelstellingen weet te behalen.Een technisch opleiding en/of inzicht in techniek is noodzakelijk voor het uitvoeren van de werkzaamheden.Welke werkzaamheden ga je uitvoeren:Na een grondige inwerkperiode op diverse afdelingen ben je in staat zelfstandig alle voorkomende werkzaamheden voor het maken van transportbanden uit te voeren.Na de inwerkperiode ga je met een van onze teams aan de slag.Bij ons ligt de nadruk op het, samen met het team waar je deel van uitmaakt, nauwkeurig en netjes werken.De werkzaamheden worden zowel machinaal- als handmatig uitgevoerd.Wij zoeken Productiemedewerkers die:leergierig zijn en voldoende doorzettingsvermogen hebben.een flexibele instelling hebben.bereid zijn hun collega’s te helpen ook als dat na half vijf is.Bereid zijn hun kennis zowel intern- als extern op een hoger niveau te brengenHet profiel van de Productiemedewerkers:Je hebt minimaal de opleiding LBO techniek afgerond.Je beschikt over een goed mondelinge en schriftelijke uitdrukkingsvaardigheid.Je woont bij voorkeur in Midden Nederland.Wat biedt Chiorino jou?Een zeer afwisselende en baan met goede doorgroeimogelijkheden.Goede opleidingsmogelijkheden zowel intern als extern.Een leuk team aan collega’s die bereid zijn jou alle kennis te leren die je nodig hebt.Een financieel gezonde en solide werkgever die omkijkt naar haar medewerkers.Secundaire arbeidsvoorwaarden:VakantiegeldPensioenSoort dienstverband: Fulltime, Onbepaalde tijdRooster:DagdienstSecundaire arbeidsvoorwaarden:KerstpakketPensioenReiskostenvergoedingWerklocatie: Fysiek",https://media.glassdoor.com/sql/4764040/verdo-werkt-squareLogo-1619418080372.png,Apeldoorn,€2K - €3K (Employer est.),Verdo Werkt4.8 ★
