job_titles,job_description,images,locations,salaries,companies,pros,cons
IT Business Systems Analyst,"Job Description
Everyone at Kite is grounded by one common goal – curing cancer. Every single day, we seek to establish a direct line between that purpose and our day-to-day work. Would you like to join us in this mission?
We are seeking a highly motivated individual to join our team in Hoofddorp, Netherlands as an IT Business Systems Analyst.
As an IT Business Systems Analyst you will be responsible for the delivery of support on the technology platforms, that support Kite’s operations in our manufacturing site. The IT Business Systems Analyst will collaborate with their business counterparts in identifying new enhancements to enterprise and quality systems. This includes request prioritization, gathering of detailed IT requirements, updating and approving specifications, test scripts, and supporting user acceptance testing.
You will be an integral and highly visible part of Kite’s Site IT team, reporting directly to the Site IT head. The Site IT team acts as the ‘face of IT’ to Kite’s manufacturing organization. Your efforts will support the delivery and performance of the IT systems, ensuring quality and high availability.
Responsibilities of the IT Business Systems Analyst include (but are not limited to):
Work with BPO to engage vendor during new product discovery to understand IT requirements and the product’s impact on the current environment
Liaison to QC/Manufacturing functional departments to support development of business cases for new business capabilities
Continue to develop an understanding of the business processes and all applicable procedures
In-depth knowledge of GxP operations as it relates to the FDA’s CFR 21 Part 11 requirements and well as Good Documentation Practices (GDP)
Install and configure Lab/Manufacturing computer systems in a regulated GMP environment
Oversee and support managed services staff with the installation/configuration of regulated Lab/Manufacturing GMP systems
Work with vendor’s tech support teams to resolve application errors as need
Serve as the System Owner/Manager and perform administrative tasks on QC/Manufacturing instruments/systems such as user additions, removal, method/assay updates
Partner with local QA/QE to evaluate and test new upgrades/patches to Operating Systems/applications and write install instruction for Lab/MFG managed services support personnel
Participate in process re-engineering workshops with business and IT stakeholders
Perform impact assessment on changing product capabilities, including impact to integrated (boundary) systems
Respond to IT support requests to address operational issues with enterprise and quality applications
Meet with internal clients and stakeholders to diagnose software and middleware issues
Align with other manufacturing sites and corporate IT to ensure global consistency
Review/develop SOPs related to administration and installation of applications used in the lab/manufacturing environments
Work with QC and Manufacturing to fulfil audit requests for all instruments/systems
Review audit trails with QC and Manufacturing to ensure data integrity and compliance
Identify/participate in data integrity solutions to ensure FDA compliance for all GxP devices and systems
Basic Qualifications:
MA/MS degree with 3+ years of Operations and/or Manufacturing, IT and/or OAT (Operational automation Technology) experience OR
BA/BS degree with 5+ years of Operations and/or Manufacturing IT and/or OAT (Operational automation Technology) experience OR
High School Degree with 9+ years of Operations and/or Manufacturing IT and/or OAT (Operational automation Technology) experience
GMP experience
Preferred Qualifications:
BS degree in Information Technology, Computer Science, or relevant field
Proven work experience (5+ years) in IT supporting business operations
Experience in a strongly regulated GxP environment, preferably pharmaceutical
Good understanding and knowledge of computer systems, mobile devices, networks and other technology products
Ability to diagnose and troubleshoot basic technical issues
Familiarity with remote desktop applications and help desk software
Excellent problem-solving and communication skills
Ability to troubleshoot complex software issues and provide step-by-step technical help, both written and verbal
Good time management skills, interpersonal skills, and the ability to think critically
Resilient with the ability to perform in an ambiguous environment and under pressure
Versatile with the ability to deliver against strongly regulated requirements
Consistent excellence in both planning and execution
Located in the Netherlands",https://media.glassdoor.com/sql/1301677/kite-pharma-squareLogo-1622752895848.png,Hoofddorp,nan,Kite Pharma,"['Great Candidate Experience! Having worked in HR for 20+ years, it is always fascinating to be on the candidate side of the table during the interview process. I was very impressed with from start to finish. I had a three (3) Zoom calls with Kite Leadership, along with calls with the recruiter. All were very professional, easy to speak to, and engaging. I never thought I was grilled about my background, but rather shared stories about my past as if catching up with someone from my past. Equally, they all shared their experiences and how they ended up with a great company. Additionally, all explained their passion for working for a company that is helping to fight and cure cancer! All had amazing enthusiasm for the mission! The candidate process was thoroughly explained to me and communication was prompt and timely. I also think they all did an excellent job of explaining what to expect in the role in terms of responsibility, success in the role, work life balance, etc. Lastly, I never felt like I was in the dark about what to expect next in the candidate process. I was sent company information, along with benefit information, and had contact information if I had any questions. I never went onsite to the facility during the process, as they have kept the interviewing process to Zoom from the pandemic. I was sent an inspiring promotional video that interviewed some employees and flashed through the facility. During the offer, I was offered to visit onsite, but declined as I didn’t want to step outside of their normal protocols and stated that from the promotional video I was sent, “it looks like it may be the nicest facility I’ve ever worked!” Overall, again a great experience and looking forward to orientation and starting!', ""Very young and nice atmosphere. It's not a suit and tie environment but more so casual."", 'I feel appreciated and am paid well. I feel great going to work and knowing my staff are paid well and have room to grow if they want to. The company is working hard to promote inclusion, diversity, and equity. I have had many jobs in my life but none have been nearly as rewarding. I feel like a human and not a number. As a leader I’m encouraged to ask, “how can we help ________ succeed?” instead of, “How do we get rid of _______?” We consistently have employee appreciation and engagement events. I don’t need to worry that if I need office supplies for my job that I’ll have to buy them myself due to budgeting or whatever. I can’t say enough good things about this company. They have changed my life in the most profound way.', 'Extremely great benefits with a competitive pay. They hire great people to work with (associate level). Volunteering opportunities are great if you’re interested, and the facilities are fabulous and kept extremely well.', '1) Quality department has good managers. 2) Engaging consequential work that has me looking forward to work days 3) Excellent benefits, including healthcare. 4) Very diverse workforce of people who care. 5) Company is growing. 6) Reasonable conversational interviewing process. Lighter in the way of tests. I applaud the company for not doing one-way interviews!', 'They strive to develop your skills and your career. Stipends are given to go to workshops and trainings that further develop your skillet.', 'Great culture, great work life balance, beautiful brand new facility']","['None for the candidate process.', 'The hours could really be stressful for certain departments.', 'Many people start as contact workers. This can be seen as both positive and negative. It gives less job stability to begin with, but if you show you are a good employee and you care, it is just a matter of time before you get the full time position through Kite.', 'Managements a mess, corporate and HR do not care the slightest for CTS department, otherwise considered MFG. Problems are not addressed, good work culture is lacking, and room for growth is nonexistent due to trapping employees with science degrees in a manufacturing department not doing anything science related. The billion dollar company does not compensate the MFG/CTS department for working 365 days a year. Administration gets a full week off in July and a full week off in December for Christmas and NYE and day, while the MFG department works on holiday with NO holiday pay or compensation - nor are the days that are scheduled off for administration comped for MFG employees. MFG works 10 hour shifts but is only given 80 hours for sick time a year, after that they have to use their own PTO time for sick days/any form of time off because it is not offered otherwise. That means 8 days out of 365 are you allowed to be sick. PTO is only accrued biweekly - and low and slow for entry level positions. Leadership does not lead, only bosses employees. Associate CTSs are micromanaged and bossed around/treated like children.', '1) Long onboarding. 2) Rigid IT requirements that prevent flexible software work. 3) Lower pay band than big tech, though this less an issue with the company itself and more a larger biotech/pharma space issue. 4) Some office locations mean housing cost difficulties.', 'As of now there are no cons.', 'HR support is simultaneously nonexistent and hinders performance management']"
Statistical Analyst,"Site Name: Netherlands - Amsterdam
Posted Date: Mar 8 2022
Statistical Analyst
As Statistical Analyst, your role is to provide programmer/analyst expertise in delivering the programs and outputs.
Your responsibilities:
Writing specifications for SAS programs/macros for study specific analyses or at the standard level
Developing, maintaining and validating SAS programs/macros for study specific analyses or at the standard level
Plans and participates in programming/QC activities at a study- or standard level to deliver all data analysis outputs
Develops the tables, figures and listings (TFL)
Reviews and ensures adherence to standards at the study or standard level (e.g., especially in the area of Analysis Data Model (ADaM) and Study Data Tabulation Model (SDTM) datasets, derivation, output definition and implementation).
Author or co-author of programming and database specifications and documentation
May represent the programming function on the study team.
Why you?
Basic Qualifications:
We are looking for professionals with these required skills to achieve our goals:
Bachelor’s degree in Bachelor in Statistics, Mathematics, Informatics or equivalent in professional experience
Ability to understand statistical concept and to have knowledge in SAS
3-6 years of experience in SAS programming (including SQL and SAS macro language)
Ability to design, test and maintain programs.
Ability to create programs for multiple use
Understanding of clinical trial process.
Basic knowledge of applied statistics is an asset.
written and verbal communication skills in English.
Preferred Qualifications:
If you have the following characteristics it would be a plus:
Solid grounding in clinical, medical and pharmaceutical science with the ability to rapidly assimilate specific and detailed knowledge in these areas
Experience evaluating and effectively communicating evidence-based medicine
Ability to work in matrix and cross-functional teams
Strong scientific communication and presentation skills
pro-active ‘can-do’ mindsetLi-GSK
Why GSK?
Our values and expectations are at the heart of everything we do and form an important part of our culture. These include Patient focus, Transparency, Respect, Integrity along with Courage, Accountability, Development, and Teamwork in a culture of Innovation, Performance and Trust.
GSK Vaccines – Our Vaccines business has a broad portfolio and innovative pipeline of vaccines to protect people of all ages. We deliver over two million vaccine doses per day to people living in over 160 countries.
For further information, please visit www.gsk.com.
At GSK we value diversity and treat all candidates equally. We aim to create an inclusive workplace where all employees feel engaged, supportive of one another, and know their work makes an important contribution.
We provide a supportive working environment, and a range of development challenges and opportunities. We also offer competitive benefits and compensation packages designed to attract and to retain the very best.
If you require an accommodation or other assistance to apply for a job at GSK, please contact the GSK Service Centre at 1-877-694-7547 (US Toll Free) or +1 801 567 5155 (outside US).
GSK is an Equal Opportunity/Affirmative Action Employer. All qualified applicants will receive equal consideration for employment without regard to race, color, national origin, religion, sex, pregnancy, marital status, sexual orientation, gender identity/expression, age, disability, genetic information, military service, covered/protected veteran status or any other federal, state or local protected class.
Important notice to Employment businesses/ Agencies
GSK does not accept referrals from employment businesses and/or employment agencies in respect of the vacancies posted on this site. All employment businesses/agencies are required to contact GSK's commercial and general procurement/human resources department to obtain prior written authorization before referring any candidates to GSK. The obtaining of prior written authorization is a condition precedent to any agreement (verbal or written) between the employment business/ agency and GSK. In the absence of such written authorization being obtained any actions undertaken by the employment business/agency shall be deemed to have been performed without the consent or contractual agreement of GSK. GSK shall therefore not be liable for any fees arising from such actions or any fees arising from any referrals by employment businesses/agencies in respect of the vacancies posted on this site.
Please note that if you are a US Licensed Healthcare Professional or Healthcare Professional as defined by the laws of the state issuing your license, GSK may be required to capture and report expenses GSK incurs, on your behalf, in the event you are afforded an interview for employment. This capture of applicable transfers of value is necessary to ensure GSK’s compliance to all federal and state US Transparency requirements. For more information, please visit GSK’s Transparency Reporting For the Record site.",https://media.glassdoor.com/sql/3477/gsk-squareLogo-1665577185640.png,Amsterdam,nan,GSK,"[""The vision, the mission, the people - for me, it's a perfect place to be. GSK has nearly 100,000 employees, but everyone I worked with was an actual person, a human being who cares about the patient at the end of the supply chain. It's a busy company to work for, with lots of activity which makes it fun and interesting."", 'Learning new things daily, Getting to know your team, good money', 'Everyone I worked with at GSK tended to be among the best at what they do compared to other companies I worked at. It’s a demanding but fair culture', 'Position allows employees to develop in several areas with innovative technology, knowledgeable analysts, and support from management. GSK pays for schooling throughout the program and offers an employee re-embursement program for further education. GSK funds development trip to the UK to work with international apprentices. There is always room for growth and development within a rotation.', 'My manager and my team', 'Product leadership, competitive income, global organization']","[""Nothing, genuinely. Seems like a paid review but it's not."", 'Long shifts, strenuous work, Bad supervisors', 'It’s a global company, which for me meant an unbelievable amount of travel. I saw the world while working at GSK, but it can take a toll on your personal life', ""Pay is low for the amount of work expected. When switching rotations there can be a lag to training. There isn't enough time to learn and develop into everything throughout a rotation."", 'Our leadership team not making decisions or making bad ones', 'Develop opportunities, R&D of new produts']"
