job_titles,job_description,images,locations,salaries,companies,pros,cons
Lab Analyst 1 - Dutch Speaking - Onsite,"At ICON, it’s our people that set us apart. Our diverse teams enable us to become a better partner to our customers and help us to fulfil our mission to advance and improve patients’ lives.
Our ‘Own It’ culture is driven by four key values that bring us together as individuals and set us apart as an organisation: Accountability & Delivery, Collaboration, Partnership and Integrity. We want to be the Clinical Research Organisation that delivers excellence to our clients and to patients at every touch-point. In short, to be the partner of choice in drug development.
That’s our vision. We’re driven by it. And we need talented people who share it.
If you’re as driven as we are, join us. You’ll be working in a dynamic and supportive environment, with some of the brightest and the friendliest people in the sector, and you’ll be helping shape an industry.
Bij ICON ben je niet enkel getuige van de toekomst van klinische geneesmiddelenontwikkeling. Je maakt er deel van uit!
Wij groeien, snel!
Voor de afdeling Flow Cytometrie van ons laboratorium in Assen zijn wij op zoek naar een enthousiaste nieuwe collega.
Heb jij een afgeronde opleiding op MBO-4 of HBO niveau in een biomedische of chemische richting? Zoek je een uitdagende baan binnen een lab met de nieuwste apparatuur en technieken? Dan is ICON op zoek naar jou!
Het bioanalytisch laboratorium van ICON is gevestigd in Assen. Hier worden met behulp van verschillende technieken (o.a. LC-MS/MS, radioactieve isotopen analyse, ELISA, flowcytometrie en HPLC) analyses uitgevoerd van (nieuwe) geneesmiddelen en biomarkers in monsters van biologische matrices afkomstig van (pre-)klinische studies vanuit de hele wereld. We werken met de nieuwste apparatuur en innovaties. Er wordt nauw samengewerkt met onze collega’s in Kansas City, waar zich het andere bioanalytische laboratorium van ICON bevindt.
Voor het laboratorium in Assen zijn we op zoek naar een nieuwe collega's!
Lab analist (32-40 uur per week in Assen)
Wat ga je doen?
Je bent als Lab Analist samen met je team verantwoordelijk voor het analyseren van samples en het verwerken van resultaten
Je voert zelfstandig de selectie, voorbewerking, analyses en dataverwerking uit
Je wordt getraind binnen de afdeling Flow cytometrie
We bieden jou:
Een uitdagende functie in een groeiend internationaal bedrijf in ons state-of-the-art onderzoekslaboratorium in Assen
Een marktconform salaris
PRA heeft een eigen CAO die zorgt voor goede voorwaarden voor onze medewerkers
Jaarlijks organiseren we (sportieve) activiteiten gericht op o.a. teambuilding en gezelligheid. We zetten ons ook maatschappelijk in en beklimmen bijvoorbeeld bergtoppen voor een goed doel
Je start met een jaarcontract met zicht op een verlenging of vast dienstverband
Binnen ons bedrijf zijn er meerdere carrièremogelijkheden, o.a. richting leiding geven, projectmanagement of methodeontwikkeling
Wat breng je mee?
Je hebt een voltooide MBO-4 of HBO opleiding in een biomedische of chemische richting (bv. Biologie en Medisch Laboratoriumonderzoek, Chemie, Forensic Science, Biomedische wetenschappen etc.)
Ervaring met GLP is gewenst, maar zeker geen vereiste
Je bent nauwkeurig en flexibel
Goede beheersing van de Engelse taal, in woord en geschrift
We bieden contracten vanaf 32 uur per week tot fulltime dienstverband
Wat doet ICON?
In opdracht van farmaceutische bedrijven doet ICON wereldwijd wetenschappelijk onderzoek naar de werking van geneesmiddelen bij mensen. In Noord-Nederland heeft ICON de divisie Early Development Services (EDS), waar zowel klinisch als bioanalytisch onderzoek wordt verricht. Hier zijn zo’n 1000 medewerkers werkzaam. Werken bij ICON betekent dat je werkt aan de ontwikkeling van de geneesmiddelen van de toekomst. Het betekent ook werken aan jezelf en bijdragen aan de ontwikkeling en groei van ICON. De ontwikkeling van onze mensen is het succes van onze organisatie. Onze internationale cultuur en dynamische organisatie trekt vooral mensen aan die gericht zijn op professionele groei, een belangrijke pijler voor onze organisatie die we graag koesteren. We bieden je de mogelijkheden die je in staat stellen om je carrière naar een hoger niveau te tillen.
Contact informatie:
Voor meer informatie kun je contact opnemen met Sophia Allinson, Recruitment Specialist via email - Sophia.Allinson@iconplc.com.
Klaar voor een nieuwe uitdaging en wil je werken in ons state-of-the-art onderzoekslaboratorium?
Ben je na al deze informatie nog enthousiaster geworden? Dat snappen we, we komen graag met je in contact! Klik op de ‘Solliciteer’ button op deze pagina en laat je CV en motivatie achter.
 Voor deze rol is het van belang dat men vloeiend is in de Nederlandse taal. Engelse taalvaardigheid is een pre
Benefits of Working in ICON:
Our success depends on the quality of our people. That’s why we’ve made it a priority to build a culture that rewards high performance and nurtures talent.
We offer very competitive salary packages. And to keep them competitive, we regularly benchmark them against our competitors. Our annual bonuses reflect delivery of performance goals – both ours and yours.
We also provide a range of health-related benefits to employees and their families and offer competitive retirement plans – and related benefits such as life assurance – so you can save and plan with confidence for the years ahead.
But beyond the competitive salaries and comprehensive benefits, you’ll benefit from an environment where you are encouraged to fulfil your sense of purpose and drive lasting change.
ICON is an equal opportunity and inclusive employer and is committed to providing a workplace free of discrimination and harassment. All qualified applicants will receive equal consideration for employment without regard to race, color, religion, sex, sexual orientation, gender identity, national origin, disability or protected veteran status.
If, because of a medical condition or disability, you need a reasonable accommodation for any part of the application process, or in order to perform the essential functions of a position, please let us know through the form below.",https://media.glassdoor.com/sql/8344/icon-squarelogo-1552408072044.png,Assen,nan,ICON,"['Supportive line managers, great coworkers and department collaboration', 'Line managers are great and help with career development. 100% remote and allow for children to be at home with you, being that you are hitting your metrics. Good word life balance, no expectation for you to work on weekends or past your working hours. No shame for taking PTO.', 'Everyone is so nice, and they do a great job at onboarding. Managers are flexible and quite nice. I feel comfortable here.', 'Icon formally Docs has taken more care in their employees and have listened to concerns. Training is readily available.', 'Great Benefits and Bonuses, Great Line Management Support, remote work, Great IT Support.', 'The pay is competitive, which is why most CRA’s move to ICON from other CRO’s and biotech companies (like i did). However, I have never met a happy CRA with ICON. Never. All of us are burnt out and depressed, and have double the workload of a normal CRA with another CRO. there is no work to life balance at all, and the management is very awful. only reason i’m with the company still is because my year ends in a couple of months and i will have to pay back a hefty sign on bonus if i leave before then. unless you are okay with working weekends and until midnight most week nights, i don’t recommend this job. the management doesn’t care about you - i had a panic attack because of the work load and my manager blamed it on me. no, i don’t have a history of anxiety. i will say they have great health insurance and probably other benefits that i’ve had little to no time to explore.', 'Remote work available. Good team.', 'Great people, office amenities, resources, etc.']","['Are told there are many opportunities to advance from this position but the company makes it impossible. No growth opportunities unless lateral movement to a different department first. Promotions taken away from the role, yearly merit increases of around 1%, expected to go above and beyond with nothing in return. Functional managers want to help staff but perks have been taken away and continue to be while additional tasks and responsibilities are tacked on to the role. The pay gap for cost of living has not been resolved.', 'Annual raises are small regardless of performance. Job levels aren’t clearly defined. No real maternity leave for US employees, only STD is offered and ICON lowered the amount from 70% to 60% pay when they took over.', 'The pay is just very low especially if you have to drive far or have loans. You can certainly work your way up in the company but it seems to take a little longer than it should, and the direct path upwards in the project associate role is a bit murky.', 'Sometimes you may be more informed than some of the managers that you are contracted under. And transparency is not something that should be given to global team.', 'Stressful, fast-paced, demanding, poor resourcing to studies, love the industry but some pharmaceutical sponsors are not easy to work with and make your job very difficult, few sponsors are easy to work with, it is really unfortunate, feel bullied by the sponsors. Most training is self-review which is not effective.', 'everything else other than the salary. i literally impulsively shop just to find a crumb of joy with working with this terrible company.', 'Salary could be more competitive.', 'Low pay compared to competitors, easy to burn out, some managers can make the job feel pretty impersonal.']"
Junior Finance & Reporting Analyst,"Advanced Accelerator Applications, a Novartis company, is an innovative medicines company focused on the development of products for targeted radioligand therapy and precision radioligand imaging. We are committed to transforming patients’ lives by leading innovation in nuclear medicine.
AAA offers professionals the opportunity to face new challenges and pursue a career in a fast growing, technology driven healthcare company. We are passionate about improving patient health by leading innovation in nuclear medicine. We are looking for people who share our commitment to help us achieve this goal. Advanced Accelerator Applications is an Equal Opportunity Employer (EOE).

Job Description:

40+ is the dedicated number of team members you would be joining at IDB (Advanced Accelerator Applications, Netherlands) whose mission is to bring new therapies to patients wordwide by producing radiopharmaceuticals for targeted radioligand therapy. IDB 's team embraces the culture of empowerment and team work.

As a Radiation Safety Officer you will support day to day safe operations of isotope production by providing oversight on activities in the area of radiation (regular self-inspections of e.g. the process)

Responsibilities:
Review of radiation safety key performance indicators around dosimetry, events etc.Support the routine of STOP-THINK-ACT by providing direction how to handle unforeseen/ unplanned eventsMaintain the ‘Risico Inventarisatie en Evaluatie’ (Risk Inventory and Evaluation) by verification, continuously improving the current situation by striving to reduce risk and exposure for staffTraining of staff on site around radiation safetyAssessing changes in the current way of working (for instance new equipment) for impact on radiation safety, provide direction where neededAct as a coach and mentor for TMS staff in the field of radiation safety
Commitment to Diversity & Inclusion:
Novartis is committed to building an outstanding, inclusive work environment and diverse teams representative of the patients and communities we serve.
Minimum requirements
What you'll bring to the role:
Certification as Radiation Safety Expert, Coordinerend Deskundige (former Niveau 3)Knowledge of a pharmaceutical or control production environmentA relevant MBO or HBO degree (Engineering, Biology and Medical Laboratory Research, or Chemical Analyst)
Attention to detail
Analytical skills that allow you to see what can be improved
Division
Oncology
Business Unit
ADVANCED ACCELERATOR APPLICATIONS
Country
Netherlands
Work Location
Baarle-Nassau
Company/Legal Entity
IDB Holland bv
Functional Area
Facilities & Administration
Job Type
Full Time
Employment Type
Temporary
Shift Work
No
Early Talent
No",https://media.glassdoor.com/sql/12934/dechra-pharmaceuticals-squarelogo-1392052728946.png,Den Bosch,nan,Dechra Pharmaceuticals PLC,"['Culture People Jeff Harbaugh Leadership Culture Dechra is a great company to work for, it leaves a lasting impression on the employees. It has a small company vibe, where everyone matters. The company is constantly growing, and leadership isn’t afraid to move forward. The next few years will be telling on how the company moves forward past increasing competition.', 'people focused culture in USA', 'Awesome work environment, field management is awesome', 'some good teammates and good management at most of the regional level', 'Company Culture; Autonomy if you have a good manager; Flexible; Using company credit card for meals when traveling; taking clients out to eat; no two days are the same', 'Diverse portfolio\nWill payout performance bonus even if your performance goal is not reached\nWill leave you alone, not micromanaged', 'Great work culture and helpful team members', ""I am thankful of Dechra's concern for it's employees safety as well as it's understanding of how all employees may not feel the same. I appreciate the fact that options were given in regards to a particular meeting and if people did not feel safe they did not have to attend. \n\nManagement takes into account all thoughts and opinions of it's employees, especially in the last year and half, and continues to try to navigate life after Covid to the best of their ability. \n\nI also enjoy the ability to connect with colleagues in person rather than on zoom."", 'Good benefits, flex work hours, friendly colleagues']","['Relationships with distribution and motus. But the goods out weight the bad.', 'Gap between UK and USA moral and leadership', 'Lack of a sustainable pipeline and zero relationships with distribution partners.', 'no real understanding or direction for corporate accounts. too many politics and using information to push others down in some departments. losing to distribution, other generics, and not innovating new drugs fast enough to sustain excessively large sales goals.', 'No clear communication about back orders on products; not sure where direction is going with the company in terms of supply chain; can be a lot of stress; lower pay potential than other companies in the industry', 'Everyone always gets performance bonus so why push\nAdding too many products, not able to grow current products due to portfolio growth, lack of focus\nNo direction or focus from direct managers\nPerception: in order to move up you have to party, drink, be in the ""in crowd"" , lots and lots of alcohol\nAbsolutely no diversity\nCEO makes it know his personal beliefs in areas that are personal. He is confrontational', 'n o t h i n g', 'Some co-workers tend to complain a bit much about things that do not affect them, and about events that do not affect them if they choose not to attend.', 'Leadership unethical, cutting corners with clueless employees and authorities.']"
