job_titles,job_description,images,locations,salaries,companies,pros,cons
Principal Statistician,"Site Name: Netherlands - Amsterdam
Posted Date: Feb 13 2023
Your responsibilities :
Responsible for a whole study from design to execution for different study designs:
to use stat methodology to establish study strategy (e.g. power modelling of different scenarios, set up power monitoring, set up mitigation plan to minimize risk of stat failure)
to provide input to protocol (design, objective, endpoint, randomization strategy, sample size, stat analysis) - to provide input to study set up (CRF review, randomization, DMP plan including specification for subset, important protocol deviation)
to develop SAP/AAR (involving sensitivity analysis to support robustness of result) and coordinate review - to review the TFL, to coordinate review with the stat analyst, to approve the TFL
to do the QC of the statistical analysis methodology - to validate study specific dataset & analysis pgm specification - to approve deviation from TFL format - to propose SAR conclusion
to prepare answer to study specific stat question (e.g. inspection, RA question) - to provide stat support to an independent analysis center
to provide consultancy on stat matter for other statisticians
Why you?
Basic Qualifications:
We are looking for professionals with these required skills to achieve our goals:
At least 5-year experience of pharmaceutical industry Has been previously responsible for studies with different designs (dose range, superiority/non inferiority, futility rule,..)
Experience in SAS software and sample size computation for standard designs Ability to work in multidisciplinary team (e.g. give guidance to non-stat, provide feedback, engage) , some being remotely located
Good oral and written communication in English including ability to explain difficult issues and situations clearly and ensures meaning is understood
Preferred Qualifications:
If you have the following characteristics it would be a plus:
University degree in Sciences, Statistics, Mathematics or equivalent Master in Statistics, Mathematics, Epidemiology or equivalent
To be able to lead the development of new biometrics/epidemiological methods to gain efficiency and meet product development needs.LI-GSK
Why GSK?
Our values and expectations are at the heart of everything we do and form an important part of our culture. These include Patient focus, Transparency, Respect, Integrity along with Courage, Accountability, Development, and Teamwork in a culture of Innovation, Performance and Trust.
GSK Pharmaceuticals – Our Pharmaceuticals business offers a unique portfolio of medicines & vaccines, including a broad range of innovative and established brands. Both globally and in Belgium, we are currently primarily focused on developing new medicines in the respiratory, HIV/infectious diseases, oncology and immuno-inflammation areas, while also continuously exploring other fields through discovery research. Working in BeNeLux, you would be joining a driven team of over 200 people that is also well embedded within GSK’s global network. For further information, please visit www.gsk.com.
At GSK we value diversity and treat all candidates equally. We aim to create an inclusive workplace where all employees feel engaged, supportive of one another, and know their work makes an important contribution.
We provide a supportive working environment, and a range of development challenges and opportunities. We also offer competitive benefits and compensation packages designed to attract and to retain the very best.
If you require an accommodation or other assistance to apply for a job at GSK/ViiV Healthcare, please contact the local HR department.
GSK is an Equal Opportunity/Affirmative Action Employer. All qualified applicants will receive equal consideration for employment without regard to race, color, national origin, religion, sex, pregnancy, marital status, sexual orientation, gender identity/expression, age, disability, genetic information, military service, covered/protected veteran status or any other federal, state or local protected class.
GSK is a global biopharma company with a special purpose – to unite science, technology and talent to get ahead of disease together – so we can positively impact the health of billions of people and deliver stronger, more sustainable shareholder returns – as an organisation where people can thrive. Getting ahead means preventing disease as well as treating it, and we aim to impact the health of 2.5 billion people around the world in the next 10 years.
Our success absolutely depends on our people. While getting ahead of disease together is about our ambition for patients and shareholders, it’s also about making GSK a place where people can thrive. We want GSK to be a workplace where everyone can feel a sense of belonging and thrive as set out in our Equal and Inclusive Treatment of Employees policy. We’re committed to being more proactive at all levels so that our workforce reflects the communities we work and hire in, and our GSK leadership reflects our GSK workforce.
GSK is a global biopharma company with a special purpose – to unite science, technology and talent to get ahead of disease together – so we can positively impact the health of billions of people and deliver stronger, more sustainable shareholder returns – as an organisation where people can thrive. Getting ahead means preventing disease as well as treating it, and we aim to impact the health of 2.5 billion people around the world in the next 10 years.
Our success absolutely depends on our people. While getting ahead of disease together is about our ambition for patients and shareholders, it’s also about making GSK a place where people can thrive. We want GSK to be a workplace where everyone can feel a sense of belonging and thrive as set out in our Equal and Inclusive Treatment of Employees policy. We’re committed to being more proactive at all levels so that our workforce reflects the communities we work and hire in, and our GSK leadership reflects our GSK workforce.
If you require an accommodation or other assistance to apply for a job at GSK, please contact the GSK Service Centre at 1-877-694-7547 (US Toll Free) or +1 801 567 5155 (outside US).
GSK is an Equal Opportunity/Affirmative Action Employer. All qualified applicants will receive equal consideration for employment without regard to race, color, national origin, religion, sex, pregnancy, marital status, sexual orientation, gender identity/expression, age, disability, genetic information, military service, covered/protected veteran status or any other federal, state or local protected class.
Important notice to Employment businesses/ Agencies
GSK does not accept referrals from employment businesses and/or employment agencies in respect of the vacancies posted on this site. All employment businesses/agencies are required to contact GSK's commercial and general procurement/human resources department to obtain prior written authorization before referring any candidates to GSK. The obtaining of prior written authorization is a condition precedent to any agreement (verbal or written) between the employment business/ agency and GSK. In the absence of such written authorization being obtained any actions undertaken by the employment business/agency shall be deemed to have been performed without the consent or contractual agreement of GSK. GSK shall therefore not be liable for any fees arising from such actions or any fees arising from any referrals by employment businesses/agencies in respect of the vacancies posted on this site.
Please note that if you are a US Licensed Healthcare Professional or Healthcare Professional as defined by the laws of the state issuing your license, GSK may be required to capture and report expenses GSK incurs, on your behalf, in the event you are afforded an interview for employment. This capture of applicable transfers of value is necessary to ensure GSK’s compliance to all federal and state US Transparency requirements. For more information, please visit GSK’s Transparency Reporting For the Record site.",https://media.glassdoor.com/sql/3477/gsk-squareLogo-1665577185640.png,Amsterdam,nan,GSK,"[""The vision, the mission, the people - for me, it's a perfect place to be. GSK has nearly 100,000 employees, but everyone I worked with was an actual person, a human being who cares about the patient at the end of the supply chain. It's a busy company to work for, with lots of activity which makes it fun and interesting."", 'Learning new things daily, Getting to know your team, good money', 'Everyone I worked with at GSK tended to be among the best at what they do compared to other companies I worked at. It’s a demanding but fair culture', 'Position allows employees to develop in several areas with innovative technology, knowledgeable analysts, and support from management. GSK pays for schooling throughout the program and offers an employee re-embursement program for further education. GSK funds development trip to the UK to work with international apprentices. There is always room for growth and development within a rotation.', 'My manager and my team', 'Product leadership, competitive income, global organization']","[""Nothing, genuinely. Seems like a paid review but it's not."", 'Long shifts, strenuous work, Bad supervisors', 'It’s a global company, which for me meant an unbelievable amount of travel. I saw the world while working at GSK, but it can take a toll on your personal life', ""Pay is low for the amount of work expected. When switching rotations there can be a lag to training. There isn't enough time to learn and develop into everything throughout a rotation."", 'Our leadership team not making decisions or making bad ones', 'Develop opportunities, R&D of new produts']"
QC Analyst (Raw Materials Introduction),"Janssen Biologics B.V. is one of the Janssen Pharmaceutical Companies of Johnson & Johnson, and is passionate about the development, production and marketing of vaccines and antibodies to prevent and combat infectious diseases. At the Leiden site in the Netherlands, hard-working and multi-skilled people are working in a high-performance culture in which innovation and a 'can do' state of mind are the central points.
The Chemical, Physical & Raw Materials (CPRm) department is part of the Quality Control (QC) department of Janssen Biologics B.V, located in Leiden (The Netherlands). The CPRm department consists of 40 highly skilled employees, of a total of 280 employees within QC.

As a part of the QC laboratories, the CPRm team is responsible for the execution of test methods using various analytical techniques. The scope of products varies from biologicals and vaccines, derived from early clinical batches up to commercial batches. The testing of the more than 170 raw materials is outsourced to a network of external test laboratories.
You will be working in a team of ten colleagues, that is exclusively concerned with the QC aspects of clinical and commercial raw materials.
These are the 4 main work areas for this highly motivated team:
Coordination of all raw material sample handling and testing for already qualified materials as well as new materials.
Handling of quality events related to testing of raw materials at the contract laboratory
Review of test results and release of raw materials for commercial use for our production sites in Leiden and Cork (Ireland)
Introduction of new Raw materials and the qualifications of new sources of existing materials to meet the business needs.
These are the responsibilities the job will bring you:
Introduction of new Raw materials and the qualifications of new sources
Coordinate NPI activities in relation to raw material qualifications and ensure on time completion per agreed timelines.
Create, review, and approve related documentation.
Act as subject matter expert for analytical method transfers and other NPI processes and has a leading role during the GMP inspections.
Participates in meetings with various local/global/internal/external stakeholders in the frame of his/her NPI project.
Ensure NPI testing plan is aligned with the platform testing strategy
Adhere to compliance best practices, EHSS regulations and lean principles.
Management of deviations in respect to raw materials testing:
Acting as lead investigator for local/global Non-Conformances which encompasses conducting the investigation, providing impact assessments, and identifying and defining appropriate corrective and preventive actions.
Supporting and advising other investigators from external and internal QC departments.
Monitor timely closure of medium/high-level investigations and associated Corrective & Preventive Actions.
Providing scientific and technical analytical support to the testing laboratories:
Serve as an expert on physical and chemical technologies used for raw materials testing and will be requested to represent the team during internal/external meetings. The jobholder will act as a Subject Matter Expert (SME) during audits and inspections and will write observation responses.
Lead or participate in exciting projects or studies to maintain quality of the testing of the raw materials
Lead and drive continuous improvement processes to contribute to a lean culture in the area of testing and to improve our cost competitiveness.
Qualifications
This is what you will bring to the job:
A bachelor’s degree in Analytical Chemistry, Pharmacy or equivalent
3-5 years of experience in a Quality Control environment with demonstrable knowledge of pharmaceutical raw materials and associated regulations
Knowledge of GMP/GLP guidelines
Proven capabilities in managing smaller and/or larger projects
Result-oriented, team player, self-starter
Excellent communication skills (oral and written in English)
This is what awaits you at J&J:
Flexible working hours
An opportunity to be part of a global market leader
Possibilities for further personal and professional development/education
Excellent record in employee continuous personal and professional development
Excellent Benefits",https://media.glassdoor.com/sql/364/johnson-and-johnson-squarelogo-1654595959720.png,Leiden,nan,Johnson & Johnson,"['Was a good company when I first started and the experience is differentiated based on who your direct manager and team are. Benefits were decent, most people are nice, and lots of smart people to work with.', 'Purpose of the company (Credo) is very meaningful and motivating factor to work @ J&J Work life balance is good Culture is very good as well', ""What a great company. Excellent health care benefits as you would expect from a pharmaceutical company and management really is there to help the employees. The training programs that they have are the best that I've ever seen and the employees that are here are really smart and happy to be working for the company. It's just such a good environment to work in."", 'Tactical level employees and leadership are fine', 'Great team collaboration; flexible remote work schedule, good support to grow professionally, great benefits. Management is very accessible.']","['New CEO and senior leadership are out of touch - demanding longer work hours, unwilling to adjust pay to fair market conditions, and reducing bonus while they sit in their ivory tower with millions of dollars in bonus after quietly laying off large portions of the workforce. The last soul of what J&J used to be died when our CMO left and with him, many executives have left as well. Paraphrasing from a townhall, executive leadership accuses employees are working longer hours because they are working from home and are not as productive. Advancement is based off of who you know and the color of your skin even though J&J tries to create optics that they care about DEI. Employees are criminally underpaid and they pride themselves in squishing levels. This is an empty shell of a company and no longer is a good place to work.', ""Given its a big company, its bit slow in terms of execution on key initiatives. Also being in healthcare industry, the release cycles are slow (4 to 5 years) as everything has to account for proper validation, testing, auditing, compliance, security and more importantly prepare for FDA approval. Don't expect to be a fast paced work environment."", ""Can't think of any cons. It's just really a good company to work for. They get the best talent in the industry and just let them go and do their thing. I haven't seen anybody that does any kind of micromanaging or anything like that, so it's just really nice to be at a company that allows you to be yourself!"", 'New CEO is out of touch. No salary inflation adjustments and actually had the gall to reduce everyone’s bonus payouts. Combine that with the tone deaf efforts to push people back into the office while continuing have overpriced and lackluster cafeteria food and bare bones amenities for employees. J&J is no longer a great place to work. Leadership likes to pontificate about culture when it is nothing more than lip service', 'I have no complaints to offer.']"
Senior Privacy Analyst (Hybrid),"Insulet started in 2000 with an idea and a mission to enable our customers to enjoy simplicity, freedom and healthier lives through the use of our Omnipod® product platform. In the last two decades we have improved the lives of hundreds of thousands of patients by using innovative technology that is wearable, waterproof, and lifestyle accommodating.
We are looking for highly motivated, performance driven individuals to be a part of our expanding team. We do this by hiring amazing people guided by shared values who exceed customer expectations. Our continued success depends on it!
Job Title: Senior Privacy Analyst
Department: IT GRC
FLSA Status: N/A
Position Overview:
With the increased footprint of Insulet internationally, a new role is created under the IT GRC function to support Insulet’s IT Privacy Team in the area of Data Privacy and Security. The person will be specialist in GDPR with good understanding of Data Privacy and Security issues. Working in a dynamic, collaborative environment, the successful candidate will support Insulet’s Privacy Compliance with new products, new markets and new functions through Privacy analysis across the entire organization. This role will focus on translating privacy requirements into technical and functional solutions for key projects and processes related to our EU and International Operations. This is a hands-on role with a technical focus, playing a key position in the global growth of Insulet over the next years. The role reports to Privacy Manager and will work closely with other departments (R&D/engineering, IT, Legal, Medical and Customer Care).
Responsibilities:
Work with the Privacy Manager and other members of the Privacy team to provide expert advice and guidance to employees across the business/regions in relation to Data Privacy requirements and protection of Personal Data
Engage with product development teams to ensure that the Insulet’s products and services continue to meet Data Privacy requirements and the development programs include privacy by design principles
Perform Data Protection Impact Assessments / Privacy Impact Assessments
Develop and maintain comprehensive Data Privacy policies and procedures including Insulet wide privacy policies, data retention policies, Privacy register policies and Privacy by design policy
Develop and maintain a comprehensive knowledge of Data Privacy and Personal Data protection legislation and regulation, implementing any changes and informing relevant parts of the Insulet’s Personal Data processing operations
Advise Insulet’s businesses on Data Privacy risks, issues, and how to mitigate or navigate them
Manage the Data Privacy and Risk Registers, ensuring accurate records of significant Personal Data processing across the business and identifying and managing associated risks.
Produce and develop appropriate metrics and updates to demonstrate effective privacy program operations and governance
Work with the Information Security team to investigate potential breaches and participate in incident response processes
Work with the Insulet’s legal team to implement appropriate contractual measures for Personal Data protection issues including model clauses where appropriate
Maintain awareness with evolving regulatory guidance and compliance frameworks that impact the Insulet’s international operations
Performs other duties as required
Education and Experience:
Minimum Requirements:
Bachelors or Masters degree in Privacy, Security, software engineering or a closely related field is required
At least 5 years of experience in the field of Data Privacy or Information Security
Strong knowledge of the core Data Privacy concepts– consent, fair processing, legal bases for processing, anonymization/pseudonymization, privacy by design
Familiarity with Data Privacy-relevant legislation and regulations, including the European Union General Data Protection Regulation (EU GDPR), E-Privacy, the UK Data Protection Act 1998
Recognized Data Privacy qualifications (CIPP/E - CIPT)
Knowledge on ISO 27K and/ or NIST is highly desirable
CIPP/A, CISA and/or CRISC certifications considered a strong plus
Fluent in English. Fluency in German or French are an added advantage
Preferred Skills and Competencies:
Ability to translate Data Privacy requirements into Functional system/product Requirements and user requirements in the software and product life cycle development process
Ability to meet and overcome the challenges of fast paced environment while building a positive work relationship between Business, Legal and IT.
Ability to rapidly identify, evaluate, and resolve conflicts and complaints.
Excellent communication skills – both written and verbal with the ability to influence at all levels of the organization.
Strong organizational skills and ability to plan and prioritize work while responding flexibly to changing priorities
Self-motivated and uses initiative to proactively resolve problems. Deals with conflicting priorities calmly, reliably, and effectively.
Physical Requirements (if applicable):
This position is eligible for hybrid working arrangements (requires on-site work from the Dutch office in Utrecht at least 1x/week; may work remotely other days). Insulet’s Utrecht office is located 1 minute from central station in Utrecht.
Role may require up to 5% travel.
NOTE: This position is eligible for hybrid working arrangements (requires on-site work from an Insulet office at least 1x/week; may work remotely other days). #LI-hybrid",https://media.glassdoor.com/sql/42520/insulet-corporation-squarelogo-1526563779619.png,Netherlands,nan,Insulet Corporation,"['Very healthy work-life balance. Leadership and company take good care of employees.', 'Nice HQ building, Good People', 'Great product, great employess, great potential', 'Remote work environment was initially I thought a pro.', 'The product and mission are awesome. Fast paced environment, high volumes and direct to consumer. At the intersection between Med Devices and consumer electronics.', 'Mission Driven Passionate Culture Great Teamwork Great Leadership', 'Very nice people to work with']","['Some divisions have difficulty with project management and establishing a vision. I have difficulty seeing a future at this company as opportunity for career growth is limited in my division.', 'Competitive Internal Culture but hard working', 'Goals are aggressive but new product amazing', ""Remote work environment quickly turned into a hostile work environment where you will be isolated and berated for asking questions. Harsh work environment, little communication between teams lead to disfunction, disorganization and constant problems. Upper management is awful, no empathy, you are a NUMBER and treated as such with a sink or swim culture. You will be given minimal, incomplete training. Hours were heavy, no work life balance as upper management doesn't care and expects the job to be done even if there are issues, no matter how long it takes. Just don't, listen to the other reviews about upper management, they are truthful. They are under-staffed, un-caring, do not communicate and you are a number only in a highly stressful environment without support as everyone is just trying to survive."", 'Zero kindness and empathy from senior R&D leadership. High IQ and 0 EQ. Lack of transparency and integrity. Little to none people management skills. Borderline abusive. Thought it would be solved but these values are promoted and nurtured at top level. Would not recommend Timelines are higher priority than quality.', 'Hard to move up and unclear career trajectory', 'Very ambitious and somewhat unrealistic goals']"
