job_titles,job_description,images,locations,salaries,companies,pros,cons
FP&A Junior Analyst,"Who we are
Fagron is the world’s leading pharmaceutical compounding company and offers prescribers the broadest possible range of therapeutic options. We are committed to improving the lives of millions of people across the world by developing unique concepts and innovative solutions to meet the growing global demand for customized medication. We focus on personalized medicine so we can help everyone with medicine based on their needs.
About the job
This is an excellent opportunity to take the next step in your career and make a difference as FP&A Junior Analyst. You will participate in several financial and data-driven projects, building reports and analyzing business performance to support strategic decisions.

You will be part of the Global Finance team in Rotterdam, reporting to the Global FP&A Manager and working jointly with the accounting and consolidation specialists, to translate numbers into insights. A collaborative and proactive attitude, analytical reasoning and a result-driven approach must be in your core. You are curious, data savvy, good with numbers, like getting things done and constantly looking for improvements.

What will you do?
Generate recurring reports and dashboards for the leadership team ensuring they are delivered timely and with accuracy.
Prepare external reporting on business performance, and support the preparation of quarterly press releases, board of directors’ presentations and other external analytics.
You will build effective relationships with regional and local finance teams.
Assists with forecasting, and annual operating budget processes including supporting the local teams and compiling figures into presentation format.
Responsible for preparing the company’s reporting packages, summarizing company's performance for various periods.
Translate business results into impactful visuals.

Set yourself apart

Bachelor degree in Finance or Business-related subjects. Master’s degree is a plus.
Analytical skills, accuracy, attention to detail and ability to set priorities to timely achieve high-quality results.
Initiative and capability to communicate across the organization, working individually as well as in a team.
1 to 2 years work experience in a similar position.
Excellent knowledge of reporting, Excel/PowerPoint, and Power BI.
Fluent spoken and written English.
Knowledge of consolidation systems is a plus.

What's on offer?
We offer a unique working environment where talent and ambition can develop to its fullest. We have an open and informal organization culture, where you need to be able to work independently. Fagron is a young, professional and ambitious company with plenty of growth opportunities and we will offer you a competitive compensation.
Job Reference: FA02524",https://media.glassdoor.com/sql/808140/fagron-squarelogo-1549531244467.png,Rotterdam,nan,Fagron,"['- Great supervisor\r\n- Allowed autonomy and responsibility\r\n- Flexible working schedules (WFH, starting a bit later in the morning, etc.)', 'Flexibility, schedule, workload, employees, hours', 'Flexible hours. Little to no oversight.', 'Flexible schedule management is understanding of life events etc.', 'Fagron is a dynamic and fast paced company. For all employees, change and growth is the norm. Growth opportunities exist, but may require patience, or making yourself stand out.', ""Flexible schedule\nBenefits okay\nIt's a good resume builder""]","[""can't think of any cons"", 'Management, pay, favoritism, clique, communication', 'Management at all levels is totally clueless about managing and is completely disengaged, even negligent, concerning the well-being and happiness of their staff. This company is foolish in that it does not recognize or reward high-performing staff but instead allows, and even promotes, people who are terrible communicators, lazy, incompetent, and know how to speak what upper management wants to hear instead of what they need to hear. People who achieved management positions are sycophants. Because of lack of oversight of people\'s work ethic or productivity several staff abuse this situation and ""work from home"" when the weather is bad for driving or they don\'t feel well. This creates a two-tier system or class of employees: those who get to choose when they want to work on-site or in person and those who do not have that option or ability because of the nature of their job. In one phrase: There is no accountability and no recognition. This is a toxic comapny to work for and they are incompetent beyond words to adequately describe. Run away as fast as you can.', 'Training is poor, promotable from within for jobs that don’t pay well. Restructuring all the time only benefiting management. Honestly most people are just winging it and the disfunction shows.', 'Change can be difficult, and cause uncertainty in your work environment; Fagron is not a good fit if this is uncomfortable. Pay is generally at or slightly below average rates for similar positions.', 'Poor leadership\nLow compensation\nUnstable work environment\nLack of investment in employees\nTechnology and software is old']"
RWE Expert (NL),"Make your mark for patients
We are looking for a RWE Expert with a passion for data and enthusiastic innovative mindset, to come join our fantastic Global Real World Evidence Team, based in either Belgium, Germany or UK. We are also open to other EU locations, Netherlands or Switzerland.
About the role
As the RWE Expert, you will be responsible for designing and executing global real-world evidence (RWE) projects to inform strategic internal decision-making thereby empowering differentiating R&D activities within UCB, support external decision making by key stakeholder groups such as patients, regulators, policy makers, payers, and prescribers and contribute to the wider epidemiological and medical understanding of specific diseases.
Depending on business need, you will help conceptualize RWE projects to meet business needs and drive the Global RWE Strategy and Tactical Plan.
Who you’ll work with:
You work with the RWE Data Analyst team, the RWE Strategy Lead and internal stakeholders. And you represent RWE on functional teams within the Mission(s) (e.g., early/development solution teams, Medical Team, Patient Safety, Regulatory, Market Access, Commercial/Marketing, Core Launch Teams. You report directly to the RWE Strategy Lead.
What will you do:
Providing strategic input to internal stakeholders based on RWE activities and robust epidemiological and medical understanding of the patient population in focus
Leading and driving innovative RWE study design, planning and execution, including protocol development and analysis specification following best methodological standards. Including new data sources and advanced analytics. (incl. digital pharmacoepidemiology)
Providing input to helps drive the Global RWE Strategy & Tactical Plan based on request from the RWE Strategy Lead responsible for the respective patient population
Providing RWE Analysts with clarifications concerning protocol implementation
Driving interpretation of analysis in collaboration with RWE Strategy Lead & internal stakeholders, and communicating analysis interpretation internally and externally
Supporting RWE Strategy Lead to ensure alignment of RWE tactics with the Strategic Publication Plan.
Interested? For this position you’ll need the following education, experience and skills:
MSc. / PhD in Life Sciences of which Epidemiology background is preferred, other like Outcome research, statistical backgrounds are favorable
You have successfully conceptualized and delivered RWE projects using primary or secondary data (within the pharmaceutical industry or with a recognized expert consultancy or academic center of excellence)
Ability to translate project work into scientific communications, and deliver impactful presentations to peers and/or internal stakeholders with a relaxed and proficient presentation style
Experience working with multidisciplinary cross functional and cross-cultural project teams
Ability to use your relationships with internal and external stakeholder groups to provide strategic input through synthesized thinking, building advocacy and empowering implementation of the solutions in support of creating patient value and UCB portfolio performance
Passion for innovation and creativity. Able to learn fast and adapt to new ways of working, be open-minded and science driven
RANDATUCB
Are you ready to ‘go beyond’ to create value and make your mark for patients? If this sounds like you, then we would love to hear from you!
About us
UCB is a global biopharmaceutical company, focusing on neurology and immunology. We are around 8,500 people in all four corners of the globe, inspired by patients and driven by science.
Why work for us?
At UCB, we don’t just complete tasks, we create value. We aren’t afraid to push forward, collaborate, and innovate to make our mark for patients. We have a caring, supportive culture where everyone feels included, respected and has equitable opportunities to do their best work. We ‘go beyond’ to create value for our patients, and always with a human focus, whether that’s on our patients, our employees or our planet. Working for us, you will discover a place where you can grow, and have the freedom to carve your own career path to achieve your full potential.
Learn more about sustainability at UCB and how it is integrated into our business approach.
UCB and its subsidiaries encourage diversity and inclusion in the workplace; we are an Equal Opportunity Employer. We do not discriminate on the basis of race/colour/religion/sex/national origin/veteran/disability/age/sexual orientation/gender identity.",https://media.glassdoor.com/sql/10908/ucb-squarelogo.png,Breda,nan,UCB S.A.,"['Amazing place to work so far', 'great pipeline, always striving for the patients', 'Good work flexibility. Patient value drive mindset', 'Management open to new ideas and suggestions for improving efficiency. Executive management really listens to employee feedback and takes action to remedy any issues promptly. Great benefits, base salary seems on the low end but generous bonus, 401k match and stock options.', 'Good pay, solid benefits - autonomy to do your job', 'Global company with many opportunitiues internationally', 'Company has good opportunities for growth.', 'Training Salary/Compensation Benefits Work-Life Balance', 'Pays on time, some people are truly wonderful though they are rarely in positions of influence.', 'Intellectually stimulating environment for people who enjoy doing research']","['none so far, but will revisit', 'Not always willing to look internally for candidates and very flat org chart so hard to move up.', 'Lack of suffecient benefits for researchers mid level and below', 'Company structure/hierarchy is a bit vague so escalation pathways are not clear.', 'Lack of ability to make a decision and stick to it Turnover of senior leaders in research and development', 'Too new to be able to tell', 'Career advancement sometimes depends on existing working relationships.', 'Advancement Daily Metrics Communication with Leaders', 'Lack of direction, poor management, constantly confusing managers with leaders. DEI is a joke, no development or career advancement if not in the bourbon club or talking rather than improving the lives of people living with severe diseases.', 'Bad work life balance, long hours']"
Sales Excellence Analyst BeNeLux (m/f/d),"Job Purpose
The purpose of this job is to support the Country Manager, sales team and local management with commercial and data-driven insights and tools that identify customer and market-based trends, drive sales force excellence and ultimately support sales performance and profitability growth.
Responsibilities
Design and maintenance of local dashboards across all business units
Stakeholder in development of centralized Business Information systems and reporting tools
Investigating operational requirements, problems, and opportunities. Seeking effective busi-ness solutions to improve the way data is used to help drive the business and maximise growth
Support function for local heads of sales and management to provide deep-dive ad hoc analy-sis (pricing, profitability, pipeline, activity analysis)
Using data to direct and support the efforts of the Sales Team to drive sales including proposing, evaluating and tracking discreet campaigns to drive new customer acquisition and repeat ordering.
Tracking performance of initiatives, monitoring risks and opportunities
Supporting the sales and marketing team to identify prospects using data analysis/data mining techniques, feeding those leads to the sales team via sales leadership.
Support commercial decision making awareness and sales campaign performance
Work on bespoke reporting for either projects or opportunities with the Lead Team and Country manager
Management Information reporting and rebate calculation for external clients
Responsible for quarterly/annual commission calculations and key role in business planning and target setting process alongside sales management
Maintenance of UK CPQ (quoting tool) system data and training collateral
Assist in ongoing CPQ (quoting tool) system development alongside HQ and local product managers
Responsible for calculation, communication, and monitoring of discount scheme
Supporting the calculation of commission/bonus payments
Link between sales and operations for data integrity
Support the rollout of new systems and new versions of existing systems including data migration and system integration
Adhoc projects
The Candidate
In view of the involvement in the organization and the role itself, the successful candidate should have the following qualifications, background and personal style
Education/ Professional Experience
Graduate (or similar) in an analytical/numerical discipline e.g. Mathematics, Physics, Econo-metrics
Advance Excel including macros
BI system experience (e.g. PowerBI, SAP Analytics Cloud, Snowflake)
Experience of CRM systems an advantage
Experience of large databases
Experience of SAP, useful but not essential
Good attention to detail
Good spoken communication manner and style
Fluent in Dutch and English
Personal Competencies
Energetic, straight-forward and performance-driven professional with strong execution abilities
Strong interest in analytics and the value they can have in helping a business to thrive
Commercial mindset with a keen interest in helping to drive the business
Stakeholder management - Work collaboratively with people at all levels and across all disci-plines within the Straumann Group",https://media.glassdoor.com/sql/40193/straumann-group-squareLogo-1647547693364.png,IJsselstein,nan,Straumann,"['best tech awesome culture awesome company', 'Good company takes care of their employees. Offers insurance that company pays 90% of the premium.', 'Great benefits and 401k plan', 'Good Medical and Dental benefits. + 401 K\nImplant reimbursement if you need them\nBest implant technology', '- Great pay and benefits']","['high pace\nhigh stress\ncustomers timeline are tight', 'Slight favoritism for Straumann reps over other divisions of the group.', 'Was bullied by a female manager who had issues with other women, particularly women with small children. Other women on my team also felt they were treated differently from their male counterparts. When I spoke up to HR they started a fast track to fire me, even though my numbers were significantly up from my start date. The company is very lucky I did not go after them for discrimination. Company also deters you from addressing customer service issues which is the foundation of creating strong relationships with your customers. You are encouraged to pass them off to customer service but they do not get handled, leaving your customers extremely frustrated. Overall from talking to other employees the company had a low morale, and was very cut throat. High turnover rates of employment. Constantly changing policies and commission structures in a not so beneficial way for the salesperson. Leaving this toxic work environment was the best thing ever.', 'Con #1 The digital side of the Straumann Group is now managed by implant managers. The DSS used to cover all brands now just a single brand. This causes DSS\'s to compete against each other and be more dependent on fewer implant reps. Clearcorrect reps now handle their own digital leads so they are also competing with the DSS\'s. \n\nDSS compensation is now significantly lower than implant rep compensation. Significantly. \n\nCon #2 Can not sell the complete digital workflow. This is a big deal. No photogrammetry, no chairside mill, and no CBCT. Simply offer scanners, 3D printers that still lack full arch temp resins (been ""validating"" them for a year), surgical design software, and a mill that is purchased for full arch.', '- Waited a month to train me\n- Once trained, little to no support was provided- I would ask questions and get no response or help\n- Not great community feel\n- Expectations set in the interview did not align with the job\n- Must work with difficult sales associates']"
