job_titles,job_description,images,locations,salaries,companies
Coördinator Supply Chain (32-36 uur/week),"Application Deadline:
Workplace: Hybrid Position
Location:
Almere, NL, 1327 AE
Contract Type: Full-Time
Working Hours: 40
Employment Type: Regular
Order Execution Coordinator, Netherlands, Hybrid

We are looking for an Order Execution Coordinator to join our awesome Spare Part Team in the Netherlands, Almere

What is the job about?
You will be responsible for Grundfos Netherlands (GDS) Spare Part delivery and handling of customers orders with focus on delivering as requested. In this role you will give support to the Global Orders Execution Manager with delivery information and quotations to meet customer requirements.

Your main responsibilities:
In this role your main responsibilities will be (but not limited to) :
Providing distribution deliveries to customers in EMEA.
Ensuring that the business outcomes are achieved. Stay trained and motivated to add value for Grundfos’ customers.
Keeping day to day contact with 3PLs and forwarders
Solving daily escalations, escalate if needed and initiate improvements for structural mitigation.
Buy to Order (BTO) Purchasing and customer stock order coordination
Follow-up with suppliers/inbound shipments
Tracking, coordinating, managing inbound shipments
Managing daily stock report
Managing Return Stock (RMA) from customers based on Group Policy
Identifying opportunities and functional process improvements in the current order execution supply chain processes

Your background
We imagine that you have:
A Bachelor degree in Supply Chain/logistics, Commercial Management or similar
Experience in working with ERP systems (SAP)
Previous experience of Customer Service or working experience for/with a 3PL would be key considerations
Solid communication skills in English (oral and written)
Knowledge of the Courier Express and LTL transportation business would be useful

What’s in it for you?
What are your goals?
Here at Grundfos it’s our mission to enable you develop and fulfil your aspirations, both career and personal. We are guided by our six core values, and you’ll find that your fresh ideas will be welcomed and make a difference in everything from local to large-scale global projects. You’ll encounter colleagues from all over the world both as part of your daily work, supporting and all the while broadening each other’s cultural horizons.
In addition, your day-to-day benefits include:
Flexible working hours; home office possibility and equipment; up to 3 days’ paid leave for volunteering
Annual bonuses, parental support, internal well-being consultants and programmes, engaging team buildings
Diverse, inclusive environment with employee-led forums offering colleagues a safe place to connect and share openly
Long-term career development with regular dialogue, as well as continuous learning and development opportunities.

Do you want to learn more?
If you have questions or would like to know more about this position, please contact Dirk Nyberg, recruiter at dnyberg@grundfos.com
If this job sounds appealing, please send your resume and cover letter by clicking “Apply”.
To dig deeper into the Grundfos universe, follow us on LinkedIn or Youtube, and to get to know some of your future colleagues and why they love working at Grundfos, check out Meet our people
We look forward to hearing from you.
About Grundfos
Grundfos is one of the world’s leading water technology companies with more than 19.000 employees in 60+ countries all over the world. Our skills commit us to pioneering solutions to the world’s water and climate challenges and improve the quality of life for people. We dare to do things that others cannot or dare not do, as we believe innovation is not only a business opportunity, but an obligation. And what really matters to us is not short term profit, but the impact we make. By becoming part of our united powerful team, you too can drive this change no matter your role.
An inclusive team
If you like the look of this job and know you can bring your skills to contribute to our purpose, please apply. We need and welcome professional people from all corners – however you identify and whatever your background is.",https://media.glassdoor.com/sql/6662727/blink-squarelogo-1653992148738.png,Den Bosch,€3K - €4K (Employer est.),Blink
Supply Chain Planner,"Wie zijn wij?

Met meer dan 100 collega’s in hartje Den Bosch is Blink de meest innovatieve uitgeverij van educatieve kindermerken (Bobo, Okki, Wild van Freek, National Geographic Junior en Pica Typen) en lesmethodieken (Blink Wereld, Blink Engels, Blink Nederlands, Blink Lezen en Blink Geschiedenis) die leerlingen uitdagen om hun talenten te ontwikkelen en de wereld te ontdekken. Bij alles wat we doen staat het prikkelen van de nieuwsgierigheid centraal, want nieuwsgierigheid is de motor van leren.

Onze cultuur

Blink is een dynamische en veelzijdige organisatie waarin ontwikkeling wordt gestimuleerd. Blinkers werken met passie voor de doelgroep, met elkaar en voor elkaar aan betekenisvolle producten. Voor inspiratie, een fijne flexplek of een samenkomst met collega’s ben je altijd welkom op kantoor, maar als je liever thuiswerkt is daar ook alle ruimte voor. Blink is een informele platte organisatie, waarin iedereen zichzelf kan en mag zijn. En er is aandacht voor elkaar, tijdens het werk, maar ook zeker daarbuiten tijdens de maandelijkse borrel of de verschillende activiteiten die door onze activiteitencommissie worden georganiseerd.

Wat ga je doen?


Als coördinator supply chain ben je een onmisbare schakel in het logistieke proces. Je bent verantwoordelijk voor de inrichting en optimalisatie van het proces van orderverwerking tot en met leveren en factureren. Daarnaast draag je zorg voor de administratie van producten en diensten in interne systemen. Je borgt een optimaal voorraadbeheer en een zo efficiënt mogelijk proces. Je communiceert veelvuldig met interne en externe relaties. Je werkt nauw samen met je directe collega in dit domein (supply chain analist) en je collega’s van Onderwijssupport.

Je gaat aan de slag met een divers pakket aan taken waaronder:

Aanmaken en beheren van producten en diensten
Voorraadbewaking
Orderverwerking
Facturatie
Relatiebeheer van de schoolleveranciers en logistiek dienstverlener
Contractbeheer en logistieke afhandeling
Functioneel systeembeheer

Wie ben jij?

Je bent pro-actief, analytisch, oplossingsgericht, en je bent een zelf-starter. Je werkt zorgvuldig en accuraat en het is voor jou geen probleem te schakelen tussen verschillende werkzaamheden. Je hebt sterke communicatieve skills, je schakelt vlot en makkelijk met diverse stakeholders binnen en buiten Blink. Je bent leergierig en kunt goed zelfstandig werken, je hebt een hands-on mentaliteit. Waarbij je in staat bent om zowel het overzicht te bewaken alsook zaken tot in de details te regelen. Het stroomlijnen van processen is je tweede natuur.

Ervaring en opleiding

HBO werk- en denkniveau
Minimaal 3 jaar werkervaring in een vergelijkbare rol, waarbij je ervaring hebt opgedaan in het logistieke domein
Affiniteit met het onderwijs is een pre

Wat bieden wij?

Salaris en overige arbeidsvoorwaarden zijn conform de CAO voor het Uitgeverijbedrijf. Deze houden onder andere in:
– Een 36-urige werkweek.
– Een salaris obv van inschaling in schaal 7 van € 2.857 tot € 4.300 (o.b.v. 36 uur), (afhankelijk van je ervaring).
– Een persoonlijk keuzebudget van 12% van je salaris, dat je kunt laten uitbetalen (vakantiegeld) of deels zelf kunt inzetten (voor extra vakantiedagen, aankoop van een fiets met fiscaal voordeel of voor andere doelen).
– Salarisverhogingen conform de CAO voor het Uitgeverijbedrijf, zowel cao-verhogingen als tredeverhogingen (gemiddeld 2% per jaar, totdat het maximum in de schaal bereikt is).
– De mogelijkheid en de faciliteiten om deels thuis te werken.
– Volop ruimte en budget om jezelf te ontwikkelen.

Interesse? / Reageren?

Denk je dat deze functie goed bij jou past? Stuur dan een mail met je CV en motivatie naar linda.buit@blink.nl. Heb je nog vragen over deze vacature? Dan kan je Linda daar natuurlijk ook over mailen.",nan,The Hague,€3K (Employer est.),Dekker Hout B.V. - Den Haag
Duaal / deeltijdstudent - Supply Chain Planner,"Supply Chain Planner te Den Haag

Ben jij op zoek naar een uitdagende en afwisselende functie binnen een mooi familiebedrijf? Wil jij ons helpen stappen te maken op het gebied van Supply Chain, operational én digital excellence? Lees dan zeker verder!

Wat doe je als Supply Chain Planner?

Ben jij de schakel tussen abstracte data en de uitdagingen van de dagelijkse praktijk? Wil jij de essentiële brugfunctie vervullen tussen inkoop, logistiek, magazijn en commercie? Dan zijn wij op zoek naar jou!

Als Supply Chain Planner lever je niet alleen een technische, maar ook een administratieve én commerciële bijdrage aan het gezamenlijke teamresultaat. Je zorgt voor de verwerking en controle van gegevens in het ERP- systeem, waaronder het verwerken en controleren van inkoopcontracten, inkooporders, inkoopdocumenten en magazijnontvangsten. Ook werk je mee aan het (aan)vullen van product specificaties in ons Product Informatie Management systeem.

Jouw taken:
Je biedt technische ondersteuning aan het algemene inkoopproces, je begeleidt het logistieke proces, controleert de Interne Kwaliteitsbewaking (IKB) en dient als back-up voor het verzorgen van technische tekeningen;
Je levert een bijdrage aan het artikelbeheer en je maakt diverse calculaties;
Je beheert voorraden, signaleert tijdig manco’s en bent proactief in het voorkomen van problemen;
Je stuurt onze productie aan voor diverse productgroepen;
Je levert een bijdrage aan onze uitdagende en complexe logistiek;
Je helpt met het onderhouden van producten, aanvullen van productkenmerken en de bijbehorende classificaties binnen het ERP en het PIM systeem.
Gezocht profiel:
Je beschikt over een afgeronde opleiding richting Economie, Business, ICT Management, Supply Chain en/of je hebt relevante werkervaring op administratief en/of Supply Chain gebied. Beschik je nog niet over de relevante werkervaring? Dan staat er een team van professionals voor je klaar die je graag verder helpt;
Je hebt minimaal een MBO+/HBO denkniveau;
Je bent analytisch, nauwkeurig, proactief en communicatief sterk;
Goede beheersing van de Nederlandse taal, Duitse en Engelse taal is een pre;
Je hebt kennis en ervaring met technieken in Excel en gaat secuur te werk;
Je hebt ervaring met ERP systemen, Microsoft Navision/Business Central is een pre;
Ervaring met Autocad is een pre;
En je hebt natuurlijk humor en houdt van gezelligheid
Wij bieden jou:
Een startsalaris vanaf €3.367,89 op basis van een 40 uur per week;
Een leuk, professioneel en ambitieus team met veel enthousiasme en behulpzaamheid;
Ruimte voor ontwikkeling d.m.v. interne en externe trainingen behorend bij de functie;
Laptop en mobiele telefoon;
Reiskostenvergoeding van € 0,21 ct. km.
Je komt in aanmerking voor een aantrekkelijke tantième regeling en niet-ziek bonus;
Deelname aan pensioenregeling (Bpf Meubel) op basis van een 50/50 premieverdeling;
Werken in een professioneel en ambitieus team met een informele werksfeer;
Een prachtig familiebedrijf met diverse bedrijfsuitjes per jaar en gezellige borrels!
Mogelijkheid tot het volgen van aanvullende trainingen en opleidingen;
Over Dekker Hout

Dekker Hout is een familiebedrijf dat in 1885 is begonnen als lokale houthandel en is uitgegroeid tot één van de meest vooruitstrevende houtbedrijven in Europa. Wij zijn gespecialiseerd in de import, export en verwerking van hout, houtproducten en gerelateerde materialen. Het hout dat wij inkopen wordt door onafhankelijke organisaties gecontroleerd en gecertificeerd en is afkomstig uit bossen die op duurzame wijze worden beheerd. Omdat kwaliteit, levertijd en leverbetrouwbaarheid bij ons voorop staan, investeren wij continue in onze logistieke en productie organisatie. Daarbij leiden wij onze medewerkers op zodat iedereen een bijdrage kan leveren aan het optimaliseren van onze dienstverlening aan onze klanten en het vergroten van ons bedrijfsresultaat. Bij Dekker Hout werken dan ook vakmensen met kennis van zaken die samen met onze klanten dagelijks aan de weg timmeren. We zijn ambitieus en gedreven vanuit de overtuiging dat onze organisatie naast een rijke historie ook een mooie toekomst heeft in een sector waar duurzaamheid een gewoonte wordt!

Heb jij interesse in deze uitdagende functie met daarin een belangrijke rol in de doorontwikkeling van de organisatie en haar medewerkers? Stuur dan je motivatiebrief en CV. Mocht je meer informatie willen over deze functie kun je dit opvragen bij Quincy Johnson, Corporate Recruiter via 06 30 86 97 70.

Interesse in de functie van Supply Chain Planner bij Dekker Hout B.V. - Den Haag regio Den Haag?
Reageer nu met je CV en motivatie via de ""solliciteer"" button.

Acquisitie naar aanleiding van deze vacature wordt niet op prijs gesteld.",https://media.glassdoor.com/sql/4293/robert-bosch-llc-squarelogo-1479310824097.png,Breda,nan,Bosch Group4.2 ★
"Manager Onderwijs voor het domein Business, Media en Recht","Bedrijfsomschrijving
Als wereldwijde marktleider speelt Bosch een toonaangevende rol in zowel de professionele als de doe-het-zelf markt voor elektrische gereedschappen en accessoires. Een constante stroom van innovaties, gekoppeld aan een intensief marketing- en verkoopbeleid moeten zorgen voor een voortdurende groei en marktaandeeluitbreiding.
Dit is jouw kans om je praktijkervaring te vergroten bij een aansprekend bedrijf.
Ben jij momenteel een duaal of deeltijd student? En wil jij met jouw ideeën een bijdrage leveren aan de Supply Chain activiteiten van Bosch in de wereld? Dan zijn wij op zoek naar jou!

Vacatureomschrijving
Wat het werken op de afdeling Logistiek interessant maakt is dat je met alle facetten van Supply Chain en Planning te maken hebt. Je bent innovatief en draagt ideeen aan voor verbeteringen voor processen en het systeem. Daarnaast ben je verantwoordelijk voor de volgende werkzaamheden:
Zorgdragen voor optimaal proces vanuit onze vestiging in Breda naar verschillende locaties door heel Europa en de wereld;
Forecasting behoeftes & afstemming met productie en transport;
Administratieve afhandeling sales & inkoop orders;
Plannen van componenten en materialen;
Opstellen, bijhouden en ontwikkelen van verschillende logistieke rapportages;
Controleren van parameters in ons ASW systeem.

Functie-eisen
In deze functie werk je in teamverband waarin snel ingespeeld dient te worden op wisselende omstandigheden. Dit vergt een grote mate van zelfstandigheid, eigen initiatief en communicatieve vaardigheden. Daarnaast herken jij jezelf in onderstaande punten:
Je volgt een deeltijd/duaal opleiding of wilt graag een deeltijd/duaal opleiding starten in de studierichting van HBO Logistiek.
Jij hebt kennis van Microsoft Office & Excel;
Jij hebt affiniteit met logistieke planning;
Kennis van SAP en/of overige logistieke systemen is een pré;
Jij bent minimaal 4 dagen per week beschikbaar;
Beheersing van de Engelse, Nederlandse taal, een eventueel extra taal is een bonus.
Aanvullende informatie
 Een enorm uitdagende functie waarin je in combinatie met je opleiding jezelf ontwikkelt tot volwaardig Teamleader. Verder bieden wij:
Goed salaris.
26 verlofdagen + 6 ADV o.b.v. fulltime dienstverband.
Een unieke én uitdagende functie binnen een internationaal opererend bedrijf wat bezighoudt met de nieuwste technologieën.
Goede werksfeer.
Opleidings- en trainingsmogelijkheden (zowel on the job als externe trainingen/cursussen).
Hoe ziet de sollicitatieprocedure van Bosch eruit?
Telefonische kennismaking met de Corporate Recruiter;
eerste kennismaking via Skype of Teams met jouw toekomstige leidinggevende;
tweede kennismaking met jouw toekomstige coördinator;
aanbieding en contract bij Bosch!
Ben je geïnteresseerd solliciteer dan via de button!",https://media.glassdoor.com/sql/1076329/windesheim-squarelogo-1576063302127.png,Zwolle,€6K - €7K (Employer est.),Windesheim4.5 ★
Supply Chain Coordinator,"Domein Business, Media en Recht
 40 uur per week
 Zwolle
 min € 5.670,- / max € 7.227,-
 kan t/m 18 juni 2023
Inhoudelijke vragen over de functie?
Stel ze aan Jolande Gomolka 06-51227686 Mail mij
Vragen over de sollicitatieprocedure?
Stel ze aan Erik van den Berg 088-4699709 Mail mij

Introductie
Heb jij een heldere visie op hoger onderwijs, kun je verbindend, inspirerend en inclusief leidinggeven? Ben je zowel intern als extern georiënteerd, ondernemend en innovatief? Ja? Solliciteer en sluit je aan bij Windesheim.

Aan deze baan geef jij invulling
Aan deze baan geef jij invulling
Als manager onderwijs ben je integraal verantwoordelijk voor de onderwijskwaliteit en innovatie van acht (nog nader overeen te komen) opleidingen van het domein BMR. Samen met jouw team van opleidingsmanagers zorg je voor de verbinding tussen het onderwijs en het onderzoek van die opleidingen en werk je nauw samen met de bedrijfsvoering. Je maakt onderdeel uit van het MT en samen met jouw collega MT-leden maak je werk van het verder ontwikkelen van het domein.

Samengevat zijn dit jouw werkzaamheden voor de opleidingen die je in portefeuille krijgt:
Borgen van de kwaliteit van onderwijs en tegelijkertijd richting en ruimte geven voor onderwijsvernieuwing in het kader van de Strategische Koers.
Zorgdragen voor verbinding tussen het onderwijs en onderzoek waarbij je nauw samenwerkt met de lectoraten.
Het versterken van de samenwerking met het team Leven Lang Ontwikkelen, dat verantwoordelijk is voor het onderwijs voor professionals (deeltijdonderwijs en contractactiviteiten).
Zorgdragen voor goede studentbegeleiding, verminderen van onnodige uitval en werken aan goede doorstroom in de keten met VO en MBO scholen.
Het, in samenwerking met de bedrijfsvoering en centrale diensten, verder professionaliseren van de organisatiecultuur en waar mogelijk verder verbeteren van de efficiency van de onderwijsorganisatie.
De vertaling van de ambities van het domein o.a. ontleend aan de Strategische Koers 2023- 2028 naar concrete activiteiten op het gebied van onderwijs, onderzoek en Leven Lang Ontwikkelen.
Het realiseren van financiële doelstellingen.
Het actief deelnemen en bijdragen aan domein overstijgende projecten.
Jij maakt impact in lijn met de strategische koers van Windesheim. De huidige strategische koers (2017-2022) loopt tot en met dit studiejaar. Het afgelopen jaar namen we de tijd om de balans op te maken, vooruit te kijken en ons voor te bereiden op de strategische koers voor de periode 2023- 2028.
Welkom bij Windesheim
Welkom bij BMR op Windesheim
Je sluit je aan bij het domein Business, Media en Recht dat met ruim zevenhonderd medewerkers onderwijs en onderzoek verzorgt voor meer dan 7.500 studenten en professionals. Je gaat aan de slag bij een domein dat werkt vanuit de maatschappelijke opdracht om studenten en professionals op te leiden die leven, leren en leiderschap tonen in een snel veranderende wereld. Onderwijs en onderzoek worden samenhangend ingezet voor het vormgeven van nieuwe en vernieuwende beroepspraktijken in (internationale) bedrijven en organisaties, en in de journalistiek.

In dit domein zijn ondergebracht:
Bacheloropleidingen: Accountancy, Bedrijfskunde, Commerciële Economie, Communicatie, Finance & Control, Finance, Tax and Advice, Global Project and Change Management, HBO Rechten, Human Resources Management, International Business, Journalistiek, Logistics Management, Ondernemerschap & Retail Management
Associate Degree-opleidingen: E-Commerce, Finance, Management
Leven Lang Ontwikkelen (LLO) met deeltijdonderwijs, open aanbod en maatwerktrajecten
Kenniscentra: Strategisch Ondernemerschap met lectoraten op het gebied van: Familiebedrijven, Strategische Samenwerking (Supply Chain Finance en Netwerken in een Circulaire Economie), Human Capital (Sociale Innovatie en Leven Lang Ontwikkelen) en het kenniscentrum Media met de lectoraten Media & Civil Society en Constructieve Journalistiek
Elke bachelor- en AD-opleiding staat onder leiding van een opleidingsmanager. Een aantal van deze opleidingen tezamen wordt aangestuurd door een manager.

Binnen het domein zijn er twee managers onderwijs, waarvan één tevens manager Kenniscentra is. Onder leiding van de directeur vormen deze managers samen met de manager Bedrijfsvoering het Management Team.

Je gaat aan de slag op een hogeschool waar iedereen zich gewaardeerd én thuis mag voelen. Gelijke kansen staan bij ons centraal en onze kracht ligt in samenwerking. Zo dragen we bij aan relevant onderzoek gericht op een inclusieve en duurzame samenleving en helpen we nieuwe professionals op weg in hun loopbaan. Dat doen we door te werken aan eigen leerroutes voor de studenten en door onze opleidingsmogelijkheden steeds beter af te stemmen op wat nodig is.

Op onze campus in Zwolle kun je meer dan werken alleen. Het is een energieke gemeenschap, met veel mensen, activiteiten en een grote hoeveelheid voorzieningen zoals een uitgebreide supermarkt, restaurants en cafés. Als je wilt sporten kan dat in onze sportschool of het zwembad. De campus ligt net buiten het bruisende centrum van Zwolle en op loopafstand van het station.
Jouw bijdrage
Jouw bijdrage
Ieder mens heeft een eigen unieke achtergrond. En wij geloven dat waar verschillen samenkomen, resultaten kunnen bloeien. Verder zien we graag dat jij voor de vacature van manager onderwijs vaardigheden als inspirerend, mensgericht leiderschap en verbinden meebrengt. Je weet hoe je draagvlak creëert en je bent gericht op het behalen van resultaten. Je weet een positieve en veilige werksfeer te creëren waarbij de diversiteit van medewerkers en inclusie bijdragen aan de kwaliteit van het domein. Daarnaast heb je:
Minimaal 5 jaar aantoonbare leidinggevende ervaring bij voorkeur in het onderwijs.
Ervaring met de complexiteit van een (onderwijs)organisatie en de hierbij behorende kwaliteitseisen.
Ervaring in het leiden van veranderingen.
Een relevant netwerk in het BMR werkveld.
Bij voorkeur didactische ervaring.
Een uitstekende beheersing van de Engelse taal.
Een afgeronde masteropleiding.
Jouw vooruitzicht
Jouw vooruitzicht
Je gaat aan de slag in een stimulerende omgeving waarin we je aanmoedigen kansen te benutten. En waarin jij jezelf mag en kunt zijn. Als manager onderwijs kun jij vanaf het nieuwe studiejaar 40 uur per week impact maken op mensen, het werkveld, de maatschappij en daarmee op de toekomst.
Daarnaast mag je (op basis van 40 uur per week) rekenen op:
een bruto maandsalaris tussen € 5.670,- en € 7.227,- (schaal 14 – manager c - cao hbo)
een contract voor de duur van twee jaar met bij goed functioneren aansluitend een vaste aanstelling.
Het betreft een structurele functie met een tijdelijke benoeming voor de periode van in eerste instantie 5 jaar. Bij een positieve evaluatie wordt de functie voortgezet. Bel met Erik van den Berg – zie contactpersonen – mocht je hier vragen over hebben.
53 vakantiedagen per jaar
8% vakantiegeld
8,3% eindejaarsuitkering
een flexibele reiskostenregeling, helemaal afgestemd op jouw wijze van vervoer.
volop ontwikkelingsmogelijkheden via ons eigen interne opleidingsinstituut en GoodHabitz
vers fruit op je werkplek en gratis sportfaciliteiten
een jaarlijkse vergoeding voor vakliteratuur en een gratis museumjaarkaart
thuiswerkfaciliteiten die hybride werken mogelijk maken, zoals een laptop

Solliciteer en sluit je aan
Ben jij een enthousiaste manager onderwijs en wil je jouw passie en talent inzetten binnen domein BMR? Solliciteer dan uiterlijk tot en met zondag 18 juni met een motivatie en je cv. Beantwoord in je motivatie in ieder geval onderstaande vragen. Dat helpt ons bij het zo objectief mogelijk werven en selecteren:
Wat spreekt je het meest aan in de huidige strategische koers van Windesheim?
Hoe ga jij invulling geven aan inclusief leiderschap?
Wat je kunt verwachten
Uiterlijk binnen 5 werkdagen na de sluitingsdatum krijg je een reactie.
De eerste gesprekken vinden plaats op maandag 26 juni op de campus in Zwolle.
Het arbeidsvoorwaardengesprek vindt plaats op donderdag 29 juni.
Een referentiecheck en een leiderschapsscan kunnen onderdeel uitmaken van de sollicitatieprocedure.
Het kunnen overleggen van een Verklaring Omtrent Gedrag maakt onderdeel uit van de sollicitatieprocedure.

Deze vacature wordt zowel intern als extern gepubliceerd. Geschikte interne kandidaten hebben voorrang op externe kandidaten.",https://media.glassdoor.com/sql/30220/atricure-squarelogo-1515796187944.png,Den Bosch,nan,AtriCure4.3 ★
