job_titles,job_description,images,locations,salaries,companies
Stagiair(e) Media & Content Creatie,"De toekomstige expert in Marketing

   MBO    24-40 uur    Rotterdam

Ben jij op zoek naar een uitdagende stageplek waar je jezelf verder kunt ontwikkelen op het gebied van marketing? Dan is deze stage iets voor jou!
Voor onze afdeling marketing zijn wij op zoek naar een leergierige en enthousiaste stagiair(e) die ons team komt versterken. Je krijgt de kans om praktijkervaring op te doen in een dynamische en snelgroeiende organisatie

Wat ga je dan doen?
Als stagiair(e) op de afdeling marketing ga je aan de slag met verschillende aspecten van marketing. Denk aan:

Het ontwikkelen en uitvoeren van (social media) marketing activiteiten om FRMWRK’s zichtbaarheid te vergroten;
Het monitoren en analyseren van de resultaten van marketing activiteiten en eventueel adviezen uitbrengen ter verbetering;
Meedenken over de ontwikkeling van marketingmaterialen en – communicatie;
Het ondersteunen bij onze podcast werkzaamheden.

Kortom, een veelzijdige stage, waarbij je zowel operationele als strategische ervaring opdoet! Uiteraard doe je dit niet alleen en zal onze collega Muhammed jou hierin begeleiden.

Wie zoeken wij?
✅Je volgt een relevante opleiding, bijvoorbeeld in de richting van marketing of communicatie;
✅Bij voorkeur ben je minimaal 6 maanden beschikbaar voor 24-40 uur per week;
✅Je bent leergierig en wilt jezelf graag verder ontwikkelen op het gebied van marketing;
✅Je bent communicatief vaardig in de Nederlandse taal;
✅Je bent creatief, proactief, zelfstandig en kunt goed samenwerken wanneer nodig.

Mocht je twijfelen of je hier volledig aan voldoet solliciteer dan nog steeds. We denken graag met je mee!

Wat bieden wij?
➡️Een uitdagende stageplaats waar jouw persoonlijke ontwikkeling centraal staat;
➡️Professionele en persoonlijke begeleiding van onze ervaren marketeer Muhammed;
➡️Een stagevergoeding van €275 per maand;
➡️Flexibele werktijden en mogelijkheid tot thuiswerken;
➡️Een jonge, platte en hechte organisatie met regelmatig leuke en gezellige borrels. Je zult ook niet de enige stagiair zijn.
Enthousiast?
Ben je al enthousiast ? Solliciteer dan direct! Ook als je twijfelt moet je het gewoon doen, wij denken graag met je mee.

Wat zeggen anderen?

''Tijdens mijn afstudeerperiode heb ik mijzelf verdiept in het instroombeleid van FRMWRK. FRMWRK heeft een informele cultuur, waar openheid en vertrouwen centraal staat. Het is de perfecte organisatie om jezelf als student te kunnen ontwikkelen. Zeker door het sparren met de opdrachtgever, krijg je nieuwe inzichten en verduidelijking over obstakels die je tegen komt tijdens het afstuderen. Daarnaast wordt je extrinsiek gemotiveerd door iedere medewerker voor het afronden van je scriptie! Je voelt je als een onderdeel van het team en je krijgt het gevoel dat je een meerwaarde bent voor de organisatie. '' - Fabian HR stagiair InHolland

""Tijdens mijn afstudeerperiode heb ik FRMWRK ervaren als een zeer leerzame omgeving waar als student ook echt naar je geluisterd wordt. De begeleiding van zowel mijn opdrachtgever als collega's was precies goed en heeft me geholpen bij het succesvol afronden van mijn studie. Als je een stage- of werkplek zoekt in een collegiale omgeving vol creativiteit en innovatie, dan ben je bij FRMWRK zeker bij het juiste adres!"" - Kirsten HR stagiair Hogeschool Leiden

''Tijdens mijn afstudeerperiode heb ik mijzelf beziggehouden met het werven van talent. Gedurende mijn stage heb ik mijzelf als volwaardig onderdeel van FRMWRK gevoeld. Dit komt door de informele cultuur en de openheid binnen het bedrijf. Verder ben ik altijd goed begeleid en kon ik altijd met vragen terecht bij mijn begeleider. FRMWRK is zeker een aanrader om af te studeren.'' - Karim CMGT stagiair Hogeschool Rotterdam

""Voor mijn afstuderen heb ik bijna 22 weken lang bij en met FRMWRK mogen werken. In de informele werkcultuur heb ik mij in deze tijd weten te verdiepen in een van voornaamste pijlers van FRMWRK: “succes”. Het is een bedrijf waar succes centraal staat, maar waar ook heel veel ruimte is voor ontwikkeling, (opbouwende) kritiek en persoonlijk contact. Tijdens mijn stage voelde ik mij dan ook echt een FRMWRK’er! "" - Anton CMGT stagiair Hogeschool Rotterdam",https://media.glassdoor.com/sql/2856093/swinkels-family-brewers-squarelogo-1566984456179.png,Lieshout,nan,Royal Swinkels Family Brewers4.1 ★
"Content- en communicatie stagiair(e) (v,m,x)","Werkgever: Swinkels Family Brewers
Locatie:
Lieshout, NL

Join the Family!

Wij zijn Swinkels Family Brewers, een 100% onafhankelijke familiebrouwer van mooie bieren als Bavaria, Cornet en La Trappe. We ondernemen al 300 jaar vanuit onze gezamenlijke passie voor bier en een goed gevoel voor kwaliteit. Met ruim 1.800 collega’s werken we wereldwijd samen om het beste uit onszelf te halen en de brouwerij nog mooier door te geven aan de volgende generatie.

Stagiair(e) Media & Content Creatie
Werkgever: Swinkels Family Brewers
Locatie:
Lieshout, NL
De uitdaging
In een tijd waar we continue bewegen tussen de digitale en fysieke wereld willen wij onze consumenten verrassen met aansprekende marketingactivaties, content en inspirerende websites van onze merken. Het Digital Marketing Team is verantwoordelijk voor customer interaction, social content, online media campagnes, social media strategy, emailmarketing en customer service.

Wat ga je doen?
In samenwerking met de Social Content Specialist ben je verantwoordelijk voor het dagelijks beheer en onderhoud van de social media kanalen van onze merken, denk hierbij aan de Facebook en Instagram pagina’s van bijvoorbeeld Bavaria, CORNET of Fruitage;
Je ontwikkelt en distribueert digitale content & creatives voor onze merken die marketeers in de verschillende landen kunnen gebruiken voor de social media kanalen en digital marketing campagnes;
In samenwerking met specialisten ga je de content ook publiceren en resultaten evalueren;
Je ondersteunt bij digitale marketing campagnes waar nodig en alles social media gerelateerd, van Instagram stories en Reels tot YouTube en Snapchat.

Dit bieden we jou
We vinden het belangrijk dat iedereen zich thuis voelt, letterlijk. Daarom ontvang je als nieuwe collega een warm welkom bij ons en maak je kennis met alle andere stagiairs. Daarnaast vertellen we je alles over de historie van de familie en onze organisatie. Daarnaast mag je het volgende van ons verwachten:
Een uitdagende werkomgeving, met volop mogelijkheden om binnen een sterk groeiend bedrijf te ondernemen, je ambities waar te maken en je inzichten naar voren te brengen;
Je vindt bij ons een open cultuur in een informele werkomgeving, waar kernwaarden als ondernemerschap, samenwerken en focus op resultaat voorop staan;
Uiteraard bieden wij ook een mooie stagevergoeding.

En ja, op zijn tijd, samen met collega’s, een heerlijk biertje proeven uit onze ruime selectie van mooie biermerken hoort er natuurlijk ook bij.

Wie ben jij?
Jij volgt momenteel een MBO of HBO-opleiding in een grafische, marketing, communicatie en/of (multi)media richting en ben je op zoek naar een meewerkstage;
Je bent voor minimaal 5 maanden beschikbaar en hebt aantoonbare affiniteit met social media en online marketing;
Je bent social savy, volgt de laatste trends op social gebied en kunt een Reel maken en posten, creatief en kunt sterke online copy/teksten schrijven;
Basiskennis Adobe Creative Suite, hoofdzakelijk Photoshop en Illustrator. Premiere Pro en After Effects zijn een pré;
Je hebt goede communicatieve vaardigheden en een goede beheersing van de Nederlandse en Engelse taal, ook in spelling;
Je werkt secuur en checkt je werk voor oplevering;
Bovenal ben je leergierig, proactief, creatief en een echte teamplayer.

Zo kun je solliciteren
Ben jij op zoek naar een nieuwe uitdaging en voel je je aangesproken door deze vacature? Verras ons dan met jouw motivatie door te solliciteren via de onderstaande button.

Heb je na het lezen van deze functieomschrijving nog vragen? Neem dan gerust contact op met Tim Schnitzler via tim.schnitzler@swinkelsfamilybrewers.com.
Wanneer krijg je een reactie op jouw sollicitatie?
Ga je solliciteren? Leuk! Je krijgt direct een bevestigingsmail van ons als je sollicitatie binnen is. Binnen twee weken ontvang je van ons een terugkoppeling. Houd voor de zekerheid je spam box goed in de gaten!",https://media.glassdoor.com/sql/2877000/hermitage-amsterdam-squarelogo-1644410388138.png,Amsterdam,nan,Hermitage Amsterdam5.0 ★
Graphic Designer,"Twee fantastische en drukbezochte cultuurhuizen zoeken een student die zich wil ontwikkelen! De Nieuwe Kerk en Hermitage Amsterdam zoeken op korte termijn een enthousiaste Content- en communicatie stagiair (v,m,x) voor 4 of 5 dagen per week. Zoveel mogelijk bezoekers trekken met zoveel mogelijk impact is onze gezamenlijke uitdaging. Je gaat daarom aan de slag op de afdeling Pers en Marketingcommunicatie waar je samenwerkt met de Contentmanager en de collega’s van Pers en Publiciteit.
Dit ga je allemaal doenJe ontwikkelt in samenspraak met collega’s (pers)content rondom de lopende én aankomende tentoonstellingen en de innovatieve randprogrammering in beide huizen;Je zorgt dat de content op de websites altijd up-to-date is en je weet je weg te vinden in verschillende CMS’en (ervaring met WordPress of andere systemen is een pre);Je ondersteunt bij de contentcreatie en webcare van alle social mediakanalen;Je bereidt de nieuwsbrieven voor en verzorgt digitale mailings;Je werkt mee met het team Pers en Publiciteit zoals mailingen, het schrijven van persberichten en analyseren van de resultaten, het organiseren van persconferenties, etc;Je ondersteunt de afdeling bij de dagelijkse werkzaamheden waarbij je vooral betrokken bent bij diverse marketing- en pr-activiteiten.
Meer over ons
De Nieuwe Kerk en de Hermitage Amsterdam, twee historische monumenten met museale functie in het centrum van de stad. Met laagdrempelige tentoonstellingen en een breed scala aan activiteiten inspireren en verrijken we onze bezoekers met kunst, cultuur en geschiedenis.
De Nieuwe Kerk toont nu De eeuw van Juliana. In de Hermitage zijn we druk bezig met de voorbereidingen voor de tentoonstelling Rembrandt & tijdgenoten.
Ben je een gemotiveerde, zelfstandige student(e) (bij voorkeur hbo of universiteit) die de juiste creatieve energie op onze afdeling brengt, nauwkeurig werkt en een vlotte pen heeft?
Heb je daarnaast passie voor kunst en cultuur, houd je van een dynamische omgeving en beschik je over sterke communicatieve en sociale vaardigheden? Dan willen we je graag ontmoeten! Reageren kan via pressoffice@hermitage.nl.
Zo ziet de afdeling eruit
Wij werken vanuit ons kantoor aan de Amstel, in hartje Amsterdam. De stageplek is onderdeel van een brede afdeling Pers en Marketingcommunicatie. Je werkt met collega's die gewend zijn dat extra stapje te zetten en op beide locaties verantwoordelijk zijn voor de PR, Marketing & Sales, Content & Online Media en Publieksprogrammering. Er wordt werk geleverd waar we gezamenlijk supertrots op zijn. En dat vieren we geregeld met een gezellige borrel!",https://media.glassdoor.com/sql/2283032/vanilia-squarelogo-1646222188004.png,Wormerveer,nan,Vanilia2.4 ★
SOCIAL MEDIA ADVERTISER,"Graphic Designer

Heb je een goed beeld van de huidige tijdsgeest en een brede interesse op het gebied van kunst, cultuur en mode? Ben je energiek, ondernemend, origineel, innovatief en kun jij je goed identificeren met de geheel eigen stijl van Vanilia? Dan zijn wij nieuwsgierig naar jouw werk als Graphic Designer!

Wij zijn op zoek naar een ervaren en inspirerend Graphic Designer met een uitstekende kennis van Illustrator, Photoshop, Indesign en Adobe Premiere met een origineel portfolio. Je hebt een pure, eerlijke en positieve instelling en voelt je verbonden met de (sociaal verantwoorde) filosofie van Vanilia en weet deze goed te vertalen in je werk. Vind je naast Graphic Design ook fotografie en content creëren leuk om jou creativiteit in kwijt te kunnen? Dan is dit de vacature voor jou!

Full-time · Wormerveer

In deze functie ben je verantwoordelijk voor alle grafische uitingen en lever je een belangrijke bijdrage aan de vormgeving en beeldtaal van Vanilia.
Taken die daarbij horen zijn
Graphic Design – van vormgeving tot print, online en video
Het verzorgen van mailings
Interne en externe grafische uitingen
Vormgeving van labels voor onze collectie
Uitingen voor de website en social media
Editten van video’s
Content creëren voor diverse kanalen zoals social media


Wie ben jij
Je bent een energieke aanpakker en bezit over doorzettingsvermogen en zelfstandigheid
Je haalt er voldoening uit om de stijl en kwaliteit van Vanilia te waarborgen in je werk en bent in staat om te werken binnen de kaders van Vanilia
Aantoonbare ervaring in het vormgeven van print en digitale media
Je bent flexibel en kunt omgaan met een strakke deadline
Afgeronde HBO opleiding richting Grafisch Ontwerpen
Ervaring met Illustrator, Photoshop, Indesign en Adobe Premiere
Uitstekende spreek- en schrijfvaardigheid in de Nederlandse en Engelse taal is een vereiste!

Over Vanilia

Werken bij Vanilia betekent werken in een inspirerende omgeving. Met een ambitieus team werken we elke dag samen om het beste uit onszelf te halen. Wij geloven dat de kracht van een merk te danken is aan het team dat erachter staat en investeren dan ook graag in talent. Wij bieden goede kansen in onze boutiques verspreid door heel Nederland of op ons monumentale servicekantoor De Adelaar in Wormerveer.",nan,Ouderkerk aan de Amstel,nan,vandenbusken3.0 ★
Social Media GURU,"vandenbusken groeit en zoekt een Social Media Advertiser die ook wil groeien!

Bij vandenbusken bedenken we knock-out ideeën voor de meest uiteenlopende nationale en internationale klanten zoals Weber, Indeed, Pfizer, BiFi en Ron Blaauw. Ondanks dat we dit al meer dan 60 jaar succesvol doen, geloven wij nog iedere dag dat het beter kan én willen we onszelf iedere dag overtreffen… En dat kan niet zonder een goed team. Hierin zijn we op zoek naar een extra speler. Een speler die ervoor zorgt dat onze campagnes de grootst mogelijke impact maken door ze goed te verspreiden via de social platformen.
Wil je je talenten inzetten en verder ontwikkelen bij het meest gedreven bureau van Nederland? Kom dan als social media advertiser het verschil maken bij vandenbusken!

Wat zijn je werkzaamheden?

Je bent van A tot Z verantwoordelijk voor het verspreiden van social campagnes voor de kanalen: Instagram, Facebook, LinkedIn, Snapchat, TikTok en Twitter. En wie weet komt daar morgen een extra platform bij…
Gebaseerd op de doelgroep van de campagne, adviseer jij welke social platformen we het best kunnen inzetten en hoe we de doelgroep kunnen targeten.
Op basis van de KPI’s van een campagne bepaal jij hoe de campagnes worden ingericht en bouw je de campagnes op.
Je optimaliseert campagnes en houdt deze scherp in de gaten om de best mogelijke resultaten te behalen.
Je houdt alle belanghebbenden op de hoogte van de resultaten en presenteert de social resultaten tijdens een eindevaluatie van een campagne.
Je denkt mee met het creatieve team hoe we de social platformen kunnen inzetten binnen campagnes. Hierin voorzie jij het creatieve team van inspiratie wat betreft de allernieuwste technieken op de platformen.

Wat we zoeken

Je bent 24 uur per week beschikbaar, verdeeld over minimaal 3 dagen.
Je bent bezig met een – of hebt een afgeronde – Hbo-opleiding, bij voorkeur in de richting marketing/ communicatie.
Je hebt minimaal 1 jaar ervaring met social media advertising.
Je hebt een grote affiniteit met performance marketing en wilt hier verder in groeien.
Je weet je weg binnen de Facebook Business Manager uitstekend te vinden. Ervaring binnen de campagnemanagers van andere social media platformen is een pré.
Je hebt ervaring met Google Analytics.
Je smult van de nieuwste technieken op het gebied van social en bent niet bang om hiermee te testen.
Je bent gek op cijfers, analyseren en verbeteren door toe te passen wat je geleerd hebt.
Het zit in je natuur dat je alles wilt weten. Je bent nieuwsgierig en onderzoekend.
Je bent bovengemiddeld zelfstanding.
Je hebt een uitstekende beheersing van de Nederlandse taal

Hoe ziet een dag bij vandenbusken er in jouw rol uit?

Een ‘gemiddelde werkdag’ bestaat niet bij vandenbusken… Al staat één ding vast, we beginnen de dag met een kop koffie. Goede koffie. Daarna gaan we los. Nieuwsgierig als je bent, ga je meteen kijken hoe jouw social campagnes gisteren gescoord hebben. Je hebt gister een aantal nieuwe A/B tests opgezet en bent heel benieuwd wat de eerste resultaten zijn. Nadat je alle campagnes hebt gemonitord en hebt bijgestuurd waar nodig, heb je een meeting. Je wordt gebrieft door een strateeg. Je strategische collega’s zijn bezig met een nieuwe campagne en willen jouw expertise inzetten om de klant te adviseren wat de meest ideale platformen zijn voor de campagne. De doelgroep is scherp geformuleerd. Je hebt direct ideeën en gaat aan de slag. Welke platformen gaan we inzetten? En welke targetingmogelijkheden zetten we in om de doelgroep op die platformen te bereiken? Dat zijn de belangrijkste vragen waar snel antwoorden op moeten komen. Later die dag wordt er van je verwacht dat je terugkoppeling geeft, dus je gaat direct aan de slag. Dan is het alweer tijd voor lunch. De ochtend is omgevlogen! Na een gezellige lunch vol sterke verhalen staat er opnieuw een brainstorm gepland. Ditmaal voor een andere campagne. Het creatieve team heeft ideeën en wil met jou sparren hoe we de campagneboodschap op een creatieve manier via de platformen kunnen overbrengen. Jij voorziet van input over de nieuwste mogelijkheden op de platformen en adviseert welk ad format het meest geschikt is. Samen komen jullie tot het beste idee. Na de brainstorm is het tijd om een nieuwe campagne in te stellen die later die week live moet. Creatie is bij je aangeleverd en het is tijd om de campagnewebsite te voorzien van pixels, de campagnes te bouwen en gereed te maken voor livegang. Nadat alles is ingericht, is het tijd om de strateeg terugkoppeling te geven over de meest ideale platformen en doelgroeptargeting, waar je die ochtend aan hebt gewerkt. Het was een dynamische dag. Met een voldaan gevoel vertrek je richting huis waarbij nieuwe ideeën en strategieën alweer opborrelen!

Wat we bieden

Een functie waarin jij jezelf verder kunt ontwikkelen als social media advertiser. O.a. door trainingen die wij vergoeden
Een energieke, creatieve omgeving onder de rook van Amsterdam, waarin jij je kan ontwikkelen
Een ongekend goede sfeer
Informele hands-on cultuur
Goede arbeidsvoorwaarden
Een gemixt team van ervaren medewerkers en jonge talenten
Een klantportfolio met grote nationale en internationale merken in zeer uiteenlopende branches

Wie we zijn

Wij zijn vandenbusken. Een campagnebureau met vechtersmentaliteit. We gaan voor niets minder dan het WOW-effect. En geloven dat je pas knock-out ideeën kunt leveren als je de kern van een vraagstuk hebt blootgelegd en de dromen van je klanten deelt. Daarom zetten we onze tanden altijd vol overgave in een project. We doorgronden eerst de vraag en behoefte van onze klant. Dan gaan we los om de verwachtingen te overtreffen.

Solliciteren

Ben jij de social media advertiser die we zoeken? Dan zijn wij heel erg benieuwd naar je motivatie en CV. De startdatum is zo snel mogelijk dus wacht niet langer en solliciteer direct door een mail te sturen naar iris@busken.nl o.v.v. “Vacature Social Media Advertiser”.",nan,Veghel,nan,Outmatch
Marketing & Social Media Intern,"Ben jij een enthousiaste en gepassioneerde communicatie/marketing student? En ben jij op zoek naar een uitdaging waarin je als social media guru aan de slag kan? Dan zijn wij wat voor jou!
We willen graag de cultuur van ons bedrijf beter uitdragen op onze social mediakanalen, denk aan Twitter, LinkedIn, Facebook en eventueel Instagram. Hierbij kunnen we wel wat hulp gebruiken van een jonge en frisse communicatie student. We zoeken iemand die creatieve content bedenkt. Op (bijna) dagelijkse basis kun je hiermee zelfstandig en eventueel vanuit huis mee aan de slag gaan en wordt het enorm gewaardeerd als je zelf komt met nieuwe ideeën voor onze communicatie. Ben je geïnteresseerd, aarzel niet en reageer snel!
‘Vereisten’
Je hebt passie voor social media
Je beschikt over een hbo-denkniveau en hebt affiniteit met e-commerce
Je bent iemand die veel initiatief neemt
Je bent in staat om aantrekkelijke teksten te schrijven
Je kan zelfstandig werken
Je bent nieuwsgierig en komt met creatieve ideeën
Interesse:
Stuur een e-mail met motivatie en CV naar info@outmatch.nl t.a.v. Mandy van de Wijgert",https://media.glassdoor.com/sql/2192276/aspire-brands-squarelogo-1630655296020.png,Rotterdam,nan,Aspire Brands B.V3.6 ★
Stage Digital Product Design,"Wil jij meedoen in het opzetten van de marketingstrategieën van merken zoals onder andere Batiste, Isle of Paradise en Noughty?Als stagiair bij Aspire Brands maak je deel uit van ons team in Rotterdam dat onze Benelux business runt. Je belangrijkste verantwoordelijkheid is het beheren van social media voor onze merken, ondersteuning bij marketingactiviteiten en administratieve taken.Sterke communicatieve vaardigheden en creativiteit zijn essentieel. We willen dat je met ideeën komt over hoe we onze merken het beste kunnen laten groeien. We zijn dus op zoek naar iemand die initiatieven neemt, met nieuwe ideeën komt en verantwoordelijkheid neemt.Wat ga je doen?· Verantwoordelijkheid voor het creëren van content en het bedenken van creatieve ideeën· Verantwoordelijk voor het beheren van onze relatie met content creators, en het beheren van onze digitale community· Rapporteren en analyseren van marketing en social media activiteiten· Ondersteuning bij marketingactiviteiten (evenementen, sampling mogelijkheden), en administratieve proceduresJouw profiel:· Bachelor- of master student in een vakgebied zoals mediacommunicatie of marketing· Passie voor schoonheid en sociale media· Zelfstandig kunnen werken met een goede drive· Nieuwsgierig en een creatief· Fulltime per week beschikbaar voor een periode van 5 maanden (minder uren per week is ook mogelijk – in overleg)· Bereid om te werken vanuit ons super mooie kantoor in het centrum van Rotterdam· Nederlandse en engelse taalvaardigheid is een must.We bieden je de kans om te werken in een start-up cultuur waar alles wat je doet ertoe doet. Je krijgt de vrijheid om te experimenteren en je eigen projecten aan te sturen. Er wordt een stage vergoeding gegeven.Soort dienstverband: Parttime, StageContractduur 5 maandenParttime uren: 24 per weekSalaris: €100,00 - €500,00 per maandRooster:Flexibele werkurenma-vrSecundaire arbeidsvoorwaarden:Flexibele werkurenTaal:Dutch (Vereist)Werklocatie: FysiekVerwachte startdatum: 01-09-2023",https://media.glassdoor.com/sql/4930476/kpmg-us-squareLogo-1677268920137.png,Amstelveen,nan,KPMG4.0 ★
