job_titles,job_description,images,locations,salaries,companies
Junior Consultant Supply Chain Sustainability,"Internship - Supply Chain Planning - Startdatum in overleg
Samenwerkend met verschillende afdelingen maak ik dagelijks impact! Daarom ga ik met enthousiasme aan de slag!

HEINEKEN zoekt joú!
Iedere dag werken wij met trots aan onze toffe producten die jij zeker al eens in je hand hebt gehad op een feestje, tijdens een werk meeting of thuis op de bank. HEINEKEN is namelijk veel meer dan alleen bier. Wat dacht je van merken als Cristal Clear, Royal Club, Heineken 0.0, Amstel Radler en Birra Moretti. Wij werken actief aan het creëren van een fijne werkomgeving waar iedereen zich gerespecteerd voelt en gelijke kansen heeft. Jouw persoonlijkheid, kennis en competenties vormen het succes van onze organisatie.

De stage
In ons team zal je vanaf dag 1 meedraaien in de operatie. Dit betekent zelfstandig kleine projecten doen en meehelpen in het operationele planproces.
Binnen het plan proces krijg jij jouw eigen takenpakket waarvoor jijzelf verantwoordelijk bent. Hier horen standaardtaken bij maar er is ook ruimte voor verbeter projecten die jijzelf kan initiëren.
Bij deze stage zal je veel te maken krijgen met de diverse functies binnen HEINEKEN. Daarnaast zal je ook veel contact hebben met leveranciers.
Tijdens de stage is er veel aandacht voor begeleiding en persoonlijke ontwikkeling.

Tijdens je stage krijg je de ruimte om HEINEKEN als bedrijf te leren kennen, ook buiten jouw afdeling en HEINEKEN. We geven jou het vertrouwen en de vrijheid, zodat je als een echte ondernemer te werk kunt gaan. We halen de buitenwereld graag naar binnen en daarom omarmen wij nieuwe, frisse ideeën met enthousiasme. Uiteraard altijd met de begeleiding die voor jou passend is.

De afdeling
Heineken Netherlands Supply is de organisatie binnen Heineken NV die verantwoordelijk is voor de 3 brouwerijen in Nederland (Zoeterwoude, Den Bosch en Wylre). De brouwerij in Zoeterwoude is ook nog eens de grootste brouwerij binnen Europa, waar jaarlijks rond de 18M hectoliter bier wordt gebrouwen! Het team Supply Chain Planning (SCP) stuurt deze 3 brouwerijen aan en maakt de planning voor de brouw- en verpakkenprocessen. Binnen het team Tactische Planning (TSCP) plannen wij onder andere alle materialen die we nodig hebben om onze brouwerijen draaiende te houden (denk aan blikjes, flesjes, dozen, 6-packs, etc.) TSCP is een echte spin-in-het-web omgeving waarbij we te maken hebben met alle stakeholders in de keten; aan de ene kant de brouwerijen, aan de andere kant onze markten die over de hele wereld liggen en alle functies die daar tussen zitten.

De arbeidsvoorwaarden
Jouw startdatum is te bepalen in overleg
De stage is fulltime (in overleg is ook 4 dagen in de week mogelijk)
De duur van de stage is 6 maanden
Het is een meewerkstage (met optie tot HBO afstudeerstage)
Jouw standplaats is Leiden.
Je ontvang een stagevergoeding van €500
Je geniet van 2 vakantiedagen per maand (o.b.v. fulltime)
Als je geen ov-studentenproduct hebt, worden jouw kosten voor woon-werkverkeer volledig vergoed
Je krijgt een werklaptop

De start van jouw stage
Samen met een diverse groep stagiairs van verschillende afdelingen zul jij aan jouw stage bij HEINEKEN beginnen. Samen worden jullie wegwijs gemaakt in de organisatie. Verder kun je samen met je mede stagiair(e)s leuke activiteiten organiseren.
De unieke jij!
Affiniteit met Supply Chain
Een echte teamspeler
Analytisch sterk

Wij vinden dat iedereen unieke talenten heeft en zijn daarom op zoek naar jou!
Bezig met HBO of WO opleiding
Bij voorkeur in de richting van Logistiek/Supply Chain en/of (technische) Bedrijfskunde en in afrondende fase van je studie

Voorwaarden vanuit HEINEKEN
Je staat ingeschreven bij een onderwijsinstelling
In het geval niet-EU nationaliteit dien je als stagiair(e) ingeschreven te staan bij een Nederlandse onderwijsinstelling.
In geval van wel-EU nationaliteit mag je als stagiair ook ingeschreven staan bij onderwijsinstellingen buiten de EU.
Fysieke aanwezigheid op de locatie van jouw stage. Wij geloven dat jij het meeste leert wanneer je direct kunt samenwerken met je collega’s. Het is dus niet mogelijk om volledig remote te werken en HEINEKEN faciliteert niet in housing.

Interesse?
Wat leuk! Voor meer informatie over deze vacature of over de sollicitatieprocedure, kun je contact opnemen met werkenbijheinekennederland@heineken.com. Je kunt natuurlijk ook gelijk solliciteren door te klikken op de “solliciteer nu” knop. Hierna vragen we je wat gegevens in te vullen, een korte motivatie voor de stage te schrijven en jouw meest recente CV te uploaden.
De organisatie
HEINEKEN is al meer dan 150 jaar marktleider. We hebben een familiegeschiedenis en Nederlands erfgoed waar we trots op zijn. Deze trots komt terug in ons ondernemerschap en nemen we mee in alles wat we doen en waar we komen. We zijn merkenbouwers en de onmisbare schakel tussen de brouwerijen en hét perfecte biertje bij mensen thuis of op het terras.
Samen staan we voor onze kernwaarden: passie voor kwaliteit, genieten van het leven en respect voor mens en milieu. We pleiten altijd voor verantwoord alcoholgebruik, voelen ons nauw verbonden met de Nederlandse maatschappij en lokale gemeenschap en streven er voortdurend naar om onze impact op onze planeet te verbeteren.
Het omarmen en vieren van diversiteit is de kern van het doel van HEINEKEN om ""de vreugde van echte saamhorigheid te brouwen om een betere wereld te inspireren"". Wij geloven dat mensen die zo divers zijn als onze brouwsels - inclusief en niet beperkt tot geslacht, etniciteit, leeftijd, seksuele geaardheid, religieuze overtuiging, nationaliteit, sociale achtergrond, handicap en denkstijl - ons leven verrijken en ons bedrijf versterken. We verwelkomen en overwegen sollicitaties van alle gekwalificeerde kandidaten, omdat we pleiten voor een cultuur van verbondenheid die eerlijke en gelijke kansen voor iedereen biedt.

Heb jij feedback op deze vacature? Mail dan naar werkenbijheinekennederland@heineken.com",https://media.glassdoor.com/sql/257903/royal-haskoning-squarelogo.png,Amersfoort,nan,Royal HaskoningDHV4.1 ★
(Junior) Supply Chain Analyst,"Making a difference in people’s lives while you work with clients to successfully deliver projects. As Junior Consultant Supply Chain Sustainability you will become part of the combination between global expertise and local knowledge. That is how you help deliver a multidisciplinary range of consultancy services for the entire living environment!
What you do as Junior Consultant Supply Chain Sustainability
""Solving diverse logistics issues for customers. How can it be done even more efficiently and sustainably? In the Districon Young Talent Program, you will develop in record time into a qualified Junior Consultant Supply Chain Sustainability""

You are passionate about logistics with a focus on sustainability. Your career in supply chain sustainability gets off to a flying start at Districon. With challenging assignments in more efficient organization of city logistics, network & transport or supply chain management. How do you apply circularity in the logistics chain? How do you reduce your clients' carbon footprint? In the Young Talent Program, you will participate fully in these projects from you first day at Districon. Every six months you will face a new challenge in making warehousing, distribution or sales & operations more sustainable. You will work in a team with experienced consultants and experts in various disciplines.

As Junior Consultant Supply Chain Sustainability, you will use your talents for projects such as:

making the production chain of a beer brewer sustainable;
carrying out CO2 performance scans and benchmarks for shippers and transporters;
devising a commercial and sustainable plan for building new distribution centres for a major retailer;
creating a planning tool for the most efficient supply of sports products in a distribution centre.
Where you will work
Royal HaskoningDHV is a global engineering, project management and consultancy firm, with 6,000 colleagues in 140 countries. Together we work on projects that have a positive impact on people, our living environment, and the economy. With the Business Line Industry & Buildings we serve a broad, international market. We work on projects within various markets, among which: consumer goods, pharma, logistics, data centres, energy, healthcare, government, and education.

You will be part of the department Supply Chain & Logistics which consists of our global supply chain team Districon. Our highly motivated team combines a unique mix of process experience, data science expertise, digital tools, and technology to deliver future-proof solutions which add value throughout the entire chain - from raw material to end consumer. By doing this, we ensure our clients can make informed decisions on strategy, tactics, and operations. Do you want to know more about our services or the projects we work on? You can check it out on this webpage.
What you bring
An intrinsic motivation to make the logistics chain more sustainable. The ability to keep going until you find the best solution. You are flexible, you enjoy variety and ask your colleague for advice if you are having problems. The consultants are eager to help you: your development is our priority. You are ambitious, analytically strong and with your inquisitive mind you always get to the core of an issue. You enjoy visiting your international clients abroad. You communicate clearly, always look at things from the other side and respond accordingly.

As Junior Consultant Supply Chain Sustainability, you will bring along the following as a basis:

a completed university degree in Supply Chain Management, (Technical) Business Administration, Operations Management or Mechanical Engineering - preferably with supply chain as a focus area;
some (work) experience in supply chain, sustainability or consultancy, gained during or after your studies;
excellent command of Dutch and English.
What we offer you
At Royal HaskoningDHV we offer a great working atmosphere in which organizational and personal development take central stage. Our assessment and rewarding process will always be based on your personal competences. We offer you a wide range of projects in which you can participate and gain experience. You will learn from working with experienced consultants and get a glimpse of the various areas of expertise we have on offer. Learn and experience in order to map out your own career path.


We combine hard work with delicious lunches, Friday afternoon drinks, barbecues, winter sports and once every two years a weekend away with the entire company. If corona allows us, of course. In any case, a good work-life balance is important to us.


Furthermore, we offer:

A great work-life balance, including a company laptop and phone, so you can work wherever and whenever you want;
Participation in the multi-year development program 'Expedition Districon' that consists of coaching and training of practical skills and your consulting- and coaching skills;
A well-facilitated home office, so you can work partly at home and partly in the office;
Travel allowance for own or public transport;
A personal budget to spend, for example on a bicycle or buy extra holidays, but you can also have it paid out;
28 vacation days with full-time employment;
Besides the development opportunities in the most beautiful and challenging projects, we also offer you:
A competitive primary salary and pension accrual through our own pension fund;
Plenty of training and development opportunities.

You will work in our office in Amersfoort. But you have access to all our other offices (eg: Amsterdam, Rotterdam, Eindhoven, Nijmegen).
Are you our new colleague?
Then we would like to meet you! Apply via the button below, or if you have any questions please send them to Christian de Visser, Lead Recruiter Multinationals, at christian.de.visser@rhdhv.com.",https://media.glassdoor.com/sql/4812555/incore-software-squarelogo-1637747220422.png,Amsterdam,€3K - €4K (Employer est.),Incore Software
Supply Chain Planner,"(Junior) Supply Chain AnalystWat we zoeken:Wij zijn op zoek naar een enthousiaste en gedreven (junior) Supply Chain Analyst. Als Supply Chain Analyst ben jij samen met collega’s de schakel tussen onze klanten en onze supply chain oplossingen. Je neemt deel aan ontwerp sessies bij de klant waarin we de supply chain analyseren en knel- en verbeterpunten vertalen naar oplossingen in onze software. Je werkt in een team bestaande uit Supply Chain analisten en IT Business analisten en je werkt nauw samen met developers, testers en onze klanten. Je draagt bij aan de functionele specificatie waarmee onze technische collega’s aan de slag gaan.Waar kom je te werken:Je komt te werken bij Incore Software. Incore Software is het leukste softwarebedrijf van Amsterdam. Op een steenworp afstand van het Centraal Station vind je ons kantoor, in de Beurs van Berlage. Hier werken we met ons team van 30 specialisten aan de Supply Chain Portal. Incore Software heeft een leidende rol in de Supply Chain en is snel aan het groeien. Wij werken voor klanten zoals Bol.com, Jumbo supermarkten, Foot Locker en Suit Supply. Deze klanten ga je helpen om meer inzage te krijgen in hun totale supply chain. Wij halen energie uit het gezamenlijk met de klant oplossen van complexe logistieke problemen, en bieden jou de kans om je snel te ontwikkelen. We zijn een jong en ambitieus team en werken graag op een hoog niveau met elkaar samen, maar er is ook genoeg ruimte voor gezelligheid tijdens en na werktijd. Voor de Coronatijd is het gebruikelijk dat we dagelijks met elkaar lekker uit lunchen gaan, zijn er wekelijkse borrels en organiseren we geregeld een personeelsuitje. Tegenwoordig houden we digitale vrijdagmiddagborrels. Het is een bedrijf waar veel kan en veel mag. Er is veel ruimte voor eigen ontwikkeling en eigen initiatief. Wij geloven in on-the-job training, dus na een korte inwerkperiode zal je al snel werken aan echte projecten. Er zijn genoeg uitdagingen en je krijgt hierbij veel eigen verantwoordelijkheid.Wat worden je werkzaamheden:· Analyseren van de klantvoorwaarden en bedrijfsprocessen· Deelnemen aan en presenteren van ontwerp sessies· Opstellen functioneel ontwerp· Documenteren· Presenteren· Testen van softwareOver welke eigenschappen moet je beschikken?· Je denkt analytisch en probleemoplossend· Je bent secuur, proactief en resultaatgericht· Je bent een team speler maar kan ook goed zelfstandig werken· Je beschikt over goede communicatieve vaardighedenOver welke capaciteiten moet je beschikken?· Je beschikt over een HBO/WO-diploma, bij voorkeur in de richting van logistiek of supply chain management· Werkervaring in een soortgelijke functie is een pré· Je beschikt over een goede kennis van de Nederlandse en Engelse taal· Je hebt affiniteit met IT· Maximaal 3 jaar werkervaringWat bieden we jou?· Werken in een jong en enthousiast bedrijf· Een goed salaris en een netto thuiswerk- of lunchvergoeding· NS Business Card, zodat je volledige reiskosten worden vergoed· Pensioen· De mogelijkheid om thuis te werken· Elke maand een incentive· Na 12 maanden een vast contract· Elke dag vers fruit op kantoor· Regelmatig vrijmibo’s en teamuitjesBen jij de (Junior) Supply Chain Analyst die we zoeken? Herken je jezelf in het bovenstaande profiel en wil je wel eens met eigen ogen zien hoe leuk het is om bij ons te werken? Reageer dan snel met je CV en motivatie!Soort dienstverband: Fulltime, Vaste baanSalaris: €3.000,00 - €3.600,00 per maandRooster:DagdienstFlexibele werkurenma-vrSecundaire arbeidsvoorwaarden:BedrijfsfeestenBedrijfsfitnessExtra vakantiedagenFlexibele werkurenHuisvestingsvergoedingKerstpakketLunchkortingPensioenReiskostenvergoedingVrijdagmiddagborrelWerk vanuit huisSoorten aanvullende vergoedingen:VakantiegeldOpleiding:HBO (Gewenst)Taal:Nederlands (Vereist)Werklocatie: Hybride werken in 1012 Amsterdam",https://media.glassdoor.com/sql/1074089/bouwmaat-squareLogo-1653342529175.png,Bunschoten,€3K - €4K (Employer est.),Bouwmaat3.3 ★
Operations Coordinator,"Wat breng je mee?
Wie ben jij!
Jij vindt het prettig om secuur te werk te gaan. Dat is belangrijk, want deze functie vraagt nauwkeurigheid. Daarnaast maak jij, als onze toekomstige Supply Chain Planner, het verschil doordat jij communicatief vaardig bent en het belang van de klant nooit uit het oog verliest. Worden de afgesproken levertijden niet gehaald? Dan durf jij de leverancier hierop aan te spreken.
Verder vragen wij:
Minimaal mbo+ werk- en denkniveau, bij voorkeur met een afgeronde opleiding in een logistieke richting.
Een aantal jaar relevante werkervaring in soortgelijke functie binnen de retail en/of groothandel.
Je vindt het leuk om in een kantooromgeving te werken.
Goede beheersing van de Nederlandse taal.
Wat krijg je terug?
Wie zijn wij!
Jouw werkplek is bij een van de Beste Werkgevers van 2022-2023. Dat is niet voor niets en daar zijn we dan ook enorm trots op! Wij hebben een zeer afwisselende functie voor je klaarliggen met veel doorgroeimogelijkheden. Als organisatie willen we blijven ontwikkelen en innoveren. Kortom, een gedreven organisatie met een sociale en resultaatgerichte cultuur.
Zo fietsen we op iedere dinsdag een rondje op de racefiets, werken we binnen een fijne werksfeer waar ruimte is voor borrels en wordt er stilgestaan bij jubileums en andere bijzondere momenten. Daarnaast zorgen we ook goed voor onze mensen en bestaat er een reiskostenvergoeding, hebben we een pensioenregeling waar je zelf flexibel kunt sparen en is een deel van je uren thuiswerken geen probleem. Wij stellen de thuiswerkmiddelen ter beschikking voor jou. Persoonlijke groei en verdere ontwikkeling in je (eigen) vakgebied is met ons eigen digitale opleidingshuis altijd beschikbaar.
Met dit alles bieden wij een fulltime bruto salaris tussen de € 2.880,00 en € 3.600,00 per maand met een resultaatafhankelijke bonus die kan oplopen tot 10%. Ben je in een kalenderjaar niet ziek geweest dan krijg je naast de 26 vakantiedagen er nog 3 extra vakantiedagen bovenop. Bovenop dit alles ontvang je ook korting op al onze producten dus kun je thuis aan de slag met onze kwaliteitsproducten.
Het team
Binnen de afdeling werk jij namelijk nauw samen met je directe collega’s. Dit team bestaat, met jou erbij, uit zes personen. Iedereen houdt zich in grote lijnen bezig met dezelfde werkzaamheden. Dat is wel zo handig, want het zorgt ervoor dat jullie – als de situatie hiernaar vraagt – elkaars werk kunnen overnemen. Ook maak jij deel uit van het categorieteam. Dit team bestaat uit collega’s vanuit e-commerce, marketing, inkoop en categorie management. Binnen dit team bepaalt iedereen vanuit zijn of haar expertise hoe wij de beste service kunnen verlenen richting de verschillende Bouwmaat vestigingen.
Wat ga je doen?
Wat ga je doen!
Als Supply Chain Planner vervul jij een belangrijke rol. Jij zorgt er namelijk voor dat de voorraad binnen iedere Bouwmaat vestiging op peil is. Daar komt soms best wat puzzel- en rekenwerk bij kijken, aangezien iedere vestiging uniek is. Waar de ene vestiging baat heeft bij een grote voorraad van een bepaald artikel, kan het zo zijn dat de behoefte van een andere vestiging ergens anders ligt. Via het voorraadplanning systeem Slim4 houd jij niet alleen overzicht, maar weet jij voor iedere vestiging de juiste balans te creëren tussen de voorraad en de beschikbaarheid van producten.
Heb jij alle lopende vraagstukken rondom het voorraadbeheer in kaart gebracht? Dan kun jij je richten op je andere werkzaamheden, zoals het vastleggen van logistieke afspraken met leveranciers. Komen er vragen binnen via de logistieke mailbox en Topdesk? Dan weet jij deze te beantwoorden. Het kan bijvoorbeeld gebeuren dat een geplande voorraad niet bij de juiste vestiging binnenkomt. Aan jou de taak om uit te zoeken hoe dit kan.
Daarnaast heb je als Supply Chain Planner een belangrijke taak bij de ombouw van diverse vestigingen. Jij bent in the lead omtrent de coördinatie en uitvoering van het uitfaseren, 1 op 1 wissels doorvoeren en het infaseren van nieuw assortiment. Hoeveel ruimte is er beschikbaar om voorraden van A naar B te vervoeren? Hoe staat het met de beschikbaarheid van de komende actiekrant? Is het bestel- en leverschema bijgewerkt? Jij hebt het antwoord op deze vragen.

Je bouwt meer op bij Bouwmaat
Bouwmaat is met haar 51 vestigingen door heel Nederland dé groothandel voor vakman in de herstel-, renovatie- en onderhoudsmarkt. Wij staan altijd klaar voor onze klanten zodat ze succesvol kunnen werken. Met kwaliteitsproducten, diensten en professionele kennis. Daarom staat op al onze gevels: Alles voor slimmer bouwen. Dat waarderen onze klanten. Ze komen graag terug. Ook omdat ze de Bouwmaat medewerker professioneel en betrokken vinden. Niet voor niets investeert Bouwmaat veel in de kennis en vaardigheden van zijn medewerkers. De klant en wij: samen maken wij dagelijks het verschil.
Bij Bouwmaat maak je deel uit van een ambitieus en professioneel team en krijg je genoeg ruimte om jezelf te ontwikkelen. Ambitie, betrokkenheid, collegialiteit, transparantie en vakmanschap zijn belangrijke kenmerken van onze organisatie.
Wil je meer weten of heb je vragen? Neem dan gerust contact op met Joke van der Plaat, HR Adviseur. Of stuur een e-mail naar hr@bouwmaat.nl.",https://media.glassdoor.com/sql/4206/samsung-electronics-america-squarelogo-1542763337200.png,Delft,nan,Samsung Electronics3.4 ★
