job_titles,job_description,images,locations,salaries,companies
Marketing & communicatie medewerker,"Wij zijn op zoek naar een Marketing en Communicatie MedewerkerWil jij werken in een maatschappelijk betrokken en uitdagend speelveld. Marketing & communicatie activiteiten uitvoeren voor onze klant: innovatie scale-up, startup, MKB ondernemers? Samenwerken met publieke & private stakeholders? In een kleinschalige, jonge en groeiende organisatie waar ondernemerschap, lef, plezier, bevlogenheid en vertrouwen hoog in het vaandel staan? En waar je veel verantwoordelijkheid en vrijheid krijgt om jezelf te ontplooien en ontwikkelen? Dan is ROM Utrecht Region op zoek naar jou!Je plek binnen de organisatie - ROM Utrecht RegionJe gaat aan de slag in ons bevlogen team Marketing/Communicatie en Intelligence bestaande uit 8 gedreven teamspelers. We doen de marketing voor nieuwe investeringen, internationale handelsmissies, ecosystemen van bedrijven en kennisinstellingen, projecten en natuurlijk van de ROM zelf. Met kennissessies in onze eigen Studio Connect, grote en kleinere live evenementen en ga zo maar door. Geen dag is hetzelfde in ons complementaire team dat werkt op basis van vertrouwen en met veel plezier.Over de ROM Utrecht RegionROM Utrecht Region verbindt ambitieuze, innovatieve ondernemers met kennis, financiering en toegangspoorten tot andere markten in Nederland en in het buitenland. Maar vooral ook met elkaar en met de regio Utrecht. De ROM helpt innovatieve ondernemers door te groeien.Dat doen we doorImpact te maken: De ecosystemen Life Sciences & Health, Earth en Media & Gaming gericht helpen met het aanjagen van innovatie en groei, het binnenhalen van middelen voor innovatie, R&D, economische structuurverandering en maatschappelijke opgaven.Innovatie: Het aanbieden van innovatie- transformatie- en groeiprogramma’s voor startups, scale-ups en innovatief MKB.Investeren: Het verstrekken van kapitaal en fondsen aan ondernemers, vanuit de verschillende stadia waarin zij met hun ontwikkeling zitten.Internationaal: Het aantrekken van buitenlandse bedrijven die zich willen vestigen in de regio Utrecht én het ondersteunen van start ups, scale-ups en het innovatieve MKB met het uitbreiden van hun business in het buitenland.Wat ga je doen?Je ontwikkelt samen met de Marketing en Communicatie Adviseurs vernieuwende communicatieplannen. Je zorgt voor een vlekkeloze uitvoering. Soms betekent dat video’s opnemen in onze eigen studio of het organiseren van bijeenkomsten, dan weer schrijf je een artikel of nieuwsbericht en zorg je voor een rijke contentkalender.Je houdt je onder andere bezig met:Vlotte teksten schrijven voor blogs, mailings en social media;Organiseren van bijeenkomsten, studiosessies, evenementen;Onderhouden websites (Wordpress);Bewaken van het merk en verbeteren van de naamsbekendheid;Ondersteuning van de marcom-collega’s bij advies en uitvoering op het gebied van marketing en communicatie bij de afdelingen;Aangaan en onderhouden van relaties met relevante partners.Hier herken jij jezelf inEen enthousiaste, leergierige & ondernemende hands-on teamplayer die netwerken leuk vindt;Met affiniteit met het begeleiden van startups, scale-ups en innovatieve mkb’ers (internationalisering en digitalisering van het regionale mkb).Een collega met een afgeronde MBO-, of HBO-opleiding, liefst met ervaring in het marketing- en communicatievakgebied;Uitstekende mondelinge en schriftelijke communicatieve vaardigheden (ook Engels);Een allround collega die het gehele speelveld van marketing begrijpt, van events tot campagnes, PR en producties;Strategisch & hands-on: Je bent een denker en een doener;Creatief: voor het bedenken van nieuwe campagnes en content;Flexibel: om in te spelen op veranderende situaties;Organisatietalent: om verschillende projecten tegelijk te beheren;Doortastendheid: om snel beslissingen te kunnen nemen.Dit bieden wijEen kleinschalige, diverse & inclusieve organisatie waarin we werken op basis van vertrouwen en verantwoordelijkheid en mandaat laag zijn belegd en waar jij als persoon er echt toe doet!Een ambitieus en zelfstandig team in een creatieve omgeving waar geen idee te gek is!Een plek waar je veel vrijheid & verantwoordelijkheid krijgt om je talent te ontplooien;Een sociaal en maatschappelijk betrokken speelveld;Een open cultuur waar ondernemerschap, lef, plezier, bevlogenheid en vertrouwen hoog in het vaandel staan en waar regelmatig leuke teambuilding activiteiten worden georganiseerd;Thuiswerken en op kantoor, het kan allebei;Elke dag ontwikkelen hoort erbij en stimuleren wij op diverse wijze;Een jaarcontract met goede arbeidsvoorwaarden zoals een eindejaarsuitkering, een goede pensioenregeling bij ABP, oog voor een goede werk/privé balans door onze 36 uurs werkweek en mogelijkheid tot hybride werken, 27 vakantiedagen per jaar op basis van een volledig dienstverband en mogelijkheid tot bijkopen, en een mooi persoonlijk ontwikkelbudget;ROM Utrecht Region heeft een eigen arbeidsvoorwaardenpakket. Voor onze salarisschalen gebruiken wij de methodiek van CAO Rijk. Het fulltime salaris voor deze functie bedraagt € 42.107,- tot max. € 49.124,- per jaar (afhankelijk van je ervaring), inclusief vakantiegeld en eindejaarsuitkering.Stuur jouw bevlogen motivatie naar ons toe via de sollicitatiebutton vóór 12 juni 2023Ben je enthousiast en herken je jezelf in bovenstaand profiel? Solliciteer dan direct online! Wij nemen dan contact met jou op en gaan verder kennismaken bij voldoende aanknopingspunten. Daarna ontvang je van ons een mooi aanbod, dat je hopelijk niet kan afwijzen.Heb je inhoudelijke vragen, neem dan contact op met Rob van Beek (06-22971844). Voor vragen over het sollicitatieproces kun je terecht Keltoum Titsuit van de afdeling HR (06-12075537).Acquisitie naar aanleiding van deze advertentie wordt niet op prijs gesteld.Soort dienstverband: Fulltime, ParttimeParttime uren: 32-36 per weekSalaris: €3.000,00 - €3.500,00 per maandRooster:Dagdienstma-vrSecundaire arbeidsvoorwaarden:Dienstreizen vergoedingPensioenReiskostenvergoedingWerk vanuit huisSoorten aanvullende vergoedingen:13e maandVakantiegeldWerklocatie: Hybride werken in 3584 BL Utrecht",https://media.glassdoor.com/sql/3290517/kees-de-boekhouder-squarelogo-1641984669494.png,Rotterdam,nan,Kees de Boekhouder1.9 ★
Stage Digital marketing,"Marketing & communicatie medewerker
In short
Verantwoordelijk voor het realiseren van marketingcommunicatie projecten en uitingen
In short
Verantwoordelijk voor het realiseren van marketingcommunicatie projecten en uitingen
4/5-daagse werkweek32/40 uur per week up and running
Unieke locatieHartje Amsterdam
Ruimte voor ontwikkelingTijd en budget om jezelf te ontwikkelen
Remote werkenDe mogelijkheid om 2 weken per jaar remote (vanuit het buitenland) te werken
Sport & yogaEen wekelijkse sportles bij een sportschool in de buurt en een yogalesje op kantoor zelf
LunchEen dagelijks verzorgde kantoorlunch
Kees de Boekhouder is een jong en snelgroeiend bedrijf dat een totaaloplossing biedt voor de administratieve uitdagingen waar zzp’ers en kleine ondernemers mee te maken krijgen. Dit doen we met een unieke combinatie van zelf ontwikkelde software en de service van een persoonlijke boekhouder. We geloven sterk in team effort en een solide, open cultuur.

Wie zoeken we?
We zoeken een creatieve en gedreven collega met ongeveer 2 jaar werkervaring (meer mag ook of course), uitstekende communicatieve en organisatorische skills en een sterk gevoel voor digitale communicatie.

Je houdt van schrijven, je weet hoe communicatie werkt en je loopt over van de inspirerende ideeën. Je bent van nature nieuwsgierig en kritisch en kan goed samenwerken.

Je bent onderdeel van het marketingteam en ondersteunt de Marketing Manager. Je hebt ervaring in het succesvol begeleiden van interne en externe communicatieprojecten. Een hands-on en leergierige houding is van belang. Je opleidingsniveau is minimaal HBO.

Ervaring in onze branche is niet nodig. Maar het is in deze functie wel belangrijk om een goed idee te hebben van de wereld van de zzp’er en de kleine ondernemer en je vindt het leuk om je in deze doelgroep in te leven.
Profiel

– 2 jaar relevante werkervaring in communicatie en/of digitale marketing.
– Minimaal 32 uur beschikbaar.
– Je houdt van samenwerken, planning en organisatie.
– Communicatief sterk.
– Gestructureerd en stressbestendig.
– Flexibel en oplossingsgericht.
– Je schrijft uitstekend in het Nederlands.
– HBO/WO werk- en denkniveau.

Wat ga je doen?
Je bent verantwoordelijk voor het realiseren van succesvolle marketingcommunicatie projecten en communicatie uitingen. Zoals social media content, blogs, video’s, events, nieuwsbrieven, sponsoring en brochures.

In het kort:

Meedenken en uitvoeren van marketing en communicatieprojecten.
Je creëert social media content icm het marketingbureau.
Begeleidt interne communicatieprojecten zoals artikelen op ons blog.
Je schrijft en redigeert teksten.
Je denkt mee over diverse vraagstukken en werkt samen met collega’s van verschillende afdelingen, freelance communicatiespecialisten en -ons marketingbureau.
Ontwikkelen en coördineren sponsoractiviteiten.
Je bent verantwoordelijk voor het aandragen van verbeteringen in de gehele klantreis. En waar nodig coördineer je communicatie projecten of voer je deze zelf uit.
Je voert marktonderzoek uit of laat deze uitvoeren om de wensen van de klanten te begrijpen en om onderbouwde keuzes te maken en uit te proberen.
Office Culture

Kees de Boekhouder bestaat uit een team boekhouders, fiscaal medewerkers, marketeers, een IT & HR afdeling. We werken vanuit verschillende locaties: ons eigen pand in hartje Amsterdam, een industrieel gedeeld kantoor in Rotterdam en een frisse ruimte in het centrum van Utrecht. We zetten ons in voor creatieve ondernemers en hun business en streven ernaar de beste te zijn in wat we doen. Je werkt nauw samen met je collega’s, maar ieder kent zijn of haar verantwoordelijkheid. We hechten veel waarde aan de ontspannen sfeer op kantoor. Ieder kwartaal sluiten we gezamenlijk af met een gezellige kwartaalborrel. Daarnaast hebben we twee keer per jaar een groot evenement voor alle werknemers.
Sounds good?
We horen graag van je!
Vul het formulier in of stuur een mail naar emilie@keesdeboekhouder.nl met
een korte motivatie en je CV.",https://media.glassdoor.com/sql/2552815/volkswagen-pon-financial-services-squarelogo-1666767492592.png,Amersfoort,nan,Volkswagen Pon Financial Services3.1 ★
Communicatiemedewerker,"Amersfoort
HBO
Stages
Ben je op zoek naar een leerzame stage in Amersfoort om jouw kennis van het vak Digital Marketing in de praktijk te kunnen toepassen en wil je zoveel mogelijk van het vak ontdekken binnen een dynamische organisatie? Per september zijn wij op zoek naar een digital marketing stagiair!
Volkswagen Pon Financial Services biedt jou een stage met een breed scala aan taken en krijg je de gelegenheid om te ontdekken en te doen wat jij interessant en leuk vindt. Samen met ervaren online marketeers denk jij na over verbeteringen en help je om onze websites en social media up-to-date te houden.
Wat ga je tijdens de Digital Marketing stage doen?
Op de afdeling Business Development & Management ga jij de online marketeers en digital marketing managers ondersteunen met diverse taken. Je gaat content schrijven met het doel de branding van onze producten te verbeteren. Je bewaakt onze huisstijl en voert in samenwerking met je collega’s verbeteringen door. Een aantal taken zullen zijn:
Werken aan de sprints om de websites en social media kanalen te verbeteren en bij te werken, je schrijft content, maakt social media post’s en neemt deel aan meetings en vergaderingen.
Optimaliseren van de lease websites: nieuwe modellen toevoegen, het wijzigen van de autospecificaties, opties en prijzen.
Social accounts controleren en bijwerken en (potentiele) klanten benaderen en informatie verstrekken.
Daarnaast wordt er op de afdeling gewerkt met scrum. Op het scrumbord staan de taken die het team de komende twee weken gaat doen, hier ben jij vrij om alle taken die jij leuk vindt op je te pakken.
Wie zoeken wij voor de digital marketing stage?
Je bent een tweede- of derdejaars HBO student en studeert in de richting van digital studies. Je bent op zoek naar een meewerkstage en je wilt het vak van digital marketing in de volle breedte leren kennen. Je bent leergierig, weet van aanpakken en je hebt kennis op het gebied van CMS en social media. Communicatief ben je sterk, zowel in woord als in geschrift.
Vanuit jouw opleiding heb je een basis meegekregen en wij geloven dat je daarmee voldoende in huis hebt om met ons team mee te draaien. Je bent per september minimaal 20 weken beschikbaar om 32 tot 40 uur per week stage te lopen.
Wat krijg je daarvoor terug?
Jij gaat werkervaring opdoen op een digital marketing afdeling en je gaat veel leren van ervaren marketeers. Je ontvangt een stagevergoeding van € 600,- op basis van 40 uur en daarbij wordt ook (een deel van) jouw reiskosten vergoed. Voor het uitvoeren van jouw werkzaamheden krijg je van ons een laptop in bruikleen. Je doet werkervaring op en vormt daarmee een beeld van de verschillende werkzaamheden binnen het digital/online vak. Een uitstekende basis voor de rest van jouw loopbaan!
Waar ga je digital marketing stage lopen?
In 2025 marktleider zijn in zero emission mobility; dat is onze ambitie. Als joint venture van Volkswagen Financial Services AG en Pon Holdings bestrijken wij de gehele keten van financieren, verzekeren en leasen voor autodealers, wagenparkbeheerders, midden- en klein bedrijf en particulieren. Daarbij leggen wij een focus op zero emission oplossingen. Onze cultuur is te typeren als professioneel, resultaatgericht en informeel. De organisatie in Amersfoort is vol in beweging en werkt met collega's die continue werken aan verbetering van dienstverlening.
Daar krijgen we energie van en zijn wij trots op! In 2022 zijn wij gecertificeerd als Great Place to Work. Wil je alvast een beeld krijgen van waar je gaat werken? Bekijk ook eens onze werken bij VWPFS en DFM film!
Kijk jij ernaar uit om tijdens je stage: digital marketing veel te leren in een professionele werkomgeving? Solliciteer dan direct!",nan,The Hague,€3K (Employer est.),Stimuleringsfonds voor de Journalistiek
Marketing- & communicatieprofessional,"Het Stimuleringsfonds voor de Journalistiek is op zoek naar een Communicatiemedewerker (32 – 36 uur). Reageren voor 26 mei.Ben jij een creatieve en resultaatgerichte communicatiemedewerker met een passie voor journalistiek? Zoek je een uitdagende functie waarin je je talenten kunt inzetten om de journalistiek te versterken? Dan is het Stimuleringsfonds voor de Journalistiek op zoek naar jou!Als communicatiemedewerker bij het Stimuleringsfonds voor de Journalistiek draag je bij aan de uitvoering van onze communicatiestrategie. Je bent verantwoordelijk voor het bedenken, schrijven en verspreiden van pakkende content op onze website, sociale media en nieuwsbrief. Je hebt een vlotte pen en weet hoe je onze doelgroepen kunt bereiken en enthousiasmeren.Omdat we nu en in de toekomst onze werkzaamheden uitbreiden willen we het team Communicatie vergroten. Daarom zijn we per direct op zoek naar een nieuwe collega. Startdatum is in overleg.TaakomschrijvingAls communicatiemedewerker werk je onder leiding van de Communicatieadviseur. Samen vormen jullie het team Communicatie. Dit team is verantwoordelijk voor alle (marketing)communicatie van SVDJ. Jullie zorgen ervoor dat o.a. de subsidieprogramma’s, events en nieuwsartikelen van SVDJ onder de aandacht worden gebracht bij journalisten, uitgevers en andere mediamakers. Denk aan het opstellen van communicatieplannen, schrijven van persberichten, beheren van de socials, bewaken van de huisstijl, bedenken en creëren van creatieve communicatie-uitingen en het vergroten van de zichtbaarheid van SVDJ.Het werk van de communicatiemedewerker is voornamelijk uitvoerend van aard, tot de werkzaamheden behoren onder andere:Beheren van de social kanalen van SVDJ; bedenken en publiceren van creatieve content;Contentplanning maken voor de socials;Schrijven en publiceren van teksten voor svdj.nl;Opstellen van nieuwsbrieven;(op)maken van divers promotiemateriaal zoals posters, video’s, socialposts, banners, whitepapers, presentaties en webpagina’s.ProfielVoor deze functie zoeken we iemand met een creatieve geest, die snel kan schakelen en goed overzicht kan bewaren.Daarnaast zijn de functie-eisen:MBO+/HBO werk- en denkniveau. Een afgeronde opleiding in de richting van marketing/communicatie is een pré;Uitstekende communicatieve vaardigheden in zowel Nederlands als Engels;Je hebt een vlotte pen en schrijft creatieve (marketing)teksten;Je bent in staat om ingewikkelde boodschappen om te zetten in heldere teksten;Je kunt goed uit de voeten met het beheren van social media-kanalen;Je hebt creatieve ideeën om binnen de huisstijl van SVDJ verschillende uitingen te ontwerpen;Je hebt oog voor detail.Kandidaten met de volgende ervaring genieten de voorkeur:Ervaring met Photoshop, InDesign, Illustrator en Premiere Pro of andere foto/video; bewerkingsprogramma’s;Ervaring met Canva, Hootsuite, WordPress, Mailchimp en Linkedin Business Manager;Ervaring met Google Analytics (4), Tag Manager en SEO;Kennis van en affiniteit met de journalistieke sector.Wij biedenDe functie van Communicatiemedewerker is een tijdelijke aanstelling voor 32 – 36 uur per week voor één jaar, met een proeftijd van één maand.Salaris en arbeidsvoorwaarden zijn conform de CAO RIJK. Het salaris bedraagt, afhankelijk van opleiding en ervaring, minimaal € 2.557,07 en maximaal € 3.477,56 bruto per maand bij een 36-urige werkweek. Je ontvangt naast je salaris een IKB (Individueel Keuze Budget). Het IKB bestaat uit geld en tijd, hiermee kun je een deel van je arbeidsvoorwaarden zelf samenstellen.We bieden je een afwisselende baan met veel ruimte voor eigen invulling en creativiteit. Je komt te werken in een jong en enthousiast team. Je kunt werken vanuit ons kantoor in Den Haag, maar thuis/hybride werken is ook helemaal prima.SolliciterenHerken jij je in dit profiel, mail dan je motivatie (in een vorm naar keuze) en CV naar vacature@svdj.nl o.v.v: “Vacature Communicatiemedewerker” vóór 26 mei. Eerste gesprekken zullen plaatsvinden in de week van 30 mei tot 2 juni.Heb je nog vragen over de functie dan kun je contact opnemen met Mariët Medendorp (Communicatieadviseur) via vacature@svdj.nl of 070-3617111.Over SVDJAls Stimuleringsfonds voor de Journalistiek dragen we bij aan het versterken van de journalistieke infrastructuur in Nederland. Wij richten ons hierbij op organisatieontwikkeling, vernieuwing en verdieping van organisaties. Daarnaast zoeken we doorlopend naar nieuwe terreinen om met impact de journalistieke infrastructuur te versterken. Onze activiteiten bestaan uit een wisselwerking tussen kennisdeling, begeleiding en subsidie.Denk daarbij aan het organiseren van kennisdelingsevenementen, het opzetten van subsidieprogramma’s voor de ontwikkeling van de onderzoeksjournalistiek of innovatie en het (laten) uitvoeren van onderzoek. Daarnaast delen we via onze website svdj.nl nieuws over ontwikkelingen in de journalistieke sector.De afgelopen jaren zijn we als organisatie gegroeid van een meer traditionele subsidieverstrekker naar sparringpartner en een centrum van kennisdeling en innovatie. Het Stimuleringsfonds ontvangt als zelfstandig bestuursorgaan (ZBO) jaarlijks een bijdrage van het ministerie van Onderwijs, Cultuur en Wetenschap, waaruit alle activiteiten worden gefinancierd, overeenkomstig de Mediawet.Acquisitie n.a.v. deze vacature wordt niet op prijs gesteld.Soort dienstverband: Fulltime, Parttime, Contract bepaalde tijdContractduur 12 maandenParttime uren: 32 - 36 per weekSalaris: €2.557,00 - €3.477,00 per maandRooster:Flexibele werkurenma-vrSecundaire arbeidsvoorwaarden:Budget voor professionele ontwikkelingFietsplanFlexibele werkurenKerstpakketKosteloos parkerenPensioenReiskostenvergoedingTelefoonplanWerk vanuit huisSoorten aanvullende vergoedingen:13e maandVakantiegeldWerklocatie: Hybride werken in 2514 AD 's-GravenhageDeadline sollicitaties: 26-05-2023",https://media.glassdoor.com/sql/2957410/4dotnet-squarelogo-1638428216298.png,Nieuwegein,nan,4DotNet4.0 ★
Internship in Communication & Event Management - Schwarzkopf Professional - Dutch Speaker ‏ (m/f/x),"Creëer jij de ideale mix tussen uitdenken en doen? Heb je oog voor branding en interne- en externe communicatie? En voel je je helemaal thuis in het coördineren van geplande activiteiten? Dan zoeken wij jou!

Ter uitbreiding van onze marketing & communicatie afdeling zijn wij op zoek naar een nieuwe collega! De rol als Marketing & Communicatieprofessional betreft een functie voor 32 – 40 uur per week met werklocatie Meppel.

Wat ga je doen?

In de rol als Marketing & Communicatieprofessional houd je je bezig met het uitzetten van de juiste lijntjes, het uitwerken en uitvoeren van geplande activiteiten en het coördineren van deze activiteiten. In het kort:

Het realiseren van interne communicatieacties zoals nieuwsbrieven, intranet voorzieningen, onboardingcampagnes, interne feestjes en etentjes;
Het ontwikkelen van (online) content zoals landingspagina’s, nieuwsbrieven, social media posts;
Het organiseren van interviews en videoproducties;
Het uitdenken, voorbereiden en uitvoeren van onze evenementen en beursdeelnames;
Het – omnichannel – opzetten en uitvoeren van communicatiecampagnes;
Het bewaken en ontwikkelen van de huisstijl en het bedenken en samenstellen van diverse vormen van printuitingen zoals brochures, goodies en andere huisstijldragers.

Naast bovengenoemde werkzaamheden speelt bij ons persoonlijke- en professionele ontwikkeling een belangrijke rol. Je krijgt bij ons dan ook ‘de vrije hand’ en ruimte voor het volgen van bijvoorbeeld trainingen, seminars of webinars.

4Dotnet en het team

Je komt terecht in een informele organisatie, waar je samen met Angela en Simone een team vormt op de afdeling marketing & communicatie. 4Dotnet is topspeler in de software development markt en ons team van Microsoft .NET specialisten staat hierin centraal. Veranderingen in onze markt gaan razendsnel, dus er is altijd wat nieuws te leren en veel ruimte voor wilde ideeën en innovatie.

Naast jouw collega’s op de afdeling marketing & communicatie ga je de samenwerking aan met de verschillende salesteams en externe partijen zoals de RAI, Jaarsbeurs en Pathé, maar ook rechtstreeks met Microsoft en Google.

Ons aanbod aan jou
Een brede, uitdagende functie met veel vrijheid en eigen inbreng;
Een fantastisch team met geweldige collega’s in een superleuke omgeving;
Een platte organisatie met open cultuur en korte lijntjes;
Een goed salaris met secundaire arbeidsvoorwaarden;
Een ruim aanbod met mogelijkheden tot het volgen van trainingen, seminars of webinars.
Wat breng je mee

Je bent minimaal in het bezit van een relevante MBO- of HBO opleiding. Je Nederlands is uitstekend. Je bent creatief, resultaatgericht en praktisch ingesteld. Je weet jouw ideeën en kennis om te zetten in iets tastbaars. Je plant je eigen werk goed en beschikt over organisatorische vaardigheden.

Verder is het hebben van een duidelijke mening over opmaak en vorming gewenst en heb je kennis en (basis)vaardigheid (dit is een pré) van:

Tools zoals Google Analytics;
SEO;
Photoshop of InDesign.
Klaar om een krachtige impuls te geven aan jouw carrière?

Solliciteer dan direct!",https://media.glassdoor.com/sql/3217/henkel-squareLogo-1645620067576.png,Werkendam,nan,Henkel4.3 ★
