job_titles,job_description,images,locations,salaries,companies
Stage bij de Academie voor Internationale Betrekkingen,"HET KLOPT, WE ZIJN OP ZOEK NAAR DÉ DOCENT BEWEGINGSONDERWIJS! (0,8 - 1,0 wtf)

Wij, het Briant College, dagen onze leerlingen uit om verantwoordelijkheid te nemen voor hun talentontwikkeling. We leren levensvaardigheden aan voor het leven, zodat ze goed voorbereid zijn op een plek in de maatschappij. Daarnaast coachen we leerlingen in hun eigen traject bij het behalen van persoonlijke doelen.

Al enkele jaren staat Gepersonaliseerd Leren binnen onze school centraal. We zitten middenin in een ontwikkeling naar een netwerkschool met een nieuwe onderwijsinrichting en een cultuur waarin Active Leadership In School (ALIS) de basis is van onze communicatie en handelen. Verder staat onze school midden in de maatschappij en is de maatschappij binnen de school. Active Leadership is een bewuste proactieve leiderschapsstijl voor leerlingen, ouders en collega’s. Het draagt bij voor mede-regisseurschap en nemen van eigen verantwoordelijkheid voor persoonlijke doelen.

Word jij onze nieuwe collega?
Dan zit expertise en enthousiasme voor het vak in je genen. Iemand die onderzoekt wat iedere leerling nodig heeft om het maximale uit zichzelf te halen en erin slaagt om maatwerk te geven. Je hebt oog voor de leerling, zijn/haar talenten en weet een relatie op te bouwen. Je bent altijd op zoek naar het juiste pedagogische klimaat en wisselt deze inzichten uit met collega’s. Zo worden we samen beter en verzilveren we kansen om leerlingen te laten ontwikkelen.

Je bent iemand die het leuk vindt om mee te werken aan een toekomstige netwerkschool en die zich bovenal herkent in en past binnen onze visie! Voel je het enthousiasme als je dit leest? Dan zoeken we jou! Check dus snel onderstaande punten en oordeel zelf: is er een match of niet?

Je krijgt voldoening als

Er een cultuur heerst van rust waarin we onze leerlingen in een veilige en open setting kunnen begeleiden op de weg naar zelfstandigheid;
Je Active Leadership In School (ALIS) kan toepassen om op deze manier onze leerlingen te helpen in hun sociaal-emotionele ontwikkeling;
Je talenten en uitdagingen ziet als ontwikkeling, niet als een belemmering;
Je in staat bent om verder te kijken dan het ongewenste gedrag en dit kan ombuigen in een (hulp)vraag;
Je zowel de-escalerend als oplossingsgericht kan werken;
Je mee mag meedenken en meewerken aan een nieuwe onderwijsinrichting;
Er waardering is voor jouw inbreng over drijfveren, doelen en manieren om onze ambitieuze toekomst waar te maken.

Wat breng je mee?

Je hebt een 1e graads lesbevoegdheid in bewegingsonderwijs (ALO-diploma) of je zit in de afrondende fase van deze opleiding;
Je hebt een netwerk in de sportwereld;
Je hebt een gezonde dosis initiatief om samen met je collega kartrekker te zijn in het organiseren van lesaanvullende (buitenschoolse) activiteiten;
Je staat stevig in je schoenen en hebt een rugzak vol met (vooral) pedagogische bagage en relativeringsvermogen;
Je bent in staat je de ALIS-visie eigen te maken en mede daarmee onze leerlingen te helpen ontwikkelen;
Je hebt zichtbaar plezier in werken met jongeren bij het wie het leren niet vanzelf gaat en je elke keer eerst gaat voor connectie en dan voor correctie;
Je bent zelfstandig, proactief, flexibel, oplossingsgericht, durft te experimenteren en je bent bovenal bereid om steeds mee te blijven groeien met onze ambitie;
Je bent een leuke persoonlijkheid met een positieve inslag en een goed gevoel voor humor;
Je bent 0,8 - 1,0 wtf beschikbaar.

Wat bieden we jou?
Onze collega’s ontvangen je met open armen en werken graag met je samen. Bovendien krijg je alle ruimte om verder te leren: we bieden ontwikkelmogelijkheden en opleidingsprogramma’s, zowel inhoudelijk als verbredend. Maar let wel! Jij bent de regisseur van je eigen loopbaan. Onze passie is groot en we kunnen natuurlijk veel over ons vertellen maar beelden zeggen meer dan woorden, dus check snel ons YouTubekanaal of onze website als je inhoudelijk meer van ons wilt weten. Verder zijn we ook actief op sociale media.

Stap je aan boord? Dan bieden we je een salaris in de schaal LB of LC (afhankelijk van je opleiding en ervaring) volgens cao po. Je begint met een jaarcontract dat we omzetten in een vast contract als de samenwerking goed bevalt.

Hoe kan je solliciteren?
Zie jij jezelf bij ons werken? Dan verras je ons met je sollicitatiebrief en CV. Je sollicitatie dient uiterlijk binnen te zijn vóór woensdag 14 juni 2023. Je kunt solliciteren door op de sollicitatiebutton te klikken. Sollicitaties die rechtstreeks via de email verstuurd worden, worden niet door ons in behandeling genomen! Dus wil je bij ons werken? Solliciteer via de button!

Daarnaast vinden we sollicitatiegesprekken handig, maar we ontmoeten graag eerst de persoon achter het CV. Om deze reden plannen wij eerst een informele sessie op vrijdag 16 juni 2023 van 09:00 – 13:00 uur. Ben je hierbij, dan ontvang je van ons een aparte uitnodiging op woensdag 14 juni 2023. Wat we op deze informele sessie van jou verwachten is dat je geheel onvoorbereid, maar vooral als jezelf langskomt zodat we elkaar eerst leren kennen. Wij zorgen voor de inwendige mens.

Heb je naar aanleiding hiervan nog vragen dan mag je ons altijd bellen. Harald Hentenaar beantwoordt ze graag en is bereikbaar via 026 – 384 03 00.",https://media.glassdoor.com/sql/499588/ministry-of-foreign-affairs-netherlands-squarelogo-1426658895211.png,The Hague,nan,Ministerie van Buitenlandse Zaken4.4 ★
Taal- en cultuurspecialist Chinees,"Stage lopen bij de Academie voor Internationale Betrekkingen is een unieke en leerzame ervaring, in het hart van de Nederlandse diplomatie. Je houdt je bezig met het organiseren van actualiteitslezingen over internationale gebeurtenissen en vraagstukken die het nieuws halen, krijgt de mogelijkheid een mooi netwerk op te bouwen, van dichtbij te ervaren hoe het beleid bij het ministerie tot stand komt en in uitvoering wordt gebracht. De Academie voor Internationale Betrekkingen houdt zich bezig met leren en ontwikkelen en organiseert diverse leeractiviteiten voor medewerkers van het Ministerie van Buitenlandse Zaken en voor Rijksambtenaren met een internationale functie.


Ben jij een enthousiaste teamspeler met een ‘can do’-mentaliteit? Ben je ‘hands-on’, leergierig, communicatief, flexibel, combineer je denken en doen, en heb je oog voor zowel de inhoud als voor het resultaat? Solliciteer dan naar onze stageplaats.

De Academie voor Internationale Betrekkingen van het Ministerie van Buitenlandse Zaken is op zoek naar een stagiair(e) voor de periode 19 juni 2023 t/m 19 december 2023. Het betreft een stage van 40 uur per week met een duur van 6 maanden.

Als stagiair(e) heb je verschillende taken:

Je werkt aan een leeropdracht die betrekking heeft op het borgen van de kennis rondom opzet en organisatie van lezingen.
Je legt een koppeling tussen de lezingen en andere leeractiviteiten, en zorgt voor aansluiting met het overige bestaande leeraanbod van de academie en stemt dit af binnen het team van leeradviseurs.
Je werkt aan de opzet en organisatie van lezingen, denkt mee over thema’s voor lezingen, legt contacten met de relevante gastsprekers.
Je volgt internationale actualiteiten in de media en kunt daar verbindingen mee leggen voor de inhoud van een lezing of leeractiviteit.
Je doet suggesties en verzorgt samen met de communicatieadviseur de communicatie over de lezingen binnen het ministerie, richting de ambassades en via social media (LinkedIn).
Je assisteert bij de organisatie van voorbereidingsoverleggen, de (online of fysieke) lezingen.
Je ondersteunt ook andere collega’s van het team bij de dagelijkse werkzaamheden van leeractiviteiten.
De specifieke opdracht wordt aan het begin van de stageperiode in overleg met jou geformuleerd.
Functie-eisen

Wij zoeken een enthousiaste teamspeler die een zelfstandige, flexibele en proactieve werkhouding heeft. Verder voldoe je als toekomstig stagiair(e) aan het volgende profiel:

Je staat gedurende de gehele stageperiode als student ingeschreven aan een Nederlandse onderwijsinstelling. Of je bezit de Nederlandse nationaliteit en staat ingeschreven aan een erkende buitenlandse onderwijsinstelling en bent derdejaars bachelor- of masterstudent aan een WO-instelling.
Een studie op het gebied van Internationale Betrekkingen, Geschiedenis, Bestuurskunde of Onderwijskunde is een pre.
Je hebt een goede beheersing van zowel Engels als Nederlands in woord en geschrift, en goede communicatieve vaardigheden. Beheersing van een andere taal is een pré.
Je vindt het leuk om aan de slag te gaan met zowel inhoudelijke vraagstukken als opdrachten van organisatorische aard.
Aantoonbare achtergrondkennis van en ervaring/affiniteit met het organiseren van (online/fysieke) activiteiten/lezingen is een voordeel.
Je hebt niet eerder stage gelopen bij het ministerie van Buitenlandse Zaken.
Arbeidsvoorwaarden
Dienstverband
Afstudeerstage / scriptie
Maximaal aantal uren per week
40
Bijzonderheden
Wij vragen je te solliciteren via de button ‘Solliciteren’.
De selectieprocedure omvat de briefselectie en een selectiegesprek. De selectiegesprekken vinden plaats tussen 24 en 31 mei 2023. Er zal 1 kandidaat geworven worden.

Wat bieden wij
Tijdens de stageperiode word je begeleid door ervaren adviseurs van de academie, en werk je samen met collega’s van andere beleidsdirecties binnen BZ, op onze ambassades wereldwijd, met verschillende andere ministeries en externe partijen. Aan het begin van de stage wordt een startgesprek gepland zodat jouw leerwensen en interesses een plek krijgen in je takenpakket. Verder heb je regelmatige voortgangsgesprekken met je stagebegeleider. De stage is echt bedoeld voor het opdoen van praktijkervaring en betreft geen tijdelijk werk. Aan het einde van je stage heb je niet alleen inhoudelijke ervaring opgedaan op gebied van leren en ontwikkelen, je hebt ook een breed scala aan vaardigheden ontwikkeld en een nieuw en divers netwerk opgebouwd. Ook heb je beter inzicht gekregen in het vak diplomatie en het Nederlandse buitenlandbeleid.

Leeropdracht
Een leeropdracht die betrekking heeft op het bundelen van leeractiviteiten, vastleggen/borgen van alle kennis die jij hebt van alle activiteiten/netwerken rondom lezingen. De specifieke opdracht wordt aan het begin van de stageperiode in overleg met de stagiair(e) geformuleerd

Voorwaarden en vergoedingen
Algemene voorwaarden en vergoedingen kan je vinden op deze site.

Ministerie van Buitenlandse Zaken

Je komt te werken voor een energiek, leuk en gedreven team van ongeveer 20 collega’s met verwante expertises. De Academie voor Internationale Betrekkingen is in 2015 opgezet door het ministerie van Buitenlandse Zaken en is afdeling van de hoofddirectie Personeel en Organisatie (HDPO). De academie houdt zich bezig met wat nodig is om de medewerkers van BZ, wereldwijd, toe te rusten op hun taak en draagt bij aan een lerende organisatie. De academie is voor BZ de aanbieder van leeractiviteiten en lezingen over de buitenlandse actualiteit, biedt een platform om kennis te verbinden en is het leerkompas voor het ministerie van Buitenlandse Zaken. Het aanbod van de academie op de internationale functie is rijksbreed toegankelijk. Inhoudelijk ontwikkelt de academie samen met de lijn het aanbod voor een breed scala aan onderwerpen zoals Europese samenwerking, Internationale samenwerking, Economische Diplomatie, Vrede en Veiligheid, en Diplomatieke Vaardigheden. Gezien de internationale context van het werk bij het ministerie is er in de werkwijze veel aandacht voor het leren op afstand (online leren, webinars, blended leermethodes) en leeraanbod in het Engels.

Het Ministerie van Buitenlandse Zaken is de spil in de communicatie tussen de Nederlandse regering en de regeringen van andere landen én tussen de Nederlandse regering en internationale organisaties. Het ministerie coördineert het buitenlands beleid van de Nederlandse regering, inclusief de ontwikkelingssamenwerking, en voert dit uit. Naast het departement in Den Haag opereert het ministerie vanuit ambassades, permanente vertegenwoordigingen en consulaten-generaal, verspreid over de hele wereld.

Diversiteit en Inclusie

Het Ministerie van Buitenlandse Zaken voert een actief diversiteitsbeleid en zet in op een inclusieve organisatie. We doen dit door de verschillen van mensen optimaal in te zetten en te benutten. En door een werkcultuur te scheppen waar iedereen zichzelf kan zijn en zich gewaardeerd voelt. We streven bij de samenstelling van teams en bij de aanname van nieuw talent naar diversiteit in, onder meer, leeftijd, gender(identiteit), cultuur, religie, achtergrond, geaardheid, (arbeids)beperking, kennis en competenties.",https://media.glassdoor.com/sql/4775572/algemene-inlichtingen-en-veiligheidsdienst-squarelogo-1643347946752.png,Zoetermeer,nan,AIVD
Meewerkstage Media Vormgever/Creative Designer - Marketing Team,"Vind je het leuk om bezig te zijn met taal, en het Mandarijn in het bijzonder? Beheers jij het Mandarijn en eventueel verschillende Chinese dialecten? Heb je kennis van de Chinese cultuur en blijf je graag op de hoogte van de Chinese actualiteit? Dan is deze unieke en interessante baan bij de AIVD echt iets voor jou.

Wat ga je doen?
Je gaat de Nederlandse democratie beschermen tegen nationale en internationale dreigingen. Om dat goed te kunnen doen, mag de AIVD deze dreigingen binnen de kaders van de Wiv 2017 onderkennen en interpreteren, waar ter wereld ze ook vandaan komen. Daarom verzamelen onze inlichtingenteams informatie uit audioberichten, digitale data, beelden en documenten uit open bronnen – waaronder sociale media – of uit bijzondere inlichtingenmiddelen, zoals hacks en tapgesprekken.

Uit de gegevens in gesproken, schriftelijke en visuele vorm die dit oplevert, haal jij de kern en vertaal je deze naar het Nederlands. Je maakt samenvattingen en plaatst relevante informatie in de juiste culturele en politieke context. Je weet informatie uit verschillende bronnen met elkaar in verband te brengen door jouw goede geheugen, opgebouwde kennis en analytisch vermogen. Verder ben je in staat om kansen te ontdekken die het teamonderzoek verder kunnen helpen en denk je mee over de richting van de onderzoeken.

Met jouw kennis van de taal en de Chinese politieke, maatschappelijke en culturele context kun je conclusies en bevindingen snel in het juiste perspectief plaatsen. Dit is van grote toegevoegde waarde voor jou én jouw collega’s, bestaande uit onderzoekers, analisten en documentalisten. Geen makkelijk werk, maar wel een unieke, interessante en uitdagende baan, in het hart van politiek en samenleving, waarbij je elke dag bijdraagt aan de bescherming van Nederlandse belangen.

Wat krijg je terug?
Een functie waarvan het maatschappelijk belang buiten kijf staat en waarbij je met gelijkgestemde, toegewijde en gemotiveerde collega’s werkt aan onderwerpen die je nergens anders tegenkomt. De opleidings- en ontwikkelmogelijkheden zijn bij ons meer dan uitstekend en we stimuleren je om daar zoveel mogelijk gebruik van te maken. Goed voor jouw ontwikkeling, maar ook goed voor de veiligheid van Nederland.

Is je nieuwsgierigheid gewekt? Solliciteer dan op de functie van taal- en cultuurspecialist Chinees!

Op onze site Werken bij de AIVD.nl tref je het verhaal aan van een van onze taal- en cultuurspecialisten: https://www.aivd.nl/onderwerpen/werken-bij-de-aivd/verhalen-uit-de-praktijk/audiobewerker

Functie-eisen

Je bent flexibel en in staat om snel te schakelen tussen gesprekken, teams en onderwerpen. Je hebt een goed geheugen en je bent analytisch sterk waardoor je uitstekend in staat bent om hoofd- en bijzaken van elkaar te onderscheiden en relevante verbanden te leggen. Daarnaast heb je er plezier in om samen aan een doel te werken en ben je sterk gemotiveerd om bijdrage te leveren aan onderzoeken met jouw specifieke kennis.

Daarnaast:

Beschik je over een WO-diploma met een focus op de Chinese taal en cultuur.
Heb je ervaring met het vertalen van Chinees naar Nederlands.
Heb je een uitstekende leesvaardigheid van zowel het vereenvoudigd als het traditioneel schrift.
Is je luistervaardigheid van het Mandarijn is uitstekend.
Beheers je de Nederlandse taal in woord en geschrift.
Het is een pré als je naast het Mandarijn een ander Chinees dialect beheerst.

De AIVD omarmt diversiteit en inclusie en wil graag dat medewerkers zich thuis voelen. Verschillende perspectieven, achtergronden en inzichten zijn een verrijking voor onze organisatie. Bij ons is iedereen die aan de voorwaarden voor een Verklaring van Geen Bezwaar (VGB) voldoet welkom, ongeacht culturele achtergrond, arbeidsvermogen, leeftijd, gender of seksuele voorkeur. Samen werken we aan de veiligheid van Nederland.

Arbeidsvoorwaarden
Salarisniveau
schaal 9
Salarisomschrijving

Het salaris is gebaseerd op een volledige werkweek. Daarnaast is aan het werken bij de AIVD een toeslag verbonden. Deze toeslag bedraagt bij indiensttreding € 148,- en loopt op tot maximaal € 460,- bruto per maand bij een volledige werkweek.

Maandsalaris
Min €3.119 – Max. €4.374 (bruto)
Dienstverband
Arbeidsovereenkomst voor bepaalde tijd met uitzicht op onbepaalde tijd
Contractduur
1 jaar
Minimaal aantal uren per week
32
Maximaal aantal uren per week
36
Overige arbeidsvoorwaarden

Naast het salaris ontvang je een Individueel Keuzebudget (IKB). Het IKB bestaat uit geld (16,37% van je bruto jaarsalaris) en tijd. Met het IKB maak jij de keuzes die bij jou passen en kun je een deel van je arbeidsvoorwaarden zelf samenstellen. Je kunt er bijvoorbeeld voor kiezen om een deel van je maandinkomen te laten uitbetalen wanneer jij dat wenst. Ook kun je dit budget omzetten in verlof en andersom of besteden aan fiscaal vriendelijke doelen. De Rijksoverheid hecht sterk aan persoonlijke groei en loopbaanontwikkeling en biedt daarvoor tal van mogelijkheden. Tot de secundaire arbeidsvoorwaarden behoren onder meer verschillende studiefaciliteiten, bedrijfsfitness, volledige vergoeding van je OV-reiskosten woon-werkverkeer en gedeeltelijk betaald ouderschapsverlof.

Bijzonderheden
Solliciteren? Stuur ons een cv en sollicitatiebrief waaruit duidelijk en onderbouwd je motivatie blijkt om te willen werken bij de AIVD.
Na de sluitingsdatum is het niet meer mogelijk om te solliciteren.
Je sollicitatie wordt alleen in behandeling genomen wanneer je op de juiste manier, via de daarvoor bestemde sollicitatie-knop reageert. Je uitgebreide motivatie is ingevuld en je cv is bijgesloten.
We vragen je om niet met anderen te spreken over je sollicitatie bij de AIVD. Het kan je sollicitatie en eventuele loopbaan bij de AIVD schaden en je veiligheid in gevaar brengen.
Om veilig te solliciteren, raden we je sterk aan je online sollicitatie vanuit Nederland te versturen. Verblijf je in het buitenland, wacht dan tot je weer in Nederland bent.
Een veiligheidsonderzoek op niveau A, psychologische onderzoeken, het opvragen van referenties en online screening zijn daarom onderdeel van de sollicitatieprocedure.
Om in aanmerking te komen voor een functie bij de AIVD moet je de Nederlandse nationaliteit hebben en (in principe) de afgelopen 10 jaar in Nederland hebben gewoond. Ook aan je eventuele partner en andere mensen in je omgeving worden bepaalde eisen gesteld.
Houd er rekening mee dat de selectieprocedure, inclusief het veiligheidsonderzoek, ongeveer 6 maanden in beslag kan nemen.
De AIVD gebruikt een digitale manier om te solliciteren. Houd er rekening mee dat het invullen van het sollicitatieformulier mogelijk technische problemen met zich meebrengt. Wacht dus niet tot het laatste moment met solliciteren.
Meer over jouw toekomstige afdeling

De directie Inlichtingen verricht onderzoek, exploiteert informatie en mobiliseert derden om de democratische rechtsorde en de staatsveiligheid te beschermen, de veiligheid te bevorderen en een bijdrage te leveren aan de vorming van het buitenlands beleid en de Nederlandse overheid.

AIVD

De Algemene Inlichtingen- en Veiligheidsdienst (AIVD) beschermt de democratie tegen nationale en internationale dreigingen, zodat we in vrijheid kunnen leven. Als je bij de AIVD werkt ben je verbindend, wendbaar, gewetensvol en moedig. Bij de AIVD doe je werk dat er toe doet: elke minuut van de dag.

We waken, vaak onzichtbaar, over Nederland en zijn bevolking. We doen daarvoor onderzoek in binnen- en buitenland. De AIVD doet wat nodig is om te voorkomen dat staten, organisaties of personen onze rechtsstaat tegenwerken, ondergraven of aanvallen. Ons werk doen we niet alleen. De AIVD heeft zijn eigen rol in het netwerk van overheidsorganisaties die de veiligheid van Nederland beschermen.

De AIVD is onderdeel van het ministerie van Binnenlandse Zaken en Koninkrijksrelaties. De taken van de AIVD zijn vastgelegd in de Wet op de inlichtingen- en veiligheidsdiensten (Wiv 2017).",https://media.glassdoor.com/sql/1035088/xindao-squarelogo-1438194474010.png,Rijswijk,€250 (Employer est.),XD Connects3.6 ★
Stagiaire public affairs & mediarelaties,"WAT GA JE PRECIES DOEN:‘Gifting’ is een mooi onderdeel van onze cultuur. Helaas creëert het ook afval en kan het slecht zijn voor onze planeet.Onze wereld vraagt om een andere manier van geven. Als gift company moeten wij de eersten zijn die daaraan voldoen.Wij zijn volledig 'connected' met ons doel om de gehele industrie te inspireren door middel van 'positive change'.Jij, als stagiair(e) voor onze Marketingteam zal deel uitmaken van onze transitie en daarmee impact hebben op ‘positive change’. Onze manier van geven veranderen. Klinkt dat niet gaaf?Vanaf augustus/september 2023 zijn wij op zoek naar een enthousiaste Media Vormgever/ Creative Designer Meewerk Stagiair(e) voor ons hoofdkantoor in RijswijkAls je ervaring op wilt doen in een internationale werkomgeving dan biedt XD Connects ​je daar uitstekende mogelijkheden voor!Over deze stage: Beschik je over uitstekende kennis van Adobe Indesign, Illustrator, Photoshop? Heb je creativiteit en passie voor je werk en het grafische vak? Dan vul jij misschien binnenkort het marketingteam XD Connects aan alsMedia Vormgever – Creative Designer! Met jouw creatieve ideeën en concepten zet je visuele uitingen in een handomdraai om voor zowel print media als online media. Je bent dan ook een belangrijk onderdeel van het marketingteam, want er zijn veel uitingen die in 2023/2024 de juiste look nodig hebben en daar kunnen wij jouw hulp goed bij gebruiken! Dit vind jij leuk om op te maken:Website content zoals banners en thumbnailsEmail campagnesBewerken van foto’sSocial media contentFlyersDrukwerkOpmaken verpakkingenVormgeving van onze website(s)WAAR ZIJN WIJ NAAR OP ZOEK?Je volgt een mbo- opleiding in de richting van grafische/media vormgevingJe hebt ervaring met Adobe programma's zoals InDesign, Illustrator enPhotoshopJe bent communicatief sterk, flexibel en neemt initiatiefJe bent een teamplayer, maar je kunt ook zelfstandig werkenJe kunt de uitleg snel vertalen naar productieJe werkt gestructureerd, nauwkeurig en leergierigWAT KUNNEN WIJ JOU BIEDEN:Een interessante stageplek in een leuk teamEen informele en internationale werksfeer met ruimte om je te ontwikkelenDe kans om een steentje bij te dragen aan een ‘changing industry’Stagevergoeding van €250,- per maand op basis van 40 uurPersoneelskorting op aankopenWekelijks gratis vers fruitMaandelijkse bedrijfslunch om ‘connected’ te blijven met je collega’sHeerlijke (Nespresso) koffieGaaf nieuw kantoor, gelegen naast centraal station RijswijkGratis gebruik van de gym in ons nieuwe pandENTHOUSIAST OVER DEZE VACATURE?‘Connect’ met ons door je korte motivatie en cv te mailen naar jobs@xdconnects.com. Voor vragen over XD Connects of deze stage kun je ook contact opnemen met Chantal de Vos (Corporate Recruiter), 070 75 90 528 / jobs@xdconnects.comof bezoek onze website www.xdconnects.com/nl-nl.OVER ONSXD Connects is één van de grootste leveranciers van gifts in Europa, met verkoopkantoren in heel Europa, een ontwerpstudio in China en een ultramoderne drukkerij in Roemenië. De collectie bestaat uit 12 verschillende productgroepen met meer dan 3.000 producten; allemaal op voorraad.Wij streven naar ‘positive change’ door het aanbieden van het beste geschenk met een lage impact, dat bedrijven met hun werknemers en klanten verbindt en tegelijkertijd de impact op het milieu minimaliseert. Als bedrijf streven wij naar maximale transparantie, zowel intern als extern. In alle aspecten van ons bedrijf stimuleren wij open communicatie, een sfeer van samenwerking en maximale eenvoud.Een baan bij XD Connects is anders dan alle andere die je hebt gehad. Je wordt uitgedaagd. Je wordt geïnspireerd. Bovendien zal je trots zijn. Want je zal deel uitmaken van iets groots; een industrie ten goede veranderen. Meer dan 550 collega's zullen blij zijn je erbij te hebben!Soort dienstverband: StageContractduur 6 maandenSalaris: €250,00 per maandRooster:Flexibele werkurenFlexibel werkroosterma-vrSecundaire arbeidsvoorwaarden:BedrijfsfeestenBedrijfsfitnessFlexibele werkurenHuisvestingsvergoedingWerklocatie: FysiekDeadline sollicitaties: 31-07-2023Verwachte startdatum: 31-08-2023",https://media.glassdoor.com/sql/1021234/nuffic-squarelogo-1539866146511.png,The Hague,€400 (Employer est.),Nuffic3.9 ★
