job_titles,job_description,images,locations,salaries,companies
Supply Chain Planner,"As a leading provider of innovative technologies for the treatment of Atrial Fibrillation (Afib) and related conditions, electrophysiologists and cardiothoracic surgeons around the globe count on AtriCure to deliver best-in-class solutions that can treat even the most complex cases. Our Isolator® Synergy™ Ablation System is the first and only medical device approved by the FDA for the treatment of long standing persistent Afib, our AtriClip Left Atrial Appendage (LAA) Exclusion System products are the most widely used LAA management devices worldwide, and we are expanding into pain management therapies. We invest in innovation, clinical science, and education to focus on improving lives for our patients’ worldwide.

We foster a culture of inclusion by embracing diverse experiences and individuals where everyone’s authentic self is welcome. We offer supporting programs and resources that provide enriching and equitable opportunities for each person to contribute professionally and personally.

Position Summary:
The Supply Chain Coordinator will be responsible for the coordination of logistics and inventory activities for the Marketing and Professional Education department, the inbound process of replenishment orders, managing RMA’s and will be interacting with internal and external customers. The successful candidate will work full time in AtriCure Distribution and Service Center.

Who Are You?

You are looking for a growing international company within the Medical Device industry
You work well independently but able to work well with a team
You are positive and constructive in life, and you focus on the opportunities that are available.

Roles and Responsibilities:

Coordinate inventory and shipment requests from Marketing and Professional Education department
Assist warehouse activities
Coordinate Inbound process – Stock shipments
Assist in returns RMA process
Supervise warehouse/customer service activities outsourced to the 3PL
Coordinate and execute Rework and Quarantine disposition activities
Coordinate item master data activities
Weekly Stock Reconciliation
Assist/Back up Logistics/Operations/Sales Operations activities

A Little About Yourself:

You have an MBO degree or equivalent.
You have around 5 years’ experience in supply chain, customer service or sales support
You have strong written/verbal communication in English
You have the ability to work in a variety of systems (ERP systems, CRM, Service Management Systems, WMS/TMS)
You have basic import and export knowledge
You have the ability to commute to primary place of work at AtriCure Distribution and Service Center.

What We Offer:
With AtriCure, you'll get the opportunity to work with a team that is passionately dedicated to improving the lives of patients with Atrial Fibrillation worldwide. It is also a company that will invest in your professional development to help you grow and be successful in your role.

In addition, AtriCure also provides:

The chance to work with an international team with more than 20 different nationalities, with 90 international employees (on-site and in the field) which makes it a dynamic place to work.
The offer includes a competitive base salary, performance-based bonus plan, training and development opportunities, 28 days’ annual paid leave, 2 days’ volunteer time off, mental health support benefit, transportation/car allowance with first class accommodation on public transport, and dynamic company events.

Our Process:

Please apply through LinkedIn or on our website. We would like to get to know you better so please feel free to share ample information about yourself and why you are interested in working with us.
Once we have your application, our International Recruiter will contact you to find out more about your background and your expectations.
The next steps include a meeting with the hiring manager to focus on key information about the role and to potential fit into the team. If this round is successful, you will get to meet a few of our team members to give you diverse perspectives about AtriCure.
After all the interviews, we conduct reference checks to help us make the final decision.

#LI-MA1",nan,Zwolle,€3K (Employer est.),Uitgekookt - Van Marle BV
Supply Chain & Logistics Support Coordinator,"Supply Chain PlannerElke week staan er 24 andere maaltijden op het menu bij Uitgekookt en die maaltijden worden meerdere keren per week vers bereid en uiterlijk de volgende dag bezorgd bij onze klanten. Jij bent verantwoordelijk voor het tijdig in huis hebben van de verse ingrediënten. Je bent onderdeel van het bedrijfsbureau waar ook de bezorging van de maaltijden gepland wordt. Je houdt veel ballen in de lucht en geen dag is hetzelfde.PlanningJe bent verantwoordelijk voor de het tijdig bestellen van de ingrediënten. Veel werk daarin wordt uit handen genomen door het systeem. Als leveranciers niet kunnen leveren, te laat leveren of de kwaliteit onvoldoende is, kom jij in je kracht en los je die problemen zelfstandig op. Je houdt overzicht en weet incidenten te managen. Daarbij werk je nauw samen met productontwikkeling. Zij selecteren leveranciers en producten en onderhandelen voorwaarden. Jij denkt daarin mee en signaleert kansen en verbeterpunten.Daarnaast ondersteun je de collega’s op de logistieke planning en kun je deze vervangen.Spin in het webAls supply chain planner ben je de spin in het web. Je hebt het overzicht wat wanneer moet gebeuren in de verschillende keukens en de orderpick. Je kunt in overleg met teamleiders snel schakelen als zaken anders lopen dat gepland. Je bent sterk in communicatie en kan ook onder druk de juiste keuzes maken.Kortom; een afwisselende rol met veel eigen verantwoordelijkheid. Daarnaast zijn er volop mogelijkheden jezelf binnen de organisatie verder te ontwikkelen in de richting die bij jou past.Jouw profielEen afgeronde relevante opleiding bijvoorbeeld HBO AD Management of MBO supply chain plannerAffiniteit met inkoop;Je bent communicatief sterk en past je communicatie aan op de situatie en je gesprekspartnerJe kunt sturend en direct zijn maar bent in de basis sociaal en inlevendJe bent accuraat en werkt gestructureerd om zo het overzicht te houdenJe houdt van afwisseling en speelt soepel in op calamiteiten en ad hoc zakenAanbodJe maakt deel uit van het team logistiek en bedrijfsbureau dat bestaat uit ongeveer 7 collega’sJe voelt je thuis in een organisatie met familiaire cultuur waarbinnen intensief wordt samengewerkt.Uitgekookt biedt volop opleidings- en doorgroeimogelijkhedenEen aantrekkelijke bonusregeling obv het resultaat van Uitgekookt en persoonlijke prestatieSalaris Euro 2.799,- obv 40 uur.Over UitgekooktUitgekookt groeit ongekend hard! Het bedrijf dat ruim 190 jaar geleden begon als een lokale groenteteler is inmiddels uitgegroeid tot de grootste verse maaltijdservice van Nederland. We zijn er met 300 collega’s en 900 bezorgers voor ruim 250.000 klanten in het hele land. Uitgekookt heeft de traditionele markt voor kant-en-klaarmaaltijden veranderd in een verse, gastronomische maaltijdservice voor jong en oud. Door de innovatieve manier van bereiding, met verse ingrediënten en zonder conserveringsmiddelen, blijven de smaak en voedingsstoffen van elk gerecht behouden.Interesse?Stuur dan je motivatie en CV naar Uitgekookt t.a.v. Miranda van MarleSoort dienstverband: Fulltime, Vaste baanSalaris: €2.799,00 per maandRooster:Dagdienstma-vrWeekendbeschikbaarheidSecundaire arbeidsvoorwaarden:BedrijfsfeestenReiskostenvergoedingSoorten aanvullende vergoedingen:BonusregelingOveruren uitbetaaldVakantiegeldWerklocatie: Fysiek",https://media.glassdoor.com/sql/1747389/effect-photonics-squarelogo-1560845442125.png,Eindhoven,nan,EFFECT Photonics3.7 ★
Job opportunities with the ICRC,"About us
Where Light Meets Digital - EFFECT Photonics is a highly vertically integrated, independent photonic semiconductor company addressing the need for high-performance, affordable optic solutions driven by the ever-increasing demand for bandwidth and faster data transfer capabilities. Our teams are made up of professional, highly skilled, energized, and enthusiastic people who share a passion for developing and creating high-volume, world-class solutions. We operate globally, and our teams work collaboratively to make EFFECT Photonics a very dynamic and rewarding place to work.

About the position

EFFECT Photonics is looking for an experienced – Supply chain / Logistics support coordinator.

The ideal candidate for this role is a passionate and engaging person who will be responsible for all inbound and outbound packages and associated paperwork for our Eindhoven office and will assist with the logistics for our other offices around the world. This role will also provide purchasing support for the local team including the entry and routing of purchase orders.

Role responsibilities:

Receiving Goods

Collect packages from central location in office building.
Inspect incoming packages for damage and correct documentation.
Enter receipt data into company systems (purchasing and tracking systems)
Distribute packages to recipients in a timely manner.

Shipments

Responsible for the processing of outbound shipments
Create and submit required documentation for domestic and international shipments (packing slips, commercial invoices and bills of lading)

Procurement

Creation of purchase orders for the local team.
Communicate with suppliers to ensure timely delivery of ordered items.
Assist finance with resolution of ordering/receiving and invoicing issues.
About You

We want you to bring your expertise, experience, and passion for delivering effective Logistics and Administrative support, we want you to help our business maximise its internal and external supply chain engagement, helping EFFECT Photonics build a world class company with a world class reputation.


Required / Desired knowledge, skills, and abilities.
Bachelor’s degree preferred or relevant working experience.
Customer Service Oriented (internal and external customers and partners)
Experience with international shipment processes and documentation (commercial invoices, HS Codes, customs)
Familiarity with commercial freight forwarders (DHL, FedEx)
Knowledge of procurement processes such as purchase orders, receipts and invoicing is desirable.
Able to work in a fast-paced environment across.
2- 5 years’ experience in a professional office or warehouse setting.
Excellent computer skills, including the Microsoft Office Suite (Outlook, Word, PowerPoint, and Excel)
Ability to work under pressure.
Excellent organization and time-management skills
Thrives in a fast-paced environment.

We are a collaborative Global Technology Company, and we’re building a truly dynamic and rewarding place to work.
Reward and Benefits
Benefits are a critical component to consider when taking on a new challenge, but because we are a global company, benefits may vary by location.
Here’s what you can expect from us regardless:
A fast-paced working culture where everyone’s point of view has real value
Genuine opportunities for self-development and career growth
An environment that embraces collaboration
A competitive salary that reflects our ambition
A flexible benefits scheme with health and pension plan (401K – US Based roles)
Paid time off (vacation days) plus statutory annual holidays
Flexible working hours
Stock Appreciation Rights (SAR – stock program)
We look forward to receiving your application, if you have any questions, please get in touch with our recruitment team.

Email: recruitment@effectphotonics.com - No agencies please!

Effect Photonics is an equal opportunity employer. All qualified applicants will receive consideration for employment without regard to race, sex, color, religion, sexual orientation, gender identity, national origin, disability status, protected veteran status, or any other characteristic protected by law. Effect Photonics complies with all applicable state and local laws governing non-discrimination in employment.",https://media.glassdoor.com/sql/1074834/rode-kruis-squarelogo-1450710892875.png,Netherlands,nan,Rode Kruis3.8 ★
Sourcing & Inkoopspecialist (Supply Chain),"Job opportunities with the ICRC
The International Committee of the Red Cross (ICRC) is the part of the Red Cross and Red Crescent movement, only their mission focusses on protecting and assisting people affected by armed conflicts and other situations of violence. The ICRC also endeavors to prevent suffering by promoting respect for international humanitarian law (IHL). Some of their unique tasks are reuniting families separated because of a conflict, visiting places of detention and promoting and strengthening humanitarian law and universal humanitarian principles.
The ICRC is not looking for volunteers, they only recruit professionals for a wide variety of roles and specialisms to work in 90 countries in the following fields: medicine & health care, forensics, engineering, water & habitat, agronomy, livestock veterinary medicine, logistics, supply-chain management, economic security & relief, finance, IT, HR, international humanitarian law, weapon contamination and & with arms carriers and interpreters in up to 20 languages.
They also offer paid traineeships in headquarters in Switzerland to help young graduates obtain a first work experience. For the job opportunities of the ICRC worldwide: https://careers.icrc.org/
Solliciteren
Solliciteren
Publicatiedatum
24-3-2022
Deel deze baan",https://media.glassdoor.com/sql/2879471/tuinmaximaal-squareLogo-1657205912953.png,Eindhoven,nan,Tuinmaximaal3.5 ★
Logistics Specialist (Bilingual in English and Dutch).,"Sourcing & Inkoopspecialist Supply ChainEindhoven - 32/40 uur – mbo/hbo werk- en denkniveau - salaris afgestemd op situatieJe maakt onderdeel uit van een snelgroeiende en dynamische organisatieEen uitdagende functie met groeipotentieelDit is je dag als Sourcing & Inkoopspecialist Supply ChainOnze organisatie is continu in beweging en jij als sourcing & inkoopspecialist weet hier goed op in te spelen. Als Sourcing & Inkoopspecialist weet jij als geen ander hoe je invulling geeft aan operationele inkoopprocessen en hoe deze te vertalen naar concrete acties.Vorige week ben je op zoek gegaan naar nieuwe leveranciers in verschillende inkoopgebieden. Vandaag ga je je bezig houden met het controleren en beoordelen van nieuwe inkoopcontracten met de afdeling legal, met als doel om met alle leveranciers een contract af te sluiten. Verder zorg je ervoor dat de nieuwe leveranciers geïmplementeerd worden in de organisatie.Hierna is er nog tijd over om op zoek te gaan naar nieuwe leveranciers, het stukje ‘sourcing’ in je rol. Jij houdt het contact met deze leveranciers en maakt prijs-en contractafspraken met ze. Daarnaast ben je in staat om opgevraagde offertes te beoordelen en inkoopvoorwaarden te controleren. Uiteraard doe je dit ook voor onze bestaande leveranciers.Dit vind je leuk om te doen als Sourcing & Inkoopspecialist Supply ChainContact onderhouden met nieuwe en huidige leveranciers, nationaal en internationaal;Onderhandelen met leveranciers over levertijden, condities en prijzen;Administratieve taken vind jij geen enkel probleem, hier krijg je juist energie van;Het leveren van een bijdrage aan de (verdere) optimalisatie van operationele werkprocessen;Je weet het overzicht te bewaren.Hier ga je direct mee aan de slagJe gaat direct aan de slag met het maken van een inkoopoverzicht van de hele organisatie en het optimaliseren van verschillende inkoopprocessen binnen de organisatie.Dit krijg je als Sourcing & Inkoopspecialist Supply ChainEen uitdagende functie met veel verantwoordelijkheid in een groeiende organisatie;Een salaris passend bij je werkervaring;125% verdienen voor elke minuut overwerk, of gecompenseerd in vrije tijd (regeling 2023);25 vakantiedagen per jaar;8% vakantiegeld, dit betalen we maandelijks uit bovenop je salaris;Deelname aan een zeer goed pensioenfonds (Detailhandel), tot wel 6x hoger dan bij andere werkgevers;Reiskostenvergoeding, zelfs als je bij ons om de hoek woont;Toegang tot meer dan 100 trainingen om jezelf te blijven ontwikkelen.Je bentHbo-geschoold, bijvoorbeeld in de richting van Supply Chain, Logistiek, Bedrijfskunde of soortgelijk (een mbo opleiding met relevante werkervaring is ook mogelijk);Resultaatgericht en analytisch sterk;Goed met het Microsoft Office pakket;Minimaal 32 uur per week beschikbaar;Communicatief sterk en beheerst de Nederlandse en Engelse taal goed in woord en geschrift.Soort dienstverband: Fulltime, Parttime, Contract bepaalde tijd, Vaste baanParttime uren: 32-40 per weekRooster:DagdienstFlexibel werkroosterma-vrSecundaire arbeidsvoorwaarden:BedrijfsfeestenExtra vakantiedagenMogelijkheid tot promotiePensioenProductkorting werknemersReiskostenvergoedingSoorten aanvullende vergoedingen:Overuren uitbetaaldVakantiegeldWerklocatie: Fysiek",https://media.glassdoor.com/sql/860002/mundipharma-international-squarelogo-1541177090989.png,Leusden,nan,Mundipharma3.3 ★
Supply Chain Planner en Logistic Support,"Mundipharma is looking for an experienced logistics professional to join our Supply Chain Operations and Planning team. You will be responsible for liaising with customers, freight forwarders and third party warehouses to agree shipping, storage, throughput and control measures, as well as reconciling and submitting License information to the Dutch Authorities. We are looking for someone with relevant experience, strong IT systems knowledge and negotiating and influencing skills.
Key Responsibilities:
Liaise with customers, freight forwarders and third party warehouses to agree shipping, storage, throughput and control measures. Monitor costs & performance of external warehousing
Responsible for monthly and yearly License reconciliations and submissions to the Dutch Authorities. Track Narcotics purchase orders and ensure accurate and timely application and status of Local and Customer Licenses.
Take lead and take ownership/oversight of all logistics functions in line with (import and export) regulations in MDC
Support and develop other members of the Supply Chain Operations and Planning teams, where required to ensure they have the appropriate skills knowledge and expertise for the current and future success of the business.
Implement and monitor appropriate systems and procedures to ensure effective supply operations. Actively contribute to the Quality Management System (QMS) processes in the MDC.
Qualification:
Relevant prior experience of working in logistics/supply chain/transportation function ideally within the pharmaceutical environment with a comprehensive knowledge of logistics processes and procedures.
Knowledge of lean techniques may be advantageous.
Education:

Higher degree education.
Strong IT systems knowledge and skills including knowledge and understanding of specialist systems.
Bilingual in English and Dutch

Experience:
Prior experience of working in logistics/supply chain/transportation function ideally within the pharmaceutical environment with a comprehensive knowledge of logistics processes and procedures
Sound degree of knowledge of technical regulations related to logistics such as import/export and customs regulations, including security requirements to include certification in dangerous goods handling and aviation security
International experience in communication, negotiation, cost control and contracting of 3rd Party Warehousing & Distribution companies.
High degree of knowledge and understanding of supply chain management. Negotiating and influencing skills.
Regional offices:
Coordination of the daily activity around inbound/outbound logistics
Main stakeholders:
Work closely with other functions (e.g. Quality, Planning, Supply Chain Coordinators, NPI, External Warehouses, Internal Customers, etc.) to ensure product can be compliantly distributed to market in support of product demand.
Quality department:
Contribute to the Quality management system
If you are interested in this role, please submit your resume .
We are looking forward to hearing from you!
Primary Location:
NL Leusden (MDC)
Job Posting Date:
2023-04-05
Job Type:
Fixed Term Contract (Fixed Term)",https://media.glassdoor.com/sql/7426513/brouwer-flexibele-ruimtes-squarelogo-1659595971564.png,Zeewolde,nan,Brouwer Units en Wagenbouw
