job_titles,job_description,images,locations,salaries,companies
Customer Service Representative,"Brouwer Flexibele Ruimtes gevestigd in Zeewolde zoekt een Supply Chain Planner en Logistics Support (fulltime).
Heb jij zin om het verschil te maken? En te werken in een sterk groeiend, ambitieus familiebedrijf?

Dan is de functie van Supply Chain Planner echt iets voor jou! Je zorgt ervoor dat de logistieke stromen zo efficiënt mogelijk lopen. De focus ligt hierbij op de inkomende en uitgaande goederenstroom. Daarnaast ondersteun jij de logistieke afdeling met jouw slimmigheden.
Onze fabriek
De fabriek is ontworpen voor een productiesystematiek waarbij de logistieke afdeling de materialen aanlevert o.b.v. het JIT principe aan de productielijnen.

Het logistieke proces is cruciaal en bepalend voor het realiseren van de doelstelling van de fabriek; de beste mass-customization fabriek van Europa. Dit betekent dat alle lijnen schaalbaar zijn in diversiteit aan producten. De capaciteit van het magazijn is hierop afgestemd. Dit komt neer op een opslagruimte aan materialen voor maximaal één week productie. Per 1 januari wordt een extern warehouse in gebruik genomen om dit te organiseren.
Wat ga je doen?
Jouw rol is om de inkomende materialenstroom te verdelen tussen de fabriek en het externe warehouse. En vervolgens voor de planning van de dagelijkse replenishment vanuit het externe warehouse naar de fabriek. Je werkt hierbij nauw samen met de afdeling logistiek en inkoop. Je werkt veel met ons WMS Wics.
Daarnaast ondersteun je de logistieke afdeling (10 fte) om stappen voorwaarts te zetten. Denk hierbij aan verhogen van de voorraadbetrouwbaarheid door analyses en tellingen, het inrichten van Kanban systemen en JIT bevoorrading van de productielijnen. Je bent ook nauw betrokken bij het inrichten van nieuwe processen als gevolg van de groei van de organisatie.
Het is een leuke, nieuwe rol waarbij je zelf ook invloed hebt op de verdere vormgeving.
In deze rol rapporteer je aan de supply chain manager, maar werk je vooral veel samen met de teamleider logistiek. Ook werk je intensief samen met de afdeling operationele inkoop.
Wie ben jij?
We zoeken een starter of iemand die toe is aan een tweede carrièrestap. Je vindt het leuk om mee te bouwen aan een groeiend bedrijf waarbij nog veel processen ingericht moeten worden.
Je neemt initiatief, bent planmatig, houdt overzicht en je bent analytisch. Je bent graag een spin in het web. Je enthousiasmeert de logistieke afdeling met je ideeën. Je bent pragmatisch ingesteld en maakt makkelijk verbinding met de werkvloer. Je hebt oog voor het grotere geheel en kan je bijdragen aan de ontwikkeling van de gehele organisatie. Je houdt ervan om de lat hoog te leggen, er écht voor te gaan en samen te werken met anderen.
En, last but not least, je hebt HBO werk en denkniveau en een afgeronde studie Logistiek of andere passende studie.
Wie zijn wij?
Brouwer is een dynamisch en sterk groeiend bedrijf. Het bedrijf kent een innovatieve en uitdagende werkomgeving waar collegialiteit en teamwork sterk gewaardeerd worden. De arbeidsvoorwaarden bij Brouwer zijn uitstekend.
Brouwer Flexibele Ruimtes is een familiebedrijf, onderdeel van Klein Groep en al ruim vijftig jaar lang een toonaangevend specialist in bouwplaatshuisvesting. Denk aan onderhoudsarme, duurzame, comfortabele schaftwagens en multi-inzetbare, flexibele standalone- en schakelunits. Vanuit dit stevige fundament ontwikkelt Brouwer zich verder. Het is de ambitie om het beste mass customization productiebedrijf te worden in de bouw. Praktisch betekent dit dat op dezelfde productielijn ook voor andere markten geproduceerd gaat worden, te beginnen met prefab binnenwanden en sanitair voor de woningbouw. De huidige locatie in Nijkerk biedt te weinig ruimte voor deze groeiambitie. Daarom is er een compleet nieuwe fabriek ontworpen.
Op een kavel van 33.000 m2 in Zeewolde wordt momenteel een productiehal van 11.000 m2 gebouwd, met veel aandacht voor duurzaamheid en circulariteit. In deze bedrijfshal komen onder andere een vrijwel volledig geautomatiseerde panelenafdeling en twee productielijnen voor het produceren van panelen en units. Gelijktijdig investeert Brouwer fors in nieuwe productie-installaties en software, om de automatisering naar een nog hoger niveau te brengen. Brouwer streeft naar volledige vrijheid in ontwerp, flexibele productielijnen en gebruik van de meest milieuvriendelijke materialen. Hiermee wordt een diversiteit aan eindmarkten bediend.
Brouwer staat te boek als een oer-Hollands productiebedrijf en kenmerkt zich door: afspraak is afspraak, vertrouwen en samenwerking, duurzaamheid en continuïteit, blijven verbeteren, korte lijnen en no-nonsense. Brouwer geeft de voorkeur aan werken met familiebedrijven en het aangaan van partnerships. De toekomst van Brouwer is rooskleurig door de ontwikkelingen in de bouwkolom, zoals de enorme vraag naar nieuwbouw en renovatie en de toenemende behoefte aan innovatie, industrialisatie en focus op duurzaamheid. De groei zal aanzienlijk zijn de komende jaren, zowel nationaal als internationaal. Binnen dat krachtenveld is het zaak de eigen organisatie fit te maken en te houden. Daarin is de operatie de basis voor het succes, waarbij de operationeel manager een sleutelpositie inneemt.
Ben jij de Supply Chain Planner die wij zoeken?
Stuur dan je sollicitatiebrief met CV naar sollicitatie@brouwer-group.nl t.a.v. Ronald Schuiling.
Als jij de geschikte kandidaat voor ons lijkt, zullen wij jou telefonisch uitnodigen voor een sollicitatiegesprek op locatie in Zeewolde. De sollicitatiegesprekken zullen zo snel mogelijk plaatsvinden.
Voor vragen of een uitgebreid functieprofiel kun je contact opnemen met:
Ronald Schuiling
06 - 17 91 53 07",https://media.glassdoor.com/sql/38791/maersk-squareLogo-1623223982283.png,Barendrecht,nan,Maersk4.2 ★
Senior Supply Chain Sepcialist,"Are you looking for developing your career in the logistics industry? Are you looking for a job where no two days are the same and you can be part of an international team?

Then this might be the opportunity for you!

We are seeking a Barendrecht based Customer Service Representative in our Central Control Tower team at KGH. The team is supporting customers across all Europe. In this role you will be working closely with local
(customs) brokers, transport companies, forwarders, planners, customer representatives, customs officers, managers and other parties at an
international level.

Maersk is transforming fast to become the global integrator of container logistics and expanding our service offerings in our industry-leading Single carrier Ocean+ business to increase our customers’ options to optimize transportation and supply chain performance.
Role Responsibilities
You are responsible for correct and timely handling of daily tasks within CCT Operations, CCT Reports and CCT Finance, according internal guidelines and procedures.
Daily operation:
responsible for correct communication towards the customer and related parties;responsible for correct and timely handling of CCT operational, reports and finance related issues and activities;contribution to the solution of challenges and escalations (root cause investigations);responsible for the completeness of files, incident registers and reporting;identification of customer-specific wishes and feedback;responsible for the completeness of reports and financial overviews EU broad (accounts payable and accounts receivable)
Who we are looking forAcademic background preferredExperience in a customer focused role in an international environmentPrevious experience of managing data, user level experience of ExcelLogistics experience is a plusFluent EnglishFlexibility to changing client requirementsTeam spirit
What we offerInternational environmentDiverse job responsibilitiesCareer developmentCompetitive salary package",https://media.glassdoor.com/sql/2919865/loavies-squarelogo-1585058595772.png,Zwolle,nan,Loavies3.0 ★
Supply Chain Trainee,"Senior Supply Chain SpecialistAre you ambitious and analytic and do you want to complete our operations team? You will be based at our HQ in Zwolle and visiting our state of the art warehouse in Groningen frequently.As a Senior Supply Chain Specialist, you have a key position within the finance and operations department. This role oversees several key responsibilities in the management and control of LOAVIES day to day operations and logistics.You are part of various expansion and improvement projects across the organization, reporting directly to the CFO.YOU GOT IT!Main responsibilitiesOwn and maintain the operations and logistics internal proceduresOwn stock count management and inquiries towards our third partiesOwn the continued development of LOAVIES operationsReview key fulfillment and transportation documentation from third parties or towards themBe a key stakeholder and subject matter expert in ERP and IT enhancement projects, provide advice and perform testing for the operations topicsProvide support to the business regarding the fulfillment and forwarding processesFollow up on defined KPIs and SLAs with third parties and ensure action plans and developed and followed up onSupport the buying team with custom clearance and inco terms and transport related topicsSupport the external and internal audits when applicableSupport the CFO and the planning department with volume forecastingSupport management with analysis and insights on the performance of the operations when requiredCoach and develop junior team members and internsBRING YOUR AMBITIONJob requirements and competenciesA completed education at HBO+ level in a business direction or a bachelor’s in finance, supply chain or economicsAt least 4 to 6 years of experience in a similar positionExperience with managing (incoming) inventory, when you have this experience in a retail / FMCG environment this is a plusExcellent knowledge and command of Excel and analyticsExperience with ERP improvements, BC is an advantage.Flexible, agile, responsive and proactiveApproachable to the various stakeholdersAttention to details and ability aligning business needs to the jobHighly analytical critical and accurateExcellent command of Dutch and English both written and spokenGood project management skillsAssertive and effective communicatorWORK HARD, PLAY HARDERWhat to expect from usA competitive package based on your work experience and educationA catered healthy lunch at the officeThe opportunity to join our bootcamp three times a week for free, provided by a personal trainer25 vacation days for full-time employmentYour birthday as an extra day offInspiring work environment at our headquarters in Zwolle, surrounded by talented, energetic colleaguesFun Friday afternoon drinks, company events and parties2 happy office dogs!Soort dienstverband: Vaste baanRooster:ma-vrSecundaire arbeidsvoorwaarden:BedrijfsfitnessProductkorting werknemersReiskostenvergoedingVrijdagmiddagborrelWerk vanuit huisSoorten aanvullende vergoedingen:VakantiegeldWerklocatie: Fysiek",https://media.glassdoor.com/sql/1075118/kruidvat-squarelogo-1605950064127.png,Ede,€3K (Employer est.),kruidvat3.4 ★
Supply Chain Planner,"Dit ga je doen
Als Supply Chain Trainee ga jij jouw carrière in de Supply Chain of Logistiek een kickstart geven. Hoe? Door een leertraject én Jobrotation. Twee jaar lang werk je mee op verschillende afdelingen en in verschillende disciplines. Je start bijvoorbeeld op de afdeling Store Replenishment - de spil tussen Inkoop, Supply Chain en al onze 1700(!) filialen. Daarna stroom je door naar een leidinggevende functie in een van onze warehouses of ga je aan de slag met procesoptimalisatie. En alsof dit nog niet uitdagend genoeg is word je intensief gecoacht. Je voert diverse coachgesprekken en doorloopt een persoonlijk ontwikkelprogramma. Zowel op inhoudelijk als op persoonlijk vlak een kickstart van jouw carrière dus! Ben jij klaar om jouw talent verder te ontwikkelen en wil je dat doen bij een organisatie waar geen dag hetzelfde is? Lees dan snel verder.


Wat ga je doen in de functie van Supply Chain Trainee?
Ervaring opdoen en talent ontwikkelen. Als Supply Chain Trainee bij A.S. Watson werk je bij de snelst groeiende retailer van Nederland. Een unieke kans om brede ervaring op te doen binnen verschillende Supply Chain-disciplines en jouw talenten verder te ontwikkelen!
Afhankelijk van jouw leerdoelen en interesses bepalen we samen aan welke opdrachten jij tijdens jouw traineeship werkt. Wil je graag ervaring opdoen in leidinggeven of ga je liever de inhoud in?
Heel veel leren. We zeiden het al; dit traineeship is een kickstart van je carrière. We doen er alles aan om jouw traject tot een succes te maken. Zowel inhoudelijk als op persoonlijk vlak krijg je tijdens het traineeship goede begeleiding.

Solliciteer direct en 'be part of more!'
Dit krijg je ervoor terug
Elke dag werk je samen, onderneem je binnen onze internationale organisatie én worden we samen een beetje beter. Daar krijg jij kansen én ontwikkelmogelijkheden voor terug. Maar er is meer…
Best belangrijk: een goed salaris! Afhankelijk van jouw ervaring start je tussen de € 2.700,- en € 3.200,-bruto per maand bij een 40-urige werkweek. Plus personeelskorting bij Kruidvat, Trekpleister en ICI PARIS XL!
24 vakantiedagen en een aantrekkelijke ATV-regeling met 19,5 dagen op fulltime basis. Liever meer vrije tijd of extra geld? Koop of verkoop vakantiedagen of laat je ATV (deels) uitbetalen. Een baan bij een succesvolle internationale organisatie met mooie merken. We zijn altijd in beweging, saai is het bij ons nooit!
Werkplezier en een snelle omgeving waarin je veel kunt leren. Je krijgt verantwoordelijkheid, vrijheid en de ruimte om jezelf te ontplooien.
Enthousiaste collega’s die informeel en open met elkaar werken aan het beste resultaat. Naast samen hard werken, ook veel samen lachen. #bepartofmore
Goede thuiswerkmogelijkheden. Hybride werken is bij ons heel gewoon en gaat altijd in goed overleg.
Ondersteuning bij een vitaal, veerkrachtig en gezond leven. We helpen je graag zodat je goed in je vel zit, zowel fysiek als mentaal.
Dit ben jij
Je bent een ambitieuze starter. Stilstand is volgens jou achteruitgang. Jij staat te popelen om je zowel inhoudelijk als op persoonlijk vlak volop te ontwikkelen en kan niet wachten om te beginnen! Je hebt een afgeronde hbo- óf wo-diploma. Staat er op dat diploma Logistiek of (technische) bedrijfskunde? Dan horen we heel graag van jou!
Werkervaring is niet nodig. Wel worden we heel blij van nevenactiviteiten tijdens je studie en van affiniteit met retail. Denk aan een afstudeeropdracht, stage of bijbaan.
Je spreekt vloeiend Nederlands én bij voorkeur Engels. In onze warehouses werken soms wel meer dan 15 nationaliteiten. Wel fijn als jij je dan goed verstaanbaar kan maken.
Een harde werker. Een traineeship is niet voor iedereen weggelegd en is best aanpoten. Niet alleen inhoudelijk maar zeker ook persoonlijk. We beloven je één ding; van deze stap in je carrière ga je nooit spijt krijgen.",https://media.glassdoor.com/sql/2356464/ofichem-group-squarelogo-1637320644831.png,Leiden,nan,Ofichem Group
Supply Chain Jobs ( WET.OPS.165 ),"Ofimedicine
Leiden
Fulltime
22 mei 2023
Bedrijfsprofiel
Ofimedicine, gevestigd op het Leiden Bioscience Park, produceert kwalitatief hoogwaardige medicijnen en levert diensten ten behoeve van de Europese markt. Met behulp van ons R&D laboratorium, GCLP-laboratorium en onze GMP-productie-omgeving bieden wij flexibele oplossingen op grote en kleine schaal. We zijn een jong bedrijf dat onderdeel is van de Ofichem Groep.

Functieomschrijving
Als Supply Chain Planner zorg jij ervoor dat onze geneesmiddelen tijdig geleverd worden aan onze klanten.

Jouw belangrijkste taken en verantwoordelijkheden:
Je ontwikkelt en optimaliseert onze Supply Chain Planning aanpak, passend bij de huidige en toekomstige omvang van Ofimedicine.
Je maakt optimaal gebruik van de mogelijkheden die ons ERP systeem QAD biedt, om daarmee de logistieke performance te verhogen.
Je ontwikkelt de farmaceutische productie- en distributieplanning op basis van de binnengekomen bestellingen. Deze planning komt tegemoet aan de klantvraag en sluit aan bij de productiecapaciteiten.
Je controleert en volgt voorraden van grondstoffen, emballage en materialen en zorgt voor tijdige bestelling door Inkoop.
Je controleert en volgt de productievoortgang in samenwerking met de Manager Manufacturing & Technology.
Afstemming en organisatie van distributie naar onze klanten.
Je signaleert proactief issues die een risico vormen voor de productie- en distributieplanning.
Je communiceert op professionele wijze met interne en externe belanghebbenden waardoor je transparantie creëert.
Omdat we een jong bedrijf zijn met een start-up cultuur, kun je worden betrokken bij andere activiteiten die passen bij (het ontwikkelen van) jouw talenten.
Wij vragen:

Je beschikt over minimaal een HBO opleiding
Je hebt in ieder geval affiniteit met productieplanning en MRP
Je hebt ervaring als Supply Chain Planner

Geboden wordt:

Ruimte voor ontwikkeling en persoonlijke groei;
Een afwisselende functie met veel diversiteit, vrijheid en verantwoordelijkheid;
Een dynamische werkomgeving binnen een hard groeiend en internationaal bedrijf;
Een enthousiast team met de ambitie om samen door te groeien;
Een marktconform salaris;
28 vakantiedagen [bij fulltime] en 8% vakantiegeld.

Ben je enthousiast geworden?
Solliciteer dan direct en stuur je CV en motivatiebrief per email naar: recruitment@ofichem.com.",https://media.glassdoor.com/sql/5672/interline-brands-squarelogo.png,Rotterdam,nan,Wilmar3.0 ★
Traineeship Supply Chain Management,"Wilmar Europe in Rotterdam is a fast growing and international processor and trader in the plant based oleochemicals industry. We are a strong proponent of sustainable growth and are strongly committed to corporate social responsibility and are a pioneer in that field in our industry.
Wilmar Europe's head office, where the trade and commercial activities for Europe are handled, is located at Delftseplein next to the Central Station in Rotterdam.
Due to the continuous growth and expansion of our activities we are consistently recruiting ambitious professionals for: Supply Chain Jobs
Our recruitment team is interested in supply chain professionals for several positions, are you looking for an opportunity to start or develop your career? Employees make the difference; that is why we are always looking for new enthusiastic colleagues who want to be part of our success. Wilmar Europe offers a dynamic and international working environment.
We offer various jobs such as:
Shipping & Logistics Coordinator (packed/bulk cargo)
Planning Executive
Customer Service Logistics Coordinator

We are looking for candidates with:
MBO in logistics, planning or supply chain
Internship or experience working with companies engaged in export/import and/or trading activities is preferred
Well-developed communication skills in English (spoken and written) is a must, Dutch , French, Spanish or German is a plus
Good skills and knowledge of MS Office (Excel, Word, PPT, Outlook)
Commercial understanding and service minded.
High level of accuracy
Ability to cope with stress/unpredictable situations
Knowledge of import /export documentations and international trading procedures
Knowledge of transport and storage of bulk and packed cargo is preferred
Good skills in ERP (SAP) software are preferred
Pro-active and eager to find solutions and solve issues quickly
Responsible and able to prioritize to meet short deadlines
Naturally curious and with growth mindset

More about Wilmar Europe
Wilmar Europe in Rotterdam and Wilmar Oleochemicals in Rozenburg (Botlek-Rotterdam) together form the Wilmar Europe organization, which in turn is part of Wilmar International. Wilmar International is founded in 1991 and is headquartered in Singapore. Today, Wilmar is a world leader in processing, trading and merchandising oilseeds, edible oils and sugars, specialty fats and oleochemicals, biodiesel and grain. It has more than 500 factories and an extensive distribution network in China, India, Indonesia and some 50 other countries on all continents. Wilmar is a strong proponent of sustainable growth and is strongly committed to corporate social responsibility and is a pioneer in that field in her industry.
Wilmar Europe's head office where the trade and commercial activities for Europe are handled, is based in Rotterdam. In addition, Wilmar Europe has offices in Germany, France, Spain and Italy and joint ventures in Italy, Poland, Switzerland, Ukraine, and the United Kingdom.
Quality, service, and reliability are the cornerstones to Wilmar’s reputation as an international processor and trader in the edible oils and oleochemicals industry. For further information about Wilmar visit our international website wilmar-international.com

We offer you:
A dynamic job based in the city centre of Rotterdam within an inspiring team with the opportunity to bring up your ideas. Taking responsibilities and personal development is self-evident within our company. Wilmar Europe Trading B.V. offers good salary and benefits package:
30 holidays per year
13th month
A pension scheme paid in full by Wilmar
Participation in the employer's collective fitness scheme and health insurance
Various other insurances paid for by Wilmar
Partial work from home options

If you wish to be considered for this position, please submit your application online with your curriculum vitae (in English) via werkenbijwilmar.nl

Wilmar

Wilmar Europe is growing significantly and has a demand for ambitious professionals to join our organisation. Employees make the difference; this is the reason why we are always looking for new enthusiastic colleagues who want to be part of our success. Wilmar Europe offers a dynamic and international work environment. We appreciate if our employees take their own initiative and bring in new ideas, next to taking responsibility.
Our European headquarters is in the city centre of Rotterdam near the Central Station.
For recruitment agencies:
We have made a conscious decision to do the recruitment ourselves. Therefore, we kindly ask you to not forward any candidates, as we will not accept their applications.",https://media.glassdoor.com/sql/36597/neways-international-uk-squarelogo-1436161382096.png,Son,nan,Neways
