job_titles,job_description,images,locations,salaries,companies
Derdejaars hbo of wo stage bij de KNVB,"Wij zijn Nuffic, de Nederlandse organisatie voor internationalisering in onderwijs. Van primair en voortgezet onderwijs tot mbo, hoger onderwijs en onderzoek, en volwasseneneducatie. We zijn een brug tussen onze opdrachtgevers, het onderwijsveld en kennisinstellingen in binnen- en buitenland. Midden in deze sterk veranderende internationale en nationale omgeving helpen wij scholen en onderwijsinstellingen op het gebied van internationalisering en internationale samenwerking.
We zijn een flexibele, klantgerichte organisatie met een breed bereik: van primair tot hoger onderwijs. In Nederland, Europa en wereldwijd. We staan klaar om nieuwe opdrachten aan te pakken en benutten kansen om ons portfolio te versterken.
Mensen maken Nuffic. Om onze ambities waar te maken, moet onze organisatie zich verder ontwikkelen. Om die reden zoeken we ter vesterking van onze stafafdeling een Stagiaire public affairs & mediarelaties.
Wat ga je doen?
Tijdens deze stage ondersteun je de woordvoering en public affairs collega in zijn dagelijkse werkzaamheden. Met jouw frisse blik ben jij zijn sparringpartner. Je doet daarbij praktijkervaring op in public affairs en mediarelaties.
Je monitort de politieke ontwikkelingen en media-uitingen over internationalisering en onderwijs.
Je maakt interne rapportages voor collega’s over ontwikkelingen in de buitenwereld en maak een wekelijks persoverzicht.
Je ondersteunt bij het beantwoorden van persvragen, schrijven van persberichten en het opstellen van statements.
Je denkt mee over strategieën richting politiek en media.
Je helpt bij de organisatie van werkbezoeken en stakeholderbijeenkomsten.
Wat neem je mee?
Je volgt een HBO/WO opleiding, bijvoorbeeld in de richting van Bestuurskunde, Europese Studies, Journalistiek of Communicatiewetenschappen.
Je hebt een neus voor nieuws en een uitstekende politieke en maatschappelijke antenne.
Je kunt je zowel mondeling als schriftelijk uitstekend uitdrukken.
Je bent analytisch en kunt strategisch denken.
Je staat ingeschreven bij een onderwijsinstelling.
Wat bieden we jou?
Wij geloven dat inclusief werkgeverschap een bepalende factor is om succesvol te zijn in de doelen die wij nastreven. We willen dat alle collega’s zich thuis voelen bij Nuffic. Door inclusief te werken, brengen we verschillende perspectieven, achtergronden en inzichten samen. Solliciteer jij bij Nuffic? Dan maakt het ons niet uit of je een rode, gele, blauwe of groene voorkeursstijl hebt, wat je achtergrond is of van wie je houdt. Belangrijk is dat je je enthousiaste zelf meeneemt, dat je bijdraagt aan een inclusieve Nuffic cultuur, dat je geniet van de hectiek binnen onze organisatie en dat je flexibel genoeg bent om hierop in te spelen, zodat we er samen voor kunnen zorgen dat iedere student of leerling toegang heeft tot het opdoen van internationale ervaring.
Een interessante en veelzijdige stage voor 32 uur per week, voor 5 tot 6 maanden. Start- en einddatum in overleg.
Een fijne werksfeer waar je je persoonlijk en professioneel ontwikkelt.
De kans ervaring op te doen in de wereld van internationalisering van het onderwijs en met de manier hoe beleid en maatschappij hierop invloed hebben.
Een stagevergoeding van € 400 bruto per maand.
Als je geen OV-kaart hebt ontvang je een reiskostenvergoeding van maximaal € 300 per maand. Aangezien we op dit moment veelal vanuit huis werken, worden je eventuele reiskosten op declaratiebasis vergoed.
Meer informatie en solliciteren
Wil je sparren over deze vacature of over werken bij Nuffic in het algemeen? Neem dan contact op Marc Bosman, Corporate Recruiter (tel. 06 - 46005408).
Bescherming van onze doelgroep tegen misbruik, het voorkomen van fraude en het waarborgen van transparantie, objectiviteit en zorgvuldigheid zijn essentieel voor ons. Nuffic accepteert dan ook geen enkele vorm van misbruik van macht of positie. Dit onderwerp komt aan bod in het selectieproces. Het opvragen van referenties is onderdeel van de procedure.
Acquisitie stellen wij niet op prijs. Delen van deze vacature in je netwerk wel!
Bescherming van onze doelgroep tegen misbruik, het voorkomen van fraude en het waarborgen van transparantie, objectiviteit en zorgvuldigheid zijn essentieel voor ons. Nuffic accepteert dan ook geen enkele vorm van misbruik van macht of positie. Dit onderwerp komt aan bod in het selectieproces.
Vacature delen via:
Regio:
Zuid-Holland
Vacaturetype / functietype:
Tijdelijk
Werkuren:
Fulltime
Parttime
Werkdagen:
Dag
Sluitingsdatum:
07-06-2023
Locatie:
Hybride
Contactpersonen:
Marc Bosman
tel.: +31 646005408
Company homepage:
http://www.nuffic.nl
Kantooradres:
Kortenaerkade 11 Den Haag 2518AX Den Haag",nan,Zeist,€300 (Employer est.),Divex
Content marketeer (junior/medior),"Stagiair Diversiteit & Inclusie - (38 uur)De KNVB wil de beste beslissingen nemen voor het voetballandschap. Daarom is het belangrijk dat de organisatie beschikt over verschillende ideeën, visies, competenties en achtergronden. En het belangrijkst: alle collega’s voelen zich welkom. Het is de overtuiging van de KNVB dat een inclusieve organisatie leidt tot een sterkere organisatie. Om dit te waarborgen hebben ze hun ambities vertaald naar een uitgebreid plan met verschillende activiteiten gericht op de processen en (toekomstige) collega’s van de organisatie. Voor de ondersteuning bij het behalen van deze doelen zijn zij op zoek naar jou!Je werkt direct samen met het hoofd diversiteit & inclusie en nauw met andere collega’s van afdeling HR, Corporate Affairs en Corporate Communicatie. De KNVB onderhoudt ook contacten met NOC*NSF, sportbonden en andere organisaties op gemeenschappelijke thema’s. Daarnaast werken ze samen met partners en experts buiten de KNVB om activiteiten uit te voeren zoals bijv. WOMEN Inc.Hoe ziet je gemiddelde werkdag eruitJe volgt de ontwikkelingen op het terrein van diversiteit, inclusie, discriminatie en toegankelijkheid die relevant zijn voor de interne organisatie en informeert betrokken collega’s hierover;Je wordt betrokken bij actuele en relevante dossiers, zoals bijv.: samenwerking en evenementen met partners, doorstroom en representatie binnen de organisatie, inclusieve cultuur en arbeidsvoorwaarden voor medewerkers, medewerkersbetrokkenheid, bewustwording op thema’s als micro-agressie en inclusief taal en media gebruik;Je ondersteunt bij het organiseren van workshops, webinars en evenementen op verschillende thema’s voor meer bewustwording in de organisatie;Je voert een stakeholderanalyse uit waar je potentiële samenwerkingspartners op het gebied van diversiteit, inclusie en gelijkwaardigheid in kaart brengt;De KNVB werkt in een dynamische werkomgeving waarbij goede samenwerking centraal staat. Daarnaast is er ruimte voor jou om een vakgebied gerelateerd onderzoek te verrichten wat ook relevant is en bijdraagt aan de doelstellingen van de afdeling.Wie zoeken wij?Je zit minimaal in het derde jaar van je HBO- of WO-opleiding, geen must maar eventueel in de richting HRM, Sportmanagement, Bedrijfskunde, Sociologie of (Arbeids- en Organisatie) psychologie;Je hebt een uitgesproken interesse voor actuele- en maatschappelijke vraagstukken;Je kunt een koppeling maken tussen maatschappelijke thema’s en de KNVB-strategie;Je kunt zelfstandig operationele activiteiten opzetten en uitvoeren;Je kunt makkelijk contact leggen met mensen.Wat mag je van de KNVB verwachten?Uitdagende stageplek in een professionele maar informele werkomgeving;Leerzame stage met diverse verantwoordelijkheden;Mogelijkheid om zowel thuis als op het kantoor in Zeist te werken;Laptop;Stagevergoeding van €300 op basis van een full time stage en een reiskostenvergoeding als je geen studenten OV-kaart hebt.Heb je interesse in de functie en de KNVB?Herken jij jezelf in bovenstaand profiel? Solliciteer dan snel of stuur je motivatiebrief en cv naar aanmelding@divex.nl!Soort dienstverband: StageContractduur 5-6 maandenSalaris: €300,00 per maandRooster:ma-vrSecundaire arbeidsvoorwaarden:Werk vanuit huisWerklocatie: Hybride werken in 3707 HX ZeistDeadline sollicitaties: 03-06-2023Verwachte startdatum: 01-09-2023",https://media.glassdoor.com/sql/2862250/mastermate-squarelogo-1567161845470.png,Apeldoorn,€2K - €3K (Employer est.),Mastermate
Intern Multimedia Design & Content Creatie - Nijmegen,"Voor de marketingafdeling is Mastermate op zoek naar een enthousiaste content marketeer die sterk in de schoenen staat. Jij bent de spil in het team als het om interne communicatie gaat. Je ontwikkelt content in de vorm van nieuwsbrieven, video’s, blogs. Hierbij ontgaat niets aan jouw scherpe oog. Je zorgt ervoor dat we zichtbaar zijn en de collega’s goed op de hoogte houden van alle nieuwtjes. Daarnaast ondersteun je je collega’s met planning en projectmanagement.
Als content marketeer houd je van het maken van content! Of dat nu een nieuwsbrief is, een video voor de collega’s of een blog voor klanten. Je houdt van organiseren en schrijft makkelijk teksten. De informatiebehoefte van de (potentiële) klanten en de collega’s is hierbij steeds je uitgangspunt. Je overtuigt, inspireert en motiveert je collega’s en maakt samen met hen relevante content voor de verschillende kanalen van Mastermate. Want samen gaan we voor maximaal resultaat!
Je hebt gevoel voor vorm en beeld en je verdiept je in de producten en oplossingen van Mastermate. Je hecht groot belang aan heldere communicatie. Communicatief ben je zeer vaardig en in staat personen te overtuigen zowel op inhoudelijke gronden als door je prettige wijze van communiceren. Ook naar je collega’s toe ben je duidelijk in je verwachtingen en deadlines.
In de praktijk
Verzorg je de interne communicatie zoals; de maandelijkse nieuwsbrief, berichten op het intranet, content (video) voor de training van medewerkers;
Ondersteun je bij de ontwikkeling van externe communicatie; denk aan de relatiemagazines, blogs en interviews;
Maak je de planningen en hou je deze scherp in de gaten;
Zorg je dat (soms strakke) deadlines gehaald worden.
Dit ben jij.
Een zelfstandige, enthousiaste en gedreven collega die staat voor kwaliteit! Je voelt je prettig in de cultuur van een familiebedrijf en hecht waarde aan samenwerken in een collegiaal team met een leuke werksfeer. Daarnaast beschik je over de volgende eisen:
Je hebt een afgeronde (hbo of mbo) communicatie opleiding, (online) communicatie of (online) marketing;
Je hebt minimaal 2 jaar ervaring;
Het beheren van een website en social media kanalen is voor jou geen probleem;
Je hebt ervaring met de creatie van video content;
Ervaring met het Adobe Creative pakket (InDesign, Photoshop en Illustrator) is een pre;
Je beschikt over overtuigingskracht en bent organisatiesensitief;
Je hebt onder tijdsdruk oog voor kwaliteit;
Je houdt wel van een potje tafelvoetbal.
Wat bieden we jou!
Een marktconform salaris tussen € 2.200,- tot € 2.600,- bruto per maand op basis van 40 uur per week, afhankelijk van jouw werkervaring.
25 vakantiedagen
Reiskostenvergoeding.
Naast betrokken werkgeverschap bieden wij eventuele scholing en opleidingen aan om jezelf te ontwikkelen en te groeien binnen ons bedrijf.
Leuke en nieuwsgierige collega’s die hun vakkennis en praktijkervaring met je delen. Zij leren jou graag alles zodat je je snel thuis voelt in deze veelzijdige functie.
Werken in een familiebedrijf met een platte organisatie, korte lijnen en een ‘recht door zee’ mentaliteit.",https://media.glassdoor.com/sql/654444/planon-squareLogo-1676546438071.png,Nijmegen,€9.63 Per Hour (Employer est.),Planon4.0 ★
Marketing stagiaire,"Intern Multimedia Design & Content Creatie - Nijmegen
Wil jij de sterke internationale groeistrategie van Planon mee vormgeven en helpen om onze merkbekendheid te vergroten? Dan is dit jouw ideale stage!
Als stagiair(e) Multimedia Design & Content Creatie ben je onderdeel van het Multimedia Design team binnen de afdeling Global Communications. Vanuit ons hoofdkantoor in Nijmegen zet je je in om via aantrekkelijke multimediale toepassingen, zoals video’s, banners, infographics en andere grafische designs, Planon te positioneren als merk en als werkgever.
Je werkt samen met verschillende wereldwijde functies, waaronder Global Marketing en Global HR, om overtuigende multimediatoepassingen te ontwikkelen en te implementeren om de merkbekendheid en de merkbetrokkenheid van Planon te vergroten. Je ontwikkelt aantrekkelijke designs voor allerlei vormen van content, inclusief employer branding campagnes ter ondersteuning van de werving van talent en het aantrekken en binden van kandidaten. Web, social media, video, podcasts, livestreams – het komt allemaal voorbij.
Wij zijn op zoek naar een meewerkstagiair(e) die ons kan ondersteunen om Planon als merk nog sterker in de markt te zetten. Je hebt interesse in film, fotografie en grafisch design en barst van de goede ideeën.
The Netherlands
Nijmegen
Students
Profile
Een bedrijf is niets zonder zijn mensen. Onze gevarieerde groep medewerkers is het kloppend hart van ons bedrijf en de sleutel tot ons collectieve succes. Om succesvol te blijven kunnen we jouw creativiteit en enthousiasme goed gebruiken.
Onze ideale kandidaat voldoet aan de volgende criteria:
Je volgt een hbo-opleiding in de richting Communicatie & Multimedia Design (CMD). Ben je een talentvolle en supercreatieve mbo’er? Reageer dan ook gerust op deze vacature;
Je bent gedreven, zelfstandig, enthousiast en proactief;
Je bent niet bang om de handen uit de mouwen te steken. Variatie in je werk en het werken met deadlines is voor jou geen probleem;
Je bent communicatief sterk;
Je hebt ervaring met het creëren van inspirerende content en je bent bekend met Adobe Creative Cloud (met name: Illustrator, Photoshop, Lightroom, InDesign en After Effects);
Bekwaam in de Nederlandse en Engelse taal.
We offer
Wij stimuleren een collaboratieve en lerende manier van werken in een inspirerende internationale omgeving. Daarnaast bieden we uitdagende projecten en buitengewone ervaringen. Voor deze stageplaats bieden wij een salaris van €385(op basis van 40 uur).
Je start je stage met een Global Induction Course waarin je alles te weten komt over Planon;
Je krijgt de mogelijkheid om relevante ervaring voor op je cv op te doen;
Je treft een uitstekende informele werksfeer aan waarin je echt deel uitmaakt van een internationaal team en open cultuur. De wekelijkse vrijdagmiddagborrel in onze eigen bar is daar een goed voorbeeld van;
Je krijgt veel verantwoordelijkheden die je echt laten ervaren hoe het is om voor een toonaangevend wereldwijd softwarebedrijf te werken;
Je kunt gebruikmaken van de sportschool op locatie met personal trainers;
Kans op een contract bij Planon na je stage.
Ga mee op onze reis om de erkende wereldleider in Smart Sustainable Building Management softwareoplossingen te blijven. Hoe we dit doen? Door onze mensen centraal te stellen en een inspirerende en veilige omgeving te creëren waarin we allemaal kunnen werken, leren, leven en spelen.
Ben jij communicatief sterk, zet je jouw creatieve ideeën graag om in aantrekkelijke content en ga jij een uitdaging niet uit de weg? Solliciteer dan direct!",nan,Netherlands,nan,Boegbeeld
Marketing / Communicatiemedewerker,"Marketing Stage bij BoegbeeldAltijd al gedroomd over een allround marketing stage binnen een startup? Zoek niet verder want Boegbeeld is opzoek naar een getalenteerde en passievolle marketing stagiaire die er klaar voor is om Boegbeeld naar het volgenden niveau te tillen.Locatie: Remote, met maandelijkse in-person meetingsStart: Zo snel mogelijkDuratie: 4-6 maanden minimum met doorgroeimogelijkhedenUren: 16 tot 40 uur per weekTakenContent Creatie Video, image en content creatie voor Instagram en YouTube van concept tot publicatie.Media Designer Grafisch ontwerp van product en marketingmateriaal.Online Marketing Opzetten, analyseren en uitvoeren van online marketingcampagnes voor Boegbeeld producten via Google en Instagram.Om succesvol te zijn in deze rol, moet je over de volgende vaardigheden beschikkenSterke communicatie- en analytische vaardigheden.Ambitie om mee te groeien met een startup.Basiskennis van Analytics en online marketingcampagnes.Can-do mentaliteitIemand die initiatief neemt, gefocust is en weet hoe prioriteiten te stellen.Beschikt al over vaardigheden om snel van start te kunnen gaan.Sterk in Nederlandse taalWat bieden wij?Kans om een cruciaal onderdeel van een startup te worden waarin jouw ideeën gebruikt en geïmplementeerd worden.Directe samenwerking met de founders van BoegbeeldDe vrijheid om je eigen verantwoordelijkheden en werkschema samen te stellen. Mogelijkheid om flexibel werkuren en dagen in te plannen.Flexibele vakantiedagenOnkostenvergoedingOver BoegbeeldIn een wereld waar alles geautomatiseerd is, kiezen wij bij Boegbeeld ervoor om producten met de hand en veel aandacht te maken, in samenwerking met lokale bedrijven. Passie en ervaring staan voor ons op de eerste plek, en dat laten we terugkomen in onze producten, verpakkingen en binnenkort ook in de Boegbeeld barbershop. Boegbeeld staat voor een handgemaakte belofte van kwaliteit en wil deze belofte verder uitrollen naar een echte barbershop ervaring.Met Boegbeeld producten willen wij onze klanten iedere dag de ervaring van de barbershop geven. Deze ervaring gaan we nu naar het volgende niveau brengen om onze klanten een daadwerkelijke barbershop ervaring te geven bij de Boegbeeld barberBoegbeeld is gecreëerd door Emre Sanli, een bekend gezicht op het internet onder de naam ‘Morrog’. Wat begon als producten op de markt brengen voor zijn community, is langzaam veranderd in een echt Nederlands merk met een range aan verzorging, styling en scheer producten. Een deel van de Boegbeeld ervaring is ‘een moment voor jezelf nemen’ wat wordt bereikt met het gebruik van handgemaakte verzorgingsproducten of een bezoek aan de Boegbeeld barbershop, waar jij een moment ervaart waarin even niks ander ertoe doet, behalve jijzelf.Cultuur bij BoegbeeldVrijheid in creativiteit en uitvoeren van ideeën. Als bedrijf geloven wij in jou en jouw kunnen. We vertrouwen op jouw expertise om keuzes te maken.Vertrouwen en integriteit. Iedereen bij Boegbeeld heeft een ondernemersmentaliteit en is gepassioneerd over verzorging en verzorgingsproducten.Solicitatie proces1e interview: Online interview 15-30 min.2e interview: Meeting met het team.We horen graag zo snel mogelijk van je! Druk op de solliciteer knop en leer ons kennen. Heb je voor het solliciteren nog andere vragen? Je kunt een e-mail sturen naar info@boegbeeld.shop om de functie verder te bespreken.Soort dienstverband: StageContractduur 6 maandenSalaris: Vanaf €100,00 per maandRooster:DagdienstFlexibele werkurenma-vrSecundaire arbeidsvoorwaarden:Flexibele werkurenMogelijkheid tot promotieReiskostenvergoedingWinstdelingWerklocatie: Thuiswerken",nan,Netherlands,€4K (Employer est.),Regionaal Historisch Centrum Vecht en Venen
Marketing Stage,"Aansprekende, duidelijke en effectieve communicatie met onze doelgroep, zowel online als offline. Daar staan wij als publieksgerichte archiefdienst voor. Jij neemt hierin het voortouw door heldere communicatieplannen op te stellen en uit te voeren. En je houdt onze sociale media en website proactief bij. Met als doel om iedereen – van bezoekers, gebruikers, ambtenaren en interne collega’s geïnformeerd, geïnspireerd en betrokken te houden.

Wat ga je doen?
Je zorgt voor de uitvoering van het corporate communicatieplan en levert actief een bijdrage aan het verder ontwikkelen hiervan.
Je ontwikkelt zelfstandig de marketing- / communicatieplannen voor onze tentoonstellingen en activiteiten (lezingen, cursussen e.d.) en voert ze uit.
Je houdt onze mediakanalen en website up-to-date met tekst, beeld en video. Je schrijft hiervoor inspirerende en relevante content (o.a. nieuwsbrieven) en signaleert kansen voor goede content-creatie.
Je zorgt voor concept, productie en distributie van publiciteitsmaterialen en drukwerk (je stuurt vormgevers / dtp-ers en drukkers aan).
Je denkt mee over hoe we onze identiteit en imago kunnen versterken.
Je gaat actief op zoek naar kansen en mogelijkheden om onze relaties te behouden en versterken en onze naamsbekendheid verder te vergoten onder de beoogde doelgroep. (o.a. door het actief benaderen van de media)
Sommige activiteiten vinden in de avonduren of het weekend plaats. Als marketing /communicatiemedewerker ben je daar dan natuurlijk bij, omdat de medewerker communicatie altijd zijn/haar deel/bijdrage aan een evenement heeft en daar van A tot Z verantwoordelijk voor is.
De coördinatie en organisatie van evenementen en activiteiten worden afhankelijk van de aard verdeeld onder de erfgoedmedewerker, dienstverlening en communicatie. Je zorgt dan voor het event- en floormanagement, helpt mee met de voorbereidende werkzaamheden en de op- en afbouw op de dag zelf.
Wie ben je?
Je bent communicatief vaardig en stapt makkelijk op mensen af om content op te halen.
Je kunt doordringen tot de kern van een boodschap én daar met je vlotte pen een creatieve draai aan geven voor onze verschillende doelgroepen.
Je schrijft graag, makkelijk en goed. Je teksten zijn altijd inspirerend en netjes verzorgd.
Van website tot socials, van CMS tot platform: jij weet precies hoe je mensen bereikt en vindt moeiteloos je weg.
Je bent flexibel, proactief en praktisch ingesteld.
Je kunt je eigen werk organiseren en weet op het juiste moment afstemming te zoeken.
Je voelt je thuis in een omgeving waarin je veel vrijheid krijgt, zelf verantwoordelijkheid neemt en er veel ruimte is voor experimenteren en leren.
Je bent stressbestendig en kan goed om gaan met deadlines en ad-hoc zaken.
Uiteraard ben jij een collega die binnen een kleine organisatie als het RHCVV meewerkt met de andere collega’s als het werk dat vraagt en toelaat.
Activiteiten vinden ook plaats in de avond of in het weekend; hierin ben jij flexibel inzetbaar.
Als communicatie-medewerker ben jij graag het gezicht van het RHCVV.
Wat breng je mee
Je hebt een relevante hbo-studie afgerond in de richting van Communicatie, Media of Marketing of andere relevante opleiding die aansluit op deze functie;
Ervaring met het opstellen en uitvoeren van communicatie en marketingplannen.
Minimaal één jaar ervaring in een vergelijkbare functie;
Je hebt een vlotte pen en jouw beheersing van de Nederlandse taal is uitstekend, zowel schriftelijk als mondeling.
Je hebt ervaring CMS-systemen en social media, zoals Twitter, Instagram en Facebook. Je hebt gevoel voor digitale systemen, zoals photoshop en vindt het leuk hierover te leren.
Affiniteit met archieven / cultuur en onze regio is een pre.
Wat bieden wij
Afhankelijk van je kennis, opleiding en ervaring krijg je een passend salaris. Voor deze functie is dat maximaal € 4.052,- bruto per maand (functieschaal 8, cao gemeenten peildatum 1 januari 2023) bij een volledige werkweek van 36 uur.
Je start met een tijdelijke aanstelling voor 1 jaar voor 32 uur per week, met bij wederzijdse tevredenheid uitzicht op verlenging.
Het RHCVV volgt de Cao Gemeenten. We bieden je goede flexibele arbeidsvoorwaarden. Met het Individueel Keuze Budget (IKB) van 17,05% bovenop jouw salaris kun je bijvoorbeeld zelf bepalen hoe en wanneer je je vakantiegeld en eindejaarsuitkering wilt laten uitbetalen, of dat je het wilt inzetten voor extra verlof.
Daarnaast kennen wij een uitstekende reiskostenvergoedingsregeling.

Omdat je als communicatieadviseur nauw betrokken bent bij alle afdelingen van het RHCVV is thuiswerken in deze functie niet mogelijk.

Over het Regionaal Historisch Centrum Vecht en Venen

Het RHCVV is een kleine organisatie met 14 enthousiaste en betrokken medewerkers en ruim 25 gedreven vrijwilligers. De (werk)sfeer is open, informeel en vriendelijk. Iedereen staat voor elkaar klaar en helpt waar nodig.

Het RHCVV bewaart en beheert de archieven van de gemeenten De Ronde Venen, Stichtse Vecht en de Bilt. Daarnaast bezit het RHCVV een grote verzameling historische archieven van particulieren, bedrijven, verenigingen en kerken uit de hele streek. Het RHCVV beheert niet alleen oudere archieven, maar is in navolging van de archiefwet en regelgeving ook toezichthouder van de aangesloten gemeenten voor archief en informatiebeheer. Het bestuur van het RHCVV bestaat uit de drie burgemeesters van de aangesloten gemeenten. De collectie is online toegankelijk en er is een studiezaal voor het doen van onderzoek en het inzien van de bibliotheek. Regelmatig organiseren wij cursussen, lezingen en tentoonstellingen.

Interesse

Herken je je in het profiel? Dan willen we graag met jou in gesprek! Stuur uiterlijk zondag 7 mei 2023 je motivatiebrief en cv in via onderstaande sollicitatieknop. De eerste gesprekken zullen plaatsvinden in de 2e week van mei.

Deze vacature staat gelijktijdig intern en extern uit. Bij gelijke geschiktheid hebben interne kandidaten voorrang.

Als onderdeel van de procedure vragen we om 2 referenties van vorige werkgevers.

Nu solliciteren

Meer weten?

Voor inhoudelijke vragen over de functie kun je contact opnemen met Roosmarijn Ubink, directeur-gemeentearchivaris van het RHC Vecht en Venen. Dat kan telefonisch via (0346) 259 425.

Voor vragen over de sollicitatieprocedure kun je contact opnemen met Daniel den Herder, corporate recruiter van gemeente Stichtse Vecht via 06 58 07 62 28. (ook WhatsApp)

Het Regionaal Historisch Centrum Vecht en Venen/Gemeente Stichtse Vecht onderschrijven de NVP Sollicitatiecode Werving en Selectie.",https://media.glassdoor.com/sql/3067971/frmwrk-squarelogo-1637834855627.png,Rotterdam,nan,FRMWRK
