job_titles,job_description,images,locations,salaries,companies
Junior Consultant,"Werken aan toonaangevende opdrachten in een professionele omgeving

Binnen ons consultancy team zijn wij op zoek naar versterking op junior niveau. Heb jij tussen 0 en 2 jaar werk/stage ervaring in een business/investment consultancy of bank en ben je analytisch sterk? Dan komen wij graag in contact met jou!

De Functie

Het debt advisory team van ICC begeleidt en adviseert het management van ondernemingen en/of private equity partijen bij het realiseren van nieuwe financieringen (bancair en non-bancair) en het verbeteren van de bestaande financieringsstructuur en –voorwaarden. Je werkt nauw samen met ervaren financieringsspecialisten die hun kennis en ervaring graag delen met jou. Concreet ga je o.a. de volgende werkzaamheden verrichten:

Je analyseert de financieringsbehoefte van onze opdrachtgevers in verschillende scenario’s;
Je stelt financiele modellen, adviesstukken en informatiememorandi op;
Je ondersteunt bij het structureren en optimaliseren van financieringstransacties en bij presentaties;
Je begeleidt de communicatie tussen opdrachtgever, de potentiële financiers en het debt advisory team tot het gehele traject succesvol afgerond is;
Je hebt een belangrijke rol in het relatiebeheer en bij de acquisitie van nieuwe opdrachten.
Dit bieden wij
Een dynamische en dealdriven werkomgeving, waarbij je bij ons echt aan de kant van de klant staat en je geen tijd en energie verliest aan veel interne processen zoals in een grote bancaire organisatie.
We bieden jou een omgeving waar je jezelf verder kunt ontwikkelen tot consultant op financieringsgebied, maar ook veel kunt leren op het gebied van M&A (via onze partner 1602 Capital), rentehedging en het managen van financiële marktrisico’s.
In een informele sfeer met een team van gedreven professionals werken met interessante klanten aan uitdagende opdrachten.
De mogelijkheid je netwerk op te bouwen en uit te breiden met DGA’s en CFO’s van de mooiste bedrijven van Nederland.
Competitief arbeidsvoorwaarden pakket inclusief opleidingstraject.
Jouw profiel

Je bent cijfermatig sterk en kunt snel een specifieke casus doorgronden. Je kunt goed overweg met MS Excel en PowerPoint. Je ontwikkelt snel een goed gevoel voor wat wel of niet haalbaar is qua financiering. Je houdt het overzicht als je aan diverse opdrachten tegelijk werkt en hebt een goed commercieel inzicht. Verder beschik je over:

Een afgeronde HBO /WO opleiding, bij voorkeur in een (bedrijfs)economische- of financiële richting;
Werk/stage ervaring bij een bank, adviesorganisatie of M&A boutique;
Sterke analytische vaardigheden;
Een gezond portie gedrevenheid en werklust;
Gevoel voor humor.
Over ICC

ICC Consultants is al ruim 40 jaar gespecialiseerd in het adviseren van bedrijven en instellingen bij het realiseren van een optimale financieringsstructuur en het afdekken van financiële marktrisico’s. Onze ervaren consultants zijn sparringpartner en huisadviseur van honderden Nederlandse (familie)bedrijven. Allemaal verschillende bedrijven qua sector, omvang en financieringsstructuur. Als dit de bedrijven en mensen zijn waar jij graag voor werkt, dan kun jij met jouw financieringskennis ontwikkelen en doorgroeien binnen ICC!

Contact

Wil je meer weten over ICC of van gedachten wisselen over het werken bij ICC neem dan contact op met onze recruiter Esther Salomé: 030-8201227. Solliciteren doe je door je CV met motivatie te mailen naar jobs@icc-consultants.nl of via Solliciteer direct.",https://media.glassdoor.com/sql/1339877/ortec-finance-squarelogo-1498136178300.png,Amsterdam,nan,Ortec Finance4.2 ★
Assistant Controller NL,"Do you have a passion for the financial markets? Are you interested in applying your analytical skills and further developing yourself within a dynamic and international organization? Are you a team player and do you want to learn more about risk management for pension funds? Then please send through an application for the Junior Consultant role in the global Pensions team and help us grow our successful Pension Strategy solution.

We are looking for someone who is passionate about the financial markets and who would like to work with industry leading asset and liability modelling (ALM) software to service the largest pension funds and asset managers globally. If you have the analytical skills ideally gained via actuarial or investment consulting experience or a finance, economics, IT or science-based degree and are a team player, then this opportunity within the Pension Strategy Solution might be right for you.

What do we have to offer?

The Junior Consultant position resides in the Global Client Servicing team of the Pension Strategy Solution. The position is based in the Netherlands, but you will be working together closely with colleagues located in the international offices of Ortec Finance. You will be required to provide support to our license clients by training them, helping them perform analyses and will become their sparring partner when it comes to the use of the ALM software, GLASS. You will gain significant experience in the asset as well as the liability modelling of client’s balance sheets, perform ALM studies yourself and further develop your modelling, analytical, advising and presentation skills. You will be in direct contact with the clients and you will be able to alternate your work between, office, working from home and occasionally at clients.

What’s in it for you?

We offer you a challenging and rewarding role in a growing company, while being part of an inspirational global business with a lot of opportunities for personal and professional career development.

In addition to a competitive salary, we offer you excellent benefits, including:

A fixed 13th month, holiday allowance, participation in our An open and informal work environment (Active staff association, annual ski trip, staff social events, annual summer and Christmas party and much more) with inspiring, smart and enthusiastic colleagues
Opportunities to develop yourself with a training program as well as weekly research and knowledge meetings
Hybrid working (Working from the office in Rotterdam or Amsterdam, with possibility to partly work from your home office)
The prospect of a permanent contract, because we strive for a long-term collaboration
Fixed 13th month, 8% holiday allowance, participation in a bonus scheme, participation in the pension scheme, commute and business travel allowance, working from home allowance, 27 vacation days and the possibility to purchase more.
Who are you?

You have sound analytical skills, and you are eager to learn. You would thrive working as part of a business team, to collaborate with colleagues and clients and to work together towards a mutual goal. And of course, you recognize yourself in our core values.

In addition, the following aspects are important:
You ideally have a master’s degree in finance, Economics, Econometrics, Actuarial Sciences, Financial Engineering or an exact science (e.g. Computer Science, Applied Mathematics, Physics)
The location of this position is in the Netherlands (Rotterdam or Amsterdam). Being able to live and work in the Netherlands is a hard requirement.
You are interested in the financial markets.
Being fluent in English is a requirement.
What is the Pension Strategy Solution?

Pension funds around the globe are confronted with challenging circumstances regarding retirement, investment and planning; continued low yields, complex liabilities, regulatory pressure, implementing good governance, and member communications. Ortec Finance provides software and services to help our clients manage these challenges.

The ALM and investment consultants working in the Pension Strategy Solution advise pension funds on their strategic investment/asset allocations, the practical implementation of these allocations and support the funds with the monitoring of short and long-term risks.

These consultants make use of our ALM software, GLASS, which has been developed by Ortec Finance and can be configured to the specific circumstances of each pension fund. In addition, clients can also utilize the software themselves and perform analyses independently.

Who are we?

Working at Ortec Finance means working somewhere else. It means working in a world where colleagues meet, gather knowledge and where likeminded peers are always willing to help each other. Where the organizational culture is friendly, flat and non-political.

Working at Ortec Finance also means working in a continuously innovating world where science, academics and mathematics dominate, since models are key in helping Ortec Finance’ clients with complex financial decisions. Because that’s what we love: giving our clients the best advice possible. Where the daily job is very in-depth, based on evidence and relevant for society. It means a job that matters. Where the learning curve is steep; we learn something new every single day. And we need to, because continuous innovation is key. Especially in a fin tech world. We don’t necessarily follow all conventions. Because yes, we are a bit rebellious too.

Ortec Finance is the leading provider of technology and solutions for risk and return management. It is our purpose to enable people to manage the complexity of investment decisions. We do this through delivering leading technologies and solutions for investment decision-making to financial institutions around the world. Our strength lies in an effective combination of advanced models, innovative technology and in-depth market knowledge. More at www.ortecfinance.com.

More information or do you want to apply?

For more information regarding this position please contact Maruska John, Recruitment Assistant at +31 10 700 5000 or send an email to recruitment@ortec-finance.com.

So, do you want to join Ortec Finance? Please use the application button. Be creative if you want.

Apply now

We hope to meet you soon!",https://media.glassdoor.com/sql/1348278/germains-seed-technology-squarelogo-1574678995913.png,Aalten,€3K (Employer est.),Germains2.7 ★
Assistant Tax Manager,"The primary purposes of the role are to ensure the timely and accurate recording of all information into the company accounting systems through the application of the correct levels of authorisation and adherence to specified procedures and practices. Additionally, this role will provide financial support and reporting to the European business unit and cost centre managers.


Primary Responsibilities

Ensure accounts payable, accounts receivable and payment are processed correctly through providing support to NL finance assistant.
covering the processing of AP, AR and payment runs in times of absence and during the two part time days of the finance assistant
Daily bank reconciliations and banking administration
Prepare balance sheet reconciliations and backup information
Preparation of month end journals
Intercompany balances reconciliation
Verifying supplier and customer master data changes and processes to ensure accurate data is held
Management of Credit card administration
Creating of recharge invoices
BTW, tax, intrastat and CBS reporting on a timely basis
Recording of Fixed assets in the financial system, maintaining of fixed asset register and running deprecation
Support the stock take process including preparing of stock revaluation
Assisting with overhead budgets and rolling forecasts
Back up for the Dutch payroll administration
Support on internal and external audits in NL
Support on improvement projects and automation of processes and systems

People

To maintain effective, co-operative working relationships with all internal and external customers, providing advice and solutions where practical and possible

General

This role will primarily support the NL and Spain in future, and may require occasional travel to the Spanish and UK sites
Confident working across locations with different cultures and languages.
Additional work, including project work, identified as necessary for the operation of the business.

Educational Qualifications

The job holder should be educated to a minimum of MBO Level 4 standard in an administrative discipline (or equivalent).

Experience

Minimum of 3 years experience in an accounts role within a private sector organisation. Experience of AP / AR is highly desirable. Highly competent in using Excel and other Microsoft packages. Sage experience desirable.

Working for Germains:

At a time when pressure on land, water and resources is greater than at any time in human history, Germains exists to help our customers maximize the productivity and cost-effectiveness of their crops. Founded in 1871, Germains Seed Technology develops innovative industry-leading conventional and organic seed solutions, specializing in Prime, Pellet, Filmcoat and Health. We have built a culture based upon the values of Courageous, Working Together, Customer Focused, Accountable and Passionate, and support and develop our employees to fulfil their potential. If you believe that your expertise and values are aligned with those at Germains then we would love to hear from you.

We offer:

A fulltime job within an enthusiastic and highly skilled team
Hybrid working (2 days a week in the office)
Great secundary benefits as holiday pay, commute to work compensation, bonus arrangement, additional holidays, pension, flexible working, and many more.",https://media.glassdoor.com/sql/15015/lyondellbasell-squareLogo-1680280708072.png,Rotterdam,nan,LyondellBasell Industries4.0 ★
Assistent accountant,"Location:
Rotterdam, NL, 3013 AA
Req ID: 81999
Facility: Rotterdam-548
Department: Tax NL
Division: Finance
Are you a qualified tax professional with experience within international organizations? Do you want to work in a leading international company within its field in an environment where professional and personal growth is encouraged? Welcome to LyondellBasell!

This is LyondellBasell

As a leader in the global chemical industry, LyondellBasell strives every day to be the safest, best operated and most valued company in our industry. The company’s products, materials and technologies are advancing sustainable solutions for food safety, access to clean water, healthcare and fuel efficiency in more than 100 international markets. LyondellBasell places high priority on diversity, equity and inclusion and is Advancing Good with an emphasis on our planet, the communities where we operate and our future workforce. The company takes great pride in its world-class technology and customer focus. LyondellBasell has stepped up its circularity and climate ambitions and actions to address the global challenges of plastic waste and decarbonization. For more information, please visit www.lyondellbasell.com or follow @LyondellBasell on LinkedIn.
This is the role

As an Assistant Tax Manager, you will be based in the Company’s corporate office in Rotterdam and be an integral member of the global Tax Department that is made up of approximately 100 tax professionals in 10 countries. More specifically, this position is part of the Tax Planning and Counsel team at LyondellBasell which is a collection of 20+ individuals located in different countries working diligently to comply with our Company’s tax policy requirements and to enhance shareholder value. This team is responsible for the global tax structuring, M&A and internal tax advisory to businesses. In order to achieve our goals, we work closely together with the business and other corporate functions such as Treasury, Legal, Accounting and HR.
You will report into the Director Global Country Tax Planning & Management located in the Netherlands. The role will support tax matters, working collaboratively with cross-functional teams and colleagues within tax globally, with a predominant focus on NL and UK.

Core responsibilities:
Lead and/or assist in a broad variety of tax matters with a focus on direct tax for operations and activities in NL, the UK and other jurisdictions (Sweden, Poland, Hungary and AFMEI (India, UAE, Egypt, Turkey));
Participate in regional tax planning and cross-border restructuring projects with opportunities to develop through technical research and presentations to tax leadership and executive management;
Analyze impact of proposed and enacted tax law changes both at local country and European Union level;
Lead and assist with corporate governance compliance requirements for the UK parent company and the NL regional offices;
Coordinate and support activities related to tax audits, controversy, litigation and ruling processes;
Lead the annual UK CFC analysis in connection with the annual corporate income tax compliance process;
Support the transfer pricing agenda, inclusive of risk management, optimization strategies, project support in liaison with internal and external stakeholders and the Transfer Pricing team;
Partnering with the business and other internal and external stakeholders to add value in the operational and support function areas;
Coordinate the non-NL/UK corporate tax return processes and other filings that are needed to be compliant with local tax regulations including managing internal stakeholders and external service providers;
Support the quarterly and year-end tax provision processes;
Lead projects to improve the tax processes locally and where appropriate, as part of a global team;
Regular travel to the London office.

The ideal candidate will be a qualified assistant tax manager who has previously gained experience in a multinational organization. Working within a team in NL and UK the role is a part of a much larger global department and the candidate will be required to interact and liaise with colleagues around the world. You will be comfortable working on your own initiative to achieve objectives and deadlines relevant to the role requirements and business needs in a timely and accurate manner.

This is who you are
Functional and technical knowledge to do the job at a high level of accomplishment
Strategic agility to anticipate future consequences and trends accurately
Self-starter with ability to work with cross-functional teams globally
Process management
Business acumen
Problem solving
Keenness to learn
This is what you bring
Either Master degree in Tax or ACA/ACCA or CTA qualification;
Typically 6 to 8 years’ work experience ideally within in a large corporate tax environment and/or big 4 accounting firm;
Experience with NL and/or UK tax law;
Experience with tax accounting under US GAAP and IFRS is a plus;
Fluency in English is a must.
This is what we offer

We offer an environment where we encourage personal and professional growth and where you will be rewarded for your performance and results. You will have the possibility to work with specialist on all fields to develop innovative solutions and to extend your national and international network. In addition, we offer you a competitive salary package. The Company's Global Remote Work Policy allows eligible employees the option to work up to three days a week from home. LyondellBasell is committed to advancing diversity, equity & inclusion (DEI) to ensure a positive experience for all employees.

Interested?

Please feel free to contact our sr Corporate Recruiter at natalie.backx-cornelissen @ lyondellbasell.com for more details.
Would you like to apply? Just send us your resume via the application button. The recruitment process exists of an initial phone screening and two/three business interviews before proceeding to a possible job offer a background check will be part of the process.
#LI-NB1",https://media.glassdoor.com/sql/5545909/vermetten-accountants-en-adviseurs-squarelogo-1646226420670.png,North Brabant,€3K - €4K (Employer est.),Vermetten | accountants en adviseurs5.0 ★
Junior Finance Professional,"Van bakkerij op de hoek tot snelgroeiend internetbedrijf; met inzicht in cijfers en deskundig financieel advies ga jij als assistent accountant op een van onze vestigingen onze klanten ondersteunen. Deskundig, daadkrachtig en doeltreffend. Zo komen jouw klanten verder door jou!

Wat ga je doen als assistent accountant?
Je helpt onze klanten bij het creëren van inzicht in de financiële gezondheid van hun onderneming. Onze klantengroep bestaat uit MKB-bedrijven die behoefte hebben aan jouw praktische ondersteuning en persoonlijk advies.
In de praktijk betekent dit dat je je o.a. bezighoudt met:

Ondersteunen bij het samenstellen en beoordelen van jaarrekeningen, begrotingen en overige managementinformatie;
Verwerken van administraties en het verzorgen van BTW-aangiften;
Het voorbereiden en geven van adviezen aan onze klanten.

Daarnaast krijg je alle ruimte om invulling te geven aan jouw ontwikkeling en ideeën ter verbetering. Je vergroot je kennis door samen te werken met onze fiscalisten, loonadviseurs, vastgoedadviseur en financieel planners. Is er een interessant project waar je aan deel wilt nemen of heb je een goed idee voor een product, dienst of verbetering? Wij bieden je graag de ruimte om – samen met collega’s – hiermee aan de slag te gaan. Het gaat tenslotte om jouw werkplezier en ontwikkeling.
Wat bieden wij jou?
Een baan waarin werkplezier en vrijheid centraal staan. Je komt binnen in een informele organisatie met een relaxte werksfeer waar we géén overwerkcultuur hebben.
Het verschil maken we met onze ‘zonder gedoe’ cultuur en het stimuleren van ondernemend werknemerschap. Door ondernemend werknemerschap kun je je eigen pad uitstippelen en zelf keuzes maken. Wij bieden jou de faciliteiten en zorgen voor rugdekking waar nodig is. Werken bij Vermetten betekent werken in een lerende organisatie, op basis van openheid en gelijkwaardigheid. Zo kom jij verder met Vermetten en komen wij verder door jou. Win-win!
Daarnaast kun je rekenen op:

Een marktconform salaris tussen €2.550,- en €3.700,- bruto per maand bij een fulltime dienstverband, afhankelijk van jouw kennis en ervaring;
Een gunstige studieregeling als je wilt doorstuderen. Ook kun je jezelf ontwikkelen met onze Vermetten Academy. Doorgroeien is overigens geen must. Jij bepaalt!
Een netto reiskostenvergoeding;
De keuze om 32, 36 of 40 uur per week te werken;
Flexibele werktijden en de mogelijkheid om maximaal de helft van je werktijd vanuit huis te werken, als je dit fijn vindt natuurlijk. Op kantoor ben je ook hartstikke welkom;
27 vakantiedagen op fulltime basis;
8% vakantiegeld;
Een premievrije pensioenregeling en goede WIA-verzekering;
De mogelijkheid om korting op jouw aanvullende zorgverzekering te krijgen.

Wie ben jij?
Je houdt van vrijheid in je werk en neemt graag het initiatief. Daarnaast vind je het interessant en leerzaam om ondernemers te helpen bij hun financiële bedrijfsvoering. Dit zien we graag op je cv:
Een (bijna) afgeronde associate degree, hbo- of wo-opleiding in de richting van Finance & Control / Bedrijfseconomie of Accountancy.

Wie is Vermetten?

Vanaf negen vestigingen verspreid over Noord-Brabant maken wij graag hét verschil voor onze klanten. Dat lukt ons alleen met betrokken, enthousiaste en deskundige medewerkers. Elk kantoor is kleinschalig en overzichtelijk waardoor iedereen elkaar goed kent. Mét de professionaliteit van een grote organisatie. Als ondernemend werknemer draag jij bij aan onze passie voor ondernemen en aan het succes van onze klanten. Wanneer je werkt bij Vermetten draait alles om deskundigheid, daadkracht en doeltreffendheid. En dat zonder gedoe.
Solliciteren of meer informatie?

Ben je meteen enthousiast geworden na het lezen van deze vacature, solliciteer dan direct via onze site. Wil je graag meer weten over de functie en/of over Vermetten? Anouk vertelt je met veel plezier alles wat je wilt weten. Je bereikt haar via 06-59866300 of solliciteren@vermetten.nl.

Het aanvragen van een Verklaring Omtrent Gedrag (VOG) is een vast onderdeel van de sollicitatieprocedure.",https://media.glassdoor.com/sql/1528400/search-it-recruitment-squarelogo-1599887910075.png,Amsterdam,€3K (Employer est.),Search X Recruitment4.7 ★
