job_titles,job_description,images,locations,salaries,companies
Junior Data Quality Professional – Finance Banking,"Job Location
 Delden
Date posted
 February 19, 2022

Position title
Finance business partner (1 fte)
With approximately 480 employees, KLK Kolb is one of the leading alkoxylation companies in Europe and offers a wide range of surfactants, chemical specialties, paper process chemicals and customer-specific products for various industries. KLK Kolb is a member of the global KLK OLEO Group.
We sell our products worldwide and currently have three manufacturing sites in the heart of Europe (Hedingen/CH, Moerdijk/NL and Delden/NL).


To support our continued successful growth, we are looking for a motivated, proactive and independently thinking

Finance business partner (1 fte)
Job Description

You will work within the finance department with a indirect line with Project Management Office organization and report directly to the Head of Finance & IT. Your main tasks will include performing detailed requirements analysis, documenting processes and developing the business cases for projects. To succeed in this role you should have a natural analytical way of thinking and be able to explain difficult concepts to non-technical users.

Responsibilities:

Evaluating business processes, anticipating requirements, uncovering areas for improvement, and developing and implementing solutions.
Leading ongoing reviews of business processes and track financial performance.
Support prioritization of initiatives based on business needs and requirements.
Align and monitor data between different databases.
Calculation of new tariffs & cost prices after completion of projects.
Documenting and communicating the results of your efforts.
Effectively communicating your insights and plans to cross-functional team members and management.
Ensuring solutions meet business needs and requirements.
Supporting the project leader with the implementation of control plans and setting up the required reporting at the end of the project.

As a candidate you have the following knowledge, experience and competences;

A bachelor’s degree in business or related field.
A minimum of 3 years of experience in business analysis or a related field.
Exceptional analytical and conceptual thinking skills.
The ability to influence stakeholders and work closely with them to determine acceptable solutions.
Excellent documentation skills.
Fundamental analytical and conceptual thinking skills.
Experience creating detailed reports and giving presentations.
Pro-active, broad and open minded, enthusiastic attitude.
Competency in Microsoft applications including Word, Excel, Teams and Outlook.
Excellent planning, organizational, and time management skills.
Excellent command of Dutch and English, both oral and written.

Information

For more information please contact Laurens Willemsen (laurens.willemsen@kolb.ch)


Candidates who meet the described profile can send a motivation letter with CV to the attention of Eva Tinselboer, HR Business Partner (eva.tinselboer@kolb.ch)

An assessment can be part of the application procedure.",https://media.glassdoor.com/sql/1727617/young-financials-squarelogo-1583832929136.png,Utrecht,nan,Young Financials
Account Management Trainee,"What do you bring?
✓ Master in Finance, Business Administration, Business Economics, or similar;
✓ Pro-active personality, driven, communicative, and eager to learn;
✓ Affinity with the financial sector and banking products.
What do you get?
✓ €3.000 – €3.200 based on 36 hours, depending on knowledge and experience;
✓ Study budget of €1.400 for external education and/or training;
✓ Steep learning curve and extensive knowledge of financial data and banking.
What do you do?
Introductie

€3.000 – €3.200 (36h) | Junior Data Quality Professional | Business Lending | Banking | Financial Data | Data Quality | Data Management | Utrecht
Does the combination of data, finance & banking appeal to you? Do you want to be trained at one of the largest international banks in the Netherlands? Would you describe yourself as data driven, proactive and communicative? Then the position as Junior Data Quality Professional – Finance Banking might be perfect for you!


Organisatie

Our client is an international bank in the field of Financial Markets, Asset Management, Real Estate and Insurance. The department you will work for, ensures that all business lending data produced by the bank passes through the systems with the highest quality. Various financial products are created and supported to enable customers to for financing. In addition, these products are tested for compliance with regulations and prices and risk profiles are drawn up. It is a dynamic and energetic work environment, with many opportunities to continue to grow.
Functie

The team produces and delivers reliable, available and accessible data for credit risk model development, reporting, sales processes as well as daily insights into portfolio and customer journeys. To develop high-quality credit risk models and to meet the increased data requirements of the regulator, excellent historical data quality is essential. This is where you come in. You will be involved in data quality activities e.g.: analyzing data issues and come up with solutions, setting up monitoring, and implementing data management. Furthermore, you work closely with colleagues from multiple teams to realize a sustainable data flow. This position gives you the opportunity to be exposed to a variety of lending products, clients, and regulations. You will also participate in projects related to improving the data landscape to a single source of truth environment. In addition, the position is in one of the most complex stakeholder environments within the bank, it gives you the opportunity to build a broad and relevant network.
Functie-eisen
A Master’s degree in Finance, Business Administration, Business Economics, or similar;
0 – 2 years of work experience in a similar position;
Strong numerical and analytical skills;
You can quickly see connections in complex data sets;
Affinity with financial data, processes, lending products;
Pro-active personality, driven, communicative, and eager to learn;
Fluent in English.
Aanbod

As a Junior Data Quality Professional – Finance Banking you will be working in a dynamic and international environment. Do you have a financial background and do you have a passion for data quality? This position is perfect for you, because you will:
Experience change processes up close, the bank is in full swing regarding innovation and data optimization
Experience a fast-learning curve in the field of financial data, banking, lending products and systems
Work in a fun team of ambitious people and you will be an important stakeholder within the bank
Participate in the internal training program of the client and you will receive personal coaching
Furthermore you will get:
Gross monthly salary €3.000 – €3.200 based on 36 hours, depending on knowledge and experience;
13th month salary, equal to 1 month’s salary
Extra study budget of €1.400 for following external education and/or training;
22,5 vacation days on an annual basis plus paid public holidays and 8,33% holiday allowance;
Participation in non-contributory pension scheme;
Full commuting allowance.


Sollicitatie

Interested? . If you wish to receive more information about this Junior Data Quality Professional – Finance Banking position, please contact Julie Leeflang via +31 (0)20 489 23 20 or sent an email to recruitment@youngfinancials.com

Julie Leeflang
Junior Talent Acquisition Manager
+31204892320",https://media.glassdoor.com/sql/39834/arvato-ag-squarelogo-1432769811760.png,Heijen,nan,Arvato Benelux B.V. – Supply Chain Solutions3.2 ★
Junior Account Manager,"Heijen, Limburg | Full-time | Master's Degree/WO | Traineeship Supply Chain Management & Logistics

Are you looking for the perfect 'kick-off' to start your career after University? We have a great opportunity for you to start working within Account Management at a leading international logistics service provider for various end-customer-oriented industries. Take your chance on this inspirational Graduate Programm! As a Management Trainee within Arvato, you will gain valuable experience within Logistics in combination with exclusive training courses and real-life assignments. You will be able to develop your competences and skills on professional level while being personally guided and coached.

Arvato acknowledges that one size, doesn’t fit all. Therefore, you will start your traineeship based on a Personal Development Plan. This custom sized plan is based upon your expertise and ambitions. Together, we will determine which path is the best match to reach your goals. That is because we believe that by 'being on it' you will find out where your strength and passion lies! The traineeship at Arvato lasts a period of approximately 18 months.

During your traineeship, you will receive valuable soft skill trainings from a senior trainer. You will strengthen your personal leadership skills, improve your professional communication skills and gain the best negotiation/stakeholder management techniques. We organize intervision sessions for our Management Trainees to reflect upon your experiences and learning curves. Hard-skill trainings are organized on topics such as Lean, Legal and Finance.

Besides these training opportunities, a lot of your development takes place during working hours. You will work on challenging real-world assignments, how cool is that?!

Hopefully you’re convinced already that Arvato is the place to be for the start of your career. But to really make sure you don’t have any doubts anymore, we will sum up some of the real-life cases you will be challenging during your Traineeship;

Analyze financial results and assess profitability. What are the drivers?
Carry out a market analysis.
Come up with an idea to improve the EBIT.
Assess the activities for an account and come up with at least one improvement suggestion.
Review a customer request for contract modification: what is the impact on capabilities and how does that look commercially?
Improve a process topic: make sure that the inbound KPI for an account can be achieved.
Assess a contract: Customer wants to make investment requiring contract extension.
Working on RfQ (Request for Quotation) and RfP (Request for Proposal).

What you will bring to the table
You are at the starting stage in your career where you have a strong desire to further develop your existing experience, abilities and skill set in a dynamic, international and high tech environment. The following are some of the key skills, attributes and experience that we would like to see:

Master’s degree, preferably in Economics or Logistics;
0-2 years of work experience;
Commercially driven;
Flexible;
Hands-on mentality;
Excellent oral and written skills in English.

What we offer
We offer you a challenging traineeship, tailored to your needs and amibtions, where you combine learning by assignments with learning by doing. It is a full-time position for 40 hours a week. We have a non-contributory pension, which means that on average you have a higher net salary compared to other companies! In addition, we offer:
A competitive salary up to €3.100,- gross a month;Travel allowance;8% holiday payment;25 vacation days, possibility to build up to 28 vacation days;Up to 40% discount on your fitness subscription;Telephone and laptop;Collective health insurance;ANW Insurance and WIA Hiaat insurance, fully paid for by Arvato.

Meet the Arvato Family!
Arvato is a fast-growing organization with an informal and transparent corporate culture. We are open to ambition, personal development and initiatives. Arvato Supply Chain Solutions is specialized in logistics solutions. In collaboration with the customer, we determine the most effective logistics process that meets their needs. Our DNA is built upon Customer Obsession, Ownership and Continuous Improvement. We achieve our goals by means of experience, state-of-the-art technologies, creativity, passion and a commitment to quality, innovation and having fun!

In the Netherlands, we serve our customer from four locations: Heijen, Venlo, Venray and Schiphol-Rijk, within these locations approximately 1.000 employees are working for Arvato. In addition to classic logistics services such as; warehousing, picking, transport management and comprehensive value-added services, we also offer tailor-made solutions for companies from sectors such as consumer products, high-tech and healthcare. For various customers we take the entire logistics process out of their hands.

Are you the new Account Manager Trainee we are looking for?
Then apply directly via the “Apply” button and upload your CV and motivation letter. Our Recruitment department will contact you regarding the further process.

Contact details
Sjoerd Croes, Corporate Recruiter
T: +31(6) 3857 2827
E: recruitment@arvato-scs.com

Company: Arvato Benelux B.V. – Supply Chain Solutions
Country: Netherlands
Job ID: 257261
[[custArvatoPost]]",https://media.glassdoor.com/sql/2541275/lime-technologies-squarelogo-1582542699308.png,Utrecht,nan,Lime Technologies AB3.7 ★
ISSA Seeks Junior Finance Officer,"Word je ook enthousiast van het verkopen van vette (tech) producten, met een groep gezellige en slimme teamgenoten? Realiseer je je ook dat sales en business development spannende en interessante onderwerpen zijn? Zo ja, dan ben jij dé Account Management Trainee die we zoeken!
Ben jij op zoek naar de sales uitdaging van je leven? Wil jij één van de eerste en belangrijkste Account Management Trainees worden van het Nederlandse team van Lime? Een stempel drukken, Lime vertegenwoordigen, deals sluiten en je naam in de geschiedenisboeken zetten?

Lime is een succesvol en op Nasdaq genoteerd internationaal softwarebedrijf dat CRM-oplossingen ontwikkelt, verkoopt en implementeert. We hebben een winstgevende groei laten zien van startup tot één van de grootste leveranciers op CRM-gebied op de Scandinavische markten. Nu is het tijd voor ons om verder te gaan dan de Scandinavische landen en onze ervaring en succes naar de Nederlandse markt te brengen. Ons fantastische nieuwe sales team van drie in Utrecht is nu op zoek naar wat backup. Dit is waar jij om de hoek komt kijken!

Zin om een business te helpen groeien?

Als Account Management Trainee werk je aan je eigen sales kansen en gebruik je ons CRM-systeem om klanten te ondersteunen bij het stroomlijnen van hun commerciële activiteiten en het verbeteren van hun winstgevendheid. Maak je geen zorgen, we zullen je alle training geven die je nodig hebt voor succes. Naast het leren van alles wat je moet weten over Lime en onze cultuur, word je ook een professional als het gaat om accountmanagement, verkooptechnieken, onze producten, het sales proces en onderhandelingstechnieken.

Zodra je dat onder de knie hebt, beheer je het volledige sales proces; alles van het eerste contact tot aan de onderhandelingen en contractvoorbereidingen, evenals het verzorgen van je bestaande klantportfolio.

Werken in sales als Account Manager en Lime vertegenwoordigen op de Nederlandse markt is een spannende mix van business development, projectmanagement en complexe salesactiviteiten, allemaal in zeer hoog tempo.

We denken dat jij:
Een ondernemende mentaliteit hebt en je wordt enthousiast van helpen bij het opstarten & vertegenwoordigen van Lime op de Nederlandse markt
Een Bachelor- of Masterdiploma in Finance, IT, Engineering, Economie, Management, Business Administration of vergelijkbaar hebt. (Je kunt je aanmelden voor het traineeprogramma tijdens je laatste studiejaar en tot twee jaar na je voltooide opleiding)
Gepassioneerd bent over het creëren van groeimogelijkheden en je bent zeer leergierig
Doorzettingsvermogen hebt
Vloeiend Nederlands en Engels spreekt
Een rijbewijs hebt
Het Trainee Programma

Met ons European Trainee Program beloven we je een unieke kans om je carrière als afgestudeerde een vliegende start te geven. Met een leuk en zeer divers trainingsprogramma en uitdagende projecten garanderen we een steile leercurve.

Het Trainee Programma begint met twee weken op ons hoofdkantoor in Lund, Zweden. Samen met alle nieuwe trainees van onze verschillende vestigingen krijg je intensieve trainingen en een opleiding, maar ook voldoende tijd voor teambuilding en leuke activiteiten. Na de introductie ga je terug naar je lokale kantoor en ben je helemaal klaar om aan de slag te gaan met je nieuwe sales kennis. Door de loop van het jaar zul je samen met de traineegroep nog meer training krijgen. Het traineejaar wordt afgerond met een lokaal feest samen met je traineegroep. Dit om te vieren dat je nu een volwaardige Account Manager bij Lime bent!

Het traineeprogramma start op 7 augustus 2023.

Klinkt het als een leuke uitdaging?

Afgezien van het bovenstaande, beloven we je een stijle leercurve en mooie mogelijkheden, hoe vaak krijg je de kans om een gloednieuw kantoor op te starten?

Kortom, een schitterende start van je carrière!

We kijken uit naar je sollicitatie! Mocht je willen uitblinken, stuur dan een motivatiebrief mee! We vragen je graag om in het Engels te solliciteren.


Don’t forget to submit your application in English.",nan,Leiden,€2K - €3K (Employer est.),International Step By Step Association
Junior Data Analist,"The International Step by Step Association (ISSA) is a vibrant international network that connects professionals and non-profit organizations working in the field of early childhood development. Established in the Netherlands in 1999, ISSA’s community today stretches across the globe with more than 95 member organizations coming from close to 40 countries, primarily located in Europe and Central Asia. In addition to providing network services to its Members (capacity building, learning exchanges, partnership projects, networking activities, etc.), ISSA also runs programs and offers services and resources to other stakeholders, increasingly acting as a broader platform for the early childhood development field. With a yearly budget of over 3 million EURO, ISSA’s operations are carried out through its programmatic and networking activities, with an emerging social enterprise division to generate unrestricted income.THE POSITIONISSA seeks to hire a Junior Finance Officer, based at its office in the Child Rights Home in Leiden, joining a team of 16 staff members. This is a part-time position of 3 or 4 days/week, depending on negotiations with the successful candidate. The Junior Finance Officer reports to the Finance Manager.The Employee's essential duties and responsibilities will be to support the all-round financial operations of ISSA’s by taking the responsibility for smooth accounting function and general financial support.This role involves working to strict monthly deadlines in line with the organization’s month end closure and monthly payroll timetable. The post-holder will be expected to work flexibly in order to meet key deadlines.Only candidates with permission to work in the EU will be considered.KEY RESPONSIBILITIESPrepare and process purchase & sales invoices in Basecone and TwinfieldPrepare and reconcile bank transactionsProcess month end journals, including payroll, depreciation, overheads, accruals, allocations and prepayments;Ensure balance sheet reconciliations are completed each monthEnsure adequate submission of all statutory returns for various authorities, including VAT returnContribute to preparation of annual financial statements and grant reportingAssist with organizational and project auditsAssist with budgeting processAssist with optimization of financial policies, processes, systems and proceduresImplement finance related policies and procedures in compliance with funder requirementsAssist with management of grants, sub-award and contractual procurement, financial review and close-out proceduresMaintain vendor management for financial servicesReview and process expense reports, credit card reports and payment requests for compliance with ISSA’s and donors’ requirementsSupport the admin team in meeting the needs of the office, including ordering supplies and house-keepingSupport with the logistics for various eventsData collection and processing to measure membership engagementOther basic financial and admin supportPROFILEEducation and Knowledge:Bachelor’s Degree in Accounting & Audit, Finance or similar field of study;Training in areas related to the job will be an advantage;Working knowledge of Dutch accounting Standards is required.Experience2+ years of work experience in accounting, finance, grants management, or related experience;work experience with non-profit program management, budgeting and accounting is desirable;Knowledge of grants administration, and ability to interpret grant-related documents and accurately respond to them is an advantage.Abilities and SkillsStrong attention to detail and accuracy in work outputs, including written communication;· Strong skills in MS Office and other relevant tools; Advanced Excel skills;Experience and high proficiency in use of computerized financial accounting programs and digital authorization systems, preferably Twinfield accounting and Basecone;Ability to work effectively in a culturally diverse team;Fluency in written and oral English, working knowledge of Dutch;Ability to independently track and manage multiple tasks and complete them quickly;· Supportive character.All applications will be considered on their merit against the criteria above.SALARY AND BENEFITS:Commensurate with experience. The terms of the contract will be determined on the basis of the applicable Dutch Labor Code.APPLICATIONS: Deadline:May 08, 2023 . Applicants should send:- a letter of interest indicating why they are suitable and qualified for the position;- a CV;- and contact information for two referees.Applications should be sent to info@issa.nlwith the subject line: Junior Finance Officer Search. All applicants will receive an acknowledgment of receipt, but only shortlisted candidates will be contacted in the course of the selection process.Recruitment will continue until a suitable candidate is found.More information about ISSA can be found at: www.issa.nl.ISSA is an equal opportunity employer, which supports diversity and does not discriminate on the basis of race, colour, religion, ethnicity, nationality, gender, age, disability or sexual orientation.Job Type: Part-timePart-time hours: 24-32 per weekSalary: €2,400.00 - €2,800.00 per monthWork Location: In personApplication Deadline: 09/06/2023Expected Start Date: 03/07/2023",nan,Netherlands,€3K (Employer est.),BrightStone Group3.9 ★
