job_titles,job_description,images,locations,salaries,companies
Junior Controller,"Als de oplossing simpel was geweest, hadden ze jouw ervaring en kritische blik niet nodig!

01

02

Salaris
€2.800 - €3.400

Uren per week
36 - 40 uur

Opleiding
HBO/WO

Locatie
Randstad

Voertaal
Nederlands

Dare to be
Bright!
Junior Data Analist
Jij zit als Junior Data Analist uitstekend op je plek bij BrightStone Group omdat je dát juist het liefste doet: waarde toevoegen door creatieve oplossingen te bedenken en data inzichtelijk te maken voor jouw collega’s. Jij automatiseert routinematige werkzaamheden 1.000 keer liever dan ze te accepteren als terugkerende handelingen. Jij hebt kennis opgedaan in programmeren en weet de toegevoegde waarde van machine learning algoritmen te benoemen. Jij en je team leren liever elke dag nieuwe dingen.

Ben jij nieuwsgierig? Mooi!
Werken bij BrightStone Group is op ontdekkingsreis gaan: altijd op zoek naar nieuwe bestemmingen en nieuwe oplossingen. En het mooie is: jouw rugzak met kennis, ervaringen en vaardigheden wordt gedurende die reis alleen maar waardevoller. Vallen, opstaan, fouten maken, daarvan leren, het hoort er allemaal bij. Groeien, leren en presteren in onze projectteams, vaak opdrachten voor banken en andere grote financiële instellingen. Die kans grijp je natuurlijk met beide handen aan als Junior Data Analist bij BrightStone Group. Wij werken alleen met enthousiaste, kritische teamspelers die informatie(stromen) analyseren én doorgronden. Zo lever jij met jouw team topkwaliteit en word je elke dag beter.

Wat ga je doen?

Verzamelen, structureren en controleren van data. Altijd met het doel: hoe kunnen we daar nog meer impact mee maken?
Verder helpen van onze organisatie, door nog slimmer, beter, sneller of gewoon anders data te benutten of te combineren;
Ontwikkelen van datamodellen en bijdragen aan datavisualisatie. Hoe complex ook, jij maakt het inzichtelijk;
Schrijven van rapportages waarin je de bevindingen uit je onderzoek opneemt;
Onderzoeken en stroomlijnen van diverse processen;
Geven van advies aan senior management. Jouw werk maakt verschil en doet er echt toe.
Hier mag je op rekenen
Een brutomaandsalaris van minimaal € 2.800 tot maximaal € 3.400;
Een uitdagend tailor made leerpad;
1-op-1-begeleiding en career counseling door een fieldmanager;
Toegang tot de Bright Academy en een online leeromgeving.
22,5 vakantiedagen op basis van 36 uur.
Ons sollicitatie proces
Bij BrightStone Group geen maandenlange, ingewikkelde procedures. We reageren uiterlijk twee dagen na jouw sollicitatie en maken graag snel kennis met je!
Heb je vragen of wil je meer weten over deze vacature?
Hamce Adam kan jou op weg helpen
Acquisitie naar aanleiding van deze vacature wordt niet op prijs gesteld
Dit neem je mee
Ten minste een hbo- of wo-opleiding, bijvoorbeeld Data Science, Quantitative Finance, Computer Science, Econometrie, Wiskunde of een vergelijkbare studie;
Ervaring met data modellering, procesoptimalisatie, visualisatie tooling en het verkrijgen van praktische inzichten;
Een sterk analytisch vermogen. Daarnaast ben je pragmatisch en creatief;
Interesse in (complexe) datavraagstukken;
Basiskennis van ten minste 1 programmeertaal, zoals Python, SQL of R.
Dare to be
Bright!
Weten waar je het over hebt.

Dare to
Grow!
Maak je ambities waar.

Dare to be
Explore
Ontdek de ondernemer in jezelf.

Dare to be
Different!
Een open blik naar de toekomst.

Je weet wat je wilt. Je bent ambitieus, gedreven en klaar voor de toekomst. BrightStone Group is de dynamische organisatie waar jouw talent tot zijn recht komt. Wij bieden je een carrière vol groei, de opleidingen om je talenten verder te ontwikkelen en horen graag wat jij te zeggen hebt.
Bij BrightStone Group gaan we geen uitdaging uit de weg en zijn we gedreven door ambitie. We kijken niet naar waar je vandaan komt, maar waar je naartoe wilt. Werk mee aan de meest uiteenlopende projecten voor de grote namen in een inclusieve organisatie waar er ruimte is voor nieuwe ideeën.
Over

Brightstone
BrightStone Group is een jonge, dynamische en snelgroeiende consultancy organisatie in Finance, Risk, Data, CDD en Compliance. Wij helpen grote financiële instellingen en snelgroeiende internationale organisaties hun ambitie om te zetten in resultaat.
Meer over BrightStone?",https://media.glassdoor.com/sql/2448065/bosveld-squarelogo-1666855249810.png,Amersfoort,nan,Bosveld4.4 ★
MANAGEMENT ASSISTENT(E),"Bij Bosveld zijn we opzoek naar een Junior Controller om ons team te komen versterken. Zoeken wij jou?

Fulltime / Parttime · Amersfoort
Waarom zou ik dat willen?

Je bent werkzaam bij het enige Gerechtsdeurwaarders & Incassokantoor met de erkenning ‘Great Place to Work’ in Nederland. Bosveld is een Gerechtsdeurwaarders- en Incassokantoor gevestigd in Amersfoort en Beverwijk waar prestatie en #plezier bovenaan staan. Bij Bosveld werken ruim 140 collega’s die dagelijks #samenwerken en zich met veel passie en empathie inzetten en opzoek gaan naar de beste oplossing. Bij Bosveld krijg jij de mogelijkheid om jezelf te blijven ontwikkelen en bieden we jou de kans om vanuit jouw eigen intrinsieke motivatie te #ondernemen en het best mogelijke resultaat in jezelf naar boven te halen. Onze strategie kunnen wij in één woord uitleggen: cultuur, want onze cultuur maakt ons anders. Want als medewerkers enthousiast zijn, dan worden klanten dat ook! Onze cultuur bewaken én versterken wij door elke dag met #plezier & prestatie (PEP) medewerkers daadwerkelijk op #1 te zetten, dat is onze #ambitie!

De uitdaging

Deurwaarderij en incasso gaat over openstaande rekeningen en schulden, wij gaan voor een gepersonaliseerde aanpak en vinden sociaal verantwoord incasseren erg belangrijk. Aan de basis daarvan ligt een betrouwbare financiële administratie in onder andere debiteurdossiers, exploiten en facturen. Het team dossieradministratie verzamelt gegevens van financieel administratieve aard, legt deze vast en verwerkt deze. Dit gebeurt in nauwe samenwerking met collega’s van de afdelingen incasso, support en onze deurwaarders.

Door jouw reeds opgedane kennis en expertise op een financiële afdeling en gedreven inzet is de financiële administratie in de dossiers optimaal. Financiële vraagstukken worden pro-actief, of op verzoek van een collega, opgelost. Door de dagelijkse dagstart met alle collega’s van de afdeling Finance weet je precies welke successen er geboekt zijn en welke uitdagingen er liggen. Wij maken het niet moeilijker dan het is! Kan de samenwerking, vraagstelling of informatieverstrekking makkelijker of efficiënter, dan maken we dat bespreekbaar en lossen het op.

Interessant! Maar.. wat ga ik doen?

Als Junior controller ben je in het bezit (of in de afrondede fase) van een HBO opleiding (richting finance of bedrijfseconomie). Bij Bosveld zoeken we een startende financial die verantwoording gaat dragen voor een breed takenpakket. In je nieuwe uitdaging als junior controller verricht je veel verschillende werkzaamheden. Zo ben je onder andere verantwoordelijk voor het verwerken van betalingen, het opstellen van facturen en het beheer van ons debiteren- en crediteurenadministratie. Je werkt nauw samen met onze incassospecialisten om ervoor te zorgen dat onze klanten op tijd betaald worden en onze financiële processen op een efficiënte- en effectieve manier verlopen. Dagelijks zijn we bezig met procesoptimalisaties waarin we jouw input graag meenemen daarom is het van belang dat je communicatief sterk bent en gericht op aanpak, uitkomst en resultaat. Wij maken het niet moeilijker dan het is! Kan de samenwerking, vraagstelling of informatieverstrekking makkelijker of efficiënter, dan maken we dat met elkaar bespreekbaar en bepalen wat de juiste oplossing is.


Hoeveel uur ga ik werken?

Je gaat 32-40 uur per week aan de slag. Bij Bosveld behoort hybride werken tot een van de mogelijkheden. Op die manier ontstaat de perfecte balans tussen werk en privé.",nan,Odijk,nan,HandicapNL
Assistant Financial Controller,"Odijk | 28 uur: “Ondersteunende rol voor een klantgericht persoon met een sterk verantwoordelijkheidsgevoel“De functieDoor omstandigheden kan onze zeer gewaardeerde collega haar functie niet meer uitvoeren zoals zij gewend was. Daarom zijn wij op zoek naar nog zo’n topper waar wij blindelings op kunnen vertrouwen.In deze functie ben je hoofdzakelijk verantwoordelijk voor de ondersteuning van de bestuurder en alle activiteiten die daarmee samenhangen. Je maakt deel uit van het secretariaat waar iedereen een hoofddomein heeft, maar ook een bijdrage levert aan algemene ondersteunende werkzaamheden voor de organisatie. Wat deze rol bijzonder maakt is het profiel dat wij zoeken. Wij zijn op zoek naar een ervaren persoon die over natuurlijk leiderschap beschikt en een voorbeeldrol binnen het secretariaat speelt.Waarom bij HandicapNL als je bij zo veel andere organisaties kunt werken?Omdat je deel gaat uitmaken van een team bevlogen en gemotiveerde mensen die werken aan maatschappelijke verandering. Bij ons kun je echt iets betekenen voor een grote groep mensen. Door de organisatie en de bestuurder optimaal te ondersteunen, maak je het mogelijk dat collega’s maximaal kunnen werken aan meer impact maken!Jouw bijdrageJouw specifieke verantwoordelijkheden binnen het secretariaat zijn:Assisteren van het bestuur;Administratieve taken ten behoeve van de directeur, RvT en MT;Agendabeheer en het notuleren van vergaderingen van de Raad van Bestuur en het MT.Aanspreekpunt/coördinator Facilitaire zaken en Gemeente;Inkopen doen;Officemanagement.Als onderdeel van het team secretariaat en donateurscentrum ben je samen met de andere collega’s verantwoordelijk voor:Telefoon beantwoorden;Bezoekers ontvangen;Secretariële ondersteuning op kantoor (i.v.m. opvang parttimedagen van andere collega’s);Faciliteren van de gezamenlijke lunch.Binnen het secretariaat zijn vijf mensen werkzaam, allen rapporterend aan de Manager Finance & Operations. Ook aan hem rapporteren de collega’s van IT en administratie.Jouw profielOnze ideale kandidaat is een energiek persoon die positief in het leven staat en dat ook uitstraalt. Jij bent klantgericht en dienstverlenend, maar je kan ook grenzen aangeven. In het bijzonder zoeken wij iemand met een sterk verantwoordelijkheidsgevoel die een voorbeeld is voor anderen en indien nodig anderen op hun verantwoordelijkheid aanspreekt. Je bent iemand die het overzicht kan bewaren en prioriteiten kan stellen. Een gastvrij en attent persoon die vooruit denkt en zaken goed regelt. Je hebt een uitstekende beheersing van de Nederlandse taal, zowel in woord als in geschrift en je hebt geen moeite met formele teksten. Jouw achtergrond en ervaring zijn voor ons minder relevant dan de competenties waar wij om vragen. Je hoeft dus niet per se een secretariële of PA achtergrond te hebben, wel een MBO+/HBO werk- en denkniveau.Over de organisatieIedereen heeft recht op een normaal leven. Voor twee miljoen mensen met een handicap is een normaal leven echter vaak niet weggelegd. Zij zitten zonder werk, gaan naar aparte scholen en worden buitengesloten van sociale activiteiten. Daarom doet HandicapNL er alles aan om kinderen, jongeren en volwassenen met een fysieke of lichamelijke beperking de kansen en handvatten te geven om écht het maximale uit het leven te halen. Zo maken we festivals toegankelijk, zorgen we voor betekenisvolle vriendschappen tussen mensen mét en zonder handicap, geven we mensen een échte start na hun revalidatie en ondersteunen we mantelzorgers zodat zij ook aan hun eigen leven toekomen.Er werken bij HandicapNL ruim veertig vaste medewerkers, allemaal hele betrokken mensen die hard werken voor de doelgroep en regelmatig ook als vrijwillige op een festival of event te vinden zijn. We zijn ambitieus en niet bang om nieuwe dingen uit te proberen, als wij maar verandering kunnen realiseren. Je komt te werken in een energieke en informele organisatie die diversiteit en inclusie omarmt.Het primair proces is belegd bij de afdelingen: Fondsenwerving & Communicatie, Impact & Bestedingen en HandicapNL Uitvoeringsprogramma’s. Ondersteunend aan het primair proces zijn Financiën & Operatie (secretariaat, administratie, IT), Strategie & Organisatie en HR.Zo’n 8.000 vrijwilligers ondersteunen ons in ons werk.Dit kan je van ons verwachtenWij vallen onder de CAO Sociaal Werk en kunnen je een aantrekkelijk pakket arbeidsvoorwaarden bieden waaronder:Een aanstelling voor 28 uur per week met een salaris, afhankelijk van ervaring en opleiding, in schaal 7;Een vaste eindejaarsuitkering van 8,3%, een loopbaanbudget, vitaliteituren en een individueel keuzebudget (IKB);Een goede pensioenregeling bij Pensioenfonds Zorg & Welzijn;Ruimte voor eigen initiatief, graag zelfs;Hybride werken is in deze functie mogelijk maar zeer beperkt i.v.m. noodzakelijke aanwezigheid op kantoor.Sollicitaties zonder cv en motivatiebrief worden niet in behandeling genomen.Soort dienstverband: ParttimeParttime uren: 28 per weekOpleiding:HBO (Gewenst)Ervaring:Management Assistent: 1 jaar (Gewenst)Werklocatie: Hybride werken in 3984 NC Odijk",https://media.glassdoor.com/sql/1433080/anthony-veder-squarelogo-1646388775444.png,Rotterdam,nan,Anthony Veder4.3 ★
Finance Assistant,"Are you an Assistant Financial Controller that acts as a team player and want to bring our reporting to the next level? Read on!
What you may expect

As an Assistant Financial Controller, you are part of the finance team that consists of 10 colleagues. The finance team is a service-oriented department with the ambition to always improve systems, processes, and reporting further. The finance department works with MS D365 F&O and Tagetik. You will be working closely together with the vessel administrators and finance manager. Report to the Finance Manager
You have the following responsibilities:

You are responsible for the financial reporting
Financial reporting consists among others of: weekly PI reporting, monthly financial reporting, covenant reporting to financiers, tax declarations (VAT and CIT), CBS reporting, Ad hoc reporting
You have a leading role in reviewing the P&L, Balance sheet and Cash flow
You coordinate the reconciliation between operational and financial systems
You have an important role in the external audits
You initiate and participate in optimizations of systems, processes, and reporting
What we offer you

A growing organization with an entrepreneurial character in an environment in which you can develop
A salary in accordance with the market
28 vacation days
Premium-free pension
Lots of (in)formal celebrations and possibilities to work on your physical health
Combining working from home and at our beautiful office in Rotterdam’s Shipping district

What we ask

You have at least Bachelor level, for example, Economics, Accountancy and/ or Controlling
You have at least 2 years of relevant work experience
You can compile financial reports, have excellent knowledge of Excel, and are used to working with an ERP system
Knowledge of Dutch GAAP and IFRS
You recognize yourself in the following characteristics:

You work accurately, you have analytical skills and you are able to work in a team
You have a proactive attitude and approach people easily
You have excellent communication skills in both Dutch and English",https://media.glassdoor.com/sql/1435219/youwe-squarelogo-1524735837176.png,Rotterdam,nan,Youwe4.2 ★
Junior Controller,"Youwe is one of Europe's leading full-service digital agencies that helps organizations navigate the rapidly changing digital world. By combining technology, data, and creativity, we help our clients communicate with their customers in innovative ways. We are looking for a friendly and reliable Finance Assistant to join our team in the information technology and services sector. As the Finance Assistant, you will play a vital role in ensuring the financial health and success of our business.

What you'll do:

Assist in managing the company's financial records, including accounts payable and receivable, invoicing, and expenses
Prepare financial reports, such as balance sheets, profit and loss statements, and cash flow analyses
Monitor and reconcile bank statements and financial transactions
Communicate with clients and vendors regarding payments and financial-related queries
Collaborate with other team members to ensure timely and accurate financial reporting
Assist in budget planning and forecasting for the company

Requirements:
What you have:

Proven experience as a Finance Assistant or similar role
Proficient in Microsoft Office, especially Excel and Word
Basic knowledge of accounting principles and financial reporting
Excellent organizational and time management skills
Attention to detail and accuracy
Strong written and verbal communication skills in English or Dutch
Bachelor's degree in Accounting, Finance, or relevant field is preferred. However, candidates with relevant experience are welcome to apply.

Benefits:

Hybrid way of working
Pension scheme
Travel reimbursement
Office lunch, snacks and drinks
Learning budget
Learning time off

",https://media.glassdoor.com/sql/986971/boni-markten-squarelogo-1430830613358.png,Nijkerk,nan,Hoofdkantoor Nijkerk3.5 ★
Grants Management Assistant,"Overzicht
Expert is een sterk groeiende franchiseorganisatie binnen de consumentenelektronica met 140 winkels, waarbij de klant, de winkel en het ondernemerschap centraal staan. Naast een zeer hoge naamsbekendheid met onze servicepropositie, hebben we een geïntegreerde e-commerce strategie, waarbij Expert.nl als tweede winkeldeur geplaatst is, de winkel staat in alles centraal.

Bij Expert heeft elke Expert ondernemer de vrijheid om te ondernemen zoals hij of zij wil ondernemen. Dat geldt ook voor onze collega’s op het hoofdkantoor. Je krijgt bij Expert de ruimte om invulling te geven aan de functie op de manier die het beste past bij jou en je team. Ons eerste antwoord is nooit nee. Je bent welkom om je ideeën met ons te delen. Zo komen de kwaliteiten van alle Expert medewerkers goed tot hun recht!

Vanuit het hoofdkantoor in Nijkerk leveren we maximale ondersteunende diensten aan onze 140 winkels op het gebied van o.a. verkoop, inkoop, marketing, winkelinrichting, service, e-commerce, opleidingen, automatisering en bedrijfsvoering.

Wij zijn voor de afdeling Controlling op zoek naar een:

Junior Controller

Je ondersteunt de Controller in zowel business control en financial control. Je voorziet interne en externe stakeholders van (financiële) bedrijfsinformatie door onder andere het beheersen van de omzetstroom, het controleren van inkoopafspraken en door het ondersteunen bij de maand- en jaarafsluitingen. Op den duur ga je interne audits ontwikkelen en uitvoeren, ga je een bijdrage leveren aan het budgetproces en neem je initiatief met betrekking tot verbeteringen binnen de organisatie. Bovendien is er voldoende ruimte voor financiële analyses, projectontwikkeling en ICT-control. Een veelzijdige en afwisselende functie in een groeiende en ambitieuze organisatie.

Wie zoeken we?
Je bent ondernemend, houdt wel van een uitdaging en weet je doelen te behalen. Bovendien herken je je in de volgende zaken:

Je bent een enthousiaste Junior Controller
Je snapt dat het belangrijk is dat de organisatie over de juiste informatie beschikt. Je gaat geen uitdaging uit de weg en je bent in staat deze informatie duidelijk en tijdig te communiceren. Door werkzaam te zijn in het Finance & Control team krijg je veel mee van de processen, de ontwikkelingen en de belangen.

Je hebt expertise
Je voelt je thuis in de wereld van cijfers en controlling en weet wat er speelt binnen de organisatie. Je volgt de nieuwste ontwikkelingen en trends op het accountancy en control vlak en weet deze adequaat toe te passen in Expert’s bedrijfsprocessen.

Je hebt oog voor detail
Je bent je ervan bewust dat je secuur moet zijn en dat je de juiste tools gebruikt op basis van de beschikbare informatie en middelen. Jij houdt het overzicht op je werkzaamheden.

Je bent ondernemend
Je kan snel schakelen, neemt graag het initiatief, denkt mee met het team en de organisatie en ziet uitdagingen in het behalen van doelstellingen. Je steekt graag de handen uit de mouwen en bent in staat om veel werk te verzetten. Resultaten boeken geeft voldoening.

Je bent service gericht
Je ondersteunt je collega’s, je beantwoordt vragen en geeft informatie over de voortgang.

Wat vragen we?

Je beschikt minimaal over een relevante afgeronde HBO-opleiding, bij voorkeur accountancy of bedrijfseconomische opleiding.
Ervaring in Dynamics Business Central is een pré.
Je hebt tenminste al enige relevante (stage-) of werkervaring in een vergelijkbare functie.
Daarnaast ben je leergierig en wil je jezelf graag blijven ontwikkelen.
Tot slot ben je tussen de 32 uur en 40 uur per week beschikbaar en woon je in Nijkerk of omgeving.

Wat bieden wij jou?
Expert groeit. En jij groeit vanzelfsprekend met ons mee. Bij ons krijg je niet alleen een prima salaris, maar ook een premievrij pensioen en een prima bonusregeling. En misschien nog wel het belangrijkste: je komt terecht in een werkomgeving met leuke collega’s, waarin je de ruimte krijgt om jezelf te ontwikkelen. Na je inwerkperiode heb je de mogelijkheid om gedeeltelijk vanuit huis te werken. Expert biedt daarom ook de mogelijkheid tot het volgen van cursussen en opleidingen.

Kom jij het maken bij Expert?
Spreekt de functie van Junior Controller jou aan?",https://media.glassdoor.com/sql/1074834/rode-kruis-squarelogo-1450710892875.png,The Hague,nan,Rode Kruis3.8 ★
