job_titles,job_description,images,locations,salaries,companies
Management Assistent CFO,"Grants Management Assistant

The Red Cross Red Crescent Climate Centre is the expertise centre of the International Red Cross and Red Crescent in the field of climate change and climate disasters. The Climate Centre’s mission is to help the Red Cross and Red Crescent Movement and its partners reduce the impacts of climate change and extreme-weather events on vulnerable people.
The Climate Centre consists of an enthusiastic team that guides a growing network of colleagues from all over the world in integrating climate risks into their work. The Climate Centre works closely with the Netherlands Red Cross and the International Federation of Red Cross and Red Crescent Societies (IFRC) in Geneva.
Due to a vacancy at the Climate Centre, we are immediately looking for a:
Grants Management Assistant (fulltime, hybrid)
Position within the company:
The Grants Management Assistant is part of the core team of the Climate Centre and supports the Grant Management Officer, coordinating and managing the administration of funding agreements with other Red Cross Red Crescent organizations, international institutions and/or foundations. This position is an important pivot in our often hectic virtual office (with a small team in the Netherlands as well as colleagues abroad). You would be working in a hybrid setting from home and from the Climate Centre office in The Hague (NL).
Envisaged start date: 1 July 2023.
Job description:
Collaborate with Program managers, Project leads, the Finance and HR teams on proposal development grant approvals, contracting and monitoring in compliance with internal processes and procedures and grant guidelines agreed upon with the funding entity.
Responsibilities include:
Direct communication to donors regarding the grant approval, needed amendments and reporting processes.
Timely and accurate project administration in the financial system (Exact online) and other management tools (Excel-based).
Project monitoring: Communication with the project team about deadlines due and specific constraints in the project cycles.
Draft grant applications, agreements and financing proposals and support budget and other contractual negotiations.
In the pre-award phases, ensure due diligence, compliance, legal and procurement checks are carried out according to the donor's requirements and own accountability standards.
Develop, maintain, and improve systems and procedures for systematic grant and contract management.
We are looking for someone who has an understanding of the full project life cycle but with a keen eye and a special interest in the project management and compliance related tasks. You can bring your experience into this relatively young centre of experts and develop, maintain and improve systems and process. Do you enjoy the variation between the operational multi-stakeholder communication and a process and systems focus? Then we look forward to hearing from you.
Job requirements:
Bachelor degree in Business, Project Management, or other related field.
Experience in business and administrative processes and information flows in organizations.
Experience with developing and reviewing contracts and proposals
Legal contracting experience a plus
Demonstrated project and time management skills, including planning and prioritizing of job duties.
Substantive knowledge of the Climate Centre’s working field is an advantage, and affinity with the mission and ways of working of the Climate Centre is important to be able to properly fulfill this role.
Strong written and verbal communication skills in English is a must.
Technical Skills
Good working knowledge of MS Office (Outlook, Word, PowerPoint, Teams), most importantly with Excel.
Knowledge of Exact online a strong asset.
Soft Skills
Able to work with a diverse group of individuals across the globe (and time zones) and virtual environment in a professional manner.
Able to build and maintain positive, effective relationships with colleagues from various cultures and diverse range of donors.
Strong organizational skills, able to manage multiple priorities simultaneously.
Able to deliver excellent service to both internal and external stakeholders.
High degree of independence with a proactive attitude and accuracy.
Hands-on, team player, flexible, pro-active, decisive and entrepreneurial.
We offer:
A flexible and people-oriented working environment with room for initiative and development. A contract for 1 year with the possibility of extension. The full time (40 hours per week) salary for this position is between € 2.723,46 and 3.477,43 gross per month (scale 8 of the Climate Centre salary scales) depending on education and work experience. Selected elements of the Netherlands Red Cross Collective Bargaining Agreement apply.
How to apply:
We would like to receive your application (in English) addressed to Olette Manhoudt, HR officer at the Climate Centre at Application@climatecentre.org. We will review the applications on a rolling basis. Once a succesful candidate is identified, this vacancy will be removed.
A reference check may be part of the selection process.
Further information:
For further information about the position, please contact Ashley Hoek, Grant Management Officer at the Climate Centre at hoek@climatecentre.org.
For more information about the work of the Red Cross Climate Centre, visit www.climatecentre.org
Twitter: @RCClimate
Facebook: @climatecentre
LinkedIn: Red Cross Red Crescent Climate Centre
Acquisition as result of this vacancy is not appreciated
Solliciteren
Solliciteren
Publicatiedatum
19-5-2023
Deel deze baan",https://media.glassdoor.com/sql/2994728/de-volksbank-squarelogo-1583832158291.png,Utrecht,€3K - €4K (Employer est.),De Volksbank3.7 ★
Assistent Controller | Nuenen | 32-40 uur | Finance en Control,"Plaats
Utrecht, Croeselaan 1
Werktijden
36 uur
Education
HBO
 €2.672,04 tot €4.110,84
Zo ziet jouw baan eruit
In deze functie maak je onderdeel uit van het ExCo-secretariaat van de Volksbank in Utrecht. Je bent de secretariële, organisatorische en administratieve steun en toeverlaat van de CFO van de Volksbank. Dankzij jou kan de CFO zowel de bestuurlijke activiteiten als de activiteiten voor de financiële kolom effectief en efficiënt uitvoeren. Daarnaast ben je sparringpartner voor de collega’s op het ExCo-secretariaat en neem je actief de lead bij de organisatie van allerlei dialogen voor het Finance Leadership Team.

Je bent zowel de rechterhand als linkerhand van onze CFO. Je bent verantwoordelijk voor het (complex) agendabeheer van de CFO en bent het visitekaartje van de afdeling Finance en het ExCo-secretariaat. Je zorgt dat interne en externe aangelegenheden voor de CFO tot in de puntjes zijn georganiseerd en ontvangt eventuele gasten. Tevens ben je spin-in-het-web met de contacten voor de CFO met de diverse toezichthouders, externe accountant en commissarissen. Daarnaast draag je bij aan de communicatie binnen het LT-Finance.


Je helpt mee/coördineert de logistieke processen van (externe) bijeenkomsten voor Investor Relations. Tevens draag je zorg voor de administratieve afhandeling van facturen, HR-zaken namens de CFO en bewaak je de actiepunten vanuit de diverse overleggen van de CFO. Het is een pré als je bekend bent met de financiële (jaar-) processen binnen een corporate organisatie. Je werkt in een duo met een van de andere ExCo-secretaresses en helpt en vervangt elkaar daar waar nodig. Binnen het secretariaat ben je elkaars sparringpartner, er is geen uitdaging je te groot.


Jouw kwaliteiten
We zijn op zoek naar een teamspeler die ook zelfstandig goed zijn of haar weg weet te vinden. Je weet snel te schakelen, bent accuraat en flexibel; kortom je ziet het als een uitdaging om in een hectische omgeving te werken, denkt in oplossingen en vindt het leuk mee te denken en zaken met een frisse blik te bekijken.

Je bent benaderbaar en trekt zaken naar je toe. Je toont initiatief, bent proactief en je voelt daarbij goed aan wanneer zaken nog afgestemd dienen te worden. Je bent stressbestendig en kunt goed relativeren. Je hebt te maken met informatie van vertrouwelijke aard en weet daar goed mee om te gaan. Kun je ook nog goed plannen en organiseren en beheers je de Engelse taal in woord en geschrift? Dan maken we graag kennis met jou!

Verder heb je:
Een afgeronde (secretariële) opleiding, minimaal HBO werk- en denkniveau en minimaal 5-10 jaar werkzaam als directiesecretaresse of assistant voor de RvB/directie in een (financiële) corporate organisatie; werkervaring in de verzekerings-/ bankwereld is een pré;
Uitstekende beheersing van de Nederlandse en Engelse taal in woord en geschrift;
Uitstekende beheersing van Outlook, iBabs en ruim voldoende beheersing van alle MS Office applicaties en SharePoint;
Daarnaast ben digital savvy;
Je bent proactief, opgewekt van aard en draagt bij aan een positieve werksfeer.
Ben je beschikbaar voor 36 uur (32-uur is eventueel bespreekbaar); kan je werken op de vrijdagen en ben je bereid om 50% op kantoor te werken.
Hier kom je te werken
Het ExCo-secretariaat bestaat uit de Management Assistants van de verschillende ExCo-leden en de chauffeurs van de ExCo-leden. Binnen het ExCo-secretariaat werken we in duo van MA’s, waarbij elk duo meerdere ExCo-leden gezamenlijk/ of bij afwezigheid zal ondersteunen. Het ExCo-secretariaat is een divers team met veel ervaring, dat op een prettige en constructieve manier met elkaar samenwerkt. Van elkaar leren en open communiceren zijn belangrijke kernwaarden van dit team.

Wat krijg je van ons?

Het salaris voor deze functie ligt tussen de € 2.672,04- en € 4.110,84,- bruto per maand op basis van 36 uur per week. Daarnaast kun je rekenen op:
Een 36-urige werkweek, flexibel in te delen met bijvoorbeeld 4x9;
Een individueel keuzebudget (IKB), waarmee je zelf kiest wanneer je jouw vakantiegeld en dertiende maand ontvangt;
Een goede collectieve pensioenregeling, met een inleg van de Volksbank van 22.5% van de salarissen;
Thuiswerken is bij ons heel normaal;
Een persoonlijk opleidingsbudget van 750 euro per jaar, naast de standaard opleidingsmogelijkheden;
Een thuiswerkvergoeding van 40 euro netto per maand en iedere 5 jaar een budget van 900 euro om jouw thuiswerkplek in te richten;
29 verlof dagen o.b.v. fulltime dienstverband ongeacht je leeftijd.
Een NS-Business Card én een vergoeding per km als je naar werk fietst;
Een fietsplan om voordelig een fiets aan te schaffen;
Gedeeltelijk doorbetaald vrijwilligerswerk;
Een vitaliteitsprogramma met workshops en coaching voor jouw mentale en fysieke gezondheid;
Een laptop en telefoon.
Word jij onze nieuwe collega?
We nodigen je van harte uit om te solliciteren. En alvast één gouden tip: wees jezelf. Wij omarmen de diversiteit van al onze collega’s en zijn oprecht benieuwd naar jou. Upload je motivatie en cv via de sollicitatiebutton. We nemen dan zo snel mogelijk contact met je op.


Voor meer informatie over de sollicitatieprocedure kun je terecht bij Celine Le, recruiter, via WhatsApp op 06 – 83 49 24 54 of via celine.le@devolksbank.nl. Ons sollicitatieproces bestaat uit twee gesprekken en een online assessment. Heb je vragen over de functie? Neem dan contact op met Caroline van Deventer via 06-22 76 47 83.

Wij werken op een prettige manier samen met een aantal preferred suppliers. Acquisitie wordt daarom niet op prijs gesteld.
#hybride #LI-CL1
Solliciteren
Vacature opslaan
Management Assistent CFO to cart",https://media.glassdoor.com/sql/1603673/veldsink-advies-squarelogo-1588086592674.png,Nuenen,nan,Veldsink Groep BV5.0 ★
Finance & IT trainee,"Wij zijn Veldsink Groep! Een bedrijf dat bestaat uit meerdere ondernemingen en waar ruim 1400 medewerkers werkzaam zijn. We zijn een sterk groeiend familiebedrijf dat sinds 1979 onafhankelijk financieel advies aanbiedt. Wil jij deel uitmaken van een dynamisch team dat de financiële spil is voor onze prachtige bedrijven binnen de gehele Veldsink groep? Wij gaan deze mooie uitdaging graag met jou aan!
Jouw job!
Ter versterking van het team Financial Control van de afdeling Finance zijn we op zoek naar een ambitieuze Assistent Controller. Samen met het team ben je verantwoordelijk voor de Financial Control van meer dan 150 bedrijven binnen de Veldsink Groep. Je zorgt ervoor dat de financiële informatie compleet, tijdig en efficiënt geregistreerd en gerapporteerd wordt. Daarvoor is het van belang dat je proactief en communicatief vaardig bent richting de verschillende stakeholders. De dynamiek spat van onze organisatie af. We zijn altijd in beweging en werken samen voor het hoogst haalbare resultaat. Je ondersteunt de financial controllers en levert zo een significante bijdrage aan het inzicht in de cijfers en prestaties van de verschillende bedrijven binnen de Veldsink Groep.
Je wordt verantwoordelijk voor:
Het voorzien in de informatiebehoefte van financial control;
Het voorbereiden van de maandafsluiting en opstellen periodieke rapportages;
Beheer van het grootboek en controle van tussenrekeningen;
Het opstellen van afrekeningen;
Het opstellen van balansdossiers;
Het optimaliseren van financiële processen;
Het dagelijks betalingsverkeer;
De uniformiteit van de registratie van financiële feiten.

Jij bent een gedreven financial en krijgt energie van werken in een dynamische werkomgeving. Daarnaast werk je graag nauwkeurig en gestructureerd. De komende jaren wil jij jezelf ontwikkelen en daar krijg je bij ons alle mogelijkheden voor. Verder herken jij jezelf in het volgende:
Je hebt een afgeronde hbo opleiding op economisch/financieel gebied;
Je hebt enkele jaren ervaring als Assistent Controller (ook starters zijn van harte welkom om te solliciteren);
Je bent enthousiast en initiatiefrijk;
Je bent accuraat, resultaat- en kwaliteitsgericht;
Je bent 24 tot 40 uur per week (parttime of fulltime) beschikbaar;
Je hebt ruimte ervaring en kennis van Microsoft Excel.

Voorop staat dat we het belangrijk vinden dat onze medewerkers kunnen groeien, dus jouw persoonlijke en professionele ontwikkeling faciliteren we middels de Veldsink Academy. Uiteraard gaan we uit van jouw kwaliteiten en willen van je leren. Tegelijkertijd bieden we je ook onze eigen kennis en expertise aan en hebben we veel aandacht voor jou als persoon. We investeren op die manier in jou als onze nieuwe collega en gaan voor een langdurige samenwerking. Het betreft een parttime of fulltime baan waarbij je terecht komt in een (h)echt en informeel team. Je komt te werken op onze Veldsink Campus in Nuenen (naast Eindhoven, Noord-Brabant).
Waar je aan mag denken met betrekking tot onze arbeidsvoorwaarden? Naast je loon ontvang je een goed pensioen, 29 vakantiedagen, een reiskostenvergoeding, de mogelijkheid om thuis te werken (inclusief thuiswerkplek en een thuiswerkvergoeding) én via Veldsink Groep kun je voordeliger sporten door de kosten van je sport abonnement door te geven aan ons!
Wie zijn wij?
Veldsink Groep is een familiebedrijf dat al sinds 1979 actief is binnen de financiële- en arbodienstverlening. Wat in 1979 begon met één advieskantoor (Veldsink Advies Nuenen), is inmiddels uitgegroeid tot een groep met meerdere bedrijven die samen de schakels binnen onze (keten)dienstverlening vormen binnen de financiële dienstverlening. De warmte, nuchterheid en betrokkenheid is hier dagelijks voelbaar en daar zijn we trots op. We groeien door ons ondernemerschap, gedrevenheid en door het feit dat alle medewerkers de kans krijgen zich optimaal te ontwikkelen.

Spreken de vacature en onze manier van werken jou aan? Dan kijken we er naar uit om kennis met je te maken. Stuur je CV en motivatiebrief naar onze recruiter Nikki Hermans via recruitment@veldsinkgroep.nl en we nemen contact met je op! Mocht je vragen hebben of meer informatie nodig hebben, dan kun je Nikki bereiken via 06-38908055.
Wij stellen het op prijs als bedrijven ervan afzien om naar aanleiding van deze advertentie ongevraagd hun diensten aan te bieden.",https://media.glassdoor.com/sql/3015427/swap-support-squarelogo-1633082609999.png,The Hague,€2K - €3K (Employer est.),Swap Support5.0 ★
Assistent controller,"Finance & IT trainee with an attitude

Also known as Trainee BI Trouble Shooter / Trainee Financial Applications Consultant / Trainee Enterprise Performance Management (EPM) Consultant / Data puzzler / BI Consultant.
Do you want to learn how to save the day at Europe’s top companies? Such as ASML, Asics, Heijmans, Boskalis and JDE? Join us today and explore your talents.
Your life as a Swap Finance & IT trainee

A steep learning curve, together with other trainees.

In our 9-month traineeship, you combine on-the-job training with weekly sessions by experts. 4 days per week, you help our clients maintain their BI and Enterprise Performance Management environments. In a dynamic role where you explore all aspects of BI and EPM. So that you can decide which part you like best.
Together with your colleagues in The Hague, Groningen, and Santander (Spain), you truly help our clients. You ensure that they can rely on their BI and EPM applications. Also, you set up Self-Service BI so that business users can perform analyses more easily. You do this for a diverse set of national and international clients, giving you a unique opportunity to experience different companies.
And on the fifth day? Every Friday, it’s time to step away from the daily activities. And to focus on a specific training session given by an expert. These sessions cover a range of topics, from personal effectiveness to consultancy skills, from business expertise to technical skills. And, of course, the latest trends and technological developments.
Together with other trainees within the Qwinc network, you gain the skills you need to become a great consultant. And build a valuable network within Qwinc at the same time.

After the traineeship? You choose between BI and EPM. And continue to expand your skills as a Swap BI application consultant or a Swap EPM application consultant.

You are working on:

Helping customers get the most out of their EPM and BI applications.
Maintain and further develop data models and data warehouses.
Back-end BI work such as connecting different data sources and setting up integrations.
Modeling data into usable data Front-end BI tools such as Tableau or PowerBI.
Retrieving business requirements and setting up reports and dashboards based on data models.
Adjusting schedules and reports and making sure that these adjustments go live without problems.
Preparing the system so that the customer can start his month-end reporting on time.
Helping customers by analyzing and solving functional issues.
Advising our customers on performance issues.

Day by day, you gain more and more knowledge of systems and concepts, such as:
Microsoft Stack (SQL, SSAS, SSRS, PowerBI)
SAP BI/BW and SAC
Financial reporting systems, such as OneStream, SAP BPC and Group Reporting, CCH Tagetik, or Oracle EPM.
Microsoft SQL or other database programs
Agile way of working
ITIL, ASL, BISL.

No in-depth BI or EPM knowledge yet? No worries. Our experienced consultants guide you. So that you can quickly build up knowledge of the environments and all its components.
Do you have what it takes?

At Swap, we have little hierarchy and an open, informal atmosphere of entrepreneurship and personal responsibility. You happily start every day without the need of someone managing you to do your job. Because you actually like the work you do.

You have higher professional education (Bachelor’s degree), for example, in Business Administration, Economics, Data Science, IT, Finance, Security & Infrastructure, or Business IT & Management. Unless you dropped out to develop your own application. That’s ok too.
You want to learn, learn, learn.
Energetic is your middle name
As a true self-starter, you learn to plan your own work
Is your fridge stacked by date? Grocery list sorted by the supermarket floor plan? Probably, as you are very analytical.
Preferably, you are available full-time; less is negotiable.
You are fluent in English and a native Dutchie or Spaniard.
Location: The Hague or Groningen

Why work at Swap Support?

Be who you are
9-month traineeship with on-the-job training and weekly sessions by experts
A safe learning environment, coached by the best.
Build a network for life with other Qwinc trainees
Experience different organizations and business processes
Learn the ins and outs of the latest tools
Have fun with the greatest team in the world

We guarantee that financials and BI analysts meet their deadlines, by taking care of their BI and EPM systems. And turn data-driven planning & reporting into a working reality.

A challenge? Sure. That’s why we like it.

Feeling at home at the cutting edge of IT and business? Join us and develop your skills even further. Be you.
At the end of the month

You take home:

EUR 2,200 – 2,700 a month
A yearly bonus depending on Swap Support’s results
Mobility budget, laptop, and phone

Paid assessment

We want to get to know you. And your talents. Experience Swap Support during our 1-day assessment and get paid for doing so. Because we value your time.
Apply now!
Any questions? Charlotte Damen is happy to answer them. Please contact Charlotte via +31 6 82 70 23 29 or charlotte.damen@swapsupport.nl for more information.",nan,Sliedrecht,€4K - €5K (Employer est.),Vlot Logistics Sliedrecht3.5 ★
"(junior) Consultant Strategic Finance Utrecht, fulltime","Vacature Assistent controller

40 uur per week | Locatie Sliedrecht

Vlot Logistics biedt een breed pakket dienstverlening op het gebied van distributie, verhuizingen, opslag en transport. Als familiebedrijf bundelen wij 125 jaar logistieke ervaring en hebben wij zo’n 300 enthousiaste medewerkers in dienst.

Ons bedrijf groeit en daarom willen we op korte termijn ons team versterken met een spontane en enthousiaste collega die bij voorkeur 40 uur in de week beschikbaar is.

Heb jij?
Minimaal 5 jaar ervaring als Assistent Controller?
HBO Bedrijfseconomie / Accountancy, SPD of vergelijkbaar?
Goede kennis van de Nederlandse taal in woord en schrift?
Ervaring met Microsoft Dynamics (is een pré)?
Ervaring met Power BI (is een pré)?
Heel veel kennis van Microsoft Excel? (eigenlijk moet je gewoon een Master Excel zijn
Zin om flink aan te pakken?
Kan jij?
Zowel in een team als zelfstandig werken?
Flexibel zijn in veranderende omstandigheden?
Gestructureerd werken?

Kun jij alle bovenstaande vragen met ‘Ja’ beantwoorden? Dan nodigen wij je graag uit om te reageren en misschien word jij onze nieuwe collega.

Welke werkzaamheden kun je verwachten?

Je komt te werken op de afdeling Finance & Control (5 fte) op onze locatie in Sliedrecht. Deze afdeling zorgt voor de administratie, facturatie en rapportage van de gehele Vlot Logistics groep (3 locaties). Samen met de controller ben je verantwoordelijk voor het opzetten en uitvoeren van de gehele planning & control cyclus. Daarnaast zorg je voor diverse organisatie- en afdelingsrapportages. Ondersteuning bij de facturatie van de diverse werkmaatschappijen behoort ook tot de functie.

De verdeling van de werkzaamheden zal ongeveer zijn:

60% rapportages
30% facturatie
10% algemene ondersteuning controller
Wat kun je nog meer verwachten?
Een uitdagende baan bij een betrokken werkgever.
Een tijdelijke arbeidsovereenkomst met uitzicht op vast dienstverband.
Salaris tussen de €4000 en €4500 per maand (inschaling op basis van aantoonbare werkervaring).
Vakantietoeslag van 8%.
Deelname in de pensioenregeling van het Bedrijfspensioenfonds.
Minimaal 24 vakantiedagen + 3,5 A.T.V dag (op basis van 40 uur).
Reiskostenvergoeding.
De mogelijkheid tot deels thuis werken.
Flexibele werkuren
Veel mogelijkheden om jezelf te ontwikkelen door middel van het volgen van cursussen en opleidingen.
Iedere dag gratis bedrijfsfruit.

NB. Het aanleveren van een VOG is een standaard onderdeel van de aanname procedure.

Reageren?

Ben jij enthousiast geworden en wil jij direct solliciteren? Voor inhoudelijke vragen over de functie mag je ook bellen met Jaco de Groot (recruiter): 085-0532371. We zien je reactie heel graag tegemoet!

Interesse in de functie van Assistent controller bij Vlot Logistics Sliedrecht regio Sliedrecht?
Reageer nu met je CV en motivatie via de ""solliciteer"" button.

Acquisitie naar aanleiding van deze vacature wordt niet op prijs gesteld.",https://media.glassdoor.com/sql/230602/international-criminal-court-squarelogo-1426851173165.png,Utrecht,nan,ICC Consultants3.6 ★
