profile_id,first_name,last_name,sub_title,profile_picture,background_image,profile_type,entity_urn,object_urn,birth_date,summary,location,premium,influencer,treasury_media,languages,industry,education,patents,awards,certifications,organizations,projects,publications,courses,test_scores,position_groups,volunteer_experiences,skills,network_info,related_profiles,contact_info
ametrandem,Ame,Trandem,Program Manager Europe & USA at Plastic Solutions Fund,https://media.licdn.com/dms/image/C4E03AQFAFI7ANripCQ/profile-displayphoto-shrink_800_800/0/1551696704943?e=1697673600&v=beta&t=JzbltT3jOVt8jn0zGwkMF7J6HXAbQYj0mBI-nC8RWrs,,personal,ACoAAARVZr8Bx16cz-Ad75OBRxByAROaWIqFkwc,72705727,,"I am an advocate, researcher and network coordinator who works across cultures on issues related to human rights, environmental sustainability and international development. Having worked closely with people around the globe, I’m driven to create social change through advocacy, multi-stakeholder dialogue and participatory decision-making, and the empowerment of civil society. I am skilled at crafting policy and advocacy strategies, research and documentation, mobilizing and coordinating networks and people, promoting awareness, and advocating reforms aimed at achieving systemic change. 

I have 15 years of experience working with civil society organizations on issues related to human rights, environmental justice, corporate accountability and international development. I have lived and worked at the grassroots and national levels in the Global South for 12 years, while also working with international NGOs focused on creating policy change within the international arena.

My work has appeared in Al Jazeera, BBC News, the Bangkok Post, the New York Times, the Wallstreet Journal, Reuters, the Economist, the Guardian, the Sydney Morning Herald, de Volkskrant, National Geographic, the International Bar Association, as well as in various documentaries, local newspapers and periodicals.

My areas of expertise include: policy analysis, evidence-based advocacy, strategy development and implementation, project management, strategic communications, proposal writing and fundraising strategies, capacity building trainings, community-based research, sustainable development, human rights, modern dance and choreography, geo-politics, corporate accountability, transboundary river basin management, and non-judicial grievance mechanisms. 

","{'country': 'Netherlands', 'short': 'The Hague, South Holland', 'city': 'The Hague', 'state': 'South Holland', 'default': 'The Hague, South Holland, Netherlands'}",False,False,[],"{'primary_locale': {'country': 'US', 'language': 'en'}, 'supported_locales': [{'country': 'US', 'language': 'en'}], 'profile_languages': [{'name': 'Central Khmer', 'proficiency': 'LIMITED_WORKING'}, {'name': 'Dutch', 'proficiency': 'LIMITED_WORKING'}, {'name': 'English', 'proficiency': 'NATIVE_OR_BILINGUAL'}, {'name': 'Spanish', 'proficiency': 'ELEMENTARY'}]}",Non-profit Organization Management,"[{'date': {'start': {'month': None, 'day': None, 'year': 2002}, 'end': {'month': None, 'day': None, 'year': 2003}}, 'school': {'name': 'International Institute of Social Studies (ISS) of Erasmus University Rotterdam', 'logo': 'https://media.licdn.com/dms/image/D4E0BAQGRnJ7YAFCJ9Q/company-logo_400_400/0/1688459071815/international_institute_of_social_studies_iss_of_erasmus_university_rotterdam_logo?e=1700697600&v=beta&t=H_7qghq-o0PZE8IDJ5hJSdpRcmAbBoAqqIUnKh7lxec', 'url': 'https://www.linkedin.com/school/international-institute-of-social-studies-iss-of-erasmus-university-rotterdam/'}, 'degree_name': 'MA', 'field_of_study': 'Politics of Alternative Development, Development Studies. '}, {'date': {'start': {'month': None, 'day': None, 'year': None}, 'end': {'month': None, 'day': None, 'year': None}}, 'school': {'name': 'Mount Holyoke College', 'logo': 'https://media.licdn.com/dms/image/C4D0BAQEzmpC0kltEEg/company-logo_400_400/0/1630554164183/mount_holyoke_college_logo?e=1700697600&v=beta&t=S2OMzXveA71R7qCi6XgK_s-13LGnG74vaHVu425TyHI', 'url': 'https://www.linkedin.com/school/mount-holyoke-college/'}, 'degree_name': 'BA', 'field_of_study': 'International Relations (Concentration in Human Rights)'}, {'date': {'start': {'month': None, 'day': None, 'year': None}, 'end': {'month': None, 'day': None, 'year': None}}, 'school': {'name': 'Universidad San Francisco de Quito', 'logo': 'https://media.licdn.com/dms/image/D4E0BAQG2ZEdGBfKPnQ/company-logo_400_400/0/1685560749935/usfq_logo?e=1700697600&v=beta&t=bOlhr9dWb-0_02gjsLNf421Rsae1wc56lWfsKrgZJRw', 'url': 'https://www.linkedin.com/school/usfq/'}, 'degree_name': 'University of Illinois Semester Abroad Program in Ecuador', 'field_of_study': None}, {'date': {'start': {'month': None, 'day': None, 'year': None}, 'end': {'month': None, 'day': None, 'year': None}}, 'school': {'name': 'Center for Global Education, Ausburg College', 'logo': None, 'url': None}, 'degree_name': 'Semester Abroad Program in Guatemala, El Salvador, and Nicaragua', 'field_of_study': 'Sustainable Development and Social Change in Central America'}]",[],"[{'title': 'Patrick Stewart Human Rights Scholarship', 'description': 'I did an internship with the Fundación Regional de Asesoría en Derechos Humanos (Inredh) in Quito, Ecuador, while carrying out research on Ecuadorian labor rights violations. My research and report were later presented to Patrick Stewart and Amnesty International USA.', 'issuer': 'Amnesty International USA', 'date': {'month': None, 'day': None, 'year': 1999}}, {'title': 'Sigma Iota Rho, International Relations Honor Society', 'description': None, 'issuer': 'Mount Holyoke College', 'date': {'month': None, 'day': None, 'year': None}}]",[],[],[],"[{'name': 'Offloading Risks & Avoiding Liabilities:  How Financial Institutions Consider Hydropower Risks in Laos', 'publisher': 'Focus on the Global South', 'url': 'https://focusweb.org/publications/offloading-risks-avoiding-liabilities-how-financial-institutions-consider-hydropower-risks-in-laos/', 'date': {'month': None, 'day': None, 'year': 2019}, 'authors': [{'type': 'standardizedContributor', 'first_name': 'Ame', 'last_name': 'Trandem', 'name': None, 'headline': 'Program Manager Europe & USA at Plastic Solutions Fund'}]}, {'name': 'Laos is Ignoring Significant Concerns of its Neighbors on Mekong Dams', 'publisher': 'The Nation', 'url': 'http://www.nationmultimedia.com/opinion/Laos-is-ignoring-significant-concerns-of-its-neigh-30252655.html', 'date': {'month': None, 'day': None, 'year': 2015}, 'authors': [{'type': 'standardizedContributor', 'first_name': 'Ame', 'last_name': 'Trandem', 'name': None, 'headline': 'Program Manager Europe & USA at Plastic Solutions Fund'}]}, {'name': 'Dam diplomacy on the Mekong', 'publisher': 'Phnom Penh Post', 'url': 'https://www.phnompenhpost.com/opinion/dam-diplomacy-mekong', 'date': {'month': None, 'day': None, 'year': 2015}, 'authors': [{'type': 'standardizedContributor', 'first_name': 'Ame', 'last_name': 'Trandem', 'name': None, 'headline': 'Program Manager Europe & USA at Plastic Solutions Fund'}]}, {'name': 'Laos silently side-steps scrutiny of controversial Mekong dam project', 'publisher': 'The Nation', 'url': 'http://www.nationmultimedia.com/opinion/Laos-silently-side-steps-scrutiny-of-controversial-30245453.html', 'date': {'month': None, 'day': None, 'year': 2014}, 'authors': [{'type': 'standardizedContributor', 'first_name': 'Ame', 'last_name': 'Trandem', 'name': None, 'headline': 'Program Manager Europe & USA at Plastic Solutions Fund'}]}, {'name': 'Mekong Dams Put Cambodian Food Security At Risk ', 'publisher': 'Bangkok Post', 'url': 'https://www.bangkokpost.com/opinion/opinion/373327/mekong-dams-put-cambodian-food-security-at-risk', 'date': {'month': None, 'day': None, 'year': 2013}, 'authors': [{'type': 'standardizedContributor', 'first_name': 'Ame', 'last_name': 'Trandem', 'name': None, 'headline': 'Program Manager Europe & USA at Plastic Solutions Fund'}]}, {'name': 'Lao Evades Responsibility with Dam Construction', 'publisher': 'The Nation', 'url': 'http://www.nationmultimedia.com/opinion/laos-evades-responsibility-with-dam-construction-30193861.html', 'date': {'month': None, 'day': None, 'year': 2012}, 'authors': [{'type': 'standardizedContributor', 'first_name': 'Ame', 'last_name': 'Trandem', 'name': None, 'headline': 'Program Manager Europe & USA at Plastic Solutions Fund'}]}, {'name': ""The Mekong River's Pandora Box"", 'publisher': 'Bangkok Post/Thanh Nien News/Phnom Penh Post', 'url': 'http://www.thanhniennews.com/commentaries/the-mekong-rivers-pandoras-box-13178.html', 'date': {'month': None, 'day': None, 'year': 2011}, 'authors': [{'type': 'standardizedContributor', 'first_name': 'Ame', 'last_name': 'Trandem', 'name': None, 'headline': 'Program Manager Europe & USA at Plastic Solutions Fund'}]}, {'name': 'A Vietnamese/Cambodian Transboundary Dialogue:  Impacts of Dams on the Se San River. ', 'publisher': 'Development', 'url': 'https://www.researchgate.net/publication/5219895_A_VietnameseCambodian_Transboundary_Dialogue_Impacts_of_dams_on_the_Se_San_River', 'date': {'month': None, 'day': None, 'year': 2008}, 'authors': [{'type': 'standardizedContributor', 'first_name': 'Ame', 'last_name': 'Trandem', 'name': None, 'headline': 'Program Manager Europe & USA at Plastic Solutions Fund'}]}]",[],[],"[{'company': {'id': None, 'name': 'Plastic Solutions Fund', 'logo': None, 'url': None, 'employees': {'start': None, 'end': None}}, 'date': {'start': {'month': 10, 'day': None, 'year': 2019}, 'end': {'month': None, 'day': None, 'year': None}}, 'profile_positions': [{'location': 'The Hague Area, Netherlands', 'date': {'start': {'month': 10, 'day': None, 'year': 2019}, 'end': {'month': None, 'day': None, 'year': None}}, 'company': 'Plastic Solutions Fund', 'description': 'The Plastic Solutions Fund is an international group of funders who have joined forces to tackle the plastic pollution problem. Together, we are turning the tide on plastic pollution in our oceans, rivers, land and air.\n\nRecognizing that 80% of the plastic ending up in the ocean comes from land, the Plastic Solutions Fund supports projects aimed at reducing production of single use plastic and packaging, with a focus on key drivers of system change in the plastic supply chain. \n\nThe Plastics Solutions Fund is currently supporting projects in Asia, the United States and the European Union.\n\nThe Plastic Solutions Fund is supported by Oak Foundation, Marisla Foundation, Mava Foundation, Adessium Foundation, PM Angell Foundation, Overbrook Foundation, Grace Communications Foundation, Oceans 5, among others.', 'title': 'Program Manager Europe & USA', 'employment_type': 'Full-time'}]}, {'company': {'id': 10333765, 'name': 'Focus on the Global South', 'logo': 'https://media.licdn.com/dms/image/C4D0BAQHHnUTE-OvDWg/company-logo_400_400/0/1631312208559?e=1700697600&v=beta&t=kZOUoc4lJXD8RrJ8AfDGNiCsud9XCp6KAryGgwdM1V8', 'url': 'https://www.linkedin.com/company/focus-on-the-global-south/', 'employees': {'start': 11, 'end': 50}}, 'date': {'start': {'month': 9, 'day': None, 'year': 2018}, 'end': {'month': 1, 'day': None, 'year': 2019}}, 'profile_positions': [{'location': 'The Hague Area, Netherlands', 'date': {'start': {'month': 9, 'day': None, 'year': 2018}, 'end': {'month': 1, 'day': None, 'year': 2019}}, 'company': 'Focus on the Global South', 'description': 'Primary researcher and author of a discussion paper for the activist think tank Focus on the Global South entitled “Offloading Risks & Avoiding Liabilities: How Financial Institutions Consider Hydropower Risks in Laos.”', 'title': 'Research Consultant', 'employment_type': None}]}, {'company': {'id': 277764, 'name': 'SOMO', 'logo': 'https://media.licdn.com/dms/image/C4E0BAQExlilI0GbOCA/company-logo_400_400/0/1678349849191/somo_logo?e=1700697600&v=beta&t=OAvCTYHCiiOeyaLMRdj15auv4C08TUSyd2Q_-elyMpA', 'url': 'https://www.linkedin.com/company/somo/', 'employees': {'start': 11, 'end': 50}}, 'date': {'start': {'month': None, 'day': None, 'year': 2016}, 'end': {'month': None, 'day': None, 'year': 2018}}, 'profile_positions': [{'location': 'Amsterdam Area, Netherlands', 'date': {'start': {'month': None, 'day': None, 'year': 2016}, 'end': {'month': None, 'day': None, 'year': 2018}}, 'company': 'SOMO', 'description': 'Co-coordinated the OECD Watch network, a global network of more than 100 NGOs working on holding corporations accountable and supporting access to remedy for local communities impacted by corporate activities through the OECD’s National Contact Point (NCP) system.  The Center for Research on Multinational Corporations (SOMO) hosted the network’s coordination and officially represented the civil society concerns in the OECD’s Investment Committee.', 'title': 'Network Coordinator', 'employment_type': None}]}, {'company': {'id': 768680, 'name': 'International Rivers', 'logo': 'https://media.licdn.com/dms/image/C560BAQGFVsoSKq5M6w/company-logo_400_400/0/1630589365446/international_rivers_logo?e=1700697600&v=beta&t=5s5H-2tQHp-_gupjuKl9VtVq7Eo27UbeTZA4UKllArc', 'url': 'https://www.linkedin.com/company/international-rivers/', 'employees': {'start': 11, 'end': 50}}, 'date': {'start': {'month': None, 'day': None, 'year': 2010}, 'end': {'month': None, 'day': None, 'year': 2015}}, 'profile_positions': [{'location': 'Southeast Asia', 'date': {'start': {'month': None, 'day': None, 'year': 2011}, 'end': {'month': None, 'day': None, 'year': 2015}}, 'company': 'International Rivers', 'description': 'Oversaw the Southeast Asia regional office and its campaigns, financial management and program aiming to protect the Mekong River Basin and its natural resources from destructive hydropower development.', 'title': 'Southeast Asia Program Director', 'employment_type': None}, {'location': 'Southeast Asia', 'date': {'start': {'month': None, 'day': None, 'year': 2010}, 'end': {'month': None, 'day': None, 'year': 2011}}, 'company': 'International Rivers', 'description': 'Coordinated and led an international campaign to protect the Mekong River from plans to build large mainstream dams through advocacy, networking, communications outreach and capacity building.', 'title': 'Mekong Campaigner', 'employment_type': None}]}, {'company': {'id': None, 'name': 'The NGO Forum on Cambodia', 'logo': None, 'url': None, 'employees': {'start': None, 'end': None}}, 'date': {'start': {'month': None, 'day': None, 'year': 2008}, 'end': {'month': None, 'day': None, 'year': 2010}}, 'profile_positions': [{'location': 'Phnom Penh, Cambodia', 'date': {'start': {'month': None, 'day': None, 'year': 2010}, 'end': {'month': None, 'day': None, 'year': 2010}}, 'company': 'The NGO Forum on Cambodia', 'description': 'Provided technical advice, capacity building and coordination support for three project teams focused on environmental and human rights issues related to coal-fired power plants, pesticides and sustainable agriculture, climate change, and hydropower dams.', 'title': 'Environment Programme Advisor', 'employment_type': None}, {'location': 'Phnom Penh, Cambodia', 'date': {'start': {'month': None, 'day': None, 'year': 2008}, 'end': {'month': None, 'day': None, 'year': 2010}}, 'company': 'The NGO Forum on Cambodia', 'description': 'Provided technical input and support into the design and implementation of the organization’s hydropower project. This included supporting the work of the Rivers Coalition in Cambodia, a coalition of local, national, and international organizations working on hydropower issues.', 'title': 'Hydropower and Community Rights Project Advisor', 'employment_type': None}]}, {'company': {'id': None, 'name': '3S Rivers Protection Network', 'logo': None, 'url': None, 'employees': {'start': None, 'end': None}}, 'date': {'start': {'month': 11, 'day': None, 'year': 2009}, 'end': {'month': 12, 'day': None, 'year': 2009}}, 'profile_positions': [{'location': 'Phnom Penh, Cambodia', 'date': {'start': {'month': 11, 'day': None, 'year': 2009}, 'end': {'month': 12, 'day': None, 'year': 2009}}, 'company': '3S Rivers Protection Network', 'description': 'Researched and authored a historical recollection report of the 3S Rivers Protection (3SPN), which documented the evolution and key achievements of the Cambodian community network over a period of eight years.', 'title': 'Research Consultant', 'employment_type': None}]}, {'company': {'id': None, 'name': '3S Rivers Protection Network', 'logo': None, 'url': None, 'employees': {'start': None, 'end': None}}, 'date': {'start': {'month': None, 'day': None, 'year': 2005}, 'end': {'month': None, 'day': None, 'year': 2008}}, 'profile_positions': [{'location': 'Banlung, Ratanakiri, Cambodia', 'date': {'start': {'month': None, 'day': None, 'year': 2005}, 'end': {'month': None, 'day': None, 'year': 2008}}, 'company': '3S Rivers Protection Network', 'description': 'Provided information, advocacy advice, capacity building and technical support to a network of 66 indigenous villages demanding remedy and the cancellation of Vietnamese hydropower projects on the Sesan and Srepok rivers that were negatively impacting downstream Cambodians.', 'title': 'Advocacy and Information Advisor', 'employment_type': None}]}, {'company': {'id': 207188, 'name': 'NIMD | Netherlands Institute for Multiparty Democracy', 'logo': 'https://media.licdn.com/dms/image/C4E0BAQHTnWY95ukjEA/company-logo_400_400/0/1630622906014/nimd_netherlands_institute_for_multiparty_democracy_logo?e=1700697600&v=beta&t=9G93_fdYmrCVNUNj4iLkvixsJjwN0zcvl_IlLrTE30I', 'url': 'https://www.linkedin.com/company/nimd-netherlands-institute-for-multiparty-democracy/', 'employees': {'start': 11, 'end': 50}}, 'date': {'start': {'month': 3, 'day': None, 'year': 2004}, 'end': {'month': 7, 'day': None, 'year': 2004}}, 'profile_positions': [{'location': 'The Hague Area, Netherlands', 'date': {'start': {'month': 3, 'day': None, 'year': 2004}, 'end': {'month': 7, 'day': None, 'year': 2004}}, 'company': 'NIMD | Netherlands Institute for Multiparty Democracy', 'description': ""This internship focused on organizing the ‘Enhancing the European Profile in Democracy\nAssistance,' which was held in July 2004 at the Peace Palace in The Hague.  The 2 day conference was organized in cooperation with the emerging European network of political party foundations and looked at how Europe viewed democracy assistance abroad, particularly in response to the US government's continued justification for its involvement in the Iraq war being about building democracy. The conference brought together the Dutch Prime Minister Jan Peter Balkenende, HRH Princess Basma Bint Talal of the Hashemite Kingdom of Jordan, Dr Madeleine Albright, former US Secretary of State, and Dr Mamphela Ramphele, Managing Director of the World Bank, among others. In conclusion, 'The Hague Statement' was produced, which called upon the European Union to\ncomplement its two foreign policy objectives, economic cooperation and security cooperation, with\na third one: democracy assistance.  In addition, to learning more about democracy assistance aboard, this internship increased my knowledge regarding the European Union and how the Dutch political system works."", 'title': 'Intern', 'employment_type': None}]}, {'company': {'id': None, 'name': 'United Students Against Swtshp', 'logo': None, 'url': None, 'employees': {'start': None, 'end': None}}, 'date': {'start': {'month': 6, 'day': None, 'year': 2000}, 'end': {'month': 9, 'day': None, 'year': 2000}}, 'profile_positions': [{'location': 'El Progreso, Honduras', 'date': {'start': {'month': 6, 'day': None, 'year': 2000}, 'end': {'month': 9, 'day': None, 'year': 2000}}, 'company': 'United Students Against Swtshp', 'description': ""Carried out field research for United Students Against Sweatshops' Workers Rights Consortium in collaboration with the Jesuit advocacy group Equipo de Reflexión, Investigación y Comunicación (ERIC) in El Progreso, Honduras involving interviews with dozens of garment factory workers. Co-authored a report detailing our findings."", 'title': 'Collegiate Apparel Research Initiative (CARI) Researcher', 'employment_type': None}]}, {'company': {'id': 2618652, 'name': 'Amnesty International USA', 'logo': 'https://media.licdn.com/dms/image/C4D0BAQF6V9st172ucw/company-logo_400_400/0/1631343023663?e=1700697600&v=beta&t=dX0kztdWtwm-7Cyqjz6pmLEa_4nRkY3cC8QWE3H5Rf8', 'url': 'https://www.linkedin.com/company/amnesty-international-usa/', 'employees': {'start': 51, 'end': 200}}, 'date': {'start': {'month': 6, 'day': None, 'year': 1999}, 'end': {'month': 8, 'day': None, 'year': 1999}}, 'profile_positions': [{'location': 'Quito, Ecuador', 'date': {'start': {'month': 6, 'day': None, 'year': 1999}, 'end': {'month': 8, 'day': None, 'year': 1999}}, 'company': 'Amnesty International USA', 'description': 'As a Patrick Stewart Human Rights Scholar for Amnesty International, I carried out research on cases of the arbitrary detention and torture of labor rights activists in Ecuador in collaboration with the Ecuadorian human rights NGO INREDH (La Fundación Regional de Asesoría en Derechos Humanos).', 'title': 'Patrick Stewart Human Rights Scholar', 'employment_type': None}]}]","[{'date': {'start': {'month': None, 'day': None, 'year': 2010}, 'end': {'month': 6, 'day': None, 'year': 2022}}, 'role': 'Board of Directors', 'company': {'id': None, 'name': '3S Rivers Protection Network (3SPN)', 'logo': None, 'url': None}, 'cause': 'HUMAN_RIGHTS', 'description': '3SPN is a community based network located in Banlung, Cambodia that works to empower local communities to claim their rights in decisions made over development projects, while protecting the natural resources that sustain their livelihoods . https://3spn.org/'}, {'date': {'start': {'month': 3, 'day': None, 'year': 2019}, 'end': {'month': None, 'day': None, 'year': None}}, 'role': 'Region Specialist Asia Volunteer', 'company': {'id': None, 'name': 'Het Actiefonds', 'logo': 'https://media.licdn.com/dms/image/C560BAQFmLAgqAuAL_Q/company-logo_400_400/0/1630600860428?e=1700697600&v=beta&t=QZdlw8y_t1JLj-crK-J1vLB40_xPmkDLc6II4oYyn8k', 'url': 'https://www.linkedin.com/company/het-actiefonds/'}, 'cause': 'HUMAN_RIGHTS', 'description': 'Het X-Y Actiefonds is an independent and progressive funding organisation that provides financial and political support for social movements and grassroots groups all over the world, in their struggle for social justice, political emancipation and sustainable development. I volunteer with the Asia section, which is responsible for evaluating project proposals and promoting the grant opportunities within Asia. '}]","['NGOs', 'Capacity Building', 'International Development', 'Human Rights', 'Policy Analysis', 'Public Policy', 'Policy', 'Climate Change', 'Research', 'Nonprofits', 'International Relations', 'Sustainable Development', 'Sustainability', 'Civil Society', 'Environmental Awareness', 'Corporate Social Responsibility', 'Rural Development', 'Environmental Policy', 'Report Writing', 'Stakeholder Engagement']",,,
