profile_id,first_name,last_name,sub_title,profile_picture,background_image,profile_type,entity_urn,object_urn,birth_date,summary,location,premium,influencer,treasury_media,languages,industry,education,patents,awards,certifications,organizations,projects,publications,courses,test_scores,position_groups,volunteer_experiences,skills,network_info,related_profiles,contact_info
harry-scheper-2386105,Harry,Scheper,HS Advies,https://media.licdn.com/dms/image/C4E03AQEXkr2B1z5oDA/profile-displayphoto-shrink_800_800/0/1668075558198?e=1697673600&v=beta&t=Djuj_Vtk8hPPtyBVglhGirB_FiOTiCxYCnVmQWrlkZo,https://media.licdn.com/dms/image/C4E16AQHLO8N7bhOmiw/profile-displaybackgroundimage-shrink_350_1400/0/1668075525569?e=1697673600&v=beta&t=RyWsndSu83dRKLTYw0VV1yYn9kpaCmc4AXFhlay83gI,personal,ACoAAAD66kwB5ozooMvhPXSEgS5CB-F7X7U1F2k,16443980,,"Stimulating young people, team building , target driven, reorgs
business building, entrepeneur, trading,sales , finding new business. portofolio management
investment advisor  ( senior certificate from DSI) Options , Equities 

Specialties: Execution , sales, sales trading,  building network, client relationship, trading in European and USA equities, experience  in Algo trades , block trades,  programe trades and block trades. USA/ADR trading, proptrading, account manager, sales manager,set up brokerage from front to back end. translate research in ideas to create opportunities . Head of European operation , either equity and Options . large experience in building a new firm ,  handle Mifid2 questions and AFM DNB . Approved for DNB and AFM , meeting all requirements. Compliance for DNB/ AFM.Supervisory Skills, 
Data Management, asset management , wealth management, senior equity trader. large experience with DMA networks, senior execution trader .
Multitasking, setting up sales strategy.  County manager for start up in the Netherlands . broad interest and experience with CRYPTO trading and sales","{'country': 'Netherlands', 'short': 'Amsterdam, North Holland', 'city': 'Amsterdam', 'state': 'North Holland', 'default': 'Amsterdam, North Holland, Netherlands'}",False,False,[],"{'primary_locale': {'country': 'US', 'language': 'en'}, 'supported_locales': [{'country': 'US', 'language': 'en'}], 'profile_languages': [{'name': 'English', 'proficiency': 'FULL_PROFESSIONAL'}, {'name': 'French', 'proficiency': 'LIMITED_WORKING'}, {'name': 'German', 'proficiency': 'PROFESSIONAL_WORKING'}]}",Financial Services,"[{'date': {'start': {'month': None, 'day': None, 'year': None}, 'end': {'month': None, 'day': None, 'year': None}}, 'school': {'name': 'NIBE', 'logo': None, 'url': None}, 'degree_name': 'senior beleggingsadviseur/handelaar', 'field_of_study': None}, {'date': {'start': {'month': None, 'day': None, 'year': 1990}, 'end': {'month': None, 'day': None, 'year': 1990}}, 'school': {'name': 'Chicago option institute CBOE', 'logo': None, 'url': None}, 'degree_name': 'senior trader', 'field_of_study': 'option valuation'}]",[],[],"[{'name': 'Kandidaat beurgemachtigde', 'date': {'start': {'month': 1, 'day': None, 'year': 1990}, 'end': {'month': None, 'day': None, 'year': None}}, 'authority': 'NIBE-SVV opleider voor de financiële dienstverlening', 'url': None, 'license_number': None, 'display_source': None, 'company': {'id': None, 'name': 'NIBE-SVV Opleidingen\u200e', 'logo': 'https://media.licdn.com/dms/image/C560BAQG3pCjzgOWzpQ/company-logo_400_400/0/1519856311035?e=1700697600&v=beta&t=6ah1mzMjRsbdTda3GeNk8SEPplcIex3HuX7Hn2Ow1rE', 'url': None}}, {'name': 'authorized option trader', 'date': {'start': {'month': 5, 'day': None, 'year': 1987}, 'end': {'month': None, 'day': None, 'year': None}}, 'authority': 'Euronext', 'url': None, 'license_number': None, 'display_source': None, 'company': {'id': None, 'name': 'Euronext', 'logo': 'https://media.licdn.com/dms/image/D4E0BAQFL3TSeRF4p7w/company-logo_400_400/0/1680277206041?e=1700697600&v=beta&t=sU8fVuSgUMK6Gz360-jRS0ujRUzxKqztG3VD_hElnRU', 'url': None}}, {'name': 'Senior effectenhandelaar', 'date': {'start': {'month': None, 'day': None, 'year': None}, 'end': {'month': None, 'day': None, 'year': None}}, 'authority': 'PIT 2010 DSI', 'url': None, 'license_number': None, 'display_source': None, 'company': None}, {'name': 'senior beleggingsadviseur', 'date': {'start': {'month': None, 'day': None, 'year': None}, 'end': {'month': None, 'day': None, 'year': None}}, 'authority': 'PIT 2010 DSI', 'url': None, 'license_number': None, 'display_source': None, 'company': None}]",[],[],[],[],[],"[{'company': {'id': 86184617, 'name': 'Signally.tech', 'logo': 'https://media.licdn.com/dms/image/C4E0BAQGUs9FGUmfN1g/company-logo_400_400/0/1653399682851?e=1700697600&v=beta&t=7aix9v-pOHW5MUUpXTI4y06soIvhq-DysoYZhGIHOqc', 'url': 'https://www.linkedin.com/company/signally-tech/', 'employees': {'start': 2, 'end': 10}}, 'date': {'start': {'month': 6, 'day': None, 'year': 2021}, 'end': {'month': None, 'day': None, 'year': None}}, 'profile_positions': [{'location': 'Amsterdam, North Holland, Netherlands', 'date': {'start': {'month': 6, 'day': None, 'year': 2021}, 'end': {'month': None, 'day': None, 'year': None}}, 'company': 'Signally.tech', 'description': 'www.signally.tech', 'title': 'Founding Partner', 'employment_type': 'Self-employed'}]}, {'company': {'id': None, 'name': 'H.Scheper Beheer  bv ', 'logo': None, 'url': None, 'employees': {'start': None, 'end': None}}, 'date': {'start': {'month': 12, 'day': None, 'year': 2020}, 'end': {'month': None, 'day': None, 'year': None}}, 'profile_positions': [{'location': 'Amsterdam, North Holland, Netherlands', 'date': {'start': {'month': 12, 'day': None, 'year': 2020}, 'end': {'month': None, 'day': None, 'year': None}}, 'company': 'H.Scheper Beheer  bv ', 'description': None, 'title': 'CEO/owner', 'employment_type': 'Full-time'}]}, {'company': {'id': None, 'name': 'Self-employed', 'logo': None, 'url': None, 'employees': {'start': None, 'end': None}}, 'date': {'start': {'month': 6, 'day': None, 'year': 2022}, 'end': {'month': None, 'day': None, 'year': None}}, 'profile_positions': [{'location': 'Amsterdam Area, Netherlands', 'date': {'start': {'month': 6, 'day': None, 'year': 2022}, 'end': {'month': None, 'day': None, 'year': None}}, 'company': 'Self-employed', 'description': 'advisory for finacial problems, on trading , broking , structures', 'title': 'Harry Scheper Advies', 'employment_type': 'Self-employed'}]}, {'company': {'id': 2339594, 'name': 'EXANTE', 'logo': 'https://media.licdn.com/dms/image/C4D0BAQH-x-08aJ5lQQ/company-logo_400_400/0/1625563468958?e=1700697600&v=beta&t=5nxjMAoP1no5cnxf76F7M47OhW4H5DcNe3Z8rgyT39c', 'url': 'https://www.linkedin.com/company/exante-ltd/', 'employees': {'start': 501, 'end': 1000}}, 'date': {'start': {'month': None, 'day': None, 'year': 2020}, 'end': {'month': 11, 'day': None, 'year': 2020}}, 'profile_positions': [{'location': 'Amsterdam, North Holland, Netherlands', 'date': {'start': {'month': None, 'day': None, 'year': 2020}, 'end': {'month': 11, 'day': None, 'year': 2020}}, 'company': 'EXANTE', 'description': None, 'title': 'Senior Account Manager', 'employment_type': 'Full-time'}]}, {'company': {'id': 303271, 'name': 'ABR Financial', 'logo': 'https://media.licdn.com/dms/image/C560BAQGWmfICXInALA/company-logo_400_400/0/1519891752146?e=1700697600&v=beta&t=fua4bqq6VRrPbjhpAfHd3mIRtQ0ya_3F5MyAJ7TPQ6o', 'url': 'https://www.linkedin.com/company/abr-financial/', 'employees': {'start': 2, 'end': 10}}, 'date': {'start': {'month': 3, 'day': None, 'year': 2013}, 'end': {'month': 12, 'day': None, 'year': 2019}}, 'profile_positions': [{'location': 'Amsterdam', 'date': {'start': {'month': 3, 'day': None, 'year': 2013}, 'end': {'month': 12, 'day': None, 'year': 2019}}, 'company': 'Closed', 'description': 'Building the business at ABR , setting up a network from clients , brokers, and people to share information in both equity as well as bonds. Being a sales trader  and act like a spider in his web ,always focused on market- moving news..Advisor for investments for clients .Event driven ideas.\nGenerating ideas for own books, proptrading . Event driven .  Working as Managing director for ABR a regulated firm  (AFM and DNB) consist of , compliance , budgettering and management and other tasks to meet requirements from regulator. Head of european operation  , for options and equity.  Expirience with setting up new firms and structures  in financial , broking , HFT etc. Equity , derivates , bonds . futures.', 'title': 'Managing Director', 'employment_type': None}]}, {'company': {'id': 22047680, 'name': 'AMSTEL SECURITIES LLP', 'logo': 'https://media.licdn.com/dms/image/C560BAQGPF4ZCnT9jgg/company-logo_400_400/0/1519866855202?e=1700697600&v=beta&t=98qGZaBxpi544DB6aOcZKHhx0TZo3AV9KyXXbN7njWk', 'url': 'https://www.linkedin.com/company/amstel-securities-llp/', 'employees': {'start': 2, 'end': 10}}, 'date': {'start': {'month': 2, 'day': None, 'year': 2010}, 'end': {'month': 2, 'day': None, 'year': 2013}}, 'profile_positions': [{'location': 'Amsterdam Area, Netherlands', 'date': {'start': {'month': 2, 'day': None, 'year': 2010}, 'end': {'month': 2, 'day': None, 'year': 2013}}, 'company': 'AMSTEL SECURITIES LLP', 'description': 'setting up DMA systems , algo trades, ideas for clients , trading for clients , focus on pan  european equity , expand client base .providing clients with information , backgrounds . training juniors. and talking to clients on Phil/indo bonds in coop with  coll. programme trades, blocktrades, options, and derivatives execution and sales.', 'title': 'Head of equity sales and trading', 'employment_type': None}]}, {'company': {'id': 25181480, 'name': 'InsingerGilissen | A Quintet Private Bank', 'logo': 'https://media.licdn.com/dms/image/C4E0BAQEQA916upPPFA/company-logo_400_400/0/1660138868485?e=1700697600&v=beta&t=GQYjxtx0BIA9YPEP49L4XcaMWwDgeIKFLBX2U71rYvE', 'url': 'https://www.linkedin.com/company/insingergilissen/', 'employees': {'start': 201, 'end': 500}}, 'date': {'start': {'month': 4, 'day': None, 'year': 1996}, 'end': {'month': 9, 'day': None, 'year': 2009}}, 'profile_positions': [{'location': 'Amsterdam', 'date': {'start': {'month': 4, 'day': None, 'year': 1996}, 'end': {'month': 9, 'day': None, 'year': 2009}}, 'company': 'InsingerGilissen | A Quintet Private Bank', 'description': 'Trading equities and bonds , Europe broker , set DMA for dealing and \nfix lines. Tradingmanager for Euronext . setting up and processing execution desks , implanting new tradings and BO systems, risk control, implanting and controling DSI regulations. advisor for investments for clients. USA/ADR trader', 'title': 'Head european salestrading', 'employment_type': None}]}, {'company': {'id': 59716185, 'name': 'Insinger de Beaufort Bank', 'logo': None, 'url': 'https://www.linkedin.com/company/insinger-de-beaufort-bank/', 'employees': {'start': None, 'end': None}}, 'date': {'start': {'month': None, 'day': None, 'year': 1996}, 'end': {'month': 9, 'day': None, 'year': 2009}}, 'profile_positions': [{'location': 'Amsterdam', 'date': {'start': {'month': None, 'day': None, 'year': 1996}, 'end': {'month': 9, 'day': None, 'year': 2009}}, 'company': 'Insinger de Beaufort Bank', 'description': 'broking european equity and bonds. ADR and USA trading , prop business , private client execution ,building trading platform  , setting up European broker network. also for USA accounts and ADR trading . advisor for investments. managing department, motivating and stimulating people', 'title': 'Head of european salestrading', 'employment_type': None}]}, {'company': {'id': 1508, 'name': 'BNP Paribas', 'logo': 'https://media.licdn.com/dms/image/C4E0BAQGaPfduOoKCJA/company-logo_400_400/0/1669711365188?e=1700697600&v=beta&t=dss3d4Fb9VJvNWmgAecHE0VaGvAJ8CQ_rwwCehJuQXU', 'url': 'https://www.linkedin.com/company/bnp-paribas/', 'employees': {'start': 10001, 'end': None}}, 'date': {'start': {'month': 1, 'day': None, 'year': 1984}, 'end': {'month': 4, 'day': None, 'year': 1996}}, 'profile_positions': [{'location': 'Amsterdam/London', 'date': {'start': {'month': 1, 'day': None, 'year': 1984}, 'end': {'month': 4, 'day': None, 'year': 1996}}, 'company': 'BNP Paribas', 'description': 'Worked  12 year for  Paribas , in Amsterdam , London, on various postions . trading options, head optionexchange, investment strategist, head of arbitrage, ADR trading . responsible for company investments traded on daily base.\nproptrading , generating trading ideas.', 'title': 'Head of arbitrage USA/ADR', 'employment_type': None}]}]",[],"['Customer Relations', 'Trading', 'Equities', 'Program Management', 'Bonds', 'Derivatives', 'Commodities', 'Strategic Planning', 'Portfolio Management', 'Change Management', 'Options', 'Trading Systems', 'Customer Service', 'Hedge Funds', 'Budgeting', 'Bloomberg', 'Team Building', 'Equity Derivatives', 'Negotiation', 'Business Analysis']",,,
