profile_id,first_name,last_name,sub_title,profile_picture,background_image,profile_type,entity_urn,object_urn,birth_date,summary,location,premium,influencer,treasury_media,languages,industry,education,patents,awards,certifications,organizations,projects,publications,courses,test_scores,position_groups,volunteer_experiences,skills,network_info,related_profiles,contact_info
maaike-le-grand-92066514,Maaike,Le Grand,Retiree at Life itself,https://media.licdn.com/dms/image/C4D03AQFLc7yONIAReA/profile-displayphoto-shrink_800_800/0/1516537317799?e=1697673600&v=beta&t=ZAdoZ96F3mrReSAgQ6BKbXfmn3_AzOw540K40Hkfbw8,,personal,ACoAAALx1OgB1Kar-l1WNSQYrhg3k2u2lYNsC6w,49403112,,"Teamleader with substantial experience in both the Dutch High School environment, and the volunteer driven World Bank Family Network in a multicultural environment. Strong knowledge of all aspects of management, liaising with multiple partners,  motivation of team members. Focus on refinement and development of new programs as suited for changing membership.

Specialties: Skills: Interpersonal/Intercultural Understanding, Oral & Written Communication in Dutch, French, English; Organization & Program Development; Curriculum Design;Newsletter Management; Teaching & Tutoring;Event Planning; and, Computer skills

Languages: Fluent in Dutch (native), French , English
Proficient in German, Spanish; 

Global Experience: Lived in Indonesia, Cameroun, Netherlands, Belgium, USA
Traveled extensively through China, India, Indonesia, Europe, South-America, and USA","{'country': None, 'short': 'Netherlands', 'city': None, 'state': None, 'default': 'Netherlands'}",False,False,[],"{'primary_locale': {'country': 'US', 'language': 'en'}, 'supported_locales': [{'country': 'US', 'language': 'en'}], 'profile_languages': []}",Individual & Family Services,"[{'date': {'start': {'month': None, 'day': None, 'year': 1975}, 'end': {'month': None, 'day': None, 'year': 1981}}, 'school': {'name': 'University of Amsterdam', 'logo': 'https://media.licdn.com/dms/image/C4E0BAQEfHBj_we-_kw/company-logo_400_400/0/1659945104460?e=1700697600&v=beta&t=k8egLWP3eIqIloLFULSmlLPZQR7cvpzTKHpzgtnWaBI', 'url': 'https://www.linkedin.com/school/university-of-amsterdam/'}, 'degree_name': ""Master's"", 'field_of_study': 'General Linguistics, French language & Literature'}, {'date': {'start': {'month': None, 'day': None, 'year': 1973}, 'end': {'month': None, 'day': None, 'year': 1976}}, 'school': {'name': 'University of Amsterdam', 'logo': None, 'url': None}, 'degree_name': 'Masters; Bachelors', 'field_of_study': 'French language and Literature including General Linguistics; French language and Literature'}]",[],[],[],[],[],[],[],[],"[{'company': {'id': None, 'name': 'Life itself', 'logo': None, 'url': None, 'employees': {'start': None, 'end': None}}, 'date': {'start': {'month': 7, 'day': None, 'year': 2014}, 'end': {'month': None, 'day': None, 'year': None}}, 'profile_positions': [{'location': 'everywhere', 'date': {'start': {'month': 7, 'day': None, 'year': 2014}, 'end': {'month': None, 'day': None, 'year': None}}, 'company': 'Life itself', 'description': 'Retiree, enjoying life in what it has to offer\nFriends, travel, reading, discussions, music, and its experiences\nThe difficult ones and the good ones', 'title': 'Retiree', 'employment_type': None}]}, {'company': {'id': None, 'name': 'World Bank Family Network', 'logo': None, 'url': None, 'employees': {'start': None, 'end': None}}, 'date': {'start': {'month': 7, 'day': None, 'year': 2008}, 'end': {'month': None, 'day': None, 'year': None}}, 'profile_positions': [{'location': 'Washington DC', 'date': {'start': {'month': 7, 'day': None, 'year': 2011}, 'end': {'month': None, 'day': None, 'year': None}}, 'company': 'World Bank Family Network', 'description': 'Advisor to the board, and to key activities as Welcoming, Mosaic newsletter and outreach to Members Abroad', 'title': 'Advisor', 'employment_type': None}, {'location': None, 'date': {'start': {'month': 7, 'day': None, 'year': 2010}, 'end': {'month': 7, 'day': None, 'year': 2011}}, 'company': 'World Bank Family Network', 'description': 'As President of the WBFN I lead a team that supports and welcomes WBG families in DC and abroad through multiple programs, activities, seminars and communications as a newsletter, publications and our website. Liaising with multiple partners inside and outside the WBG, as well as advocacy on behalf of our approximately 6000 members are part of the job.', 'title': 'President', 'employment_type': None}, {'location': None, 'date': {'start': {'month': 7, 'day': None, 'year': 2009}, 'end': {'month': 7, 'day': None, 'year': 2010}}, 'company': 'world bank family network', 'description': ""researching better ways to integrate newcomers to the Family Network in our activities, in a way that's both profitable to them ( they learn new skills, develop networks, establish support groups) and to our volunteer organization"", 'title': 'president-elect', 'employment_type': None}, {'location': None, 'date': {'start': {'month': 7, 'day': None, 'year': 2008}, 'end': {'month': 7, 'day': None, 'year': 2009}}, 'company': 'World Bank Family Network', 'description': 'As Welcoming Chair I led a team, we welcomed over 450 new families to the DC area.', 'title': 'Welcoming Chair', 'employment_type': None}]}, {'company': {'id': 5636, 'name': 'NATO', 'logo': 'https://media.licdn.com/dms/image/C4E0BAQEK47w4j4i5SQ/company-logo_400_400/0/1554461066550?e=1700697600&v=beta&t=EuIw6fvVhF_wUpLd6FGrB5pL4P4TK9TRzPFHw2L5aC4', 'url': 'https://www.linkedin.com/company/nato/', 'employees': {'start': 1001, 'end': 5000}}, 'date': {'start': {'month': 1, 'day': None, 'year': 2001}, 'end': {'month': 1, 'day': None, 'year': 2003}}, 'profile_positions': [{'location': None, 'date': {'start': {'month': 1, 'day': None, 'year': 2001}, 'end': {'month': 1, 'day': None, 'year': 2003}}, 'company': 'NATO', 'description': 'Permanent Representation of the Kingdom of the Netherlands at the European Commission, FRENCH TEACHER; Designed and taught weekly French classes on 4 different levels to small groups of staff members of the Embassy and NATO, with emphasis on speaking and listening comprehension \nDrafted a French diagnostic test, and developed specific language materials for the different demands, this based on capacity of the students.', 'title': 'French Teacher', 'employment_type': None}]}, {'company': {'id': None, 'name': 'Montessori Lyceum Amsterdam', 'logo': None, 'url': None, 'employees': {'start': None, 'end': None}}, 'date': {'start': {'month': 1, 'day': None, 'year': 1979}, 'end': {'month': 1, 'day': None, 'year': 2001}}, 'profile_positions': [{'location': None, 'date': {'start': {'month': 1, 'day': None, 'year': 1993}, 'end': {'month': 1, 'day': None, 'year': 2001}}, 'company': 'Montessori Lyceum Amsterdam', 'description': 'Supervised a team, consisting of 25 teachers, 6 classes (about 175 pupils) at the Montessori High School in Amsterdam\nCoordinated staff meetings, motivated colleagues , encouraged many pupils when in trouble , resolved communication problems , intervened in discussions between parents  and tutors, initiated actions in  to improve educational skills of the team', 'title': 'TEAM LEADER', 'employment_type': None}, {'location': None, 'date': {'start': {'month': 1, 'day': None, 'year': 1979}, 'end': {'month': 1, 'day': None, 'year': 2001}}, 'company': 'Montessori Lyceum Amsterdam', 'description': '2003-2005\nTaught  to all middle and high school levels and ages, tutored several classes, motivated pupils to learn new things and perform well, adjusted content and teaching style to the audience, created a feeling of trust, designed new approaches to solve problems, showed flexibility to change to the needs of the moment.\nParticipated in international exchanges with classes in Caudry, northern France.\nParticipated in a seminar on middle school electronic curriculum in Spain.', 'title': 'FRENCH TEACHER', 'employment_type': None}, {'location': None, 'date': {'start': {'month': 1, 'day': None, 'year': 1979}, 'end': {'month': 1, 'day': None, 'year': 1993}}, 'company': 'Montessori Lyceum Amsterdam', 'description': None, 'title': 'French TEACHER', 'employment_type': None}]}, {'company': {'id': None, 'name': 'NBLC, The Hague', 'logo': None, 'url': None, 'employees': {'start': None, 'end': None}}, 'date': {'start': {'month': 1, 'day': None, 'year': 1980}, 'end': {'month': 1, 'day': None, 'year': 1982}}, 'profile_positions': [{'location': None, 'date': {'start': {'month': 1, 'day': None, 'year': 1980}, 'end': {'month': 1, 'day': None, 'year': 1982}}, 'company': 'NBLC, The Hague', 'description': 'Researched  the reading problems of deaf children, advised writers and publishers on language-related complexities. This resulted in a manual* for authors for young deaf children and the publication of several new books for deaf children.', 'title': 'RESEARCHER, ADVISER', 'employment_type': None}]}]",[],"['Linguistics', 'Education', 'English', 'French', 'German', 'Dutch', 'Cross-cultural Training', 'Teaching', 'International Development', 'Public Speaking', 'Editing', 'Nonprofits', 'Program Management', 'Management Consulting', 'Research', 'Leadership', 'Community Outreach', 'Program Development', 'Intercultural Communication', 'Volunteer Management']",,,
