profile_id,first_name,last_name,sub_title,profile_picture,background_image,profile_type,entity_urn,object_urn,birth_date,summary,location,premium,influencer,treasury_media,languages,industry,education,patents,awards,certifications,organizations,projects,publications,courses,test_scores,position_groups,volunteer_experiences,skills,network_info,related_profiles,contact_info
tcheiner,TC,Heiner,Lead Software Engineer at Wells Fargo,https://media.licdn.com/dms/image/C4E03AQFa2KkEFgIEQw/profile-displayphoto-shrink_800_800/0/1516319781018?e=1697673600&v=beta&t=XZcVgy7iLxpzLKQ7lNPhDbNx2OOb1iGGuibF1fgUjO4,,personal,ACoAAAClwPcBGtuxetf3dqNzHtAN40XZG1-NfVw,10862839,,"I am looking for a position in a growing company with financial/banking, facilitating e-commerce payments or healthcare.  Interested in remote or hybrid opportunities. 

I am a hands-on enterprise banking projects (mostly in java) technical lead with project management experience onboarding and mentoring developers.  I have done hands-on coding, DevOps, project management and teach lead.  My projects have spanned from platform migrations, enhancements, upgrades (platform upgrades, compliance, security and tracking) to monitoring, analyzing platform bottlenecks and for black swan events. 

I am a tinkerer by nature.  I learn by mimicking, refine by iteration and optimize by automating repetitive processes.  I am curious about how things work and always like to try to learn by recreating what I am curious about and making it better.  

I am able to work in the Netherlands, U.S or Singapore.

My Past: 
I was born in Singapore did my Comp Sci degree in the U.S. and have recently relocated to Amsterdam. 

In college, I picked up C/C++, VB, HTML, ASP, SQL and assembly (MIPS/RISC).   

Via work, I have experience with the following stacks HTML/JS/Java/ATG to CSS/Web Portals/BEA/SVN/MVC/Spring to  React/Java/Apache/Git/CPF and have gone through many different dev tools. 

Favourite projects:
My favourite project at Wells Fargo was reverse engineering and rewriting (web services upgrade) the Personal Loans app, upgrading our backend protocol to mutual auth and implementing a batch server job that reconciles our submitted apps with fulfilment enabling the bank visibility and ability to recover lost applications (between front end submissions to back-office processing) regardless of the events leading to that failure. 

Pet projects: 
I have picked up programming languages, set up (Novell/windows network administration to Linux) servers and OSses (Linux flavours,  AWS Cloud server setups, etc.) out of plain curiosity, writing a script to automate character levelling on a MUD or a vacation home rental system (before Airbnb), hackingDebian on iMac G3 (a variant of Hackintosh) or repairing hardware devices (comfortable with breadboarding, circuit design and soldering).  

I headed the Parent-Teacher Association for 120 families.  I liaised between the families and school, hosted weekly community events, holiday events (parties and craft projects), excursions and fundraising events.  I am particularly proud that those efforts resulted in a close-knit, inclusive, engaging and productive community.","{'country': 'Netherlands', 'short': 'Amsterdam, North Holland', 'city': 'Amsterdam', 'state': 'North Holland', 'default': 'Amsterdam, North Holland, Netherlands'}",False,False,[],"{'primary_locale': {'country': 'US', 'language': 'en'}, 'supported_locales': [{'country': 'US', 'language': 'en'}], 'profile_languages': [{'name': 'Cantonese', 'proficiency': 'ELEMENTARY'}, {'name': 'English', 'proficiency': 'NATIVE_OR_BILINGUAL'}, {'name': 'Mandarin', 'proficiency': 'NATIVE_OR_BILINGUAL'}, {'name': 'Teochew', 'proficiency': 'ELEMENTARY'}]}",Mental Health Care,"[{'date': {'start': {'month': None, 'day': None, 'year': None}, 'end': {'month': None, 'day': None, 'year': None}}, 'school': {'name': 'University of Missouri-Kansas City', 'logo': 'https://media.licdn.com/dms/image/C4D0BAQH0Ws8yXJow-Q/company-logo_400_400/0/1650469003694?e=1700697600&v=beta&t=PM4q0mIOLFnf0BNesFywkFGLsbNerSrNuUNXGZZeQJw', 'url': 'https://www.linkedin.com/school/umkc/'}, 'degree_name': 'BSc', 'field_of_study': 'Computer Science'}]",[],[],[],[],[],[],[],[],"[{'company': {'id': None, 'name': 'MyndSens', 'logo': None, 'url': None, 'employees': {'start': None, 'end': None}}, 'date': {'start': {'month': 6, 'day': None, 'year': 2023}, 'end': {'month': None, 'day': None, 'year': None}}, 'profile_positions': [{'location': 'Amsterdam, North Holland, Netherlands', 'date': {'start': {'month': 6, 'day': None, 'year': 2023}, 'end': {'month': None, 'day': None, 'year': None}}, 'company': 'MyndSens', 'description': None, 'title': 'Technical Architect', 'employment_type': 'Contract'}]}, {'company': {'id': 1235, 'name': 'Wells Fargo', 'logo': 'https://media.licdn.com/dms/image/C4D0BAQGLxWPpGqaVmw/company-logo_400_400/0/1607533344544?e=1700697600&v=beta&t=f6OlpfUZ9mdtM_zW-rVgJESNeD5jdwa5ZWLA2xslLXc', 'url': 'https://www.linkedin.com/company/wellsfargo/', 'employees': {'start': 10001, 'end': None}}, 'date': {'start': {'month': 7, 'day': None, 'year': 2004}, 'end': {'month': 10, 'day': None, 'year': 2020}}, 'profile_positions': [{'location': 'San Francisco, California, United States', 'date': {'start': {'month': 7, 'day': None, 'year': 2004}, 'end': {'month': 10, 'day': None, 'year': 2020}}, 'company': 'Wells Fargo', 'description': 'The Wells Fargo Online Sales Platform sells online banking products including Home Equity, Business Deposit, Consumer Deposit, Brokerage, Personal Loans, Credit Card, and Student Loans. Across the enterprise, there is one team that has production data access due to the confidential and sensitive nature of these products. I am one of 3 key leads for the team of 8 that handles development and operations on these production systems.\no Troubleshoot platform issues in production including the rollout of U.S. Paycheck Protection Program (a $10 billion Federal loan program rolled out rapidly during the COVID crisis).\no Responsible for identifying the root cause of issues and guide teams from various cross-functional scrums/stakeholders to come up with mitigation plans and implement resolution.\no Primary contact for oversight and management of all production issues with new real-time deposits applications servicing approximately 3000 daily applications for consumer and business.\no Own the initiative to improve oversight into application drop-off rate in production for all lines of business.\n\nLead Engineer (Projects)\n- Designed and authored technical specifications of projects for Personal Loans/Deposits/Credit Card/Student Loans/Mortgage.\no Communicated architecture with UML design documents motivated by business requirements discussions with all pertinent product owners, BAs, compliance, legal, back office, etc.\no Led planning, design, resource estimation, peer review, QA test plans, release management  and deployment for multiple high visibility projects\no Managed as many as five simultaneous projects per release -- scope ranged from enhancements (security, compliance, requirement) to a complete rewrite of applications.\no Trained development team in Hyderabad, India on the maintenance queue development tasks.', 'title': 'Lead Software Engineer', 'employment_type': 'Full-time'}]}, {'company': {'id': None, 'name': 'MSN Singapore', 'logo': None, 'url': None, 'employees': {'start': None, 'end': None}}, 'date': {'start': {'month': 12, 'day': None, 'year': 2003}, 'end': {'month': 2, 'day': None, 'year': 2004}}, 'profile_positions': [{'location': None, 'date': {'start': {'month': 12, 'day': None, 'year': 2003}, 'end': {'month': 2, 'day': None, 'year': 2004}}, 'company': 'MSN Singapore', 'description': 'o Implemented architecture of featured promotions in heavy online traffic. Coordinated among teams across different time zones to deliver critical features on time. Development in ASP.', 'title': 'Developer', 'employment_type': None}]}, {'company': {'id': None, 'name': 'UserTrends', 'logo': None, 'url': None, 'employees': {'start': None, 'end': None}}, 'date': {'start': {'month': 4, 'day': None, 'year': 2001}, 'end': {'month': 6, 'day': None, 'year': 2002}}, 'profile_positions': [{'location': None, 'date': {'start': {'month': 4, 'day': None, 'year': 2001}, 'end': {'month': 6, 'day': None, 'year': 2002}}, 'company': 'UserTrends', 'description': 'oImplemented server enhancement projects, prototype e-mail campaign; created advertisements and coordinated distributions of emails to subscribers and app tools. Development in Java.', 'title': 'Software Engineer', 'employment_type': None}]}, {'company': {'id': None, 'name': 'Brightcube', 'logo': None, 'url': None, 'employees': {'start': None, 'end': None}}, 'date': {'start': {'month': 12, 'day': None, 'year': 2000}, 'end': {'month': 4, 'day': None, 'year': 2001}}, 'profile_positions': [{'location': None, 'date': {'start': {'month': 12, 'day': None, 'year': 2000}, 'end': {'month': 4, 'day': None, 'year': 2001}}, 'company': 'Brightcube', 'description': 'o Assisted in maintaining middle-tier layer in n-tier software system. Analyzed technologies for storage and imaging solutions. Led in-house team of developers in managing all websites involving ASP/SQL/COM technology. Completed enhancements to existing technologies under tight deadlines. Development primarily in ASP.', 'title': 'Software Engineer', 'employment_type': None}]}, {'company': {'id': None, 'name': 'KC Accounting                                                                                       ', 'logo': None, 'url': None, 'employees': {'start': None, 'end': None}}, 'date': {'start': {'month': None, 'day': None, 'year': 2000}, 'end': {'month': None, 'day': None, 'year': 2000}}, 'profile_positions': [{'location': 'Kansas City, Missouri, United States', 'date': {'start': {'month': None, 'day': None, 'year': 2000}, 'end': {'month': None, 'day': None, 'year': 2000}}, 'company': 'KC Accounting                                                                                       ', 'description': 'Coordinated software quality testing and analysis for account firm. Development in Visual Basic.', 'title': 'Software Analyst', 'employment_type': 'Internship'}]}, {'company': {'id': None, 'name': 'Neighborhood Watch Group                                                                            ', 'logo': None, 'url': None, 'employees': {'start': None, 'end': None}}, 'date': {'start': {'month': None, 'day': None, 'year': 2000}, 'end': {'month': None, 'day': None, 'year': 2000}}, 'profile_positions': [{'location': 'Kansas City, Missouri, United States', 'date': {'start': {'month': None, 'day': None, 'year': 2000}, 'end': {'month': None, 'day': None, 'year': 2000}}, 'company': 'Neighborhood Watch Group                                                                            ', 'description': 'Directed team of five (5) developers in creating web-based reporting logging system for neighborhood patrol group; website featured basic security features, along with search and help systems, and was installed in two Midwest states. Collected and examined data regarding criminal sightings and generated reports on potentially problematic neighborhoods. Development in ASP.', 'title': 'Web Architect ', 'employment_type': 'Internship'}]}, {'company': {'id': None, 'name': 'Johnson County Community College                                                                    ', 'logo': None, 'url': None, 'employees': {'start': None, 'end': None}}, 'date': {'start': {'month': None, 'day': None, 'year': 1999}, 'end': {'month': None, 'day': None, 'year': 1999}}, 'profile_positions': [{'location': 'Kansas City, Missouri, United States', 'date': {'start': {'month': None, 'day': None, 'year': 1999}, 'end': {'month': None, 'day': None, 'year': 1999}}, 'company': 'Johnson County Community College                                                                    ', 'description': 'Graded C++ assignments and tests, evaluated labs, and provided instruction to students.', 'title': 'C++ Teaching Assistant                                                                              ', 'employment_type': 'Part-time'}]}]",[],"['Project Planning', 'Code Review', 'Systems Design', 'Technical Design', 'Technical Architecture', 'Relational Databases', 'Back-End Web Development', 'Python (Programming Language)', 'System Administration', 'Web Applications', 'Cascading Style Sheets (CSS)', 'Web Services', 'C (Programming Language)', 'Amazon Web Services (AWS)', 'Analytics', 'Struts', 'Representational State Transfer (REST)', 'HTML', 'Hibernate', 'Object-Oriented Programming (OOP)']",,,
