profile_id,first_name,last_name,sub_title,profile_picture,background_image,profile_type,entity_urn,object_urn,birth_date,summary,location,premium,influencer,treasury_media,languages,industry,education,patents,awards,certifications,organizations,projects,publications,courses,test_scores,position_groups,volunteer_experiences,skills,network_info,related_profiles,contact_info
reinier-nijmeijer-15158818,Reinier,Nijmeijer,Independend  Consultant for Legal & Commercial Services,,,personal,ACoAAAOk-s0BBY_IAIqViOJPw2gVPA-2Js3M9Q4,61143757,,"Dutch National, Master at Law. Retired from Royal Dutch Shell in June 2016. Senior professional with commercial acumen and all-round international expertise in the upstream oil & gas industry.  After private practise enjoyed an international career with Shell in positions. Involved in all relevant aspects of upstream operations and new business development, notably in Europe, Middle East, Russia, CIS and Asia. 
Key skills/strengths: 
•	Cultural awareness: Dutch by birth, open mind, also lived in Oman, Iran, Dubai and Russia
•	Leadership: authenticity, compassion and drive with emphasis on development and delivery
•	Interpersonal and negotiating: Lead Negotiator for various Russian, ME and CIS deals
•	Commercial: VP commercial ME/CIS/Russia and leading commercial teams
•	Risk management: Joint Ventures: design, financing, execution, management and disputes
•	Compliance: setting up and implementing compliance programs (FCPA, US and EU sanctions)


","{'country': 'Netherlands', 'short': 'Voorburg, South Holland', 'city': 'Voorburg', 'state': 'South Holland', 'default': 'Voorburg, South Holland, Netherlands'}",False,False,[],"{'primary_locale': {'country': 'US', 'language': 'en'}, 'supported_locales': [{'country': 'US', 'language': 'en'}], 'profile_languages': [{'name': 'Dutch, English', 'proficiency': None}, {'name': 'French, German', 'proficiency': 'LIMITED_WORKING'}]}",Legal Services,"[{'date': {'start': {'month': None, 'day': None, 'year': None}, 'end': {'month': None, 'day': None, 'year': None}}, 'school': {'name': 'Utrecht University', 'logo': 'https://media.licdn.com/dms/image/C510BAQG6HfmPTdJKXw/company-logo_400_400/0/1519884681258?e=1700697600&v=beta&t=i09IbD7RibJlZYVNrl7o5pIy-Ip7_0I2XZqXZA9kXUI', 'url': 'https://www.linkedin.com/school/universiteit-utrecht/'}, 'degree_name': ""Master's degree"", 'field_of_study': 'Law'}]",[],[],[],"[{'name': 'Association of International Petroleum Negotiators', 'position': 'Regional Director CIS', 'date_start': {'month': None, 'day': None, 'year': 2014}, 'date_end': {'month': None, 'day': None, 'year': 2016}}]",[],[],[],[],"[{'company': {'id': 3248690, 'name': 'Legal & Commercial Services International ', 'logo': 'https://media.licdn.com/dms/image/C560BAQGiQFAzPwiiAw/company-logo_400_400/0/1631609016341?e=1700697600&v=beta&t=lN2KitLmdgmY2l4QzDfaItNCrgmRGyYcPwM0LhDWTbU', 'url': 'https://www.linkedin.com/company/legal-&-commercial-services-international-co-ltd/', 'employees': {'start': 11, 'end': 50}}, 'date': {'start': {'month': 1, 'day': None, 'year': 2017}, 'end': {'month': None, 'day': None, 'year': None}}, 'profile_positions': [{'location': 'Voorburg, The Netherlands', 'date': {'start': {'month': 1, 'day': None, 'year': 2017}, 'end': {'month': None, 'day': None, 'year': None}}, 'company': 'Legal & Commercial Services International Co., Ltd', 'description': 'After retirement from Royal Dutch Shell in mid 2016, engaged as a independent consultant for mainly the oil and gas industry for joint venture design and management. \nKey skills and areas of expertise:\n-  Cultural awareness: Dutch by birth, open mind, also lived in Oman, Iran, Dubai and Russia\n-  Leadership: authenticity, compassion and drive with emphasis on development and delivery\n-  Interpersonal and negotiating: Lead Negotiator for various Russian, ME and CIS deals\n-  Commercial: VP commercial ME/CIS/Russia and leading commercial teams\n-  Risk management: Joint Ventures: design, financing, execution, management and disputes\n-  Compliance: setting up and implementing compliance programs (FCPA, US and EU sanctions)', 'title': 'Independent Consultant', 'employment_type': None}]}, {'company': {'id': 1271, 'name': 'Shell Exploration and Production Services (RF) B.V.', 'logo': 'https://media.licdn.com/dms/image/C4D0BAQGN30g7aSl4NA/company-logo_400_400/0/1519856218579?e=1700697600&v=beta&t=tNZAoMUkdjwkgcqi-h79Em_6eRebVnZdKSDkAOA6QPE', 'url': 'https://www.linkedin.com/company/shell/', 'employees': {'start': 10001, 'end': None}}, 'date': {'start': {'month': 9, 'day': None, 'year': 2004}, 'end': {'month': 2, 'day': None, 'year': 2016}}, 'profile_positions': [{'location': 'Moscow, Russian Federation', 'date': {'start': {'month': 1, 'day': None, 'year': 2010}, 'end': {'month': 2, 'day': None, 'year': 2016}}, 'company': 'Shell', 'description': 'Joint Ventures, Compliance and Negotiations', 'title': 'Associate General Counsel E&P Shell New Business', 'employment_type': None}, {'location': 'Dubai,  Middle East, The Netherlands, Global NBD-M&A,', 'date': {'start': {'month': 9, 'day': None, 'year': 2004}, 'end': {'month': 12, 'day': None, 'year': 2010}}, 'company': 'Shell', 'description': None, 'title': 'Associate General Counsel', 'employment_type': None}]}]",[],[],,,
