profile_id,first_name,last_name,sub_title,profile_picture,background_image,profile_type,entity_urn,object_urn,birth_date,summary,location,premium,influencer,treasury_media,languages,industry,education,patents,awards,certifications,organizations,projects,publications,courses,test_scores,position_groups,volunteer_experiences,skills,network_info,related_profiles,contact_info
cecile-van-sasse-van-ysselt-5897a324,Cecile,van Sasse van Ysselt,Buyer,https://media.licdn.com/dms/image/C5603AQEJ0tEx5q0JJA/profile-displayphoto-shrink_800_800/0/1571734734524?e=1697673600&v=beta&t=Xgs6bQvHwsyIz2otDkZJowVM2NvhX6FuZfNc3MsAAf0,,personal,ACoAAAUZlXkBf7ALMzSm_6Q7rY48VuANP-wgV3Q,85562745,,"Thirteen years of work experience from different sectors such as the Oil and Gas industry and the Banking sector. 

In Norway I worked in the Oil and Gas industry as a Buyer, a Business Development and Marketing coordinator and Tendering coordinator. Furthermore, I have written “100% Oslo”; a travel guide about Oslo which can be purchased online and in many bookstores in The Netherlands.

In Spain I have worked several years for Barclays Bank as Manager of the International Clients department.

As a result of having worked in different countries, I speak Dutch, English, Spanish and Norwegian fluently.

I have recently relocated to The Netherlands (The Hague area) due to my husbands new job. After finally having settled down, I am now looking for a new position.","{'country': None, 'short': 'Netherlands', 'city': None, 'state': None, 'default': 'Netherlands'}",False,False,[],"{'primary_locale': {'country': 'ES', 'language': 'es'}, 'supported_locales': [{'country': 'ES', 'language': 'es'}, {'country': 'US', 'language': 'en'}], 'profile_languages': []}",Oil & Energy,"[{'date': {'start': {'month': None, 'day': None, 'year': 2004}, 'end': {'month': None, 'day': None, 'year': 2007}}, 'school': {'name': 'De Haagse Hogeschool / The Hague University of Applied Sciences', 'logo': 'https://media.licdn.com/dms/image/C4D0BAQFtr7VqGaVWcQ/company-logo_400_400/0/1519902744083?e=1700697600&v=beta&t=ScCp43qZhvbFl9RLWtKr5X0jfZR9O8KBee1bwe1QQOY', 'url': 'https://www.linkedin.com/school/haagse-hogeschool/'}, 'degree_name': 'Bachelor degree European Studies', 'field_of_study': 'International Business, Marketing, Economics, Intercultural Communication, Management skills'}]",[],[],[],[],[],[],[],[],"[{'company': {'id': 4103, 'name': 'Aker Solutions', 'logo': 'https://media.licdn.com/dms/image/D4D0BAQFJOKvCg7vVoA/company-logo_400_400/0/1688379037344?e=1700697600&v=beta&t=_nXExLwkxKrkZN7sqCj93ma7XD4BWsrqpXlrLIwFqWM', 'url': 'https://www.linkedin.com/company/aker-solutions/', 'employees': {'start': 10001, 'end': None}}, 'date': {'start': {'month': 11, 'day': None, 'year': 2019}, 'end': {'month': 8, 'day': None, 'year': 2021}}, 'profile_positions': [{'location': None, 'date': {'start': {'month': 11, 'day': None, 'year': 2019}, 'end': {'month': 8, 'day': None, 'year': 2021}}, 'company': 'Aker Solutions', 'description': '- Purchaser of clamp connectors, seals and small machinery\n- Responsible for the whole purchase process from; sending out the RFQ to suppliers, evaluating the offers received, selecting the appropriate supplier, placing the PO to the winning supplier, ensuring the goods arrive on time and in good condition at the applicable Aker Solutions warehouse worldwide. \n- Negociating with suppliers to obtain lowest prices possible\n- Attending internal Project Management meetings with the relevant engineering team to give updates on the status of the order and to adapt orders to the needs of the Project team \n- Evaluating new suppliers\n- Travel to supplier sites for inspection and to maintain a good relationship with our suppliers. My suppliers are based in the UK, Poland and Norway\n- Register orders in SAP', 'title': 'Buyer Mechanical items', 'employment_type': 'Full-time'}]}, {'company': {'id': None, 'name': 'home', 'logo': None, 'url': None, 'employees': {'start': None, 'end': None}}, 'date': {'start': {'month': 1, 'day': None, 'year': 2018}, 'end': {'month': 1, 'day': None, 'year': 2019}}, 'profile_positions': [{'location': None, 'date': {'start': {'month': 1, 'day': None, 'year': 2018}, 'end': {'month': 1, 'day': None, 'year': 2019}}, 'company': 'home', 'description': 'Norway has a maternity leave of 12 months. Between my two maternity leaves I passed my Norwegian language course A2 and B1.', 'title': 'Maternity leave second child', 'employment_type': 'Full-time'}]}, {'company': {'id': None, 'name': 'Home', 'logo': None, 'url': None, 'employees': {'start': None, 'end': None}}, 'date': {'start': {'month': 9, 'day': None, 'year': 2016}, 'end': {'month': 9, 'day': None, 'year': 2017}}, 'profile_positions': [{'location': None, 'date': {'start': {'month': 9, 'day': None, 'year': 2016}, 'end': {'month': 9, 'day': None, 'year': 2017}}, 'company': 'Home', 'description': '12 months maternity leave.', 'title': 'Maternity leave first child', 'employment_type': None}]}, {'company': {'id': 4103, 'name': 'Aker Solutions', 'logo': 'https://media.licdn.com/dms/image/D4D0BAQFJOKvCg7vVoA/company-logo_400_400/0/1688379037344?e=1700697600&v=beta&t=_nXExLwkxKrkZN7sqCj93ma7XD4BWsrqpXlrLIwFqWM', 'url': 'https://www.linkedin.com/company/aker-solutions/', 'employees': {'start': 10001, 'end': None}}, 'date': {'start': {'month': 12, 'day': None, 'year': 2011}, 'end': {'month': 5, 'day': None, 'year': 2017}}, 'profile_positions': [{'location': 'Oslo Area, Norway', 'date': {'start': {'month': 10, 'day': None, 'year': 2014}, 'end': {'month': 5, 'day': None, 'year': 2017}}, 'company': 'Aker Solutions', 'description': ""- Developing KAM plans for the global Key Account Managers\n- Organizing international conferences to promote our products\n- Coordinating exhibitions at important international oil and gas conferences\n- Coordinating press releases, marketing material and branding\n- Developing marketing material for our aftermarket products (spare parts, commissioning etc)\n- Updating CRM system and supporting the team with administrative matters\n- Ensuring the company is qualified as a vendor to oil operators and EPC's by taking care of the Approved Vendor Lists"", 'title': 'Business Development and Marketing Coordinator EMEA region', 'employment_type': 'Full-time'}, {'location': 'Oslo y alrededores, Noruega', 'date': {'start': {'month': 12, 'day': None, 'year': 2011}, 'end': {'month': 10, 'day': None, 'year': 2014}}, 'company': 'Aker Solutions', 'description': '* Working as a Tender Coordinator in a highly international Sales/ Tender team.\n\n* Following the tender throughout the whole tender process from receiving the ITT from the Client to Purchase Order placement.\n\n* Supporting Vice Presidents of various disciplines and Project Managers ensuring that the right processes are being applied during tenders\n\n* Presenting tenders to internal Management\n\n* Participating in the tender process development.\n\n* Managing tender documentation:\n    - Creating and maintaining tender documentation folders\n    - Acting as the main contact person for the client’s               organisation regarding all administrative and commercial issues\n    - Maintaining relevant records updated\n    - Ensuring all applicable tender tools are being used', 'title': 'Tender Coordinator', 'employment_type': None}]}, {'company': {'id': 87054, 'name': ""mo'media"", 'logo': 'https://media.licdn.com/dms/image/D560BAQEXnSyQiw5MEg/company-logo_400_400/0/1681722181897?e=1700697600&v=beta&t=YQFF0xjr6t3l5Nd5m5afHKBRSyJS161q9v9xZf_I9mI', 'url': ""https://www.linkedin.com/company/mo'media/"", 'employees': {'start': 11, 'end': 50}}, 'date': {'start': {'month': 11, 'day': None, 'year': 2011}, 'end': {'month': 12, 'day': None, 'year': 2011}}, 'profile_positions': [{'location': 'Oslo y alrededores, Noruega', 'date': {'start': {'month': 11, 'day': None, 'year': 2011}, 'end': {'month': 12, 'day': None, 'year': 2011}}, 'company': ""mo'media"", 'description': ""- Author of 100% Oslo; a travel guide for Oslo city published by Mo'Media. Available in several languages, can be purchased in bookstores in The Netherlands and on the internet \n\n- The travel guide contains information about hotels, restaurants, bars, museums, shops, transportation etc in Oslo\n\n- The travel guide shows different walking routes through Oslo to visit the places mentioned in the guide\n\n- The travel guide also contains a map of Oslo which indicates the location of the places to visit"", 'title': 'Author of: ""100% Oslo"" travel guide', 'employment_type': None}]}, {'company': {'id': 1426, 'name': 'Barclays', 'logo': 'https://media.licdn.com/dms/image/C4E0BAQFAXc9z0Go7Uw/company-logo_400_400/0/1663677973285?e=1700697600&v=beta&t=TO5QLHS-4qLww8lD3w43DNbQWNQxuOvZ9jUKo_AqVsw', 'url': 'https://www.linkedin.com/company/barclays-bank/', 'employees': {'start': 10001, 'end': None}}, 'date': {'start': {'month': 6, 'day': None, 'year': 2008}, 'end': {'month': 9, 'day': None, 'year': 2011}}, 'profile_positions': [{'location': 'Madrid y alrededores, España', 'date': {'start': {'month': 5, 'day': None, 'year': 2010}, 'end': {'month': 9, 'day': None, 'year': 2011}}, 'company': 'Barclays', 'description': '* Resolving complaints from clients or brokers.\n\n* Making sure that the monthly objectives are reached.\n\n* Improving and establishing new procedures for the department.\n\n* Representing the department in management meetings.', 'title': 'Head of International Clients Department', 'employment_type': None}, {'location': 'Madrid y alrededores, España', 'date': {'start': {'month': 6, 'day': None, 'year': 2008}, 'end': {'month': 5, 'day': None, 'year': 2010}}, 'company': 'Barclays', 'description': '* Informing international clients (Dutch, Germans, English, French etc.) and brokers about our mortgage products; insurances and accounts. \n\n* Implementing and adapting mortgage cases to changes in the risk policy. Accounting, analyzing and verifying economic documentation in their original language. \n\n* Analyzing the income and debt rates of our clients. \n\n* Loading cases on our systems.\n\n* Ordering the valuation and finally arranging the signing of the mortgage together with the solicitor and legal department. \n\n* Reaching the established objectives.', 'title': 'Financial advisor International Clients Department', 'employment_type': None}]}, {'company': {'id': 1277, 'name': 'American Express Madrid', 'logo': 'https://media.licdn.com/dms/image/C4D0BAQGRhsociEn4gQ/company-logo_400_400/0/1523269243842?e=1700697600&v=beta&t=Lfm-libDbtkf9PX2rEN6NQf21p6hEmJfGQgSiflmyuA', 'url': 'https://www.linkedin.com/company/american-express/', 'employees': {'start': 10001, 'end': None}}, 'date': {'start': {'month': 12, 'day': None, 'year': 2007}, 'end': {'month': 6, 'day': None, 'year': 2008}}, 'profile_positions': [{'location': 'Madrid y alrededores, España', 'date': {'start': {'month': 12, 'day': None, 'year': 2007}, 'end': {'month': 6, 'day': None, 'year': 2008}}, 'company': 'American Express', 'description': '* Affiliating Dutch companies to American Express Corporate\n\n* Offering customer service to existing American Express clients\n\n* Managing contracts.', 'title': 'Sales agent', 'employment_type': None}]}, {'company': {'id': 945013, 'name': 'Save The Children Foundation', 'logo': 'https://media.licdn.com/dms/image/C4E0BAQEA7t80Qj9CGA/company-logo_400_400/0/1625821087114?e=1700697600&v=beta&t=TGT4q1sNaJSYn11oGuUFe9jH6CDAIJ8Nl4oKur2BddI', 'url': 'https://www.linkedin.com/company/save-the-children-spain/', 'employees': {'start': 201, 'end': 500}}, 'date': {'start': {'month': 2, 'day': None, 'year': 2007}, 'end': {'month': 7, 'day': None, 'year': 2007}}, 'profile_positions': [{'location': 'Madrid y alrededores, España', 'date': {'start': {'month': 2, 'day': None, 'year': 2007}, 'end': {'month': 7, 'day': None, 'year': 2007}}, 'company': 'Save The Children Foundation', 'description': '- Organizing events and conferences\n- Contacting well known artists and writers to host special events\n- Writing press releases\n- Branding\n- Maintaining relationships with the media', 'title': 'Internship Communications Department', 'employment_type': None}]}]",[],"['Norwegian language course A1, A2', 'Dirección', 'Marketing', 'Microsoft Office', 'Gestión de proyectos', 'Oil & Gas Industry', 'English', 'Dutch', 'Sales Process', 'Tender Development', 'Customer Service', 'Spanish', 'spanish', 'Banking', 'Norwegian', 'Business Development']",,,
