profile_id,first_name,last_name,sub_title,profile_picture,background_image,profile_type,entity_urn,object_urn,birth_date,summary,location,premium,influencer,treasury_media,languages,industry,education,patents,awards,certifications,organizations,projects,publications,courses,test_scores,position_groups,volunteer_experiences,skills,network_info,related_profiles,contact_info
lucia-emanuela-b-407271193,Lucia Emanuela,B.,Lucia Emanuela,https://media.licdn.com/dms/image/D4E03AQGghLYznsP7nw/profile-displayphoto-shrink_800_800/0/1687172474338?e=1697673600&v=beta&t=4Ol7HyWd6V3mQMmUFrcec9PJMqvEU65Z_OuzcJl3kjc,https://media.licdn.com/dms/image/D4E16AQHVrBGIEMn54w/profile-displaybackgroundimage-shrink_350_1400/0/1689929275888?e=1697673600&v=beta&t=RRFj6Sf3_M0VkrbkSz03WUpdc6YlO9yaCPGdyVWwzIg,personal,ACoAAC1sSAcBC899XwNPa00Po-WOnWE1KfhAPDI,762071047,,"TEKsystems - Our People Make IT Possible

TEKsystems is an Allegis Group company, the largest private talent management firm in the world. Our longstanding history and industry-leading position speak to our success in providing IT staffing solutions and IT services that empower organizations to actualize ROI and sustain a truly competitive advantage in a fast-changing market.

With more than 100 locations around the world and expertise across diverse industries, TEKsystems is dedicated to offering customized advice for your mission-critical business transformation.

Are you exploring new opportunities? 
Let's connect!","{'country': None, 'short': 'Netherlands', 'city': None, 'state': None, 'default': 'Netherlands'}",True,False,[],"{'primary_locale': {'country': 'RO', 'language': 'ro'}, 'supported_locales': [{'country': 'RO', 'language': 'ro'}, {'country': 'US', 'language': 'en'}], 'profile_languages': []}",Staffing & Recruiting,"[{'date': {'start': {'month': None, 'day': None, 'year': 2013}, 'end': {'month': None, 'day': None, 'year': 2016}}, 'school': {'name': 'Universitatea „Alexandru Ioan Cuza” din Iași', 'logo': 'https://media.licdn.com/dms/image/C510BAQH7piuGzWOz0Q/company-logo_400_400/0/1519871851762?e=1700697600&v=beta&t=_ku9hPhSNgrLlx_eHAUCGRuCtH_p08qQMPSAXxPfJF4', 'url': 'https://www.linkedin.com/school/universitatea-%E2%80%9Ealexandru-ioan-cuza%E2%80%9D-din-ia%C8%99i/'}, 'degree_name': ""Bachelor's degree"", 'field_of_study': 'Social Work'}, {'date': {'start': {'month': 9, 'day': None, 'year': 2017}, 'end': {'month': 2, 'day': None, 'year': 2018}}, 'school': {'name': 'Instituto Superior de Serviço Social do Porto', 'logo': 'https://media.licdn.com/dms/image/C560BAQGvnBZUkX1IcA/company-logo_400_400/0/1626871406429?e=1700697600&v=beta&t=vrYsg_EbCHbgEAYv3ercW682ctyPz2EBvhwPyOE5oSI', 'url': 'https://www.linkedin.com/school/isssp-pt/'}, 'degree_name': ""Master's degree"", 'field_of_study': ' Social Work'}, {'date': {'start': {'month': None, 'day': None, 'year': 2016}, 'end': {'month': None, 'day': None, 'year': 2018}}, 'school': {'name': 'Universitatea „Alexandru Ioan Cuza” din Iași', 'logo': 'https://media.licdn.com/dms/image/C510BAQH7piuGzWOz0Q/company-logo_400_400/0/1519871851762?e=1700697600&v=beta&t=_ku9hPhSNgrLlx_eHAUCGRuCtH_p08qQMPSAXxPfJF4', 'url': 'https://www.linkedin.com/school/universitatea-%E2%80%9Ealexandru-ioan-cuza%E2%80%9D-din-ia%C8%99i/'}, 'degree_name': ""Master's degree"", 'field_of_study': 'Probation, Mediation and Social Work with Crime Victims'}]",[],[],[],[],[],[],[],[],"[{'company': {'id': 2152, 'name': 'TEKsystems', 'logo': 'https://media.licdn.com/dms/image/D4E0BAQFLrODAdU8Mdw/company-logo_400_400/0/1688568814697?e=1700697600&v=beta&t=qaokIrVSUkZYbYEp8qV3-_oaPeKzhgA_WT5icP1bSyE', 'url': 'https://www.linkedin.com/company/teksystems/', 'employees': {'start': 10001, 'end': None}}, 'date': {'start': {'month': 5, 'day': None, 'year': 2023}, 'end': {'month': None, 'day': None, 'year': None}}, 'profile_positions': [{'location': 'Amsterdam, North Holland, Netherlands', 'date': {'start': {'month': 5, 'day': None, 'year': 2023}, 'end': {'month': None, 'day': None, 'year': None}}, 'company': 'TEKsystems', 'description': None, 'title': 'Technical Recruiter', 'employment_type': 'Full-time'}]}, {'company': {'id': 595883, 'name': 'Takeaway.com', 'logo': 'https://media.licdn.com/dms/image/C4D0BAQEUHCjDyAKZHg/company-logo_400_400/0/1590485817309?e=1700697600&v=beta&t=Clviee0t16lf2lAsniJRZvFVcTgI01TCXgX_lfKqSsM', 'url': 'https://www.linkedin.com/company/takeaway-com/', 'employees': {'start': 1001, 'end': 5000}}, 'date': {'start': {'month': 4, 'day': None, 'year': 2020}, 'end': {'month': 5, 'day': None, 'year': 2023}}, 'profile_positions': [{'location': 'Amsterdam, North Holland, Netherlands', 'date': {'start': {'month': 4, 'day': None, 'year': 2020}, 'end': {'month': 5, 'day': None, 'year': 2023}}, 'company': 'Takeaway.com', 'description': 'The role involves the following: \n- managing a team of up to 80 couriers and answering to their queries, coaching them and offering them support, including motivating and correcting behaviours; \n- establishing work procedures, processes and tasks to support both company and divisional objectives and strategic goals;\n- assigning tasks and training new team members;\n-overseeing the smooth operations on a daily basis and ensuring that the courier equipment is stored, handled and dispatched safely, timely and efficiently;\n- constantly checking the couriers’ performance and steering on KPIs;\n- assisting higher level logistics management in the area of shift planning, restaurant and courier management;\n-operating as a linking pin between couriers, courier captains and the Senior Courier Coordinator/City Operations Manager;\n- providing City Operations Manager and/or business planners with input for shift planning;\n- payments, schedules, leaves and processing exits;\n- strong communication with the stakeholders. \n\nDay by day my knowledge expands in terms of screening, recruitment, hiring, training and motivating teams through special projects and organizational initiatives.', 'title': 'Courier Coordinator', 'employment_type': 'Full-time'}]}, {'company': {'id': 6705573, 'name': 'Cervo Group', 'logo': 'https://media.licdn.com/dms/image/C560BAQGvMYE5pj-dCw/company-logo_400_400/0/1651765787209?e=1700697600&v=beta&t=ab8c-Ceqb72yctFPSqIjQnBMbAigOPTH9xpZoZ8VOfg', 'url': 'https://www.linkedin.com/company/cervogroup/', 'employees': {'start': 1001, 'end': 5000}}, 'date': {'start': {'month': 11, 'day': None, 'year': 2019}, 'end': {'month': 4, 'day': None, 'year': 2020}}, 'profile_positions': [{'location': 'Amsterdam, North Holland, Netherlands', 'date': {'start': {'month': 11, 'day': None, 'year': 2019}, 'end': {'month': 4, 'day': None, 'year': 2020}}, 'company': 'Cervo Group', 'description': 'In-house coordinator at JustEatTakeaway.\nI have been part of a pilot project.', 'title': 'In-House Coordinator', 'employment_type': 'Full-time'}]}, {'company': {'id': None, 'name': 'Romanian School Amsterdam', 'logo': None, 'url': None, 'employees': {'start': None, 'end': None}}, 'date': {'start': {'month': 9, 'day': None, 'year': 2019}, 'end': {'month': 11, 'day': None, 'year': 2019}}, 'profile_positions': [{'location': 'Amsterdam Area, Netherlands', 'date': {'start': {'month': 9, 'day': None, 'year': 2019}, 'end': {'month': 11, 'day': None, 'year': 2019}}, 'company': 'Romanian School Amsterdam', 'description': None, 'title': 'Collaborator', 'employment_type': 'Part-time'}]}, {'company': {'id': 72171769, 'name': 'Springfield Grădiniță și After School', 'logo': 'https://media.licdn.com/dms/image/C4D0BAQHtNXz0_CfWuQ/company-logo_400_400/0/1618604575521?e=1700697600&v=beta&t=8vshA4oZdCLsfwcVIZquAZRYaWKIq7iNfhc87Yb9kfI', 'url': 'https://www.linkedin.com/company/springfield-gr%C4%83dini%C8%9B%C4%83-%C8%99i-after-school/', 'employees': {'start': 11, 'end': 50}}, 'date': {'start': {'month': 9, 'day': None, 'year': 2018}, 'end': {'month': 7, 'day': None, 'year': 2019}}, 'profile_positions': [{'location': 'Bucharest, Romania', 'date': {'start': {'month': 9, 'day': None, 'year': 2018}, 'end': {'month': 7, 'day': None, 'year': 2019}}, 'company': 'Springfield Grădiniță și After School', 'description': 'Working as a teacher trainee has prepared me to meet the challenges of the educational environment, such as understanding a child’s needs, ethics, care and empathy.', 'title': 'Teacher Trainee', 'employment_type': 'Full-time'}]}, {'company': {'id': 15095831, 'name': 'Alexandru Ioan Cuza University of Iasi', 'logo': 'https://media.licdn.com/dms/image/C510BAQH7piuGzWOz0Q/company-logo_400_400/0/1519871851762?e=1700697600&v=beta&t=_ku9hPhSNgrLlx_eHAUCGRuCtH_p08qQMPSAXxPfJF4', 'url': 'https://www.linkedin.com/school/universitatea-%E2%80%9Ealexandru-ioan-cuza%E2%80%9D-din-ia%C8%99i/', 'employees': {'start': 1001, 'end': 5000}}, 'date': {'start': {'month': 3, 'day': None, 'year': 2017}, 'end': {'month': 6, 'day': None, 'year': 2017}}, 'profile_positions': [{'location': 'Iasi', 'date': {'start': {'month': 3, 'day': None, 'year': 2017}, 'end': {'month': 6, 'day': None, 'year': 2017}}, 'company': 'Universitatea „Alexandru Ioan Cuza” din Iași', 'description': 'Collaboration with the university for assisting a blind student in Erasmus mobility.', 'title': 'Personal assistant for a blind person', 'employment_type': 'Part-time'}]}, {'company': {'id': 4841128, 'name': 'Mast-Jägermeister SE', 'logo': 'https://media.licdn.com/dms/image/D4E0BAQFFkWM58Mxc2w/company-logo_400_400/0/1664870105508?e=1700697600&v=beta&t=qzMVskCKxF80cSIxsTDDEo9CWrBovKwNSj0xVF7OPGs', 'url': 'https://www.linkedin.com/company/mast-j%C3%A4germeister-se/', 'employees': {'start': 501, 'end': 1000}}, 'date': {'start': {'month': 3, 'day': None, 'year': 2014}, 'end': {'month': 5, 'day': None, 'year': 2016}}, 'profile_positions': [{'location': 'Iaşi, Romania', 'date': {'start': {'month': 3, 'day': None, 'year': 2014}, 'end': {'month': 5, 'day': None, 'year': 2016}}, 'company': 'Mast-Jägermeister SE', 'description': None, 'title': 'Hostess/ Advertiser ', 'employment_type': 'Part-time'}]}, {'company': {'id': 346058, 'name': 'Aquis Hotels & Resorts', 'logo': 'https://media.licdn.com/dms/image/C4D0BAQGHbneYSQ-8IA/company-logo_400_400/0/1519863683931?e=1700697600&v=beta&t=sl1exDFTvPiJxjpi1T2QkfoGGk_XX_ibdVLYTwqFdJg', 'url': 'https://www.linkedin.com/company/aquis-hotels-&-resorts-aquis-sandy-beach-/', 'employees': {'start': 201, 'end': 500}}, 'date': {'start': {'month': 7, 'day': None, 'year': 2015}, 'end': {'month': 9, 'day': None, 'year': 2015}}, 'profile_positions': [{'location': 'Kérkira, Ionian Islands, Greece', 'date': {'start': {'month': 7, 'day': None, 'year': 2015}, 'end': {'month': 9, 'day': None, 'year': 2015}}, 'company': 'Aquis Hotels & Resorts', 'description': 'Work & Travel Experience', 'title': 'Buffet Waitress', 'employment_type': 'Full-time'}]}, {'company': {'id': 4827, 'name': 'JTI (Japan Tobacco International)', 'logo': 'https://media.licdn.com/dms/image/C4E0BAQF7sWbNjLJaMw/company-logo_400_400/0/1593603861051?e=1700697600&v=beta&t=AiJ1Ipqrx9kxrzGGr46nL8JYVy6TnwX3ALJyk4JjXew', 'url': 'https://www.linkedin.com/company/jti/', 'employees': {'start': 10001, 'end': None}}, 'date': {'start': {'month': 12, 'day': None, 'year': 2014}, 'end': {'month': 3, 'day': None, 'year': 2015}}, 'profile_positions': [{'location': 'Iaşi, Romania', 'date': {'start': {'month': 12, 'day': None, 'year': 2014}, 'end': {'month': 3, 'day': None, 'year': 2015}}, 'company': 'JTI (Japan Tobacco International)', 'description': None, 'title': 'Brand Ambassador', 'employment_type': 'Part-time'}]}]","[{'date': {'start': {'month': 12, 'day': None, 'year': 2013}, 'end': {'month': 6, 'day': None, 'year': 2016}}, 'role': 'Student Volunteer', 'company': {'id': None, 'name': 'Fundatia Servicilor Sociale Bethany', 'logo': 'https://media.licdn.com/dms/image/C4E0BAQEE6glTZdGH9Q/company-logo_400_400/0/1519890421939?e=1700697600&v=beta&t=GAkOW2-5Nwkk7FatAnjkIrdgw5lM-tUaWXW8Jwjbi-4', 'url': 'https://www.linkedin.com/company/fundatia-servicilor-sociale-bethany/'}, 'cause': 'SOCIAL_SERVICES', 'description': 'https://vimeo.com/128131107'}]","['Teamwork', 'Multitasking', 'Drive for results', 'Knowledge Sharing', 'Analytical Skills', 'Early Childhood Education', 'Strategy', 'Hiring', 'Recruiting', 'Operations Management', 'Customer Experience', 'Salesforce.com', 'Driven By Results', 'Easily Adaptable', 'Fundraising', 'Childcare', 'Working With Children', 'Working with Adolescents', 'Coaching', 'Training']",,,
