profile_id,first_name,last_name,sub_title,profile_picture,background_image,profile_type,entity_urn,object_urn,birth_date,summary,location,premium,influencer,treasury_media,languages,industry,education,patents,awards,certifications,organizations,projects,publications,courses,test_scores,position_groups,volunteer_experiences,skills,network_info,related_profiles,contact_info
juan-cruz-diez-beltran-b9190820,Juan Cruz,Diez Beltran,"MD, MPH, Health Consultant",,,personal,ACoAAARn6J0B3tCQ4NrDTEpTFuNXlE0_MAKgfrk,73918621,,"• Four years providing clinical services in resource limited settings in DR Congo and Mozambique, Africa;  the experience assisted with my growth as a reality-based public health professional, 

• Experience with different non-governmental organizations, each with a specific approach for addressing health needs of their target populations,

• Supervisory experience in both program administration as well as team management,

• Masters Degree in Public Health,

• Creative writing, good reporting and communication skills, at community, organization and government levels,

• Fluent in English, Spanish, French and Portuguese.","{'country': 'Netherlands', 'short': 'Amsterdam, North Holland', 'city': 'Amsterdam', 'state': 'North Holland', 'default': 'Amsterdam, North Holland, Netherlands'}",False,False,[],"{'primary_locale': {'country': 'US', 'language': 'en'}, 'supported_locales': [{'country': 'US', 'language': 'en'}], 'profile_languages': [{'name': 'Dutch', 'proficiency': 'ELEMENTARY'}, {'name': 'English', 'proficiency': 'FULL_PROFESSIONAL'}, {'name': 'French', 'proficiency': 'LIMITED_WORKING'}, {'name': 'Portuguese', 'proficiency': 'PROFESSIONAL_WORKING'}, {'name': 'Spanish', 'proficiency': 'NATIVE_OR_BILINGUAL'}]}",Hospital & Health Care,"[{'date': {'start': {'month': None, 'day': None, 'year': 2010}, 'end': {'month': None, 'day': None, 'year': 2011}}, 'school': {'name': 'Vrije Universiteit (VU University) & Royal Tropical Institute (KIT)', 'logo': None, 'url': None}, 'degree_name': 'Master of Public Health (MPH)', 'field_of_study': 'Public Health with specialization in HIV'}, {'date': {'start': {'month': None, 'day': None, 'year': 1994}, 'end': {'month': None, 'day': None, 'year': 2002}}, 'school': {'name': 'University of Buenos Aires', 'logo': None, 'url': None}, 'degree_name': 'Medical Doctor', 'field_of_study': 'Medicine'}]",[],[],[],[],[],"[{'name': 'Compendium of Technical Bulletins on HIV prevention and treatment strategies for gay men and other men who have sex with men (MSM)', 'publisher': 'The Global Forum on MSM and HIV', 'url': 'http://www.msmgf.org/files/msmgf/documents/TechBulletins/EN/Sec1MSMGF_TechBulletins2012.pdf', 'date': {'month': None, 'day': None, 'year': 2012}, 'authors': [{'type': 'standardizedContributor', 'first_name': 'Juan Cruz', 'last_name': 'Diez Beltran', 'name': None, 'headline': 'MD, MPH, Health Consultant'}, {'type': 'nonStandardizedContributor', 'first_name': None, 'last_name': None, 'name': 'Milo Santos', 'headline': None}, {'type': 'nonStandardizedContributor', 'first_name': None, 'last_name': None, 'name': 'Tom Pyun', 'headline': None}]}, {'name': 'LGBTI people and organisations in a hostile environment.', 'publisher': 'Creating Space: Common issues, lessons learnt and ways forward for people involved in the development of LGBTI organisations.', 'url': 'http://creatingspacelgbti.wikispaces.com/', 'date': {'month': None, 'day': None, 'year': 2012}, 'authors': [{'type': 'standardizedContributor', 'first_name': 'Juan Cruz', 'last_name': 'Diez Beltran', 'name': None, 'headline': 'MD, MPH, Health Consultant'}, {'type': 'nonStandardizedContributor', 'first_name': None, 'last_name': None, 'name': 'Bram Langen', 'headline': None}, {'type': 'nonStandardizedContributor', 'first_name': None, 'last_name': None, 'name': 'Warren Banks', 'headline': None}, {'type': 'nonStandardizedContributor', 'first_name': None, 'last_name': None, 'name': 'Jan Bruinsma', 'headline': None}, {'type': 'nonStandardizedContributor', 'first_name': None, 'last_name': None, 'name': 'Gisela Dutting', 'headline': None}, {'type': 'nonStandardizedContributor', 'first_name': None, 'last_name': None, 'name': 'Karen Kraan', 'headline': None}, {'type': 'nonStandardizedContributor', 'first_name': None, 'last_name': None, 'name': 'W. Muguongo', 'headline': None}]}, {'name': 'Lesons Learned - Schorer Monitor 2011', 'publisher': 'Schorer Stichting', 'url': 'http://lessons-learned.wikispaces.com/file/view/24-SCHORER-ENG.pdf/361372280/24-SCHORER-ENG.pdf', 'date': {'month': None, 'day': None, 'year': 2012}, 'authors': [{'type': 'standardizedContributor', 'first_name': 'Juan Cruz', 'last_name': 'Diez Beltran', 'name': None, 'headline': 'MD, MPH, Health Consultant'}]}]","[{'name': 'Clinical management of HIV - University of Washington, Seattle, United States', 'number': None}, {'name': 'Strategies to prolong and improve quality of life in children living with HIV/AIDS - University of Buenos Aires, Buenos Aires', 'number': None}]",[],"[{'company': {'id': None, 'name': 'Diez Beltran - Consultants', 'logo': None, 'url': None, 'employees': {'start': None, 'end': None}}, 'date': {'start': {'month': 9, 'day': None, 'year': 2011}, 'end': {'month': None, 'day': None, 'year': None}}, 'profile_positions': [{'location': 'Amsterdam Area, Netherlands', 'date': {'start': {'month': 9, 'day': None, 'year': 2011}, 'end': {'month': None, 'day': None, 'year': None}}, 'company': 'Diez Beltran - Consultants', 'description': '- Full-time consultant, The Global Forum on MSM & HIV (MSMGF), Feb 2013 to present,\n\n- HIV Advisor, AIDS Healthcare Foundation, http://www.aidshealth.org/, Amsterdam, currently,\n\n- Member of advisory board for the Mainstreaming of Sexual Diversity into SRHR and HIV Program, Dance4life, www.dance4life.nl, Amsterdam, currently,\n\n- Advisor for HIV prevention programs, Willen Doen Stichting, www.willenendoen.org, Amsterdam, currently, \n\n- Schorer Monitor, Documentation of Lessons Learned. In-depth interviews among Schorer’s employees and documentation of best practices and lessons learned from the Monitor, a survey on sexual and HIV testing behaviours among MSM in the Netherlands, December 2011,  \n\n- Workshop on Documentation of Lessons Learned. Development, co-facilitation and reporting back of a workshop for Schorer’s Latin American counterparts, Quito, Ecuador, Nov 2011,\n\n- Development of LGBTI Organizations. Six articles on organizational development produced together with 5 other professionals from the field, and based on thoughts from attendees to a workshop on the same topic held by Schorer, Amsterdam, Oct 2011.', 'title': 'Director', 'employment_type': None}]}, {'company': {'id': None, 'name': 'The Global Forum on MSM and HIV (MSMGF)', 'logo': None, 'url': None, 'employees': {'start': None, 'end': None}}, 'date': {'start': {'month': 6, 'day': None, 'year': 2012}, 'end': {'month': 2, 'day': None, 'year': 2013}}, 'profile_positions': [{'location': 'Based in Amsterdam, for Latin America', 'date': {'start': {'month': 6, 'day': None, 'year': 2012}, 'end': {'month': 2, 'day': None, 'year': 2013}}, 'company': 'The Global Forum on MSM and HIV (MSMGF)', 'description': '- Management of Latin American portfolio of countries and programs under the Dutch funded (MoFA) Bridging the Gaps program,\n\n- Design, preparation and facilitation of workshops for Latin American partners,\n\n- Supervision and assistance during the development of workplans, budgets and contracts,\n\n- Representation of the organization at different levels, from MoH (e.g. Brazil) to grass root level organizations.', 'title': 'Program Associate', 'employment_type': None}]}, {'company': {'id': 1041198, 'name': 'Schorer', 'logo': None, 'url': 'https://www.linkedin.com/company/schorer/', 'employees': {'start': 51, 'end': 200}}, 'date': {'start': {'month': 1, 'day': None, 'year': 2012}, 'end': {'month': 4, 'day': None, 'year': 2012}}, 'profile_positions': [{'location': 'Based in Amsterdam, for Latin America', 'date': {'start': {'month': 1, 'day': None, 'year': 2012}, 'end': {'month': 4, 'day': None, 'year': 2012}}, 'company': 'Schorer', 'description': '- Coordination of health programs for 3 Latin American counterparts (LGBT and Human Rights organizations) in Ecuador and Costa Rica,\n\n- Revision and mentoring in the development of baseline studies, research lines and other relevant documents,\n\n- Supervision of expansion of Latin American partners into regional centres of reference (support to emerging organizations in neighbouring countries).', 'title': 'Senior Program Officer, International Projects', 'employment_type': None}]}, {'company': {'id': None, 'name': 'International Training and Education Centre on Health (I - TECH)', 'logo': None, 'url': None, 'employees': {'start': None, 'end': None}}, 'date': {'start': {'month': 5, 'day': None, 'year': 2010}, 'end': {'month': 7, 'day': None, 'year': 2010}}, 'profile_positions': [{'location': 'Mozambique (Cabo Delgado, Inhambane, Tete and Gaza)', 'date': {'start': {'month': 5, 'day': None, 'year': 2010}, 'end': {'month': 7, 'day': None, 'year': 2010}}, 'company': 'International Training and Education Centre on Health (I - TECH)', 'description': '- Coordination of training courses in clinical mentoring (ToT- training of trainers) for medical doctors and other health professionals,\n\n- Coordination, supervision and facilitation of training courses for management of HIV/AIDS patients, both adults and paediatrics, for medical technicians,\n\n- Development of evaluation tools and revision of curricula used by the organization.', 'title': 'External Advisor', 'employment_type': None}]}, {'company': {'id': 2462546, 'name': 'ARK - Absolute Return for Kids Mozambique', 'logo': 'https://media.licdn.com/dms/image/D4E0BAQGM--tr2hEILw/company-logo_400_400/0/1663668573644?e=1700697600&v=beta&t=f098zX1F_xt4wQFmWhUtbKKZ6x22HmIMULztd9V4f4E', 'url': 'https://www.linkedin.com/company/ark-schools/', 'employees': {'start': 1001, 'end': 5000}}, 'date': {'start': {'month': 7, 'day': None, 'year': 2008}, 'end': {'month': 3, 'day': None, 'year': 2010}}, 'profile_positions': [{'location': 'Maputo province, Mozambique', 'date': {'start': {'month': 7, 'day': None, 'year': 2008}, 'end': {'month': 3, 'day': None, 'year': 2010}}, 'company': 'Ark', 'description': '- Daily clinical responsibility for clinic and patients at Hospital Geral da Machava, treating patients with tuberculosis and/or HIV/AIDS,\n\n- Supervision and mentoring of clinical staff at health centres with HIV/AIDS facilities serving adults and children with HIV,\n\n- Creation of HIV/AIDS services (VCT, treatment, follow up, data collection, referral systems) in peripheral health centres,\n\n- Coordination of training courses and workshops for activists and counsellors, design of curricula, facilitation and implementation,\n\n- Design of adherence tools for people living with HIV to be used during counselling sessions and clinical consultations to increase adherence.', 'title': 'Senior Medical Officer', 'employment_type': None}]}, {'company': {'id': 19796, 'name': 'Clinton Foundation', 'logo': 'https://media.licdn.com/dms/image/C4E0BAQHHr3HAE3l0IA/company-logo_400_400/0/1519856167294?e=1700697600&v=beta&t=J9lBgJoxIM9fg_DaZfxsQ9JSMEFQXCpZ_MIuCm9mFaI', 'url': 'https://www.linkedin.com/company/clintonfoundation/', 'employees': {'start': 201, 'end': 500}}, 'date': {'start': {'month': 10, 'day': None, 'year': 2007}, 'end': {'month': 2, 'day': None, 'year': 2008}}, 'profile_positions': [{'location': 'Mozambique, Nampula Province', 'date': {'start': {'month': 10, 'day': None, 'year': 2007}, 'end': {'month': 2, 'day': None, 'year': 2008}}, 'company': 'Clinton Foundation', 'description': '- Supervision and mentoring of clinical and volunteer HIV team during transition/programme phase out of CHAI in Moma district,\n\n- Consolidation of existing care systems and follow up plan with MoH,\n\n- Integration of HIV services into other vertical health programmes (TB,  Nutrition),\n\n- Decentralisation of HIV services from district hospital to outlying health facilities, including support (PMTCT, TB, Nutrition, Paeds).', 'title': 'Senior Medical Officer and Coordinator', 'employment_type': None}]}, {'company': {'id': None, 'name': 'Absolute Return for Kids (ARK South Africa)', 'logo': None, 'url': None, 'employees': {'start': None, 'end': None}}, 'date': {'start': {'month': 1, 'day': None, 'year': 2007}, 'end': {'month': 5, 'day': None, 'year': 2007}}, 'profile_positions': [{'location': 'Mozambique', 'date': {'start': {'month': 1, 'day': None, 'year': 2007}, 'end': {'month': 5, 'day': None, 'year': 2007}}, 'company': 'Absolute Return for Kids (ARK South Africa)', 'description': '- Large scale assessment for pre-programme strategic planning, including interviews and visits and assessment of >100 health centres nationally,\n\n- Reported results and findings to ARK management and board, on health issues and systems in Mozambique,\n\n- Orientation to Mozambique HIV care and treatment policy and practice through professional work and volunteer work in the Maputo central paediatric clinic.', 'title': 'General Practitioner and Medical Consultant', 'employment_type': None}]}, {'company': {'id': None, 'name': 'Medicos en Catástrofe (MEC)', 'logo': None, 'url': None, 'employees': {'start': None, 'end': None}}, 'date': {'start': {'month': 4, 'day': None, 'year': 2006}, 'end': {'month': 7, 'day': None, 'year': 2006}}, 'profile_positions': [{'location': 'Democratic Republic of the Congo', 'date': {'start': {'month': 4, 'day': None, 'year': 2006}, 'end': {'month': 7, 'day': None, 'year': 2006}}, 'company': 'Medicos en Catástrofe (MEC)', 'description': '- Representation of the organization in meetings with local health authorities and other organizations,\n\n- Design, coordination and implementation of health promotion campaigns, assessment, lobbying for funds, recruitment of personnel,\n\n- Daily clinical responsibility for clinic and patients.', 'title': 'Medical Co-ordinator', 'employment_type': None}]}]",[],"['Creative Writing', 'Critical Thinking', 'Professional Networking', 'International Liaison', 'Community Relations', 'Community Networking', 'Process Review', 'Community Development', 'Public Health', 'Business Networking', 'Capacity Building', 'HIV prevention', 'Program Management', 'Training', 'Research', 'Organizational Development', 'Program Evaluation', 'Policy', 'NGOs', 'Health Promotion']",,,
