profile_id,first_name,last_name,sub_title,profile_picture,background_image,profile_type,entity_urn,object_urn,birth_date,summary,location,premium,influencer,treasury_media,languages,industry,education,patents,awards,certifications,organizations,projects,publications,courses,test_scores,position_groups,volunteer_experiences,skills,network_info,related_profiles,contact_info
eugenerurangwa,Eugene,Rurangwa,1,https://media.licdn.com/dms/image/C5603AQEzuijlVpjgyg/profile-displayphoto-shrink_800_800/0/1516846324094?e=1697673600&v=beta&t=dKCU_OUXSe3piVCHc9Y-Gmix8FvbV2CopjKylC_Y0uM,https://media.licdn.com/dms/image/C5616AQFz8okn5Mwu7Q/profile-displaybackgroundimage-shrink_350_1400/0/1516846324595?e=1697673600&v=beta&t=RZRpixXuN_UVKxbWYiASHL_grSDI4DZmOcRXsnNrZHM,personal,ACoAABjVyI4BGmzMjIbdlxqY7NY5GvRgLdB-8ag,416663694,,"Eugene Rurangwa PhD is a scientist with 30 years of international work experience in the agriculture sector with technical expertise and specialisation in aquatic production systems. He focusses his research activities on the development and application of technological tools to improve sustainability, efficiency and profitability in aquaculture. He has managed and worked on national and international complex projects in: (1) sustainable aquaculture production, environmental impact of intensive aquaculture, aquatic toxicology, microbial management in fish and systems, (2) fish market and value chain analysis, scans and feasibility studies, fish by-product valorisation, fish for food and nutrition security, (3) inclusive businesses development for the private sector and smallholders and, (4) capacity building and curricula development.

Country project work experience: Belgium, Germany, Netherlands, Norway, Poland, UK, USA, Algeria, Benin, Ethiopia, Ghana, Kenya, Mali, Nigeria, Rwanda, South Africa and Tanzania. He has a large network with academics, the public and private sectors in Europe and in both French and English speaking countries in Africa.

Native from Rwanda, East Africa, he has worked and lived between Belgium, The Netherlands and the African continent. With a good understanding of both the Western and the African cultures, he is a perfect quadrilingual and proficient user of English, French, Dutch and Kinyarwanda.
","{'country': 'Netherlands', 'short': 'Kruiningen, Zeeland', 'city': 'Kruiningen', 'state': 'Zeeland', 'default': 'Kruiningen, Zeeland, Netherlands'}",False,False,[],"{'primary_locale': {'country': 'NL', 'language': 'nl'}, 'supported_locales': [{'country': 'NL', 'language': 'nl'}, {'country': 'US', 'language': 'en'}], 'profile_languages': [{'name': 'Dutch', 'proficiency': None}, {'name': 'English', 'proficiency': None}, {'name': 'French', 'proficiency': None}, {'name': 'Kinyarwanda', 'proficiency': None}]}",Research,"[{'date': {'start': {'month': None, 'day': None, 'year': 2010}, 'end': {'month': None, 'day': None, 'year': 2010}}, 'school': {'name': 'Utrecht University', 'logo': 'https://media.licdn.com/dms/image/C510BAQG6HfmPTdJKXw/company-logo_400_400/0/1519884681258?e=1700697600&v=beta&t=i09IbD7RibJlZYVNrl7o5pIy-Ip7_0I2XZqXZA9kXUI', 'url': 'https://www.linkedin.com/school/universiteit-utrecht/'}, 'degree_name': 'Certificate', 'field_of_study': 'Proefdierkunde'}, {'date': {'start': {'month': None, 'day': None, 'year': 1994}, 'end': {'month': None, 'day': None, 'year': 1999}}, 'school': {'name': 'KU Leuven', 'logo': 'https://media.licdn.com/dms/image/C560BAQHAtw6LesXG-w/company-logo_400_400/0/1519856403240?e=1700697600&v=beta&t=TFY_wkkDte_zqbephqgB-m5rxmhTCyRntHSJeh3qUYI', 'url': 'https://www.linkedin.com/school/ku_leuven/'}, 'degree_name': 'Doctor of Philosophy (PhD)', 'field_of_study': 'Marine/Aquatic Biology'}, {'date': {'start': {'month': None, 'day': None, 'year': 1994}, 'end': {'month': None, 'day': None, 'year': 1995}}, 'school': {'name': 'Université catholique de Louvain', 'logo': 'https://media.licdn.com/dms/image/C4D0BAQGpQ3G9ianp8w/company-logo_400_400/0/1618215726662?e=1700697600&v=beta&t=YaYvFuiw-UdZLTAzARSbTzqsmsCB19qGe2YR48RGaDo', 'url': 'https://www.linkedin.com/school/uclouvain/'}, 'degree_name': None, 'field_of_study': 'Statistics and Biometry'}, {'date': {'start': {'month': None, 'day': None, 'year': 1991}, 'end': {'month': None, 'day': None, 'year': 1994}}, 'school': {'name': 'KU Leuven', 'logo': 'https://media.licdn.com/dms/image/C560BAQHAtw6LesXG-w/company-logo_400_400/0/1519856403240?e=1700697600&v=beta&t=TFY_wkkDte_zqbephqgB-m5rxmhTCyRntHSJeh3qUYI', 'url': 'https://www.linkedin.com/school/ku_leuven/'}, 'degree_name': None, 'field_of_study': 'Aquaculture'}, {'date': {'start': {'month': None, 'day': None, 'year': 1989}, 'end': {'month': None, 'day': None, 'year': 1989}}, 'school': {'name': 'Auburn University', 'logo': 'https://media.licdn.com/dms/image/C4D0BAQEM_SJBFzoT4w/company-logo_400_400/0/1645562455797?e=1700697600&v=beta&t=irMfABEH67G72l09TzdIy25S4hxt1rXJMeizR1V1tPo', 'url': 'https://www.linkedin.com/school/auburn-university/'}, 'degree_name': None, 'field_of_study': 'Aquaculture'}, {'date': {'start': {'month': None, 'day': None, 'year': 1983}, 'end': {'month': None, 'day': None, 'year': 1986}}, 'school': {'name': 'National Univesity of Rwanda', 'logo': None, 'url': None}, 'degree_name': 'Engineer (Ir.)', 'field_of_study': 'Agriculture Sciences'}, {'date': {'start': {'month': None, 'day': None, 'year': 1980}, 'end': {'month': None, 'day': None, 'year': 1983}}, 'school': {'name': 'National University of Rwanda', 'logo': None, 'url': None}, 'degree_name': 'Master of Sciences (MSc)', 'field_of_study': 'Natural Sciences'}]",[],[],[],"[{'name': 'PUM Netherlands Senior Experts', 'position': 'Expert', 'date_start': {'month': 11, 'day': None, 'year': 2016}, 'date_end': None}, {'name': 'Dutch Aquaculture Association (NGvA); European Aquaculture Society (EAS)', 'position': None, 'date_start': None, 'date_end': None}, {'name': 'Smart Expert Africa', 'position': None, 'date_start': None, 'date_end': None}]",[],"[{'name': 'Aquaculture Innovation in Vietnam', 'publisher': None, 'url': None, 'date': {'month': None, 'day': None, 'year': 2016}, 'authors': [{'type': 'standardizedContributor', 'first_name': 'Eugene', 'last_name': 'Rurangwa', 'name': None, 'headline': '1'}, {'type': 'nonStandardizedContributor', 'first_name': None, 'last_name': None, 'name': 'Urs Baumgartner', 'headline': None}, {'type': 'nonStandardizedContributor', 'first_name': None, 'last_name': None, 'name': 'Hang M. Nguyen', 'headline': None}, {'type': 'nonStandardizedContributor', 'first_name': None, 'last_name': None, 'name': 'J.W. van de Vis', 'headline': None}]}, {'name': 'Environmental Impact of Intensive Aquaculture in East Africa.', 'publisher': 'FoodTechAfrica', 'url': None, 'date': {'month': None, 'day': None, 'year': 2016}, 'authors': [{'type': 'standardizedContributor', 'first_name': 'Eugene', 'last_name': 'Rurangwa', 'name': None, 'headline': '1'}, {'type': 'standardizedContributor', 'first_name': 'Edward', 'last_name': 'Schram', 'name': None, 'headline': 'Wageningen Marine Research'}, {'type': 'nonStandardizedContributor', 'first_name': None, 'last_name': None, 'name': 'Kees Goudswaard', 'headline': None}, {'type': 'standardizedContributor', 'first_name': 'Bas', 'last_name': 'Bolman', 'name': None, 'headline': 'Senior advisor Marine and Coastal Management'}]}, {'name': 'Development of Aquaculture in Ghana: Analysis of the fish value chain and potential business cases. IMARES report C021/15', 'publisher': 'Dutch Embassy in Accra, Ghana', 'url': 'http://edepot.wur.nl/337344', 'date': {'month': None, 'day': None, 'year': 2015}, 'authors': [{'type': 'standardizedContributor', 'first_name': 'Eugene', 'last_name': 'Rurangwa', 'name': None, 'headline': '1'}, {'type': 'nonStandardizedContributor', 'first_name': None, 'last_name': None, 'name': 'S.K. Agyakwah, H. Boon, B.C. Bolsman', 'headline': None}]}, {'name': 'Impact of a novel protein meal on the gastrointestinal microbiota and transcriptome of larval zebrafish Danio rerio.', 'publisher': 'Front. Physiol. 6:13', 'url': 'http://journal.frontiersin.org/article/10.3389/fphys.2015.00133/abstract', 'date': {'month': None, 'day': None, 'year': 2015}, 'authors': [{'type': 'standardizedContributor', 'first_name': 'Eugene', 'last_name': 'Rurangwa', 'name': None, 'headline': '1'}, {'type': 'nonStandardizedContributor', 'first_name': None, 'last_name': None, 'name': 'Detmer Sipkema', 'headline': None}, {'type': 'nonStandardizedContributor', 'first_name': None, 'last_name': None, 'name': 'Jeroen Kals', 'headline': None}, {'type': 'nonStandardizedContributor', 'first_name': None, 'last_name': None, 'name': 'Menno ter Veld', 'headline': None}, {'type': 'nonStandardizedContributor', 'first_name': None, 'last_name': None, 'name': 'Maria Forlenza', 'headline': None}, {'type': 'nonStandardizedContributor', 'first_name': None, 'last_name': None, 'name': 'Gianina M. Bacanu', 'headline': None}, {'type': 'nonStandardizedContributor', 'first_name': None, 'last_name': None, 'name': 'Hauke SmidtArjan', 'headline': None}, {'type': 'nonStandardizedContributor', 'first_name': None, 'last_name': None, 'name': 'Arjan P. Palstra', 'headline': None}]}, {'name': 'Feasibility study of fish farming in the Mau Mara Serengeti (MaMaSe) Sustainable Water Initiative.  MaMaSe project. IMARES report C169/14.', 'publisher': 'Alterra/Wageningen UR', 'url': None, 'date': {'month': None, 'day': None, 'year': 2015}, 'authors': [{'type': 'standardizedContributor', 'first_name': 'Eugene', 'last_name': 'Rurangwa', 'name': None, 'headline': '1'}, {'type': 'standardizedContributor', 'first_name': 'Ruth', 'last_name': 'van Werven', 'name': None, 'headline': 'Omgevingsmanager team waterveiligheid'}, {'type': 'standardizedContributor', 'first_name': 'Bas', 'last_name': 'Bolman', 'name': None, 'headline': 'Senior advisor Marine and Coastal Management'}]}, {'name': 'Fish silage as feed ingredient for fish and livestock. IMARES report C135/14', 'publisher': 'Dutch Top Sector Agri & Food', 'url': 'http://edepot.wur.nl/327115', 'date': {'month': None, 'day': None, 'year': 2014}, 'authors': [{'type': 'standardizedContributor', 'first_name': 'Eugene', 'last_name': 'Rurangwa', 'name': None, 'headline': '1'}, {'type': 'nonStandardizedContributor', 'first_name': None, 'last_name': None, 'name': 'Aad van Vuuren', 'headline': None}, {'type': 'standardizedContributor', 'first_name': 'Marnix', 'last_name': 'Poelman', 'name': None, 'headline': 'Researcher / project manager at Wageningen Marine Research'}]}, {'name': 'Aquaculture in East Africa: a regional approach.  IMARES report C153/14, LEI report 14-120.  ISBN 2352-4243.', 'publisher': 'Dutch Ministry of Economic Affairs', 'url': 'http://edepot.wur.nl/324139', 'date': {'month': None, 'day': None, 'year': 2014}, 'authors': [{'type': 'standardizedContributor', 'first_name': 'Eugene', 'last_name': 'Rurangwa', 'name': None, 'headline': '1'}, {'type': 'nonStandardizedContributor', 'first_name': None, 'last_name': None, 'name': 'Mike Turenhout', 'headline': None}, {'type': 'nonStandardizedContributor', 'first_name': None, 'last_name': None, 'name': 'Arie Pieter van DuijnArjen', 'headline': None}, {'type': 'nonStandardizedContributor', 'first_name': None, 'last_name': None, 'name': 'Arjen Roem', 'headline': None}, {'type': 'nonStandardizedContributor', 'first_name': None, 'last_name': None, 'name': 'Egid Katunzi', 'headline': None}, {'type': 'nonStandardizedContributor', 'first_name': None, 'last_name': None, 'name': 'Amon Shoko', 'headline': None}, {'type': 'nonStandardizedContributor', 'first_name': None, 'last_name': None, 'name': 'Jean Bosco Kabagambe', 'headline': None}]}, {'name': 'Mission Report of a Quick Assessment of needs.  IMARES report C112.14.', 'publisher': 'Safeway College of Technology/Department of Aquaculture', 'url': None, 'date': {'month': None, 'day': None, 'year': 2014}, 'authors': [{'type': 'standardizedContributor', 'first_name': 'Eugene', 'last_name': 'Rurangwa', 'name': None, 'headline': '1'}]}, {'name': ""Mission exploratoire de la pêche, pisciculture et de l'aquaculture au Bénin: un quick scan du secteur pour des possibilités d'interventions. LEI report 14-049/IMARES report C072/14"", 'publisher': 'Ambassade du Royaume des Pays-Bas à Cotonou, Bénin', 'url': 'http://edepot.wur.nl/308953', 'date': {'month': None, 'day': None, 'year': 2014}, 'authors': [{'type': 'standardizedContributor', 'first_name': 'Eugene', 'last_name': 'Rurangwa', 'name': None, 'headline': '1'}, {'type': 'standardizedContributor', 'first_name': 'Jolanda', 'last_name': 'van den Berg', 'name': None, 'headline': 'Senior Researcher Environment and Development, Wageningen Economic Research (former LEI), Wageningen UR'}, {'type': 'nonStandardizedContributor', 'first_name': None, 'last_name': None, 'name': 'Philipe Laleye', 'headline': None}, {'type': 'standardizedContributor', 'first_name': 'Arie Pieter', 'last_name': 'van Duijn', 'name': None, 'headline': 'Researcher and Independent Consultant at A P'}]}, {'name': 'Fermentation of Arabinoxylan-Oligosaccharides, Oligofructose and their Monomeric Sugars by Hindgut Bacteria from Siberian Sturgeon and African Catfish in Batch Culture in vitro', 'publisher': 'Journal of Aquaculture Research & Development 2014, 5:3', 'url': 'http://omicsonline.org/open-access/fermentation-of-arabinoxylanoligosaccharides-oligofructose-and-their-monomeric-sugars-by-hindgut-bacteria-from-siberian-sturgeon-and-african-catfish-in-batch-culture-in-vitro-2155-9546.1000230.php?aid=27002', 'date': {'month': None, 'day': None, 'year': 2014}, 'authors': [{'type': 'standardizedContributor', 'first_name': 'Eugene', 'last_name': 'Rurangwa', 'name': None, 'headline': '1'}, {'type': 'standardizedContributor', 'first_name': 'Zahra', 'last_name': 'Geraylou', 'name': None, 'headline': 'Senior R&D Engineer'}, {'type': 'nonStandardizedContributor', 'first_name': None, 'last_name': None, 'name': 'Tom van de Wiele', 'headline': None}, {'type': 'standardizedContributor', 'first_name': 'Christophe', 'last_name': 'Courtin', 'name': None, 'headline': 'Professor at KU Leuven'}, {'type': 'nonStandardizedContributor', 'first_name': None, 'last_name': None, 'name': 'Jan A. Delcour', 'headline': None}, {'type': 'standardizedContributor', 'first_name': 'Johan', 'last_name': 'Buyse', 'name': None, 'headline': 'Professor at KU Leuven'}, {'type': 'nonStandardizedContributor', 'first_name': None, 'last_name': None, 'name': 'Frans Ollevier', 'headline': None}]}, {'name': 'Comparison of aquaculture farming methods for Kenya', 'publisher': 'FoodTechAfrica', 'url': 'http://edepot.wur.nl/332040', 'date': {'month': None, 'day': None, 'year': 2014}, 'authors': [{'type': 'standardizedContributor', 'first_name': 'Eugene', 'last_name': 'Rurangwa', 'name': None, 'headline': '1'}, {'type': 'nonStandardizedContributor', 'first_name': None, 'last_name': None, 'name': 'Andries Kamstra', 'headline': None}, {'type': 'nonStandardizedContributor', 'first_name': None, 'last_name': None, 'name': 'Victor Bierbooms', 'headline': None}, {'type': 'nonStandardizedContributor', 'first_name': None, 'last_name': None, 'name': 'F. Aartsen', 'headline': None}, {'type': 'nonStandardizedContributor', 'first_name': None, 'last_name': None, 'name': 'Ep Eding', 'headline': None}, {'type': 'nonStandardizedContributor', 'first_name': None, 'last_name': None, 'name': 'R. Stokkers', 'headline': None}, {'type': 'standardizedContributor', 'first_name': 'Arie Pieter', 'last_name': 'van Duijn', 'name': None, 'headline': 'Researcher and Independent Consultant at A P'}]}, {'name': 'Microorganisms in recirculating aquaculture systems and their management', 'publisher': 'Reviews in Aquaculture 5, 1–14', 'url': 'http://onlinelibrary.wiley.com/doi/10.1111/raq.12057/abstract', 'date': {'month': None, 'day': None, 'year': 2014}, 'authors': [{'type': 'standardizedContributor', 'first_name': 'Eugene', 'last_name': 'Rurangwa', 'name': None, 'headline': '1'}, {'type': 'nonStandardizedContributor', 'first_name': None, 'last_name': None, 'name': 'Marc C.J. Verdegem', 'headline': None}]}, {'name': 'In vitro selection and characterization of putative probiotics isolated from the gut of Acipenser baerii (Brandt, 1869)', 'publisher': 'Aquaculture Research 45, 341-352', 'url': 'http://onlinelibrary.wiley.com/doi/10.1111/j.1365-2109.2012.03232.x/full', 'date': {'month': None, 'day': None, 'year': 2012}, 'authors': [{'type': 'standardizedContributor', 'first_name': 'Eugene', 'last_name': 'Rurangwa', 'name': None, 'headline': '1'}, {'type': 'standardizedContributor', 'first_name': 'Zahra', 'last_name': 'Geraylou', 'name': None, 'headline': 'Senior R&D Engineer'}, {'type': 'nonStandardizedContributor', 'first_name': None, 'last_name': None, 'name': 'Maarten P M Vanhove', 'headline': None}, {'type': 'nonStandardizedContributor', 'first_name': None, 'last_name': None, 'name': 'Caroline Souffreau', 'headline': None}, {'type': 'standardizedContributor', 'first_name': 'Johan', 'last_name': 'Buyse', 'name': None, 'headline': 'Professor at KU Leuven'}, {'type': 'nonStandardizedContributor', 'first_name': None, 'last_name': None, 'name': 'Frans Ollevier', 'headline': None}]}]",[],[],"[{'company': {'id': 166859, 'name': 'Wageningen UR (University & Research centre)', 'logo': 'https://media.licdn.com/dms/image/C510BAQFQJQXtOy2Stw/company-logo_400_400/0/1519889640020?e=1700697600&v=beta&t=DfM4gdRk76TMhZBoa5gWFhnkNZBuUm47LktavPNU9gg', 'url': 'https://www.linkedin.com/school/wageningenuniversity/', 'employees': {'start': 5001, 'end': 10000}}, 'date': {'start': {'month': 5, 'day': None, 'year': 2009}, 'end': {'month': None, 'day': None, 'year': None}}, 'profile_positions': [{'location': 'The Netherlands', 'date': {'start': {'month': 5, 'day': None, 'year': 2009}, 'end': {'month': None, 'day': None, 'year': None}}, 'company': 'Wageningen University & Research', 'description': 'Project Development and Management\nResearch conducting and results dissemination\nPublication and evaluation of project reports\nPublication of peer-reviewed scientific articles and public papers', 'title': 'Researcher and Project Leader Aquaculture (IMARES)', 'employment_type': None}]}, {'company': {'id': 3629, 'name': 'KU Leuven', 'logo': 'https://media.licdn.com/dms/image/C560BAQHAtw6LesXG-w/company-logo_400_400/0/1519856403240?e=1700697600&v=beta&t=TFY_wkkDte_zqbephqgB-m5rxmhTCyRntHSJeh3qUYI', 'url': 'https://www.linkedin.com/school/ku_leuven/', 'employees': {'start': 10001, 'end': None}}, 'date': {'start': {'month': 11, 'day': None, 'year': 1998}, 'end': {'month': 4, 'day': None, 'year': 2009}}, 'profile_positions': [{'location': 'Leuven, Belgium', 'date': {'start': {'month': 11, 'day': None, 'year': 2004}, 'end': {'month': 4, 'day': None, 'year': 2009}}, 'company': 'KU Leuven', 'description': 'Research Aquatic Toxicology and Microbiology of Aquatic Systems;  Environmental Pollution Biomonitoring; Training and Supervision of MSc and PhD Students at the KU Leuven and the Gent University (Aquaculture Master Program)', 'title': 'Post-Doctoral Assistant', 'employment_type': None}, {'location': 'Leuven, Belgium', 'date': {'start': {'month': 11, 'day': None, 'year': 1998}, 'end': {'month': 10, 'day': None, 'year': 2004}}, 'company': 'KU Leuven', 'description': 'Project Management; Research on development of environmental toxicity biomarkers and spermatoxicology', 'title': 'Scientific Collaborator', 'employment_type': None}]}, {'company': {'id': None, 'name': 'National University of Rwanda', 'logo': None, 'url': None, 'employees': {'start': None, 'end': None}}, 'date': {'start': {'month': 8, 'day': None, 'year': 1986}, 'end': {'month': 4, 'day': None, 'year': 1994}}, 'profile_positions': [{'location': 'Butare, Rwanda', 'date': {'start': {'month': 2, 'day': None, 'year': 1991}, 'end': {'month': 4, 'day': None, 'year': 1994}}, 'company': 'National University of Rwanda', 'description': 'Breeding, Nutrition, Monoculture and Polyculture Production of Fish in Ponds, Integrated Agriculture-Aquaculture, Water Quality Management in Ponds, Processing of Nile tilapia and African catfish; Teaching and Supervision of Thesis Students at the National University of Rwanda', 'title': 'Researcher Homologue of the Belgian Flemish InterUniversity Research Project ""Clarias au Rwanda""', 'employment_type': None}, {'location': 'Rwasave - Butare, Rwanda', 'date': {'start': {'month': 3, 'day': None, 'year': 1988}, 'end': {'month': 12, 'day': None, 'year': 1991}}, 'company': 'National University of Rwanda', 'description': 'Research, Direction and Management of the Rwasave Fish Culture Research Center; Teaching and Supervision of Thesis Students at the National University of Rwanda', 'title': 'Managing Director of the Aquaculture Research Centre', 'employment_type': None}, {'location': 'Rwasave - Butare, Rwanda', 'date': {'start': {'month': 8, 'day': None, 'year': 1986}, 'end': {'month': 1, 'day': None, 'year': 1991}}, 'company': 'National University of Rwanda', 'description': 'Pond aquaculture, Pond fertilisation, Fish breeding and Production, Pond nutrient dynamics, Water quality; Teaching and Supervision of Thesis Students at the National University of Rwanda', 'title': 'Research Associate of the US AID Pond Dynamics/Collaborative Research Support Program (CRSP)', 'employment_type': None}]}, {'company': {'id': None, 'name': 'Rwanda Agricultural Research Institute (ISAR)', 'logo': None, 'url': None, 'employees': {'start': None, 'end': None}}, 'date': {'start': {'month': 12, 'day': None, 'year': 1988}, 'end': {'month': 1, 'day': None, 'year': 1991}}, 'profile_positions': [{'location': 'Rubona - Butare, Rwanda', 'date': {'start': {'month': 12, 'day': None, 'year': 1988}, 'end': {'month': 1, 'day': None, 'year': 1991}}, 'company': 'Rwanda Agricultural Research Institute (ISAR)', 'description': 'Member of the Board of Directors and Representative of Researchers', 'title': 'Member of the Board of Directors', 'employment_type': None}]}]","[{'date': {'start': {'month': 3, 'day': None, 'year': 2011}, 'end': {'month': None, 'day': None, 'year': None}}, 'role': 'Elected Vice-President of the Rwandese Community in the City of Leuven, Belgium', 'company': {'id': None, 'name': 'RDGN & DRB', 'logo': None, 'url': None}, 'cause': 'CIVIL_RIGHTS', 'description': 'As a member the Rwandan Diaspora Global Network (RDGN) and part of the elected comité of the Diaspora Rwandaise de Belgique (DRB Rugali) in the city of Leuven (Belgium), I am in charge of the community organisation, development and insertion and maintaining the bond with the homeland. We organise cultural activities and debates around several topics with the Belgian Flemish community for smooth integration, intellectual and economic development of the community, support of the vulnerable groups.  As vice-president, I replace the president in his absence.'}]",['Aquaculture'],,,
