profile_id,first_name,last_name,sub_title,profile_picture,background_image,profile_type,entity_urn,object_urn,birth_date,summary,location,premium,influencer,treasury_media,languages,industry,education,patents,awards,certifications,organizations,projects,publications,courses,test_scores,position_groups,volunteer_experiences,skills,network_info,related_profiles,contact_info
benno-ridderhof-b9315a10,Benno,Ridderhof,I'm faster than a RTS and cheaper than a Polish P.,https://media.licdn.com/dms/image/C5603AQFiYMhZVEuzJg/profile-displayphoto-shrink_800_800/0/1517714618343?e=1697673600&v=beta&t=5ap0bYoIGly1xaOwawZzKnS6a8W6kQo4ZJtHK5fcrxE,https://media.licdn.com/dms/image/C5616AQFVN7vnGx0ZMQ/profile-displaybackgroundimage-shrink_350_1400/0/1517714618971?e=1697673600&v=beta&t=7f4aexESQcgtlabFNw6BJn8kHSC45_pDaAyACCURuBQ,personal,ACoAAAIoax8B_A_gbY7yubpcjDzun04-co5qZ0g,36203295,,"At the VU University Amsterdam.  

1. Database and descriptive statictics. (Access)The course is an extensive introduction into the correct creation and use of structured data in a database environment. Students of Archaeology, Near Eastern Studies and Ancient History follow this course. Students of general history will have the opportunity to follow this course from 2011. Recommended books:  EA Abbott: Flatland, R Kaplan: The nothing that is.

2.  Ancient cartography. A map is not just a map, it is much more. Old maps are far more instructive than most people think. Students will learn the meaning and the intentions of maps as well as their projection systems. Recommended books: JP Snyder; Flattening the Earth.

3. Visual disclosure of scientific data part 1: Vectorizing your material.
Students of Archaeology, Near Eastern Studies and Ancient History learn how to vectorise your old drawings correctly and prepare them for scientific analysis. (Program: AutoCAD) It is imperative that they learn about basic trigonometry, so special attention is given to this subject. During the course and the test they are not allowed to use a calculator. This course is followed by students from all over Holland and exchange students from Italy. Recommended books:  S Gibilisco: Trigonometry demystified.

4. Visual disclosure of scientific data part 2: An introduction into the correct use of GIS.
Students of Archaeology, Near Eastern Studies and Ancient History will learn how to collect and prepare de different types of digital data for use in a GIS environment. Only then are they allowed to analyze it in GIS. No Book, only a reader which I wrote myself.

5. Correct use of measuring equipment at archeological sites.
In this course student will learn to operate dumpy levels, theodolites and total stations correctly.
All courses are open to students from other Universities. 
For more information please look at the digital Rosters of the university

Specialties: Vectorizing 

MBB
It has been a busy time MBB has vectorized al lot of old excavations from The Netherlands  for scientific research: Apeldoorn, Dorestad(Wijk bij Duurstede) settlement ongoing, all the cemeteries are finished(3000 drawings finished, 1500 to go), Valkenburg de Woerd, settlement  Wageningen cemetery, Voerendaal, villa, Wijchen, cemetery, Ede, supervising, Goedereede, settlement, Aardenburg ongoing, settlement. The applied method is becoming a standard for old excavations.","{'country': 'Netherlands', 'short': 'Amsterdam, North Holland', 'city': 'Amsterdam', 'state': 'North Holland', 'default': 'Amsterdam, North Holland, Netherlands'}",False,False,[],"{'primary_locale': {'country': 'US', 'language': 'en'}, 'supported_locales': [{'country': 'US', 'language': 'en'}], 'profile_languages': [{'name': 'Dutch', 'proficiency': 'NATIVE_OR_BILINGUAL'}, {'name': 'English', 'proficiency': 'FULL_PROFESSIONAL'}, {'name': 'French', 'proficiency': 'PROFESSIONAL_WORKING'}, {'name': 'German', 'proficiency': 'FULL_PROFESSIONAL'}, {'name': 'Italian', 'proficiency': 'LIMITED_WORKING'}, {'name': 'Latin', 'proficiency': 'LIMITED_WORKING'}, {'name': 'Sanskrit', 'proficiency': 'ELEMENTARY'}]}",Education Management,"[{'date': {'start': {'month': None, 'day': None, 'year': 1984}, 'end': {'month': None, 'day': None, 'year': 1994}}, 'school': {'name': 'Vrije Universiteit Amsterdam (VU Amsterdam)', 'logo': 'https://media.licdn.com/dms/image/D4E0BAQGFG964atm3Ow/company-logo_400_400/0/1682661887840?e=1700092800&v=beta&t=9_w6JN2W8tFzLfJtY_8RcNmqQZzGUlcMXQLryo-X764', 'url': 'https://www.linkedin.com/school/vrije-universiteit-amsterdam/'}, 'degree_name': 'drs', 'field_of_study': 'archaeologie, Ancient History, Religious Antropology'}, {'date': {'start': {'month': None, 'day': None, 'year': None}, 'end': {'month': None, 'day': None, 'year': None}}, 'school': {'name': 'wilhemina mavo', 'logo': None, 'url': None}, 'degree_name': None, 'field_of_study': None}]",[],[],[],[],[],[],[],[],"[{'company': {'id': None, 'name': 'Francia Media', 'logo': None, 'url': None, 'employees': {'start': None, 'end': None}}, 'date': {'start': {'month': 11, 'day': None, 'year': 2010}, 'end': {'month': None, 'day': None, 'year': None}}, 'profile_positions': [{'location': None, 'date': {'start': {'month': 11, 'day': None, 'year': 2010}, 'end': {'month': None, 'day': None, 'year': None}}, 'company': 'Francia Media', 'description': None, 'title': 'Planning, coordination and implementation of the vectorisation of early Medieval/Carolingian Europe', 'employment_type': None}]}, {'company': {'id': None, 'name': 'CLUE', 'logo': None, 'url': None, 'employees': {'start': None, 'end': None}}, 'date': {'start': {'month': None, 'day': None, 'year': 2010}, 'end': {'month': None, 'day': None, 'year': None}}, 'profile_positions': [{'location': None, 'date': {'start': {'month': None, 'day': None, 'year': 2010}, 'end': {'month': None, 'day': None, 'year': None}}, 'company': 'CLUE', 'description': None, 'title': 'senior advisor on vectorisation of old heritage material', 'employment_type': None}]}, {'company': {'id': None, 'name': 'city archeology of Vienna', 'logo': None, 'url': None, 'employees': {'start': None, 'end': None}}, 'date': {'start': {'month': None, 'day': None, 'year': 2008}, 'end': {'month': None, 'day': None, 'year': None}}, 'profile_positions': [{'location': None, 'date': {'start': {'month': None, 'day': None, 'year': 2008}, 'end': {'month': None, 'day': None, 'year': None}}, 'company': 'city archeology of Vienna', 'description': 'Organizing Workshops and sessions at the yearly conference ""Kulturelles Erbe und Neue Technologien"" in Vienna hosted by Wolfgang Börner.', 'title': 'Member of the scientific comity of the yearly conference ""Kulturelles Erbe und Neue Technologien"" in', 'employment_type': None}]}, {'company': {'id': None, 'name': 'mud blood and beer', 'logo': None, 'url': None, 'employees': {'start': None, 'end': None}}, 'date': {'start': {'month': 4, 'day': None, 'year': 2005}, 'end': {'month': None, 'day': None, 'year': None}}, 'profile_positions': [{'location': None, 'date': {'start': {'month': 4, 'day': None, 'year': 2005}, 'end': {'month': None, 'day': None, 'year': None}}, 'company': 'mud blood and beer', 'description': 'As director and sole employee of MBB I specialize in digital disclosure of old excavations.', 'title': 'director and sole employee', 'employment_type': None}]}, {'company': {'id': 338695, 'name': 'Rijksdienst voor het Cultureel Erfgoed (State Service for Cultural Heritage)', 'logo': 'https://media.licdn.com/dms/image/C4D0BAQG8GHwIeEgSSQ/company-logo_400_400/0/1573642609313?e=1700092800&v=beta&t=RhDYZUhYPTFBWNDOPFnbl-DNlSSApe9uLGUWGjdGauU', 'url': 'https://www.linkedin.com/company/rijksdienst-voor-het-cultureel-erfgoed-state-service-for-cultural-heritage-/', 'employees': {'start': 201, 'end': 500}}, 'date': {'start': {'month': None, 'day': None, 'year': 2003}, 'end': {'month': None, 'day': None, 'year': None}}, 'profile_positions': [{'location': None, 'date': {'start': {'month': None, 'day': None, 'year': 2003}, 'end': {'month': None, 'day': None, 'year': None}}, 'company': 'Cultural Heritage Agency of the Netherlands', 'description': None, 'title': 'freelance', 'employment_type': None}]}, {'company': {'id': 5570, 'name': 'Vrije Universiteit Amsterdam', 'logo': 'https://media.licdn.com/dms/image/D4E0BAQGFG964atm3Ow/company-logo_400_400/0/1682661887840?e=1700092800&v=beta&t=9_w6JN2W8tFzLfJtY_8RcNmqQZzGUlcMXQLryo-X764', 'url': 'https://www.linkedin.com/school/vrije-universiteit-amsterdam/', 'employees': {'start': 1001, 'end': 5000}}, 'date': {'start': {'month': 9, 'day': None, 'year': 1997}, 'end': {'month': None, 'day': None, 'year': None}}, 'profile_positions': [{'location': None, 'date': {'start': {'month': 9, 'day': None, 'year': 1997}, 'end': {'month': None, 'day': None, 'year': None}}, 'company': 'Vrije Universiteit Amsterdam (VU Amsterdam)', 'description': None, 'title': 'drs', 'employment_type': None}]}, {'company': {'id': 6077, 'name': 'Leiden University', 'logo': 'https://media.licdn.com/dms/image/C4D0BAQEFlK1wNecYbA/company-logo_400_400/0/1519855876129?e=1700092800&v=beta&t=_Ka1xca3IfdCHmeD7q7WGgDYObpZ56ZjJTvjnjfwxW0', 'url': 'https://www.linkedin.com/school/leiden-university/', 'employees': {'start': 1001, 'end': 5000}}, 'date': {'start': {'month': None, 'day': None, 'year': 1999}, 'end': {'month': None, 'day': None, 'year': 2000}}, 'profile_positions': [{'location': None, 'date': {'start': {'month': None, 'day': None, 'year': 1999}, 'end': {'month': None, 'day': None, 'year': 2000}}, 'company': 'Leiden University', 'description': None, 'title': 'It-specialist at the faculty of archaeology', 'employment_type': None}]}]",[],"['GIS analysis', 'Cartography', 'Digital Mapping', 'LiDAR', 'CAD', 'Measurement Systems', 'Trigonometry', 'History', 'Archaeology', 'GIS', 'Cultural Heritage', 'Teaching', 'Geography', 'Museums', 'Lecturing', 'Databases', 'Museum Collections', 'Research', 'Peplum movies', 'Anthropology']",,,
