profile_id,first_name,last_name,sub_title,profile_picture,background_image,profile_type,entity_urn,object_urn,birth_date,summary,location,premium,influencer,treasury_media,languages,industry,education,patents,awards,certifications,organizations,projects,publications,courses,test_scores,position_groups,volunteer_experiences,skills,network_info,related_profiles,contact_info
jingwangnl,Jing,Wang,FinTech | Banking | Financial Institution | KYC | CDD | COB | ODD | AML | CFT | Wwft | Transaction Monitoring | Risk Analysis | Account Management | Customer Service | Ms Office Suite | Core Banking | CAMLS pursuing,https://media.licdn.com/dms/image/C4D03AQEhJ7lEicbsNQ/profile-displayphoto-shrink_800_800/0/1648976716153?e=1697673600&v=beta&t=R0qR0tFgDsPKjjwJdDviaxmg8CqGnMkwlAlJk2aHrOw,https://media.licdn.com/dms/image/C4E16AQFP10kG2bqy6g/profile-displaybackgroundimage-shrink_350_1400/0/1651231746376?e=1697673600&v=beta&t=64fBZf4Jekh4PUMuByN6O3NKE-3OWWFX7irOOEUtWhE,personal,ACoAABJ-bJIBbW-LtNwARlJGjbLVzfeogs7NcAA,310275218,,"How will you define to make business success?
What does challenge mean to you?
How about learning?

To me, business success is business compliance and sustainability. Being a KYC officer, I am the gate keeper of our bank to prevent it from being used by financial crimes, to ensure it satisfies with the regulatory and compliance requirements, and to help it to appear more trustworthy to potential new customer, to understand customer’s profile, to serve the customer better and manage its risks prudently.

Keeping self-challenge is never easy but it makes me become a better version of myself. After nine years of working as a contract and commercial manager in the telecommunication sector, I changed my career to banking industry and became a KYC officer. It was proved by fact that I had made a right decision.

I believe in never stop learning. It is my way to explore and experience the world, spiritually and physically. So to me, learning is not just about courses, training and reading. It is also about to know and understand different people, to travel and discover a new city, and to take in different cultures. All those ways helped me to become who am I and to the “Me” I like.

If you are interested to have a talk to me, feel free to DM me via Linkdin or send me an email: J.WONG5518@gmail.com🍀","{'country': 'Netherlands', 'short': 'Leidschendam, South Holland', 'city': 'Leidschendam', 'state': 'South Holland', 'default': 'Leidschendam, South Holland, Netherlands'}",False,False,[],"{'primary_locale': {'country': 'US', 'language': 'en'}, 'supported_locales': [{'country': 'US', 'language': 'en'}], 'profile_languages': [{'name': 'Chinese', 'proficiency': 'NATIVE_OR_BILINGUAL'}, {'name': 'English', 'proficiency': 'FULL_PROFESSIONAL'}, {'name': 'Mandarin', 'proficiency': 'NATIVE_OR_BILINGUAL'}]}",Banking,"[{'date': {'start': {'month': None, 'day': None, 'year': None}, 'end': {'month': None, 'day': None, 'year': None}}, 'school': {'name': 'Tianjin University', 'logo': 'https://media.licdn.com/dms/image/C560BAQF4wed2P4L9EA/company-logo_400_400/0/1519900670824?e=1700697600&v=beta&t=OEtDNH4m4na1dd49xd9hP-FU0pbu8mWMuhmHc82IyTk', 'url': 'https://www.linkedin.com/school/tianjin-university/'}, 'degree_name': ""Master's degree"", 'field_of_study': 'Management Science and Engineering'}, {'date': {'start': {'month': None, 'day': None, 'year': None}, 'end': {'month': None, 'day': None, 'year': None}}, 'school': {'name': 'Tianjin University', 'logo': 'https://media.licdn.com/dms/image/C560BAQF4wed2P4L9EA/company-logo_400_400/0/1519900670824?e=1700697600&v=beta&t=OEtDNH4m4na1dd49xd9hP-FU0pbu8mWMuhmHc82IyTk', 'url': 'https://www.linkedin.com/school/tianjin-university/'}, 'degree_name': ""Bachelor's degree"", 'field_of_study': 'Process Equipment & Control Engineering'}, {'date': {'start': {'month': None, 'day': None, 'year': None}, 'end': {'month': None, 'day': None, 'year': None}}, 'school': {'name': 'Tianjin University', 'logo': 'https://media.licdn.com/dms/image/C560BAQF4wed2P4L9EA/company-logo_400_400/0/1519900670824?e=1700697600&v=beta&t=OEtDNH4m4na1dd49xd9hP-FU0pbu8mWMuhmHc82IyTk', 'url': 'https://www.linkedin.com/school/tianjin-university/'}, 'degree_name': ""Bachelor's degree"", 'field_of_study': 'Financial Management'}]",[],"[{'title': ""CEO's Commendation "", 'description': None, 'issuer': 'Huawei Technoloies Co.Ltd    ', 'date': {'month': 5, 'day': None, 'year': 2018}}, {'title': 'Excellent Employee', 'description': 'For outstanding performance and last contribution', 'issuer': 'WEU Contrcat  Commercial & Fulfillment Management Dept.', 'date': {'month': 8, 'day': None, 'year': 2013}}]",[],[],[],[],[],[],"[{'company': {'id': 13801, 'name': 'Bank of China', 'logo': 'https://media.licdn.com/dms/image/C4E0BAQESGRoshOPpWg/company-logo_400_400/0/1519856344275?e=1700697600&v=beta&t=oMx5Yg-5IGNzEtmrg_5cCTnpW9llCSGUPIq128hp2VI', 'url': 'https://www.linkedin.com/company/bank-of-china/', 'employees': {'start': 10001, 'end': None}}, 'date': {'start': {'month': 2, 'day': None, 'year': 2019}, 'end': {'month': None, 'day': None, 'year': None}}, 'profile_positions': [{'location': 'Rotterdam, South Holland, Netherlands', 'date': {'start': {'month': 2, 'day': None, 'year': 2019}, 'end': {'month': None, 'day': None, 'year': None}}, 'company': 'Bank of China', 'description': '•\tRoutinely research for Industrial KYC services up to +/- 4 new cases per month to keep internal KYC procedure up-to-date with the latest legislation, new methods, procedures and technologies for AML/CFT. The BOC KYC service keeps in the lead of industrial practice.\n•\tDesign and improve 2-4 policies and procedures of BOC KYC every year to strengthen daily execution & operation and create more effective AML compliance. The operation of each procedure has been increased +/- 10%.\n•\tIdentify and investigate if any Money Laundering or Terrorist Financing cautionary flags to control suspicious activities and ensure full compliance for +/- 40 corporate customers.\n•\tEnsure +/- 10 new corporate customers are effectively on boarded per year to expand BOC customer portfolio. All new corporate customer portfolios are 100% complaint with legislation and regulations as well as Bank of China’s internal processes.\n•\tProvide daily advisory as primary contact to customer to truly understand customer needs, provide optimum service and improve customer engagement whilst remaining compliant.\n•\tMentor (junior) team member daily and review his output ensure quality of work; ensure the team to meet the requirement of the efficiency as well as compliance.', 'title': 'KYC Officer', 'employment_type': 'Full-time'}]}, {'company': {'id': 3014, 'name': 'Huawei Technologies', 'logo': 'https://media.licdn.com/dms/image/C510BAQEtZ01_ey5nIA/company-logo_400_400/0/1586016478298?e=1700697600&v=beta&t=dJ2IOca1rPXrrck56_Uy8wjK330x_fcQ5LZZDwIblOo', 'url': 'https://www.linkedin.com/company/huawei/', 'employees': {'start': 10001, 'end': None}}, 'date': {'start': {'month': 2, 'day': None, 'year': 2011}, 'end': {'month': 2, 'day': None, 'year': 2019}}, 'profile_positions': [{'location': 'Den Haag, North Brabant Province, Netherlands', 'date': {'start': {'month': 4, 'day': None, 'year': 2014}, 'end': {'month': 2, 'day': None, 'year': 2019}}, 'company': 'Huawei', 'description': ""•\tEngagement in key customer\no\tLed the commercial & contract negotiation team (4 FTE) and negotiated sales contracts with customer, ensure the success of the negotiation and business.\no\tDesigned the business model, worked together with cross-functional teams, including Product & Service, Legal, and Finance etc. to meet customer's needs as well as keep company's best interest.\no\tSuccessfully signed the contracts of corporate level projects with contract amount more than XX M EUR.\n•\tLed the “Managed Contract Execution” process\no\t Managed contract process, responsible for the process improvements to ensure the effectiveness and efficiency.\no\t  Improved the days sales outstanding (DSO) by 10 days and inventory turnover outstanding (ITO) by 15 days.\no\tReduced the average purchase order process period from 6 days to 2 days in 2017.\no\tAwarded for the excellent team for payment terms management in 2018.\n•\tManaged the “Manage Authorization Execution” process\no\t Regulated and optimized the Authorization Execution process.\no\tThe management maturity of the decision making team ranked TOP3 in WEU region every year. \no\tProvided comprehensive suggestion based on the strategy, finance and risk to support C- level management to make decisions for biding and sales contract in a more efficient and effective manner.\no\tAnalysed the projects P&L of bid projects & sales contracts and monthly reported to CEO and management team, improve the efficiency & effectiveness and ensure the balance of the project profit and risk.\n•\tTeam Management of 4 FTE: \no\tThe department KPI ranked TOP 3 among the 9 representative offices in WEU region every year.\no\tResponsible for team operation and management\no\tSet the department annual KPI aligning with the corporate strategy, managed the Personal Performance of the team members\no\tProvided mentoring, advise and support team members to make sure the timely accomplishment of the project and to improve the individual and team capability"", 'title': 'Director of Contract and Commercial Dept.', 'employment_type': None}, {'location': 'Düsseldorf Area, Germany', 'date': {'start': {'month': 2, 'day': None, 'year': 2011}, 'end': {'month': 4, 'day': None, 'year': 2014}}, 'company': 'Huawei', 'description': '•\tensured a price-effective but commercially healthy solution through analysing and calculating project P&L based on company delegation\n•\tLooked for alternative and innovative solutions where appropriate by leading the SOC response to commercial and financial requirements of (incl. but not limited to general terms and conditions) in the tender documents. .\n•\tEnsured the proposals and contract are realistic, risk-balanced and fit for win-win purposes\n•\tParticipated in and successfully complete implementing LTC (lead to cash) process and tooling to the 9 representative offices in WEU region by providing training and operation support.\n•\tDesigned case studies and provided training to 100+ employees/year in commercial excellence and best practices sharing', 'title': ' Commercial Manager', 'employment_type': None}]}]",[],"['KYC', 'CDD', 'Anti Money Laundering', 'Customer Relationship Management (CRM)', 'finance', 'Telecommunications', 'Contract Management', 'Cost Management', 'Business Process Improvement', 'Project Delivery', 'Cost Control', 'Project Planning', 'Change Management', 'Process Management', 'Purchase Orders', 'Risk Management', 'Data Analysis', 'Project Management', 'Financial Analysis', 'P&L']",,,
