profile_id,first_name,last_name,sub_title,profile_picture,background_image,profile_type,entity_urn,object_urn,birth_date,summary,location,premium,influencer,treasury_media,languages,industry,education,patents,awards,certifications,organizations,projects,publications,courses,test_scores,position_groups,volunteer_experiences,skills,network_info,related_profiles,contact_info
junyupkim,Junyup,Kim,Treasury Officer at Hana Bank Amsterdam Branch,https://media.licdn.com/dms/image/C4E03AQHDwmYVGDsjvQ/profile-displayphoto-shrink_800_800/0/1644686039920?e=1697673600&v=beta&t=bsfVrt3E0yCjRK4rSCZbIOVVZ04DhGKQ-pFHI-ip12g,https://media.licdn.com/dms/image/D4E16AQGXKrvo7VqN9w/profile-displaybackgroundimage-shrink_350_1400/0/1675613087223?e=1697673600&v=beta&t=RxtLqmfS__RmrXyb3td62fwQINm8lruV3m-0sn7PmKE,personal,ACoAAAzL928BmVlP3Ayg77EiGR42Br6S4UHMXzg,214693743,,"■ A proactive, responsible, innovative, and enthusiastic analyst and researcher 
■ Professional experience in the financial market, the field of economic research & policy suggestion
■ Core competencies include: 
— Quantitative/Qualitative Analysis, Risk Analytics, Communication and Project Management, Learning Agility, Financial and Economic Data Management and Programming","{'country': 'Netherlands', 'short': 'Amsterdam, North Holland', 'city': 'Amsterdam', 'state': 'North Holland', 'default': 'Amsterdam, North Holland, Netherlands'}",False,False,[],"{'primary_locale': {'country': 'US', 'language': 'en'}, 'supported_locales': [{'country': 'US', 'language': 'en'}], 'profile_languages': [{'name': 'Dutch', 'proficiency': 'ELEMENTARY'}, {'name': 'English', 'proficiency': 'FULL_PROFESSIONAL'}, {'name': 'Korean', 'proficiency': 'NATIVE_OR_BILINGUAL'}]}",Financial Services,"[{'date': {'start': {'month': None, 'day': None, 'year': 2015}, 'end': {'month': None, 'day': None, 'year': 2017}}, 'school': {'name': 'Tilburg University', 'logo': 'https://media.licdn.com/dms/image/C4D0BAQHNJkPAcEjYEg/company-logo_400_400/0/1631003396114?e=1700697600&v=beta&t=pmxkaQ2W7K-vpqyiSW215OvNG5wTY3voV4Aj1sLAp2s', 'url': 'https://www.linkedin.com/school/tilburg-university/'}, 'degree_name': '(Attended) Program of Research Master in Economics', 'field_of_study': None}, {'date': {'start': {'month': None, 'day': None, 'year': 2011}, 'end': {'month': None, 'day': None, 'year': 2013}}, 'school': {'name': 'Seoul National University', 'logo': 'https://media.licdn.com/dms/image/C510BAQFJwoUTNksLew/company-logo_400_400/0/1519906917635?e=1700697600&v=beta&t=8CoohGWkW20Rle2zdQ56xzrhOX4HvUQgTTNiyUaD8g0', 'url': 'https://www.linkedin.com/school/%EC%84%9C%EC%9A%B8%EB%8C%80%ED%95%99%EA%B5%90-seoul-national-university-/'}, 'degree_name': 'Master of Arts (MA)', 'field_of_study': 'Economics'}, {'date': {'start': {'month': None, 'day': None, 'year': 2005}, 'end': {'month': None, 'day': None, 'year': 2011}}, 'school': {'name': 'Yonsei University', 'logo': 'https://media.licdn.com/dms/image/D560BAQHtgIy07-b20A/company-logo_400_400/0/1667779233478?e=1700697600&v=beta&t=xl0e254lO39JN_vyiZFUHkjljcj3z7xr4ASt7DZOisM', 'url': 'https://www.linkedin.com/school/yonsei/'}, 'degree_name': 'Bachelor of Arts (BA)', 'field_of_study': 'Economics'}, {'date': {'start': {'month': None, 'day': None, 'year': 2009}, 'end': {'month': None, 'day': None, 'year': 2010}}, 'school': {'name': 'University of California, Davis', 'logo': 'https://media.licdn.com/dms/image/C4E0BAQEBG25KNBwuCQ/company-logo_400_400/0/1616103040374?e=1700697600&v=beta&t=FIlb8rR4-s-_c1x5_RBUnKo90ZfsCB245U4say3D0aE', 'url': 'https://www.linkedin.com/school/uc-davis/'}, 'degree_name': 'Education Abroad Program (EAP)', 'field_of_study': 'EAP-Economics'}]",[],"[{'title': 'Best Report Award on Regional Economic Focus', 'description': 'Best Report Award 2013 on Regional Economic Focus, “Credit Liquidity Imbalances in the Euro Area”', 'issuer': 'KIEP/ No. 533/ December 31, 2013', 'date': {'month': 12, 'day': None, 'year': 2013}}, {'title': 'Good Employee Award', 'description': None, 'issuer': 'KIEP/ No. 536/ December 31, 2013', 'date': {'month': 12, 'day': None, 'year': 2013}}]","[{'name': 'Modern Big Data Analysis with SQL Specialization (Cloudera/Coursera)', 'date': {'start': {'month': 6, 'day': None, 'year': 2021}, 'end': {'month': None, 'day': None, 'year': None}}, 'authority': 'Coursera', 'url': 'https://www.coursera.org/account/accomplishments/specialization/certificate/6M6LRBZPSJVY', 'license_number': '6M6LRBZPSJVY', 'display_source': 'coursera.org', 'company': {'id': None, 'name': 'Coursera', 'logo': 'https://media.licdn.com/dms/image/C4D0BAQGexnfBxeEG-g/company-logo_400_400/0/1608039227697?e=1700697600&v=beta&t=oKIt6loOByFMfTbXJsSV0MxzKtgkMvIZ2QTzkZrNq70', 'url': None}}, {'name': 'IBM Data Science Professional Certificate', 'date': {'start': {'month': 7, 'day': None, 'year': 2020}, 'end': {'month': None, 'day': None, 'year': None}}, 'authority': 'IBM', 'url': 'http://coursera.org/verify/professional-cert/ZJMGZB23SU3N', 'license_number': 'ZJMGZB23SU3N', 'display_source': 'coursera.org', 'company': {'id': None, 'name': 'IBM', 'logo': 'https://media.licdn.com/dms/image/D560BAQGiz5ecgpCtkA/company-logo_400_400/0/1688684715427?e=1700697600&v=beta&t=u5Re06Myc9BstE2M6qN9MMORKODl8XmTlCBTPMoVtXk', 'url': None}}, {'name': 'Microsoft Office Specialist: Office 2003 Master Certification', 'date': {'start': {'month': 1, 'day': None, 'year': 2009}, 'end': {'month': None, 'day': None, 'year': None}}, 'authority': 'Microsoft Certifications', 'url': None, 'license_number': '20090122 850309 6653120-Yy7s-w7NK', 'display_source': None, 'company': None}]",[],[],"[{'name': 'Monetary Financial Institutions (MFIs) Risk Factor Analysis and Its Implications', 'publisher': None, 'url': None, 'date': {'month': None, 'day': None, 'year': 2018}, 'authors': [{'type': 'standardizedContributor', 'first_name': 'Junyup', 'last_name': 'Kim', 'name': None, 'headline': 'Treasury Officer at Hana Bank Amsterdam Branch'}]}, {'name': 'Economy and Financial Markets in the Euro Area: Figures (December 2017)', 'publisher': 'Presentation Slide', 'url': None, 'date': {'month': None, 'day': None, 'year': 2017}, 'authors': [{'type': 'standardizedContributor', 'first_name': 'Junyup', 'last_name': 'Kim', 'name': None, 'headline': 'Treasury Officer at Hana Bank Amsterdam Branch'}]}, {'name': 'Cross-Border Capital Flows in the Euro Area: What Has Happened and What Do We Need to Do?', 'publisher': None, 'url': None, 'date': {'month': None, 'day': None, 'year': 2017}, 'authors': [{'type': 'standardizedContributor', 'first_name': 'Junyup', 'last_name': 'Kim', 'name': None, 'headline': 'Treasury Officer at Hana Bank Amsterdam Branch'}]}, {'name': 'Employment Policies in Low Growth Period: Case Studies and Empirical Analyses on European Countries', 'publisher': 'KIEP Research Paper, No. Policy Analysis 15-21, KIEP.', 'url': None, 'date': {'month': None, 'day': None, 'year': 2015}, 'authors': [{'type': 'standardizedContributor', 'first_name': 'Junyup', 'last_name': 'Kim', 'name': None, 'headline': 'Treasury Officer at Hana Bank Amsterdam Branch'}]}, {'name': 'Why Did Korean Domestic Demand Slow Down after the Asian Financial Crisis?', 'publisher': 'KIEP Research Paper, No. Policy Analysis 15-01, KIEP.', 'url': None, 'date': {'month': None, 'day': None, 'year': 2015}, 'authors': [{'type': 'standardizedContributor', 'first_name': 'Junyup', 'last_name': 'Kim', 'name': None, 'headline': 'Treasury Officer at Hana Bank Amsterdam Branch'}]}, {'name': '2015 KIEP World Economic Outlook (2nd Update)', 'publisher': 'World Economy Today, Vol. 15, No. 21, KIEP.', 'url': None, 'date': {'month': None, 'day': None, 'year': 2015}, 'authors': [{'type': 'standardizedContributor', 'first_name': 'Junyup', 'last_name': 'Kim', 'name': None, 'headline': 'Treasury Officer at Hana Bank Amsterdam Branch'}]}, {'name': 'Core Economic Policy and Position on the EU of the UK Conservative Government', 'publisher': 'World Economy Today, Vol. 15, No. 17, KIEP.', 'url': None, 'date': {'month': None, 'day': None, 'year': 2015}, 'authors': [{'type': 'standardizedContributor', 'first_name': 'Junyup', 'last_name': 'Kim', 'name': None, 'headline': 'Treasury Officer at Hana Bank Amsterdam Branch'}]}, {'name': 'Trend and Outlook of the Euro Area Private Debt After the European Debt Crisis', 'publisher': 'World Economy Today, Vol. 15, No. 6, KIEP.', 'url': None, 'date': {'month': None, 'day': None, 'year': 2015}, 'authors': [{'type': 'standardizedContributor', 'first_name': 'Junyup', 'last_name': 'Kim', 'name': None, 'headline': 'Treasury Officer at Hana Bank Amsterdam Branch'}]}, {'name': '2015 KIEP World Economic Outlook (Update)', 'publisher': 'World Economy Update, Vol. 15, No. 3, KIEP.', 'url': None, 'date': {'month': None, 'day': None, 'year': 2015}, 'authors': [{'type': 'standardizedContributor', 'first_name': 'Junyup', 'last_name': 'Kim', 'name': None, 'headline': 'Treasury Officer at Hana Bank Amsterdam Branch'}]}, {'name': 'Policies for Industrial Competitiveness Improvement in Europe and their Implications', 'publisher': 'KIEP Research Paper, No. Policy Analysis 14-22, KIEP.', 'url': None, 'date': {'month': None, 'day': None, 'year': 2014}, 'authors': [{'type': 'standardizedContributor', 'first_name': 'Junyup', 'last_name': 'Kim', 'name': None, 'headline': 'Treasury Officer at Hana Bank Amsterdam Branch'}]}, {'name': 'The European Banking Industry After the Global Financial Crisis: Changes in Business Circumstances and Strategies', 'publisher': 'KIEP Research Paper, No. Policy References 14-02, KIEP.', 'url': None, 'date': {'month': None, 'day': None, 'year': 2014}, 'authors': [{'type': 'standardizedContributor', 'first_name': 'Junyup', 'last_name': 'Kim', 'name': None, 'headline': 'Treasury Officer at Hana Bank Amsterdam Branch'}]}, {'name': '2015 KIEP World Economic Outlook', 'publisher': 'World Economy Update, Vol. 14, No. 7, KIEP', 'url': None, 'date': {'month': None, 'day': None, 'year': 2014}, 'authors': [{'type': 'standardizedContributor', 'first_name': 'Junyup', 'last_name': 'Kim', 'name': None, 'headline': 'Treasury Officer at Hana Bank Amsterdam Branch'}]}, {'name': 'Private Sector Credit Liquidity Constraints in the Euro Area', 'publisher': 'Regional Economic Focus, Vol. 8, No. 49, KIEP.', 'url': None, 'date': {'month': None, 'day': None, 'year': 2014}, 'authors': [{'type': 'standardizedContributor', 'first_name': 'Junyup', 'last_name': 'Kim', 'name': None, 'headline': 'Treasury Officer at Hana Bank Amsterdam Branch'}]}, {'name': 'Economic Changes in the Euro Area Member Countries After the European Debt Crisis', 'publisher': 'World Economy Update, Vol. 14, No. 5, KIEP', 'url': None, 'date': {'month': None, 'day': None, 'year': 2014}, 'authors': [{'type': 'standardizedContributor', 'first_name': 'Junyup', 'last_name': 'Kim', 'name': None, 'headline': 'Treasury Officer at Hana Bank Amsterdam Branch'}]}, {'name': 'H2 2014 KIEP World Economic Outlook', 'publisher': 'World Economy Update, Vol. 14, No. 4, KIEP', 'url': None, 'date': {'month': None, 'day': None, 'year': 2014}, 'authors': [{'type': 'standardizedContributor', 'first_name': 'Junyup', 'last_name': 'Kim', 'name': None, 'headline': 'Treasury Officer at Hana Bank Amsterdam Branch'}]}, {'name': 'Background and Outlook of the Recent UK Economic Recovery', 'publisher': 'Regional Economic Focus, Vol. 8, No. 22, KIEP.', 'url': None, 'date': {'month': None, 'day': None, 'year': 2014}, 'authors': [{'type': 'standardizedContributor', 'first_name': 'Junyup', 'last_name': 'Kim', 'name': None, 'headline': 'Treasury Officer at Hana Bank Amsterdam Branch'}]}, {'name': 'Analysis of the Low Inflation in the Euro Area', 'publisher': 'Regional Economic Focus, Vol. 8, No. 3, KIEP.', 'url': None, 'date': {'month': None, 'day': None, 'year': 2014}, 'authors': [{'type': 'standardizedContributor', 'first_name': 'Junyup', 'last_name': 'Kim', 'name': None, 'headline': 'Treasury Officer at Hana Bank Amsterdam Branch'}]}, {'name': 'Macroeconomic Trend and Outlook of the Northern European Countries', 'publisher': 'Regional Economic Focus, Vol. 8, No. 1, KIEP.', 'url': None, 'date': {'month': None, 'day': None, 'year': 2014}, 'authors': [{'type': 'standardizedContributor', 'first_name': 'Junyup', 'last_name': 'Kim', 'name': None, 'headline': 'Treasury Officer at Hana Bank Amsterdam Branch'}]}, {'name': 'Trends of Economy, Industry, and Korean Wave (K-Wave) in the UK', 'publisher': 'Hallyu (as known as K-Wave) Now, Vol. 5 (Q3 2013), KOFICE. ', 'url': None, 'date': {'month': None, 'day': None, 'year': 2014}, 'authors': [{'type': 'standardizedContributor', 'first_name': 'Junyup', 'last_name': 'Kim', 'name': None, 'headline': 'Treasury Officer at Hana Bank Amsterdam Branch'}]}, {'name': 'Harmonizing Social Welfare and Economic Growth: Case Studies of European Countries and Implications for Korea', 'publisher': 'KIEP Research Paper, No. Policy Analysis 13-24, KIEP.', 'url': None, 'date': {'month': None, 'day': None, 'year': 2013}, 'authors': [{'type': 'standardizedContributor', 'first_name': 'Junyup', 'last_name': 'Kim', 'name': None, 'headline': 'Treasury Officer at Hana Bank Amsterdam Branch'}]}]",[],[],"[{'company': {'id': 13230630, 'name': 'Hana Bank', 'logo': 'https://media.licdn.com/dms/image/C510BAQGBm3ktbhChlw/company-logo_400_400/0/1581061274874?e=1700697600&v=beta&t=ZBnB7jt8q07NIRx_Pn-UFVBosmZynca5Wk5jLjX93zg', 'url': 'https://www.linkedin.com/company/hana-bank/', 'employees': {'start': 10001, 'end': None}}, 'date': {'start': {'month': 7, 'day': None, 'year': 2021}, 'end': {'month': None, 'day': None, 'year': None}}, 'profile_positions': [{'location': 'Amsterdam, Netherlands', 'date': {'start': {'month': 7, 'day': None, 'year': 2021}, 'end': {'month': None, 'day': None, 'year': None}}, 'company': 'Hana Bank', 'description': '■ Performed various tasks in asset and liability management (ALM)\n— Managing liquidity and Evaluating FX exposure position\n— Establishing and Executing a funding plan based on prospective cash flows\n— Forecasting regulatory ratios (LCR, NSFR)\n— Reviewing the asset-side portfolio and Establishing a periodic optimization plan\n— Monitoring periodic banking profits and Performing treasury operations (e.g., MM, FX deals)\n\n■ Reported regulatory requirements to the Supervisory Authority (De Nederlandsche Bank, DNB)\n— COREP LCR DA, COREP ALMM, Monthly LCR\n— Internal Liquidity Adequacy Assessment Process (ILAAP) in Supervisory Review and Evaluation Process (SREP)\n— Liquidity Stress Testing\n\n■ Implemented the loan business focused on Schuldscheindarlehen (SSD) from benelux and the northern European countries\n— Analyzing a borrower company and Co-writing a loan approval report to the head office\n\n■ Engaged in onboarding on the T2-T2S Consolidation Project of the Eurosystem as a payment bank side\n— Performing and Reporting mandatory tests and results to DNB\n\n■ Made efforts to make a more cooperative work atmosphere among staffs and between teams', 'title': 'Treasury Officer || Amsterdam Branch', 'employment_type': 'Full-time'}]}, {'company': {'id': None, 'name': '-', 'logo': None, 'url': None, 'employees': {'start': None, 'end': None}}, 'date': {'start': {'month': 12, 'day': None, 'year': 2017}, 'end': {'month': 7, 'day': None, 'year': 2021}}, 'profile_positions': [{'location': 'Netherlands', 'date': {'start': {'month': 12, 'day': None, 'year': 2017}, 'end': {'month': 7, 'day': None, 'year': 2021}}, 'company': '-', 'description': '■ Analyzed and Obtained knowledge of the latest economic, financial, and regulatory issues\n— Writing a paper on monetary financial institutions (MFIs) risk factor analysis and its implications (09/2018)\n— Studying financial risk management, Reviewing the literature, Taking courses and seminars\n\n■ Enhanced skills for programming and data management\n\n■ Selected seminars and courses \n— Modern Big Data Analysis with SQL (Cloudera/Coursera, 10/2020 – 06/2021)\n— Managing the Balance Sheet During Periods of Increased Model Risk (GARP Webcast, 27/10/2020)\n— Towards Data-driven Agri-food Business (Wageningen University & Research, 28-29/11/2019)\n— Stress Testing: Added Value or Just More Stress? Find out How the Financial Sector Deals with It! (GARP Chapter Meeting, 12/03/2019)', 'title': '(Specialized in) Economic Research and Financial Market Analysis', 'employment_type': None}]}, {'company': {'id': 13412127, 'name': 'Korea Institute for International Economic Policy (KIEP)', 'logo': 'https://media.licdn.com/dms/image/C4D0BAQE8ZkP2Wn8c5Q/company-logo_400_400/0/1519952376745?e=1700697600&v=beta&t=2fJ5sFHkveszknIGEs0f2tb2kakgJ5JTiTzUoFwYe24', 'url': 'https://www.linkedin.com/company/kiep/', 'employees': {'start': 201, 'end': 500}}, 'date': {'start': {'month': 1, 'day': None, 'year': 2013}, 'end': {'month': 8, 'day': None, 'year': 2015}}, 'profile_positions': [{'location': 'Sejong City, South Korea', 'date': {'start': {'month': 1, 'day': None, 'year': 2013}, 'end': {'month': 8, 'day': None, 'year': 2015}}, 'company': 'Korea Institute for International Economic Policy (KIEP)', 'description': '■ Assessed the risk factors in the European banking sectors, Advised strategies for policymakers to establish a more sustainable financial system in Korea by investigating the balance sheet data of MFIs\n\n■ Evaluated the credit liquidity imbalance in the Euro Area, Examined the deflation risk in the Euro Area after the European Debt Crisis \n\n■ Performed comprehensive evaluations of the European economies, Forecasted the GDP growth rate, Analyzed the European social welfare system and major industries\n\n■ Investigated the effectiveness of Korea-EU FTA and the long-term economic growth trend of Korea\n\n■ Recommended supporting measures for expanding business opportunities of Korean Wave (K-Wave) in the global market for the Korean industrial representatives and government officials \n\n■ Attained both unplanned and pre-scheduled projects within deadlines\n\n■ Communicated with both internal and external experts along with publishing research outcomes\n\n■ Co-organized domestic & international seminars and conferences', 'title': 'Researcher || Europe Team', 'employment_type': 'Full-time'}]}, {'company': {'id': 16249328, 'name': 'Seoul National University', 'logo': 'https://media.licdn.com/dms/image/C4D0BAQGHUvrRqlvw1w/company-logo_400_400/0/1519880345535?e=1700697600&v=beta&t=gW9C_LvlzZJzQRA0NZNvveXgmHv1ak-SeViEewoR9p8', 'url': 'https://www.linkedin.com/company/seoulnationaluniversity/', 'employees': {'start': 10001, 'end': None}}, 'date': {'start': {'month': 3, 'day': None, 'year': 2011}, 'end': {'month': 12, 'day': None, 'year': 2012}}, 'profile_positions': [{'location': 'Seoul, South Korea', 'date': {'start': {'month': 3, 'day': None, 'year': 2011}, 'end': {'month': 12, 'day': None, 'year': 2012}}, 'company': 'Seoul National University', 'description': '■ Supported the research on the Asia economic & financial openness and regional integration project by data pooling and trimming while maintaining data integrity and structured data management logic\n—\tKim, Soyoung and Jong-Wha Lee. 2012. “Real and Financial Integration in East Asia” Review of International Economics, 20(2), 332-349', 'title': 'Research Assistant || Department of Economics', 'employment_type': None}, {'location': 'Seoul, South Korea', 'date': {'start': {'month': 3, 'day': None, 'year': 2012}, 'end': {'month': 6, 'day': None, 'year': 2012}}, 'company': 'Seoul National University', 'description': '■ Assisted faculty members with classroom instruction material, examinations, and record-keeping', 'title': 'Teaching Assistant || Department of Economics', 'employment_type': None}]}, {'company': {'id': 670272, 'name': 'Export-Import Bank of Korea', 'logo': 'https://media.licdn.com/dms/image/C4D0BAQFJhRjwSdDO0Q/company-logo_400_400/0/1519887565644?e=1700697600&v=beta&t=e_nfQ-F279nE9feHYuLH8CZdtn-yutPwHgQU6IxEYsg', 'url': 'https://www.linkedin.com/company/export-import-bank-of-korea/', 'employees': {'start': 501, 'end': 1000}}, 'date': {'start': {'month': 1, 'day': None, 'year': 2012}, 'end': {'month': 2, 'day': None, 'year': 2012}}, 'profile_positions': [{'location': 'Seoul, Korea', 'date': {'start': {'month': 1, 'day': None, 'year': 2012}, 'end': {'month': 2, 'day': None, 'year': 2012}}, 'company': 'Export-Import Bank of Korea', 'description': '■ Integrated data of macroeconomic trends and Korean culture industry export, Conducted a literature review on project, infrastructure, and culture business finance', 'title': 'Research Assistant || Industry and Overseas Investment Research Office', 'employment_type': None}]}]",[],"['Research and Analysis', 'Quantitative and Qualitative Analyses', 'Data Analysis', 'Internatioanl Economics', 'Macroeconomics', 'Financial Economics', 'Policy Analysis', 'Regional Studies', 'Microsoft Office', 'Microsoft Excel', 'Stata', 'Eviews', 'R', 'Minitab', 'SPSS']",,,
