profile_id,first_name,last_name,sub_title,profile_picture,background_image,profile_type,entity_urn,object_urn,birth_date,summary,location,premium,influencer,treasury_media,languages,industry,education,patents,awards,certifications,organizations,projects,publications,courses,test_scores,position_groups,volunteer_experiences,skills,network_info,related_profiles,contact_info
helena-casanova-garcia-51920112,Helena,Casanova Garcia,Founding partner and owner Casanova+Hernandez architects,https://media.licdn.com/dms/image/C4D03AQHzeJZu7mBzqw/profile-displayphoto-shrink_800_800/0/1517482223104?e=1697673600&v=beta&t=hLyIV9Crn-bF_ZOF-CZp4qu8QHL3_IUzI0-5lWF77Rk,https://media.licdn.com/dms/image/C4D16AQHK8iVBHUmXSw/profile-displaybackgroundimage-shrink_350_1400/0/1618394107851?e=1697673600&v=beta&t=lz1GMMvemYUnUi8qVV_mDXg1Asvqzk1zr7hmD-Hyr4E,personal,ACoAAAKFgaUBD16CHWziHyUDB3JK4WR-e38AkSk,42303909,,"‘Casanova + Hernandez Architects’ was established in Rotterdam in 2001 in order to experiment and build the new urban habitat of the XXI century.
  
The office activities are focused on the three linked fields that make a sustainable urban development possible: urban planning, landscape architecture and architecture.
This global understanding of the design is explored in every project from the large scale associated to the territory and the city till the smaller one related to the design of the architectural space and the technical details.

Some of the research topics developed at our office related to urbanism, housing and working functions are: sustainability, flexible urban planning, mix of functions, living and working, hybrid buildings, new ways of living, flexible buildings and urban regeneration of the post-war neighbourhoods.

Complementary to this research the office looks for contemporary solutions for public buildings like exhibition spaces, cultural, educational and sport facilities.

These research topics are theoretically developed via academic activities at different universities, debates, lectures, exhibitions and publications and are tested in the practice via international competitions and realized buildings.","{'country': 'Netherlands', 'short': 'The Randstad, Netherlands', 'city': 'The Randstad', 'state': 'Netherlands', 'default': 'The Randstad, Netherlands'}",False,False,[],"{'primary_locale': {'country': 'US', 'language': 'en'}, 'supported_locales': [{'country': 'US', 'language': 'en'}], 'profile_languages': [{'name': 'Dutch', 'proficiency': 'FULL_PROFESSIONAL'}, {'name': 'English', 'proficiency': 'FULL_PROFESSIONAL'}, {'name': 'French', 'proficiency': 'ELEMENTARY'}, {'name': 'German', 'proficiency': 'PROFESSIONAL_WORKING'}, {'name': 'Italian', 'proficiency': 'PROFESSIONAL_WORKING'}, {'name': 'Spanish', 'proficiency': 'NATIVE_OR_BILINGUAL'}]}",Architecture & Planning,"[{'date': {'start': {'month': None, 'day': None, 'year': 1985}, 'end': {'month': None, 'day': None, 'year': 1997}}, 'school': {'name': 'ETSAM, Escuela Técnica Superior de Arquitectura, Madrid, Spain', 'logo': None, 'url': None}, 'degree_name': 'Architecture and civil engineer', 'field_of_study': 'Architecture'}, {'date': {'start': {'month': None, 'day': None, 'year': 1991}, 'end': {'month': None, 'day': None, 'year': 1992}}, 'school': {'name': 'Politecnico di Milano', 'logo': None, 'url': None}, 'degree_name': None, 'field_of_study': None}, {'date': {'start': {'month': None, 'day': None, 'year': 1974}, 'end': {'month': None, 'day': None, 'year': 1986}}, 'school': {'name': 'Real Conservatorio Superior de Música de Madrid', 'logo': None, 'url': None}, 'degree_name': None, 'field_of_study': 'Piano and composition'}]",[],[],[],[],"[{'title': 'National History Museum. Tirana, Albania', 'date': {'start': {'month': 1, 'day': None, 'year': 2016}, 'end': {'month': 1, 'day': None, 'year': 2016}}, 'description': None, 'contributors': [{'type': 'standardizedContributor', 'first_name': 'Helena', 'last_name': 'Casanova Garcia', 'name': None, 'headline': 'Founding partner and owner Casanova+Hernandez architects'}]}, {'title': 'Albanian Carpet', 'date': {'start': {'month': None, 'day': None, 'year': 2018}, 'end': {'month': None, 'day': None, 'year': 2020}}, 'description': 'Nominated for the Mies van der Rohe Prize 2021\n\nShiroka is a fishing village located on the shores of Shkodra Lake, near the border with Montenegro. Its inhabitants lived for centuries from the lake, men fishing with small rowboats and women tending orchards and weaving carpets by hand. The reaction to the end of a communist regime that had deprived citizens of living from traditional “private” activities was widespread mistrust in the public sphere, which led to a period characterized by uncontrolled occupation and privatization of public space. As result, the public space of the waterfront of Shkodra lake was occupied with illegal constructions such as private houses, restaurants, private parking areas, and kiosks. “Albanian Carpet” returns the waterfront to the citizens demolishing the illegal constructions, opening the views over the lake, and creating an alive public space with a domestic character.', 'contributors': [{'type': 'standardizedContributor', 'first_name': 'Helena', 'last_name': 'Casanova Garcia', 'name': None, 'headline': 'Founding partner and owner Casanova+Hernandez architects'}]}, {'title': 'Black and White Twins. Blaricum, NL', 'date': {'start': {'month': None, 'day': None, 'year': None}, 'end': {'month': None, 'day': None, 'year': None}}, 'description': None, 'contributors': [{'type': 'standardizedContributor', 'first_name': 'Helena', 'last_name': 'Casanova Garcia', 'name': None, 'headline': 'Founding partner and owner Casanova+Hernandez architects'}]}, {'title': 'Ceramic Museum and Mosaic Park. Jinzhou, China', 'date': {'start': {'month': None, 'day': None, 'year': None}, 'end': {'month': None, 'day': None, 'year': None}}, 'description': None, 'contributors': [{'type': 'standardizedContributor', 'first_name': 'Helena', 'last_name': 'Casanova Garcia', 'name': None, 'headline': 'Founding partner and owner Casanova+Hernandez architects'}]}, {'title': 'Cooltower. Rotterdam, NL', 'date': {'start': {'month': None, 'day': None, 'year': None}, 'end': {'month': None, 'day': None, 'year': None}}, 'description': None, 'contributors': [{'type': 'standardizedContributor', 'first_name': 'Helena', 'last_name': 'Casanova Garcia', 'name': None, 'headline': 'Founding partner and owner Casanova+Hernandez architects'}]}, {'title': 'Europan 6 winner project, Stadswerf Groningen', 'date': {'start': {'month': None, 'day': None, 'year': None}, 'end': {'month': None, 'day': None, 'year': None}}, 'description': None, 'contributors': [{'type': 'standardizedContributor', 'first_name': 'Helena', 'last_name': 'Casanova Garcia', 'name': None, 'headline': 'Founding partner and owner Casanova+Hernandez architects'}]}, {'title': 'Gingko Project. Beekbergen, NL', 'date': {'start': {'month': None, 'day': None, 'year': None}, 'end': {'month': None, 'day': None, 'year': None}}, 'description': None, 'contributors': [{'type': 'standardizedContributor', 'first_name': 'Helena', 'last_name': 'Casanova Garcia', 'name': None, 'headline': 'Founding partner and owner Casanova+Hernandez architects'}]}, {'title': 'Lichterfelde Süd', 'date': {'start': {'month': None, 'day': None, 'year': None}, 'end': {'month': None, 'day': None, 'year': None}}, 'description': '39 Ha new urban development: residential, infraestructure, facilitites, green areas\nUnder development', 'contributors': [{'type': 'standardizedContributor', 'first_name': 'Helena', 'last_name': 'Casanova Garcia', 'name': None, 'headline': 'Founding partner and owner Casanova+Hernandez architects'}]}, {'title': 'MARUBI NATIONAL MUSEUM AND ARCHIVE OF PHOTOGRAPHY. Shkodra, Albania', 'date': {'start': {'month': None, 'day': None, 'year': None}, 'end': {'month': None, 'day': None, 'year': None}}, 'description': 'NOMINATED FOR THE MIES VAN DER ROHE AWARD 2017\n\nNOMINATED FOR THE BEST MUSEUM OF THE YEAR 2017 (EMYA)\n', 'contributors': [{'type': 'standardizedContributor', 'first_name': 'Helena', 'last_name': 'Casanova Garcia', 'name': None, 'headline': 'Founding partner and owner Casanova+Hernandez architects'}]}]","[{'name': 'Building Knowledge in Interdisciplinary Design', 'publisher': 'Damdi Publishers. Seoul, South Korea', 'url': 'http://www.casanova-hernandez.com/PUBLICATIONS/M004/', 'date': {'month': None, 'day': None, 'year': 2016}, 'authors': [{'type': 'standardizedContributor', 'first_name': 'Helena', 'last_name': 'Casanova Garcia', 'name': None, 'headline': 'Founding partner and owner Casanova+Hernandez architects'}, {'type': 'nonStandardizedContributor', 'first_name': None, 'last_name': None, 'name': 'Jesus Hernandez Mayor', 'headline': None}]}, {'name': 'Public Space Acupuncture', 'publisher': 'Actar Publishers, New York', 'url': None, 'date': {'month': None, 'day': None, 'year': None}, 'authors': [{'type': 'standardizedContributor', 'first_name': 'Helena', 'last_name': 'Casanova Garcia', 'name': None, 'headline': 'Founding partner and owner Casanova+Hernandez architects'}, {'type': 'nonStandardizedContributor', 'first_name': None, 'last_name': None, 'name': 'Jesus Hernandez Mayor', 'headline': None}]}, {'name': 'Scale and Perception', 'publisher': 'Wasmuth, Germany', 'url': 'http://www.casanova-hernandez.com/PUBLICATIONS/M002/', 'date': {'month': None, 'day': None, 'year': None}, 'authors': [{'type': 'standardizedContributor', 'first_name': 'Helena', 'last_name': 'Casanova Garcia', 'name': None, 'headline': 'Founding partner and owner Casanova+Hernandez architects'}, {'type': 'nonStandardizedContributor', 'first_name': None, 'last_name': None, 'name': 'Jesus Hernandez Mayor', 'headline': None}]}, {'name': 'Urban Symbiosis with an open end', 'publisher': 'Europan Nederland', 'url': 'http://www.casanova-hernandez.com/PUBLICATIONS/M001/', 'date': {'month': None, 'day': None, 'year': None}, 'authors': [{'type': 'standardizedContributor', 'first_name': 'Helena', 'last_name': 'Casanova Garcia', 'name': None, 'headline': 'Founding partner and owner Casanova+Hernandez architects'}]}]",[],[],"[{'company': {'id': None, 'name': 'casanova + hernandez architects', 'logo': None, 'url': None, 'employees': {'start': None, 'end': None}}, 'date': {'start': {'month': 10, 'day': None, 'year': 2001}, 'end': {'month': None, 'day': None, 'year': None}}, 'profile_positions': [{'location': 'Rotterdam, The Netherlands / Tirana, Albania', 'date': {'start': {'month': 10, 'day': None, 'year': 2001}, 'end': {'month': None, 'day': None, 'year': None}}, 'company': 'casanova + hernandez architects', 'description': None, 'title': 'Founding partner and owner', 'employment_type': None}]}, {'company': {'id': None, 'name': 'Academie van Bouwkunst Rotterdam', 'logo': None, 'url': None, 'employees': {'start': None, 'end': None}}, 'date': {'start': {'month': None, 'day': None, 'year': 2003}, 'end': {'month': None, 'day': None, 'year': 2019}}, 'profile_positions': [{'location': None, 'date': {'start': {'month': None, 'day': None, 'year': 2003}, 'end': {'month': None, 'day': None, 'year': 2019}}, 'company': 'Academie van Bouwkunst Rotterdam', 'description': None, 'title': 'Visiting lecturer and final thesis tutor', 'employment_type': None}]}, {'company': {'id': None, 'name': 'University of Navarra', 'logo': None, 'url': None, 'employees': {'start': None, 'end': None}}, 'date': {'start': {'month': 1, 'day': None, 'year': 2018}, 'end': {'month': 6, 'day': None, 'year': 2018}}, 'profile_positions': [{'location': 'Pamplona Area, Spain', 'date': {'start': {'month': 1, 'day': None, 'year': 2018}, 'end': {'month': 6, 'day': None, 'year': 2018}}, 'company': 'University of Navarra', 'description': None, 'title': 'Guest Professor', 'employment_type': None}]}, {'company': {'id': None, 'name': 'Europan NL', 'logo': None, 'url': None, 'employees': {'start': None, 'end': None}}, 'date': {'start': {'month': 2, 'day': None, 'year': 2016}, 'end': {'month': 12, 'day': None, 'year': 2017}}, 'profile_positions': [{'location': 'the Netherlands', 'date': {'start': {'month': 2, 'day': None, 'year': 2016}, 'end': {'month': 12, 'day': None, 'year': 2017}}, 'company': 'Europan NL', 'description': None, 'title': 'Board member', 'employment_type': None}]}, {'company': {'id': 166529, 'name': 'TU Delft', 'logo': 'https://media.licdn.com/dms/image/C4E0BAQFwaGpwaod9mQ/company-logo_400_400/0/1670699851986?e=1700697600&v=beta&t=x0gehJn4urFszU2u5SdBucc2zlxk3Ja4h8oWEtjCIYo', 'url': 'https://www.linkedin.com/school/tudelft/', 'employees': {'start': 5001, 'end': 10000}}, 'date': {'start': {'month': None, 'day': None, 'year': 2002}, 'end': {'month': None, 'day': None, 'year': 2015}}, 'profile_positions': [{'location': None, 'date': {'start': {'month': None, 'day': None, 'year': 2002}, 'end': {'month': None, 'day': None, 'year': 2015}}, 'company': 'Delft University of Technology', 'description': None, 'title': 'Visiting lecturer and visiting critic', 'employment_type': None}]}, {'company': {'id': None, 'name': 'Stimuleringsfonds Creatieve Industrie', 'logo': None, 'url': None, 'employees': {'start': None, 'end': None}}, 'date': {'start': {'month': 8, 'day': None, 'year': 2009}, 'end': {'month': 7, 'day': None, 'year': 2013}}, 'profile_positions': [{'location': 'Rotterdam Area, Netherlands', 'date': {'start': {'month': 8, 'day': None, 'year': 2009}, 'end': {'month': 7, 'day': None, 'year': 2013}}, 'company': 'Stimuleringsfonds Creatieve Industrie', 'description': None, 'title': 'Commission member', 'employment_type': None}]}, {'company': {'id': 1385336, 'name': 'Shenzhen University', 'logo': None, 'url': 'https://www.linkedin.com/company/shenzhen-university/', 'employees': {'start': None, 'end': None}}, 'date': {'start': {'month': 10, 'day': None, 'year': 2012}, 'end': {'month': 10, 'day': None, 'year': 2012}}, 'profile_positions': [{'location': 'Shenzhen, China', 'date': {'start': {'month': 10, 'day': None, 'year': 2012}, 'end': {'month': 10, 'day': None, 'year': 2012}}, 'company': 'Shenzhen University', 'description': None, 'title': 'Guest Professor', 'employment_type': None}]}, {'company': {'id': None, 'name': 'Berlage Institute', 'logo': None, 'url': None, 'employees': {'start': None, 'end': None}}, 'date': {'start': {'month': 9, 'day': None, 'year': 2011}, 'end': {'month': 7, 'day': None, 'year': 2012}}, 'profile_positions': [{'location': 'Rotterdam', 'date': {'start': {'month': 9, 'day': None, 'year': 2011}, 'end': {'month': 7, 'day': None, 'year': 2012}}, 'company': 'Berlage Institute', 'description': ""Studio 'Public Space Acupuncture', organized and developed together with Jesús Hernandez Mayor"", 'title': 'Guest Professor', 'employment_type': None}]}, {'company': {'id': None, 'name': 'Neutelings-Riedijk Architecten', 'logo': None, 'url': None, 'employees': {'start': None, 'end': None}}, 'date': {'start': {'month': None, 'day': None, 'year': 2000}, 'end': {'month': None, 'day': None, 'year': 2001}}, 'profile_positions': [{'location': None, 'date': {'start': {'month': None, 'day': None, 'year': 2000}, 'end': {'month': None, 'day': None, 'year': 2001}}, 'company': 'Neutelings-Riedijk Architecten', 'description': None, 'title': 'Collaborator', 'employment_type': None}]}, {'company': {'id': None, 'name': 'West 8, Urban Design and Landscape Architecture', 'logo': None, 'url': None, 'employees': {'start': None, 'end': None}}, 'date': {'start': {'month': None, 'day': None, 'year': 1999}, 'end': {'month': None, 'day': None, 'year': 2000}}, 'profile_positions': [{'location': None, 'date': {'start': {'month': None, 'day': None, 'year': 1999}, 'end': {'month': None, 'day': None, 'year': 2000}}, 'company': 'West 8, Urban Design and Landscape Architecture', 'description': None, 'title': 'Collaborator', 'employment_type': None}]}]",[],"['Architecture', 'Urbanism', 'Architectural Design', 'Sustainable Design', 'Landscape Architecture', 'Interior Design', 'Design Research', 'Public Space', 'Urban Regeneration', 'Social Sustainability', 'Architectures', 'Sustainable Development', 'Interior Architecture', 'Sustainability', 'Urban Design', 'Urban Planning', 'Sustainable Architecture', 'Urban', 'Green Building']",,,
