profile_id,first_name,last_name,sub_title,profile_picture,background_image,profile_type,entity_urn,object_urn,birth_date,summary,location,premium,influencer,treasury_media,languages,industry,education,patents,awards,certifications,organizations,projects,publications,courses,test_scores,position_groups,volunteer_experiences,skills,network_info,related_profiles,contact_info
walter-obendrauf-35133322,Walter,Obendrauf,"Resources Assurance Lead (Middle East, Australia, Indonesia and China) at Shell",https://media.licdn.com/dms/image/C4D03AQFomfmX25tzXw/profile-displayphoto-shrink_800_800/0/1516969384039?e=1697673600&v=beta&t=xPX6pOI4i45ZdUX14yU_QSnqZga4pPNijZPF5TR-COY,,personal,ACoAAAStDS0BJUA6f1tAQGHLsbsb-gcSXPyk1ls,78449965,,"19 years of Upstream Development experience with Shell, in several leadership and reservoir engineering positions in The Netherlands, Brunei and the UK.

Broad experience in oil and gas developments. Successful history of delivering complex projects, leading multidisciplinary teams and reservoir engineering teams.

Strong technical background (as Discipline Lead for Reservoir Engineering) with focus areas well planning, reserves estimation, reservoir simulation, production forecasting and process safety (as Shell's Principal Technical Expert for pore pressure prediction).

Extensive experience in business planning, economics and auditing.

Currently as Hydrocarbon Resource Manager leading the Technical Planning team for Shell's Upstream Operated Business.","{'country': 'Netherlands', 'short': 'The Hague, South Holland', 'city': 'The Hague', 'state': 'South Holland', 'default': 'The Hague, South Holland, Netherlands'}",False,False,[],"{'primary_locale': {'country': 'US', 'language': 'en'}, 'supported_locales': [{'country': 'US', 'language': 'en'}], 'profile_languages': []}",Oil & Energy,"[{'date': {'start': {'month': None, 'day': None, 'year': None}, 'end': {'month': None, 'day': None, 'year': None}}, 'school': {'name': 'University of Leoben, Austria', 'logo': None, 'url': None}, 'degree_name': 'Ph.D. (with distinction)', 'field_of_study': None}, {'date': {'start': {'month': None, 'day': None, 'year': None}, 'end': {'month': None, 'day': None, 'year': 1991}}, 'school': {'name': 'University of Technology, Graz', 'logo': None, 'url': None}, 'degree_name': 'M.Sc. (with distinction)', 'field_of_study': 'Physics'}]",[],[],[],[],[],[],[],[],"[{'company': {'id': 1271, 'name': 'Shell', 'logo': 'https://media.licdn.com/dms/image/C4D0BAQGN30g7aSl4NA/company-logo_400_400/0/1519856218579?e=1700697600&v=beta&t=tNZAoMUkdjwkgcqi-h79Em_6eRebVnZdKSDkAOA6QPE', 'url': 'https://www.linkedin.com/company/shell/', 'employees': {'start': 10001, 'end': None}}, 'date': {'start': {'month': 8, 'day': None, 'year': 2007}, 'end': {'month': None, 'day': None, 'year': None}}, 'profile_positions': [{'location': 'The Hague, South Holland, Netherlands', 'date': {'start': {'month': 4, 'day': None, 'year': 2020}, 'end': {'month': None, 'day': None, 'year': None}}, 'company': 'Shell', 'description': '• Delivering compliant estimation, classification and reporting of Shell’s oil & gas reserves / resources, including externally disclosed SEC-Proved Reserves.\n• Assuring oil & gas production forecasts and volumes for all large projects at Final Investment Decision, as well as for deals (investments, divestments)\n• Shell’s Focal Point for reporting of the Standardized Measure of Oil and Gas\n• Leading the Competitor Analysis for oil & gas resources', 'title': 'Cluster Lead Resources Assurance and Reporting (Middle East, Australia, Indonesia and China)', 'employment_type': 'Full-time'}, {'location': None, 'date': {'start': {'month': 1, 'day': None, 'year': 2015}, 'end': {'month': None, 'day': None, 'year': None}}, 'company': 'Shell', 'description': '• Leading a global community of Subject Matter Experts and focal points for Pore Pressure Prediction.\n• Reviewing all subsurface incidents in Shell, proposing actions for improvement. Sharing learnings, best practices. Numerous presentations to practitioners and management.\n• Delivered Shell’s new Pore Pressure Prediction Guidelines and course material. Contributor to Shell’s Design and Engineering Practices.\n• As a result of the aforementioned points, the number of related subsurface incidents has more than halved in the last 5 years.', 'title': 'Principal Technical Expert for Pore Pressure Prediction in Development', 'employment_type': 'Full-time'}, {'location': 'The Hague Area, Netherlands', 'date': {'start': {'month': 2, 'day': None, 'year': 2017}, 'end': {'month': 3, 'day': None, 'year': 2020}}, 'company': 'Shell', 'description': ""•\tManaging the technical planning team for Shell's Upstream Operated Business, ensuring credible, competitive and affordable business plans, through close cooperation with Finance, Group Planning, Shell's Upstream Operated countries, the Project & Technology Organisation and Exploration\n•\tAnalysis of the project portfolio, prioritisation and identification of opportunities\n•\tCoordinating the tracking of progress on delivery and performance, intervening where required"", 'title': 'Hydrocarbon Resource Manager (Upstream Operated)', 'employment_type': None}, {'location': 'The Hague', 'date': {'start': {'month': 9, 'day': None, 'year': 2012}, 'end': {'month': 1, 'day': None, 'year': 2017}}, 'company': 'Shell', 'description': 'Audit Manager for Shell Internal Audit, responsible for the following areas:\n - Oil and Gas Reserves, Hydrocarbon Maturation\n - Joint Ventures (Upstream)\n - New Business Development (acquisitions & divestments) (Upstream)\n\nProviding quality material insight, critical judgment, assurance and support with regards to the control framework of Royal Dutch Shell to Businesses, Functions and the Audit Committee.', 'title': 'Audit Manager Upstream', 'employment_type': None}, {'location': 'Aberdeen, United Kingdom', 'date': {'start': {'month': 8, 'day': None, 'year': 2007}, 'end': {'month': 8, 'day': None, 'year': 2012}}, 'company': 'Shell', 'description': ""Leading a team of 30 reservoir engineers working on all Shell operated fields in the Central and Northern North Sea (oil and gas, sandstone and fractured carbonates, brown fields and new discoveries, HPHT, subsea, FPSO, platforms, etc.).\nStaff supervision: Direct line responsibility, staff apraisal, competence development, training, coaching, mentoring, staff allocation planning.\nReservoir Engineering technical authority: Responsible for technical quality of all reservoir engineering work in the asset, giving guidance, conducting reviews.\nResponsible for annual reserves reporting in the asset.\nHSE: Shell's focal point for Pore Pressure Prediction in brown fields. Co-author of a PPP course."", 'title': 'Discipline Lead Reservoir Engineering (Central and Northern North Sea)', 'employment_type': None}]}, {'company': {'id': None, 'name': 'Brunei Shell Petroleum', 'logo': None, 'url': None, 'employees': {'start': None, 'end': None}}, 'date': {'start': {'month': None, 'day': None, 'year': 2002}, 'end': {'month': 8, 'day': None, 'year': 2007}}, 'profile_positions': [{'location': None, 'date': {'start': {'month': 2, 'day': None, 'year': 2006}, 'end': {'month': 8, 'day': None, 'year': 2007}}, 'company': 'Brunei Shell Petroleum', 'description': 'Leading the multidisciplinary team responsible for well planning and delivery of Champion West Phase 3. This project was at that time the biggest oil and gas development in Brunei and a showcase project for Smart Field Development in Shell, featuring long horizontal “smart snake” oil wells and “smart” multi-zone gas wells. My team successfully delivered the oil wells with the highest production rates in Brunei’s history, within time and budget.', 'title': 'Subsurface Team Leader for Champion West', 'employment_type': None}, {'location': 'Brunei Darussalam', 'date': {'start': {'month': None, 'day': None, 'year': 2004}, 'end': {'month': None, 'day': None, 'year': 2006}}, 'company': 'Brunei Shell Petroleum', 'description': 'Senior Reservoir Engineer for the Champion West field. \nBusiness Planning focal point for the East Asset.', 'title': 'Senior Reservoir Engineer', 'employment_type': None}, {'location': 'Brunei Darussalam', 'date': {'start': {'month': None, 'day': None, 'year': 2002}, 'end': {'month': None, 'day': None, 'year': 2004}}, 'company': 'Brunei Shell Petroleum', 'description': 'Responsible for gas production planning and forecasting in Brunei Shell (Department for Business Planning and Economics). \nFocal point for all Brunei Shell gas production issues, liaison with LNG plant, aligning gas demand and deliverability, maximising gas sales.', 'title': 'Corporate Gas Forecaster / Planner', 'employment_type': None}]}, {'company': {'id': None, 'name': 'NAM (Shell)', 'logo': None, 'url': None, 'employees': {'start': None, 'end': None}}, 'date': {'start': {'month': None, 'day': None, 'year': 1998}, 'end': {'month': None, 'day': None, 'year': 2002}}, 'profile_positions': [{'location': None, 'date': {'start': {'month': None, 'day': None, 'year': 1998}, 'end': {'month': None, 'day': None, 'year': 2002}}, 'company': 'NAM (Shell)', 'description': None, 'title': 'Reservoir Engineer', 'employment_type': None}]}, {'company': {'id': 61219, 'name': 'University of Leoben', 'logo': 'https://media.licdn.com/dms/image/C4D0BAQFecSKv-xcrUw/company-logo_400_400/0/1519856585345?e=1700697600&v=beta&t=dlLTOuDFIyuSTIHXJNWncCuJmyVTo9RM7hKJYoA3pmQ', 'url': 'https://www.linkedin.com/company/university-of-leoben/', 'employees': {'start': 51, 'end': 200}}, 'date': {'start': {'month': None, 'day': None, 'year': 1991}, 'end': {'month': None, 'day': None, 'year': 1998}}, 'profile_positions': [{'location': None, 'date': {'start': {'month': None, 'day': None, 'year': 1991}, 'end': {'month': None, 'day': None, 'year': 1998}}, 'company': 'University of Leoben', 'description': 'Flow simulation, measurement techniques, rheology (flow properties)', 'title': 'Assistant Professor', 'employment_type': None}]}]",[],"['Field Development', 'Reservoir Engineering', 'Reserves', 'Reservoir Management', 'Reservoir Simulation', 'Internal Audit', 'Petroleum Engineering', 'Subsurface', 'Petroleum', 'Well Testing', 'Gas', 'Subsea Engineering', 'Upstream', 'Product Optimization', 'Drilling', 'Oil & Gas', 'Energy Industry']",,,
