profile_id,first_name,last_name,sub_title,profile_picture,background_image,profile_type,entity_urn,object_urn,birth_date,summary,location,premium,influencer,treasury_media,languages,industry,education,patents,awards,certifications,organizations,projects,publications,courses,test_scores,position_groups,volunteer_experiences,skills,network_info,related_profiles,contact_info
anderson-m-j-0ba86915,Anderson,M. J,Monitoring and Evaluation Officer of the Amazon’s Territory,https://media.licdn.com/dms/image/C4D03AQFGGGbMDqnuoA/profile-displayphoto-shrink_800_800/0/1516570319031?e=1697673600&v=beta&t=W9_xaugtaJXzh16RyWfKK37aZ1wJKa7ip4Xh_w0C_Ew,https://media.licdn.com/dms/image/C4D16AQFFRDwgClRP9A/profile-displaybackgroundimage-shrink_350_1400/0/1516570319636?e=1697673600&v=beta&t=-EdFIuAgHrdDmliYDwaVwiPH-q_sbQZkKyEo0Tb2jW0,personal,ACoAAAMnE04BYMsw5mEL8takMEOeKcgZpgpARfE,52892494,,"I am a self-motivated international development professional with over ten years of experience in working in the academe, government agencies, and multilateral organizations such as UNICEF, UNDP, and UNESCO with international experience in Brazil, France, the Netherlands, and United Kingdom.

Part of my expertise is based on Impact Evaluation and Monitoring & Evaluation (M&E) with eight years of evaluating development projects. Identified effective school-based intervention projects for UNDP, Government and NGO`s and monitored its implementation in several municipalities reaching more than 22,000 underprivileged children. 

I am highly-experienced in conducting high-level policy research and analysis and produced the Brazilian Human Development Report in 2010, a result of a point-by-point nationwide consultation giving a voice to over half a million Brazilians. Provided evidence-based information which led to the build-up of the new Millennium Development Goals (MDGs) indicators for the State of Minas Gerais in Brazil. 

In addition to that I am qualified in public and project management as well as proposal writing for local and national governments, besides being skilled in data and knowledge management with experience in handling large datasets (surveys) for UNICEF`s equity-focused evaluation using STATA. Able to author technical research, statistical analyses, and briefings while maintaining high professional and unbiased standards. 

To conclude, I am able to successfully handle stakeholder relations and represent organizations in high-level meetings with authorities and elected officials. Proven experience in serving in an advisory capacity to political figures resulting to significant changes in public policy and reviewing specialised journal articles for the International Review of Administrative Science (SAGE).","{'country': 'Netherlands', 'short': 'The Hague, South Holland', 'city': 'The Hague', 'state': 'South Holland', 'default': 'The Hague, South Holland, Netherlands'}",False,False,[],"{'primary_locale': {'country': 'US', 'language': 'en'}, 'supported_locales': [{'country': 'US', 'language': 'en'}], 'profile_languages': [{'name': 'English', 'proficiency': 'FULL_PROFESSIONAL'}, {'name': 'Portuguese', 'proficiency': 'NATIVE_OR_BILINGUAL'}, {'name': 'Spanish', 'proficiency': 'PROFESSIONAL_WORKING'}]}",Public Policy,"[{'date': {'start': {'month': None, 'day': None, 'year': 2014}, 'end': {'month': None, 'day': None, 'year': 2017}}, 'school': {'name': 'International Institute of Social Studies (ISS) of Erasmus University Rotterdam', 'logo': 'https://media.licdn.com/dms/image/D4E0BAQGRnJ7YAFCJ9Q/company-logo_400_400/0/1688459069875?e=1700697600&v=beta&t=sk48vtDSCR3kcUmYpJ8GpaHZg22VP4HLaG7Drm01Dk8', 'url': 'https://www.linkedin.com/school/international-institute-of-social-studies-iss-of-erasmus-university-rotterdam/'}, 'degree_name': 'Doctor of Philosophy (PhD)', 'field_of_study': 'Development Studies'}, {'date': {'start': {'month': None, 'day': None, 'year': 2014}, 'end': {'month': None, 'day': None, 'year': 2014}}, 'school': {'name': 'Massachusetts Institute of Technology', 'logo': 'https://media.licdn.com/dms/image/D560BAQH-UXRfIDIKug/company-logo_400_400/0/1689799728670?e=1700697600&v=beta&t=xjgypzCPH-UmOJcMYc8yA21KalhuvtMS7-wAuk-PhK8', 'url': 'https://www.linkedin.com/school/mit/'}, 'degree_name': 'Coursework', 'field_of_study': 'Impact Evaluation of Social Programmes (Randomised Impact Evaluation)'}, {'date': {'start': {'month': None, 'day': None, 'year': 2012}, 'end': {'month': None, 'day': None, 'year': 2012}}, 'school': {'name': 'The London School of Economics and Political Science (LSE)', 'logo': 'https://media.licdn.com/dms/image/C560BAQEmNyPMuyVfyQ/company-logo_400_400/0/1657529757543?e=1700697600&v=beta&t=NSY7HiEon6090pzCZJmSANOZTdk1FZ5VJhKW8LrNXTY', 'url': 'https://www.linkedin.com/school/london-school-of-economics/'}, 'degree_name': 'Methods Summer Course', 'field_of_study': 'Econometrics and Quantitative Economics'}, {'date': {'start': {'month': None, 'day': None, 'year': 2008}, 'end': {'month': None, 'day': None, 'year': 2009}}, 'school': {'name': 'Erasmus University Rotterdam', 'logo': None, 'url': None}, 'degree_name': 'Master of Public Administration - MPA', 'field_of_study': 'International Public Management and Policy'}, {'date': {'start': {'month': None, 'day': None, 'year': 2005}, 'end': {'month': None, 'day': None, 'year': 2006}}, 'school': {'name': 'Escola Nacional de Administração Pública (ENAP) - National School of Public Administration', 'logo': None, 'url': None}, 'degree_name': 'Postgraduate Diploma', 'field_of_study': 'Public Management'}, {'date': {'start': {'month': None, 'day': None, 'year': 1999}, 'end': {'month': None, 'day': None, 'year': 2002}}, 'school': {'name': 'Universidade Estadual Paulista Júlio de Mesquita Filho', 'logo': 'https://media.licdn.com/dms/image/D4D0BAQFOCoSfimNaXg/company-logo_400_400/0/1688179703166?e=1700697600&v=beta&t=hOvoDJN5xDfqks4116PAJcmberdi3bCqKEfNYzs3DMs', 'url': 'https://www.linkedin.com/school/unesp---universidade-estadual-paulista-j-lio-de-mesquita-filho-/'}, 'degree_name': 'Bachelor', 'field_of_study': 'Public Administration'}]",[],"[{'title': 'Erasmus TrustFund', 'description': None, 'issuer': 'Erasmus University Trust Fund', 'date': {'month': 8, 'day': None, 'year': 2016}}, {'title': 'Human Development and Capability Association Fund', 'description': None, 'issuer': 'HDCA', 'date': {'month': 8, 'day': None, 'year': 2016}}, {'title': 'Science Without Border (CAPES) PhD Scholarship', 'description': '4 years Full PhD Scholarship', 'issuer': 'CAPES Foundation - Ministry of Education of Brazil', 'date': {'month': 1, 'day': None, 'year': 2014}}, {'title': 'Santander Cambridge Scholarship (Cambridge Trust)', 'description': None, 'issuer': 'Cambridge Trust & Santander', 'date': {'month': 10, 'day': None, 'year': 2013}}, {'title': 'Claremont Evaluation Center & EvalPartners Scholarship', 'description': None, 'issuer': 'Claremont Evaluation Center', 'date': {'month': 8, 'day': None, 'year': 2013}}, {'title': 'Erasmus Waiver', 'description': None, 'issuer': 'Erasmus University Rotterdam', 'date': {'month': 9, 'day': None, 'year': 2009}}, {'title': 'Alban Scholarship for Postgraduate Studies', 'description': None, 'issuer': 'the European Union-Latin America cooperation', 'date': {'month': 9, 'day': None, 'year': 2007}}, {'title': 'Postgraduate scholarship (ENAP)', 'description': None, 'issuer': 'National School of Public Administration', 'date': {'month': 9, 'day': None, 'year': 2004}}, {'title': 'Research Induction Scholarship', 'description': None, 'issuer': 'Foundation for the Support to Research of the State of São Paulo (FAPESP)', 'date': {'month': 1, 'day': None, 'year': 2002}}]",[],"[{'name': 'Human Development and Capability Association', 'position': None, 'date_start': None, 'date_end': None}]","[{'title': 'National Human Development Report 2010', 'date': {'start': {'month': None, 'day': None, 'year': None}, 'end': {'month': None, 'day': None, 'year': None}}, 'description': None, 'contributors': [{'type': 'standardizedContributor', 'first_name': 'Anderson', 'last_name': 'M. J', 'name': None, 'headline': 'Monitoring and Evaluation Officer of the Amazon’s Territory'}]}]","[{'name': 'Civic Activism and Social Accountability: A Quantitative Approach (chapter)', 'publisher': 'Exploring Civic Innovation for Social and Economic Transformation / Routledge', 'url': 'https://www.routledge.com/Exploring-Civic-Innovation-for-Social-and-Economic-Transformation/Biekart-Harcourt-Knorringa/p/book/9781138936331', 'date': {'month': None, 'day': None, 'year': 2016}, 'authors': [{'type': 'standardizedContributor', 'first_name': 'Anderson', 'last_name': 'M. J', 'name': None, 'headline': 'Monitoring and Evaluation Officer of the Amazon’s Territory'}]}, {'name': 'Production and use of independent media: road to government accountability?', 'publisher': 'International Institute of Social Studies - Working paper series', 'url': 'http://www.indsocdev.org/resources/Working_Paper_2014-1_Production_and_Use_of_Independent_Media.pdf', 'date': {'month': None, 'day': None, 'year': 2014}, 'authors': [{'type': 'standardizedContributor', 'first_name': 'Anderson', 'last_name': 'M. J', 'name': None, 'headline': 'Monitoring and Evaluation Officer of the Amazon’s Territory'}]}, {'name': 'Evaluation of the Brazilian Family Grant Programme: A quasi-experimental study in the State of Rio de Janeiro', 'publisher': 'Revista Psicologia Reflexão e Crítica', 'url': 'http://www.scielo.br/pdf/prc/v25n4/11.pdf', 'date': {'month': None, 'day': None, 'year': 2012}, 'authors': [{'type': 'standardizedContributor', 'first_name': 'Anderson', 'last_name': 'M. J', 'name': None, 'headline': 'Monitoring and Evaluation Officer of the Amazon’s Territory'}, {'type': 'standardizedContributor', 'first_name': 'Luciana', 'last_name': 'MOURÃO', 'name': None, 'headline': 'Professora do PPG em Psicologia na Universidade Salgado de Oliveira e Professora visitante da UERJ. Coordenadora do APRIMORA - Núcleo de Estudos em Trajetória e Desenvolvimento Profissional.'}, {'type': 'nonStandardizedContributor', 'first_name': None, 'last_name': None, 'name': 'Maria Cristina Ferreira', 'headline': None}]}, {'name': 'Conhecimento Organizacional em Escolas de Governo: um estudo comparado entre 8 Escolas de Governo (Organisational Knowledge in Schools of Government: a comparison study among 8 schools of govenment)', 'publisher': 'Revista de Administração Pública (RAP)', 'url': 'http://www.scielo.br/scielo.php?pid=S0034-76122012000400003&script=sci_arttext', 'date': {'month': None, 'day': None, 'year': 2012}, 'authors': [{'type': 'standardizedContributor', 'first_name': 'Anderson', 'last_name': 'M. J', 'name': None, 'headline': 'Monitoring and Evaluation Officer of the Amazon’s Territory'}, {'type': 'standardizedContributor', 'first_name': 'Luciana', 'last_name': 'MOURÃO', 'name': None, 'headline': 'Professora do PPG em Psicologia na Universidade Salgado de Oliveira e Professora visitante da UERJ. Coordenadora do APRIMORA - Núcleo de Estudos em Trajetória e Desenvolvimento Profissional.'}]}, {'name': 'How do local government associations influence policy? Assessing conditions for policy influence of interest groups in Brazil and the Netherlands', 'publisher': 'Brazilian Political Science Review', 'url': 'http://socialsciences.scielo.org/scielo.php?pid=S1981-38212010000100003&script=sci_arttext', 'date': {'month': None, 'day': None, 'year': 2010}, 'authors': [{'type': 'standardizedContributor', 'first_name': 'Anderson', 'last_name': 'M. J', 'name': None, 'headline': 'Monitoring and Evaluation Officer of the Amazon’s Territory'}]}, {'name': 'Valores e Desenvolvimento Humano (Values and Human Development)', 'publisher': 'United Nations Development Programme - UNDP', 'url': 'http://www.pnud.org.br/HDR/arquivos/rdh_Brasil_2009_2010.pdf', 'date': {'month': None, 'day': None, 'year': 2010}, 'authors': [{'type': 'standardizedContributor', 'first_name': 'Anderson', 'last_name': 'M. J', 'name': None, 'headline': 'Monitoring and Evaluation Officer of the Amazon’s Territory'}]}, {'name': 'Educação de Qualidade: o desafio dos municípios (Quality of Education: the great challenge of municipalities)', 'publisher': 'Confederação Nacional de Municípios (National Confederation of Municipalities)', 'url': None, 'date': {'month': None, 'day': None, 'year': 2009}, 'authors': [{'type': 'standardizedContributor', 'first_name': 'Anderson', 'last_name': 'M. J', 'name': None, 'headline': 'Monitoring and Evaluation Officer of the Amazon’s Territory'}]}, {'name': 'A Importância do Capital Humano e da Tecnologia da Informação em Benefício do Conhecimento Organizacional: um estudo de caso (The Importance of the Human Capital and Information Technology to Organizational Knowledge: A Case Study)', 'publisher': 'Revista Organização & Sociedade – O&S/UFBA', 'url': 'http://www.revistaoes.ufba.br/viewarticle.php?id=201', 'date': {'month': None, 'day': None, 'year': 2007}, 'authors': [{'type': 'standardizedContributor', 'first_name': 'Anderson', 'last_name': 'M. J', 'name': None, 'headline': 'Monitoring and Evaluation Officer of the Amazon’s Territory'}]}, {'name': 'Bolsa Família (Family Grant) Programme: an analysis of Brazilian income transfer programme', 'publisher': 'Field Actions Science Reports – FACTS Reports', 'url': 'http://factsreports.revues.org/1314', 'date': {'month': None, 'day': None, 'year': None}, 'authors': [{'type': 'standardizedContributor', 'first_name': 'Anderson', 'last_name': 'M. J', 'name': None, 'headline': 'Monitoring and Evaluation Officer of the Amazon’s Territory'}, {'type': 'standardizedContributor', 'first_name': 'Luciana', 'last_name': 'MOURÃO', 'name': None, 'headline': 'Professora do PPG em Psicologia na Universidade Salgado de Oliveira e Professora visitante da UERJ. Coordenadora do APRIMORA - Núcleo de Estudos em Trajetória e Desenvolvimento Profissional.'}]}, {'name': 'Le programme Bolsa Família (Bourse familiale)\xa0: analyse du programme brésilien de transfert de revenus', 'publisher': 'Field Actions Science Reports – FACTS Reports', 'url': 'http://factsreports.revues.org/1195', 'date': {'month': None, 'day': None, 'year': None}, 'authors': [{'type': 'standardizedContributor', 'first_name': 'Anderson', 'last_name': 'M. J', 'name': None, 'headline': 'Monitoring and Evaluation Officer of the Amazon’s Territory'}, {'type': 'standardizedContributor', 'first_name': 'Luciana', 'last_name': 'MOURÃO', 'name': None, 'headline': 'Professora do PPG em Psicologia na Universidade Salgado de Oliveira e Professora visitante da UERJ. Coordenadora do APRIMORA - Núcleo de Estudos em Trajetória e Desenvolvimento Profissional.'}]}]","[{'name': 'Advanced Topics in Regression Analysis', 'number': '3203'}, {'name': 'Child and Youth in Development Context', 'number': '4218'}, {'name': 'Compliance with International Norms', 'number': None}, {'name': 'Europeanisation of Public Policy', 'number': None}, {'name': 'Global Governance', 'number': None}, {'name': 'International Public Management', 'number': None}, {'name': 'Law of International Organisations', 'number': None}, {'name': 'Poverty and Inequality', 'number': None}, {'name': 'Regression and Data Analysis', 'number': '3103'}, {'name': 'The Transformation of the European Welfare States', 'number': None}]",[],"[{'company': {'id': 4881, 'name': 'UNICEF', 'logo': 'https://media.licdn.com/dms/image/C510BAQE5WFsvU5iicw/company-logo_400_400/0/1519856174357?e=1700697600&v=beta&t=wv1Nid09MpsBciWzz6p9fKkTtwXG7NiyQ_Wegdl7y1M', 'url': 'https://www.linkedin.com/company/unicef/', 'employees': {'start': 10001, 'end': None}}, 'date': {'start': {'month': 1, 'day': None, 'year': 2019}, 'end': {'month': None, 'day': None, 'year': None}}, 'profile_positions': [{'location': 'Belém, Pará, Brazil', 'date': {'start': {'month': 1, 'day': None, 'year': 2019}, 'end': {'month': None, 'day': None, 'year': None}}, 'company': 'UNICEF', 'description': None, 'title': 'Monitoring And Evaluation Officer', 'employment_type': None}]}, {'company': {'id': None, 'name': 'University Salgado Filho - UNIVERSO', 'logo': None, 'url': None, 'employees': {'start': None, 'end': None}}, 'date': {'start': {'month': 1, 'day': None, 'year': 2010}, 'end': {'month': None, 'day': None, 'year': None}}, 'profile_positions': [{'location': 'Rio de Janeiro Area, Brazil', 'date': {'start': {'month': 1, 'day': None, 'year': 2010}, 'end': {'month': None, 'day': None, 'year': None}}, 'company': 'University Salgado Filho - UNIVERSO', 'description': '•\tVolunteered as a researcher in this group who prides itself for not being an instrument of partisan politics.\n•\tPart of a research group working on evaluating social policy, publishing studies, convening symposia, and promoting solutions to national social policy challenges and financed by the Foundation for the Support to Research of the State of Rio de Janeiro (FAPERJ). \n•\tCurrently conducting an in-depth research on Bolsa Familia, the Brazilian conditional cash transfer program, using STATA and analyzing key documents to identify areas for support and intervention.\n•\tPrepares briefings, research papers, reports, and presentations for the Project Coordinator.', 'title': 'Researcher', 'employment_type': None}]}, {'company': {'id': None, 'name': 'SAGE Journals', 'logo': None, 'url': None, 'employees': {'start': None, 'end': None}}, 'date': {'start': {'month': 10, 'day': None, 'year': 2014}, 'end': {'month': 11, 'day': None, 'year': 2018}}, 'profile_positions': [{'location': None, 'date': {'start': {'month': 10, 'day': None, 'year': 2014}, 'end': {'month': 11, 'day': None, 'year': 2018}}, 'company': 'SAGE Journals', 'description': 'Reviewer of one of the most renowned international peer-reviewed journal devoted to academic and professional public administration since 1927.\nIt is the oldest scholarly public administration journal specifically focused on comparative and international topics.', 'title': 'Reviewer of the International Review and Administrative Science Journal', 'employment_type': None}]}, {'company': {'id': 5677, 'name': 'University of Melbourne', 'logo': 'https://media.licdn.com/dms/image/D560BAQEACkXGOAWOFg/company-logo_400_400/0/1691363408363?e=1700697600&v=beta&t=ungcRXsKMC0LaQ7D8PkpxeiZJjY_ZGmwjBV432JaDeY', 'url': 'https://www.linkedin.com/school/university-of-melbourne/', 'employees': {'start': 5001, 'end': 10000}}, 'date': {'start': {'month': 1, 'day': None, 'year': 2017}, 'end': {'month': 11, 'day': None, 'year': 2017}}, 'profile_positions': [{'location': 'Melbourne, Australia', 'date': {'start': {'month': 1, 'day': None, 'year': 2017}, 'end': {'month': 11, 'day': None, 'year': 2017}}, 'company': 'University of Melbourne', 'description': 'I am responsible for overseeing and supporting a Master student and junior evaluation specialist to develop and implement a community-based participatory evaluation in a fragile country in Africa, Guinea-Bissau. \nI do need to be involved in all phases of this intense exercise by developing an in-depth desktop review based on meetings with government officials, NGO partners and documents; participating in fieldwork visits to gather data and carry out focus group discussions; besides collecting other quantitative data. Furthermore, technical expertise exchange and reporting progress are also part of my duties.', 'title': 'Evaluation Fellow', 'employment_type': None}]}, {'company': {'id': 3527, 'name': 'Johns Hopkins Bloomberg School of Public Health', 'logo': 'https://media.licdn.com/dms/image/C560BAQGjZPHyW5gNxw/company-logo_400_400/0/1519856402101?e=1700697600&v=beta&t=VooBL9jV631CqqAQOQes_N7BZJ41A3p1XVtXev7jqn0', 'url': 'https://www.linkedin.com/school/johns-hopkins-bloomberg-school-of-public-health/', 'employees': {'start': 1001, 'end': 5000}}, 'date': {'start': {'month': 2, 'day': None, 'year': 2017}, 'end': {'month': 4, 'day': None, 'year': 2017}}, 'profile_positions': [{'location': 'Guinea-Bissau', 'date': {'start': {'month': 2, 'day': None, 'year': 2017}, 'end': {'month': 4, 'day': None, 'year': 2017}}, 'company': 'Johns Hopkins Bloomberg School of Public Health', 'description': 'This was a USAID-funded project in which I had the responsibility to strengthen the capacity of Ministry of Health from Guinea Bissau to continuously monitor community-level SBCC activities (Social and Behaviour Change Communication) by developing a methodology of continuous participatory evaluation in order to influence decision-making.\nMy deliverables were the following:\n•\tA concept note for the M&E workshop and implementation phase\n•\tSituational analysis and research instruments \n•\tA developed participatory framework\n•\tA detailed workshop agenda \n•\tA facilitator’s handbook (outlining key concepts to be presented and workshop activities) \n•\tParticipant workbook\n•\tA 4-day workshop, conducted\n•\tA final workshop report with recommendations for sustainability', 'title': 'Evaluation Specialist', 'employment_type': None}]}, {'company': {'id': 4881, 'name': 'UNICEF', 'logo': 'https://media.licdn.com/dms/image/C510BAQE5WFsvU5iicw/company-logo_400_400/0/1519856174357?e=1700697600&v=beta&t=wv1Nid09MpsBciWzz6p9fKkTtwXG7NiyQ_Wegdl7y1M', 'url': 'https://www.linkedin.com/company/unicef/', 'employees': {'start': 10001, 'end': None}}, 'date': {'start': {'month': 6, 'day': None, 'year': 2013}, 'end': {'month': 4, 'day': None, 'year': 2015}}, 'profile_positions': [{'location': 'São Paulo Area, Brazil', 'date': {'start': {'month': 6, 'day': None, 'year': 2013}, 'end': {'month': 4, 'day': None, 'year': 2015}}, 'company': 'UNICEF', 'description': '•\tResponsible for gathering and analysing a large dataset containing 140 indicators used for equity-focused interventions with a purpose to provide evidence to influence major policy decisions. These help the organization in advocating on behalf of the well-being of disadvantaged groups.\n•\tProviding meaningful and essential information to facilitate social policy initiatives such as the signing of the Ministry of Healthcare of a memorandum of understanding (MoU) acknowledging itself as responsible for reducing child mortality rates. \n•\tExtracting micro data from the National Household Sample Survey (PNAD) and the Brazilian Institute of Geography and Statistics (IBGE); Included gender, age, and ethnicity in the datasets to address specific policy needs. \n•\tHandling knowledge management tasks which included the creation of datasets and graphics on violence against young people (0 -18 year-olds) in Brazil. The data will be used to the new National Brazilian Report on VIOLENCE AGAINST CHILDREN.\n•\tThe data bring up integral and the latest Brazilian situation with regards to social and economic indicators such as improvement in vaccination coverage and decrease in child labor.', 'title': 'Policy Analyst (National Consultant - short term assignments)', 'employment_type': None}]}, {'company': {'id': None, 'name': 'International Institute of Social Studies (ISS) of Erasmus University Rotterdam', 'logo': None, 'url': None, 'employees': {'start': None, 'end': None}}, 'date': {'start': {'month': 3, 'day': None, 'year': 2014}, 'end': {'month': 6, 'day': None, 'year': 2014}}, 'profile_positions': [{'location': 'The Hague Area, Netherlands', 'date': {'start': {'month': 3, 'day': None, 'year': 2014}, 'end': {'month': 6, 'day': None, 'year': 2014}}, 'company': 'International Institute of Social Studies (ISS) of Erasmus University Rotterdam', 'description': '• collecting and preparing target variables from secondary data from various sources (World Governance Indicators; Polity 4 project; World Bank Data; CIRI Human Rights Data Project; UNDP; Indices of Social Development; Media Sustainability; Reporters Without Borders; and US-Based Organisation Freedom House);\n• Conducting Granger-causality test for a binary regression analysis;\n• Conducting cross-country and panel data analysis with endogeneity checks and fixed-effects (country fixed effects, time-lags, and when possible also IV analysis);\n• Providing all the raw data, prepared data and STATA log file in a clear and accessible manner', 'title': 'Research Assistant', 'employment_type': None}]}, {'company': {'id': None, 'name': 'Brazilian Federal Government', 'logo': None, 'url': None, 'employees': {'start': None, 'end': None}}, 'date': {'start': {'month': 2, 'day': None, 'year': 2012}, 'end': {'month': 2, 'day': None, 'year': 2014}}, 'profile_positions': [{'location': 'Brazil', 'date': {'start': {'month': 2, 'day': None, 'year': 2012}, 'end': {'month': 2, 'day': None, 'year': 2014}}, 'company': 'Brazilian Federal Government', 'description': '•\tManages a budget of USD 5 million annually for education projects, including those targeting children with cognitive difficulties and disabilities. \n•\tInterprets financial information and develops financial management mechanisms to minimize financial risk. \n•\tServes in an advisory capacity and provides advice to the President on how to maximize the results of politically sensitive and deadline-driven projects. \n•\tPivotal in evaluating projects during and post-implementation phase. Gathers and documents best practices as reference for future projects. \n•\tFormulates long-term business plans for the Ministry of Defense and provides input on improving business performance and reducing operation costs. \n•\tHandles end-to-end project management from developing project plans, managing schedules, to identifying project risks and evaluating project outcomes.\n•\tLeads a team of six staff members and conducts capacity building trainings on planning, organizing, motivating, and controlling resources to achieve specific goals in the context of educational projects. Ensures that all projects are output-oriented and are focused on the quality of education and geared towards optimizing results for the students.\n•\tTakes charge of stakeholder management and represents the organization in business dealings and meetings with auditors, solicitors and governments. \n•\tLiaises with auditors to ensure that annual monitoring is done in a timely manner.', 'title': 'Specialist in Public Management', 'employment_type': None}]}, {'company': {'id': 1861, 'name': 'UNDP', 'logo': 'https://media.licdn.com/dms/image/C560BAQFIruBoghVYeQ/company-logo_400_400/0/1593438994352?e=1700697600&v=beta&t=2W_FBE_XoALrKcErJ-be5APZrWLFxSpE-Prdp9V8fHE', 'url': 'https://www.linkedin.com/company/undp/', 'employees': {'start': 10001, 'end': None}}, 'date': {'start': {'month': 9, 'day': None, 'year': 2011}, 'end': {'month': 7, 'day': None, 'year': 2012}}, 'profile_positions': [{'location': 'Brasília Area, Brazil', 'date': {'start': {'month': 9, 'day': None, 'year': 2011}, 'end': {'month': 7, 'day': None, 'year': 2012}}, 'company': 'UNDP', 'description': '•\tFormulated the methodology used by the Secretaries of the Government of Minas Gerais during the consultations for the negotiations of the new indicators for the MDGs. \n•\tGathered relevant information from key stakeholders which was used to draft the proposal for the new targets and goals which was more comprehensive as it took into consideration the inequalities among municipalities.  The proposal was approved by the Government of Minas Gerais and the UNDP HQ in New York. \n•\tSuccessfully led Minas Gerais to be the first state in the world to rethink the challenges of 2015 and receive commendation from the United Nations as an example to be followed by other states.', 'title': ""Negotiation of new MDG's indicators for the State of Minas Gerais (National Consultant)"", 'employment_type': None}, {'location': 'Brazil', 'date': {'start': {'month': 9, 'day': None, 'year': 2011}, 'end': {'month': 12, 'day': None, 'year': 2011}}, 'company': 'UNDP', 'description': '•\tConducted data gathering and analysis of secondary data related to the indicators of MDG 7: Ensure environmental sustainability. Concluded by means of factor analysis that it was possible to lessen the number of indicators and make the data more effective as they relate to evidence-based policy advocacy. \n•\tUsed a multivariate/factorial analysis to correlate indicators and public policies connected to MDG 7 and removed overlapping indicators which resulted to this MDG to be evaluated effectively by decreasing the number of indicators from 46 to eight.\n•\tDeveloped promotional materials on how the principles of sustainable development have been introduced into policies around the world and their consequences, which was used in a background paper for discussion within meetings with government authorities.\n•\tProduced technical guidance on the progress of public policies in Brazil and identified areas lacking policies including sanitation and lack of potable water in public schools. \n•\tPrepared a final report with a critical analysis of public policies that affect the implementation of MDG 7 and how to consequently achieve their goals.', 'title': 'Verifying the achievement of the MDG 7 (National Consultant)', 'employment_type': None}]}, {'company': {'id': 1836789, 'name': 'CNM - Confederação Nacional de Municípios', 'logo': 'https://media.licdn.com/dms/image/C4D0BAQH--gn9PiDIHQ/company-logo_400_400/0/1641813797565?e=1700697600&v=beta&t=VJKqiIvWybBlLd7H8cYI6GWlkE05U6HSvuGJ0DdNThA', 'url': 'https://www.linkedin.com/company/portalcnm/', 'employees': {'start': 51, 'end': 200}}, 'date': {'start': {'month': 9, 'day': None, 'year': 2011}, 'end': {'month': 3, 'day': None, 'year': 2012}}, 'profile_positions': [{'location': 'Brasília Area, Brazil', 'date': {'start': {'month': 9, 'day': None, 'year': 2011}, 'end': {'month': 3, 'day': None, 'year': 2012}}, 'company': 'CNM - Confederação Nacional de Municípios', 'description': '•\tConducted high-level policy and technical research and identified areas needing support and intervention. After establishing the root of the problem, recommended a capacity building approach to 2,000 civil servants to ensure that proper skills and knowledge will be transmitted to prevent the same problems from recurring. \n•\tHandled knowledge management communication activities such as the preparation of briefings, reports, and presentations. Contributed two volumes in a book on topics revolving around local municipalities; ensured timely launch of publications – coordinated between authors, designers and the printers to ensure project success; maintained and updated an electronic and physical library of publications related to local policies.', 'title': 'Research Analyst', 'employment_type': None}]}]",[],"['Policy Analysis', 'Public Policy', 'Research', 'International Development', 'Project Management', 'Education', 'Education Policy', 'Social Policy', 'Human Development', 'Development Studies', 'Analysis', 'Government', 'Capacity Building', 'Proposal Writing', 'Politics', 'International Relations', 'Tableau software', 'Data analysis', 'Statistics', 'Tableau']",,,
