profile_id,first_name,last_name,sub_title,profile_picture,background_image,profile_type,entity_urn,object_urn,birth_date,summary,location,premium,influencer,treasury_media,languages,industry,education,patents,awards,certifications,organizations,projects,publications,courses,test_scores,position_groups,volunteer_experiences,skills,network_info,related_profiles,contact_info
ger-madern-59412729,Ger,Madern,Owner chez Ger Madern Financial Consultant,,,personal,ACoAAAXkMIABEYny47cISL-0J1cSJtuS7KWFTZk,98840704,,"RESUME

Financial management specialist. Expertise in financial management of governmental and non-governmental organizations. Over 20 years of experience in North, West and East Africa, and the Netherlands Antilles.

Setting up financial- and administrative procedures, financial management systems and elaborating yearly- and long term budgets.

Elaboration of tools for financial management and follow up of the financial reporting of clients.

Provide employees in projects and programs for training and on-the-job-training and working together on capacity strengthening.
 
Charged with logistic matters as the elaboration and execution of tender procedures, writing terms of reference for the recruitment of consultants and auditors, etc.

Drafting technical- and financial reports for donor organizations.

Specialties: pdf,","{'country': 'Netherlands', 'short': 'Eindhoven, North Brabant', 'city': 'Eindhoven', 'state': 'North Brabant', 'default': 'Eindhoven, North Brabant, Netherlands'}",False,False,[],"{'primary_locale': {'country': 'FR', 'language': 'fr'}, 'supported_locales': [{'country': 'FR', 'language': 'fr'}], 'profile_languages': []}",Financial Services,"[{'date': {'start': {'month': None, 'day': None, 'year': None}, 'end': {'month': None, 'day': None, 'year': 1968}}, 'school': {'name': 'MEAO (College for Administration)', 'logo': None, 'url': None}, 'degree_name': 'diploma; MBA', 'field_of_study': 'Modern Business Administration'}]",[],[],[],[],[],[],[],[],"[{'company': {'id': None, 'name': 'Ger Madern Financial Consultant', 'logo': None, 'url': None, 'employees': {'start': None, 'end': None}}, 'date': {'start': {'month': 11, 'day': None, 'year': 2010}, 'end': {'month': None, 'day': None, 'year': None}}, 'profile_positions': [{'location': None, 'date': {'start': {'month': 11, 'day': None, 'year': 2010}, 'end': {'month': None, 'day': None, 'year': None}}, 'company': 'Ger Madern Financial Consultant', 'description': None, 'title': 'Owner', 'employment_type': None}]}, {'company': {'id': None, 'name': 'Algerian Water Company', 'logo': None, 'url': None, 'employees': {'start': None, 'end': None}}, 'date': {'start': {'month': 4, 'day': None, 'year': 1994}, 'end': {'month': None, 'day': None, 'year': None}}, 'profile_positions': [{'location': None, 'date': {'start': {'month': 4, 'day': None, 'year': 1994}, 'end': {'month': None, 'day': None, 'year': None}}, 'company': 'Algerian Water Company', 'description': 'AGEP), financed by the German government (GTZ). Giving assistance to the management of AGEP and of 35 water works all over the country. Standardization of the financial reporting of the water works and introducing a financial management-information system. Responsible for on-the-job-training. Because of political unrest the project had to be abandoned', 'title': 'Gestionnaire', 'employment_type': None}]}, {'company': {'id': 13445, 'name': 'SNV', 'logo': 'https://media.licdn.com/dms/image/C4D0BAQG1LfSno0rbaQ/company-logo_400_400/0/1519855938169?e=1700697600&v=beta&t=TBbS4NClpdaRfjt7Z9RTCsqYYxB117B_TQtPGUz7NMk', 'url': 'https://www.linkedin.com/company/snv/', 'employees': {'start': 1001, 'end': 5000}}, 'date': {'start': {'month': 2, 'day': None, 'year': 2008}, 'end': {'month': 11, 'day': None, 'year': 2010}}, 'profile_positions': [{'location': None, 'date': {'start': {'month': 2, 'day': None, 'year': 2008}, 'end': {'month': 11, 'day': None, 'year': 2010}}, 'company': 'SNV', 'description': None, 'title': 'Senior Advisor', 'employment_type': None}]}, {'company': {'id': None, 'name': 'Ger Madern Financial Consultant', 'logo': None, 'url': None, 'employees': {'start': None, 'end': None}}, 'date': {'start': {'month': 9, 'day': None, 'year': 2007}, 'end': {'month': 2, 'day': None, 'year': 2008}}, 'profile_positions': [{'location': None, 'date': {'start': {'month': 9, 'day': None, 'year': 2007}, 'end': {'month': 2, 'day': None, 'year': 2008}}, 'company': 'Ger Madern Financial Consultant', 'description': 'Three short missions to Mali for KIT and for CELTIC BV as a consultant in the framework of the construction of a logistical center for the exportation of fruits and vegetables.\n\nTwo short missions to Mali (Mopti) for KIT to assist the local financial manager of CRRA Mopti in the financial yearly report and in the recruitment of an auditor.\n\nContract of 8 days with SNV Benin to assist in elaborating the budget of PROCOTON, to be submitted to the Dutch Embassy.', 'title': 'Self employed', 'employment_type': None}]}, {'company': {'id': 45241, 'name': 'KIT', 'logo': 'https://media.licdn.com/dms/image/C510BAQHQjpS_n-4srA/company-logo_400_400/0/1519856687182?e=1700697600&v=beta&t=n_NB-gLUApORsklhAPCX0_VaOjpdGwwilj8XjMCy9vA', 'url': 'https://www.linkedin.com/school/royal-tropical-institute/', 'employees': {'start': 51, 'end': 200}}, 'date': {'start': {'month': 1, 'day': None, 'year': 1998}, 'end': {'month': 9, 'day': None, 'year': 2007}}, 'profile_positions': [{'location': None, 'date': {'start': {'month': 9, 'day': None, 'year': 1998}, 'end': {'month': 9, 'day': None, 'year': 2007}}, 'company': 'KIT Royal Tropical Institute', 'description': None, 'title': 'Gestionnaire (IER Bamako - Mali)', 'employment_type': None}, {'location': None, 'date': {'start': {'month': 1, 'day': None, 'year': 1998}, 'end': {'month': 1, 'day': None, 'year': 2000}}, 'company': 'KIT Royal Tropical Institute', 'description': None, 'title': 'Head Project Administration', 'employment_type': None}]}, {'company': {'id': None, 'name': 'the Royal Tropical Institute', 'logo': None, 'url': None, 'employees': {'start': None, 'end': None}}, 'date': {'start': {'month': 1, 'day': None, 'year': 2000}, 'end': {'month': 9, 'day': None, 'year': 2006}}, 'profile_positions': [{'location': None, 'date': {'start': {'month': 1, 'day': None, 'year': 2000}, 'end': {'month': 9, 'day': None, 'year': 2006}}, 'company': 'the Royal Tropical Institute', 'description': ""KIT) as a financial management advisor with the Institut d'Economie Rurale (IER) in Bamako Mali. In charge of the yearly budgeting and financial reporting of the institute and its nine centers in the country. Assisting in the setting up of business plans.\nGiving courses and on-the-job-training to local staff. Maintaining contacts with the funding organization (Dutch Embassy), Ministries, auditors, etc. Participating in the management team of IER"", 'title': 'Gestionnaire', 'employment_type': None}]}, {'company': {'id': None, 'name': 'Mai 2006', 'logo': None, 'url': None, 'employees': {'start': None, 'end': None}}, 'date': {'start': {'month': 1, 'day': None, 'year': 1998}, 'end': {'month': 1, 'day': None, 'year': 1999}}, 'profile_positions': [{'location': None, 'date': {'start': {'month': 1, 'day': None, 'year': 1998}, 'end': {'month': 1, 'day': None, 'year': 1999}}, 'company': 'Mai 2006', 'description': ""Evaluation of two projects in Togo - PROPTA and Ranch de l'Adelée- financed by EDF.\nResponsible, in a team of four persons, for the financial analysis and evaluation.\n\nTwo missions of three weeks each for setting up a new financial system for the Dutch Government on Curacao in the Netherlands Antilles\n\nEconomical feasibility study for a logistical center for the exportation of fruits and vegetables in Bamako, Mali during 10 days.\n\nSeveral missions to Mali in order to realize the building and the management structure of a logistical center for the exportation of fruits and vegetables.\n\nSeveral missions to Mali for the financial monitoring of a project in Mopti (Mali) financed by CORDAID.\n\n\n\n\n\n\t8 November, 2010"", 'title': 'Coordonnator', 'employment_type': None}]}, {'company': {'id': None, 'name': 'Kabinet voor Nederlands-Antilliaanse en Arubaanse Zaken (Dutch Government)', 'logo': None, 'url': None, 'employees': {'start': None, 'end': None}}, 'date': {'start': {'month': 1, 'day': None, 'year': 1994}, 'end': {'month': 1, 'day': None, 'year': 1998}}, 'profile_positions': [{'location': None, 'date': {'start': {'month': 1, 'day': None, 'year': 1994}, 'end': {'month': 1, 'day': None, 'year': 1998}}, 'company': 'Kabinet voor Nederlands-Antilliaanse en Arubaanse Zaken (Dutch Government)', 'description': 'accountant of the Governors Office in Willemstad, Curaçao.\nResponsible for all financial and administrative matters, such as financial reporting to the Dutch Government, Budgeting and salary administration. Responsible for all consular matters, such as handling the applications for and the issue of visa and passports and assistance to Dutch citizens in the Netherlands Antilles who are in social difficulties. Leading a team of six assistants and coordinating the activities of the secretarial-, the financial- and the consular department.', 'title': 'Comptable', 'employment_type': None}]}, {'company': {'id': None, 'name': 'ALGERIA. GFA', 'logo': None, 'url': None, 'employees': {'start': None, 'end': None}}, 'date': {'start': {'month': 1, 'day': None, 'year': 1993}, 'end': {'month': 1, 'day': None, 'year': 1994}}, 'profile_positions': [{'location': None, 'date': {'start': {'month': 1, 'day': None, 'year': 1993}, 'end': {'month': 1, 'day': None, 'year': 1994}}, 'company': 'ALGERIA. GFA', 'description': None, 'title': 'Gestionnaire', 'employment_type': None}]}, {'company': {'id': None, 'name': 'BURUNDI. GFA', 'logo': None, 'url': None, 'employees': {'start': None, 'end': None}}, 'date': {'start': {'month': 1, 'day': None, 'year': 1989}, 'end': {'month': 1, 'day': None, 'year': 1992}}, 'profile_positions': [{'location': None, 'date': {'start': {'month': 1, 'day': None, 'year': 1989}, 'end': {'month': 1, 'day': None, 'year': 1992}}, 'company': 'BURUNDI. GFA', 'description': 'Sending out to Makamba. Financial and administrative manager together with the counterpart of the SRD Buragane. Responsible for introducing an analytical bookkeeping for financial reporting and budgeting. Computerizing the bookkeeping and the salary-administration. Controlling purchases and the management of the stocks. On-the-job-training of the counterpart and lower executives. Maintaining the financial contacts with the donor, The African Development Bank in Abidjan', 'title': 'Head of Finance', 'employment_type': None}]}]",[],[],,,
