profile_id,first_name,last_name,sub_title,profile_picture,background_image,profile_type,entity_urn,object_urn,birth_date,summary,location,premium,influencer,treasury_media,languages,industry,education,patents,awards,certifications,organizations,projects,publications,courses,test_scores,position_groups,volunteer_experiences,skills,network_info,related_profiles,contact_info
cesar-reyes-acosta,César,Reyes Acosta,Product Manager at AOC / MMD Monitors & Displays,https://media.licdn.com/dms/image/C5603AQHOR5W3kT8C2Q/profile-displayphoto-shrink_800_800/0/1656515252752?e=1697673600&v=beta&t=vgIEer9DUVBeLFsOMiHNMzH0qaFEfVkkhHkTHDI_iHw,,personal,ACoAAArhJ8QBmZvMQbFng8DI_FIyxYFgNF2C5Ic,182527940,,"Hello! I am a Product & Business Manager with an analytical, entrepreneurial and team-player mindset. I have experience in different industries (IT, Professional AV and Consumer Electronics) and B2C and B2B sales channels.

Based in Amsterdam, I lead the product and business development of AOC and PHILIPS gaming products in Europe with outstanding sales, marketing and R&D teams!

Previously, I had great working experiences:
- In companies such as Procter & Gamble, HP, Samsung, and NGOs.
- Wide range of roles as Product and Business Development, Sales, Business Intelligence and Finance.
- Local and regional assignments in Latin America and Europe.","{'country': 'Netherlands', 'short': 'Amsterdam, North Holland', 'city': 'Amsterdam', 'state': 'North Holland', 'default': 'Amsterdam, North Holland, Netherlands'}",False,False,[],"{'primary_locale': {'country': 'ES', 'language': 'es'}, 'supported_locales': [{'country': 'ES', 'language': 'es'}], 'profile_languages': [{'name': 'Español', 'proficiency': 'NATIVE_OR_BILINGUAL'}, {'name': 'Inglés', 'proficiency': 'FULL_PROFESSIONAL'}, {'name': 'Portugués', 'proficiency': 'PROFESSIONAL_WORKING'}]}",Information Technology & Services,"[{'date': {'start': {'month': None, 'day': None, 'year': 2010}, 'end': {'month': None, 'day': None, 'year': 2015}}, 'school': {'name': 'Universidad de Chile', 'logo': 'https://media.licdn.com/dms/image/D4E0BAQHIGS7sjxtNWQ/company-logo_400_400/0/1690249781478?e=1700697600&v=beta&t=Bz_w7J2YBqSt-SXaJpmeaZ9JYZCVmhnsOL93VSLbUy0', 'url': 'https://www.linkedin.com/school/uchile/'}, 'degree_name': ""Bachelor's degree"", 'field_of_study': 'Economics'}]",[],[],[],[],[],[],"[{'name': 'Cybersecurity', 'number': None}, {'name': 'Strategic Selling for Retail', 'number': 'HP Sales Skills 2017'}]",[],"[{'company': {'id': 35688848, 'name': 'AOC International Europe B.V.', 'logo': 'https://media.licdn.com/dms/image/C4D0BAQGUbTFBQz34OA/company-logo_400_400/0/1589452976005?e=1700697600&v=beta&t=Stje15DA2mE20_xVwY3DVJMEDFygc4wKmFsZAilLvMY', 'url': 'https://www.linkedin.com/company/aoc-international-europe/', 'employees': {'start': 501, 'end': 1000}}, 'date': {'start': {'month': 9, 'day': None, 'year': 2019}, 'end': {'month': None, 'day': None, 'year': None}}, 'profile_positions': [{'location': 'Amsterdam, North Holland, Netherlands', 'date': {'start': {'month': 1, 'day': None, 'year': 2021}, 'end': {'month': None, 'day': None, 'year': None}}, 'company': 'AOC International Europe B.V.', 'description': None, 'title': 'AGON by AOC Gaming Product & Business Manager, Europe', 'employment_type': 'Full-time'}, {'location': 'Amsterdam Area, Netherlands', 'date': {'start': {'month': 9, 'day': None, 'year': 2019}, 'end': {'month': 12, 'day': None, 'year': 2020}}, 'company': 'AOC International Europe B.V.', 'description': '- Led Product & Business Development of Touch Monitors, and IT Accessories for PHILIPS and AOC brands, in the European market.', 'title': 'IT Accessories & Touch Monitors Product Manager, Europe', 'employment_type': None}]}, {'company': {'id': 357708, 'name': 'MMD Monitors & Displays', 'logo': 'https://media.licdn.com/dms/image/C4D0BAQH4EwE84n8iEA/company-logo_400_400/0/1589448067471?e=1700697600&v=beta&t=y0nC_lpjj_2GXWc5xFZcwDvPhdzlksbb-unhc-Mi85Y', 'url': 'https://www.linkedin.com/company/mmd-monitors-&-displays/', 'employees': {'start': 51, 'end': 200}}, 'date': {'start': {'month': 9, 'day': None, 'year': 2019}, 'end': {'month': None, 'day': None, 'year': None}}, 'profile_positions': [{'location': 'Amsterdam, North Holland, Netherlands', 'date': {'start': {'month': 1, 'day': None, 'year': 2021}, 'end': {'month': None, 'day': None, 'year': None}}, 'company': 'MMD Monitors & Displays', 'description': None, 'title': 'PHILIPS EVNIA Gaming Product & Business Manager, Europe', 'employment_type': 'Full-time'}, {'location': 'Amsterdam Area, Netherlands', 'date': {'start': {'month': 9, 'day': None, 'year': 2019}, 'end': {'month': 12, 'day': None, 'year': 2020}}, 'company': 'MMD Monitors & Displays', 'description': '- Led Product & Business Development of Touch Monitors, and IT Accessories for PHILIPS and AOC brands, in the European market.', 'title': 'IT Accessories & Touch Monitors Product Manager, Europe', 'employment_type': None}]}, {'company': {'id': 1753, 'name': 'Samsung Electronics', 'logo': 'https://media.licdn.com/dms/image/C560BAQFsvADfvcJi_A/company-logo_400_400/0/1676336400130?e=1700697600&v=beta&t=lhSkOKvLjjTbOQwOhGRlIn4wAll7sCDUp5Hy5_JA_7w', 'url': 'https://www.linkedin.com/company/samsung-electronics/', 'employees': {'start': 10001, 'end': None}}, 'date': {'start': {'month': 9, 'day': None, 'year': 2018}, 'end': {'month': 8, 'day': None, 'year': 2019}}, 'profile_positions': [{'location': 'Santiago Province, Chile', 'date': {'start': {'month': 9, 'day': None, 'year': 2018}, 'end': {'month': 8, 'day': None, 'year': 2019}}, 'company': 'Samsung Electronics', 'description': '- Led Product Management of Samsung Displays Solutions: Digital Signage, LED, Interactive Boards, Hospitality and PC Monitors, and their respective software and accessories.\n- Chile Monthly Best Employee Recognition in December 2018.', 'title': 'Professional Displays & Monitors Product Manager', 'employment_type': None}]}, {'company': {'id': 5390798, 'name': 'HP', 'logo': 'https://media.licdn.com/dms/image/D560BAQEZ6ZVjZmwiwA/company-logo_400_400/0/1692312131153?e=1700697600&v=beta&t=vjNct5MIM4_u8C8P3Lu9JTr5cqiwD8aw1wO_if4Wd8M', 'url': 'https://www.linkedin.com/company/hp/', 'employees': {'start': 10001, 'end': None}}, 'date': {'start': {'month': 4, 'day': None, 'year': 2015}, 'end': {'month': 8, 'day': None, 'year': 2018}}, 'profile_positions': [{'location': 'Santiago, Chile', 'date': {'start': {'month': 8, 'day': None, 'year': 2017}, 'end': {'month': 8, 'day': None, 'year': 2018}}, 'company': 'HP', 'description': '- Led Consumer Category for Chile (PCs) and Uruguay & Paraguay  (Notebooks and PCs), both for HP and Omen brands\n- HP Work & Fun Team Member: Co-lead social responsibility and sports activities\n- HP Buddy: Mentor the new cohorts of HP Trainees', 'title': 'Consumer Category Manager', 'employment_type': None}, {'location': 'Santiago, Chile', 'date': {'start': {'month': 11, 'day': None, 'year': 2016}, 'end': {'month': 7, 'day': None, 'year': 2017}}, 'company': 'HP', 'description': '- Led Mobility Category (tablets, detachables and phablets) for Multi-Country Area Region that considers Latin America without Mexico and Brazil\n- HP Work & Fun Team Member: Co-lead social responsibility and sports activities', 'title': 'Mobility Product Manager Jr, Multi-Country Area', 'employment_type': None}, {'location': 'Santiago, Chile', 'date': {'start': {'month': 2, 'day': None, 'year': 2016}, 'end': {'month': 10, 'day': None, 'year': 2016}}, 'company': 'HP', 'description': '- Built business tools to track and take action in diverse regional KPIs and sales opportunities\n- Co-founder and Captain of HP Runners Team', 'title': 'Business Analyst', 'employment_type': None}, {'location': 'Santiago, Chile', 'date': {'start': {'month': 4, 'day': None, 'year': 2015}, 'end': {'month': 1, 'day': None, 'year': 2016}}, 'company': 'HP', 'description': '-\t“Always Accountable” Recognition in Q3 FY15\n-\t“Making the Difference: Innovation” Recognition in Q4 FY15', 'title': 'Managment & Sales Trainee', 'employment_type': None}]}, {'company': {'id': 1116, 'name': 'Procter & Gamble', 'logo': 'https://media.licdn.com/dms/image/C4D0BAQGGCd-fMXfRWw/company-logo_400_400/0/1661448431618?e=1700697600&v=beta&t=_DDCDOc6py-Y24mv5TErwVsmncoB6tnFXsjB7qIVQSw', 'url': 'https://www.linkedin.com/company/procter-and-gamble/', 'employees': {'start': 10001, 'end': None}}, 'date': {'start': {'month': 1, 'day': None, 'year': 2014}, 'end': {'month': 12, 'day': None, 'year': 2014}}, 'profile_positions': [{'location': 'Santiago Province, Chile', 'date': {'start': {'month': 7, 'day': None, 'year': 2014}, 'end': {'month': 12, 'day': None, 'year': 2014}}, 'company': 'Procter & Gamble', 'description': None, 'title': 'Customer Development Finance Intern', 'employment_type': None}, {'location': 'Ciudad de Panamá, Panamá', 'date': {'start': {'month': 1, 'day': None, 'year': 2014}, 'end': {'month': 6, 'day': None, 'year': 2014}}, 'company': 'Procter & Gamble', 'description': '- ""Thanks for putting your heart into it!"" Recognition in Q4 FY14', 'title': 'Product Supply Finance Baby Care Intern, Latin America', 'employment_type': None}]}, {'company': {'id': 7790222, 'name': 'Chile California Council', 'logo': 'https://media.licdn.com/dms/image/C4D0BAQE5aUQ75tkzxw/company-logo_400_400/0/1519888757806?e=1700697600&v=beta&t=pOn2A5IrlPVff0XrgMP6bPul87qlBjKt_2BtTibEWQU', 'url': 'https://www.linkedin.com/company/chile-california-council/', 'employees': {'start': 2, 'end': 10}}, 'date': {'start': {'month': 7, 'day': None, 'year': 2013}, 'end': {'month': 8, 'day': None, 'year': 2013}}, 'profile_positions': [{'location': 'San Francisco Bay Area', 'date': {'start': {'month': 7, 'day': None, 'year': 2013}, 'end': {'month': 8, 'day': None, 'year': 2013}}, 'company': 'Chile California Council', 'description': '-\tThe internship was part of “Prácticas para Chile” program and led by the Chilean Finance Ministry', 'title': 'Intern', 'employment_type': None}]}]","[{'date': {'start': {'month': 8, 'day': None, 'year': 2020}, 'end': {'month': 7, 'day': None, 'year': 2022}}, 'role': 'Corporate Partnerships Manager', 'company': {'id': None, 'name': 'educate.', 'logo': 'https://media.licdn.com/dms/image/C560BAQEjPn4UUunfkw/company-logo_400_400/0/1624295395920?e=1700697600&v=beta&t=58k8-oRDQCt2L8W3mk7Qvv5dOPslH9al_jFkcFyxqhg', 'url': 'https://www.linkedin.com/company/educatengo/'}, 'cause': 'EDUCATION', 'description': None}, {'date': {'start': {'month': 9, 'day': None, 'year': 2012}, 'end': {'month': 12, 'day': None, 'year': 2013}}, 'role': 'Project Manager & Founder - Taller de Introducción al mundo de la Ingeniería', 'company': {'id': None, 'name': 'Colegio de Ingenieros de Chile A.G.', 'logo': 'https://media.licdn.com/dms/image/C4E0BAQGJoLOZEIRtAA/company-logo_400_400/0/1651789970375?e=1700697600&v=beta&t=oYarvHwbTnhi5503cxf3PF-njrw4akiSeo1-0QcwQ5I', 'url': 'https://www.linkedin.com/company/colegio-de-ingenieros-de-chile/'}, 'cause': 'EDUCATION', 'description': '- Volunteer organization that coached 20 students from public schools to be accepted into an engineering major'}, {'date': {'start': {'month': 12, 'day': None, 'year': 2014}, 'end': {'month': 1, 'day': None, 'year': 2015}}, 'role': 'Volunteer', 'company': {'id': None, 'name': 'International Monetary Fund', 'logo': 'https://media.licdn.com/dms/image/C4D0BAQEBM8ZXjvt56g/company-logo_400_400/0/1614377080026?e=1700697600&v=beta&t=6H-_3AcsIDZ1muWOjr3CYuHdutXkd1mGYWBk7_NVGrY', 'url': 'https://www.linkedin.com/company/international-monetary-fund/'}, 'cause': 'POVERTY_ALLEVIATION', 'description': '- Supported organization and co-led a group of 24 volunteers in the Santiago 2014 IMF Conference: Challenges for securing growth and shared prosperity in Latin America'}, {'date': {'start': {'month': 7, 'day': None, 'year': 2013}, 'end': {'month': 12, 'day': None, 'year': 2014}}, 'role': 'Volunteer & Teacher', 'company': {'id': None, 'name': 'CreeME UChile', 'logo': 'https://media.licdn.com/dms/image/C4E0BAQGqlXydIYnoXg/company-logo_400_400/0/1519868384632?e=1700697600&v=beta&t=Bw9qCzFkatMbxGIA9VSy1yoW0-aWjgwCTRCGSxxMm2k', 'url': 'https://www.linkedin.com/company/creeme-uchile/'}, 'cause': 'ECONOMIC_EMPOWERMENT', 'description': '- Taught management, finance and accounting classes to +100 micro entrepreneurs'}, {'date': {'start': {'month': 9, 'day': None, 'year': 2011}, 'end': {'month': 12, 'day': None, 'year': 2013}}, 'role': '""El Plan"" y ""Financity"" Monitor', 'company': {'id': None, 'name': 'Momento Cero (Mo.0)', 'logo': 'https://media.licdn.com/dms/image/C560BAQEkmQJZMP1KFw/company-logo_400_400/0/1519898267046?e=1700697600&v=beta&t=k-ghmG1m8VbCClshHK2QnrtJvXasTnggsF-RCIeBH2I', 'url': 'https://www.linkedin.com/company/momento-cero/'}, 'cause': 'POVERTY_ALLEVIATION', 'description': '- Taught entrepreneurial spirit and personal finance to low income children and families through seminars and board games'}]","['Microsoft Excel', 'Microsoft Word', 'Microsoft Office', 'Business English', 'Economics', 'Spanish', 'Estrategia empresarial', 'Estrategia', 'Analysis', 'Administración y dirección de empresas', 'Business Strategy']",,,
