profile_id,first_name,last_name,sub_title,profile_picture,background_image,profile_type,entity_urn,object_urn,birth_date,summary,location,premium,influencer,treasury_media,languages,industry,education,patents,awards,certifications,organizations,projects,publications,courses,test_scores,position_groups,volunteer_experiences,skills,network_info,related_profiles,contact_info
meizegers,Mei,Zegers,Senior International Development Consultant at Independent Development Consultant,https://media.licdn.com/dms/image/D4E03AQHBTr6nZ61sJg/profile-displayphoto-shrink_800_800/0/1689521862788?e=1697673600&v=beta&t=wwBo-Y_RzIakmcVwwUWNiVsnbnTwhh0y_KGN1p25kMw,https://media.licdn.com/dms/image/C5616AQHTxkPZusVoUg/profile-displaybackgroundimage-shrink_350_1400/0/1566466825944?e=1697673600&v=beta&t=qSGzBtdztbgzPbOhBSyk8ItGTS9qI509xGeR7pYEwpA,personal,ACoAAAFVtDsBcrtOYau0viZWl552PrNf0-PDo5k,22393915,,"International Development Expert with Experience in Africa and Asia:

-	Consultant with 37 years of working experience in developing countries. Also a total of four years working at Royal Tropical Institute (KIT) in Amsterdam. Resident in Africa and Asia for over 30 years.

-     Team Leader of complex evaluations including three global thematic evaluations (1 for UNICEF, 2 for the ILO), multi-country and multi-project evaluations. 

-	Contracts with current and past employers include: International Labour Organization, UNICEF, World Bank, U.S. Department of Labor, USAID, UNFPA, and European Commission, UN Women

-	Team leader having led groups of up to 30 in design, monitoring and evaluation/impact assessment of projects and organizations, quantitative and qualitative research.  

-	Multi-sectoral experience acquired through entry point of organization development.  Planning at micro, meso, macro level. 

Work experience in countries: 
Asia:  Bangladesh, Cambodia, China, India, Indonesia, Mongolia, Pakistan, Philippines, Thailand. 
Africa: Côte d'Ivoire, Congo-Brazzaville (RC), Congo-Kinshasa (DRC), Ghana, Ethiopia, Kenya, Lesotho, Liberia, Madagascar, Malawi, Mozambique, Morocco, South Africa, The Gambia, Rwanda, Senegal, Tanzania, The Gambia, Uganda, Zambia, Zimbabwe.
Latin America: Guatemala, Paraguay, Suriname
Europe: Netherlands, Belgium, Serbia

Specialties: Economic activities development; child labour; vocational education, violence against children, social protection, HIV in the workplace; mainstreaming gender; organisation analysis and institutional networking; culture and development; socio-economic analysis; community development. Gender as core component in all assignments","{'country': 'Netherlands', 'short': 'Amsterdam, North Holland', 'city': 'Amsterdam', 'state': 'North Holland', 'default': 'Amsterdam, North Holland, Netherlands'}",False,False,[],"{'primary_locale': {'country': 'US', 'language': 'en'}, 'supported_locales': [{'country': 'US', 'language': 'en'}], 'profile_languages': [{'name': 'Dutch', 'proficiency': 'NATIVE_OR_BILINGUAL'}, {'name': 'English', 'proficiency': 'NATIVE_OR_BILINGUAL'}, {'name': 'French', 'proficiency': 'PROFESSIONAL_WORKING'}]}",Management Consulting,"[{'date': {'start': {'month': None, 'day': None, 'year': 1983}, 'end': {'month': None, 'day': None, 'year': 1988}}, 'school': {'name': 'Vrije Universiteit Amsterdam (VU Amsterdam)', 'logo': 'https://media.licdn.com/dms/image/D4E0BAQGFG964atm3Ow/company-logo_400_400/0/1682661887840?e=1700697600&v=beta&t=bmk2N5LswEoQY_WJO0VySuxsWNNlfjU6XyPjkGaINeo', 'url': 'https://www.linkedin.com/school/vrije-universiteit-amsterdam/'}, 'degree_name': 'Ph.D.', 'field_of_study': 'Social Sciences, Management Training for Small Enterprises in the Context of Developing Country'}, {'date': {'start': {'month': None, 'day': None, 'year': 1977}, 'end': {'month': None, 'day': None, 'year': 1980}}, 'school': {'name': 'Vrije Universiteit Amsterdam (VU Amsterdam)', 'logo': 'https://media.licdn.com/dms/image/D4E0BAQGFG964atm3Ow/company-logo_400_400/0/1682661887840?e=1700697600&v=beta&t=bmk2N5LswEoQY_WJO0VySuxsWNNlfjU6XyPjkGaINeo', 'url': 'https://www.linkedin.com/school/vrije-universiteit-amsterdam/'}, 'degree_name': ""Master's Degree with honours"", 'field_of_study': 'Labour and Organisational Psychology with minor in Development Economics'}]",[],[],[],"[{'name': ""Association for Women's Rights in Development (AWID)"", 'position': 'Member', 'date_start': None, 'date_end': None}, {'name': 'European Evaluation Society', 'position': 'Member', 'date_start': None, 'date_end': None}, {'name': 'International Development Evaluation Association (IDEAS)', 'position': 'Member', 'date_start': None, 'date_end': None}]",[],[],[],[],"[{'company': {'id': None, 'name': 'Independent Development Consultant', 'logo': None, 'url': None, 'employees': {'start': None, 'end': None}}, 'date': {'start': {'month': None, 'day': None, 'year': 1984}, 'end': {'month': None, 'day': None, 'year': None}}, 'profile_positions': [{'location': 'Global', 'date': {'start': {'month': None, 'day': None, 'year': 1984}, 'end': {'month': None, 'day': None, 'year': None}}, 'company': 'Independent Development Consultant', 'description': 'Consulting in international development covering a range of socio-economic issues. Team led 3 global (worldwide) thematic evaluations for the United Nations. See ""About""', 'title': 'Senior International Development Consultant', 'employment_type': 'Freelance'}]}, {'company': {'id': None, 'name': 'ICF Macro', 'logo': None, 'url': None, 'employees': {'start': None, 'end': None}}, 'date': {'start': {'month': None, 'day': None, 'year': 2007}, 'end': {'month': None, 'day': None, 'year': 2012}}, 'profile_positions': [{'location': None, 'date': {'start': {'month': None, 'day': None, 'year': 2007}, 'end': {'month': None, 'day': None, 'year': 2012}}, 'company': 'ICF Macro', 'description': 'Multiple missions to different countries to conduct project evaluations, develop concept notes, project documents...', 'title': 'Senior Consultant', 'employment_type': None}]}, {'company': {'id': None, 'name': 'Royal Tropical Institute A', 'logo': None, 'url': None, 'employees': {'start': None, 'end': None}}, 'date': {'start': {'month': 1, 'day': None, 'year': 1985}, 'end': {'month': 12, 'day': None, 'year': 1987}}, 'profile_positions': [{'location': 'Amsterdam', 'date': {'start': {'month': 1, 'day': None, 'year': 1985}, 'end': {'month': 12, 'day': None, 'year': 1987}}, 'company': 'Royal Tropical Institute A', 'description': 'Course design, coordination, facilitation of courses in intercultural communications, international development, and gender issues. Also worked at Royal Tropical Institute in 1979 so total duration with the Institute was 4 years. During same time period did some part time consulting and worked on writing PhD dissertation.', 'title': 'Course Coordinator, Facilitator', 'employment_type': None}]}, {'company': {'id': 164314, 'name': 'International Labour Organization (ILO)', 'logo': 'https://media.licdn.com/dms/image/C4E0BAQF1LqzU9GnGOw/company-logo_400_400/0/1579692940031?e=1700697600&v=beta&t=kI7R0YgoDvFoThiQHbdx7sAeltX0iGYeszs_Dh0-9Kc', 'url': 'https://www.linkedin.com/company/international-labour-organization-ilo/', 'employees': {'start': 1001, 'end': 5000}}, 'date': {'start': {'month': 1, 'day': None, 'year': 1980}, 'end': {'month': 12, 'day': None, 'year': 1984}}, 'profile_positions': [{'location': 'Republic of Congo -Brazzaville, The Gambia', 'date': {'start': {'month': 1, 'day': None, 'year': 1980}, 'end': {'month': 12, 'day': None, 'year': 1984}}, 'company': 'International Labour Organization', 'description': '1980-1982 Management consulting and trainer for the National Centre for Management (CENAGES) in Congo-Brazzaville in management training, organisation development and personnel management, organised and supervised training needs study in 40 enterprises.\n1982-1984- Training and Research Unit Coordinator for the Indigenous Business Advisory Service, The Gambia.  Established Unit on management training and planned, coordinated and taught courses for project staff and small-scale entrepreneurs.  Designed and supervised countrywide study of training needs, designed appropriate courses for the semi-literate and assessed effectiveness of courses.', 'title': 'Associate Expert: Management Training, Resarch, Entrerpeneurship', 'employment_type': None}]}]","[{'date': {'start': {'month': None, 'day': None, 'year': None}, 'end': {'month': None, 'day': None, 'year': None}}, 'role': 'Co-founder', 'company': {'id': None, 'name': 'Kalakar Trust', 'logo': None, 'url': None}, 'cause': 'SOCIAL_SERVICES', 'description': 'VISION of the Kalakar Trust:\nTo be a lead agency and model NGO in the preservation and development of the vanishing traditional arts in India by focusing on the physical, mental and professional needs of the artists.\nMISSION:\nTo support the development of traditional artists through:\n- social, education, and health actions \n-improvement of economic opportunities through training on performing, production, directing, choreography, costume management, and marketing of their arts so that they can have decent work and income. \n'}]","['Capacity Building', 'International Development', 'Program Evaluation', 'Qualitative Research', 'Proposal Writing', 'Organizational Development', 'Community Development', 'Civil Society', 'Workshop Facilitation', 'Research', 'NGOs', 'Policy Analysis', 'Government', 'International Relations', 'Program Management', 'Africa', 'Policy', 'Governance', 'Human Rights', 'Grants']",,,
