profile_id,first_name,last_name,sub_title,profile_picture,background_image,profile_type,entity_urn,object_urn,birth_date,summary,location,premium,influencer,treasury_media,languages,industry,education,patents,awards,certifications,organizations,projects,publications,courses,test_scores,position_groups,volunteer_experiences,skills,network_info,related_profiles,contact_info
yurisebregts,Yuri,Sebregts,Executive Vice President Technology and Chief Technology Officer at Shell,https://media.licdn.com/dms/image/C4E03AQH9LrgDWYar5w/profile-displayphoto-shrink_800_800/0/1581951024172?e=1697673600&v=beta&t=JjFL8B1TIs-e0R3tAyqhQQUZZjm1ia2VVvH4vlDtmvQ,https://media.licdn.com/dms/image/C5616AQGLwRGOPowj2A/profile-displaybackgroundimage-shrink_350_1400/0/1521187244718?e=1697673600&v=beta&t=936huiLfdlaLSpl2WJfq9UieMpIQXdcEnZUQbAbEIcE,personal,ACoAAAJGCLoBb20E8cpZuQYkNNpeaFgY9u39MAI,38144186,,"I believe in the power of technology as a force for good in society and a competitive differentiator for Shell. 

I lead an organisation of more than 3,000 people who develop and deploy new technologies today, creating more and cleaner energy for the future. These teams are based at major technology centres in Amsterdam, Houston and Bangalore, and at smaller technical centres located close to Shell’s customers and partners. I am committed to creating workplace diversity and an inclusive environment that allows everyone to bring their whole selves to work and be the best they can be.

As EVP Technology, I am responsible for new technology development and external technology commercialisation activities across areas as diverse as geology, chemistry, engineering and digital technologies. Our activities range from research and development programmes delivered in-house and through collaborations with external partners, to deployment of technologies across Shell’s operations, as well as catalyst manufacturing and sales, and technology licensing and technical services to third parties. I also oversee the company’s digitalisation activities to apply proven and new digital technology solutions to Shell’s existing businesses and emerging new business models. 

This is my private LinkedIn page, the views expressed here are my own and do not necessarily reflect those of Shell.  

I invite you to read my latest speech on digitalisation and the energy transition.","{'country': 'Netherlands', 'short': 'Amsterdam, North Holland', 'city': 'Amsterdam', 'state': 'North Holland', 'default': 'Amsterdam, North Holland, Netherlands'}",False,False,"[{'url': None, 'title': 'Yuri Sebregts Trouw interview English translation', 'description': '', 'image': 'https://media.licdn.com/dms/image/C4E2DAQGo-Cey-g8rBA/profile-treasury-document-cover-images_1920/0/1583639971686?e=1692885600&v=beta&t=078UFmcuFZfKHvLkX_ipzq5I7l6dae8O9oDe32XKhys'}]","{'primary_locale': {'country': 'US', 'language': 'en'}, 'supported_locales': [{'country': 'US', 'language': 'en'}], 'profile_languages': []}",Oil & Energy,"[{'date': {'start': {'month': None, 'day': None, 'year': None}, 'end': {'month': None, 'day': None, 'year': None}}, 'school': {'name': 'Leiden University', 'logo': 'https://media.licdn.com/dms/image/C4D0BAQEFlK1wNecYbA/company-logo_400_400/0/1519855876129?e=1700092800&v=beta&t=_Ka1xca3IfdCHmeD7q7WGgDYObpZ56ZjJTvjnjfwxW0', 'url': 'https://www.linkedin.com/school/leiden-university/'}, 'degree_name': 'MSc Chemistry', 'field_of_study': None}]",[],[],[],[],[],[],[],[],"[{'company': {'id': 1271, 'name': 'Shell', 'logo': 'https://media.licdn.com/dms/image/C4D0BAQGN30g7aSl4NA/company-logo_400_400/0/1519856218579?e=1700092800&v=beta&t=HqIwwLBNmVKkXXiXnFVRbQwTX34PBz5TB2QZhtR3btU', 'url': 'https://www.linkedin.com/company/shell/', 'employees': {'start': 10001, 'end': None}}, 'date': {'start': {'month': 10, 'day': None, 'year': 2004}, 'end': {'month': None, 'day': None, 'year': None}}, 'profile_positions': [{'location': 'Amsterdam Area, Netherlands', 'date': {'start': {'month': 3, 'day': None, 'year': 2018}, 'end': {'month': None, 'day': None, 'year': None}}, 'company': 'Shell', 'description': ""Responsible for Shell's technology strategy and new technology development, as well as external technology commercialization."", 'title': 'Executive Vice President Technology and Chief Technology Officer', 'employment_type': None}, {'location': 'Amsterdam Area, Netherlands', 'date': {'start': {'month': 1, 'day': None, 'year': 2015}, 'end': {'month': 2, 'day': None, 'year': 2018}}, 'company': 'Shell', 'description': 'Responsible for the technology strategy and ensuring that Shell develops and deploys technologies and services to deliver projects and new products across the world faster and more economically.', 'title': 'Executive Vice President Innovation and R&D and Chief Technology Officer', 'employment_type': None}, {'location': 'Houston, Texas Area', 'date': {'start': {'month': 9, 'day': None, 'year': 2012}, 'end': {'month': 12, 'day': None, 'year': 2014}}, 'company': 'Shell', 'description': ""Led Shell's global supply organization for Refinery Crude selection, economic optimization and scheduling, and Shell's global Manufacturing Excellence and Support organization."", 'title': 'Vice President Manufacturing Excellence and Refinery Margin Optimization', 'employment_type': None}, {'location': 'London, United Kingdom', 'date': {'start': {'month': 9, 'day': None, 'year': 2009}, 'end': {'month': 8, 'day': None, 'year': 2012}}, 'company': 'Shell', 'description': 'Led Shell Lubricants Global supply chain organisation. This includes operations, product management and new business development. Bottom line accountable for supply chain planning, raw materials and services sourcing, production in 50+ locations and worldwide Lubricants logistics operations.', 'title': 'Vice President Lubricants Supply Chain', 'employment_type': None}, {'location': None, 'date': {'start': {'month': 6, 'day': None, 'year': 2007}, 'end': {'month': 8, 'day': None, 'year': 2009}}, 'company': 'Shell', 'description': None, 'title': 'General Manager Stanlow Refinery and Chemicals Manufacturing Complex', 'employment_type': None}, {'location': None, 'date': {'start': {'month': 10, 'day': None, 'year': 2004}, 'end': {'month': 5, 'day': None, 'year': 2007}}, 'company': 'Shell', 'description': None, 'title': 'General Manager Global C4 and C5 Olefins Business', 'employment_type': None}]}, {'company': {'id': 1271, 'name': 'Shell', 'logo': 'https://media.licdn.com/dms/image/C4D0BAQGN30g7aSl4NA/company-logo_400_400/0/1519856218579?e=1700092800&v=beta&t=HqIwwLBNmVKkXXiXnFVRbQwTX34PBz5TB2QZhtR3btU', 'url': 'https://www.linkedin.com/company/shell/', 'employees': {'start': 10001, 'end': None}}, 'date': {'start': {'month': None, 'day': None, 'year': 1991}, 'end': {'month': None, 'day': None, 'year': 2004}}, 'profile_positions': [{'location': None, 'date': {'start': {'month': None, 'day': None, 'year': 1991}, 'end': {'month': None, 'day': None, 'year': 2004}}, 'company': 'Shell', 'description': None, 'title': 'Various technical and managerial roles', 'employment_type': None}]}]",[],"['Supply Chain', 'Refinery', 'Supply Chain Management', 'Coaching', 'Petroleum', 'Logistics', 'New Business Development', 'Product Management', 'Change Management', 'Downstream Oil & Gas', 'Business Strategy', 'Lubricants', 'Sourcing', 'Refining', 'Energy', 'Gas', 'Oil & Gas', 'Strategy', 'Process Engineering', 'Business Development']",,,
