profile_id,first_name,last_name,sub_title,profile_picture,background_image,profile_type,entity_urn,object_urn,birth_date,summary,location,premium,influencer,treasury_media,languages,industry,education,patents,awards,certifications,organizations,projects,publications,courses,test_scores,position_groups,volunteer_experiences,skills,network_info,related_profiles,contact_info
willemiekehof,Willemieke,Hof,Adviseur Praktijkleren at Samenwerking Beroepsonderwijs Bedrijfsleven SBB,https://media.licdn.com/dms/image/C4D03AQEdJPr2JEnzxw/profile-displayphoto-shrink_800_800/0/1516569004332?e=1697673600&v=beta&t=QuSSdqxr7KdYwRifBBg0lFk3rOulI1U7Y_m6dnASIFg,,personal,ACoAAAMk6IQBzvNOVBY3JcCquCmOAtfiJtJ_We0,52750468,,"Opleidingsprofessional met een praktijk- en  resultaatgerichte aanpak.
In het werk stressbestendig, volhardend, met oog voor detail en gericht op samenwerking
In relaties betrokken en waarderend.
Als persoon te typeren als iemand met een positieve instelling, evenwichting, vriendelijk en mensgericht. 
Trefwoorden: Leergriering, nieuwsgierig, avontuurlijk, ontdekkend en creatief
Hobby's: reizen, fotograferen, kunst & design, lezen, schrijven, golf, fitness en 'leuke dingen doen' in de breedste zin van het woord.","{'country': 'Netherlands', 'short': 'Amsterdam, North Holland', 'city': 'Amsterdam', 'state': 'North Holland', 'default': 'Amsterdam, North Holland, Netherlands'}",False,False,[],"{'primary_locale': {'country': 'US', 'language': 'en'}, 'supported_locales': [{'country': 'US', 'language': 'en'}], 'profile_languages': [{'name': 'Afrikaans', 'proficiency': 'ELEMENTARY'}, {'name': 'Dutch', 'proficiency': 'NATIVE_OR_BILINGUAL'}, {'name': 'English', 'proficiency': 'PROFESSIONAL_WORKING'}, {'name': 'French', 'proficiency': 'ELEMENTARY'}, {'name': 'German', 'proficiency': 'PROFESSIONAL_WORKING'}]}",Education Management,"[{'date': {'start': {'month': None, 'day': None, 'year': 2014}, 'end': {'month': None, 'day': None, 'year': 2015}}, 'school': {'name': 'IVOR-Reisbegeleiding', 'logo': None, 'url': None}, 'degree_name': None, 'field_of_study': 'Opleiding tot reisbegeleider'}, {'date': {'start': {'month': None, 'day': None, 'year': 2009}, 'end': {'month': None, 'day': None, 'year': 2010}}, 'school': {'name': 'ACC Academie voor Counselling en Coaching', 'logo': None, 'url': None}, 'degree_name': None, 'field_of_study': 'Counsellor/coach'}, {'date': {'start': {'month': None, 'day': None, 'year': 2006}, 'end': {'month': None, 'day': None, 'year': 2007}}, 'school': {'name': 'FCE Foundation for Corporate Education/Kessels & Smit', 'logo': None, 'url': None}, 'degree_name': None, 'field_of_study': 'Leergang Corporate Learning'}, {'date': {'start': {'month': None, 'day': None, 'year': 2005}, 'end': {'month': None, 'day': None, 'year': 2006}}, 'school': {'name': 'FCE Foundation for Corporate Education/Kessels & Smit', 'logo': None, 'url': None}, 'degree_name': None, 'field_of_study': 'Leergang Opleidingskunde'}, {'date': {'start': {'month': None, 'day': None, 'year': 2003}, 'end': {'month': None, 'day': None, 'year': 2004}}, 'school': {'name': 'Fontys University of Applied Sciences', 'logo': 'https://media.licdn.com/dms/image/C560BAQHoPshjTmIrAg/company-logo_400_400/0/1519856033175?e=1700697600&v=beta&t=0qGzAv6PuQje0RGiJ7HkFVuTY5RW0pmusC4QImvaao4', 'url': 'https://www.linkedin.com/school/fontys-hogescholen/'}, 'degree_name': None, 'field_of_study': 'Trainer/Opleider'}, {'date': {'start': {'month': None, 'day': None, 'year': 1990}, 'end': {'month': None, 'day': None, 'year': 1994}}, 'school': {'name': 'Hogeschool Alkmaar', 'logo': None, 'url': None}, 'degree_name': None, 'field_of_study': 'Commerciele Economie'}, {'date': {'start': {'month': None, 'day': None, 'year': 1986}, 'end': {'month': None, 'day': None, 'year': 1990}}, 'school': {'name': 'Wenckebach MTS', 'logo': None, 'url': None}, 'degree_name': None, 'field_of_study': 'Werktuigbouwkunde'}, {'date': {'start': {'month': None, 'day': None, 'year': 1977}, 'end': {'month': None, 'day': None, 'year': 1980}}, 'school': {'name': 'Ichtus College', 'logo': None, 'url': None}, 'degree_name': 'HAVO', 'field_of_study': None}, {'date': {'start': {'month': None, 'day': None, 'year': 1973}, 'end': {'month': None, 'day': None, 'year': 1977}}, 'school': {'name': 'Ichtus College', 'logo': None, 'url': None}, 'degree_name': 'Mavo', 'field_of_study': None}]",[],[],[],[],[],[],[],[],"[{'company': {'id': 2436491, 'name': 'Samenwerking Beroepsonderwijs Bedrijfsleven SBB', 'logo': 'https://media.licdn.com/dms/image/D4E0BAQHlzhYnl17l_Q/company-logo_400_400/0/1666272829235?e=1700697600&v=beta&t=thVu27Qh-nVGOAFUxvz0e_F5G4QQ3GFJxk62hb5Exdo', 'url': 'https://www.linkedin.com/company/samenwerking-beroepsonderwijs-bedrijfsleven-sbb/', 'employees': {'start': 501, 'end': 1000}}, 'date': {'start': {'month': 11, 'day': None, 'year': 2017}, 'end': {'month': None, 'day': None, 'year': None}}, 'profile_positions': [{'location': 'Zoetermeer', 'date': {'start': {'month': 11, 'day': None, 'year': 2017}, 'end': {'month': None, 'day': None, 'year': None}}, 'company': 'Samenwerking Beroepsonderwijs Bedrijfsleven SBB', 'description': None, 'title': 'Adviseur Praktijkleren', 'employment_type': None}]}, {'company': {'id': 1285119, 'name': 'Mad Science Nederland', 'logo': 'https://media.licdn.com/dms/image/C4E0BAQGgv7wTOBeAjQ/company-logo_400_400/0/1604425426803?e=1700697600&v=beta&t=4WCR-rwA_WtGuhmwhG5gIbEekKKt5jYbzeqr-wGJEWc', 'url': 'https://www.linkedin.com/company/mad-science-nederland/', 'employees': {'start': 201, 'end': 500}}, 'date': {'start': {'month': 5, 'day': None, 'year': 2017}, 'end': {'month': 6, 'day': None, 'year': 2018}}, 'profile_positions': [{'location': None, 'date': {'start': {'month': 5, 'day': None, 'year': 2017}, 'end': {'month': 6, 'day': None, 'year': 2018}}, 'company': 'Mad Science Nederland', 'description': 'Verzorgen naschoolse cursussen wetenschap en techniek voor basisscholen', 'title': 'Mad Scientist', 'employment_type': None}]}, {'company': {'id': 86659347, 'name': 'ROC Kop van Noord Holland', 'logo': 'https://media.licdn.com/dms/image/C4E0BAQELom63yVT1Zw/company-logo_400_400/0/1657031616394?e=1700697600&v=beta&t=5SfqHbqefbAo6DbuFp5qeoM6_jx5vfywrsgQ2neujn0', 'url': 'https://www.linkedin.com/school/vonknh/', 'employees': {'start': 1001, 'end': 5000}}, 'date': {'start': {'month': 4, 'day': None, 'year': 2013}, 'end': {'month': 12, 'day': None, 'year': 2014}}, 'profile_positions': [{'location': 'Den Helder', 'date': {'start': {'month': 4, 'day': None, 'year': 2013}, 'end': {'month': 12, 'day': None, 'year': 2014}}, 'company': 'Vonk', 'description': 'Productie promofilm ROC Kop van Noord Holland\nOntwerp 4 jarig leertraject Sustainable Energy\nInstroombevordering meisjes in techniekopleidingen\nProjectmanagement duurzame energie voor basisscholen (uitgevoerd door MBO-leerlingen) \nOrganisatie deelname beurs Carrières aan Zee\nGeven van lessen duurzame energie\nCoördinatie bouw solarboat\nOpzetten van de opleiding Commercieel Technicus', 'title': 'Projectcoordinator Techniekcampus', 'employment_type': None}]}, {'company': {'id': 206960, 'name': 'Kenniscentrum Aequor', 'logo': 'https://media.licdn.com/dms/image/C510BAQGQj_h-pn7U7w/company-logo_400_400/0/1519906770045?e=1700697600&v=beta&t=Q7_GCkLxJTAK2DiQdDY9lbFfLRlBIvgG5IT7SVRA2Fc', 'url': 'https://www.linkedin.com/company/aequor/', 'employees': {'start': 51, 'end': 200}}, 'date': {'start': {'month': 3, 'day': None, 'year': 2011}, 'end': {'month': 3, 'day': None, 'year': 2013}}, 'profile_positions': [{'location': 'Ede', 'date': {'start': {'month': 3, 'day': None, 'year': 2011}, 'end': {'month': 3, 'day': None, 'year': 2013}}, 'company': 'Aequor', 'description': 'Ondersteunen en adviseren van leerbedrijven met het oog op verbetering van de kwaliteit van de beroepspraktijkvorming in het MBO-onderwijs. \nErkennen van leerbedrijven\nBevorderen van de samenwerking tussen onderwijs en bedrijfsleven\nZorgdragen voor een juiste matching  tussen aanbod BOL en BBL-studenten en vraag van het bedrijfsleven.\nCoachen van praktijkbegeleiders.\nBijhouden van het (deel)register van erkende leerbedrijven.\nOpstellen van jaarplannen.\nOpstellen en vastleggen van bezoekverslagen.', 'title': 'Bedrijfsadviseur', 'employment_type': None}]}, {'company': {'id': None, 'name': 'Kenniscentum Calibris', 'logo': None, 'url': None, 'employees': {'start': None, 'end': None}}, 'date': {'start': {'month': 4, 'day': None, 'year': 2010}, 'end': {'month': 12, 'day': None, 'year': 2010}}, 'profile_positions': [{'location': 'Bunnik', 'date': {'start': {'month': 4, 'day': None, 'year': 2010}, 'end': {'month': 12, 'day': None, 'year': 2010}}, 'company': 'Kenniscentum Calibris', 'description': ""Adviseren van bedrijven m.b.t. instroom-,  doorstroom en uitstroom van medewerkers in de zorgsector\nOnderhouden van een netwerk van scholen, bedrijven, UWV's, KvK's, en gemeenten, en het bevorderen van de samenwerking tussen deze partijen."", 'title': 'Adviseur Arbeidsmarktvraagstukken', 'employment_type': None}]}, {'company': {'id': None, 'name': 'Corus Coated Products', 'logo': None, 'url': None, 'employees': {'start': None, 'end': None}}, 'date': {'start': {'month': None, 'day': None, 'year': 2007}, 'end': {'month': None, 'day': None, 'year': 2010}}, 'profile_positions': [{'location': 'IJmuiden', 'date': {'start': {'month': None, 'day': None, 'year': 2007}, 'end': {'month': None, 'day': None, 'year': 2010}}, 'company': 'Corus Coated Products', 'description': 'Medewerkers adviseren over EVC, ontwikkelings- en scholingstrajecten\nOntwerpen van Logistiek opleidingen voor een productie-afdeling\nAansturen van een team van opledingsmedewerkers\nOntwikkelen, plannen en coordineren van werkplekopleidingen\nCoachen van studerende medewerkers\nPlanning van inwerktrainingen bij de opstart van een nieuwe productielijn', 'title': 'Opleidingscoordinator', 'employment_type': None}]}, {'company': {'id': None, 'name': 'Corus Training Centre', 'logo': None, 'url': None, 'employees': {'start': None, 'end': None}}, 'date': {'start': {'month': None, 'day': None, 'year': 2003}, 'end': {'month': 3, 'day': None, 'year': 2007}}, 'profile_positions': [{'location': 'IJmuiden', 'date': {'start': {'month': 6, 'day': None, 'year': 2003}, 'end': {'month': 3, 'day': None, 'year': 2007}}, 'company': 'Corus Training Centre', 'description': 'Projectleider voor de invoering van competentiegericht opleiden binnen een grote onderhoudsdienst.\nOntwikkelen van MBO opleidingen procestechiek, werktuigbouw en elektrotechniek.\nCoachen van studerende medewerkers.\nMedewerkers adviseren over opleidingsmogelijkheden\nDeelname aan beurzen en open dagen ter beordering van de instroom en promotie opleidingen.\nVerzorgen van excursies en presentaties voor Vmbo-scholen\nOpstellen van opleidingsbeleid en jaarplannen.\nAfnemen an proeven van bekwaamheid.', 'title': 'Opleidingsadviseur', 'employment_type': None}, {'location': 'IJmuiden', 'date': {'start': {'month': None, 'day': None, 'year': 2003}, 'end': {'month': None, 'day': None, 'year': 2007}}, 'company': 'Corus Training Centre', 'description': 'Planning en coordinatie van trainingen\nAdviseren over en verkopen van maatwerktrainingen\nGeven van trainingen\nLesgeven aan leerlingen, dyslectische en allochtone medewerkers', 'title': 'Account Manager Trainingen Arbo, Veiligheid en Milieu', 'employment_type': None}, {'location': 'IJmuiden', 'date': {'start': {'month': None, 'day': None, 'year': 2003}, 'end': {'month': None, 'day': None, 'year': 2007}}, 'company': 'Corus Training Centre', 'description': 'Verantwoordelijk  voor het Arbo-en milieuzorgsysteem binnen het opleidingscentrum van Corus\nZorgdragen voor naleving van wetgeving \nAansturen van een team van regeltaakhouders\nVersterken van Arbo- en milieubewustzijn van docenten en medewerkers\nBegeleiden van inerne audits\nSchrijven en beheren van handboeken', 'title': 'Arbo- en milieucoordinator', 'employment_type': None}]}, {'company': {'id': None, 'name': 'Hoogovens IJmuiden', 'logo': None, 'url': None, 'employees': {'start': None, 'end': None}}, 'date': {'start': {'month': 6, 'day': None, 'year': 1980}, 'end': {'month': 6, 'day': None, 'year': 2003}}, 'profile_positions': [{'location': 'IJmuden', 'date': {'start': {'month': 6, 'day': None, 'year': 1980}, 'end': {'month': 6, 'day': None, 'year': 2003}}, 'company': 'Hoogovens IJmuiden', 'description': 'Inkopen van goederen en diensten voor een onderhoudsdienst\nInhuren van technisch personeel\nVoorraadbeheer van reservedelen\nBegeleiden van grote onderhoudsprojecten\nTekenen en laten vervaardigen van constructiedelen\nLaten reviseren van machinedelen\nOpstellen van contracten met leveranciers\nVoeren van prijsonderhandelingen', 'title': 'Werkvoorbereider/planner/inkoper', 'employment_type': None}]}]","[{'date': {'start': {'month': 5, 'day': None, 'year': 2011}, 'end': {'month': None, 'day': None, 'year': None}}, 'role': 'Secretaris', 'company': {'id': None, 'name': 'VVE De Singel', 'logo': None, 'url': None}, 'cause': None, 'description': None}]","['Interim Management', 'Dutch', 'Coaching', 'Personal Development', 'Project Planning', 'English', 'German', 'Training', 'Teaching']",,,
