profile_id,first_name,last_name,sub_title,profile_picture,background_image,profile_type,entity_urn,object_urn,birth_date,summary,location,premium,influencer,treasury_media,languages,industry,education,patents,awards,certifications,organizations,projects,publications,courses,test_scores,position_groups,volunteer_experiences,skills,network_info,related_profiles,contact_info
timea-rk,Kisgyörgy,Tímea Réka,"💎   Supporting meaningful relations with positive thinking, emphaty & open communication",https://media.licdn.com/dms/image/C4D03AQEqFOSdS5vYTQ/profile-displayphoto-shrink_800_800/0/1660710851126?e=1697673600&v=beta&t=DszeNhpU2I4C_zA49jiZwe_Jh_ft4QdQevx_KfgDbH4,https://media.licdn.com/dms/image/C4D16AQFs_Bh9rd51uw/profile-displaybackgroundimage-shrink_350_1400/0/1660710399346?e=1697673600&v=beta&t=6AQXnMzysJdt3KALpd78IiCM2VQoFaVqnSPJUMw96VI,personal,ACoAADWAZVYB5DKB8hzTLqVVW6kr1FPXjsCS1QM,897606998,,"📍 Born and raised in one of the most beautiful capital cities in Europe: Budapest. I am a native Hungarian, fluent in English, German and at a beginner level of the French language.

Colleagues describe me as a warm hearted, intelligent, very calm and patient person who challenges the ""status quo” while always ready to be at service for others.

Since the age of  16, my kind  and outgoing personality has  made me perfectly suited  for jobs working with people. I was lucky enough to get the chance to work at the International Airport of Hungary, Budapest for more than  5 years. I was  struck by the atmosphere and the cultural diversity I found there. I spent my freetime working various part time jobs in there.  Following my studies, it  became clear  to me that I wanted to  travel and work abroad.  

💭 ''Follow your bliss and the universe will open doors where there were only walls. '' 

My favourite quote from Joseph Campbell that well summarizes my life in the past 10 years. 
My bliss: a career that opened the whole world to me. 

🛫 My journey began in Cyprus with a summer job during 2015. My life since then has been transformed; I became a professional entertainer at a 5 star beach resort. Working as a kids club representative allowed me to develop my creative mindset in the workplace and my problem solving abilities. This summer proved to me that I am meant to work with people in a fun and ever changing environment. 
I also began scuba diving during this time and instantly fell in love with it. Despite my demanding schedule, I took any opportunity to dive. It didn’t take me long to realize I wanted to combine my career with my passion. The decision to do so has been, by far, the best and most rewarding aspect of my life.

🌎 It took me to places that I could only dream of: from the Mediterranean to the Caribbean, with the highlight of my journey: 4 years in the Maldives. I have matured, built my resilience & independence. Only if I could prescribe traveling and working abroad to all! Such a transformative experience helped me become the best version of myself in all areas of my life.

🌈 I have a wide range of interest from human connections, psychology, compassion based interventions, behaviour & performace improvements, food & nutrition as well as creative work such as face & body painting.","{'country': 'Netherlands', 'short': 'Amsterdam, North Holland', 'city': 'Amsterdam', 'state': 'North Holland', 'default': 'Amsterdam, North Holland, Netherlands'}",False,False,[],"{'primary_locale': {'country': 'US', 'language': 'en'}, 'supported_locales': [{'country': 'US', 'language': 'en'}], 'profile_languages': [{'name': 'English', 'proficiency': 'FULL_PROFESSIONAL'}, {'name': 'French', 'proficiency': 'ELEMENTARY'}, {'name': 'German', 'proficiency': 'PROFESSIONAL_WORKING'}, {'name': 'Hungarian', 'proficiency': 'NATIVE_OR_BILINGUAL'}]}",Financial Services,"[{'date': {'start': {'month': None, 'day': None, 'year': 2010}, 'end': {'month': None, 'day': None, 'year': 2013}}, 'school': {'name': 'Eötvös Loránd University', 'logo': 'https://media.licdn.com/dms/image/D4D0BAQHxEjuJ-Jkxbg/company-logo_400_400/0/1687438432441?e=1700697600&v=beta&t=CpiuF4dG0Ds-FuS0jGn8C0OEVZW6NKVlWZaKwqZ25U4', 'url': 'https://www.linkedin.com/school/eotvos-lorand-university-/'}, 'degree_name': None, 'field_of_study': 'Early Childhood Education and Teaching'}]",[],[],"[{'name': 'Organizational Behaviour Management', 'date': {'start': {'month': 7, 'day': None, 'year': 2022}, 'end': {'month': None, 'day': None, 'year': None}}, 'authority': 'Vrije Universiteit Amsterdam (VU Amsterdam)', 'url': None, 'license_number': None, 'display_source': None, 'company': {'id': None, 'name': 'Vrije Universiteit Amsterdam (VU Amsterdam)', 'logo': 'https://media.licdn.com/dms/image/D4E0BAQGFG964atm3Ow/company-logo_400_400/0/1682661887840?e=1700697600&v=beta&t=bmk2N5LswEoQY_WJO0VySuxsWNNlfjU6XyPjkGaINeo', 'url': None}}, {'name': 'Elite Scuba Diving Instructor', 'date': {'start': {'month': 11, 'day': None, 'year': 2021}, 'end': {'month': None, 'day': None, 'year': None}}, 'authority': 'PADI', 'url': None, 'license_number': None, 'display_source': None, 'company': {'id': None, 'name': 'PADI', 'logo': 'https://media.licdn.com/dms/image/C4D0BAQGt15EDpU4Jhg/company-logo_400_400/0/1538160453888?e=1700697600&v=beta&t=y_MgSCsAjOv_swPndcn3hA6cgvXCMbqELUmJHHU7Czs', 'url': None}}, {'name': 'Professional Face & Body Painting', 'date': {'start': {'month': 3, 'day': None, 'year': 2015}, 'end': {'month': None, 'day': None, 'year': None}}, 'authority': 'Muriani Make Up', 'url': None, 'license_number': None, 'display_source': None, 'company': None}]",[],[],[],"[{'name': 'Femininity, Career Relations, Function of Men & Women', 'number': None}]",[],"[{'company': {'id': None, 'name': 'Transparent Solutions, LLC', 'logo': None, 'url': None, 'employees': {'start': None, 'end': None}}, 'date': {'start': {'month': 9, 'day': None, 'year': 2022}, 'end': {'month': None, 'day': None, 'year': None}}, 'profile_positions': [{'location': 'Amsterdam Area', 'date': {'start': {'month': 9, 'day': None, 'year': 2022}, 'end': {'month': None, 'day': None, 'year': None}}, 'company': 'Transparent Solutions, LLC', 'description': None, 'title': 'Financial Audit Support', 'employment_type': 'Full-time'}]}, {'company': {'id': 3733956, 'name': 'lti Maafushivaru, Maldives', 'logo': 'https://media.licdn.com/dms/image/C510BAQFnGLSCsCJuug/company-logo_400_400/0/1582174244693?e=1700697600&v=beta&t=7D28N9ZaJQz8xe7EGTFgQy93mfo0LUW15-v5N2q2XY0', 'url': 'https://www.linkedin.com/company/lti-maafushivaru/', 'employees': {'start': 201, 'end': 500}}, 'date': {'start': {'month': 8, 'day': None, 'year': 2020}, 'end': {'month': 2, 'day': None, 'year': 2022}}, 'profile_positions': [{'location': 'Maldives', 'date': {'start': {'month': 8, 'day': None, 'year': 2020}, 'end': {'month': 2, 'day': None, 'year': 2022}}, 'company': 'lti Maafushivaru, Maldives', 'description': '🏝 A demanding but very rewarding work that reaches out further than ""just"" recreational scuba diving. A life in a luxurious, multi-cultural environment, where exceeding great expectations of high-profile individuals was always the priority.\n\nI am proud of transforming clients\' mindsets, helping achieve their goals by personalised training, honest care & compassion with:\n\n• Enthusiasm and ability to deal with stress in a positive way.\n• High level of ethical, safety & hospitality standards.\n• Strong communication skills including presentations.', 'title': 'Dive Base Leader - Manager', 'employment_type': 'Full-time'}]}, {'company': {'id': 76060093, 'name': 'Prodivers', 'logo': None, 'url': 'https://www.linkedin.com/company/prodivers/', 'employees': {'start': None, 'end': None}}, 'date': {'start': {'month': 5, 'day': None, 'year': 2018}, 'end': {'month': 3, 'day': None, 'year': 2020}}, 'profile_positions': [{'location': 'Maldives', 'date': {'start': {'month': 5, 'day': None, 'year': 2018}, 'end': {'month': 3, 'day': None, 'year': 2020}}, 'company': 'Prodivers', 'description': None, 'title': 'Scuba Diving Instructor & Office Assistant', 'employment_type': 'Full-time'}]}, {'company': {'id': None, 'name': 'Omega Divers', 'logo': None, 'url': None, 'employees': {'start': None, 'end': None}}, 'date': {'start': {'month': 4, 'day': None, 'year': 2017}, 'end': {'month': 11, 'day': None, 'year': 2017}}, 'profile_positions': [{'location': 'Crete, Greece', 'date': {'start': {'month': 4, 'day': None, 'year': 2017}, 'end': {'month': 11, 'day': None, 'year': 2017}}, 'company': 'Omega Divers', 'description': None, 'title': 'Scuba Diving Instructor & Snorkel Guide', 'employment_type': 'Full-time'}]}, {'company': {'id': None, 'name': 'Coral Point Diving', 'logo': None, 'url': None, 'employees': {'start': None, 'end': None}}, 'date': {'start': {'month': 11, 'day': None, 'year': 2016}, 'end': {'month': 4, 'day': None, 'year': 2017}}, 'profile_positions': [{'location': 'Dominican Republic', 'date': {'start': {'month': 11, 'day': None, 'year': 2016}, 'end': {'month': 4, 'day': None, 'year': 2017}}, 'company': 'Coral Point Diving', 'description': None, 'title': 'Scuba Diving Instructor ', 'employment_type': 'Internship'}]}, {'company': {'id': None, 'name': 'Omega Divers', 'logo': None, 'url': None, 'employees': {'start': None, 'end': None}}, 'date': {'start': {'month': 5, 'day': None, 'year': 2016}, 'end': {'month': 11, 'day': None, 'year': 2016}}, 'profile_positions': [{'location': 'Crete, Greece', 'date': {'start': {'month': 5, 'day': None, 'year': 2016}, 'end': {'month': 11, 'day': None, 'year': 2016}}, 'company': 'Omega Divers', 'description': None, 'title': 'Sales Professional & Divemaster', 'employment_type': 'Full-time'}]}, {'company': {'id': 4997141, 'name': 'Golden Coast Beach Hotel', 'logo': 'https://media.licdn.com/dms/image/C510BAQHKZRdGzyaQNA/company-logo_400_400/0/1519890310310?e=1700697600&v=beta&t=SaZbNw_OARvdKWrEILBw4x52q_nCHSmPx181U6GNgEI', 'url': 'https://www.linkedin.com/company/golden-coast-beach-hotel/', 'employees': {'start': 51, 'end': 200}}, 'date': {'start': {'month': 4, 'day': None, 'year': 2015}, 'end': {'month': 11, 'day': None, 'year': 2015}}, 'profile_positions': [{'location': 'Cyprus', 'date': {'start': {'month': 4, 'day': None, 'year': 2015}, 'end': {'month': 11, 'day': None, 'year': 2015}}, 'company': 'Golden Coast Beach Hotel', 'description': None, 'title': 'Entertainer & Kids Club Representative', 'employment_type': 'Full-time'}]}, {'company': {'id': 18698, 'name': 'Menzies Aviation', 'logo': 'https://media.licdn.com/dms/image/C4D0BAQFCO4f2LXVZow/company-logo_400_400/0/1611227091312?e=1700697600&v=beta&t=EkWr_JlTIptaHHX0kpbAn7PSZLuwPxEZdGPy52xKMQ8', 'url': 'https://www.linkedin.com/company/menzies-aviation/', 'employees': {'start': 10001, 'end': None}}, 'date': {'start': {'month': None, 'day': None, 'year': 2013}, 'end': {'month': 3, 'day': None, 'year': 2015}}, 'profile_positions': [{'location': 'Budapest International Airport, Hungary', 'date': {'start': {'month': None, 'day': None, 'year': 2013}, 'end': {'month': 3, 'day': None, 'year': 2015}}, 'company': 'Menzies Aviation', 'description': None, 'title': 'Business Lounge Agent', 'employment_type': 'Part-time'}]}, {'company': {'id': 55346, 'name': 'Gebr. Heinemann', 'logo': 'https://media.licdn.com/dms/image/C4D0BAQHzSjzooXtY8g/company-logo_400_400/0/1623658356517?e=1700697600&v=beta&t=0eiQ27DgNrNvk03GSWRq1-59UfuoI8GPxlEYYj0ecww', 'url': 'https://www.linkedin.com/company/gebr--heinemann/', 'employees': {'start': 5001, 'end': 10000}}, 'date': {'start': {'month': None, 'day': None, 'year': 2012}, 'end': {'month': None, 'day': None, 'year': 2014}}, 'profile_positions': [{'location': 'Budapest International Airport, Hungary', 'date': {'start': {'month': None, 'day': None, 'year': 2012}, 'end': {'month': None, 'day': None, 'year': 2014}}, 'company': 'Gebr. Heinemann', 'description': None, 'title': 'Beauty Consultant & Sales Representative', 'employment_type': 'Full-time'}]}]",[],"['Hostessing', 'Flight Safety', 'Food Safety', 'Product Marketing', 'Customer-focused Service', 'Cashiering', 'Expert Advisor', 'Childcare', 'Hospitality', 'Entertainment', 'Guest Services', 'Teamwork', 'Advertising Sales', 'Customer Satisfaction', 'Event Planning', 'Organization Skills', 'Employee Training', 'Sales', 'Visual Communication', 'Administrative Assistance']",,,
