profile_id,first_name,last_name,sub_title,profile_picture,background_image,profile_type,entity_urn,object_urn,birth_date,summary,location,premium,influencer,treasury_media,languages,industry,education,patents,awards,certifications,organizations,projects,publications,courses,test_scores,position_groups,volunteer_experiences,skills,network_info,related_profiles,contact_info
informatie-en-advies-hoofddorp-b7416675,Informatie en Advies,Hoofddorp,Administration/Real Estate/Import,https://media.licdn.com/dms/image/C4E03AQFAX-pIOa0gKw/profile-displayphoto-shrink_800_800/0/1516542630821?e=1697673600&v=beta&t=tynR7IFcspKawGEq_e-ctFR97Rq8pAznmKc5d9Qg3xc,,personal,ACoAAA_c8QgBx_I3ZD8eMD0_GtskWaeEtYLOX9g,266137864,,"Welcome to Informatie en Advies Hoofddorp

Our strength is knowledge and experience.

Finding daily administrative and brokerage firms in the Netherlands is no longer difficult. Finding the right and good administrative and broker costs more effort. We often encounter customers from the perspective of time and experience to understand the Netherlands public services.

Welcome to the website of Informatie en Advies Hoofddorp.

Thanks to cooperate of our analysts of sales / rental property, financial expert on individuals and businesses, administrative and accounting professionals and our consultants as well, we are able to offer you our services: creating and running an own business in the Netherlands, rent / buying real estate, mortgage conclusion and / or for information on other banking products and support in the conduct of their daily administration.","{'country': 'Netherlands', 'short': 'Amsterdam, North Holland', 'city': 'Amsterdam', 'state': 'North Holland', 'default': 'Amsterdam, North Holland, Netherlands'}",False,False,"[{'url': None, 'title': 'Informatie en Advies Hoofddorp', 'description': 'Facebook: Informatie en Advies Hoofddorp', 'image': 'https://media.licdn.com/dms/image/C562DAQG-MvzcdsoDjA/profile-treasury-image-shrink_8192_8192/0/1601733693958?e=1692950400&v=beta&t=fgf5gtEiDZYvaFD0itnChFXw-bdp6pqDM6oI9-d3gmk'}]","{'primary_locale': {'country': 'US', 'language': 'en'}, 'supported_locales': [{'country': 'US', 'language': 'en'}], 'profile_languages': []}",Commercial Real Estate,[],[],[],[],[],[],[],[],[],"[{'company': {'id': None, 'name': 'Informatie en Advies Hoofddorp', 'logo': None, 'url': None, 'employees': {'start': None, 'end': None}}, 'date': {'start': {'month': 10, 'day': None, 'year': 2010}, 'end': {'month': None, 'day': None, 'year': None}}, 'profile_positions': [{'location': 'Hoofddorp', 'date': {'start': {'month': 10, 'day': None, 'year': 2010}, 'end': {'month': None, 'day': None, 'year': None}}, 'company': 'Informatie en Advies Hoofddorp', 'description': None, 'title': 'Informatie en Advies Hoofddorp', 'employment_type': None}]}]",[],[],,,
