profile_id,first_name,last_name,sub_title,profile_picture,background_image,profile_type,entity_urn,object_urn,birth_date,summary,location,premium,influencer,treasury_media,languages,industry,education,patents,awards,certifications,organizations,projects,publications,courses,test_scores,position_groups,volunteer_experiences,skills,network_info,related_profiles,contact_info
nico-evequoz,Nicolas,Evequoz,Sourcing Manager at Boehringer Ingelheim,,,personal,ACoAAAUUKqMBnWh6UeQ9d4q_WDiOwahm_MJYQBk,85207715,,"An energetic, positive person, I consider myself a natural entrepreneur, curious and fearless to changes. I am an extroverted negotiator with an analytical mind eager for excellence in processes. Born and raised in a
big family in a quiet river city in Argentina, I value respect, commitment, responsibility, and human equity. I am passionate about what I do, and find myself at the perfect career timing to exponentially learn and grow
in many directions.","{'country': 'Netherlands', 'short': 'Amsterdam, North Holland', 'city': 'Amsterdam', 'state': 'North Holland', 'default': 'Amsterdam, North Holland, Netherlands'}",False,False,[],"{'primary_locale': {'country': 'ES', 'language': 'es'}, 'supported_locales': [{'country': 'ES', 'language': 'es'}, {'country': 'US', 'language': 'en'}], 'profile_languages': [{'name': 'Español', 'proficiency': 'NATIVE_OR_BILINGUAL'}, {'name': 'Ingles', 'proficiency': 'PROFESSIONAL_WORKING'}, {'name': 'Portugues', 'proficiency': 'PROFESSIONAL_WORKING'}]}",Pharmaceuticals,"[{'date': {'start': {'month': None, 'day': None, 'year': 2014}, 'end': {'month': None, 'day': None, 'year': 2014}}, 'school': {'name': 'Aden Business School', 'logo': 'https://media.licdn.com/dms/image/D4D0BAQFud3fNISzh2g/company-logo_400_400/0/1683907376103?e=1700697600&v=beta&t=MOm9MrDhlYueHGtgs8nHCOc9_m9Ap7OP83iAxWwE4ag', 'url': 'https://www.linkedin.com/school/adenbs/'}, 'degree_name': 'Especialización en Compras y Abastecimiento', 'field_of_study': None}, {'date': {'start': {'month': None, 'day': None, 'year': 2016}, 'end': {'month': None, 'day': None, 'year': 2017}}, 'school': {'name': 'ENEB - Escuela de Negocios Europea de Barcelona', 'logo': 'https://media.licdn.com/dms/image/C4E0BAQHo72GsHIDlnQ/company-logo_400_400/0/1624370271996?e=1700697600&v=beta&t=7KX9n0e4l4DYntc2nvD28rvRdBHVoRsCgrzUcybBsYY', 'url': 'https://www.linkedin.com/school/eneb-escuela-de-negocios-europea-de-barcelona/'}, 'degree_name': 'POSGRADO EN COACHING, PNL Y LIDERAZGO DE EQUIPOS', 'field_of_study': None}, {'date': {'start': {'month': None, 'day': None, 'year': 2014}, 'end': {'month': None, 'day': None, 'year': 2014}}, 'school': {'name': 'Instituto VerdeAmarello', 'logo': None, 'url': None}, 'degree_name': 'Curso portugues', 'field_of_study': None}, {'date': {'start': {'month': None, 'day': None, 'year': 2002}, 'end': {'month': None, 'day': None, 'year': 2011}}, 'school': {'name': 'University of Buenos Aires', 'logo': 'https://media.licdn.com/dms/image/C4E0BAQF-QztqGXBokQ/company-logo_400_400/0/1519861386584?e=1700697600&v=beta&t=wdS2y2Kqs4G-P_WRZNCkZazaRBcTtLLpeKwfm3Romkk', 'url': 'https://www.linkedin.com/school/universidad-de-buenos-aires/'}, 'degree_name': 'Licenciatura en Administracion de Empresas', 'field_of_study': 'Ingles, Portugues, SAP, SAP BW, Plat. Ariba -Isis,Buyer-, Office (Excel, PowerPoint, Word, Acces),'}]",[],[],"[{'name': 'Aprende copywriting para comercio electrónico', 'date': {'start': {'month': 7, 'day': None, 'year': 2020}, 'end': {'month': None, 'day': None, 'year': None}}, 'authority': 'LinkedIn', 'url': 'https://www.linkedin.com/learning/certificates/9f23b37388166d9ee6a238f2f0e07d0d45fc068e22260c3052c4deb2ccd3eac9?trk=backfilled_certificate', 'license_number': None, 'display_source': 'linkedin.com', 'company': {'id': None, 'name': 'LinkedIn', 'logo': 'https://media.licdn.com/dms/image/C560BAQHaVYd13rRz3A/company-logo_400_400/0/1638831589865?e=1700697600&v=beta&t=e1FsZytsym0fLF5Jt7PFnH40bqJRRzdgJ5LH7Y3pJJM', 'url': None}}, {'name': 'Conviértete en experto en marketing digital', 'date': {'start': {'month': 7, 'day': None, 'year': 2020}, 'end': {'month': None, 'day': None, 'year': None}}, 'authority': 'LinkedIn', 'url': 'https://www.linkedin.com/learning/certificates/18903652efa13b6baeae718105cea1c7fd23688718758eaca7bf14dfb45ec91b?trk=backfilled_certificate', 'license_number': None, 'display_source': 'linkedin.com', 'company': {'id': None, 'name': 'LinkedIn', 'logo': 'https://media.licdn.com/dms/image/C560BAQHaVYd13rRz3A/company-logo_400_400/0/1638831589865?e=1700697600&v=beta&t=e1FsZytsym0fLF5Jt7PFnH40bqJRRzdgJ5LH7Y3pJJM', 'url': None}}, {'name': 'Conviértete en responsable financiero', 'date': {'start': {'month': 7, 'day': None, 'year': 2020}, 'end': {'month': None, 'day': None, 'year': None}}, 'authority': 'LinkedIn', 'url': 'https://www.linkedin.com/learning/certificates/5632efe8af5278d3681149c2e59f31f39f12a65e6a517ffc3e25a301908e0785?trk=backfilled_certificate', 'license_number': None, 'display_source': 'linkedin.com', 'company': {'id': None, 'name': 'LinkedIn', 'logo': 'https://media.licdn.com/dms/image/C560BAQHaVYd13rRz3A/company-logo_400_400/0/1638831589865?e=1700697600&v=beta&t=e1FsZytsym0fLF5Jt7PFnH40bqJRRzdgJ5LH7Y3pJJM', 'url': None}}, {'name': 'Cómo construir tu propio conjunto de tecnologías de marketing', 'date': {'start': {'month': 7, 'day': None, 'year': 2020}, 'end': {'month': None, 'day': None, 'year': None}}, 'authority': 'LinkedIn', 'url': 'https://www.linkedin.com/learning/certificates/f27dc2a2910e093eb25872b72e236589b4959fdcbacde8c5b3c79fa07d988901?trk=backfilled_certificate', 'license_number': None, 'display_source': 'linkedin.com', 'company': {'id': None, 'name': 'LinkedIn', 'logo': 'https://media.licdn.com/dms/image/C560BAQHaVYd13rRz3A/company-logo_400_400/0/1638831589865?e=1700697600&v=beta&t=e1FsZytsym0fLF5Jt7PFnH40bqJRRzdgJ5LH7Y3pJJM', 'url': None}}, {'name': 'Excel 2016 práctico: Plan de viabilidad económico-financiero', 'date': {'start': {'month': 7, 'day': None, 'year': 2020}, 'end': {'month': None, 'day': None, 'year': None}}, 'authority': 'LinkedIn', 'url': 'https://www.linkedin.com/learning/certificates/557325c0ef4c75bb651fd817d24824f4aabd09cb44b8a0c75628ec911bc39ace?trk=backfilled_certificate', 'license_number': None, 'display_source': 'linkedin.com', 'company': {'id': None, 'name': 'LinkedIn', 'logo': 'https://media.licdn.com/dms/image/C560BAQHaVYd13rRz3A/company-logo_400_400/0/1638831589865?e=1700697600&v=beta&t=e1FsZytsym0fLF5Jt7PFnH40bqJRRzdgJ5LH7Y3pJJM', 'url': None}}, {'name': 'Fundamentos de la narrativa o storytelling', 'date': {'start': {'month': 7, 'day': None, 'year': 2020}, 'end': {'month': None, 'day': None, 'year': None}}, 'authority': 'LinkedIn', 'url': 'https://www.linkedin.com/learning/certificates/47407643cd8bf872c391aee4ab3e52a4a0919447a52a8835588be443908020cc?trk=backfilled_certificate', 'license_number': None, 'display_source': 'linkedin.com', 'company': {'id': None, 'name': 'LinkedIn', 'logo': 'https://media.licdn.com/dms/image/C560BAQHaVYd13rRz3A/company-logo_400_400/0/1638831589865?e=1700697600&v=beta&t=e1FsZytsym0fLF5Jt7PFnH40bqJRRzdgJ5LH7Y3pJJM', 'url': None}}, {'name': 'Fundamentos de las finanzas: Análisis de informes financieros', 'date': {'start': {'month': 7, 'day': None, 'year': 2020}, 'end': {'month': None, 'day': None, 'year': None}}, 'authority': 'LinkedIn', 'url': 'https://www.linkedin.com/learning/certificates/fdbc52e7b9b70d7b442e2605d1e9c30c5dd0d610c212b52aed4fcf790043f56b?trk=backfilled_certificate', 'license_number': None, 'display_source': 'linkedin.com', 'company': {'id': None, 'name': 'LinkedIn', 'logo': 'https://media.licdn.com/dms/image/C560BAQHaVYd13rRz3A/company-logo_400_400/0/1638831589865?e=1700697600&v=beta&t=e1FsZytsym0fLF5Jt7PFnH40bqJRRzdgJ5LH7Y3pJJM', 'url': None}}, {'name': 'Fundamentos de las finanzas: Comprensión de informes financieros', 'date': {'start': {'month': 7, 'day': None, 'year': 2020}, 'end': {'month': None, 'day': None, 'year': None}}, 'authority': 'LinkedIn', 'url': 'https://www.linkedin.com/learning/certificates/3d39c23b66b7e9212fcebf33808fc218c2a54639af3fa080890c70bd1363afde?trk=backfilled_certificate', 'license_number': None, 'display_source': 'linkedin.com', 'company': {'id': None, 'name': 'LinkedIn', 'logo': 'https://media.licdn.com/dms/image/C560BAQHaVYd13rRz3A/company-logo_400_400/0/1638831589865?e=1700697600&v=beta&t=e1FsZytsym0fLF5Jt7PFnH40bqJRRzdgJ5LH7Y3pJJM', 'url': None}}, {'name': 'Fundamentos de las finanzas: Control y reducción de costes', 'date': {'start': {'month': 7, 'day': None, 'year': 2020}, 'end': {'month': None, 'day': None, 'year': None}}, 'authority': 'LinkedIn', 'url': 'https://www.linkedin.com/learning/certificates/8f3a0576bac8a6610c476b2904db94655a753a8219e62ffb0214bffc85073536?trk=backfilled_certificate', 'license_number': None, 'display_source': 'linkedin.com', 'company': {'id': None, 'name': 'LinkedIn', 'logo': 'https://media.licdn.com/dms/image/C560BAQHaVYd13rRz3A/company-logo_400_400/0/1638831589865?e=1700697600&v=beta&t=e1FsZytsym0fLF5Jt7PFnH40bqJRRzdgJ5LH7Y3pJJM', 'url': None}}, {'name': 'Fundamentos de las finanzas: Decisiones de inversión', 'date': {'start': {'month': 7, 'day': None, 'year': 2020}, 'end': {'month': None, 'day': None, 'year': None}}, 'authority': 'LinkedIn', 'url': 'https://www.linkedin.com/learning/certificates/64015424d8d023c5dd233739d1192c8a54e65c137b523f467055ba4e667489fc?trk=backfilled_certificate', 'license_number': None, 'display_source': 'linkedin.com', 'company': {'id': None, 'name': 'LinkedIn', 'logo': 'https://media.licdn.com/dms/image/C560BAQHaVYd13rRz3A/company-logo_400_400/0/1638831589865?e=1700697600&v=beta&t=e1FsZytsym0fLF5Jt7PFnH40bqJRRzdgJ5LH7Y3pJJM', 'url': None}}, {'name': 'Marketing online: Creación de un calendario editorial', 'date': {'start': {'month': 7, 'day': None, 'year': 2020}, 'end': {'month': None, 'day': None, 'year': None}}, 'authority': 'LinkedIn', 'url': 'https://www.linkedin.com/learning/certificates/650ea0e6f290a3c87356cd27cd4a3cdd8527117e6c2ca578f8dde5eedcea93fe?trk=backfilled_certificate', 'license_number': None, 'display_source': 'linkedin.com', 'company': {'id': None, 'name': 'LinkedIn', 'logo': 'https://media.licdn.com/dms/image/C560BAQHaVYd13rRz3A/company-logo_400_400/0/1638831589865?e=1700697600&v=beta&t=e1FsZytsym0fLF5Jt7PFnH40bqJRRzdgJ5LH7Y3pJJM', 'url': None}}, {'name': 'Marketing práctico: Consejos para trabajar con datos', 'date': {'start': {'month': 7, 'day': None, 'year': 2020}, 'end': {'month': None, 'day': None, 'year': None}}, 'authority': 'LinkedIn', 'url': 'https://www.linkedin.com/learning/certificates/15d1c91f343e90d951c4eb077afe4fbf48b92a81db27d39001bb3cbf61fcaa32?trk=backfilled_certificate', 'license_number': None, 'display_source': 'linkedin.com', 'company': {'id': None, 'name': 'LinkedIn', 'logo': 'https://media.licdn.com/dms/image/C560BAQHaVYd13rRz3A/company-logo_400_400/0/1638831589865?e=1700697600&v=beta&t=e1FsZytsym0fLF5Jt7PFnH40bqJRRzdgJ5LH7Y3pJJM', 'url': None}}, {'name': 'Agile Marketing', 'date': {'start': {'month': 6, 'day': None, 'year': 2020}, 'end': {'month': None, 'day': None, 'year': None}}, 'authority': 'LinkedIn', 'url': 'https://www.linkedin.com/learning/certificates/dec8b07596a60996d1421664328321437ec9c009a22cf6ddb59a8845ee3f356b?trk=backfilled_certificate', 'license_number': None, 'display_source': 'linkedin.com', 'company': {'id': None, 'name': 'LinkedIn', 'logo': 'https://media.licdn.com/dms/image/C560BAQHaVYd13rRz3A/company-logo_400_400/0/1638831589865?e=1700697600&v=beta&t=e1FsZytsym0fLF5Jt7PFnH40bqJRRzdgJ5LH7Y3pJJM', 'url': None}}, {'name': 'Aprende Scratch: Programación para niños', 'date': {'start': {'month': 6, 'day': None, 'year': 2020}, 'end': {'month': None, 'day': None, 'year': None}}, 'authority': 'LinkedIn', 'url': 'https://www.linkedin.com/learning/certificates/8d37e9c98304d25b0d172225c21aee7bc3d2d9fe281412513243d58f3ce6de83?trk=backfilled_certificate', 'license_number': None, 'display_source': 'linkedin.com', 'company': {'id': None, 'name': 'LinkedIn', 'logo': 'https://media.licdn.com/dms/image/C560BAQHaVYd13rRz3A/company-logo_400_400/0/1638831589865?e=1700697600&v=beta&t=e1FsZytsym0fLF5Jt7PFnH40bqJRRzdgJ5LH7Y3pJJM', 'url': None}}, {'name': 'Auditorías SEO', 'date': {'start': {'month': 6, 'day': None, 'year': 2020}, 'end': {'month': None, 'day': None, 'year': None}}, 'authority': 'LinkedIn', 'url': 'https://www.linkedin.com/learning/certificates/16a041595607828ae34531ccb3b7d25febf667b2888989720a5b785b78f4fe06?trk=backfilled_certificate', 'license_number': None, 'display_source': 'linkedin.com', 'company': {'id': None, 'name': 'LinkedIn', 'logo': 'https://media.licdn.com/dms/image/C560BAQHaVYd13rRz3A/company-logo_400_400/0/1638831589865?e=1700697600&v=beta&t=e1FsZytsym0fLF5Jt7PFnH40bqJRRzdgJ5LH7Y3pJJM', 'url': None}}, {'name': 'Big data: Escucha activa', 'date': {'start': {'month': 6, 'day': None, 'year': 2020}, 'end': {'month': None, 'day': None, 'year': None}}, 'authority': 'LinkedIn', 'url': 'https://www.linkedin.com/learning/certificates/63441f2d12f57adc1c2dd98e87590d69dca875a5b2f185ba122590e8f44254d4?trk=backfilled_certificate', 'license_number': None, 'display_source': 'linkedin.com', 'company': {'id': None, 'name': 'LinkedIn', 'logo': 'https://media.licdn.com/dms/image/C560BAQHaVYd13rRz3A/company-logo_400_400/0/1638831589865?e=1700697600&v=beta&t=e1FsZytsym0fLF5Jt7PFnH40bqJRRzdgJ5LH7Y3pJJM', 'url': None}}, {'name': 'Finanzas para directivos no financieros', 'date': {'start': {'month': 6, 'day': None, 'year': 2020}, 'end': {'month': None, 'day': None, 'year': None}}, 'authority': 'LinkedIn', 'url': 'https://www.linkedin.com/learning/certificates/e3389c5934b2901e1497d444a14be0e73b461b76d758bcbdd3e4d89fcbd075e6?trk=backfilled_certificate', 'license_number': None, 'display_source': 'linkedin.com', 'company': {'id': None, 'name': 'LinkedIn', 'logo': 'https://media.licdn.com/dms/image/C560BAQHaVYd13rRz3A/company-logo_400_400/0/1638831589865?e=1700697600&v=beta&t=e1FsZytsym0fLF5Jt7PFnH40bqJRRzdgJ5LH7Y3pJJM', 'url': None}}, {'name': 'Foundations of The Fourth Industrial Revolution (Industry 4.0)', 'date': {'start': {'month': 6, 'day': None, 'year': 2020}, 'end': {'month': None, 'day': None, 'year': None}}, 'authority': 'LinkedIn', 'url': 'https://www.linkedin.com/learning/certificates/361fd6d5640b434c9aaf3e9e5a0eb7fe8301f9a50534e1e3e7507d3a8d307506?trk=backfilled_certificate', 'license_number': None, 'display_source': 'linkedin.com', 'company': {'id': None, 'name': 'LinkedIn', 'logo': 'https://media.licdn.com/dms/image/C560BAQHaVYd13rRz3A/company-logo_400_400/0/1638831589865?e=1700697600&v=beta&t=e1FsZytsym0fLF5Jt7PFnH40bqJRRzdgJ5LH7Y3pJJM', 'url': None}}, {'name': 'Fundamentos del marketing online: Content marketing', 'date': {'start': {'month': 6, 'day': None, 'year': 2020}, 'end': {'month': None, 'day': None, 'year': None}}, 'authority': 'LinkedIn', 'url': 'https://www.linkedin.com/learning/certificates/e9ba7cc9efba0384dc84c07cf4fba9158e725effcdc4552b52d95b79457a8571?trk=backfilled_certificate', 'license_number': None, 'display_source': 'linkedin.com', 'company': {'id': None, 'name': 'LinkedIn', 'logo': 'https://media.licdn.com/dms/image/C560BAQHaVYd13rRz3A/company-logo_400_400/0/1638831589865?e=1700697600&v=beta&t=e1FsZytsym0fLF5Jt7PFnH40bqJRRzdgJ5LH7Y3pJJM', 'url': None}}, {'name': 'Fundamentos del marketing online: Email marketing', 'date': {'start': {'month': 6, 'day': None, 'year': 2020}, 'end': {'month': None, 'day': None, 'year': None}}, 'authority': 'LinkedIn', 'url': 'https://www.linkedin.com/learning/certificates/aaa5e216d3e033b7423b423f23a1c488cee4b754d8d1c2d65e254a37fa6ebb39?trk=backfilled_certificate', 'license_number': None, 'display_source': 'linkedin.com', 'company': {'id': None, 'name': 'LinkedIn', 'logo': 'https://media.licdn.com/dms/image/C560BAQHaVYd13rRz3A/company-logo_400_400/0/1638831589865?e=1700697600&v=beta&t=e1FsZytsym0fLF5Jt7PFnH40bqJRRzdgJ5LH7Y3pJJM', 'url': None}}]",[],[],[],[],[],"[{'company': {'id': 3235, 'name': 'Boehringer Ingelheim', 'logo': 'https://media.licdn.com/dms/image/C4D0BAQF-BkJ_L17ZSw/company-logo_400_400/0/1555601492336?e=1700697600&v=beta&t=uh5jISZ7vrveg9GTUTEHUj1FCZGAjYRZWsyNmLfpaq0', 'url': 'https://www.linkedin.com/company/boehringer-ingelheim/', 'employees': {'start': 10001, 'end': None}}, 'date': {'start': {'month': 12, 'day': None, 'year': 2020}, 'end': {'month': None, 'day': None, 'year': None}}, 'profile_positions': [{'location': 'Amsterdam, North Holland, Netherlands', 'date': {'start': {'month': 4, 'day': None, 'year': 2022}, 'end': {'month': None, 'day': None, 'year': None}}, 'company': 'Boehringer Ingelheim', 'description': None, 'title': 'SM/Acting Head of Sourcing Indirect Spend MIDI', 'employment_type': 'Full-time'}, {'location': 'Amsterdam, North Holland, Netherlands.', 'date': {'start': {'month': 12, 'day': None, 'year': 2020}, 'end': {'month': 7, 'day': None, 'year': 2022}}, 'company': 'Boehringer Ingelheim', 'description': 'Sourcing Manager Netherlands\n\nMain cross divisional responsibilities\n- Category Management\n- Contract Management\n- Key sourcing contact point\n- Operations', 'title': 'Sourcing Manager Netherlands', 'employment_type': 'Full-time'}]}, {'company': {'id': None, 'name': 'Con Sabor Latino / eMobilityMood / EQZ Business Solutions', 'logo': None, 'url': None, 'employees': {'start': None, 'end': None}}, 'date': {'start': {'month': 2, 'day': None, 'year': 2019}, 'end': {'month': 12, 'day': None, 'year': 2020}}, 'profile_positions': [{'location': 'Argentina', 'date': {'start': {'month': 2, 'day': None, 'year': 2019}, 'end': {'month': 12, 'day': None, 'year': 2020}}, 'company': 'Con Sabor Latino / eMobilityMood / EQZ Business Solutions', 'description': 'Entrepreneur of initiatives with an innovative and sustainable approach. \n\nWith Sabor Latino: online store to bring Latino culture to the world, through food products.\n\nEQZ Business Solutions: Procurement Consulting and Digital MKT through Freelancer.com and Prosapient.', 'title': 'Emprendedor', 'employment_type': None}]}, {'company': {'id': 1406, 'name': 'Novartis', 'logo': 'https://media.licdn.com/dms/image/D4E0BAQFnAMTTBfrmdw/company-logo_400_400/0/1688116195018?e=1700697600&v=beta&t=CDwluwWIIBxhnVLoRUv63gYqpkWyE9amd4L9_Q5IV28', 'url': 'https://www.linkedin.com/company/novartis/', 'employees': {'start': 10001, 'end': None}}, 'date': {'start': {'month': 5, 'day': None, 'year': 2015}, 'end': {'month': 12, 'day': None, 'year': 2020}}, 'profile_positions': [{'location': 'Argentina', 'date': {'start': {'month': 2, 'day': None, 'year': 2016}, 'end': {'month': 12, 'day': None, 'year': 2020}}, 'company': 'Novartis', 'description': '- Modeled and lead the country procurement team following a global business transformation.\n- Joined the country cross-functional leadership team as main procurement contact.\n- Supported key initial procurement processes for the new country strategy towards innovation\nand digital transformation.\n- Won the Annual Excellence Award for a Change Cultural Project (Ponete la 10) participation', 'title': 'Category Business Partner South Cone', 'employment_type': None}, {'location': 'CABA', 'date': {'start': {'month': 11, 'day': None, 'year': 2017}, 'end': {'month': 4, 'day': None, 'year': 2018}}, 'company': 'Novartis', 'description': '- Implemented global, regional, and country projects across categories & functions, supporting stakeholder alignment and customer satisfaction.\n- Actively contributed to the identification of business critical opportunities for process improvement and cost savings.\n- Won Annual Excellence Award for leading the first company innovation festival', 'title': 'Procurement Head Argentina', 'employment_type': None}, {'location': 'Nuñez, Ciudad Autónoma de Buenos Aires', 'date': {'start': {'month': 5, 'day': None, 'year': 2015}, 'end': {'month': 12, 'day': None, 'year': 2016}}, 'company': 'Novartis', 'description': '- Implemented global, regional, and country projects across categories & functions, supporting stakeholder alignment and customer satisfaction.\n- Actively contributed to the identification of business critical opportunities for process improvement and cost savings.\n- Won Annual Excellence Award for leading the first company innovation festival Excellence Award - Pharma 2018. Innovation Week project.', 'title': 'Procurement Category Manager', 'employment_type': None}]}, {'company': {'id': None, 'name': 'Arcos Dorados', 'logo': None, 'url': None, 'employees': {'start': None, 'end': None}}, 'date': {'start': {'month': 9, 'day': None, 'year': 2013}, 'end': {'month': 4, 'day': None, 'year': 2015}}, 'profile_positions': [{'location': 'Argentina', 'date': {'start': {'month': 9, 'day': None, 'year': 2013}, 'end': {'month': 4, 'day': None, 'year': 2015}}, 'company': 'Arcos Dorados', 'description': '- Supported the creation of the indirect area.\n- Lead binational team of two associates.\n- Managed a BTO contract -Aquanima- on key categories over Latin America.', 'title': 'Indirect Procurement Corp Manager', 'employment_type': None}]}, {'company': {'id': 1248, 'name': 'Unilever', 'logo': 'https://media.licdn.com/dms/image/C4E0BAQF6TJKa56uLAg/company-logo_400_400/0/1663661969458?e=1700697600&v=beta&t=YnBfRWG5HlUuJxKelTb56FoVBIORXOSDJMzROxGDhNw', 'url': 'https://www.linkedin.com/company/unilever/', 'employees': {'start': 10001, 'end': None}}, 'date': {'start': {'month': 5, 'day': None, 'year': 2006}, 'end': {'month': 8, 'day': None, 'year': 2013}}, 'profile_positions': [{'location': 'Buenos Aires', 'date': {'start': {'month': 1, 'day': None, 'year': 2013}, 'end': {'month': 8, 'day': None, 'year': 2013}}, 'company': 'Unilever', 'description': 'Responsable for purchases for South Cone (Argentina, Bolivia, Chile, Paraguay, Perú y Uruguay) for Human Resourse, Profesional Services and Travel. \nAnalysis and control of IP Targets for SoCo. \nSupport on business tools: Ariba Buying, IPA, Sap BW, ISIS.', 'title': 'Indirect Procurement Coordinator SoCo', 'employment_type': None}, {'location': None, 'date': {'start': {'month': 11, 'day': None, 'year': 2008}, 'end': {'month': 8, 'day': None, 'year': 2013}}, 'company': 'Unilever', 'description': '- Coordinate the BTO (Best Transformation Outsourcing) process South Cone (Argentina, Bolivia, Chile, Paraguay, Peru, Uruguay).\n- Support implementation of Ariba Buyer, communication plan and trainings. UAT User and Power User. \n-  Control and reporting of Procurement objetives: savings, payment terms, cashflow. \n- Sap BW: Create Megadata reports. Data mining.', 'title': ' Indirects Procurement Analyst South Cone', 'employment_type': None}, {'location': None, 'date': {'start': {'month': 1, 'day': None, 'year': 2007}, 'end': {'month': 10, 'day': None, 'year': 2008}}, 'company': 'Unilever', 'description': 'Comprador NPI - \nCompra de Maquinaria - Lineas de produccion y partes. - Importacion -\n \nRepuestos: Electricos/Electronicos, Elementos de Transmision, Neumatica, Bombas, Valvulas, Mecanizados.', 'title': 'Comprador', 'employment_type': None}, {'location': None, 'date': {'start': {'month': 5, 'day': None, 'year': 2006}, 'end': {'month': 12, 'day': None, 'year': 2006}}, 'company': 'Unilever', 'description': 'Gestion de SAP: Generacio y actualizacion: Contratos Marco - PO - para Packaging-Chemical-Ingridents', 'title': 'Operador SAP para Compras Regionales Productivas.', 'employment_type': None}]}, {'company': {'id': None, 'name': 'Grupo Proaxion', 'logo': None, 'url': None, 'employees': {'start': None, 'end': None}}, 'date': {'start': {'month': 1, 'day': None, 'year': 2006}, 'end': {'month': 4, 'day': None, 'year': 2006}}, 'profile_positions': [{'location': None, 'date': {'start': {'month': 1, 'day': None, 'year': 2006}, 'end': {'month': 4, 'day': None, 'year': 2006}}, 'company': 'Grupo Proaxion', 'description': 'Coordinacion de Mistery Shopper para auditar promotoras en canales de Ventas. - Supermercados y Farmacias -. Cuenta Procter&amp;Gamble. \nAlcance: Argentina, 25 bocas. \nRealizar informes al cliente sobre sobre los resultados de las acciones.', 'title': 'Controller de Promociones', 'employment_type': None}]}]",[],"['Certificación CELPE BRAS', 'SAP', 'Aprovisionamiento', 'Subcontratación', 'Negociación', 'Cadena de suministro', 'Procurement', 'Administración de la cadena de suministro', 'Planificación estratégica', 'Autodidact', 'IT tool expertise - SAP - Ariba - ISIS - Excel', 'Negotiation', 'Teamwork', 'Liderazgo de equipos', 'Estrategia empresarial', 'Microsoft Excel', 'Inglés', 'Programación', 'Scratch', 'Aprendizaje automático']",,,
