profile_id,first_name,last_name,sub_title,profile_picture,background_image,profile_type,entity_urn,object_urn,birth_date,summary,location,premium,influencer,treasury_media,languages,industry,education,patents,awards,certifications,organizations,projects,publications,courses,test_scores,position_groups,volunteer_experiences,skills,network_info,related_profiles,contact_info
sohel-samim-21939420,Sohel,Samim,"DESIGN, PRODUCT DEVELOPMENT, SOURCING, FASHION BUSINESS & MANAGEMENT. ",https://media.licdn.com/dms/image/D4E03AQFOZAxZgGRRUg/profile-displayphoto-shrink_800_800/0/1675617899444?e=1697673600&v=beta&t=uOEWv2zJe7ac_3IMHamHKz_Hs1ukN94WBa01sKUeFSY,https://media.licdn.com/dms/image/C5616AQFBJwwA8uwvwQ/profile-displaybackgroundimage-shrink_350_1400/0/1651272401602?e=1697673600&v=beta&t=owGyXx4EFPWwZylVPh3Iymv92OwqXieOukIg78aahOU,personal,ACoAAART2TUBa3YV9o7UB9WkxitbStMbvKcmTCk,72603957,,"I, aspire to be a part of the beautiful culture and make my mark in the field of fashion business.I come from a place that's rich with knowledge and experience. Bangladesh remains the second largest apparel exporter in the world.  I've come a long way from tracing simple measurement charts to creating tangible forms out of ideas laid down by teams with over 16 members.  

I have started my MSc Fashion Business and Management in UCA, UK.  Attaining this higher education from University for the Creative Arts (UCA) will become my gateway to enhancing my social and business relationships along with establishing a better idea on the global trends.  

I've graduated from the renowned BGMEA Institute of Fashion and Technology, Dhaka. I completed MBA in Apparel merchandising and B.Sc. in Fashion designing and Technology, and these have helped me come a long way in my professional experiences.

Currently, I'm working with the Centro, Dhaka as the Head of Design and Product Development. Every jot and tittle from sales, sample grouping, packaging, labelling, grid planning, trend researching, idea conceptualisation, trimming to presenting the line and collection to the clients was supervised by me and executed to perfection. 

Working with a line of brands across the country I've familiarised myself with the many cultures, trends, and customer needs. From the Zara store in Spain, Puma in Germany, Marks & Spencer and Primark in UK, Aeropostale in USA, Just Jeans in Australia, Woolworth in South Africa and the Landmark in UAE. You could name a brand, and I would've worked or collaborated with them at some point. 

I've hustled across the ramp for brands to put out nothing but the best. While I'm at it, I've also ensured that every bit of fabric we put together is ethically sourced and of sustainable nature. The idea of sourcing sustainable goods was something I built over the time and it has definitely seen some positive results. 

My references can vouch for it when I say that I am very self-reliant. If they wanted to source new suppliers, explain product lines, supervise showrooms, determine client requirements, come up with developmental sketches and concept techniques, or even quote the right prices - I was the one they could count on without a second opinion. That's the brand I've created for myself over the 13 years of professional work in Fashion Designing and product development.","{'country': 'United Kingdom', 'short': 'Godalming, England', 'city': 'Godalming', 'state': 'England', 'default': 'Godalming, England, United Kingdom'}",False,False,[],"{'primary_locale': {'country': 'US', 'language': 'en'}, 'supported_locales': [{'country': 'US', 'language': 'en'}], 'profile_languages': []}",Textiles,"[{'date': {'start': {'month': 2, 'day': None, 'year': 2022}, 'end': {'month': 2, 'day': None, 'year': 2023}}, 'school': {'name': 'University for the Creative Arts', 'logo': 'https://media.licdn.com/dms/image/C4E0BAQHRPBxzNegSQQ/company-logo_400_400/0/1678375758765?e=1700697600&v=beta&t=4Ry_njBF4H3mud25R-xUtRmMnD2I1E_4zvom9Kzn0Uc', 'url': 'https://www.linkedin.com/school/universityforthecreativearts/'}, 'degree_name': 'MSc Fashion Business and Management', 'field_of_study': 'Fashion/Apparel Design'}, {'date': {'start': {'month': 2, 'day': None, 'year': 2022}, 'end': {'month': 2, 'day': None, 'year': 2023}}, 'school': {'name': 'University for the Creative Arts', 'logo': 'https://media.licdn.com/dms/image/C4E0BAQHRPBxzNegSQQ/company-logo_400_400/0/1678375758765?e=1700697600&v=beta&t=4Ry_njBF4H3mud25R-xUtRmMnD2I1E_4zvom9Kzn0Uc', 'url': 'https://www.linkedin.com/school/universityforthecreativearts/'}, 'degree_name': ""Master's degree"", 'field_of_study': 'Fashion Business & Management '}, {'date': {'start': {'month': None, 'day': None, 'year': 2010}, 'end': {'month': None, 'day': None, 'year': 2011}}, 'school': {'name': 'BGMEA INSTITUTE OF FASHION AND TECHNOLOGY', 'logo': None, 'url': None}, 'degree_name': 'MBA in Apparel Merchandising', 'field_of_study': 'Merchandising'}, {'date': {'start': {'month': None, 'day': None, 'year': 2002}, 'end': {'month': None, 'day': None, 'year': 2006}}, 'school': {'name': 'BGMEA INSTITUTE OF FASHION AND TECHNOLOGY', 'logo': None, 'url': None}, 'degree_name': 'Bsc in Fashion Design and Technology', 'field_of_study': 'Fashion Designing'}, {'date': {'start': {'month': 2, 'day': None, 'year': 2022}, 'end': {'month': None, 'day': None, 'year': None}}, 'school': {'name': 'University for the Creative Arts', 'logo': 'https://media.licdn.com/dms/image/C4E0BAQHRPBxzNegSQQ/company-logo_400_400/0/1678375758765?e=1700697600&v=beta&t=4Ry_njBF4H3mud25R-xUtRmMnD2I1E_4zvom9Kzn0Uc', 'url': 'https://www.linkedin.com/school/universityforthecreativearts/'}, 'degree_name': 'Msc', 'field_of_study': 'Fashion Business and Management'}]",[],[],[],[],[],[],[],[],"[{'company': {'id': 71765101, 'name': 'Centro Sourcing UK Ltd.', 'logo': 'https://media.licdn.com/dms/image/C4D0BAQE9HitsXzTCOg/company-logo_400_400/0/1616406866731?e=1700697600&v=beta&t=phIURZl2mSMIISOYP3BLwZIJ6alrCkYeZjFVgsBMzUg', 'url': 'https://www.linkedin.com/company/centro-uk-sourcing-ltd/', 'employees': {'start': 501, 'end': 1000}}, 'date': {'start': {'month': 10, 'day': None, 'year': 2022}, 'end': {'month': None, 'day': None, 'year': None}}, 'profile_positions': [{'location': 'Guildford, England, United Kingdom', 'date': {'start': {'month': 10, 'day': None, 'year': 2022}, 'end': {'month': None, 'day': None, 'year': None}}, 'company': 'Centro Sourcing UK Ltd.', 'description': None, 'title': 'Design and Product  Development', 'employment_type': 'Full-time'}]}, {'company': {'id': None, 'name': 'CENTRO TEX LTD', 'logo': None, 'url': None, 'employees': {'start': None, 'end': None}}, 'date': {'start': {'month': 1, 'day': None, 'year': 2012}, 'end': {'month': None, 'day': None, 'year': None}}, 'profile_positions': [{'location': 'UTTARA', 'date': {'start': {'month': 1, 'day': None, 'year': 2012}, 'end': {'month': None, 'day': None, 'year': None}}, 'company': 'CENTRO TEX LTD', 'description': None, 'title': 'HEAD OF DESIGN AND DEVELOPMENT', 'employment_type': None}, {'location': None, 'date': {'start': {'month': 1, 'day': None, 'year': 2012}, 'end': {'month': None, 'day': None, 'year': None}}, 'company': 'Centro Tex Ltd', 'description': None, 'title': 'Head of Design and Development ', 'employment_type': None}]}, {'company': {'id': None, 'name': 'Haze&Finn, Belgium', 'logo': None, 'url': None, 'employees': {'start': None, 'end': None}}, 'date': {'start': {'month': 1, 'day': None, 'year': 2013}, 'end': {'month': None, 'day': None, 'year': None}}, 'profile_positions': [{'location': 'Dhaka, Bangladesh', 'date': {'start': {'month': 1, 'day': None, 'year': 2013}, 'end': {'month': None, 'day': None, 'year': None}}, 'company': 'Haze&Finn, Belgium', 'description': None, 'title': 'Head Designer', 'employment_type': None}]}, {'company': {'id': None, 'name': 'Pride Group', 'logo': None, 'url': None, 'employees': {'start': None, 'end': None}}, 'date': {'start': {'month': 9, 'day': None, 'year': 2011}, 'end': {'month': 12, 'day': None, 'year': 2011}}, 'profile_positions': [{'location': 'Dhaka', 'date': {'start': {'month': 9, 'day': None, 'year': 2011}, 'end': {'month': 12, 'day': None, 'year': 2011}}, 'company': 'Pride Group', 'description': None, 'title': 'Head Of Design and product Development', 'employment_type': None}]}, {'company': {'id': 926278, 'name': 'Viyellatex Group', 'logo': 'https://media.licdn.com/dms/image/D560BAQHSmvG9BUI1Mg/company-logo_400_400/0/1666154414859?e=1700697600&v=beta&t=F9em-jDr4ldCgkmbnAuWlXcHTBZo92aIW3SuO3I5Bwk', 'url': 'https://www.linkedin.com/company/viyellatexgroup/', 'employees': {'start': 10001, 'end': None}}, 'date': {'start': {'month': 1, 'day': None, 'year': 2007}, 'end': {'month': 9, 'day': None, 'year': 2011}}, 'profile_positions': [{'location': None, 'date': {'start': {'month': 1, 'day': None, 'year': 2007}, 'end': {'month': 9, 'day': None, 'year': 2011}}, 'company': 'Viyellatexgroup', 'description': None, 'title': 'Head of Design and Development', 'employment_type': None}]}, {'company': {'id': 85648, 'name': 'Tesco International Sourcing', 'logo': 'https://media.licdn.com/dms/image/C510BAQHXTNj4vKmH3A/company-logo_400_400/0/1563846658638?e=1700697600&v=beta&t=f1ZHuoI4XKYKhB5CyIVg2xw_IqqoOgOR_Qrh_Whet9g', 'url': 'https://www.linkedin.com/company/tescosourcing/', 'employees': {'start': 201, 'end': 500}}, 'date': {'start': {'month': 4, 'day': None, 'year': 2007}, 'end': {'month': 12, 'day': None, 'year': 2007}}, 'profile_positions': [{'location': None, 'date': {'start': {'month': 4, 'day': None, 'year': 2007}, 'end': {'month': 12, 'day': None, 'year': 2007}}, 'company': 'Tesco Sourcing', 'description': None, 'title': 'Technical Designer', 'employment_type': None}]}]",[],"['Textiles', 'Apparel', 'Fashion Design', 'Trend', 'Fashion', 'Wovens', 'Denim', 'Knitwear', 'Sportswear', 'Weaving', 'Product Development', 'Target Costing', 'Sewing', 'Textile Industry', 'Trend Analysis', 'Fashion Illustration', 'Outerwear', 'Pattern', 'Tech Packs', 'Merchandising']",,,
