profile_id,first_name,last_name,sub_title,profile_picture,background_image,profile_type,entity_urn,object_urn,birth_date,summary,location,premium,influencer,treasury_media,languages,industry,education,patents,awards,certifications,organizations,projects,publications,courses,test_scores,position_groups,volunteer_experiences,skills,network_info,related_profiles,contact_info
marten-tulleners-89054617,Marten,Tulleners,Directeur / eigenaar at Julius Baller BV,,https://media.licdn.com/dms/image/C4D16AQEG5cdUgqPYlg/profile-displaybackgroundimage-shrink_350_1400/0/1516630817789?e=1697673600&v=beta&t=9L2s590RfWd6VsGm1ZWZnaiKG-iE_SBsrzI4NXNA834,personal,ACoAAAN2HWwB1xGUZEJ6s-8eDwcS6vtEpaOrIHY,58072428,,"In mijn meer dan 50 jarige loopbaan heb ik mij met alle facetten van mijn vakgebied
beziggehouden met name op gebied van metalen daken/non- ferro en koperslagerij.

Het ambachtelijke beroep van koperslager heeft in ons bedrijf de tand des tijds glansrijk doorstaan.
De specifieke vakkennis is generaties lang overgedragen op jonge mensen die met hun vakmanschap in staat zijn alles stijlvast te reconstrueren of nieuw te maken.

Ook voert Julius Baller ontwerpen van beeldend kunstenaars uit in materialen als zink, koper, messing, roestvast staal etc.

Door een nauwgezette samenwerking met de ontwerper en met inzet van onze vakkennis ontstaat een eindproduct dat aan alle gestelde eisen voldoet. Het gehele proces-vertaling van het idee, realisatie en plaatsing wordt door ons uitgevoerd en begeleid. Gemaakte afspraken met de afnemers, zoals de overheid of instellingen, kunnen daardoor stipt worden nagekomen. De door ons vervaardigde en opgestelde kunstwerken dragen bij aan een verrijking van de dagelijkse omgeving.","{'country': 'Netherlands', 'short': 'Amsterdam, North Holland', 'city': 'Amsterdam', 'state': 'North Holland', 'default': 'Amsterdam, North Holland, Netherlands'}",False,False,[],"{'primary_locale': {'country': 'US', 'language': 'en'}, 'supported_locales': [{'country': 'US', 'language': 'en'}], 'profile_languages': []}",Arts & Crafts,"[{'date': {'start': {'month': None, 'day': None, 'year': 1963}, 'end': {'month': None, 'day': None, 'year': 1976}}, 'school': {'name': 'Avondstudie', 'logo': None, 'url': None}, 'degree_name': None, 'field_of_study': None}, {'date': {'start': {'month': None, 'day': None, 'year': 1959}, 'end': {'month': None, 'day': None, 'year': 1963}}, 'school': {'name': 'Derde Ambachtsschool Timorplein Amsterdam', 'logo': None, 'url': None}, 'degree_name': 'Diploma', 'field_of_study': None}]",[],[],[],[],"[{'title': 'Koninlijk Theater  Carré', 'date': {'start': {'month': 3, 'day': None, 'year': 2014}, 'end': {'month': 6, 'day': None, 'year': 2014}}, 'description': 'Het bijmaken van ontbrekende onderdelen, herstellen en restaureren van de ornamentale zinken consoles van het voorbalkon.\nSituatie na de restauratie\nOpgeleverd juni 2014.', 'contributors': [{'type': 'standardizedContributor', 'first_name': 'Marten', 'last_name': 'Tulleners', 'name': None, 'headline': 'Directeur / eigenaar at Julius Baller BV'}]}]",[],[],[],"[{'company': {'id': None, 'name': 'Julius Baller BV', 'logo': None, 'url': None, 'employees': {'start': None, 'end': None}}, 'date': {'start': {'month': None, 'day': None, 'year': 1975}, 'end': {'month': None, 'day': None, 'year': None}}, 'profile_positions': [{'location': 'Amsterdam', 'date': {'start': {'month': None, 'day': None, 'year': 1975}, 'end': {'month': None, 'day': None, 'year': None}}, 'company': 'Julius Baller BV', 'description': None, 'title': 'Directeur / eigenaar', 'employment_type': None}]}, {'company': {'id': None, 'name': 'Tulleners BV', 'logo': None, 'url': None, 'employees': {'start': None, 'end': None}}, 'date': {'start': {'month': None, 'day': None, 'year': 1970}, 'end': {'month': None, 'day': None, 'year': 2004}}, 'profile_positions': [{'location': 'Amsterdam', 'date': {'start': {'month': None, 'day': None, 'year': 1970}, 'end': {'month': None, 'day': None, 'year': 2004}}, 'company': 'Tulleners BV', 'description': None, 'title': 'Directeur / eigenaar', 'employment_type': None}]}, {'company': {'id': None, 'name': 'Aannemingsbedrijf STR', 'logo': None, 'url': None, 'employees': {'start': None, 'end': None}}, 'date': {'start': {'month': None, 'day': None, 'year': 1974}, 'end': {'month': None, 'day': None, 'year': 1982}}, 'profile_positions': [{'location': 'Amsterdam', 'date': {'start': {'month': None, 'day': None, 'year': 1974}, 'end': {'month': None, 'day': None, 'year': 1982}}, 'company': 'Aannemingsbedrijf STR', 'description': None, 'title': 'Mededirecteur / eigenaar', 'employment_type': None}]}, {'company': {'id': None, 'name': 'Fa. M. Tulleners', 'logo': None, 'url': None, 'employees': {'start': None, 'end': None}}, 'date': {'start': {'month': None, 'day': None, 'year': 1967}, 'end': {'month': None, 'day': None, 'year': 1970}}, 'profile_positions': [{'location': 'Amsterdam', 'date': {'start': {'month': None, 'day': None, 'year': 1967}, 'end': {'month': None, 'day': None, 'year': 1970}}, 'company': 'Fa. M. Tulleners', 'description': None, 'title': 'Gezel en Patroon', 'employment_type': None}]}, {'company': {'id': None, 'name': 'Fa. Hesseling Amsterdam', 'logo': None, 'url': None, 'employees': {'start': None, 'end': None}}, 'date': {'start': {'month': None, 'day': None, 'year': 1963}, 'end': {'month': None, 'day': None, 'year': 1967}}, 'profile_positions': [{'location': 'Amsterdam', 'date': {'start': {'month': None, 'day': None, 'year': 1963}, 'end': {'month': None, 'day': None, 'year': 1967}}, 'company': 'Fa. Hesseling Amsterdam', 'description': None, 'title': 'Leerling gezel loodgieter', 'employment_type': None}]}]","[{'date': {'start': {'month': None, 'day': None, 'year': 1975}, 'end': {'month': None, 'day': None, 'year': 1985}}, 'role': 'Bestuurslid', 'company': {'id': None, 'name': 'Stichting Restauratie atelier Uilenburg', 'logo': None, 'url': None}, 'cause': 'ARTS_AND_CULTURE', 'description': None}, {'date': {'start': {'month': None, 'day': None, 'year': 1990}, 'end': {'month': None, 'day': None, 'year': 2001}}, 'role': 'Penningmeester', 'company': {'id': None, 'name': 'Uneto?VNI afd. Amsterdam', 'logo': None, 'url': None}, 'cause': None, 'description': None}, {'date': {'start': {'month': None, 'day': None, 'year': 2003}, 'end': {'month': None, 'day': None, 'year': 2010}}, 'role': 'Bestuurslid', 'company': {'id': None, 'name': 'Nationaal Restauratie Centrum Amsterdam', 'logo': None, 'url': None}, 'cause': None, 'description': None}, {'date': {'start': {'month': None, 'day': None, 'year': 2001}, 'end': {'month': None, 'day': None, 'year': None}}, 'role': 'Penningmeester', 'company': {'id': None, 'name': 'Stichting Eensgezindheid', 'logo': None, 'url': None}, 'cause': None, 'description': None}, {'date': {'start': {'month': None, 'day': None, 'year': 1985}, 'end': {'month': None, 'day': None, 'year': 1995}}, 'role': 'Deelnemer werkgroep', 'company': {'id': None, 'name': 'ROC', 'logo': None, 'url': None}, 'cause': None, 'description': 'Zitting in werkgroepen van het ROC t.b.v. scholing installateurs\nBhutan\n'}, {'date': {'start': {'month': None, 'day': None, 'year': 2004}, 'end': {'month': None, 'day': None, 'year': None}}, 'role': 'Researcher', 'company': {'id': None, 'name': 'Bhutanese regering en PUM', 'logo': None, 'url': None}, 'cause': None, 'description': 'Onderzoek ter plaatse en rapportage scholing technisch onderwijs  op verzoek van de Bhutanese regering en de PUM\n'}]","['Management', 'Research', 'Sales', 'Leadership', 'Training']",,,
