profile_id,first_name,last_name,sub_title,profile_picture,background_image,profile_type,entity_urn,object_urn,birth_date,summary,location,premium,influencer,treasury_media,languages,industry,education,patents,awards,certifications,organizations,projects,publications,courses,test_scores,position_groups,volunteer_experiences,skills,network_info,related_profiles,contact_info
bertrand-kamga-kabiwa-72b041b1,Bertrand,Kamga Kabiwa,Area Sales Manager at Bridge Polymers BV,,,personal,ACoAABetHtMB9WM0T8BWD0Yd2MqxJo1YW7FM58k,397221587,,"INTRODUCTION:
Bertrand is Cameroonian of origin and lives in the Netherlands. Coming from a country with cultural diversity, I am always open for new challenges.

Bertrand is interested in the fields of marketing/sales as well as Logistics and has always found pleasure working in the above mentioned areas. 

Hobbies:  fitness, motocross, football and others.

 TV : National geography, investigation discovery, discovery channel, CNN,BBC, just to name these.","{'country': 'Netherlands', 'short': 'Valkenswaard, North Brabant', 'city': 'Valkenswaard', 'state': 'North Brabant', 'default': 'Valkenswaard, North Brabant, Netherlands'}",False,False,[],"{'primary_locale': {'country': 'US', 'language': 'en'}, 'supported_locales': [{'country': 'US', 'language': 'en'}], 'profile_languages': [{'name': 'Dutch', 'proficiency': 'LIMITED_WORKING'}, {'name': 'English', 'proficiency': 'NATIVE_OR_BILINGUAL'}, {'name': 'French', 'proficiency': 'FULL_PROFESSIONAL'}]}",Chemicals,"[{'date': {'start': {'month': None, 'day': None, 'year': 2009}, 'end': {'month': None, 'day': None, 'year': 2014}}, 'school': {'name': 'Fontys University of Applied Sciences', 'logo': 'https://media.licdn.com/dms/image/C560BAQHoPshjTmIrAg/company-logo_400_400/0/1519856033175?e=1700697600&v=beta&t=0qGzAv6PuQje0RGiJ7HkFVuTY5RW0pmusC4QImvaao4', 'url': 'https://www.linkedin.com/school/fontys-hogescholen/'}, 'degree_name': 'Bachelor of Applied Science (B.A.Sc.)', 'field_of_study': 'Business Administration and Management, General'}, {'date': {'start': {'month': None, 'day': None, 'year': 2007}, 'end': {'month': None, 'day': None, 'year': 2008}}, 'school': {'name': 'Université de Yaoundé', 'logo': None, 'url': None}, 'degree_name': 'yes', 'field_of_study': 'Faculté des sciences Jurisdoques et politioues'}, {'date': {'start': {'month': None, 'day': None, 'year': 2001}, 'end': {'month': None, 'day': None, 'year': 2006}}, 'school': {'name': 'Cameroon College of Art and commerce Kumba', 'logo': None, 'url': None}, 'degree_name': 'Advance Level Certificate', 'field_of_study': 'Business/Commerce, General'}, {'date': {'start': {'month': None, 'day': None, 'year': 1995}, 'end': {'month': None, 'day': None, 'year': 2001}}, 'school': {'name': 'Saint Francis College Fiango Kumba', 'logo': None, 'url': None}, 'degree_name': 'Odinary Level Certificate', 'field_of_study': 'Business/Commerce, General'}]",[],[],"[{'name': 'Degree Certificate Higher Education', 'date': {'start': {'month': None, 'day': None, 'year': None}, 'end': {'month': None, 'day': None, 'year': None}}, 'authority': 'Fontys,In accordance with the requirements as degreed in the Higher Education and Research Act (WHW, Stb.593, 1992).', 'url': None, 'license_number': None, 'display_source': None, 'company': None}]",[],[],[],[],[],"[{'company': {'id': None, 'name': 'Bridge Polymers BV', 'logo': None, 'url': None, 'employees': {'start': None, 'end': None}}, 'date': {'start': {'month': 1, 'day': None, 'year': 2018}, 'end': {'month': None, 'day': None, 'year': None}}, 'profile_positions': [{'location': 'Eindhoven Area, Netherlands', 'date': {'start': {'month': 1, 'day': None, 'year': 2018}, 'end': {'month': None, 'day': None, 'year': None}}, 'company': 'Bridge Polymers BV', 'description': 'Market Development :\n\nPlanning and implementing growth strategies to develop new markets.', 'title': 'Area Sales Manager', 'employment_type': None}]}, {'company': {'id': None, 'name': 'The Agatha Foundation', 'logo': None, 'url': None, 'employees': {'start': None, 'end': None}}, 'date': {'start': {'month': 1, 'day': None, 'year': 2014}, 'end': {'month': None, 'day': None, 'year': None}}, 'profile_positions': [{'location': 'USA, Europe and Africa', 'date': {'start': {'month': 1, 'day': None, 'year': 2014}, 'end': {'month': None, 'day': None, 'year': None}}, 'company': 'The Agatha Foundation', 'description': 'Inspired by the African Union’s designation of the decade 2010 – 2020 as the decade of the African woman and in line with United Nations’ Millennium Development goals 1 -5, The Agatha Foundation seeks “to end poverty and hunger, promote universal education, promote gender equality and empower women, reduce child mortality rates, improve maternal health and combat HIV/AIDS, malaria and other diseases.”\n\nThe activities and Programs of the Agatha foundation are focused on ;\n.Education and Food\n.Healthcare\n.Community service\n.Entrepreneurship and leadership', 'title': 'Vice President', 'employment_type': None}]}, {'company': {'id': 1320327, 'name': 'Partners Network BV', 'logo': 'https://media.licdn.com/dms/image/C4E0BAQEamx4zwfTMlA/company-logo_400_400/0/1525254760390?e=1700697600&v=beta&t=wOPbW7ST3uU6oZIZbD04NlwodIAnO6Q3aAmBbudjphc', 'url': 'https://www.linkedin.com/company/partners-network-bv/', 'employees': {'start': 11, 'end': 50}}, 'date': {'start': {'month': 3, 'day': None, 'year': 2017}, 'end': {'month': 1, 'day': None, 'year': 2018}}, 'profile_positions': [{'location': 'Nunspeet the Netherlands', 'date': {'start': {'month': 3, 'day': None, 'year': 2017}, 'end': {'month': 1, 'day': None, 'year': 2018}}, 'company': 'Partners Network - Global Distributor ', 'description': '> Analyse assigned sales markets and purchase market. \n>  Approach existing and new clients, advise and conduct sales.\n>  Update other team members about relevant information regarding the assigned markets and request what the market needs.\n> Perform according to the set KPI’s.\n>  Set up certain appointed commercial projects.\n> Travel on a regular base to my (potential)clients in order to establish a strong, trustful relationship. \n> Check and control given overviews were I am involved.', 'title': 'Team Member Commerce', 'employment_type': None}]}, {'company': {'id': None, 'name': 'BIOMAX BV', 'logo': None, 'url': None, 'employees': {'start': None, 'end': None}}, 'date': {'start': {'month': 6, 'day': None, 'year': 2014}, 'end': {'month': None, 'day': None, 'year': 2017}}, 'profile_positions': [{'location': 'Amsterdam Area, Netherlands', 'date': {'start': {'month': 6, 'day': None, 'year': 2014}, 'end': {'month': None, 'day': None, 'year': 2017}}, 'company': 'BIOMAX BV', 'description': '•     Selling animal concentrates through distribution and directly to customers.\n•      Managing and increasing effectiveness with distribution partners \n•\tDevelop customer base necessary to meet all sales forecasts and budgets \n•\tProspecting for new business, preparing/presenting proposals and maintaining existing relationships .', 'title': 'Sales Account Manager', 'employment_type': None}]}, {'company': {'id': None, 'name': 'Self Employed', 'logo': None, 'url': None, 'employees': {'start': None, 'end': None}}, 'date': {'start': {'month': 8, 'day': None, 'year': 2012}, 'end': {'month': 12, 'day': None, 'year': 2013}}, 'profile_positions': [{'location': 'Netherlands and Cameroon', 'date': {'start': {'month': 8, 'day': None, 'year': 2012}, 'end': {'month': 12, 'day': None, 'year': 2013}}, 'company': 'Self Employed', 'description': 'Export of used products and cars from the Nederland to Cameroon. Controlling the process of;\n. International administration of documents and legal aspects.\n. Financial administration\n.Marketing and communication\n.Relationship management and International logistics.', 'title': 'Export Manager', 'employment_type': None}]}, {'company': {'id': 71486, 'name': 'Vlisco Netherlands B.V.', 'logo': 'https://media.licdn.com/dms/image/C4E0BAQH1gsizDpeqaw/company-logo_400_400/0/1519912665757?e=1700697600&v=beta&t=OsQUg0bXufbzD8ZBk0eJkPoiWYyiJZaUWX1du9ZdZ3E', 'url': 'https://www.linkedin.com/company/vlisco-netherlands/', 'employees': {'start': 1001, 'end': 5000}}, 'date': {'start': {'month': 6, 'day': None, 'year': 2013}, 'end': {'month': 10, 'day': None, 'year': 2013}}, 'profile_positions': [{'location': 'Amsterdam Area, Netherlands', 'date': {'start': {'month': 6, 'day': None, 'year': 2013}, 'end': {'month': 10, 'day': None, 'year': 2013}}, 'company': 'Vlisco Netherlands', 'description': 'The goals and objectives of my research was to have an understanding of the Afropolitans consumer interested in African print fabric, living within Britain and France and how to approach them. My assignment helped the company to;\n. Identify the different countries of Afropolitans by nationalities and their activities online within Britain and France.\n.Map out the geographic distribution of the Afropolitans living in Britain and France.\n.Describe the reasons for the migration of the Afropolitans to Britain and France.\n.Understand the online behavior of the Afropolitans living in Britain and France.\n.See if the Afropolitans have interest for Vlisco products.', 'title': 'Market Analyst ( Traineeship)', 'employment_type': None}]}, {'company': {'id': 2329, 'name': 'Schneider Electric', 'logo': 'https://media.licdn.com/dms/image/C4E0BAQGNfeTPCu6Z-w/company-logo_400_400/0/1519855876125?e=1700697600&v=beta&t=oq2qciVzt70AQNoOE1svAQqmQ0SvpgG4nesqH01h474', 'url': 'https://www.linkedin.com/company/schneider-electric/', 'employees': {'start': 10001, 'end': None}}, 'date': {'start': {'month': 7, 'day': None, 'year': 2012}, 'end': {'month': 6, 'day': None, 'year': 2013}}, 'profile_positions': [{'location': 'Helmond', 'date': {'start': {'month': 7, 'day': None, 'year': 2012}, 'end': {'month': 6, 'day': None, 'year': 2013}}, 'company': 'Schneider Electric', 'description': 'Responsible for the quality control of products at the last stage of the logistics process before delivery to the customers. This was a part time job alongside my studies.', 'title': 'Quality controle operator outbound', 'employment_type': None}]}, {'company': {'id': 110040, 'name': 'World Trade Centers Association', 'logo': 'https://media.licdn.com/dms/image/C510BAQFgAFjXnAlngw/company-logo_400_400/0/1519888844216?e=1700697600&v=beta&t=RlbUkQbN9HYroFUovxbFUdC2v1iTqh-ReLqfsi_eyic', 'url': 'https://www.linkedin.com/company/world-trade-centers-association/', 'employees': {'start': 11, 'end': 50}}, 'date': {'start': {'month': 2, 'day': None, 'year': 2011}, 'end': {'month': 7, 'day': None, 'year': 2011}}, 'profile_positions': [{'location': 'Eindhoven Area, Netherlands', 'date': {'start': {'month': 2, 'day': None, 'year': 2011}, 'end': {'month': 7, 'day': None, 'year': 2011}}, 'company': 'World Trade Centers Association', 'description': 'With a group of five students we created an industrial international business club for the organization to improve its image in order to uplift the value of the organization. The International Business Club was set up through a market research, creating a strategic, operational and tactical plan.', 'title': 'Junior consultant ( Traineeship)', 'employment_type': None}]}, {'company': {'id': None, 'name': 'Teletronik BV', 'logo': None, 'url': None, 'employees': {'start': None, 'end': None}}, 'date': {'start': {'month': 9, 'day': None, 'year': 2010}, 'end': {'month': 1, 'day': None, 'year': 2011}}, 'profile_positions': [{'location': 'Eindhoven Area, Netherlands', 'date': {'start': {'month': 9, 'day': None, 'year': 2010}, 'end': {'month': 1, 'day': None, 'year': 2011}}, 'company': 'Teletronik BV', 'description': '. Created a strategic business plan for a led lighting company based in Switzerland. Teletronik wanted to expand its markets in the Benelux', 'title': 'Junior Consultant (Traineeship)', 'employment_type': None}]}, {'company': {'id': None, 'name': 'Brasseries du Cameroon', 'logo': None, 'url': None, 'employees': {'start': None, 'end': None}}, 'date': {'start': {'month': 6, 'day': None, 'year': 2008}, 'end': {'month': 1, 'day': None, 'year': 2009}}, 'profile_positions': [{'location': 'Cameroon', 'date': {'start': {'month': 6, 'day': None, 'year': 2008}, 'end': {'month': 1, 'day': None, 'year': 2009}}, 'company': 'Brasseries du Cameroon', 'description': '.I was in charge of the inventory and gave account on products that went in and out of the warehouse.\n.Complete reports by entering required information.\n. Maintain safe and clean work environment by keeping shelves, pallet area and workstation neat; maintaining clean shipping supply area; complying with procedures, rules and regulation.\n.maintain technical knowledge by attending educational workshops.', 'title': 'Warehouse Employee', 'employment_type': None}]}]","[{'date': {'start': {'month': 1, 'day': None, 'year': 2014}, 'end': {'month': None, 'day': None, 'year': None}}, 'role': 'Vice presedent', 'company': {'id': None, 'name': 'The Agatha Foundation', 'logo': None, 'url': None}, 'cause': 'CIVIL_RIGHTS', 'description': 'Inspired by the African Union’s designation of the decade 2010 – 2020 as the decade of the African woman and in line with United Nations’ Millennium Development goals 1 -5, The Agatha Foundation seeks “to end poverty and hunger, promote universal education, promote gender equality and empower women, reduce child mortality rates, improve maternal health and combat HIV/AIDS, malaria and other diseases.”\n\nThe activities and Programs of the Agatha foundation are focused on ;\n.Education and Food\n.Healthcare\n.Community service\n.Entrepreneurship and leadership'}]","['flexible, can do multiple task or projects at the same time.', 'Positive attitude and behaviours(taking initiative and doing my job)', 'Attention to details', 'Interest in life long learning,( being open and rsponsive to change)', 'Independence', 'Analyzing and information processing', 'Creative problem solving', 'Planning and organization', 'International Business', 'Problem Solving', 'Leadership', 'Communication', 'Strategy', 'Coaching', 'Marketing Strategy', 'Customer Service', 'Management Consulting', 'Microsoft Excel', 'Teamwork', 'Market Research']",,,
