profile_id,first_name,last_name,sub_title,profile_picture,background_image,profile_type,entity_urn,object_urn,birth_date,summary,location,premium,influencer,treasury_media,languages,industry,education,patents,awards,certifications,organizations,projects,publications,courses,test_scores,position_groups,volunteer_experiences,skills,network_info,related_profiles,contact_info
mariapirson,Maria,Pirson,Market Researcher and Content Writer at Daedalean AI,https://media.licdn.com/dms/image/C4D03AQHfcxcwbNeFdA/profile-displayphoto-shrink_800_800/0/1641381831344?e=1697673600&v=beta&t=Qfzc6zRFipGNPMt6nno6lYW5eacHP0XtV0xUaRCSLZc,,personal,ACoAAADLfNMBizM5MflG7mRlmgFfBN365fmmEsA,13335763,,"Working on all levels including government level, global professional experience with an understanding of many cultures. Experienced negotiator. Strong communicating skills, both written and verbal. Working with people, helping and serving them is my passion and skill.

As a writer, I see my mission in carefully transferring the technical messages onto business soil without damaging the roots. Caring about the readers (investors, media, general public): cutting to the chase, presenting the concept clearly and concisely, and explaining how it is relevant to their business. Caring about the technical side: crafting the brand story without distorting or oversimplifying the ideas.

Skills:
— expertise in multicultural communication
— writing, editing and rewriting in order to produce clear and concise texts
— analytical skills: research, processing a large amount of complex information, summarizing, highlighting trends and providing insights
— facilitation of negotiations, team coaching

Several years of working in IT in various roles (business analyst, content marketing expert, investment writer and an organizational consultant). Having authored dozens of articles, presentations, white papers, pre-sale documents, and investment memos, I have a broad understanding of business issues and can quickly grasp the essence of many problems that a team can encounter.","{'country': 'Netherlands', 'short': 'Amsterdam, North Holland', 'city': 'Amsterdam', 'state': 'North Holland', 'default': 'Amsterdam, North Holland, Netherlands'}",False,False,[],"{'primary_locale': {'country': 'US', 'language': 'en'}, 'supported_locales': [{'country': 'US', 'language': 'en'}], 'profile_languages': [{'name': 'Dutch', 'proficiency': 'LIMITED_WORKING'}, {'name': 'English', 'proficiency': 'NATIVE_OR_BILINGUAL'}, {'name': 'German', 'proficiency': 'PROFESSIONAL_WORKING'}, {'name': 'Russian', 'proficiency': 'NATIVE_OR_BILINGUAL'}, {'name': 'Spanish', 'proficiency': 'LIMITED_WORKING'}]}",Marketing & Advertising,"[{'date': {'start': {'month': None, 'day': None, 'year': 2014}, 'end': {'month': None, 'day': None, 'year': 2015}}, 'school': {'name': 'St. Petersburg School of Conference Interpreting and Translation', 'logo': None, 'url': None}, 'degree_name': None, 'field_of_study': 'Language Interpretation and Translation'}, {'date': {'start': {'month': None, 'day': None, 'year': 2013}, 'end': {'month': None, 'day': None, 'year': 2014}}, 'school': {'name': 'Moscow State Linguistic University', 'logo': 'https://media.licdn.com/dms/image/C4E0BAQFCrFNNJc6x_Q/company-logo_400_400/0/1564564847157?e=1700697600&v=beta&t=u14fxFERiSy7mvr_SY_XoKYiCjhfq-iBr1QNJ9wbABI', 'url': 'https://www.linkedin.com/school/%D0%BC%D0%BE%D1%81%D0%BA%D0%BE%D0%B2%D1%81%D0%BA%D0%B8%D0%B9-%D0%B3%D0%BE%D1%81%D1%83%D0%B4%D0%B0%D1%80%D1%81%D1%82%D0%B2%D0%B5%D0%BD%D0%BD%D1%8B%D0%B9-%D0%BB%D0%B8%D0%BD%D0%B3%D0%B2%D0%B8%D1%81%D1%82%D0%B8%D1%87%D0%B5%D1%81%D0%BA%D0%B8%D0%B9-%D1%83%D0%BD%D0%B8%D0%B2%D0%B5%D1%80%D1%81%D0%B8%D1%82%D0%B5%D1%82-%D0%BC%D0%B3%D0%BB%D1%83-/'}, 'degree_name': None, 'field_of_study': 'Language Interpretation and Translation'}, {'date': {'start': {'month': None, 'day': None, 'year': 2002}, 'end': {'month': None, 'day': None, 'year': 2007}}, 'school': {'name': 'Lomonosov Moscow State University (MSU)', 'logo': 'https://media.licdn.com/dms/image/C560BAQFafJR7i-j8EA/company-logo_400_400/0/1557584831531?e=1700697600&v=beta&t=bLzcwJmSUqrR7G0fWsdch2DvGnveD-PmZ5_2J07riKw', 'url': 'https://www.linkedin.com/school/%D0%BC%D0%BE%D1%81%D0%BA%D0%BE%D0%B2%D1%81%D0%BA%D0%B8%D0%B9-%D0%B3%D0%BE%D1%81%D1%83%D0%B4%D0%B0%D1%80%D1%81%D1%82%D0%B2%D0%B5%D0%BD%D0%BD%D1%8B%D0%B9-%D1%83%D0%BD%D0%B8%D0%B2%D0%B5%D1%80%D1%81%D0%B8%D1%82%D0%B5%D1%82-%D0%B8%D0%BC.-%D0%BC.%D0%B2.-%D0%BB%D0%BE%D0%BC%D0%BE%D0%BD%D0%BE%D1%81%D0%BE%D0%B2%D0%B0-%D0%BC%D0%B3%D1%83-/'}, 'degree_name': 'Specialist', 'field_of_study': 'Philosophy'}]",[],[],"[{'name': 'ACP-ATF', 'date': {'start': {'month': 10, 'day': None, 'year': 2018}, 'end': {'month': None, 'day': None, 'year': None}}, 'authority': 'ICAgile', 'url': 'https://icagile.com/Agile-Professionals/Find-Agile-Professionals/ctl/UserDetails/mid/938/uid/e0cec3ab-269d-42a0-b148-b6a87d092f00', 'license_number': None, 'display_source': 'icagile.com', 'company': {'id': None, 'name': 'ICAgile', 'logo': 'https://media.licdn.com/dms/image/C4E0BAQFIpMBYCThKMQ/company-logo_400_400/0/1596209405253?e=1700697600&v=beta&t=uy9d-IV9LvRo7BJy37xvfXU_U8wvhwiG6Lx3OJV6WWE', 'url': None}}]",[],"[{'title': ""Joe Abercrombie's visit to Moscow and St. Petersburg"", 'date': {'start': {'month': 9, 'day': None, 'year': 2013}, 'end': {'month': 9, 'day': None, 'year': 2013}}, 'description': 'Organizing a visit of the bestselling British dark fantasy author Joe Abercrombie.\n\nResults:\nOver 250 visitors in St. Petersburg during the meeting in Bookvoed store. 100-200 visitors on every other event (Moscow International Book Fair, bookstore meetings, Everycon convention), few dozens of interviews and photoshoots by Russian media.\nAmount of author\'s books bought by retailers was doubled, extra prints of old ones were made. The first print of ""The Heroes"" in Russian was gone in 2 weeks, so the second print had to be made immediately.\n\nAuthor\'s comments on the visit:\nhttp://www.joeabercrombie.com/2013/09/17/back-from-russia/', 'contributors': [{'type': 'standardizedContributor', 'first_name': 'Maria', 'last_name': 'Pirson', 'name': None, 'headline': 'Market Researcher and Content Writer at Daedalean AI'}, {'type': 'standardizedContributor', 'first_name': 'Dmitriy', 'last_name': 'Chernikov', 'name': None, 'headline': 'Bespoke Tailor / Fashion & Luxury Communicator'}]}]","[{'name': 'Славой Жижек: «Не волнуйтесь, катастрофа обязательно произойдет»', 'publisher': 'Colta.Ru', 'url': 'http://archives.colta.ru/docs/5216', 'date': {'month': None, 'day': None, 'year': 2012}, 'authors': [{'type': 'standardizedContributor', 'first_name': 'Maria', 'last_name': 'Pirson', 'name': None, 'headline': 'Market Researcher and Content Writer at Daedalean AI'}]}]",[],[],"[{'company': {'id': 10999325, 'name': 'Daedalean AI', 'logo': 'https://media.licdn.com/dms/image/D4D0BAQEBfWqli5t7Rg/company-logo_400_400/0/1667160289981?e=1700697600&v=beta&t=I_9rrFWMHi3eBG-IaD9qR8s8cP4t6SRFVBe3m40RmJ4', 'url': 'https://www.linkedin.com/company/daedalean/', 'employees': {'start': 51, 'end': 200}}, 'date': {'start': {'month': 10, 'day': None, 'year': 2020}, 'end': {'month': None, 'day': None, 'year': None}}, 'profile_positions': [{'location': 'Zurich, Switzerland', 'date': {'start': {'month': 10, 'day': None, 'year': 2020}, 'end': {'month': None, 'day': None, 'year': None}}, 'company': 'Daedalean AI', 'description': None, 'title': 'Market Researcher and Content Writer ', 'employment_type': None}]}, {'company': {'id': None, 'name': 'Private Consultancy ', 'logo': None, 'url': None, 'employees': {'start': None, 'end': None}}, 'date': {'start': {'month': 1, 'day': None, 'year': 2017}, 'end': {'month': None, 'day': None, 'year': None}}, 'profile_positions': [{'location': 'Amsterdam Area, Netherlands', 'date': {'start': {'month': 1, 'day': None, 'year': 2017}, 'end': {'month': None, 'day': None, 'year': None}}, 'company': 'Private Consultancy ', 'description': None, 'title': 'Head Of Content and Organisational Consultant', 'employment_type': None}]}, {'company': {'id': None, 'name': 'Quby - outsmarting energy', 'logo': None, 'url': None, 'employees': {'start': None, 'end': None}}, 'date': {'start': {'month': 1, 'day': None, 'year': 2019}, 'end': {'month': 4, 'day': None, 'year': 2019}}, 'profile_positions': [{'location': 'Amsterdam Area, Netherlands', 'date': {'start': {'month': 1, 'day': None, 'year': 2019}, 'end': {'month': 4, 'day': None, 'year': 2019}}, 'company': 'Quby - outsmarting energy', 'description': '', 'title': 'Agile Coach (project-based)', 'employment_type': None}]}, {'company': {'id': None, 'name': 'Self-Employed', 'logo': None, 'url': None, 'employees': {'start': None, 'end': None}}, 'date': {'start': {'month': 1, 'day': None, 'year': 2004}, 'end': {'month': 1, 'day': None, 'year': 2019}}, 'profile_positions': [{'location': None, 'date': {'start': {'month': 1, 'day': None, 'year': 2004}, 'end': {'month': 1, 'day': None, 'year': 2019}}, 'company': 'Self-Employed', 'description': ""—\xa0Interpreted (both English to Russian and Russian to English) at hundreds of public events, highly specialized technical seminars and conferences, private negotiations. As an interpreter, worked in Russia, in numerous European countries including the UK, Germany, the Netherlands, and Switzerland, as well as in the US, India, and Brazil. \n—\xa0Facilitated business and government negotiations and business meetings, including on C-level\n— Developed and led workshops on effective business communication and negotiations based on interpreting techniques \n— Among my clients: Adam Smith Conferences, Christie's Auction House, KPMG, Coca Cola, United Nations, Moscow Domodedovo Airport, Skolkovo Innovation Centre, Russian Ministry of Defence, Russian Federal Customs Service, British Embassy in Russia, US Embassy in Russia, American Chamber of Commerce, The Banker, Rosneft, USAID\t\n—\xa0Held the post of Senior Interpreter at Moscow Domodedovo Airport during the IPO preparation process (2011), interpreted for the board of directors\n—\xa0For many years, managed teams of qualified translators and editors (English-Russian, Russian-English, German-Russian, German-English) and was the only point of contact between customers and the team. Was personally responsible for deadlines and quality control. Coordinated teamwork in large volume translations, including urgent orders."", 'title': 'Interpreter, Negotiation Facilitator (Russian, English, German)', 'employment_type': None}]}, {'company': {'id': 10882, 'name': 'DataArt', 'logo': 'https://media.licdn.com/dms/image/C4E0BAQGRi6OIlNQG8Q/company-logo_400_400/0/1519856519357?e=1700697600&v=beta&t=3YYrbpCJdnVO9hV5VGzETSnN2ZLIvj0i61y0s6iPMPs', 'url': 'https://www.linkedin.com/company/dataart/', 'employees': {'start': 5001, 'end': 10000}}, 'date': {'start': {'month': 9, 'day': None, 'year': 2017}, 'end': {'month': 12, 'day': None, 'year': 2018}}, 'profile_positions': [{'location': None, 'date': {'start': {'month': 9, 'day': None, 'year': 2017}, 'end': {'month': 12, 'day': None, 'year': 2018}}, 'company': 'DataArt', 'description': 'Wrote and edited dozens of marketing, technical and pre-sales documents, articles, white papers, market research reports and presentations in the fields including AI/ML, blockchain, Fintech, Insurtech, data management, and cloud technologies.\n \nAt DataArt, I worked with C-level executives, finance professionals, software developers, solution designers, marketing and sales teams, and data scientists.', 'title': 'Senior Content Marketing Specialist, Finance Practice', 'employment_type': None}]}, {'company': {'id': None, 'name': 'MDMA Creative Agency', 'logo': None, 'url': None, 'employees': {'start': None, 'end': None}}, 'date': {'start': {'month': 6, 'day': None, 'year': 2010}, 'end': {'month': 9, 'day': None, 'year': 2018}}, 'profile_positions': [{'location': 'Moscow, Russian Federation', 'date': {'start': {'month': 6, 'day': None, 'year': 2010}, 'end': {'month': 9, 'day': None, 'year': 2018}}, 'company': 'MDMA Creative Agency', 'description': 'Among the projects I worked on:\n— Helped to organize a large conference on cybersecurity (CyberCrimeCon 2016). Responsibilities included: managing language services; compiling list of relevant press contacts worldwide; corresponding with the journalists on the list (initially, cold e-mail); corresponding with invited experts, assisting them with logistics issues such as visas and tickets; composing, editing, and translating (from Russian into English) texts and presentations about the conference, including the website and a comprehensive follow-up report \n— Summarized the results of a long-term cybersecurity investigation initially presented as numerous highly technical reports, in the form of a longread article suitable for the publication in Forbes\n— Managed a team of 13 translators/analysts for a project on media content analysis. More than 2500 articles from twenty newspapers and magazines in five languages were processed in accordance with the established research procedure. Was personally responsible for finding and selecting analysts for the task, instructing them on all aspects of the project, both technical and otherwise, for the deadlines, and, in part, for formulating the final conclusions of the project', 'title': 'Senior Analyst, Assistant to Director (on a project basis)', 'employment_type': None}]}, {'company': {'id': 1385289, 'name': 'Webov and Knigin', 'logo': None, 'url': 'https://www.linkedin.com/company/webov-and-knigin/', 'employees': {'start': None, 'end': None}}, 'date': {'start': {'month': 9, 'day': None, 'year': 2010}, 'end': {'month': 2, 'day': None, 'year': 2011}}, 'profile_positions': [{'location': 'Moscow, Russian Federation', 'date': {'start': {'month': 9, 'day': None, 'year': 2010}, 'end': {'month': 2, 'day': None, 'year': 2011}}, 'company': 'Webov and Knigin', 'description': ""—\xa0Responsibilities were broad and included: market research, developing new ways to promote the company's services, negotiations with prospective partners and clients, creating adwords campaigns, overseeing web analytics, designing website wireframes, hiring new employees, managing outsourcers (software developers, designers, translators), etc.\n—\xa0Republished Tramway, a Russian illustrated magazine for children which initially was issued in 1990-1995, was made by most talented and wittiest authors and artists and was extremely popular with the whole generation. There were 5 books published by us (each included 12 monthly issues of the magazine, from 1990 to 1995, and a foreword written by the former Chief Editor, with memoirs how the magazine had been made). It became the company's signature project and brought it a lot of media attention. Over 50,000 copies were sold, with orders from the whole ex-Soviet Union and beyond.\t\n—\xa0Managed a fundraising translation project (a book of memoirs by an Argentinian-Russian author): designed a website for the project, was responsible for its promotion in social media, managed the translation and editing. \n— Published on paper Practice of Functional Programming, a magazine formerly existing only in electronic form. Negotiated with editors, organized the whole publishing process, led a promotion campaign among readers."", 'title': 'Director of Business Development', 'employment_type': None}]}, {'company': {'id': 39414, 'name': 'Noerr Stiefenhofer Lutz', 'logo': 'https://media.licdn.com/dms/image/D4E0BAQGwN1HxmgUJSA/company-logo_400_400/0/1689359057063?e=1700697600&v=beta&t=2IKcJx3KEDd2k54t7ZuazYQRoUCLrLuDNwiCuG9Q_4M', 'url': 'https://www.linkedin.com/company/noerr/', 'employees': {'start': 1001, 'end': 5000}}, 'date': {'start': {'month': 2, 'day': None, 'year': 2008}, 'end': {'month': 3, 'day': None, 'year': 2009}}, 'profile_positions': [{'location': None, 'date': {'start': {'month': 2, 'day': None, 'year': 2008}, 'end': {'month': 3, 'day': None, 'year': 2009}}, 'company': 'Noerr', 'description': '—\xa0Translated agreements, contracts, memorandums for clients, powers of attorney, and other documents in the areas of tax law, commercial law, corporate law, and copyright law\n—  Coordinated teamwork in cases of large volume translations. Was personally responsible for the final editing and processing of results: translation quality, consistency of terminology, meeting deadlines\n—  Interpreted for company executives at conferences and important events\n—  Assisted in the preparation of memorandums, legal research, the analysis of financial statements; assumed some paralegal responsibilities', 'title': 'Translator', 'employment_type': None}]}]","[{'date': {'start': {'month': 12, 'day': None, 'year': 2015}, 'end': {'month': None, 'day': None, 'year': None}}, 'role': 'Translator', 'company': {'id': None, 'name': 'Translators Without Borders', 'logo': None, 'url': None}, 'cause': 'HUMAN_RIGHTS', 'description': None}, {'date': {'start': {'month': 11, 'day': None, 'year': 2016}, 'end': {'month': 11, 'day': None, 'year': 2016}}, 'role': 'Volunteer', 'company': {'id': None, 'name': 'TEDx Amsterdam', 'logo': None, 'url': None}, 'cause': 'EDUCATION', 'description': None}]","['Qualitative Research', 'General Aviation', 'Agile Methodologies', 'Communication', 'Facilitation', 'Translation', 'Interpreting', 'Language Services', 'Analytical Skills', 'Linguistics', 'Multilingual', 'Foreign Languages', 'Proofreading', 'Editing', 'Content Marketing', 'Writing', 'Scrum', 'Kanban', 'Lean Six Sigma', 'JIRA']",,,
