profile_id,first_name,last_name,sub_title,profile_picture,background_image,profile_type,entity_urn,object_urn,birth_date,summary,location,premium,influencer,treasury_media,languages,industry,education,patents,awards,certifications,organizations,projects,publications,courses,test_scores,position_groups,volunteer_experiences,skills,network_info,related_profiles,contact_info
saskia-bergsvoort-3b7b778b,Saskia,Bergsvoort,Executive Assistant to SVP and General Manager EMEAR at Here Technologies,https://media.licdn.com/dms/image/C4E03AQHqW5SN4JhGqw/profile-displayphoto-shrink_800_800/0/1629145282681?e=1697673600&v=beta&t=llqS8UiiCuGZiBvGWBORcrVU0Zep-G26131ORc4F8-g,,personal,ACoAABM3XHsBxfQJmAjzlnjT1Fp_Zf6QoeHi_8Y,322395259,,"Experienced Executive & Personal Assistant with Project and Event Management and Leadership skills:

Executive & Personal Assistant to the Senior Vice President.

Manager of the Executive Administration department (cross channel team, Direct & Digital & Contract Europe), managing and motivating a team consisting of one Executive Assistant and one Management Assistant. 

Project & Event Management: gathering funds for various project & events (vendor conferences, sales kick off meetings, internal projects. 

Acting as a liaison for customers, shareholders, vendors, executives, managers, staff and Dutch works council.

Significant qualities: Thinking outside the box, good organisational and people skills, business acumen, result-driven, flexible, no 9 - 5 mentality, welcomes a challenge.

Specialism: executive support, project and event management, leadership.","{'country': 'Netherlands', 'short': 'Eindhoven, North Brabant', 'city': 'Eindhoven', 'state': 'North Brabant', 'default': 'Eindhoven, North Brabant, Netherlands'}",False,False,[],"{'primary_locale': {'country': 'NL', 'language': 'nl'}, 'supported_locales': [{'country': 'NL', 'language': 'nl'}, {'country': 'US', 'language': 'en'}], 'profile_languages': []}",Information Technology & Services,"[{'date': {'start': {'month': None, 'day': None, 'year': None}, 'end': {'month': None, 'day': None, 'year': None}}, 'school': {'name': 'HES Amsterdam', 'logo': None, 'url': None}, 'degree_name': None, 'field_of_study': 'HEAO International business and languages'}, {'date': {'start': {'month': None, 'day': None, 'year': None}, 'end': {'month': None, 'day': None, 'year': None}}, 'school': {'name': 'NCATB training & Advisory Group', 'logo': None, 'url': None}, 'degree_name': None, 'field_of_study': 'Management support & Project Management'}, {'date': {'start': {'month': None, 'day': None, 'year': None}, 'end': {'month': None, 'day': None, 'year': None}}, 'school': {'name': 'Montessori Lyceum Amsterdam', 'logo': None, 'url': None}, 'degree_name': None, 'field_of_study': 'HAVO'}]",[],[],[],[],"[{'title': 'Office Depot Sales Kick off 2013/2014 & Office Depot Vendor Conference 2015/2016', 'date': {'start': {'month': 1, 'day': None, 'year': 2013}, 'end': {'month': 10, 'day': None, 'year': 2016}}, 'description': None, 'contributors': [{'type': 'standardizedContributor', 'first_name': 'Saskia', 'last_name': 'Bergsvoort', 'name': None, 'headline': 'Executive Assistant to SVP and General Manager EMEAR at Here Technologies'}]}]",[],"[{'name': 'Performance Management', 'number': None}]",[],"[{'company': {'id': 3237134, 'name': 'HERE Technologies', 'logo': 'https://media.licdn.com/dms/image/C4D0BAQGKyaQjPgF-5g/company-logo_400_400/0/1626073646378?e=1700697600&v=beta&t=kUse9kqsbVHjzhdtT6aebLnolfeYOCWogo-gDF29-Rg', 'url': 'https://www.linkedin.com/company/here/', 'employees': {'start': 5001, 'end': 10000}}, 'date': {'start': {'month': 12, 'day': None, 'year': 2021}, 'end': {'month': None, 'day': None, 'year': None}}, 'profile_positions': [{'location': 'Eindhoven, Noord-Brabant, Nederland', 'date': {'start': {'month': 11, 'day': None, 'year': 2022}, 'end': {'month': None, 'day': None, 'year': None}}, 'company': 'HERE Technologies', 'description': None, 'title': 'Executive Assistant to VP Global Sales Operations at Here Technologies', 'employment_type': None}, {'location': 'Eindhoven en omgeving', 'date': {'start': {'month': 12, 'day': None, 'year': 2021}, 'end': {'month': 11, 'day': None, 'year': 2022}}, 'company': 'HERE Technologies', 'description': 'All your location data and software in one platform; www.here.com', 'title': 'Executive Assistant to SVP and General Manager EMEAR at Here Technologies', 'employment_type': 'Full-time'}]}, {'company': {'id': None, 'name': 'Office Depot International B.V.', 'logo': None, 'url': None, 'employees': {'start': None, 'end': None}}, 'date': {'start': {'month': 3, 'day': None, 'year': 2011}, 'end': {'month': 8, 'day': None, 'year': 2021}}, 'profile_positions': [{'location': 'Venlo', 'date': {'start': {'month': 3, 'day': None, 'year': 2011}, 'end': {'month': 8, 'day': None, 'year': 2021}}, 'company': 'Office Depot International B.V.', 'description': '• Manager of the cross channel Executive Administration department. \n• Consolidating weekly and monthly finance reports.\n• Calendar and mailbox management, on behalf of the senior executive.\n• Coordinating corporate events.\n• Consolidating PowerPoint presentations for business review meetings.\n• Project Management: gathering funds for the project, technical coordination and validation of \n deliverables. \n• Communication: undertaking both written and verbal communications \n on behalf of the senior executive.\n• Responsible for the follow up of action points in various management meetings. \n• Supporting the Management & Dutch Works Council.\n• Member of Steering Committee for international sales management meetings & vendor conferences.\n• Implementation of Oracle Cloud 9; Training the business, on site live support for several departments (marketing, transportation, facilities).', 'title': 'Executive & Personal Assistant/Project & Event Management', 'employment_type': None}]}, {'company': {'id': None, 'name': 'Office Depot Europe B.V.', 'logo': None, 'url': None, 'employees': {'start': None, 'end': None}}, 'date': {'start': {'month': 7, 'day': None, 'year': 2009}, 'end': {'month': 2, 'day': None, 'year': 2011}}, 'profile_positions': [{'location': 'Venlo', 'date': {'start': {'month': 7, 'day': None, 'year': 2009}, 'end': {'month': 2, 'day': None, 'year': 2011}}, 'company': 'Office Depot Europe B.V.', 'description': None, 'title': 'Executive Assistant New Markets Strategy & Sales Support Europe & Finance Europe', 'employment_type': None}]}, {'company': {'id': None, 'name': 'Tebodin', 'logo': None, 'url': None, 'employees': {'start': None, 'end': None}}, 'date': {'start': {'month': 6, 'day': None, 'year': 2008}, 'end': {'month': 5, 'day': None, 'year': 2009}}, 'profile_positions': [{'location': 'Eindhoven', 'date': {'start': {'month': 6, 'day': None, 'year': 2008}, 'end': {'month': 5, 'day': None, 'year': 2009}}, 'company': 'Tebodin', 'description': None, 'title': 'Office Manager', 'employment_type': None}]}, {'company': {'id': None, 'name': 'Copaco', 'logo': None, 'url': None, 'employees': {'start': None, 'end': None}}, 'date': {'start': {'month': 6, 'day': None, 'year': 2007}, 'end': {'month': 5, 'day': None, 'year': 2008}}, 'profile_positions': [{'location': 'Eindhoven', 'date': {'start': {'month': 6, 'day': None, 'year': 2007}, 'end': {'month': 5, 'day': None, 'year': 2008}}, 'company': 'Copaco', 'description': None, 'title': 'Executive Assistant', 'employment_type': None}]}, {'company': {'id': None, 'name': 'Royal Numico', 'logo': None, 'url': None, 'employees': {'start': None, 'end': None}}, 'date': {'start': {'month': 10, 'day': None, 'year': 2006}, 'end': {'month': 5, 'day': None, 'year': 2007}}, 'profile_positions': [{'location': 'Amsterdam', 'date': {'start': {'month': 10, 'day': None, 'year': 2006}, 'end': {'month': 5, 'day': None, 'year': 2007}}, 'company': 'Royal Numico', 'description': None, 'title': 'Management Development Assistant HR', 'employment_type': None}]}, {'company': {'id': None, 'name': 'KPMG', 'logo': None, 'url': None, 'employees': {'start': None, 'end': None}}, 'date': {'start': {'month': 10, 'day': None, 'year': 2005}, 'end': {'month': 9, 'day': None, 'year': 2006}}, 'profile_positions': [{'location': 'Amsterdam', 'date': {'start': {'month': 10, 'day': None, 'year': 2005}, 'end': {'month': 9, 'day': None, 'year': 2006}}, 'company': 'KPMG', 'description': None, 'title': 'Personal Assistant to President Financial Services.', 'employment_type': None}]}, {'company': {'id': None, 'name': 'Randstad', 'logo': None, 'url': None, 'employees': {'start': None, 'end': None}}, 'date': {'start': {'month': 8, 'day': None, 'year': 1999}, 'end': {'month': 9, 'day': None, 'year': 2005}}, 'profile_positions': [{'location': 'Amsterdam', 'date': {'start': {'month': 8, 'day': None, 'year': 1999}, 'end': {'month': 9, 'day': None, 'year': 2005}}, 'company': 'Randstad', 'description': 'Various interim assignments at Heineken, Philips, ABN AMRO, IBM.', 'title': 'Support professional', 'employment_type': None}]}]",[],"['Project Management', 'Event Management', 'Executive Support']",,,
