profile_id,first_name,last_name,sub_title,profile_picture,background_image,profile_type,entity_urn,object_urn,birth_date,summary,location,premium,influencer,treasury_media,languages,industry,education,patents,awards,certifications,organizations,projects,publications,courses,test_scores,position_groups,volunteer_experiences,skills,network_info,related_profiles,contact_info
ashwindwarkasing,Ashwin,Dwarkasing,International Dutch & US Tax Consultant @ onestopTaxPrep,https://media.licdn.com/dms/image/C4E03AQFv0-Al9avICA/profile-displayphoto-shrink_800_800/0/1516271730924?e=1697673600&v=beta&t=b7LnuS_M_e1u9ot4I4KcfH8LK6n9saqHuD2GxqDbHTg,,personal,ACoAAACAl7oBAPgh9QaGpzEqn43UkBsPgHDEQks,8427450,,"Over 11 years experience in providing international Dutch and US tax assistance to individuals. 

Started in 1998 at PwC assisting fortune 500 multinationals with their international assignees to the Netherlands, advising on and later setting-up assignment policies, tax equalization calculations and Dutch income tax returns. In 1999 started specializing in US nationals by preparing US tax returns and later advising on US tax related matters. In later years my focus was entirely on dual handling of Dutch and US tax affairs for US employees of multinationals and high profile US citizens in The Netherlands. 

Looking for a more personal approach to tax preparation, I joined TaXpat from January 1, 2005 to December 31, 2008 focusing more on individual clients rather than multinationals. In this respect fully assisting and advising clients on personal tax planning and tax preparation instead of short term assignment assistance. 

In 2009 started onestopTax and subsidiary onestopTaxPrep applying a new business model with a fee structure, which allows for more flexibility and higher service levels and increased personalized service

Specialties: Specialist in both Dutch and US Income Taxation for Individuals.","{'country': 'Netherlands', 'short': 'Amsterdam, North Holland', 'city': 'Amsterdam', 'state': 'North Holland', 'default': 'Amsterdam, North Holland, Netherlands'}",False,False,[],"{'primary_locale': {'country': 'US', 'language': 'en'}, 'supported_locales': [{'country': 'US', 'language': 'en'}, {'country': 'NL', 'language': 'nl'}], 'profile_languages': []}",Legal Services,"[{'date': {'start': {'month': None, 'day': None, 'year': 2000}, 'end': {'month': None, 'day': None, 'year': 2003}}, 'school': {'name': 'University of Amsterdam', 'logo': 'https://media.licdn.com/dms/image/C4E0BAQEfHBj_we-_kw/company-logo_400_400/0/1659945104460?e=1700697600&v=beta&t=k8egLWP3eIqIloLFULSmlLPZQR7cvpzTKHpzgtnWaBI', 'url': 'https://www.linkedin.com/school/university-of-amsterdam/'}, 'degree_name': None, 'field_of_study': 'Dutch Tax Law'}, {'date': {'start': {'month': None, 'day': None, 'year': 1995}, 'end': {'month': None, 'day': None, 'year': 1998}}, 'school': {'name': 'Inholland University of Applied Sciences', 'logo': 'https://media.licdn.com/dms/image/C4E0BAQF4kRIPNGd2sw/company-logo_400_400/0/1677156028522?e=1700697600&v=beta&t=7ThjhGwOCWZ9SlS8ceEVNxGD7Xe6XHi-SUVE_r_yyt0', 'url': 'https://www.linkedin.com/school/hogeschool-inholland/'}, 'degree_name': None, 'field_of_study': 'HR-Management'}, {'date': {'start': {'month': None, 'day': None, 'year': 1995}, 'end': {'month': None, 'day': None, 'year': 1998}}, 'school': {'name': 'Inholland University of Applied Sciences', 'logo': 'https://media.licdn.com/dms/image/C4E0BAQF4kRIPNGd2sw/company-logo_400_400/0/1677156028522?e=1700697600&v=beta&t=7ThjhGwOCWZ9SlS8ceEVNxGD7Xe6XHi-SUVE_r_yyt0', 'url': 'https://www.linkedin.com/school/hogeschool-inholland/'}, 'degree_name': None, 'field_of_study': 'Business law'}, {'date': {'start': {'month': None, 'day': None, 'year': 1993}, 'end': {'month': None, 'day': None, 'year': 1995}}, 'school': {'name': 'University of Amsterdam', 'logo': 'https://media.licdn.com/dms/image/C4E0BAQEfHBj_we-_kw/company-logo_400_400/0/1659945104460?e=1700697600&v=beta&t=k8egLWP3eIqIloLFULSmlLPZQR7cvpzTKHpzgtnWaBI', 'url': 'https://www.linkedin.com/school/university-of-amsterdam/'}, 'degree_name': None, 'field_of_study': 'Economics'}, {'date': {'start': {'month': None, 'day': None, 'year': 1985}, 'end': {'month': None, 'day': None, 'year': 1991}}, 'school': {'name': 'Spinoza Lyceum', 'logo': None, 'url': None}, 'degree_name': None, 'field_of_study': None}, {'date': {'start': {'month': None, 'day': None, 'year': None}, 'end': {'month': None, 'day': None, 'year': None}}, 'school': {'name': 'US Internal Revenue Service', 'logo': None, 'url': None}, 'degree_name': 'Enrolled Agent', 'field_of_study': 'US Taxation'}]",[],[],[],[],[],[],[],[],"[{'company': {'id': 278195, 'name': 'onestopTaxPrep', 'logo': None, 'url': 'https://www.linkedin.com/company/onestoptaxprep/', 'employees': {'start': 2, 'end': 10}}, 'date': {'start': {'month': 1, 'day': None, 'year': 2009}, 'end': {'month': None, 'day': None, 'year': None}}, 'profile_positions': [{'location': 'Amsterdam Area, Netherlands', 'date': {'start': {'month': 1, 'day': None, 'year': 2009}, 'end': {'month': None, 'day': None, 'year': None}}, 'company': 'onestopTaxPrep', 'description': 'Dutch and US Tax preparation services for expats and US nationals living and working in The Netherlands', 'title': 'Int. Dutch / US Income Tax Specialist', 'employment_type': None}]}, {'company': {'id': None, 'name': 'TaXpat', 'logo': None, 'url': None, 'employees': {'start': None, 'end': None}}, 'date': {'start': {'month': 1, 'day': None, 'year': 2005}, 'end': {'month': 12, 'day': None, 'year': 2008}}, 'profile_positions': [{'location': None, 'date': {'start': {'month': 1, 'day': None, 'year': 2005}, 'end': {'month': 12, 'day': None, 'year': 2008}}, 'company': 'TaXpat', 'description': 'Providing both Dutch and US income tax advice and service to individuals and expats living in the Netherlands or on assignment to the USA; Dutch and US income tax returns, Dutch and US tax advice.', 'title': 'Int. Dutch / USA income tax specialist', 'employment_type': None}]}, {'company': {'id': 1044, 'name': 'PricewaterhouseCoopers', 'logo': 'https://media.licdn.com/dms/image/D4D0BAQGv_22548SaOQ/company-logo_400_400/0/1689197046877?e=1700697600&v=beta&t=ExPap1fji47kUzWW6Ci2VT3UwRDJfap4xCJPT4J8ZOc', 'url': 'https://www.linkedin.com/company/pwc/', 'employees': {'start': 10001, 'end': None}}, 'date': {'start': {'month': 10, 'day': None, 'year': 1998}, 'end': {'month': 12, 'day': None, 'year': 2004}}, 'profile_positions': [{'location': None, 'date': {'start': {'month': 10, 'day': None, 'year': 1998}, 'end': {'month': 12, 'day': None, 'year': 2004}}, 'company': 'PwC', 'description': 'Providing Dutch / USA income tax related services to expats in the Netherlands and / or companies with expats; Dutch and US income tax returns, expat policies, assignment structuring', 'title': 'Int. Dutch / USA income tax specialist', 'employment_type': None}]}]",[],"['International Tax', 'Expatriate Tax', 'Expatriate Management', 'Tax Returns', 'Dutch', 'Income Tax', 'New Business Development', 'Tax', 'Tax Law', 'US Tax', 'Payroll']",,,
