profile_id,first_name,last_name,sub_title,profile_picture,background_image,profile_type,entity_urn,object_urn,birth_date,summary,location,premium,influencer,treasury_media,languages,industry,education,patents,awards,certifications,organizations,projects,publications,courses,test_scores,position_groups,volunteer_experiences,skills,network_info,related_profiles,contact_info
dr-victor-katoma-6b34194,Dr Victor,Katoma,Senior Lecturer,,,personal,ACoAAADGAacBJvwzwq8dU16Ekc6OQE0SGGu3OrU,12976551,,"Victor joined the University of Cape Town’in 2007. He then worked for Shell international in the Netherlands as Research Statistical analyst responsible for business mathematical modeling in the Knowledge Management Department. His research involves dynamic business modeling, including multilevel structural equation modeling, linear and non-linear interactive class modeling and latent growth curves. Past research endeavors included publications to repuatble journals (SACLA, IEEE and ICEL) on knowledge management systems models and inference. 

Currently, apart from providing lectures in Functional Analysis and Mathematical Methods much of the work is focused on measure theories, in sigma algebras. It is anticipated that special fields and operational theories could be an effective way to induce synergy between far spaced domains, henceforth speeding up conversion of theory into practice.       

Other research interests include, statistical inference in business processes, probability theories as applied to business modeling, knowledge management systems models, and e-Business Strategy. 


Other vested interests include applications of Mathematical modeling in business and inference; using Atlas ti in qualitative consultancy and research. 

From  mathematics to computing and modeling ""business"", it has all been trying to see what is transitory in what is permanent and what is permanent in what is transitory. Once some levels of mastery is obtained, we can then be more certain in isolating and applying our specific reasons to specific areas of need!","{'country': 'Netherlands', 'short': 'The Hague, South Holland', 'city': 'The Hague', 'state': 'South Holland', 'default': 'The Hague, South Holland, Netherlands'}",False,False,[],"{'primary_locale': {'country': 'US', 'language': 'en'}, 'supported_locales': [{'country': 'US', 'language': 'en'}], 'profile_languages': []}",Higher Education,"[{'date': {'start': {'month': None, 'day': None, 'year': 2006}, 'end': {'month': None, 'day': None, 'year': 2009}}, 'school': {'name': 'University of Cape Town', 'logo': 'https://media.licdn.com/dms/image/C560BAQEFCqoOrVEFCA/company-logo_400_400/0/1519856479029?e=1700092800&v=beta&t=3rwmqsPizYKkn9eQCw_aa4Gm5vU9EXRdG5gNNTdBjzQ', 'url': 'https://www.linkedin.com/school/university-of-cape-town/'}, 'degree_name': 'Doctorate', 'field_of_study': 'Math Modeling and Business'}, {'date': {'start': {'month': None, 'day': None, 'year': 2003}, 'end': {'month': None, 'day': None, 'year': 2006}}, 'school': {'name': 'University of Cape Town', 'logo': 'https://media.licdn.com/dms/image/C560BAQEFCqoOrVEFCA/company-logo_400_400/0/1519856479029?e=1700092800&v=beta&t=3rwmqsPizYKkn9eQCw_aa4Gm5vU9EXRdG5gNNTdBjzQ', 'url': 'https://www.linkedin.com/school/university-of-cape-town/'}, 'degree_name': 'Msc', 'field_of_study': 'Comp and Math Modeling ""Knowledge Management Systems and Inference""'}, {'date': {'start': {'month': None, 'day': None, 'year': 1994}, 'end': {'month': None, 'day': None, 'year': 1998}}, 'school': {'name': 'University of Zambia', 'logo': None, 'url': None}, 'degree_name': 'BSc(Hones)', 'field_of_study': 'Pure and Computational Mathematics'}, {'date': {'start': {'month': None, 'day': None, 'year': None}, 'end': {'month': None, 'day': None, 'year': None}}, 'school': {'name': 'Shell Open University Netherlands', 'logo': None, 'url': None}, 'degree_name': None, 'field_of_study': 'Stractural Equation Modeling'}]",[],[],[],[],[],[],[],[],"[{'company': {'id': None, 'name': 'University in Namibia', 'logo': None, 'url': None, 'employees': {'start': None, 'end': None}}, 'date': {'start': {'month': 2, 'day': None, 'year': 2010}, 'end': {'month': None, 'day': None, 'year': None}}, 'profile_positions': [{'location': 'Namibia University of Science and Technology', 'date': {'start': {'month': 2, 'day': None, 'year': 2010}, 'end': {'month': None, 'day': None, 'year': None}}, 'company': 'University in Namibia', 'description': 'Lecturing: Numerical Analysis, Differential Equations, Functional Analysis, Complex Analysis and Financial Mathematics', 'title': 'Senior Lecturer Mathematics', 'employment_type': None}]}, {'company': {'id': None, 'name': 'Namibia University of Technology', 'logo': None, 'url': None, 'employees': {'start': None, 'end': None}}, 'date': {'start': {'month': None, 'day': None, 'year': 2010}, 'end': {'month': None, 'day': None, 'year': None}}, 'profile_positions': [{'location': 'Windhoek', 'date': {'start': {'month': None, 'day': None, 'year': 2010}, 'end': {'month': None, 'day': None, 'year': None}}, 'company': 'Namibia University of Technology', 'description': None, 'title': 'Senior Lecturer and Associate Dean: Faculty of Health and Applied Sciences', 'employment_type': None}]}, {'company': {'id': 1271, 'name': 'Shell', 'logo': 'https://media.licdn.com/dms/image/C4D0BAQGN30g7aSl4NA/company-logo_400_400/0/1519856218579?e=1700092800&v=beta&t=HqIwwLBNmVKkXXiXnFVRbQwTX34PBz5TB2QZhtR3btU', 'url': 'https://www.linkedin.com/company/shell/', 'employees': {'start': 10001, 'end': None}}, 'date': {'start': {'month': 5, 'day': None, 'year': 2007}, 'end': {'month': None, 'day': None, 'year': None}}, 'profile_positions': [{'location': None, 'date': {'start': {'month': 5, 'day': None, 'year': 2007}, 'end': {'month': None, 'day': None, 'year': None}}, 'company': 'Shell', 'description': 'Working in Knowledge Management as an analyst, developing Models based on the computer KM system usege networks and user.', 'title': 'Research Statistical Analyst', 'employment_type': None}]}, {'company': {'id': 7936, 'name': 'University of Cape Town', 'logo': 'https://media.licdn.com/dms/image/C560BAQEFCqoOrVEFCA/company-logo_400_400/0/1519856479029?e=1700092800&v=beta&t=3rwmqsPizYKkn9eQCw_aa4Gm5vU9EXRdG5gNNTdBjzQ', 'url': 'https://www.linkedin.com/school/university-of-cape-town/', 'employees': {'start': 1001, 'end': 5000}}, 'date': {'start': {'month': 2, 'day': None, 'year': 2003}, 'end': {'month': 2, 'day': None, 'year': 2007}}, 'profile_positions': [{'location': None, 'date': {'start': {'month': 2, 'day': None, 'year': 2003}, 'end': {'month': 2, 'day': None, 'year': 2007}}, 'company': 'University of Cape Town', 'description': 'Managing tutorials, marking of assignments and tests, cordinating any work relating to the general running of second year programming and software engineering courses.', 'title': 'Teaching Associate', 'employment_type': None}]}, {'company': {'id': None, 'name': 'University of Botswana', 'logo': None, 'url': None, 'employees': {'start': None, 'end': None}}, 'date': {'start': {'month': 1, 'day': None, 'year': 2001}, 'end': {'month': 1, 'day': None, 'year': 2003}}, 'profile_positions': [{'location': None, 'date': {'start': {'month': 1, 'day': None, 'year': 2001}, 'end': {'month': 1, 'day': None, 'year': 2003}}, 'company': 'University of Botswana', 'description': 'demonstrating the use of statistical packages, marking and grading of assignments, preparing tutorials.', 'title': 'Assistant Lectrure', 'employment_type': None}]}]",[],"['Systems Analysis', 'E-Learning', 'Statistics', 'Software Engineering', 'Instructional Design', 'Mathematical Modeling', 'Research', 'Databases', 'Numerical Analysis', 'SQL', 'Matlab', 'Programming', 'Lecturing', 'Knowledge Management', 'Management', 'Analysis', 'Strategic Planning', 'Team Leadership', 'Project Management', 'System Administration']",,,
