profile_id,first_name,last_name,sub_title,profile_picture,background_image,profile_type,entity_urn,object_urn,birth_date,summary,location,premium,influencer,treasury_media,languages,industry,education,patents,awards,certifications,organizations,projects,publications,courses,test_scores,position_groups,volunteer_experiences,skills,network_info,related_profiles,contact_info
carolinareydiaz,Carolina,Rey,MBA Rotterdam School of Management RSM | Project Director | Financial Consultant | Banking Specialist,https://media.licdn.com/dms/image/C4E03AQGG3tbDPMkBTw/profile-displayphoto-shrink_800_800/0/1562195145959?e=1697673600&v=beta&t=5keTLG9xk0MSCrGoMCSgjZ8fS4-JqmgUb8ohTTZiqxs,,personal,ACoAABN0EHYBlh8qSk6_IslSYPShP4KTqy3KptI,326373494,,"With +16 years of professional experience in financial and development sectors, I am passioned and committed to improve people`s quality of life through my strategical and critical thinking  

Experience with origination, structuring, advising, negotiation, assessment, facilitating and funding public & private project transactions. Expert in infrastructure projects, PPPs, mixed structures and public sector participation in LATAM. Experienced in controlling and managing complex, detailed, large and multilevel different projects / investments at the same time. Practice with cross functional, cross regional, with high technical knowledge, and publicly sensitive investments. Directed pioneer health PPP in Colombia. Knowledge and track record acting as Director of Public Sectors from the risk side. Supported Investment Banking public & private transactions from origination phase until execution. Experience structuring feasible and bankable infrastructure projects.

Large experience analysing markets and financials, modelling, assessing risks, supervising and presenting project investments with different audiences. Collecting vast experience and knowledge in financing projects (public & private) working with Corporate, Public, Treasury, Project, and Trade Finance Banking. Knowledge of critical credit topics as sovereign risk, country risk, treasury credit-risk operations and financial sector assessment. Experience participating in risk, credit, investment and project committees local and internationally. 

Good at aligning stakeholders and participants interests. Helicopter view integrating different roles into relations and transactions. Skilled at interacting with organizations and actors to mobilize efforts, including C-level and managers. Current and past experience developing institutional relations with a commercial focus. Track record in business development, pipeline generation, manage public & private clients. Track record in supporting and coordinating cross-cultural / functional teams (+100 people), administrating resources and achieving objectives and goals.","{'country': 'Netherlands', 'short': 'Rotterdam, South Holland', 'city': 'Rotterdam', 'state': 'South Holland', 'default': 'Rotterdam, South Holland, Netherlands'}",False,False,"[{'url': None, 'title': 'CV (english)', 'description': '', 'image': 'https://media.licdn.com/dms/image/C562DAQFZUFM3emrCaA/profile-treasury-document-cover-images_1920/0/1584130733379?e=1692954000&v=beta&t=IMmQ24wZGoN-buwtMl-EwVnxnRc9HG54o59HptfMzV4'}]","{'primary_locale': {'country': 'ES', 'language': 'es'}, 'supported_locales': [{'country': 'ES', 'language': 'es'}, {'country': 'US', 'language': 'en'}], 'profile_languages': [{'name': 'Español', 'proficiency': 'NATIVE_OR_BILINGUAL'}, {'name': 'Francés', 'proficiency': 'ELEMENTARY'}, {'name': 'Inglés', 'proficiency': 'FULL_PROFESSIONAL'}, {'name': 'Portugués', 'proficiency': 'ELEMENTARY'}]}",Financial Services,"[{'date': {'start': {'month': None, 'day': None, 'year': 2019}, 'end': {'month': None, 'day': None, 'year': 2020}}, 'school': {'name': 'Rotterdam School of Management, Erasmus University', 'logo': 'https://media.licdn.com/dms/image/C4E0BAQGxI95CurHtdA/company-logo_400_400/0/1657183585803/rotterdam_school_of_management_erasmus_university_logo?e=1700697600&v=beta&t=0GusBmbz_Dde2vBx2mXvkfaW0pV98sMXZUNXHKKsMK4', 'url': 'https://www.linkedin.com/school/rotterdam-school-of-management-erasmus-university/'}, 'degree_name': 'Master in Business Administration', 'field_of_study': 'Candidate'}, {'date': {'start': {'month': None, 'day': None, 'year': 2017}, 'end': {'month': None, 'day': None, 'year': 2017}}, 'school': {'name': 'IE Business School', 'logo': 'https://media.licdn.com/dms/image/C4D0BAQGvE_Hi22X6lQ/company-logo_400_400/0/1663153932290/ie_business_school_logo?e=1700697600&v=beta&t=7P5RfgQpEGXsr1Ir93rHKOR5boojiZ2srMoLhgpyGPQ', 'url': 'https://www.linkedin.com/school/ie-business-school/'}, 'degree_name': 'Management in Public Private Partnerships ', 'field_of_study': None}, {'date': {'start': {'month': None, 'day': None, 'year': 2017}, 'end': {'month': None, 'day': None, 'year': 2017}}, 'school': {'name': 'INALDE Business School', 'logo': 'https://media.licdn.com/dms/image/C4E0BAQHyFZghcmeHbA/company-logo_400_400/0/1630563560272/inalde_business_school_logo?e=1700697600&v=beta&t=-LPe6XEjnEU6MZwjhJXgmxE_L0Kx6fJsa93G2PIfk3g', 'url': 'https://www.linkedin.com/school/inalde-business-school/'}, 'degree_name': 'Programme in Leadership ', 'field_of_study': None}, {'date': {'start': {'month': None, 'day': None, 'year': 2015}, 'end': {'month': None, 'day': None, 'year': 2015}}, 'school': {'name': 'Universidad de Los Andes', 'logo': 'https://media.licdn.com/dms/image/C510BAQEO0I5nIlsnpg/company-logo_400_400/0/1631308924640?e=1700697600&v=beta&t=Xo42KINDBwGJRtZuYaDoGbrLpOwOE-c_8vGjZmZm1QU', 'url': 'https://www.linkedin.com/school/universidad-de-los-andes/'}, 'degree_name': 'Diplomado en Project Finance', 'field_of_study': None}, {'date': {'start': {'month': None, 'day': None, 'year': 2005}, 'end': {'month': None, 'day': None, 'year': 2005}}, 'school': {'name': 'CESA', 'logo': 'https://media.licdn.com/dms/image/C4E0BAQEEu_mVsKhbrQ/company-logo_400_400/0/1630638098428/cesa_colegio_de_estudios_superiores_de_administracion_logo?e=1700697600&v=beta&t=INeOJwnRALVwdAiEik0GArMe8YlPxRyXYQnjPj_jUWc', 'url': 'https://www.linkedin.com/school/cesa-edu/'}, 'degree_name': 'Specialist in Stockmarket Operation ', 'field_of_study': None}, {'date': {'start': {'month': None, 'day': None, 'year': 1997}, 'end': {'month': None, 'day': None, 'year': 2001}}, 'school': {'name': 'Universidad Externado de Colombia', 'logo': 'https://media.licdn.com/dms/image/C560BAQFatn9VKxffZQ/company-logo_400_400/0/1648153000253/universidad_externado_de_colombia_logo?e=1700697600&v=beta&t=ujR-tS08UkeOr8g9qmrfcKRfHcazXqDQduKTDjwTEOs', 'url': 'https://www.linkedin.com/school/universidad-externado-de-colombia/'}, 'degree_name': 'Bachelor in Finance and International Relations', 'field_of_study': None}]",[],[],"[{'name': 'Certified PPP - Public Private Partnership Professional ', 'date': {'start': {'month': 10, 'day': None, 'year': 2018}, 'end': {'month': None, 'day': None, 'year': None}}, 'authority': 'The World Bank', 'url': None, 'license_number': None, 'display_source': None, 'company': {'id': None, 'name': 'The World Bank', 'logo': 'https://media.licdn.com/dms/image/C560BAQHaSQcYJGhexg/company-logo_400_400/0/1631316663649?e=1700697600&v=beta&t=QiuqTlYlrunc6TG1ReMslL-UT2R5hC7vinVvSFDKcbQ', 'url': None}}, {'name': 'Cambridge Advanced in English - CAE', 'date': {'start': {'month': 12, 'day': None, 'year': 2013}, 'end': {'month': None, 'day': None, 'year': None}}, 'authority': 'University of Cambridge', 'url': None, 'license_number': None, 'display_source': None, 'company': {'id': None, 'name': 'University of Cambridge', 'logo': 'https://media.licdn.com/dms/image/C4E0BAQGLqHVOwtQeUQ/company-logo_400_400/0/1663833279033/university_of_cambridge_logo?e=1700697600&v=beta&t=16PdoiUUYlZwRuKaeMJRjVNFydWwK2D7FicejGGid5o', 'url': None}}, {'name': 'Diplome de Francais Pratique', 'date': {'start': {'month': 12, 'day': None, 'year': 2000}, 'end': {'month': None, 'day': None, 'year': None}}, 'authority': 'LAlliance Francaise en Colombie', 'url': None, 'license_number': None, 'display_source': None, 'company': None}]","[{'name': 'BBVA Bank (Spain)', 'position': 'Global Managerial Trainee Programme - 2009', 'date_start': None, 'date_end': None}, {'name': 'Granahorrar Bank ', 'position': 'Banking Training Programme - 2002', 'date_start': None, 'date_end': None}]",[],[],"[{'name': 'Academic Year Advanced English - European English Centre (Malta) - 2011-2012', 'number': None}, {'name': 'English as Foreign Language - South Thames College (UK) - 2013', 'number': None}]",[],"[{'company': {'id': 1391834, 'name': 'TEQUENDAMA SOCIETY - Infrastructure & project developer', 'logo': 'https://media.licdn.com/dms/image/C560BAQFrb3jnRoUxKw/company-logo_400_400/0/1631369939178?e=1700697600&v=beta&t=UO2Iyx97urN6Qm1p9dTl51T6WHuj55a7wKuIlJlZM0Y', 'url': 'https://www.linkedin.com/company/sociedad-hotelera-tequendama-s.a./', 'employees': {'start': 0, 'end': 1}}, 'date': {'start': {'month': 7, 'day': None, 'year': 2021}, 'end': {'month': None, 'day': None, 'year': None}}, 'profile_positions': [{'location': None, 'date': {'start': {'month': 7, 'day': None, 'year': 2021}, 'end': {'month': None, 'day': None, 'year': None}}, 'company': 'Sociedad Hotelera Tequendama S.A.', 'description': '- Design and manage the institutional and Infrastructure Department business development plan\n- Collaborate enhancing and developing the New Businesses Unit\n- Coo-lead generation and incubation of projects and new businesses to be developed company-inside and inter Group companies  \n- Develop current clients, markets, and products, finding opportunities inside 18 companies in the Group. Deal with public and private clients and stakeholders\n- Coordinate and support operational, strategic, and commercial alignment inside National Defense Corporate Group \n- Search, contact and manage new, local and crossborder, partners and allies. Represent and visibilize the new company’s and entrepreneurial’s Group strategy \n- Negotiate and stablish new and different kind of partnerships\n- Identify clients’ problems and obstacles as opportunities to offer infrastructure solutions. Built long-term win-win relationships\n- Plan and design the structuring process for each project\n- Design and create different business models for each development opportunity\n- Find and select a convenient group of allies (public & private) to structure and / or operate each initiative\n- Approach, negotiate and close diverse financial schemes with investors and creditors\n- Analyse the legal framework, constrains and challenges to make feasible proposals and projects. Define pre-requisites and previous actions to enhance business opportunities\n- Make in-house and coordinate with third parties, specific commercial, legal, financial and technical studies and analysis\n- Generate and supervise final products project related. Executed investment options internally and externally with related actors\n- Design, control and supervise projects developments, stonemiles, schedules, resources and roadmaps  \n- Present and sell different kind of proposals and projects in diverse stages to different stakeholders\n- Map and manage projects’ stakeholders, creating and implementing tailor made strategies', 'title': 'Investment Officer - New Business & Innovation', 'employment_type': None}]}, {'company': {'id': 3518724, 'name': 'Financiera de Desarrollo Nacional - National Development Bank', 'logo': 'https://media.licdn.com/dms/image/D4E0BAQH1IGPPEoob4A/company-logo_400_400/0/1684353947795/financiera_de_desarrollo_nacional_logo?e=1700697600&v=beta&t=skzraQD7C6eEHvB5vAllcSf9C7bXBCYNPTSkyXTGMqs', 'url': 'https://www.linkedin.com/company/financieradedesarrollonacional/', 'employees': {'start': 201, 'end': 500}}, 'date': {'start': {'month': 10, 'day': None, 'year': 2014}, 'end': {'month': 12, 'day': None, 'year': 2018}}, 'profile_positions': [{'location': 'Colombia', 'date': {'start': {'month': 10, 'day': None, 'year': 2014}, 'end': {'month': 12, 'day': None, 'year': 2018}}, 'company': 'Financiera de Desarrollo Nacional', 'description': '- Led integral structure, promotion and implementation of Public Private Partnerships (PPP) schemes and private capital strategies for national and subnational projects\n- Headed pioneer initiative in Colombia: Bogota`s Hospital Programme. Reached integral structure of five new hospitals in PPP scheme with direct impact over more than 1.4m people and of €700m investment \n- Directed design and settlement of five international bids, aligning legal framework with best financial and industry international experiences and standards \n- Promoted projects to local and international stakeholders in public, consultant, construction and financial markets, had average of five commercial meetings per week. Made specific roadshows in Colombia, Mexico, Spain and UK\n- Coordinated interaction with multilaterals and supporting international organisations, resulted in implementation of international standards and practices as Building Information Modelling, SOURCE platform and Five Case Model\n- Managed +100 collaborators with interdisciplinary fields from different countries and work based locations\n- Project advisory in social and productive public infrastructure, pre- and feasibility stages, coordinating the private and public organizations involved', 'title': 'Advisory and Project Management Director ', 'employment_type': None}]}, {'company': {'id': None, 'name': 'JM Noguera & Cia Investment Banking', 'logo': None, 'url': None, 'employees': {'start': None, 'end': None}}, 'date': {'start': {'month': 9, 'day': None, 'year': 2012}, 'end': {'month': 9, 'day': None, 'year': 2014}}, 'profile_positions': [{'location': 'Colombia', 'date': {'start': {'month': 9, 'day': None, 'year': 2012}, 'end': {'month': 9, 'day': None, 'year': 2014}}, 'company': 'JM Noguera & Cia Investment Banking', 'description': '- Managed five senior financial professionals\n- Executed +15 investment banking operations with niched focus on public and financial sectors\n- Chaired project finance transactions including financial modelling, leverage options, fund raising and valuations for more than €3bn', 'title': 'Director of Financial Structuring ', 'employment_type': None}]}, {'company': {'id': 1320205, 'name': 'BBVA Colombia', 'logo': 'https://media.licdn.com/dms/image/C4D0BAQH3DGvaF6jpWA/company-logo_400_400/0/1630480283214/bbva_colombia_logo?e=1700697600&v=beta&t=xiREKGHSt9tPZ_UfA4fq9oKafYXcXBlbXK8092Y2uI4', 'url': 'https://www.linkedin.com/company/bbva-colombia/', 'employees': {'start': 5001, 'end': 10000}}, 'date': {'start': {'month': 4, 'day': None, 'year': 2006}, 'end': {'month': 9, 'day': None, 'year': 2011}}, 'profile_positions': [{'location': 'Colombia', 'date': {'start': {'month': 1, 'day': None, 'year': 2011}, 'end': {'month': 9, 'day': None, 'year': 2011}}, 'company': 'BBVA en Colombia', 'description': '- Management position with direct responsibilities with Risk, Treasury and Commercial Vice Presidencies. Led team +15 financial professionals\n- Took individual decisions up to €3m. Decided and supported risk exposure of clients in national and headquarters committees\n- Managed three biggest client segments: Corporate (limit operations €6bn), Financial Sector (local and offshore, exposure €5bn) and Public Sector (limits of €800m), summarizing more of 1.200 clients\n- Participated to create new products, strategies and procedures to BBVA Group\n- Developed and improved risk assessment tools and processes', 'title': 'Risk & Credit Manager - Wholesale, Public & Financial Sector', 'employment_type': None}, {'location': 'Colombia', 'date': {'start': {'month': 1, 'day': None, 'year': 2008}, 'end': {'month': 12, 'day': None, 'year': 2010}}, 'company': 'BBVA en Colombia', 'description': '- Achieved biggest individual borrow of BBVA Colombia in club deal through trust scheme of €1.2bn with term of 19 years\n- Improved and administrated risk frameworks: Country Risk authorisation (€1.2bn), Republic of Colombia authorisation (sovereign €4bn), Inter-Group and Financial Industry Programme (€4.9bn)\n- Negotiated and defined treasury contracts with international and local banks\n- Developed structures of treasury administration and coverage', 'title': 'Specialist in Financial and Public Sector ', 'employment_type': None}, {'location': 'Colombia', 'date': {'start': {'month': 4, 'day': None, 'year': 2006}, 'end': {'month': 12, 'day': None, 'year': 2007}}, 'company': 'BBVA en Colombia', 'description': '- Administrated Foreign Country and Issuer framework risk\n- Weighted up risk positions with public organisations, national and subnational governments, and infrastructure projects', 'title': 'Senior Analyst Advanced Financing ', 'employment_type': None}]}, {'company': {'id': None, 'name': 'Granahorrar Bank', 'logo': None, 'url': None, 'employees': {'start': None, 'end': None}}, 'date': {'start': {'month': 7, 'day': None, 'year': 2002}, 'end': {'month': 5, 'day': None, 'year': 2006}}, 'profile_positions': [{'location': 'Colombia', 'date': {'start': {'month': 6, 'day': None, 'year': 2005}, 'end': {'month': 5, 'day': None, 'year': 2006}}, 'company': 'Granahorrar Bank', 'description': '*Estudio y análisis financiero de grandes empresas, corporaciones y proyectos de construcción con ingresos anuales entre EUR 4M y EUR 80M.  \n*Medición y valoración de los riesgos asociados.\n*Modelaje financiero de proyectos económicos de largo plazo.\n*Propuesta y definición de posiciones de crédito, esquema de riesgos, estructura de mitigantes y coberturas.\n*Sustentación de la propuesta ante comités locales y de Presidencia con un promedio de 20 casos por mes. \n*Investigación, elaboración y propuesta de políticas de crédito sectoriales. \n*Análisis, sustentación e implementación de la apertura de actividades y líneas de crédito con el mercado micro-financiero', 'title': 'Analyst Enterprise and Building Credit', 'employment_type': None}, {'location': 'Colombia', 'date': {'start': {'month': 1, 'day': None, 'year': 2004}, 'end': {'month': 5, 'day': None, 'year': 2005}}, 'company': 'Granahorrar Bank', 'description': '*Análisis económico-financiero de pequeñas y medianas empresas con un promedio de 80 casos por mes.\n*Valoración económica.  \n*Ponderación y medición de riesgos de contraparte.\n*Realización de proyecciones financieras con puntos de quiebre y sensibilización de escenarios.  \n*Definición y propuesta de riesgo de crédito, sustentación de la misma ante comités de área y Vicepresidencia. \n*Realización de investigación, análisis y presentación de estudios sectoriales de la economía, con base en los cuales se adoptaron matrices de riesgo y exposición.', 'title': 'Junior Credit Analyst Small and Medium Enterprises ', 'employment_type': None}, {'location': 'Colombia', 'date': {'start': {'month': 7, 'day': None, 'year': 2002}, 'end': {'month': 12, 'day': None, 'year': 2003}}, 'company': 'Granahorrar Bank', 'description': '*Manejo y gestión comercial de clientes naturales, empresariales y corporativos.\n*Establecer e implementar estrategias comerciales en cuanto a captación, colocación de recursos y venta de productos financieros.\n*Gestión y administración de hasta 15 funcionarios a cargo.\n*Responsable de la operación y resultados de 2 sucursales bancarias.\n*Cumplimiento de presupuesto comercial, de ventas y rentabilidad para la oficina bancaria.\n*Seleccionada para realizar proceso de Trainee al interior del Banco, en todas las áreas de negocio de la entidad.\n*Cumplimiento del 100% de las metas de venta de productos financieros (15 metas mensuales), habiendo recibido la oficina con una ejecución del 5%.\n*Generación de indicadores de resultados y seguimiento.', 'title': 'Bank Branch Manager ', 'employment_type': None}]}]",[],"['Investment Banking', 'Timely Decision Making', 'Country Risk Analysis', 'Sovereign', 'Derivatives', 'Fixed Income', 'Corporate Finance', 'Portfolio Management', 'Project Finance', 'Financial Modeling', 'Financial Analysis', 'Financial Markets', 'Emerging Markets', 'Valuation', 'Banking', 'FX Options', 'Risk Management', 'Financial Accounting', 'Government Loans', 'Critical Thinking']",,,
