profile_id,first_name,last_name,sub_title,profile_picture,background_image,profile_type,entity_urn,object_urn,birth_date,summary,location,premium,influencer,treasury_media,languages,industry,education,patents,awards,certifications,organizations,projects,publications,courses,test_scores,position_groups,volunteer_experiences,skills,network_info,related_profiles,contact_info
roelienm,Roelien,Muis-Merkens,"Teacher Dutch Language & Culture. People's person, writer, traveller.",https://media.licdn.com/dms/image/C4E03AQHEDmC01RlnZQ/profile-displayphoto-shrink_800_800/0/1516330494972?e=1697673600&v=beta&t=7_HKiH94hA7c1OTJEc4EKt_bFVECtl0H3MDGl-CBl4k,,personal,ACoAAAHg6-MB-uMU5AznAwdNtAIh8NuGdK4yGvg,31517667,,"Highly educated and professional self-employed Dutch linguist.

I founded my own business -  joinwords - in 2011, to help companies and individuals with my excellent copywriting and translation skills. 

Copywriting, translation and transcreation professional.

With my business joinwords, I provide:
* attractive, well-written Dutch texts for advertorials, mailings, brochures, flyers, blogs, websites etc. The start-point is a clear understanding of the target-audience. I add  creativity, to-the-point sentences and accuracy to get to the end-point: reader-friendly, meaningful content.   
* English & German into Dutch and Dutch into English translation, editing and proofreading services. 
* transcreation projects, by combining translation and copywriting skills. 

Professional and personal skills.

I have an international focus and obtained international leading experience and track record. I also possess excellent communication and interpersonal skills. I have a professional attitude and am a conscientious, committed multitasker who is able to prioritise and used to deadlines. I am driven, keen to learn and widely interested. I am a people's person and enjoy writing, travelling, reading and sports in my spare time.

If you are seeking a driven, inspired Dutch linguist to help with copywriting and/or translation tasks, please e-mail: roelien@joinwords.com.
","{'country': 'Netherlands', 'short': 'The Randstad, Netherlands', 'city': 'The Randstad', 'state': 'Netherlands', 'default': 'The Randstad, Netherlands'}",False,False,[],"{'primary_locale': {'country': 'US', 'language': 'en'}, 'supported_locales': [{'country': 'US', 'language': 'en'}], 'profile_languages': [{'name': 'Dutch', 'proficiency': None}, {'name': 'English', 'proficiency': None}, {'name': 'German', 'proficiency': None}]}",Translation & Localization,"[{'date': {'start': {'month': None, 'day': None, 'year': 2004}, 'end': {'month': None, 'day': None, 'year': 2006}}, 'school': {'name': 'Radboud University', 'logo': 'https://media.licdn.com/dms/image/C4E0BAQHgdni-2v0psQ/company-logo_400_400/0/1670846116863?e=1700697600&v=beta&t=vgJeC3CA6j7MZM594LPJ9niyV2uONRQXRNwcseFWVLI', 'url': 'https://www.linkedin.com/school/radboud-university-nijmegen/'}, 'degree_name': 'Masters', 'field_of_study': 'Language and Cultural Studies'}, {'date': {'start': {'month': None, 'day': None, 'year': 2004}, 'end': {'month': None, 'day': None, 'year': 2004}}, 'school': {'name': 'Stellenbosch University', 'logo': 'https://media.licdn.com/dms/image/C4D0BAQExpmBFffJImA/company-logo_400_400/0/1654849270041?e=1700697600&v=beta&t=5NADnWg8EISkkReW0QBaItg9_OpNcJ6AG7tAx06EUbA', 'url': 'https://www.linkedin.com/school/stellenbosch-university/'}, 'degree_name': 'Bachelor', 'field_of_study': 'Journalism - term abroad'}, {'date': {'start': {'month': None, 'day': None, 'year': 2000}, 'end': {'month': None, 'day': None, 'year': 2004}}, 'school': {'name': 'Fontys University of Applied Sciences', 'logo': 'https://media.licdn.com/dms/image/C560BAQHoPshjTmIrAg/company-logo_400_400/0/1519856033175?e=1700697600&v=beta&t=0qGzAv6PuQje0RGiJ7HkFVuTY5RW0pmusC4QImvaao4', 'url': 'https://www.linkedin.com/school/fontys-hogescholen/'}, 'degree_name': 'Bachelor', 'field_of_study': 'Journalism'}]",[],[],[],[],[],[],[],[],"[{'company': {'id': None, 'name': 'Het Lyceum Rotterdam', 'logo': None, 'url': None, 'employees': {'start': None, 'end': None}}, 'date': {'start': {'month': None, 'day': None, 'year': 2021}, 'end': {'month': None, 'day': None, 'year': None}}, 'profile_positions': [{'location': 'Rotterdam, NL', 'date': {'start': {'month': None, 'day': None, 'year': 2021}, 'end': {'month': None, 'day': None, 'year': None}}, 'company': 'Het Lyceum Rotterdam', 'description': None, 'title': 'Teacher Dutch Language & Culture', 'employment_type': 'Part-time'}]}, {'company': {'id': None, 'name': 'joinwords, NL', 'logo': None, 'url': None, 'employees': {'start': None, 'end': None}}, 'date': {'start': {'month': 9, 'day': None, 'year': 2011}, 'end': {'month': 12, 'day': None, 'year': 2021}}, 'profile_positions': [{'location': 'Utrecht, Netherlands', 'date': {'start': {'month': 9, 'day': None, 'year': 2011}, 'end': {'month': 12, 'day': None, 'year': 2021}}, 'company': 'joinwords, NL', 'description': ""joinwords helps clients with copywriting assignments in Dutch for a wide range of subjects and English and German into Dutch translations. It is founded by freelancer Roelien Muis-Merkens, who has a strong background in text-production and creative writing. \n\nDutch copywriting for various media: websites (information & product pages), magazines (columns, advertorials), business communications (flyers, brochures, mailings, internal memo's, e-zines, etc.).\n\nTranslation expertise in business communication, marketing and general texts. Very strong in transcreation due to copywriting background. Also Dutch into English translations of general texts, such as CVs and internal communication. Providing editing and proofreading tasks for English and German into Dutch & Dutch into English documents."", 'title': 'Owner of joinwords. Self-employed linguist in translations (EN/DE-NL & NL-EN) & copywriting', 'employment_type': None}]}, {'company': {'id': None, 'name': 'RR Donnelley, UK', 'logo': None, 'url': None, 'employees': {'start': None, 'end': None}}, 'date': {'start': {'month': 12, 'day': None, 'year': 2009}, 'end': {'month': 6, 'day': None, 'year': 2011}}, 'profile_positions': [{'location': 'London, United Kingdom', 'date': {'start': {'month': 1, 'day': None, 'year': 2011}, 'end': {'month': 6, 'day': None, 'year': 2011}}, 'company': 'RR Donnelley, UK', 'description': 'I lead a team of 4 to 6 Project Coordinators. Apart from project management my role includes distributing the work load evenly in my team, maintaining good communication with the sales department, leading weekly conference calls with clients, reporting weekly to the production manager, addressing and resolving problems within my team and executing team lead administrative tasks (approving holidays, time-sheets etc).', 'title': 'Account Manager and Team Lead', 'employment_type': None}, {'location': 'London, United Kingdom', 'date': {'start': {'month': 12, 'day': None, 'year': 2009}, 'end': {'month': 1, 'day': None, 'year': 2011}}, 'company': 'RR Donnelley, UK', 'description': 'Looking after translation requests from a large German and a few minor financial clients. My responsibilities include: organising and overlooking each project stage, such as, preparing quotations, liaising with linguists, keeping profit margins, performing editing and proofreading tasks (EN and DE into NL), document formatting, translation deliveries, invoicing preparations. My role entails multi-tasking, performing well under pressure, team-work and excellent time-management.', 'title': 'Project Coordinator', 'employment_type': None}]}, {'company': {'id': None, 'name': 'RWS Group Translations, UK', 'logo': None, 'url': None, 'employees': {'start': None, 'end': None}}, 'date': {'start': {'month': 8, 'day': None, 'year': 2007}, 'end': {'month': 11, 'day': None, 'year': 2009}}, 'profile_positions': [{'location': None, 'date': {'start': {'month': 4, 'day': None, 'year': 2009}, 'end': {'month': 11, 'day': None, 'year': 2009}}, 'company': 'RWS Group Translations, UK', 'description': 'As a senior project manager I guide the project managers and help them with queries and difficulties. I take part in training new project managers and I assist the department’s management if required. I look after my own set of clients and take responsibility for the coordination of complex translation requests, which e.g. involve long term translation projects and DTP work', 'title': 'Senior Project Manager', 'employment_type': None}, {'location': None, 'date': {'start': {'month': 8, 'day': None, 'year': 2007}, 'end': {'month': 3, 'day': None, 'year': 2009}}, 'company': 'RWS Group Translations, UK', 'description': 'I am responsible for all translation requests from my own set of clients, which are mainly based in The Netherlands. My activities include maintaining an excellent working relationship with clients, liaising with translators and team-working with colleagues. I prepare quotations, coordinate and despatch translations, and give invoicing instructions to accounts payable.', 'title': 'Project Manager', 'employment_type': None}]}, {'company': {'id': None, 'name': 'HeldHavtig Communication, NL', 'logo': None, 'url': None, 'employees': {'start': None, 'end': None}}, 'date': {'start': {'month': 3, 'day': None, 'year': 2006}, 'end': {'month': 3, 'day': None, 'year': 2007}}, 'profile_positions': [{'location': None, 'date': {'start': {'month': 3, 'day': None, 'year': 2006}, 'end': {'month': 3, 'day': None, 'year': 2007}}, 'company': 'HeldHavtig Communication, NL', 'description': '- December 2006 - March 2007: Freelance Copywriter (based in US)\n- June - December 2006: Full-time Copywriter and project manager\n- March - June 2006: Copywriter Intern', 'title': 'Copywriter and project manager', 'employment_type': None}]}, {'company': {'id': None, 'name': 'Theaters Tilburg, NL', 'logo': None, 'url': None, 'employees': {'start': None, 'end': None}}, 'date': {'start': {'month': 10, 'day': None, 'year': 2004}, 'end': {'month': 6, 'day': None, 'year': 2006}}, 'profile_positions': [{'location': None, 'date': {'start': {'month': 10, 'day': None, 'year': 2004}, 'end': {'month': 6, 'day': None, 'year': 2006}}, 'company': 'Theaters Tilburg, NL', 'description': 'As floor manager, I was responsible for managing a team of hostesses, ensuring the facilities (e.g. bar, cloakroom and information desk) ran smoothly, using my problem-solving skills, and providing guests with information and assistance.', 'title': 'Floor Manager', 'employment_type': None}]}]",[],"['Language Development', 'Proofreading', 'Translation', 'Localization', 'Multilingual', 'Globalization', 'Language Services', 'Website Localization', 'Linguistics', 'Foreign Languages', 'Terminology', 'Internationalization', 'Project Management', 'Editing', 'Marketing Communications', 'Copywriting', 'German', 'Project Coordination', 'Corporate Communications', 'English']",,,
