profile_id,first_name,last_name,sub_title,profile_picture,background_image,profile_type,entity_urn,object_urn,birth_date,summary,location,premium,influencer,treasury_media,languages,industry,education,patents,awards,certifications,organizations,projects,publications,courses,test_scores,position_groups,volunteer_experiences,skills,network_info,related_profiles,contact_info
desireekuster,Désirée ,Kuster,Communication advisor | I help social organisations with human communication,https://media.licdn.com/dms/image/D4E03AQEnj0hLyg1rbA/profile-displayphoto-shrink_800_800/0/1668780108790?e=1697673600&v=beta&t=_hbSUEmeLJ_1BwArpBRhXkFx1koPqlf9whFH-xMv7g0,https://media.licdn.com/dms/image/C4E16AQGDChTq_Th5ug/profile-displaybackgroundimage-shrink_350_1400/0/1658828739449?e=1697673600&v=beta&t=rDbjQnQDqYmVGR8rIWzppZSrUv_kuG1NbNSE2P-cToE,personal,ACoAABsgR10BepX8ODD-byt9xGNsVcx-pzmL12k,455100253,,"Since childhood, I have been involved in design, communication and storytelling. So it was no surprise that I decided to study communication. However, I wanted to challenge myself by following this study at an international school. As a result, I was able to study and work in South Korea, England and Germany in addition to be active in an international setting in the Netherlands.

Because I got to know so many different cultures and people, I really started to realise the power of a story. It is something that is the same in every culture: how we learn to understand each other, create deep connections and shape our lives.

When I decided to go on an adventure in 2020 and move to Japan for a year, I seized the opportunity to combine the theoretical and creative side of communication and to spend the whole day telling stories. I also wanted to do create something that could make the world a little bit better. From this mix, Éclaire Studio was born. 

Unfortunately, covid-19 cancelled my travel plans and thus I stil am in the beautiful Netherlands, but now I get to enjoy working with passionate entrepreneurs every day!","{'country': 'Netherlands', 'short': 'Arnhem, Gelderland', 'city': 'Arnhem', 'state': 'Gelderland', 'default': 'Arnhem, Gelderland, Netherlands'}",False,False,[],"{'primary_locale': {'country': 'NL', 'language': 'nl'}, 'supported_locales': [{'country': 'NL', 'language': 'nl'}, {'country': 'US', 'language': 'en'}], 'profile_languages': [{'name': 'Duits', 'proficiency': 'LIMITED_WORKING'}, {'name': 'Engels', 'proficiency': 'PROFESSIONAL_WORKING'}, {'name': 'Japans', 'proficiency': 'ELEMENTARY'}, {'name': 'Koreaans', 'proficiency': 'ELEMENTARY'}, {'name': 'Nederlands', 'proficiency': 'NATIVE_OR_BILINGUAL'}]}",Public Relations & Communications,"[{'date': {'start': {'month': None, 'day': None, 'year': 2014}, 'end': {'month': None, 'day': None, 'year': 2018}}, 'school': {'name': 'Hogeschool van Arnhem en Nijmegen (HAN)', 'logo': 'https://media.licdn.com/dms/image/C4D0BAQE_-3BSObKKhw/company-logo_400_400/0/1561721136820?e=1700697600&v=beta&t=96ENc9Kj6SuqGCnhRYQffKBM_vETjpl-mhMQ9Lcm6wk', 'url': 'https://www.linkedin.com/school/hogeschool-van-arnhem-en-nijmegen/'}, 'degree_name': ""Bachelor's degree"", 'field_of_study': 'International Business/Corporate Communications'}, {'date': {'start': {'month': None, 'day': None, 'year': 2019}, 'end': {'month': None, 'day': None, 'year': 2019}}, 'school': {'name': 'Kyoto Japanese Language School', 'logo': None, 'url': None}, 'degree_name': 'Japanese Language', 'field_of_study': 'Japanese Studies'}, {'date': {'start': {'month': None, 'day': None, 'year': 2016}, 'end': {'month': None, 'day': None, 'year': 2017}}, 'school': {'name': 'University of Gloucestershire', 'logo': 'https://media.licdn.com/dms/image/C4E0BAQHHIhQ5wEdxXA/company-logo_400_400/0/1679407481960?e=1700697600&v=beta&t=hrq6iL1IdYi34c3TFENUBLH-7XS0i7ssZRByep2dv9U', 'url': 'https://www.linkedin.com/school/university-of-gloucestershire/'}, 'degree_name': 'Minor', 'field_of_study': 'Advertising, marketing and branding '}, {'date': {'start': {'month': None, 'day': None, 'year': 2015}, 'end': {'month': None, 'day': None, 'year': 2015}}, 'school': {'name': 'Ajou University', 'logo': 'https://media.licdn.com/dms/image/C560BAQHYa6ScWlkSXA/company-logo_400_400/0/1519906818281?e=1700697600&v=beta&t=cs8keGapi7bNCHbG2N3EXZW3yZrXuCbxWkXOERJ_pnE', 'url': 'https://www.linkedin.com/school/ajou/'}, 'degree_name': None, 'field_of_study': 'Korean Language/Culture'}, {'date': {'start': {'month': None, 'day': None, 'year': 2015}, 'end': {'month': None, 'day': None, 'year': 2015}}, 'school': {'name': 'Korean School of Amsterdam', 'logo': None, 'url': None}, 'degree_name': 'Beginners 1 ', 'field_of_study': None}, {'date': {'start': {'month': None, 'day': None, 'year': 2011}, 'end': {'month': None, 'day': None, 'year': 2014}}, 'school': {'name': 'ROC Rijn IJssel', 'logo': None, 'url': None}, 'degree_name': 'Foundation degree', 'field_of_study': 'Event management/ Event manager'}]",[],[],"[{'name': 'Event management ', 'date': {'start': {'month': None, 'day': None, 'year': None}, 'end': {'month': None, 'day': None, 'year': None}}, 'authority': 'ROC Rijn IJssel MBO Bussinesschool', 'url': None, 'license_number': None, 'display_source': None, 'company': {'id': None, 'name': 'ROC Rijn IJssel MBO Bussinesschool', 'logo': None, 'url': None}}]",[],"[{'title': 'Integrated Communications Game', 'date': {'start': {'month': 1, 'day': None, 'year': 2016}, 'end': {'month': 7, 'day': None, 'year': 2016}}, 'description': 'For the Integrated Communications Game our group acted as Communications Advisors for DEKRA Certification B.V. in Arnhem, Netherlands. For 2 weeks long, we worked on creating professional products within a limited time frame.  \n\nThe delivered products: \n- Internal Communications report\n- Marketing Communications report\n- Commercial Article\n- Press Conference\n- Integrated Communications report', 'contributors': [{'type': 'standardizedContributor', 'first_name': 'Désirée ', 'last_name': 'Kuster', 'name': None, 'headline': 'Communication advisor | I help social organisations with human communication'}, {'type': 'nonStandardizedContributor', 'first_name': None, 'last_name': None, 'name': 'Saoirse Burgman', 'headline': None}, {'type': 'nonStandardizedContributor', 'first_name': None, 'last_name': None, 'name': 'Scarlet Capellan Lopez', 'headline': None}, {'type': 'nonStandardizedContributor', 'first_name': None, 'last_name': None, 'name': 'Jack Jordan', 'headline': None}]}, {'title': 'Marketing Communication/Accountability project - Aviko', 'date': {'start': {'month': 1, 'day': None, 'year': 2016}, 'end': {'month': 7, 'day': None, 'year': 2016}}, 'description': 'Potato producer and processor Aviko B.V. wanted to gain insight in how labels of their products were perceived in some countries, and what could be improved to enhance their image. Our group got to investigate the UK market, and based our plan on extensive research and creative insights. \n\nThis project was set up as a competition, where we won the first place. \n\n', 'contributors': [{'type': 'standardizedContributor', 'first_name': 'Désirée ', 'last_name': 'Kuster', 'name': None, 'headline': 'Communication advisor | I help social organisations with human communication'}, {'type': 'nonStandardizedContributor', 'first_name': None, 'last_name': None, 'name': 'Scarlet Capellan Lopez', 'headline': None}, {'type': 'nonStandardizedContributor', 'first_name': None, 'last_name': None, 'name': 'Saoirse Burgman', 'headline': None}, {'type': 'nonStandardizedContributor', 'first_name': None, 'last_name': None, 'name': 'Jack Jordan', 'headline': None}]}, {'title': 'Public Relations Project - Good Things', 'date': {'start': {'month': 1, 'day': None, 'year': 2016}, 'end': {'month': 6, 'day': None, 'year': 2016}}, 'description': 'For our client, Good Things, we set up a public relations plan in order to kickstart the brands image. ', 'contributors': [{'type': 'standardizedContributor', 'first_name': 'Désirée ', 'last_name': 'Kuster', 'name': None, 'headline': 'Communication advisor | I help social organisations with human communication'}, {'type': 'nonStandardizedContributor', 'first_name': None, 'last_name': None, 'name': 'Scarlet Capellan Lopez', 'headline': None}, {'type': 'nonStandardizedContributor', 'first_name': None, 'last_name': None, 'name': 'Jack Jordan', 'headline': None}, {'type': 'nonStandardizedContributor', 'first_name': None, 'last_name': None, 'name': 'Saoirse Burgman', 'headline': None}]}, {'title': 'Digital Magazine Project', 'date': {'start': {'month': 9, 'day': None, 'year': 2015}, 'end': {'month': 1, 'day': None, 'year': 2016}}, 'description': 'For our client, Arnhem Business School, we were asked to create a digital magazine to promote the courses and define a new brand for the school. \nWith limited courses because of a teachers illness, we were able to create a fully functional digital magazine created through InDesign and Mag+. ', 'contributors': [{'type': 'standardizedContributor', 'first_name': 'Désirée ', 'last_name': 'Kuster', 'name': None, 'headline': 'Communication advisor | I help social organisations with human communication'}, {'type': 'nonStandardizedContributor', 'first_name': None, 'last_name': None, 'name': 'Scarlet Capellan Lopez', 'headline': None}, {'type': 'standardizedContributor', 'first_name': 'Anna', 'last_name': 'Stalmakova', 'name': None, 'headline': 'Customer Success Manager at Pipedrive 🦄'}, {'type': 'standardizedContributor', 'first_name': 'Hussein', 'last_name': 'Eleish', 'name': None, 'headline': 'CRM Email Marketeer'}]}, {'title': 'Operational Plan', 'date': {'start': {'month': 2, 'day': None, 'year': 2015}, 'end': {'month': 7, 'day': None, 'year': 2015}}, 'description': 'The Operational Plan project is to teach students how to recover a company that has a crisis. \nIn a team of four people, each with their own expertise, we worked together to solve the problem and created a well defined plan. \n\nMy tasks in this project contained: \n- Being the Communications Manager \n- Creating an Integrated Marketing Communication plan\n- Combining all four devision plans into one consise document \n- Presenting and defensing the plan \n- Overcoming the difficulties of 2 group members leaving\n', 'contributors': [{'type': 'standardizedContributor', 'first_name': 'Désirée ', 'last_name': 'Kuster', 'name': None, 'headline': 'Communication advisor | I help social organisations with human communication'}, {'type': 'nonStandardizedContributor', 'first_name': None, 'last_name': None, 'name': 'Bogdan Manole', 'headline': None}, {'type': 'nonStandardizedContributor', 'first_name': None, 'last_name': None, 'name': 'Akram Al Dulaili', 'headline': None}, {'type': 'nonStandardizedContributor', 'first_name': None, 'last_name': None, 'name': 'Arezoe Hoesseinzada', 'headline': None}]}, {'title': 'Business Plan Project', 'date': {'start': {'month': 9, 'day': None, 'year': 2014}, 'end': {'month': 2, 'day': None, 'year': 2015}}, 'description': 'Within a group of international students, a business plan has been created. The business plan containted the marketing and finance plan, on how to promote a ‘ping pong table door’ within the desired target market of the Netherlands. \nThe final presentation for students and lectures of Arnhem Businesss School was presented by myself and Mylène Sneller, and defenced by the entire group. \n\nPeer comments: \n""Désirée feels very responsible for the whole group. She made sure everything is always handed in on time."" - Mylène Sneller \n\n""Désirée is a good teammate and a hard working student. What I like about her is that she is always really active in our group meetings and knows when what to do."" - Linh Vu\n\n""Désirée is always organized and keeps us updated when the deadline is and what to do. I mostly appreciate about her that she always offers help whenever there is help needed."" - Lin Trinh ', 'contributors': [{'type': 'standardizedContributor', 'first_name': 'Désirée ', 'last_name': 'Kuster', 'name': None, 'headline': 'Communication advisor | I help social organisations with human communication'}, {'type': 'standardizedContributor', 'first_name': 'Mylène', 'last_name': 'Sneller', 'name': None, 'headline': 'A natural leader with an eye for detail, responsible, and most of all hospitable. '}, {'type': 'standardizedContributor', 'first_name': 'Grace', 'last_name': 'L. Vu', 'name': None, 'headline': 'Hospitality Student at International College of Management Sydney'}, {'type': 'standardizedContributor', 'first_name': 'Lin', 'last_name': 'T.', 'name': None, 'headline': 'Growth Marketing Manager DE at Check.'}]}]",[],[],[],"[{'company': {'id': 102543, 'name': 'Gemeente Wageningen', 'logo': 'https://media.licdn.com/dms/image/C4E0BAQGJwv973D7-hw/company-logo_400_400/0/1659353938314?e=1700697600&v=beta&t=IYcLMAMtSo1evQ6TctgY5MrSuubm9mAEAIWS7DqeyMQ', 'url': 'https://www.linkedin.com/company/gemeente-wageningen/', 'employees': {'start': 201, 'end': 500}}, 'date': {'start': {'month': 5, 'day': None, 'year': 2023}, 'end': {'month': None, 'day': None, 'year': None}}, 'profile_positions': [{'location': 'Wageningen, Gelderland, Netherlands', 'date': {'start': {'month': 5, 'day': None, 'year': 2023}, 'end': {'month': None, 'day': None, 'year': None}}, 'company': 'Gemeente Wageningen', 'description': None, 'title': 'Interim Communicatieadviseur', 'employment_type': 'Freelance'}]}, {'company': {'id': 710747, 'name': 'Gemeente Ouder-Amstel', 'logo': 'https://media.licdn.com/dms/image/C4E0BAQE3b4Npx2BeOw/company-logo_400_400/0/1519652711992?e=1700697600&v=beta&t=14IDw7s5-Uy_-wRroac73Z5kQaYreUxbuvzq5e3SWtU', 'url': 'https://www.linkedin.com/company/gemeente-ouder-amstel/', 'employees': {'start': 11, 'end': 50}}, 'date': {'start': {'month': 11, 'day': None, 'year': 2022}, 'end': {'month': None, 'day': None, 'year': None}}, 'profile_positions': [{'location': 'Ouderkerk aan de Amstel, North Holland, Netherlands', 'date': {'start': {'month': 11, 'day': None, 'year': 2022}, 'end': {'month': None, 'day': None, 'year': None}}, 'company': 'Gemeente Ouder-Amstel', 'description': 'Communicatieadviseur voor het team vluchtelingen van de gemeente Ouder-Amstel. Hier verzorg ik de operationele communicatie in woord en beeld. Daarnaast lever ik advies rondom de communicatie en participatie voor de verschillende opvanglocaties in de gemeente.', 'title': 'Interim Medior Communicatieadviseur ', 'employment_type': 'Freelance'}]}, {'company': {'id': 76811552, 'name': 'Éclaire Studio', 'logo': 'https://media.licdn.com/dms/image/D4E0BAQFXIL17Bz3Lew/company-logo_400_400/0/1656427412175?e=1700697600&v=beta&t=kzzd06T3r2Gp4eIAdCixh2HzdmeLlpUzRAbD_035IdQ', 'url': 'https://www.linkedin.com/company/eclaire-designs/', 'employees': {'start': 0, 'end': 1}}, 'date': {'start': {'month': 4, 'day': None, 'year': 2021}, 'end': {'month': None, 'day': None, 'year': None}}, 'profile_positions': [{'location': 'Netherlands', 'date': {'start': {'month': 4, 'day': None, 'year': 2021}, 'end': {'month': None, 'day': None, 'year': None}}, 'company': 'Éclaire Studio', 'description': 'Stand out, connect and grow your business through strong brands and convertible websites for ambitious, high-end and kind entrepreneurs. Éclaire takes your brand to the next level through strategic and loving design. By doing so your visuality increases, you connect with dream clients and your business grows!\n\n- Brand design\n- Brand strategy\n- Web- & UX design\n- Freelance Projects\n- Brand coaching', 'title': 'Owner', 'employment_type': 'Self-employed'}]}, {'company': {'id': 5055935, 'name': 'Picqer', 'logo': 'https://media.licdn.com/dms/image/C4D0BAQEZ9gNtgMCyEQ/company-logo_400_400/0/1624455509713?e=1700697600&v=beta&t=ePUBSvC39hcKxSmCdftNPro40ZKKCqDePckpo1epvzM', 'url': 'https://www.linkedin.com/company/picqer/', 'employees': {'start': 11, 'end': 50}}, 'date': {'start': {'month': 10, 'day': None, 'year': 2018}, 'end': {'month': 4, 'day': None, 'year': 2021}}, 'profile_positions': [{'location': 'Arnhem', 'date': {'start': {'month': 10, 'day': None, 'year': 2018}, 'end': {'month': 4, 'day': None, 'year': 2021}}, 'company': 'Picqer', 'description': 'Picqer is easy to use online software for managing your warehouse. We support you in everything that has to happen within your warehouse. From smart purchasing till processing and shipping your orders. We bring structure in the process, prevent mistakes and ensure that all your orders are shipped in time. \n\nAt Picqer, I take care of all the offline and online marketing.', 'title': 'Marketeer ', 'employment_type': None}]}, {'company': {'id': 523960, 'name': 'Amac | Apple Premium Reseller ', 'logo': 'https://media.licdn.com/dms/image/C4D0BAQF3PEUHPxu6xg/company-logo_400_400/0/1590415602031?e=1700697600&v=beta&t=FmhY3n3Z2zcKNxVeOrYwg7VQSljG-pnooEUUfh6T_QE', 'url': 'https://www.linkedin.com/company/apramac/', 'employees': {'start': 501, 'end': 1000}}, 'date': {'start': {'month': 7, 'day': None, 'year': 2017}, 'end': {'month': 8, 'day': None, 'year': 2018}}, 'profile_positions': [{'location': 'Arnhem', 'date': {'start': {'month': 7, 'day': None, 'year': 2017}, 'end': {'month': 8, 'day': None, 'year': 2018}}, 'company': 'Amac | Apple Premium Reseller', 'description': ""At Amac we work hard to deliver the premium brand experience to every consumer.\n\nAs a sales advisor at Amac my tasks included to advice and inform customers about the products of e.g. Apple, Beats, B&O, Belkin, Knomo and others. Beside personal recommendations on how products can enhance the consumer's life we also offer classes and individual help on the use of Apple products. \n\nAs iMember coach, I gave lectures on how to use Apple products and participate in individual sessions where I help an individual get the most out of their device."", 'title': 'Sales Advisor and iMember coach', 'employment_type': None}]}, {'company': {'id': 40305, 'name': 'DGMR', 'logo': 'https://media.licdn.com/dms/image/C560BAQEc7VdkICD2ww/company-logo_400_400/0/1655818316506?e=1700697600&v=beta&t=Dl6zHL_ABDfiw5Frkbf8dTslX_HYQ4nhKz6Uyqu61Hk', 'url': 'https://www.linkedin.com/company/dgmr/', 'employees': {'start': 201, 'end': 500}}, 'date': {'start': {'month': 2, 'day': None, 'year': 2018}, 'end': {'month': 6, 'day': None, 'year': 2018}}, 'profile_positions': [{'location': 'Arnhem', 'date': {'start': {'month': 2, 'day': None, 'year': 2018}, 'end': {'month': 6, 'day': None, 'year': 2018}}, 'company': 'DGMR', 'description': 'At DGMR I conducted research on the current use of online media within DGMR. This resulted in an advisory report on Employer Branding which received a nomination of 8.3. Together with conducting the research, I supported the daily tasks of the communications team.', 'title': 'Graduation student Online Media ', 'employment_type': None}]}, {'company': {'id': 12219, 'name': 'Hogeschool van Arnhem en Nijmegen (HAN)', 'logo': 'https://media.licdn.com/dms/image/C4D0BAQE_-3BSObKKhw/company-logo_400_400/0/1561721136820?e=1700697600&v=beta&t=96ENc9Kj6SuqGCnhRYQffKBM_vETjpl-mhMQ9Lcm6wk', 'url': 'https://www.linkedin.com/school/hogeschool-van-arnhem-en-nijmegen/', 'employees': {'start': 1001, 'end': 5000}}, 'date': {'start': {'month': 1, 'day': None, 'year': 2016}, 'end': {'month': 3, 'day': None, 'year': 2018}}, 'profile_positions': [{'location': 'Arnhem/Nijmegen', 'date': {'start': {'month': 1, 'day': None, 'year': 2016}, 'end': {'month': 3, 'day': None, 'year': 2018}}, 'company': 'Hogeschool van Arnhem en Nijmegen (HAN)', 'description': 'As a student representative, I have informed potential and prospective students at e.g. open days on what Arnhem Business School/HAN can offer for them, what they can expect from the international courses and how they can best prepare for the transition from their former education to higher education.', 'title': 'Student Representative ', 'employment_type': None}]}, {'company': {'id': 166379, 'name': 'The Integer Group', 'logo': 'https://media.licdn.com/dms/image/C4E0BAQFPORxreL7mDg/company-logo_400_400/0/1631804838704?e=1700697600&v=beta&t=OI_8N0dVne49i5mfUKrgN-W2vMRHpdNr9bRvyg2SNdo', 'url': 'https://www.linkedin.com/company/the-integer-group/', 'employees': {'start': 1001, 'end': 5000}}, 'date': {'start': {'month': 1, 'day': None, 'year': 2017}, 'end': {'month': 6, 'day': None, 'year': 2017}}, 'profile_positions': [{'location': 'Hamburg Area, Germany', 'date': {'start': {'month': 1, 'day': None, 'year': 2017}, 'end': {'month': 6, 'day': None, 'year': 2017}}, 'company': 'The Integer Group', 'description': 'At this internship I have performed the following duties for the client service team of Procter & Gamble mainly for the brands Oral-B, Gillette, Venus and Always: \n\n•  Assistance in coordination of international projects \n•  Support in development of e-commerce concepts \n•  Coordination and processing of day-to-day business (time, cost and quality management) \n•  Direction and briefing of internal departments (Planning, Creation and Accounting) as well as external service providers (translation agencies) \n•  Complication of briefings, re-briefings, timings, status reports, internal production plans, cost estimates and orders\n•  Preparation of presentations\n•  Complication of competition analyses/research \n•  Preparation of and participation in internal and external meetings', 'title': 'Account Manager Intern ', 'employment_type': None}]}, {'company': {'id': None, 'name': 'Huis van Puck', 'logo': None, 'url': None, 'employees': {'start': None, 'end': None}}, 'date': {'start': {'month': 2, 'day': None, 'year': 2014}, 'end': {'month': 5, 'day': None, 'year': 2014}}, 'profile_positions': [{'location': 'Arnhem', 'date': {'start': {'month': 2, 'day': None, 'year': 2014}, 'end': {'month': 5, 'day': None, 'year': 2014}}, 'company': 'Huis van Puck', 'description': ""At Huis van Puck I supported the Marketing and Communications department as an intern. Tasks included to maintaining the ways of communication and write content for the social media pages and website. \n\nBesides marketing, I also supported the organisation of events. One of my tasks was to organise the monthly open stage, which  I have executed four times under minimal supervision. Other events I supported were Nacht of de Mode, Plays at the theatre of Huis van Puck and Puck's cabaret. \n\nOther tasks included designing flyers and the annual report."", 'title': 'Marketing and Communications Intern', 'employment_type': None}]}, {'company': {'id': None, 'name': 'Doe Fabriek', 'logo': None, 'url': None, 'employees': {'start': None, 'end': None}}, 'date': {'start': {'month': 6, 'day': None, 'year': 2013}, 'end': {'month': 12, 'day': None, 'year': 2013}}, 'profile_positions': [{'location': 'Apeldoorn', 'date': {'start': {'month': 6, 'day': None, 'year': 2013}, 'end': {'month': 12, 'day': None, 'year': 2013}}, 'company': 'Doe Fabriek', 'description': 'Responsibilities included: \n\n- Event organization \n- Volunteer coordinator \n- Designing lay-outs', 'title': 'Marketing and Communications Intern', 'employment_type': None}]}]","[{'date': {'start': {'month': 4, 'day': None, 'year': 2012}, 'end': {'month': 6, 'day': None, 'year': 2012}}, 'role': 'Evenementorganisator', 'company': {'id': None, 'name': 'Jeugdcentrum 0313', 'logo': None, 'url': None}, 'cause': 'CHILDREN', 'description': 'Bij het lokale jeugdcentrum in Doesburg heb ik geholpen bij het produceren van een musical, gespeeld door scholieren van de leeftijd 10 tot 13. Voor drie maanden lang hebben we elke maandag en donderdag gerepeteerd om uiteindelijk de musical te vertonen op 1 juni. \n\nNa alle positieve reacties van het eerste optreden is de productie uitgenodigd om op de Hanzefeesten, Doesburg grootste evenement, op te voeren. \n\nMijn taken hier waren het vinden en kiezen van een script, het werven van scholieren, het begeleiden van repetities en andere taken relevant bij de productie van de musical. \n\nPersbericht: http://www.doesburgdirect.nl/jongerencentrum-0313-komt-met-nieuwe-musical/'}, {'date': {'start': {'month': 3, 'day': None, 'year': 2019}, 'end': {'month': 2, 'day': None, 'year': 2020}}, 'role': 'Advertentie-PR', 'company': {'id': None, 'name': 'Alzheimer Nederland', 'logo': 'https://media.licdn.com/dms/image/C4E0BAQGWK8FpOVTtew/company-logo_400_400/0/1577464531265?e=1700697600&v=beta&t=ViZg8dldh5iCoo73g300rlKXIYOYr4e1FQTAydH1Pmg', 'url': 'https://www.linkedin.com/company/alzheimer-nederland/'}, 'cause': 'HEALTH', 'description': None}]","['InDesign', 'Photoshop', 'Microsoft Word', 'Microsoft Excel', 'PowerPoint', 'File Management', 'Mag+', 'Design', 'Teamwork', 'Public Speaking', 'Graphic Design', 'Marketing Communications', 'Research', 'Social Media', 'Cultural Awareness', 'HTML5', 'CSS', 'Adobe Illustrator', 'Adobe Premiere Pro', 'WordPress']",,,
