profile_id,first_name,last_name,sub_title,profile_picture,background_image,profile_type,entity_urn,object_urn,birth_date,summary,location,premium,influencer,treasury_media,languages,industry,education,patents,awards,certifications,organizations,projects,publications,courses,test_scores,position_groups,volunteer_experiences,skills,network_info,related_profiles,contact_info
lucamontagnino,Luca,Montagnino,Account Manager @ Salesforce.org,https://media.licdn.com/dms/image/C5603AQGkj3t8Wfe4cA/profile-displayphoto-shrink_800_800/0/1551430428894?e=1697673600&v=beta&t=qdjSJVhhkp4GKIr4CUPCjPqaGOo2JSjHuFx-GtoxDhY,https://media.licdn.com/dms/image/C5616AQFan7myIrvsMQ/profile-displaybackgroundimage-shrink_350_1400/0/1588946964628?e=1697673600&v=beta&t=eLRt3MF-yUWXQXlFUDa0BUMxGXCJiV_vdIuq4ND9rsM,personal,ACoAAApjrjcB84Z2PKAoDDSHCYee7nUidfS1SnI,174304823,,"Born and raised in Liguria, Italy, then I moved to Milan to attend University. Lived in Lisbon, Bangkok, Dublin and now Amsterdam.

I love photography, economics and politics, travelling (i did backpacking in Thailand, Vietnam, Cambodia, Laos, Malaysia, Colombia, Cuba and more!) and outdoor sports.

I am now the Salesforce.org Account Executive for Israel and Italy, looking after all Nonprofit organizations in the region.


Need an help! Let's keep in touch!
- Phone: +31615552954
- E-mail: lmontagnino@salesforce.com

>> Views expressed are my own and do not reflect that of Salesforce. <<​","{'country': 'Netherlands', 'short': 'Amsterdam, North Holland', 'city': 'Amsterdam', 'state': 'North Holland', 'default': 'Amsterdam, North Holland, Netherlands'}",True,False,[],"{'primary_locale': {'country': 'IT', 'language': 'it'}, 'supported_locales': [{'country': 'IT', 'language': 'it'}, {'country': 'US', 'language': 'en'}], 'profile_languages': [{'name': 'Dutch', 'proficiency': 'ELEMENTARY'}, {'name': 'English', 'proficiency': 'FULL_PROFESSIONAL'}, {'name': 'Italian', 'proficiency': 'NATIVE_OR_BILINGUAL'}, {'name': 'Portuguese', 'proficiency': 'LIMITED_WORKING'}, {'name': 'Spanish', 'proficiency': 'FULL_PROFESSIONAL'}]}",Internet,"[{'date': {'start': {'month': None, 'day': None, 'year': 2010}, 'end': {'month': None, 'day': None, 'year': 2013}}, 'school': {'name': 'Università Bocconi', 'logo': 'https://media.licdn.com/dms/image/C4E0BAQGGoWODFvonTQ/company-logo_400_400/0/1656918903301?e=1700697600&v=beta&t=Jf43gXMhy4WfiATzR4p4fsM1LEkJoStXJrFJkypD8sc', 'url': 'https://www.linkedin.com/school/universita-bocconi/'}, 'degree_name': 'Master of Science (M.Sc.)', 'field_of_study': 'Economics and Social Sciences'}, {'date': {'start': {'month': None, 'day': None, 'year': 2011}, 'end': {'month': None, 'day': None, 'year': 2012}}, 'school': {'name': 'Chulalongkorn University', 'logo': 'https://media.licdn.com/dms/image/D560BAQFAIBq-4numTQ/company-logo_400_400/0/1686307967316?e=1700697600&v=beta&t=qPV-A3vAZMTZcjzrR-EXnnePQ1XEfIV8K9zj-8ssqXA', 'url': 'https://www.linkedin.com/school/chulalongkornuniversity/'}, 'degree_name': 'Master of Arts (M.A.)', 'field_of_study': 'International Economics'}, {'date': {'start': {'month': None, 'day': None, 'year': 2009}, 'end': {'month': None, 'day': None, 'year': 2010}}, 'school': {'name': 'Universidade Católica Portuguesa', 'logo': 'https://media.licdn.com/dms/image/C4E0BAQFVhTtFlN625Q/company-logo_400_400/0/1548255940144?e=1700697600&v=beta&t=iaiV3t8im1CkN1rBWz8lOoPwlRv7XEUJj3Q8spE0WyQ', 'url': 'https://www.linkedin.com/school/universidade-cat%C3%B3lica-portuguesa/'}, 'degree_name': ""Bachelor's degree"", 'field_of_study': 'Economics'}, {'date': {'start': {'month': None, 'day': None, 'year': 2009}, 'end': {'month': None, 'day': None, 'year': 2009}}, 'school': {'name': 'Tsinghua University', 'logo': 'https://media.licdn.com/dms/image/C4D0BAQFJU3_2fIeNWw/company-logo_400_400/0/1519855961159?e=1700697600&v=beta&t=q2v9QmIdiE474UDJW-3MZCLdAmXgFnrmMLhtMXBlhXg', 'url': 'https://www.linkedin.com/school/tsinghua-university/'}, 'degree_name': 'Summer school', 'field_of_study': 'Economics of Globalization'}, {'date': {'start': {'month': None, 'day': None, 'year': 2007}, 'end': {'month': None, 'day': None, 'year': 2010}}, 'school': {'name': 'Università Bocconi', 'logo': 'https://media.licdn.com/dms/image/C4E0BAQGGoWODFvonTQ/company-logo_400_400/0/1656918903301?e=1700697600&v=beta&t=Jf43gXMhy4WfiATzR4p4fsM1LEkJoStXJrFJkypD8sc', 'url': 'https://www.linkedin.com/school/universita-bocconi/'}, 'degree_name': ""Bachelor's degree"", 'field_of_study': 'Economics and Social Sciences'}]",[],[],"[{'name': 'IELTS Academic (passing grade: 7.5/9)', 'date': {'start': {'month': 1, 'day': None, 'year': 2012}, 'end': {'month': None, 'day': None, 'year': None}}, 'authority': 'Cambridge English Language Assessment', 'url': None, 'license_number': None, 'display_source': None, 'company': None}, {'name': 'ECDL (European Computer Driving Licence)', 'date': {'start': {'month': 5, 'day': None, 'year': 2008}, 'end': {'month': None, 'day': None, 'year': None}}, 'authority': 'ECDL Foundation', 'url': None, 'license_number': None, 'display_source': None, 'company': None}, {'name': 'Build a Battle Station App Badge', 'date': {'start': {'month': None, 'day': None, 'year': None}, 'end': {'month': None, 'day': None, 'year': None}}, 'authority': 'Salesforce Trailhead', 'url': None, 'license_number': None, 'display_source': None, 'company': {'id': None, 'name': 'Trailhead', 'logo': 'https://media.licdn.com/dms/image/C560BAQGXS7-SEokjig/company-logo_400_400/0/1591199421818?e=1700697600&v=beta&t=5c4tdHBfxlGPCsB_-23HWbDnXkNVPxqLT5SDwUeaItE', 'url': None}}]",[],[],[],"[{'name': 'Advanced Econometrics', 'number': None}, {'name': 'Advanced Macroeconomics', 'number': None}, {'name': 'Advanced Mathematics', 'number': None}, {'name': 'Advanced Microeconomics', 'number': None}, {'name': 'Advanced Statistics', 'number': None}, {'name': 'Bunisess Strategy', 'number': None}, {'name': 'Competition law', 'number': None}, {'name': 'Development Economics', 'number': None}, {'name': 'Econometrics', 'number': None}, {'name': 'Economics of Foreign Direct investments', 'number': None}, {'name': 'Economics of Globalization', 'number': None}, {'name': 'Economics of Innovation and Technologies', 'number': None}, {'name': 'Finance', 'number': None}, {'name': 'History of Globalization', 'number': None}, {'name': 'International Economics', 'number': None}, {'name': 'Macroeconomics', 'number': None}, {'name': 'Mathematics', 'number': None}, {'name': 'Microeconomics', 'number': None}, {'name': 'Monetary Policy', 'number': None}, {'name': 'Monetary Policy and Financial Regulation', 'number': None}]",[],"[{'company': {'id': 3185, 'name': 'Salesforce.org', 'logo': 'https://media.licdn.com/dms/image/C560BAQHZ9xYomLW7zg/company-logo_400_400/0/1591198956689?e=1700697600&v=beta&t=OuARN7w34KcVK-cUIk4wTTvGbDv9vLefDaE0iVmOzAU', 'url': 'https://www.linkedin.com/company/salesforce/', 'employees': {'start': 10001, 'end': None}}, 'date': {'start': {'month': 9, 'day': None, 'year': 2015}, 'end': {'month': None, 'day': None, 'year': None}}, 'profile_positions': [{'location': 'Amsterdam Area, Netherlands', 'date': {'start': {'month': 2, 'day': None, 'year': 2021}, 'end': {'month': None, 'day': None, 'year': None}}, 'company': 'Salesforce', 'description': 'Salesforce.org is a nonprofit social enterprise born out of Salesforce to give back to communities around the world . We work to put the world’s best technology into the hands of nonprofits and schools so they can create more impact, that translates into deepen constituent relationships, deliver better programs, and accelerate transformation into a Connected Nonprofit.\n\nSalesforce helps Nonprofits of all sizes to gain a 360-degree view of the organization, from fundraising and programs to marketing and engagement.  I do help small Nonprofit and Foundation organizations across EMEA to get the most in terms of technology and help them put their constituents at the center of their strategy.', 'title': 'Territory Manager - Italy and Israel, NGO', 'employment_type': None}, {'location': 'Amsterdam, North Holland, Netherlands', 'date': {'start': {'month': 2, 'day': None, 'year': 2019}, 'end': {'month': 1, 'day': None, 'year': 2021}}, 'company': 'Salesforce', 'description': None, 'title': 'SMB (Small-Medium Business) Account Manager - Soutern Europe and MEA', 'employment_type': 'Full-time'}, {'location': 'Dublin, County Dublin, Ireland', 'date': {'start': {'month': 3, 'day': None, 'year': 2017}, 'end': {'month': 2, 'day': None, 'year': 2019}}, 'company': 'Salesforce', 'description': None, 'title': 'Small Business Account Manager - BeNeLux, Continental Europe and MEA', 'employment_type': 'Full-time'}, {'location': 'Ireland', 'date': {'start': {'month': 9, 'day': None, 'year': 2015}, 'end': {'month': 3, 'day': None, 'year': 2017}}, 'company': 'Salesforce', 'description': 'Companies need to take pace of a fast-changing environment, as their customer is becoming centric in Company\'s strategy. People now need personalized and social services and all departments need to be aligned to satisfy their stakeholders.\n\nSalesforce helps every day companies to become ""Customer Centic"". We have been named the World\'s Most Innovative Company for 4 consecutive years by Forbes, recognized as one of FORTUNE\'s Top 10 Best Companies to Work For, and are the fastest-growing major Tech Company in the World. Information Technology and digitalization is changing our daily life and our way to do business.\n\nOn top of my daily job, I am looking after the Business Development team together with the Senior colleagues.  We do campaign coaching and monitoring and I am responsible for doing reporting at the team level and providing feedback to Strategy department.', 'title': 'Strategic Account Business Development Representative', 'employment_type': None}]}, {'company': {'id': 1028, 'name': 'Oracle', 'logo': 'https://media.licdn.com/dms/image/D4E0BAQHYCgYovUuPtQ/company-logo_400_400/0/1665755678671?e=1700697600&v=beta&t=L4ZEVRnd_9KrJnsNaMI5tDvqjY9b9p7_jHMviu3cvC8', 'url': 'https://www.linkedin.com/company/oracle/', 'employees': {'start': 10001, 'end': None}}, 'date': {'start': {'month': 12, 'day': None, 'year': 2013}, 'end': {'month': 8, 'day': None, 'year': 2015}}, 'profile_positions': [{'location': 'Dublin, Ireland', 'date': {'start': {'month': 7, 'day': None, 'year': 2014}, 'end': {'month': 8, 'day': None, 'year': 2015}}, 'company': 'Oracle', 'description': 'Information Technology and digitalization is changing our daily life and our way to do business. Therefore, companies need to keep the pace with a fast-moving digital world and support the daily business with innovative instruments by using a limited IT budget.', 'title': 'Business Development Consultant', 'employment_type': None}, {'location': 'Milan Area, Italy', 'date': {'start': {'month': 12, 'day': None, 'year': 2013}, 'end': {'month': 6, 'day': None, 'year': 2014}}, 'company': 'Oracle', 'description': 'I joined Oracle HCM Consulting team in December 2013, acquiring knowledge in projects implementation and assisting the team during the whole project life-cycle.', 'title': 'HCM Consulting Intern', 'employment_type': None}]}, {'company': {'id': 1860, 'name': 'United Nations', 'logo': 'https://media.licdn.com/dms/image/C4D0BAQEJd9iXSB3aTQ/company-logo_400_400/0/1604441643356?e=1700697600&v=beta&t=OwEMFF0ekrVG7pO-I7j1kYQhuuBfmeLak07StE-5YWA', 'url': 'https://www.linkedin.com/company/united-nations/', 'employees': {'start': 10001, 'end': None}}, 'date': {'start': {'month': 7, 'day': None, 'year': 2012}, 'end': {'month': 10, 'day': None, 'year': 2012}}, 'profile_positions': [{'location': 'Bangkok', 'date': {'start': {'month': 7, 'day': None, 'year': 2012}, 'end': {'month': 10, 'day': None, 'year': 2012}}, 'company': 'United Nations', 'description': 'Research Assistant in the Department of Information and Communication Technologies and Disaster Risk Reduction (IDD). Main tasks: \n•\tICT data and ICT market analysis for ESCAP region; \n•\tICT data analysis application for projects on building resilience against natural disasters with social media and ICT devices;\n•\tEconomic Consultancy for member countries; \n•\tShortcoming: Working paper on Electronic waste in ESCAP region.', 'title': 'Research Assistant', 'employment_type': None}]}, {'company': {'id': None, 'name': 'Bar Bagni “Elios”', 'logo': None, 'url': None, 'employees': {'start': None, 'end': None}}, 'date': {'start': {'month': 6, 'day': None, 'year': 2008}, 'end': {'month': 9, 'day': None, 'year': 2009}}, 'profile_positions': [{'location': 'Pietra Ligure (SV)', 'date': {'start': {'month': 6, 'day': None, 'year': 2008}, 'end': {'month': 9, 'day': None, 'year': 2009}}, 'company': 'Bar Bagni “Elios”', 'description': 'Seasonal Job', 'title': 'Barman and swimming instructor', 'employment_type': None}]}, {'company': {'id': None, 'name': 'Bagni “La Bussola”', 'logo': None, 'url': None, 'employees': {'start': None, 'end': None}}, 'date': {'start': {'month': 6, 'day': None, 'year': 2005}, 'end': {'month': 9, 'day': None, 'year': 2007}}, 'profile_positions': [{'location': 'Borgio Verezzi (SV)', 'date': {'start': {'month': 6, 'day': None, 'year': 2005}, 'end': {'month': 9, 'day': None, 'year': 2007}}, 'company': 'Bagni “La Bussola”', 'description': 'Seasonal Job', 'title': 'Lifeguard', 'employment_type': None}]}]","[{'date': {'start': {'month': None, 'day': None, 'year': None}, 'end': {'month': None, 'day': None, 'year': None}}, 'role': 'Volunteer', 'company': {'id': None, 'name': 'AGESCI', 'logo': 'https://media.licdn.com/dms/image/C560BAQGKmofbIEeGYQ/company-logo_400_400/0/1535644491303?e=1700697600&v=beta&t=8j69SJIsQbr3n2gyIrSIbJC_7nqwRrtIvvGAUR9h8QU', 'url': 'https://www.linkedin.com/company/agesci/'}, 'cause': 'SOCIAL_SERVICES', 'description': None}]","['English', 'Teamwork', 'Business Development', 'Microsoft Excel', 'Microsoft Office', 'Business Strategy', 'Campaign Management', 'Analysis', 'Management', 'Marketing Strategy', 'Sales Analysis', 'Data Analysis', 'PowerPoint', 'Statistics', 'Econometrics', 'Economics', 'Stata', 'Research', 'Statistical Modeling', 'Works well in a team']",,,
