profile_id,first_name,last_name,sub_title,profile_picture,background_image,profile_type,entity_urn,object_urn,birth_date,summary,location,premium,influencer,treasury_media,languages,industry,education,patents,awards,certifications,organizations,projects,publications,courses,test_scores,position_groups,volunteer_experiences,skills,network_info,related_profiles,contact_info
michalis-delagas-6768797b,Michalis,Delagas,"MSc Geologist, Geoscientist",https://media.licdn.com/dms/image/C4D03AQHOPJ1y6WOYXw/profile-displayphoto-shrink_800_800/0/1600278774599?e=1697673600&v=beta&t=oYGeW5yc4Nl1Nqph7bdiTBaqa3rgjJ7G5xGaSG3XMaQ,,personal,ACoAABEJR3oBH9An8Qdeea1UzVz9khHBp9CRDWs,285820794,,"Having finished a Master degree at Utrecht University in Earth Structure and Dynamics I am actively looking for job opportunities as a geologist, geophysicist or geotechnical engineer mainly in the energy sector ( ie geothermal energy, CO2 storage or oil and gas fields) or other relevant to my studies job positions.

Regarding my studies, during MSc studies, I followed a course for unconventional geo-resources which made me motivated to pursue a career in this field. For that reason, I am looking actively for full-time job opportunities in the sector of Energy as Geologist/ Geophysicist and optimally in Geothermal and Oil and Gas Exploration, or CO2 storage.

My thesis project was on researching Intra-oceanic subduction initiation with analogue modeling techniques which provided with important scientific and technical skills such as the use of laboratory equipment, process, analysis, documentation and interpretation of results with computer software. Subsequently, I started a research project on the exploration of Geothermal resource potential in mainland Greece developing a numerical model of the thermal structure of the Greek lithosphere. This was achieved by modelling the 3D geological structure of the area and use it as input for the thermal model.  During this project, I familiarized myself with the use of two different numerical modelling software. 

During my Bachelor in Geology department at the University of Athens, I did an Internship at the National Observatory of Athens having the opportunity to get an insight into how geological research in the field of Tectonics and Geodynamics works. Furthermore, I have worked along with Corinth Rift Laboratory (CRL) team for 2 years after Bachelor graduation, contributing to several field expeditions in North Peloponnese, Greece for GPS and Seismic data acquisition   

I describe myself as a committed and highly motivated scientist. Being curious, competitive, independent and seeking to expand my knowledge and skills are a few of my natural traits. I have good Fieldwork skills mainly obtained from the geological mapping of an area in Southern Greece as part of my BSc Thesis as well as spending 4 weeks in Spain collecting data for investigating the tectonic history and Inversion of Sorbas Basin in Almeria in June 2018 as part of one of my MSc courses. Throughout these projects, I learned to make meaningful interpretations of geological structures in the field and also of microstructures of rock samples to infer the deformation history of an area.

          

         ","{'country': 'Netherlands', 'short': 'Woensdrecht, North Brabant', 'city': 'Woensdrecht', 'state': 'North Brabant', 'default': 'Woensdrecht, North Brabant, Netherlands'}",False,False,[],"{'primary_locale': {'country': 'US', 'language': 'en'}, 'supported_locales': [{'country': 'US', 'language': 'en'}], 'profile_languages': [{'name': 'Dutch', 'proficiency': 'ELEMENTARY'}, {'name': 'English', 'proficiency': 'PROFESSIONAL_WORKING'}, {'name': 'Greek', 'proficiency': 'NATIVE_OR_BILINGUAL'}]}",Architecture & Planning,"[{'date': {'start': {'month': None, 'day': None, 'year': 2017}, 'end': {'month': None, 'day': None, 'year': 2020}}, 'school': {'name': 'Utrecht University', 'logo': 'https://media.licdn.com/dms/image/C510BAQG6HfmPTdJKXw/company-logo_400_400/0/1519884681258?e=1700092800&v=beta&t=QmNHoENF2Y_jlRACSsZ9TEtxi26_FphbWXhv1lZ3mrE', 'url': 'https://www.linkedin.com/school/universiteit-utrecht/'}, 'degree_name': 'Master of Science - MS', 'field_of_study': 'Geology/Earth Structure and Dynamics'}, {'date': {'start': {'month': None, 'day': None, 'year': 2005}, 'end': {'month': None, 'day': None, 'year': 2014}}, 'school': {'name': 'Ethnikon kai Kapodistriakon Panepistimion Athinon', 'logo': 'https://media.licdn.com/dms/image/C4E0BAQFb2kiXq0tftw/company-logo_400_400/0/1519863326011?e=1700092800&v=beta&t=269Ziz29aYxDTRjWrJisud-rdl3PchupBxd9vo7No_4', 'url': 'https://www.linkedin.com/school/ethnikon-kai-kapodistriakon-panepistimion-athinon/'}, 'degree_name': 'Bachelor of Science - BS', 'field_of_study': 'Geology and Geo-environment'}]",[],[],"[{'name': 'ArcGIS Pro Essential Workflows', 'date': {'start': {'month': 6, 'day': None, 'year': 2021}, 'end': {'month': None, 'day': None, 'year': None}}, 'authority': 'Esri Nederland', 'url': None, 'license_number': None, 'display_source': None, 'company': {'id': None, 'name': 'Esri Nederland', 'logo': 'https://media.licdn.com/dms/image/C4E0BAQGPxYpHaZ107A/company-logo_400_400/0/1658731439394?e=1700092800&v=beta&t=doQmt13Q8uEcSqGXyITRfDXMcKfkNHZElw42jWW6DGk', 'url': None}}]",[],"[{'title': 'Geothermal resource potential in mainland Greece', 'date': {'start': {'month': 9, 'day': None, 'year': 2019}, 'end': {'month': 3, 'day': None, 'year': 2020}}, 'description': None, 'contributors': [{'type': 'standardizedContributor', 'first_name': 'Michalis', 'last_name': 'Delagas', 'name': None, 'headline': 'MSc Geologist, Geoscientist'}]}, {'title': 'MSc Thesis - Intra-Oceanic Subduction Initiation, Inferences from Analogue Modeling', 'date': {'start': {'month': 9, 'day': None, 'year': 2018}, 'end': {'month': 7, 'day': None, 'year': 2019}}, 'description': 'Subduction is key for driving for plate tectonics. Yet it is still unclear where and how subduction initiates in the oceanic domain. It is widely accepted that it critically depends on the rheology of the oceanic lithosphere (Nikolaeve et al., 2010) and can occur upon failure of the load-bearing crustal and mantle layers. When oceanic lithosphere is too strong, high shear strength of the oceanic lithosphere does not permit failure, and subduction may occur by deforming a passive margin at ocean-continent transition.  However, weakening processes such as zones of serpentinized mantle may affect the strain localization (Maffione et al., 2015; Stern, 2004). Therefore, a series of experiments conducted to determine the favourable rheological and kinematic conditions that lead to the development of subduction zones in the intra-oceanic domain. These experiments involving both oceanic and continental domains which incorporate weak zones of realistic dimensions in the oceanic crust. Model results show that the key factor for the strain localisation is the difference in strength between the continental and oceanic upper crust. Analysis of deformation is used to define a boundary of rheological conditions enabling subduction in oceanic or in continental domain. Additionally, addition of a weak zones in a thick and strong oceanic lithosphere doesn’t affect the deformation pattern. However, presence of a weak zone in a relatively younger oceanic lithosphere (60 ± 10 My) may induce strain localization in the oceanic crust rather than at passive margin.   This shows the importance of geological inheritance and thermo-mechanical feed-backs for the locus and evolution of subduction zone. ', 'contributors': [{'type': 'standardizedContributor', 'first_name': 'Michalis', 'last_name': 'Delagas', 'name': None, 'headline': 'MSc Geologist, Geoscientist'}]}]",[],"[{'name': 'Dynamics of Basins and Orogens', 'number': None}, {'name': 'Guided Field Research', 'number': None}, {'name': 'Paleomsgnetism', 'number': None}, {'name': 'Structural Analysis of Deformed Rocks', 'number': None}, {'name': 'Structure and Composition of Earths Interior', 'number': None}, {'name': 'Tectonic Modeling of lithospheric and crustal processes', 'number': None}, {'name': 'Unconventional Georesources', 'number': None}]",[],"[{'company': {'id': 407619, 'name': 'KuiperCompagnons', 'logo': 'https://media.licdn.com/dms/image/C4D0BAQF8NDewiW1k-g/company-logo_400_400/0/1671553713489?e=1700092800&v=beta&t=fHAOBNbFXcla1ufZfRthIrLjIPDxN6ja98r6e3iox38', 'url': 'https://www.linkedin.com/company/kuipercompagnons/', 'employees': {'start': 51, 'end': 200}}, 'date': {'start': {'month': 4, 'day': None, 'year': 2021}, 'end': {'month': None, 'day': None, 'year': None}}, 'profile_positions': [{'location': 'Rotterdam and The Hague', 'date': {'start': {'month': 4, 'day': None, 'year': 2021}, 'end': {'month': None, 'day': None, 'year': None}}, 'company': 'KuiperCompagnons', 'description': 'My role as a 3D modeler is to produce 3 dimensional models of residential or industrial areas and using them to calculate traffic, rail and industry noise levels or nitrogen deposition levels for the necessary environmental research for new developments. For the purposes of this job position I have learned to utilise in an advanced level several software programs among them Arc GIS Pro.', 'title': 'GIS specialist and 3D Modeler', 'employment_type': 'Part-time'}]}, {'company': {'id': 166740, 'name': 'Utrecht University', 'logo': 'https://media.licdn.com/dms/image/C510BAQG6HfmPTdJKXw/company-logo_400_400/0/1519884681258?e=1700092800&v=beta&t=QmNHoENF2Y_jlRACSsZ9TEtxi26_FphbWXhv1lZ3mrE', 'url': 'https://www.linkedin.com/school/universiteit-utrecht/', 'employees': {'start': 5001, 'end': 10000}}, 'date': {'start': {'month': 6, 'day': None, 'year': 2018}, 'end': {'month': 6, 'day': None, 'year': 2018}}, 'profile_positions': [{'location': 'Almería Area, Spain', 'date': {'start': {'month': 6, 'day': None, 'year': 2018}, 'end': {'month': 6, 'day': None, 'year': 2018}}, 'company': 'Utrecht University', 'description': 'Geological investigation on the tectonic history and later inversion of Sorbas Basin. Tectonic structures data collection, process and interpretation', 'title': 'Field Geologist', 'employment_type': None}]}, {'company': {'id': 3326920, 'name': 'National Observatory of Athens', 'logo': 'https://media.licdn.com/dms/image/C510BAQEgbRSYoPv3Qw/company-logo_400_400/0/1519905740437?e=1700092800&v=beta&t=-ygSKYlw1FKS8Y93CicVZrXJaky_SPUx1VPIGLjaoOY', 'url': 'https://www.linkedin.com/company/national-observatory-of-athens/', 'employees': {'start': 51, 'end': 200}}, 'date': {'start': {'month': 12, 'day': None, 'year': 2014}, 'end': {'month': None, 'day': None, 'year': 2017}}, 'profile_positions': [{'location': 'Athens, Greece', 'date': {'start': {'month': None, 'day': None, 'year': 2015}, 'end': {'month': None, 'day': None, 'year': 2017}}, 'company': 'National Observatory of Athens', 'description': 'Corinth Rift Laboratory, GPS and Seismic data collection, SAR Interferometry', 'title': 'Assistant Geoscientist', 'employment_type': None}, {'location': 'Athens, Greece', 'date': {'start': {'month': 12, 'day': None, 'year': 2014}, 'end': {'month': 3, 'day': None, 'year': 2015}}, 'company': 'National Observatory of Athens', 'description': None, 'title': 'Assistant Geoscientist', 'employment_type': None}]}]",[],"['Laptops', 'Analytical Skills', 'Field Work', 'Geology', 'Modeling', 'Earth Science', 'Geological Mapping', 'Structural Geology', 'Research', 'Geophysics', 'Structural Analysis', 'Numerical Modelling', 'Laboratory Skills', 'Sampling', 'Data Collection', 'Microsoft Office', 'Matlab', 'Geographic Information Systems (GIS)', 'Adobe Illustrator', 'Presentation Skills']",,,
