profile_id,first_name,last_name,sub_title,profile_picture,background_image,profile_type,entity_urn,object_urn,birth_date,summary,location,premium,influencer,treasury_media,languages,industry,education,patents,awards,certifications,organizations,projects,publications,courses,test_scores,position_groups,volunteer_experiences,skills,network_info,related_profiles,contact_info
kanak-chowdhary,Kanak,Chowdhary,Senior Integration Consultant at Capgemini Netherlands,https://media.licdn.com/dms/image/C5103AQFa6e5LQL2ufA/profile-displayphoto-shrink_800_800/0/1516858687637?e=1697673600&v=beta&t=1JGp972HX5-9GLHKxk43fGkXvaj8SJsMF87ixYUcA0U,https://media.licdn.com/dms/image/C5616AQGfgVZ-TX2F4g/profile-displaybackgroundimage-shrink_350_1400/0/1617882345383?e=1697673600&v=beta&t=nz8_jU-Y_r8tD-3d5IhCCZruaIOIYCvBB-EJ9z-0YRY,personal,ACoAAAujugwBRwhkvZJHEjlT3sD5TNhfZBfioRE,195279372,,"Passionate about solving complex challenges that help make a difference! Keeping myself up to date with the latest trends in tech and working on cutting-edge technologies is a motivator for me. Integration is my expertise and passion both in technology and in my private life. Experience working for different clients and companies in Retail, FSI, E-commerce, Industrial Manufacturing & Logistics industries.

Working with MuleSoft team at Deloitte has sharpened my skills with the cutting-edge integration developments and has given me a good picture of end to end setup of a delivery project. Working in IT for so many clients and industries, has helped me hone my skills of analyzing & managing business relationships in the tech world. With 12 years of IT consultancy, I have worked with various firms and clients in The Netherlands, U.K. and India.

I apply my knowledge in analytics, solutioning and architecture to help organizations achieve digital integration. My passion for latest advancements in IT and my growth mindset helps me adapt to this every changing technology landscape and enables me to provide pragmatic solutions for customer needs. My problem-solving and administrative skills helps me tackle complex problems and improve the way of working. I use my skills of visualizing the overall lifecycle of services for integration of new generation client applications with legacy systems substantiated on interrogations with consumers and service providers.

I am an open and accessible person with a happy and positive attitude. I am highly motivated, used to working independently and a great team player. I have led key initiatives to reduce operating budget for clients by advising and transforming business requirements into technical implementations for developers and testers. 12 years of experience in IT consulting with in-depth understanding of project life-cycles, project development methodologies and tailored agile ceremonies.

Specializations: Mulesoft, Enterprise Architecture, IBM Integration Bus, IBM Websphere Message Broker (Middleware), IBM DataStage (ETL), IBM Datapower, Agile Methodology, Scrum development.","{'country': 'Netherlands', 'short': 'Amsterdam, North Holland', 'city': 'Amsterdam', 'state': 'North Holland', 'default': 'Amsterdam, North Holland, Netherlands'}",False,False,"[{'url': None, 'title': 'Kanak Chowdhary CV', 'description': None, 'image': 'https://media.licdn.com/dms/image/C562DAQGGXry0s0O_Yw/profile-treasury-document-cover-images_1920/0/1623075401325?e=1692961200&v=beta&t=AZWNWXDrdmRWyA3WzTC4qMlLoKKLY6e12ijpR4aBHs8'}, {'url': None, 'title': 'KanakChowdhary_CV.PPTX', 'description': None, 'image': 'https://media.licdn.com/dms/image/C562DAQHMyzkDysycqQ/profile-treasury-document-cover-images_1920/0/1619657852052?e=1692961200&v=beta&t=I9OyhS4mRlp08vpZ71lYZzIOKeW2PxsvAiU027_MzSo'}]","{'primary_locale': {'country': 'US', 'language': 'en'}, 'supported_locales': [{'country': 'US', 'language': 'en'}], 'profile_languages': [{'name': 'Dutch', 'proficiency': 'ELEMENTARY'}, {'name': 'English', 'proficiency': 'NATIVE_OR_BILINGUAL'}, {'name': 'Hindi', 'proficiency': 'NATIVE_OR_BILINGUAL'}]}",Information Technology & Services,"[{'date': {'start': {'month': None, 'day': None, 'year': 2007}, 'end': {'month': None, 'day': None, 'year': 2011}}, 'school': {'name': 'Rajiv Gandhi Prodyogiki Vishwavidyalaya', 'logo': 'https://media.licdn.com/dms/image/C4E0BAQEAVRB3i7rHHg/company-logo_400_400/0/1519874329661?e=1700697600&v=beta&t=eGl_hvRE-FZVGh68rtbBm6lQbDBQNXa0GEF5chqJFkA', 'url': 'https://www.linkedin.com/school/rajiv-gandhi-prodyogiki-vishwavidyalaya/'}, 'degree_name': 'Bachelor of Engineering (B.E.)', 'field_of_study': 'Computer Science'}, {'date': {'start': {'month': None, 'day': None, 'year': 2002}, 'end': {'month': None, 'day': None, 'year': 2007}}, 'school': {'name': 'Delhi Public School - India', 'logo': 'https://media.licdn.com/dms/image/C510BAQFJWBCrV-fjMg/company-logo_400_400/0/1582379391289?e=1700697600&v=beta&t=dahiDsEsslcsB_bgjOKUa63dT0VFLlfVXF-h6ic-7jY', 'url': 'https://www.linkedin.com/school/delhi-public-schools/'}, 'degree_name': 'High School', 'field_of_study': None}, {'date': {'start': {'month': None, 'day': None, 'year': 1992}, 'end': {'month': None, 'day': None, 'year': 2002}}, 'school': {'name': 'St. Joseph School', 'logo': None, 'url': None}, 'degree_name': 'Primary School', 'field_of_study': None}]",[],[],"[{'name': 'MuleSoft Certified Developer - Level 1 (Mule 4) Renewal with maintenance certification', 'date': {'start': {'month': 5, 'day': None, 'year': 2022}, 'end': {'month': 5, 'day': None, 'year': 2024}}, 'authority': 'MuleSoft', 'url': None, 'license_number': None, 'display_source': None, 'company': {'id': None, 'name': 'MuleSoft', 'logo': 'https://media.licdn.com/dms/image/C560BAQEleBubBy_9ww/company-logo_400_400/0/1591199296396?e=1700697600&v=beta&t=i7LWYFntXi5MzJu5Q5_OOzK-tyiM3SfJEtfAaf86pac', 'url': None}}, {'name': 'IBM Certified Solution Architect – Cloud Platform Solution v2', 'date': {'start': {'month': 7, 'day': None, 'year': 2018}, 'end': {'month': 7, 'day': None, 'year': 2020}}, 'authority': 'IBM', 'url': None, 'license_number': None, 'display_source': None, 'company': None}, {'name': 'IBM Certified Solution Developer - InfoSphere DataStage v8.5', 'date': {'start': {'month': 9, 'day': None, 'year': 2014}, 'end': {'month': None, 'day': None, 'year': None}}, 'authority': 'IBM', 'url': None, 'license_number': 'C2090-421 IBM Certification', 'display_source': None, 'company': {'id': None, 'name': 'IBM', 'logo': 'https://media.licdn.com/dms/image/D560BAQGiz5ecgpCtkA/company-logo_400_400/0/1688684715427?e=1700697600&v=beta&t=u5Re06Myc9BstE2M6qN9MMORKODl8XmTlCBTPMoVtXk', 'url': None}}, {'name': 'Mulesoft Certified Developer - Level 1 (Mule 4)', 'date': {'start': {'month': 5, 'day': None, 'year': 2020}, 'end': {'month': 6, 'day': None, 'year': 2022}}, 'authority': 'MuleSoft', 'url': None, 'license_number': None, 'display_source': None, 'company': {'id': None, 'name': 'MuleSoft', 'logo': 'https://media.licdn.com/dms/image/C560BAQEleBubBy_9ww/company-logo_400_400/0/1591199296396?e=1700697600&v=beta&t=i7LWYFntXi5MzJu5Q5_OOzK-tyiM3SfJEtfAaf86pac', 'url': None}}]",[],"[{'title': 'Clarks, Capgemini UK', 'date': {'start': {'month': 2, 'day': None, 'year': 2023}, 'end': {'month': 2, 'day': None, 'year': 2023}}, 'description': None, 'contributors': [{'type': 'standardizedContributor', 'first_name': 'Kanak', 'last_name': 'Chowdhary', 'name': None, 'headline': 'Senior Integration Consultant at Capgemini Netherlands'}]}, {'title': 'Hunkemöller, Capgemini Netherlands', 'date': {'start': {'month': 8, 'day': None, 'year': 2021}, 'end': {'month': 12, 'day': None, 'year': 2022}}, 'description': None, 'contributors': [{'type': 'standardizedContributor', 'first_name': 'Kanak', 'last_name': 'Chowdhary', 'name': None, 'headline': 'Senior Integration Consultant at Capgemini Netherlands'}, {'type': 'standardizedContributor', 'first_name': 'Ramesh', 'last_name': 'Kampalle', 'name': None, 'headline': 'Senior Integration Architect '}, {'type': 'standardizedContributor', 'first_name': 'Priyadarshini', 'last_name': 'Sivapathy', 'name': None, 'headline': 'Integration Specialist at Capgemini | 4x Mulesoft Certified | Middleware Consultant | API Design & Development'}, {'type': 'standardizedContributor', 'first_name': 'Nicky', 'last_name': 'van Steensel van der Aa', 'name': None, 'headline': 'Senior Consultant @ Ilionx'}, {'type': 'standardizedContributor', 'first_name': 'Srishti', 'last_name': 'Tripathi', 'name': None, 'headline': 'Manager at Capgemini'}, {'type': 'standardizedContributor', 'first_name': 'Abhilash', 'last_name': 'Hanagal', 'name': None, 'headline': 'Solutions Architect at Adidas | Managed a variety of complex software products in the Payment industry'}]}, {'title': 'VDL, Deloitte Netherlands', 'date': {'start': {'month': 7, 'day': None, 'year': 2020}, 'end': {'month': 7, 'day': None, 'year': 2021}}, 'description': None, 'contributors': [{'type': 'standardizedContributor', 'first_name': 'Kanak', 'last_name': 'Chowdhary', 'name': None, 'headline': 'Senior Integration Consultant at Capgemini Netherlands'}, {'type': 'standardizedContributor', 'first_name': 'João', 'last_name': 'Martins da Silva', 'name': None, 'headline': 'Consultant @ Aman Group (HCCM Consulting) | Integration Services Engineer'}, {'type': 'standardizedContributor', 'first_name': 'Gonçalo', 'last_name': 'Barros', 'name': None, 'headline': 'Senior Integration Consultant'}]}, {'title': 'Brenntag Connect, Deloitte Netherlands', 'date': {'start': {'month': 2, 'day': None, 'year': 2020}, 'end': {'month': 6, 'day': None, 'year': 2020}}, 'description': None, 'contributors': [{'type': 'standardizedContributor', 'first_name': 'Kanak', 'last_name': 'Chowdhary', 'name': None, 'headline': 'Senior Integration Consultant at Capgemini Netherlands'}, {'type': 'standardizedContributor', 'first_name': 'Pedro', 'last_name': 'Gala', 'name': None, 'headline': 'Tech Consultant na Deloitte Portugal'}, {'type': 'standardizedContributor', 'first_name': 'Goncalo', 'last_name': 'Soares', 'name': None, 'headline': 'Technology Consultant with a passion for bringing digital transformation to life.'}]}, {'title': 'Royal Swinkels Family Brewers, Deloitte Netherlands', 'date': {'start': {'month': 6, 'day': None, 'year': 2019}, 'end': {'month': 12, 'day': None, 'year': 2019}}, 'description': 'Royal Swinkels Family Brewers project is about building a Webshop on E-Commerce platform for two major brands LaTrappe and Brewfinder. Kanak worked as a Scrum Master and a Functional Analyst and was involved in requirement gathering, effort estimation, backlog creation and facilitating agile ceremonies.\n', 'contributors': [{'type': 'standardizedContributor', 'first_name': 'Kanak', 'last_name': 'Chowdhary', 'name': None, 'headline': 'Senior Integration Consultant at Capgemini Netherlands'}]}, {'title': 'Enterprise Integration Technology, ABN AMRO, Infosys Limited', 'date': {'start': {'month': 5, 'day': None, 'year': 2016}, 'end': {'month': 12, 'day': None, 'year': 2018}}, 'description': 'At ABN AMRO the Enterprise Integration project enabled digital integration with SOA compliance by building integration layers on legacy systems using Enterprise Service Bus. As a team we gathered business requirements, designed data structures for services on financial transactions and developed integration flows implementing the complete cycle from intake, release, deployment, verification and overall lifecycle management of SOA services.', 'contributors': [{'type': 'standardizedContributor', 'first_name': 'Kanak', 'last_name': 'Chowdhary', 'name': None, 'headline': 'Senior Integration Consultant at Capgemini Netherlands'}, {'type': 'standardizedContributor', 'first_name': 'Subrat Kumar', 'last_name': 'Garnaik', 'name': None, 'headline': 'Enterprise Integration Consultant | API Integration Specialist | DevOps | CICD | Low-code Development'}, {'type': 'standardizedContributor', 'first_name': 'Abhishek', 'last_name': 'Chaudhary', 'name': None, 'headline': 'Project Manager | Business Architect | Implementation Expert'}, {'type': 'standardizedContributor', 'first_name': 'Paul', 'last_name': 'Milo', 'name': None, 'headline': 'Business Analyst at ABN AMRO Asset Based Finance'}, {'type': 'standardizedContributor', 'first_name': 'Kusumika', 'last_name': 'Ghosh', 'name': None, 'headline': 'Senior API Engineer | Google Cloud Certified Professional Cloud Developer & Architect | API Security Expert '}, {'type': 'standardizedContributor', 'first_name': 'Abrar', 'last_name': 'Khan', 'name': None, 'headline': 'Azure Data Platform Consultant'}, {'type': 'standardizedContributor', 'first_name': 'Hemant', 'last_name': 'kumar', 'name': None, 'headline': 'Technology Lead at Infosys'}, {'type': 'standardizedContributor', 'first_name': 'John', 'last_name': 'van Schaik', 'name': None, 'headline': 'IT Development Engineer at Sphinx at ABN AMRO Bank N.V.'}, {'type': 'standardizedContributor', 'first_name': 'Lalit', 'last_name': 'Varshney', 'name': None, 'headline': 'Technology Architect'}, {'type': 'standardizedContributor', 'first_name': 'Jimmy', 'last_name': 'Voskuil', 'name': None, 'headline': 'CISO/PO bij Gemeente Waterland'}, {'type': 'standardizedContributor', 'first_name': 'Jimmy', 'last_name': 'B', 'name': None, 'headline': 'Information Security Officer at Visma | Raet'}, {'type': 'standardizedContributor', 'first_name': 'Anne', 'last_name': 'Wever', 'name': None, 'headline': 'Creatieve verbinder met oog voor mens en proces @Mobilee management & advies'}, {'type': 'standardizedContributor', 'first_name': 'Shanker', 'last_name': 'Bejjanki', 'name': None, 'headline': 'Technology Architect'}, {'type': 'standardizedContributor', 'first_name': 'Tanu', 'last_name': 'Saraswat', 'name': None, 'headline': 'Integration Specialist, Microsoft Certified: Azure Solutions Architect Expert'}, {'type': 'standardizedContributor', 'first_name': 'Wim', 'last_name': 'Gruwel', 'name': None, 'headline': 'Principal Architect at Cognizant'}, {'type': 'standardizedContributor', 'first_name': 'Bashir', 'last_name': 'Khoshiwal', 'name': None, 'headline': 'Scrum Master Internal and Open API Gateways at ABN AMRO BANK N.V.'}, {'type': 'standardizedContributor', 'first_name': 'Vardhaman', 'last_name': 'Jain', 'name': None, 'headline': 'Integration Engineer | CI/CD Engineer | Data Enthusiast | Business Analyst'}, {'type': 'standardizedContributor', 'first_name': 'Harish', 'last_name': 'Chandrashekara Rao', 'name': None, 'headline': 'Senior Associate at Cognizant'}]}, {'title': 'eCommerce Integration Framework Project, TNT (Now FedEx), Infosys Limited', 'date': {'start': {'month': 3, 'day': None, 'year': 2015}, 'end': {'month': 4, 'day': None, 'year': 2016}}, 'description': 'Worked in Scrum teams integrating Java services with IIB and IBM Message Broker. Built Broker flows, configured Style sheets for each interfaces and synchronized the services with common architecture.\n\nTechnologies/ Frameworks/ Methodologies Used:  \t\n•\tMessage Broker 7.5 and IIB9, MQ V 7.5\n•\tDevelopment and Unit Testing using SOAP, REST, HTTP, etc.\n•\tUsed various messaging domains like XML, XMLNSC, MRM, TDS, etc.\n•\tUsed various protocols and standards including HTTP, MQ, SOAP, REST, WSDL, XSD, etc.\n•\tScrum\n\nKey Responsibilities taken:\n•\tImplemented complex functionalities like local cache and global cache in IIB9 abiding time boxing management.\n•\tCreated MQ objects in WMQ using scripts which included configuring broker queues, WAS activity service server connection channel gateway queues, migration export router queues and global cluster switch queues.\n•\tBuilt Broker flows, configured Style sheets (XSLs) for interfaces and synchronized services in common architecture. Designed and developed message flows for Batch and Event based scenarios\n•\tDeveloping Message flows utilising the SOAP Input/SOAP Request/SOAP Reply nodes in order to expose services to SOAP based clients\n•\tUsed SOAPUI in order to test Web services deployed to the broker.\n•\tCreated Message Sets using the WSDL provided by the Business Analyst.\n•\tAssisted in Sprint Planning and burn down reports.\n•\tActed as a mentor to new graduates joining the company and aide their development so that they can be utilised on projects. \n•\tCoordinated 5 resources, based in two different sites when implementing projects into the production environment.', 'contributors': [{'type': 'standardizedContributor', 'first_name': 'Kanak', 'last_name': 'Chowdhary', 'name': None, 'headline': 'Senior Integration Consultant at Capgemini Netherlands'}, {'type': 'standardizedContributor', 'first_name': 'Prakash', 'last_name': 'Jha', 'name': None, 'headline': 'Senior Project Manager | RTE | Agile Coach | DevOps'}, {'type': 'standardizedContributor', 'first_name': 'Sushil Kumar', 'last_name': 'Sethi', 'name': None, 'headline': 'Azure DevOps Engineer at ABN AMRO'}, {'type': 'standardizedContributor', 'first_name': 'Bhuvnesh', 'last_name': 'Mishra', 'name': None, 'headline': 'Technology Lead at Infosys'}, {'type': 'standardizedContributor', 'first_name': 'Mayank', 'last_name': 'Sharma', 'name': None, 'headline': 'Expert IT Developer'}]}, {'title': ""Order Management System, Walmart Sam's Club, Infosys Limited"", 'date': {'start': {'month': 5, 'day': None, 'year': 2014}, 'end': {'month': 3, 'day': None, 'year': 2015}}, 'description': 'Technologies/ Frameworks/ Methodologies Used:  \t\n•\tMessage Broker V7.5 and V8\n•\tMessage Queuing V7, Data Power(XB62)\n•\tAgile - Scope creep in Scrum for the injection of requirements into previously-defined project.\n•\tXML, JSON, SOAP Input, HTTP Input, TCP/IP etc.\n\nKey Responsibilities taken:\n•\tUsed MoSCoW prioritization technique in Agile to reach a common understanding with the client requirements in existing application.\n•\tClassified and fixed Technical Debt Management by collaboration with cross functional teams.\n•\tSetup of MB/MQ environment installation of MB/MQ.\n•\tWorked on MB production issues, archiving of log files, giving authority to users, working with other application teams and production implementation.\n•\tCreated Data Power Multi-Protocol Gateway (MPG) services for exposing the Core Services through Data Power.\n', 'contributors': [{'type': 'standardizedContributor', 'first_name': 'Kanak', 'last_name': 'Chowdhary', 'name': None, 'headline': 'Senior Integration Consultant at Capgemini Netherlands'}, {'type': 'standardizedContributor', 'first_name': 'Prashant', 'last_name': 'Shekhar', 'name': None, 'headline': 'Technical Lead at Tech Mahindra'}, {'type': 'standardizedContributor', 'first_name': 'Sarvesh', 'last_name': 'Kulkarni', 'name': None, 'headline': 'Software Engineer III at Walmart'}]}, {'title': 'Merchendizing Space Planning, Walmart Inc., Infosys Limited', 'date': {'start': {'month': 8, 'day': None, 'year': 2012}, 'end': {'month': 5, 'day': None, 'year': 2014}}, 'description': 'As a Infosphere DataStage developer developed Complex DataStage Mappings, developed ETL jobs and worked on complete ETL life cycle implementation from requirement gatherings to production implementation.\n\nTechnologies/ Frameworks/ Methodologies Used:  \t\n•\tIBM Infospere DataStage 7, 8.5 and 9.1\n•\tBuilt DataStage jobs to read files from vendors using Complex Flat File and Sequential File stages.\n•\tWorked on Cross platform Mainframe jobs and shell scripts for loading data between DB2 tables.\n•\tWaterfall Method\n\nKey Responsibilities taken:\n•\tCreated Sequencers with Error Handling, Restarting the Jobs and Trigger Email.\n•\tWorked as a system analyst, dealing closely with clients to establish problem specifications and system designs.\n•\tAnalyzed functional requirements for gaps, high/low level designs.\n•\tPerformed regression and system-level testing to verify software quality and function before it was released.', 'contributors': [{'type': 'standardizedContributor', 'first_name': 'Kanak', 'last_name': 'Chowdhary', 'name': None, 'headline': 'Senior Integration Consultant at Capgemini Netherlands'}, {'type': 'standardizedContributor', 'first_name': 'Ekta', 'last_name': 'Khandelwal', 'name': None, 'headline': 'Technical Support Engineer at TraceLink'}, {'type': 'standardizedContributor', 'first_name': 'Prashant', 'last_name': 'Shekhar', 'name': None, 'headline': 'Technical Lead at Tech Mahindra'}, {'type': 'standardizedContributor', 'first_name': 'Nikita', 'last_name': 'Welkar', 'name': None, 'headline': 'Technology Lead at Infosys'}]}, {'title': 'Assortment Management, Walmart Inc., Infosys Limited', 'date': {'start': {'month': 9, 'day': None, 'year': 2011}, 'end': {'month': 8, 'day': None, 'year': 2012}}, 'description': 'Technologies/ Frameworks/ Methodologies Used:  \t\n•\tIBM Infosphere DataStage 8.1 and 9.1\n•\tWindows Scripts and Windows Scheduler to configure and restart daily and weekly batch flows.\n\nKey Responsibilities taken:\n•\tWorked in development and production support project. Major responsibilities involved, maintaining and monitoring DataStage flows, handling job abends and rolling out fixes in production support.\n•\tWorked on JDA BAM tool which displayed the fresh data and historical data used for daily report generations and analysis by clients.\n•\tUnderstood and analyzed the business flow of transactions at each level to optimize the total run time and reduce costs (for clients) of running DataStage flows.\n•\tAcquired understanding of core retail processes of warehouse management and assortment creations.', 'contributors': [{'type': 'standardizedContributor', 'first_name': 'Kanak', 'last_name': 'Chowdhary', 'name': None, 'headline': 'Senior Integration Consultant at Capgemini Netherlands'}, {'type': 'standardizedContributor', 'first_name': 'Ekta', 'last_name': 'Khandelwal', 'name': None, 'headline': 'Technical Support Engineer at TraceLink'}]}, {'title': 'Telecom Distribution System for Aircel India Ltd.t, Innovative India Technology', 'date': {'start': {'month': 6, 'day': None, 'year': 2010}, 'end': {'month': 8, 'day': None, 'year': 2010}}, 'description': 'Built a Telecom Distribution System for a cellular operator, AIRCEL India Pvt. Ltd.\nCreated a website and forum for the HR section to maintain the TDS\nEvaluated technologies based on distributed database management systems and Web services. \nTechnologies involved: PHP, javascript, CSS and LAMP.', 'contributors': [{'type': 'standardizedContributor', 'first_name': 'Kanak', 'last_name': 'Chowdhary', 'name': None, 'headline': 'Senior Integration Consultant at Capgemini Netherlands'}, {'type': 'standardizedContributor', 'first_name': 'Swati', 'last_name': 'Singh', 'name': None, 'headline': 'Project Management | Certified Scrum Master | ETL Consultant'}, {'type': 'standardizedContributor', 'first_name': 'Aaryaman', 'last_name': 'Singh', 'name': None, 'headline': 'Proprietor at Innovative India Technology'}]}]","[{'name': 'VALUE ADDS TO THE PROJECTS', 'publisher': None, 'url': None, 'date': {'month': None, 'day': None, 'year': None}, 'authors': [{'type': 'standardizedContributor', 'first_name': 'Kanak', 'last_name': 'Chowdhary', 'name': None, 'headline': 'Senior Integration Consultant at Capgemini Netherlands'}]}]",[],[],"[{'company': {'id': 157240, 'name': 'Capgemini', 'logo': 'https://media.licdn.com/dms/image/D560BAQF_q1awsuPNAg/company-logo_400_400/0/1688232761552?e=1700697600&v=beta&t=AVYkP63AKDHCytQUaCjdM3Y02lrOzHDiL9K6PJnhnlY', 'url': 'https://www.linkedin.com/company/capgemini/', 'employees': {'start': 10001, 'end': None}}, 'date': {'start': {'month': 8, 'day': None, 'year': 2021}, 'end': {'month': None, 'day': None, 'year': None}}, 'profile_positions': [{'location': 'Netherlands', 'date': {'start': {'month': 8, 'day': None, 'year': 2021}, 'end': {'month': None, 'day': None, 'year': None}}, 'company': 'Capgemini', 'description': 'Building integration solutions for an international lingerie brand', 'title': 'Senior Consultant MuleSoft', 'employment_type': 'Full-time'}]}, {'company': {'id': 2449847, 'name': 'Deloitte Digital Netherlands', 'logo': 'https://media.licdn.com/dms/image/C510BAQG9x6s0x5PIxw/company-logo_400_400/0/1519904069133?e=1700697600&v=beta&t=JzT4vPqEFGwjJ7aQh40ryhj_Lu-HxtbkkF50NWbFoqE', 'url': 'https://www.linkedin.com/company/deloitte-digital/', 'employees': {'start': 5001, 'end': 10000}}, 'date': {'start': {'month': 1, 'day': None, 'year': 2019}, 'end': {'month': 7, 'day': None, 'year': 2021}}, 'profile_positions': [{'location': 'Netherlands', 'date': {'start': {'month': 7, 'day': None, 'year': 2020}, 'end': {'month': 7, 'day': None, 'year': 2021}}, 'company': 'Deloitte Digital', 'description': None, 'title': 'Mulesoft Specialist and Integration Designer at VDL', 'employment_type': 'Full-time'}, {'location': 'Amsterdam, North Holland, Netherlands', 'date': {'start': {'month': 1, 'day': None, 'year': 2020}, 'end': {'month': 6, 'day': None, 'year': 2020}}, 'company': 'Deloitte Digital', 'description': 'Enabling Brenntag Connect achieve digital transformation by building their sales platform. Worked as Mulesoft developer and business analyst.\n• Analysed and implemented end-to-end technical solutions and implemented Mulesoft integration flows transforming input from SAP systems into required format for ODS systems\n• Streamlining the way of working by analysing discrepancies in user stories and alignment between teams.', 'title': 'Mulesoft Developer', 'employment_type': 'Full-time'}, {'location': 'Amsterdam Area, Netherlands', 'date': {'start': {'month': 1, 'day': None, 'year': 2019}, 'end': {'month': 12, 'day': None, 'year': 2019}}, 'company': 'Deloitte Digital', 'description': 'Worked at Advertising Marketing and Commerce offering as a Srcum Master and Functional Analyst. My team built a E-Commerce Webshop for a Beer Brewing client. Responsibilities involve requirement gathering, effort estimation, backlog creation and facilitating agile ceremonies.\n•\tFacilitate Sprint Planning, Backlog Grooming, Demo, Release and Retrospective meetings.\n•\tDefine a complete set of User Stories for the eComm flow for two webshops for two brands.\n•\tWork with business owner and product manager to prioritize and validate requirements.\n•\tRemove team impediments to assist team with delivering sprint goals and deliverables.', 'title': 'Consultant, Scrum Master', 'employment_type': 'Full-time'}]}, {'company': {'id': 1283, 'name': 'Infosys Limited', 'logo': 'https://media.licdn.com/dms/image/D560BAQFxkafvVCoOYw/company-logo_400_400/0/1691574911350?e=1700697600&v=beta&t=azmsbLj7e3l3rR8yDaEb3wf1aLiL1nL3HcmypwlGyGA', 'url': 'https://www.linkedin.com/company/infosys/', 'employees': {'start': 10001, 'end': None}}, 'date': {'start': {'month': 9, 'day': None, 'year': 2011}, 'end': {'month': 12, 'day': None, 'year': 2018}}, 'profile_positions': [{'location': 'Amsterdam Area, Netherlands', 'date': {'start': {'month': 6, 'day': None, 'year': 2016}, 'end': {'month': 12, 'day': None, 'year': 2018}}, 'company': 'Infosys', 'description': 'IT consultant with 7 years of experience in analyzing and designing Integration and SOA solutions. As a business analyst in an Agile scrum team, I enabled SOA compliance and APIfication via ESB. Interacted with stakeholders to identify business requirements, advise solutions, discuss architecture agreements with architects of involved parties, translate enterprise architecture designs into Service Solution Architectures, and specifying them as clear requirements to developers and testers.\n\nI use my skills of listening, interrogating and visualizing the complete lifecycle of services for integrating new system with legacy systems. In various processes, I have used my communication skills to convince the end user of the utility to optimize the designs. At ABN AMRO the goal of Enterprise Integration project is to assist SOA compliance by building integration layers on legacy systems via Enterprise Service Bus. My role is to gather business requirements and to design data structures for services on financial transactions. I realize and help develop processes involved for intake, release, deployment, verification and overall lifecycle management of SOA services.\n\nKey technologies:\nSparx Enterprise Architect, IBM Integration Bus, Message Broker (IIB9, IIB10, WMB)\nLanguages: ESQL, Java, SQL\n\nRelevant experience: \nSOA, Integration, Solution architecture, Enterprise Architecture, Service Analysis, ESB, WebSphere Registry and Repository (WSRR), agile, scrum\n\nAdditional Responsibilities:\n+ Configured Azure Chat-bot for ABN AMRO enterprise repository.\n+ CI/CD pipeline implementation.', 'title': 'Business Analyst, Integration Specialist & Solutions Designer at ABN AMRO', 'employment_type': None}, {'location': 'Birmingham, Solihull, Ashby de la zouch, United Kingdom | Hyderabad, Pune, India', 'date': {'start': {'month': 6, 'day': None, 'year': 2015}, 'end': {'month': 5, 'day': None, 'year': 2016}}, 'company': 'Infosys', 'description': 'Worked with a team of developers through multiple agile software lifecycles. Orchestrated and executed client communication, requirement gathering, ad hoc analysis, user acceptance testing and project planning for Integration projects.\n\nRole in the Scrum team involved identifying and translating application requirements into MQ/MB infrastructure design, implementing the design in all environments and supporting the new infrastructure during Testing and implementation.\nKey technologies:\nIntegration Bus, Message Broker (IIB9, IIB10, WMB), DataPower XI50 and XS40.\nLanguages: ESQL, Java, SQL\n\nExperience developing complex Message Flows using a combination of MQ Input/Output/Reply, Compute Nodes, Java Compute Nodes, Mapping Nodes, Aggregation, RouteToLabel, HTTP Input/Reply/Request, SOAP Input/Reply/Request, FileInput, FileOutput, Collector Node, Timeout Notification node, Oracle Stored Procedure calls, XML parsing, complex Error Handling modules.', 'title': 'Integration Specialist at TNT / FedEx', 'employment_type': None}, {'location': 'Hyderabad, India', 'date': {'start': {'month': 3, 'day': None, 'year': 2013}, 'end': {'month': 5, 'day': None, 'year': 2015}}, 'company': 'Infosys', 'description': 'Built Broker flows, configured Style sheets for interfaces and synchronized the services with common architecture. ETL developer using Datastage V7.5. Development and testing in Deployment/implementation of client business functions. Maintenance of existing code along with defect fixing activities to incorporate new business requirements. Enhanced the re-usability of the jobs by making and deploying shared containers and multiple instances of the jobs.\n\nKey technologies:\nInfoSphere DataStage 8.1, 8.5 & 9.1, Integration Bus, Message Broker (IIB9, IIB10, WMB), DataPower XI50 and XS40.\nLanguages: ESQL, Java, SQL', 'title': 'Senior Systems Engineer at Walmart Inc.', 'employment_type': None}, {'location': 'Mysore, Pune, Hyderabad, India', 'date': {'start': {'month': 3, 'day': None, 'year': 2012}, 'end': {'month': 2, 'day': None, 'year': 2013}}, 'company': 'Infosys', 'description': 'Extensively used the Data Stage Director for debugging, troubleshooting and monitoring the Datastage jobs logs to identify and fix the errors.\n\nWorked on root cause analysis of problems and provided fixes, troubleshooting and resolving of issues during QA, PROD and Warranty support of the module.', 'title': 'System Engineer at Walmart Inc.', 'employment_type': None}, {'location': 'Karnataka, India & Pune, India', 'date': {'start': {'month': 9, 'day': None, 'year': 2011}, 'end': {'month': 2, 'day': None, 'year': 2012}}, 'company': 'Infosys', 'description': None, 'title': 'Intern', 'employment_type': 'Full-time'}]}]","[{'date': {'start': {'month': 4, 'day': None, 'year': 2012}, 'end': {'month': 6, 'day': None, 'year': 2015}}, 'role': 'Vice President Membership, Vice President Education, Vice President Public Relations', 'company': {'id': None, 'name': 'Toastmasters International', 'logo': 'https://media.licdn.com/dms/image/D560BAQEpd2EzKwouwQ/company-logo_400_400/0/1681497195468?e=1700697600&v=beta&t=Ac3nnP-U5AF8tq2CmNwLOOIU19yNEFqLBQP_jOXAkgc', 'url': 'https://www.linkedin.com/company/toastmasters-international/'}, 'cause': 'EDUCATION', 'description': 'Tracks Completed : \n•\tCompetent Communicator \n•\tCompetent Leader'}, {'date': {'start': {'month': 5, 'day': None, 'year': 2010}, 'end': {'month': 7, 'day': None, 'year': 2010}}, 'role': 'Intern', 'company': {'id': None, 'name': 'Innovative India Technology', 'logo': None, 'url': None}, 'cause': 'SCIENCE_AND_TECHNOLOGY', 'description': 'PHP Web Developer Intern\nhttps://www.linkedin.com/redir/phishing-page?url=https%3A%2F%2Finnovativeindiatechnology%2ecom%2F'}]","['MuleSoft Anypoint Platform', 'Integration Development', 'Sparx Enterprise Architect', 'Integration', 'Solution Architecture', 'E-commerce', 'Retail', 'Business Analysis', 'Scrum', 'SOA', 'Enterprise Architecture', 'Data Integration', 'Requirements Analysis', 'Agile Methodologies', 'Data Warehousing', 'Shell Scripting', 'SDLC', 'MuleSoft CloudHub', 'Mulesoft', 'Salesforce']",,,
