profile_id,first_name,last_name,sub_title,profile_picture,background_image,profile_type,entity_urn,object_urn,birth_date,summary,location,premium,influencer,treasury_media,languages,industry,education,patents,awards,certifications,organizations,projects,publications,courses,test_scores,position_groups,volunteer_experiences,skills,network_info,related_profiles,contact_info
tarek-jallad-13942b24,Tarek,Jallad,"Sales, Operations 
and Customer Manager - (Open for opportunities)",https://media.licdn.com/dms/image/C4D03AQHKMBUZ4NSh9w/profile-displayphoto-shrink_800_800/0/1607855291060?e=1697673600&v=beta&t=MUpkwsDamkWZSmW34gevqsByjK8UjhauD9QVgrV4uUM,,personal,ACoAAAUL3P0BIa14zVDPGaKrDlnwPixzMPBQ5FY,84663549,,"A dynamic and pro-active Senior Project and operations coordinator with 10+ years of experience in researching, planning, and executing incentive programs and events in the U.A.E. I have worked with a vast number of clients throughout my career.

My peoples’ skills combined with my proficiency in 4 languages and my multi-cultural background has always been my edge at building and maintaining meaningful and professional relationships. I am persistent in my drive for improvement and got an impressive track record of bringing in new business.

I am always striving to bring 110% to the work that I do, and my goal as an Operations Coordinator is to research, plan and execute the best possible solution for the clients that will not only engage, inform, surprise, delight, and impact them, but that will also deliver on measurable business goals. I am the conduit between Agency and the client.

When I am not on the job, I love riding my motorbike throughout the lovely streets of Dubai and admire this beautiful city. I also enjoy going out with friends and discover new restaurants and cool places.

I am currently looking for a suitable position with a company/agency renowned for hiring exceptional people & for giving them unparalleled opportunities to build their careers & capabilities.

If you believe that I can be of help to you or if you would like to learn more about myself, please get in touch at tarekjallad1@gmail.com

I love meeting new people and learning new things, so please feel free to say hello.","{'country': None, 'short': 'Netherlands', 'city': None, 'state': None, 'default': 'Netherlands'}",False,False,[],"{'primary_locale': {'country': 'US', 'language': 'en'}, 'supported_locales': [{'country': 'US', 'language': 'en'}], 'profile_languages': [{'name': 'Arabic', 'proficiency': 'NATIVE_OR_BILINGUAL'}, {'name': 'English', 'proficiency': 'NATIVE_OR_BILINGUAL'}, {'name': 'French', 'proficiency': 'LIMITED_WORKING'}, {'name': 'Italian', 'proficiency': 'NATIVE_OR_BILINGUAL'}]}","Leisure, Travel & Tourism","[{'date': {'start': {'month': None, 'day': None, 'year': 2008}, 'end': {'month': None, 'day': None, 'year': 2011}}, 'school': {'name': 'Arab Academy for Science, Technology and Maritime Transport', 'logo': 'https://media.licdn.com/dms/image/C4D0BAQF8yEiNZd2KvA/company-logo_400_400/0/1648981681362?e=1700697600&v=beta&t=Pn4cpA4uOCPxTD0vPCuiv5WqTdq2UkkYj9wyhSZnQjQ', 'url': 'https://www.linkedin.com/school/arab-academy-for-science-and-technology-and-maritime-transport/'}, 'degree_name': ""Bachelor's Degree"", 'field_of_study': 'Travel and Tourism Services Management'}, {'date': {'start': {'month': None, 'day': None, 'year': 2004}, 'end': {'month': None, 'day': None, 'year': 2008}}, 'school': {'name': 'Arab Academy for Science, Technology and Maritime Transport', 'logo': 'https://media.licdn.com/dms/image/C4D0BAQF8yEiNZd2KvA/company-logo_400_400/0/1648981681362?e=1700697600&v=beta&t=Pn4cpA4uOCPxTD0vPCuiv5WqTdq2UkkYj9wyhSZnQjQ', 'url': 'https://www.linkedin.com/school/arab-academy-for-science-and-technology-and-maritime-transport/'}, 'degree_name': 'High School', 'field_of_study': 'International General Certificate for Secondary Education (IGCSE)'}]",[],[],[],[],[],[],"[{'name': 'Advanced Airline Course', 'number': None}, {'name': 'Advanced English for Tourism and Hospitality', 'number': None}, {'name': 'Consumer Behavior', 'number': None}, {'name': 'Event management and Planning', 'number': None}, {'name': 'New Trends in Tourism Industry', 'number': None}, {'name': 'Psychological Aspects in the Tourism and Hospitality Industry', 'number': None}, {'name': 'Special Interest Tourism', 'number': None}, {'name': 'Tour Guiding and Leading', 'number': None}, {'name': 'Tourism Development ', 'number': None}, {'name': 'Tourism Market Research', 'number': None}, {'name': 'Tourism Marketing', 'number': None}, {'name': 'Tourism Planning and Environment', 'number': None}, {'name': 'Tourism and Transportation', 'number': None}, {'name': 'Tourism management', 'number': None}]",[],"[{'company': {'id': 3796223, 'name': 'Magic Travels ', 'logo': 'https://media.licdn.com/dms/image/C4E0BAQFzGTPPmh8y3g/company-logo_400_400/0/1519912334105?e=1700697600&v=beta&t=alOUJdNFaIrVsndPOzoq4_OT6PQUA9fdNoIvNoYtq8A', 'url': 'https://www.linkedin.com/company/magic-travels/', 'employees': {'start': 51, 'end': 200}}, 'date': {'start': {'month': 2, 'day': None, 'year': 2018}, 'end': {'month': 1, 'day': None, 'year': 2020}}, 'profile_positions': [{'location': 'Dubai, United Arab Emirates', 'date': {'start': {'month': 2, 'day': None, 'year': 2018}, 'end': {'month': 1, 'day': None, 'year': 2020}}, 'company': 'Magic Travels ', 'description': ""- Building and maintaining profitable relationships with key customers.\n- Understanding key customer individual needs and develop plans to meet them.\n- Expanding the customer base by upselling and cross-selling.\n- Resolving customer complaints quickly and efficiently.\n- Overseeing the relationship with customers handled by my team.\n- Collaborating closely with the markeing and sales departments to build strategies that ensure they satisfy clients with the company's products and services\n- Researching competitors and learning how to stay ahead of the competition."", 'title': 'Customer Relations Manager', 'employment_type': None}]}, {'company': {'id': 1955890, 'name': 'Mohamed Al Geziry Consultancy', 'logo': 'https://media.licdn.com/dms/image/C560BAQE5VpAvvm7ZIA/company-logo_400_400/0/1519886895136?e=1700697600&v=beta&t=56uALCPKicXE-12XG7nXSJxnDUPBSpTyShPucjoDjRk', 'url': 'https://www.linkedin.com/company/mohamed-al-geziry-consultancy/', 'employees': {'start': 11, 'end': 50}}, 'date': {'start': {'month': 5, 'day': None, 'year': 2017}, 'end': {'month': 1, 'day': None, 'year': 2018}}, 'profile_positions': [{'location': 'Dubai, United Arab Emirates', 'date': {'start': {'month': 5, 'day': None, 'year': 2017}, 'end': {'month': 1, 'day': None, 'year': 2018}}, 'company': 'Mohamed Al Geziry Consultancy', 'description': '- Representative of Seychelles Islands as a destination country in the GCC area from the\nSeychelles Tourism Board (STB).\n- Updating all the major market key players with the newest information related to\ntourism in Seychelles.\n- Reporting to the Ministry of Tourism in Dubai\n- Acting a liaison between tourism agencies in the U.A.E and GCC and the Seychelles Tourism Board', 'title': 'Key Account Manager', 'employment_type': 'Full-time'}]}, {'company': {'id': 873485, 'name': 'The Vision Destination Management', 'logo': 'https://media.licdn.com/dms/image/C4E0BAQEeFtRLvuVotA/company-logo_400_400/0/1519894148825?e=1700697600&v=beta&t=mzZ-cKlaTK42QRg-8b3dQ6xviLE19a4_XQ_H8lx1XMY', 'url': 'https://www.linkedin.com/company/the-vision-destination-management/', 'employees': {'start': 11, 'end': 50}}, 'date': {'start': {'month': 1, 'day': None, 'year': 2014}, 'end': {'month': 3, 'day': None, 'year': 2017}}, 'profile_positions': [{'location': 'Dubai', 'date': {'start': {'month': 1, 'day': None, 'year': 2014}, 'end': {'month': 3, 'day': None, 'year': 2017}}, 'company': 'The Vision Destination Management', 'description': '- In charge of planning and executing Incentive programs in the U.A.E, Oman and\nQatar.\n- Formulating informative and entertaining events.\n- Evaluating the venues.\n- Negotiating with hotels and suppliers and getting the best deals for our clients.\n- Itemized costing and budget-oriented Incentive proposals offering good value for\nmoney.\n- Develop marketing and promotional strategies and find innovative ways to stay\nahead of the competition.\n- Ensure outstanding customer satisfaction\n- Liaising with the largest Tour Operators in Europe.\n- Handling groups of 20 to 2000 persons at a time.', 'title': 'Sales, Operations and Customer Care Executive', 'employment_type': None}]}, {'company': {'id': None, 'name': 'Reem Tours & Travel (M.I.C.E)', 'logo': None, 'url': None, 'employees': {'start': None, 'end': None}}, 'date': {'start': {'month': 1, 'day': None, 'year': 2010}, 'end': {'month': 6, 'day': None, 'year': 2011}}, 'profile_positions': [{'location': 'Dubai, United Arab Emirates', 'date': {'start': {'month': 1, 'day': None, 'year': 2010}, 'end': {'month': 6, 'day': None, 'year': 2011}}, 'company': 'Reem Tours & Travel (M.I.C.E)', 'description': '- In charge of planning and executing Incentive programs in Dubai and Abu Dhabi.\n- Formulating informative and entertaining events.\n- Answer inbound client requests or inquiries.\n- Evaluating the venues.\n- Develop relationships with key hotel partners and venues.\n- 24/7 contact for clients during programs\n- Cultivate upselling opportunities', 'title': 'Senior Project & Operations Coordinator', 'employment_type': 'Full-time'}]}, {'company': {'id': 1509614, 'name': 'NET TOURS & TRAVEL DUBAI', 'logo': None, 'url': 'https://www.linkedin.com/company/net-tours-&-travel-dubai/', 'employees': {'start': None, 'end': None}}, 'date': {'start': {'month': 1, 'day': None, 'year': 2007}, 'end': {'month': 12, 'day': None, 'year': 2009}}, 'profile_positions': [{'location': 'Dubai, United Arab Emirates', 'date': {'start': {'month': 1, 'day': None, 'year': 2007}, 'end': {'month': 12, 'day': None, 'year': 2009}}, 'company': 'NET TOURS & TRAVEL DUBAI', 'description': '-In charge of planning and executing Incentive programs in Dubai and Abu Dhabi.\n- Formulating incentive programs and write proposals.\n- Evaluating the venues.\n- Negotiating with hotels and suppliers.\n- Study competition to find new ways to retain clients.\n- Liaising with tour operators in Europe.\n- Make recommendations according to customer’s needs\n- Answer inbound clients requests or inquiries.\n- Organize and make inspections visits during the quote phase to the contracted services.\n- Develop marketing and promotional strategies', 'title': 'Senior Project & Operations Coordinator', 'employment_type': None}]}, {'company': {'id': None, 'name': 'San Giovanni Tours & Travel', 'logo': None, 'url': None, 'employees': {'start': None, 'end': None}}, 'date': {'start': {'month': 2, 'day': None, 'year': 2004}, 'end': {'month': 11, 'day': None, 'year': 2006}}, 'profile_positions': [{'location': 'Alexandria, Egypt', 'date': {'start': {'month': 2, 'day': None, 'year': 2004}, 'end': {'month': 11, 'day': None, 'year': 2006}}, 'company': 'San Giovanni Tours & Travel', 'description': '- Engage with the clients to ensure they are satisfied with the service.\n- Formulating tour packages.\n- Answer inbound client requests or inquiries.\n- Develop and maintain relationships with clients.\n- Promote new products or services when relevant.\n- 24/7 contact for clients during tours.', 'title': 'Operations Coordinator', 'employment_type': None}]}]",[],"['Teamwork', 'Tourism', 'Travel Management', 'Hotels', 'Customer Service', 'Incentives', 'Management', 'Microsoft Office', 'Microsoft Excel', 'PowerPoint', 'Microsoft Word', 'English', 'Event Planning', 'Event Management', 'Research', 'Public Speaking', 'Hospitality', 'Adventure Travel', 'Leisure Travel', 'Tour Operators']",,,
