profile_id,first_name,last_name,sub_title,profile_picture,background_image,profile_type,entity_urn,object_urn,birth_date,summary,location,premium,influencer,treasury_media,languages,industry,education,patents,awards,certifications,organizations,projects,publications,courses,test_scores,position_groups,volunteer_experiences,skills,network_info,related_profiles,contact_info
rodrigoalario,Carolina,Rodrigo,"Translator and copy-editor. Specialist in Outdoor Sports, Technical Texts, Marketing and Fashion & Cosmetics. Founder of Explore Translations",https://media.licdn.com/dms/image/C5603AQG5LwfTaIH2KA/profile-displayphoto-shrink_800_800/0/1589124627871?e=1697673600&v=beta&t=by7misUOgB_YpDfpdMpZMoj9JMKpqKJinWMxgObYg5U,https://media.licdn.com/dms/image/C4D16AQGUC1HanR0y1w/profile-displaybackgroundimage-shrink_350_1400/0/1615030315901?e=1697673600&v=beta&t=LNyhLQ22IhKlrV6FLyBRRMoi702qtx-L3wSMF6pdCT8,personal,ACoAAAM_Z3gBExz5OgWGZ3XRTdb3QAx0JHzWdo8,54486904,,"I am a professional translator specialized in outdoor sports, adventure travel and technical texts. 
I translate from English and German into Spanish. 

In 2016, I founded Explore Translations, combining my professional career with my passion for the outdoor sports. At Explore Translations, we provide a wide range of translation services in different language combinations for the outdoor sports and adventure travel industries. Website: https://www.exploretranslations.com. 

I started my career as a freelance translator and proofreader in 2012, after gaining experience as an in-house translator in two different companies related to industry sectors (UVITEM and MAESSA).

I also write articles mainly about outdoor sports terminology in Explore Translations' Blog:
https://exploretranslations.wordpress.com/","{'country': 'Spain', 'short': 'Sagunto, Valencian Community', 'city': 'Sagunto', 'state': 'Valencian Community', 'default': 'Sagunto, Valencian Community, Spain'}",False,False,[],"{'primary_locale': {'country': 'ES', 'language': 'es'}, 'supported_locales': [{'country': 'ES', 'language': 'es'}, {'country': 'US', 'language': 'en'}], 'profile_languages': [{'name': 'Alemán', 'proficiency': 'PROFESSIONAL_WORKING'}, {'name': 'Español', 'proficiency': 'NATIVE_OR_BILINGUAL'}, {'name': 'Inglés', 'proficiency': 'FULL_PROFESSIONAL'}]}",Translation & Localization,"[{'date': {'start': {'month': None, 'day': None, 'year': 2010}, 'end': {'month': None, 'day': None, 'year': 2010}}, 'school': {'name': 'Leuphana Universität, Lüneburg, Germany', 'logo': None, 'url': None}, 'degree_name': 'Sommer Semmester 2010', 'field_of_study': 'Cultural studies, german.'}, {'date': {'start': {'month': None, 'day': None, 'year': 2007}, 'end': {'month': None, 'day': None, 'year': 2010}}, 'school': {'name': 'University of Valencia', 'logo': None, 'url': None}, 'degree_name': 'Translation Studies', 'field_of_study': 'German, English and Spanish'}, {'date': {'start': {'month': None, 'day': None, 'year': 2004}, 'end': {'month': None, 'day': None, 'year': 2005}}, 'school': {'name': 'Universidad de Valencia', 'logo': None, 'url': None}, 'degree_name': 'CAP', 'field_of_study': 'Pedagogía'}, {'date': {'start': {'month': None, 'day': None, 'year': 1998}, 'end': {'month': None, 'day': None, 'year': 2004}}, 'school': {'name': 'Universidad de Valencia', 'logo': None, 'url': None}, 'degree_name': 'Spanish Philology', 'field_of_study': 'Spanish language and literature'}, {'date': {'start': {'month': None, 'day': None, 'year': 2002}, 'end': {'month': None, 'day': None, 'year': 2003}}, 'school': {'name': 'University of Galway', 'logo': 'https://media.licdn.com/dms/image/D4E0BAQGs-MjKBicdRg/company-logo_400_400/0/1688394520775?e=1700697600&v=beta&t=qG3S9orb1KmUc-FP8py8dK3XclCPnjHvhN4A_Ji2fIk', 'url': 'https://www.linkedin.com/school/universityofgalway/'}, 'degree_name': 'Spanish Estudies', 'field_of_study': 'Spanish language and literature'}, {'date': {'start': {'month': None, 'day': None, 'year': 2004}, 'end': {'month': None, 'day': None, 'year': None}}, 'school': {'name': 'Instituto Cervantes y Universidad de Zaragoza', 'logo': None, 'url': None}, 'degree_name': 'Curso de Formación de Profesores de Español como Lengua Extranjera', 'field_of_study': 'Enseñanda de segundas lenguas'}]",[],[],[],[],[],[],"[{'name': 'Course on SEO Techniques', 'number': 'Aido'}, {'name': 'Course on Video Games Localization and Translation', 'number': 'Trágora Formación'}, {'name': 'Webinar Traduficción II. (Translation of science fiction, horror and fantasy genres).', 'number': 'Con Trazo Firme'}, {'name': 'Webinar on marketing strategies for translators: “How to get new clients”.', 'number': 'ASETRAD (National Associa'}, {'name': 'Webinar “Miéville, Rothfuss, Rowling: ellos fantasean y nosotros traducimos” (Webinar about the translation of fiction books)', 'number': 'ASETRAD (National Associa'}, {'name': 'Webinar “Traduficción I“ (Translation of science fiction, horror and fantasy).', 'number': 'Con Trazo Firme'}, {'name': 'Webinar: ""CAT Tools: OmegaT""\u200b.', 'number': 'ASETRAD (National Associa'}, {'name': 'Webinar: ""Translation in Publishing Industry: literature and books""\u200b.', 'number': 'Con Trazo Firme'}, {'name': 'Website Translation and Localization', 'number': 'Aula SIC'}, {'name': 'Word for Translators and Proofreaders', 'number': 'ASETRAD (National Associa'}, {'name': 'Workshop “Open source software for translators“.', 'number': 'XARXATIV (Regional Associ'}, {'name': 'Workshop: ""Improving narrative writing""\u200b.', 'number': 'Con Trazo Firme'}]",[],"[{'company': {'id': 10950690, 'name': 'Explore Translations', 'logo': 'https://media.licdn.com/dms/image/C560BAQGCfDm4t3-74Q/company-logo_400_400/0/1568105075733?e=1700697600&v=beta&t=rOXnoX_S9nNIHe5VMFuXRG9Tz-aUfq5ZMpOj-jJJdik', 'url': 'https://www.linkedin.com/company/explore-translations/', 'employees': {'start': 2, 'end': 10}}, 'date': {'start': {'month': 9, 'day': None, 'year': 2016}, 'end': {'month': None, 'day': None, 'year': None}}, 'profile_positions': [{'location': None, 'date': {'start': {'month': 9, 'day': None, 'year': 2016}, 'end': {'month': None, 'day': None, 'year': None}}, 'company': 'Explore Translations', 'description': 'Founder of Explore Translations. Translator and Project Manager.', 'title': 'Translator and Project Manager', 'employment_type': 'Self-employed'}]}, {'company': {'id': None, 'name': 'Traductora y correctora autónoma', 'logo': None, 'url': None, 'employees': {'start': None, 'end': None}}, 'date': {'start': {'month': 11, 'day': None, 'year': 2012}, 'end': {'month': None, 'day': None, 'year': None}}, 'profile_positions': [{'location': 'Valencia y alrededores, España', 'date': {'start': {'month': 11, 'day': None, 'year': 2012}, 'end': {'month': None, 'day': None, 'year': None}}, 'company': 'Traductora y correctora autónoma', 'description': 'Professional translator specialized in travel industry, outdoor sports and technical texts.\nWebsite, apps and software localization.', 'title': 'Freelance Translator (EN, DE > ES)', 'employment_type': None}]}, {'company': {'id': 600057, 'name': 'Leuphana Universität Lüneburg', 'logo': 'https://media.licdn.com/dms/image/C4E0BAQHdaerS-OMZlg/company-logo_400_400/0/1653912713524?e=1700697600&v=beta&t=qviZgJgqO8MecB64yf2Jze_kMK8vP5yggLJYFj_pIYY', 'url': 'https://www.linkedin.com/school/universitat-luneburg/', 'employees': {'start': 1001, 'end': 5000}}, 'date': {'start': {'month': 6, 'day': None, 'year': 2010}, 'end': {'month': 7, 'day': None, 'year': 2010}}, 'profile_positions': [{'location': None, 'date': {'start': {'month': 6, 'day': None, 'year': 2010}, 'end': {'month': 7, 'day': None, 'year': 2010}}, 'company': 'Leuphana University of Lüneburg', 'description': None, 'title': 'Assistant in foreign language department at Leuphana Universität, Germany', 'employment_type': None}]}, {'company': {'id': None, 'name': 'SOMNE, Oficina Técnica', 'logo': None, 'url': None, 'employees': {'start': None, 'end': None}}, 'date': {'start': {'month': 3, 'day': None, 'year': 2010}, 'end': {'month': 3, 'day': None, 'year': 2010}}, 'profile_positions': [{'location': None, 'date': {'start': {'month': 3, 'day': None, 'year': 2010}, 'end': {'month': 3, 'day': None, 'year': 2010}}, 'company': 'SOMNE, Oficina Técnica', 'description': 'Translation into English of website: www.somne.eu', 'title': 'Translator', 'employment_type': None}]}, {'company': {'id': None, 'name': 'ULTRAVIOLETA, TECNOLOGÍA Y MAQUINARIA', 'logo': None, 'url': None, 'employees': {'start': None, 'end': None}}, 'date': {'start': {'month': 6, 'day': None, 'year': 2008}, 'end': {'month': 9, 'day': None, 'year': 2009}}, 'profile_positions': [{'location': None, 'date': {'start': {'month': 6, 'day': None, 'year': 2008}, 'end': {'month': 9, 'day': None, 'year': 2009}}, 'company': 'ULTRAVIOLETA, TECNOLOGÍA Y MAQUINARIA', 'description': 'Translation of user manuals and assembly guides of industrial machines.', 'title': 'Translator', 'employment_type': None}]}, {'company': {'id': None, 'name': 'Academia V&V', 'logo': None, 'url': None, 'employees': {'start': None, 'end': None}}, 'date': {'start': {'month': None, 'day': None, 'year': 2007}, 'end': {'month': None, 'day': None, 'year': 2008}}, 'profile_positions': [{'location': 'Puerto de Sagunto', 'date': {'start': {'month': None, 'day': None, 'year': 2007}, 'end': {'month': None, 'day': None, 'year': 2008}}, 'company': 'Academia V&V', 'description': 'Clases de repaso de inglés, lengua, valenciano y comentario de texto a alumnos de ESO y Bachillerato', 'title': 'Profesora de repaso de inglés, lengua y comentario de texto', 'employment_type': None}]}, {'company': {'id': None, 'name': 'American Cultural Center, S.L.', 'logo': None, 'url': None, 'employees': {'start': None, 'end': None}}, 'date': {'start': {'month': None, 'day': None, 'year': 2007}, 'end': {'month': None, 'day': None, 'year': 2007}}, 'profile_positions': [{'location': 'Puerto de Sagunto', 'date': {'start': {'month': None, 'day': None, 'year': 2007}, 'end': {'month': None, 'day': None, 'year': 2007}}, 'company': 'American Cultural Center, S.L.', 'description': 'Clases de español a extranjeros', 'title': 'Profesora de español para extranjeros', 'employment_type': None}]}, {'company': {'id': None, 'name': 'MAESSA', 'logo': None, 'url': None, 'employees': {'start': None, 'end': None}}, 'date': {'start': {'month': 3, 'day': None, 'year': 2006}, 'end': {'month': 5, 'day': None, 'year': 2006}}, 'profile_positions': [{'location': None, 'date': {'start': {'month': 3, 'day': None, 'year': 2006}, 'end': {'month': 5, 'day': None, 'year': 2006}}, 'company': 'MAESSA', 'description': 'Translation of user manuals and assembly guides of industrial machines.', 'title': 'Translator', 'employment_type': None}]}, {'company': {'id': None, 'name': 'AIP Language School, S.L.', 'logo': None, 'url': None, 'employees': {'start': None, 'end': None}}, 'date': {'start': {'month': None, 'day': None, 'year': 2006}, 'end': {'month': None, 'day': None, 'year': 2006}}, 'profile_positions': [{'location': 'Valencia', 'date': {'start': {'month': None, 'day': None, 'year': 2006}, 'end': {'month': None, 'day': None, 'year': 2006}}, 'company': 'AIP Language School, S.L.', 'description': 'Clases de español e historia de España (docencia en inglés) a estudiantes universitarios estadounidenses en un programa de intercambio', 'title': 'Profesora de español para extranjeros e historia (docencia en inglés)', 'employment_type': None}]}, {'company': {'id': None, 'name': 'Interway, S.L.', 'logo': None, 'url': None, 'employees': {'start': None, 'end': None}}, 'date': {'start': {'month': 6, 'day': None, 'year': 2005}, 'end': {'month': 9, 'day': None, 'year': 2005}}, 'profile_positions': [{'location': 'Crewe, Inglaterra', 'date': {'start': {'month': 6, 'day': None, 'year': 2005}, 'end': {'month': 9, 'day': None, 'year': 2005}}, 'company': 'Interway, S.L.', 'description': 'Responsable de estudiantes españoles de 1º de Bachillerato durante su estancia en Crewe (Inglaterra)\nCoordinación y organización de actividades culturales', 'title': 'Supervisora de estudiantes españoles', 'employment_type': None}]}]","[{'date': {'start': {'month': None, 'day': None, 'year': None}, 'end': {'month': None, 'day': None, 'year': None}}, 'role': 'Traducciones al castellano', 'company': {'id': None, 'name': 'Instituto Jane Goodall España', 'logo': 'https://media.licdn.com/dms/image/C4D0BAQFExCFSBTj7EA/company-logo_400_400/0/1663248704637?e=1700697600&v=beta&t=BbNjhYnRSks0PmVniWjvLDceJnu6EY8xL8SuOc0ly0I', 'url': 'https://www.linkedin.com/company/institutojanegoodall/'}, 'cause': 'ENVIRONMENT', 'description': 'Colaboro puntualmente con traducciones del inglés al español'}, {'date': {'start': {'month': None, 'day': None, 'year': 2010}, 'end': {'month': None, 'day': None, 'year': None}}, 'role': 'Correctora', 'company': {'id': None, 'name': 'Revista de Literatura Comparada y Tª de la LIteratura 452ºF', 'logo': None, 'url': None}, 'cause': 'ARTS_AND_CULTURE', 'description': 'Revisión de textos en castellano'}]","['Translation', 'Proofreading', 'Foreign Languages', 'Spanish', 'English', 'Website Localization', 'Localization', 'Legal Translation', 'Technical Translation', 'Language Services', 'Interpreting', 'Subtitling', 'Linguistics', 'Trados', 'Multilingual', 'Medical Translation', 'Machine Translation', 'Internationalization', 'Terminology', 'Language Teaching']",,,
