profile_id,first_name,last_name,sub_title,profile_picture,background_image,profile_type,entity_urn,object_urn,birth_date,summary,location,premium,influencer,treasury_media,languages,industry,education,patents,awards,certifications,organizations,projects,publications,courses,test_scores,position_groups,volunteer_experiences,skills,network_info,related_profiles,contact_info
tiselim,Taha,Selim,"Co-founder/CEO @MolKet | Quantum Education Officer/Lecturer II @AUAS  | Ph.D. Candidate, Quantum Theoretical & Computational Chemistry @RUN | Founder & Developer @codemath.ai",https://media.licdn.com/dms/image/C4E03AQHB98Lrb4gRyg/profile-displayphoto-shrink_800_800/0/1642101757532?e=1697673600&v=beta&t=2JAQUbQFe_vDe8fnob8Mxc-tpU-Pp_qzO1xYnEOxRtU,https://media.licdn.com/dms/image/C4D16AQFvQNEZ9DIq1g/profile-displaybackgroundimage-shrink_350_1400/0/1639160268230?e=1697673600&v=beta&t=tY9sVmWgclyEmJbCjKbKZkMEx9xPGfSPFs4-8zKRZRM,personal,ACoAABwOQrsBM65l-YlsjsOuNrUPzRcAydnhtuk,470696635,,"Chief Executive Officer & co-founder of MolKet (under construction), a superposition of tech and service startup. An AI-assistant which helps in writing chemistry packages and modules for molecular design in chemistry and materials and choose the best computing architecture to  perform large scale computations. Choices include quantum computers, high performance computing, and special dedicated chips like GPUs, TPUs, and ASIC AI. 
 MolKet offers designing new smart solutions leveraging quantum technologies and quantum chemistry. 

PhD candidate in quantum theoretical and computational chemistry at Radboud University Nijmegen, the Netherlands. 

Selim holds a master degree in physics, lasers, and materials from University of Burgundy and University of Paris-Saclay from France. 

===
 MolKet: Co-founded with Alain Chancé, the Chief Business Officer and co-founder. MolKet offers an integrated cloud services with modular design tools that enable customers to perform molecular design and computations in a modular fashion without worrying about the efficiency or the coding parts of the core modules for the simulations. MolKet optimizer, based on the problem, can choose the proper computing architecture for the problem.In that way, the user can harness the power of the hybrid architecture combining quantum computing with high performance computing. Choices include QPUs, GPUs, CPUs, and special computing chips like ASIC AI and TPUs. Among the services, training, consultancy, and knowledge transfer are presented as well.  

PhD publications: co-authored few profound publications involving new quantum computational methods and algorithms to enable large molecular simulations in computational chemistry for the multi-billion international James Webb Space Telescope within the Dutch Astronomical Network II. Such methods and algorithms are integrated in the simulation packages to provide data used by researchers studying the chemical anatomy of interstellar media such as protoplanetary disks in deep outer space. 

M.Sc. thesis: Simulating  the quantum control process and fine-tune the femtosecond laser parameters to control the reactions channels and favor the desired outcomes. The project presents the basis for chemical control for a personal care company. 

B.Sc.: contributed to test new types of super-symmetric Hamiltonians (SUSY-H). These Hamiltonian provide easy way to compute excited states using second quantization using the variational principle.","{'country': 'Netherlands', 'short': 'Amsterdam Area', 'city': None, 'state': None, 'default': 'Amsterdam Area'}",False,False,[],"{'primary_locale': {'country': 'US', 'language': 'en'}, 'supported_locales': [{'country': 'US', 'language': 'en'}], 'profile_languages': [{'name': 'Arabic', 'proficiency': None}, {'name': 'Dutch', 'proficiency': 'ELEMENTARY'}, {'name': 'English', 'proficiency': None}, {'name': 'French', 'proficiency': None}]}",Higher Education,"[{'date': {'start': {'month': 9, 'day': None, 'year': 2017}, 'end': {'month': 6, 'day': None, 'year': 2023}}, 'school': {'name': 'Radboud University', 'logo': 'https://media.licdn.com/dms/image/C4E0BAQHgdni-2v0psQ/company-logo_400_400/0/1670846116863?e=1700697600&v=beta&t=vgJeC3CA6j7MZM594LPJ9niyV2uONRQXRNwcseFWVLI', 'url': 'https://www.linkedin.com/school/radboud-university-nijmegen/'}, 'degree_name': 'Doctor of Philosophy - PhD', 'field_of_study': 'Theoretical Chemistry'}, {'date': {'start': {'month': None, 'day': None, 'year': 2016}, 'end': {'month': None, 'day': None, 'year': 2017}}, 'school': {'name': 'Université de Bourgogne', 'logo': 'https://media.licdn.com/dms/image/C4D0BAQHp0NXLR49Hng/company-logo_400_400/0/1519952475834?e=1700697600&v=beta&t=vihPrHmVFbPbTHSNgj-cSS0wxPmB5KafnS6QXmFjnqU', 'url': 'https://www.linkedin.com/school/universit%C3%A9-de-bourgogne/'}, 'degree_name': ""Master's degree"", 'field_of_study': 'Theoretical/Computational Chemical Physics, Quantum Control and Ultrafast Dynamics'}, {'date': {'start': {'month': None, 'day': None, 'year': 2011}, 'end': {'month': None, 'day': None, 'year': 2015}}, 'school': {'name': 'The American University in Cairo', 'logo': 'https://media.licdn.com/dms/image/C4E0BAQGjzyYT-NNNFw/company-logo_400_400/0/1610442280959?e=1700697600&v=beta&t=wl6nF_D6KqgBwjHIbY5ue4lOf-hkeRT2yi2xNfJ5U3A', 'url': 'https://www.linkedin.com/school/aucegypt/'}, 'degree_name': 'Bachelor’s Degree', 'field_of_study': 'Physics Major and Math Minor'}, {'date': {'start': {'month': None, 'day': None, 'year': 2009}, 'end': {'month': None, 'day': None, 'year': 2011}}, 'school': {'name': 'Higher Institute of Engineering, El Shrouk Academy', 'logo': None, 'url': None}, 'degree_name': 'Associated Degree', 'field_of_study': 'Electrical, Electronics and Communications Engineering'}, {'date': {'start': {'month': None, 'day': None, 'year': 2009}, 'end': {'month': None, 'day': None, 'year': 2011}}, 'school': {'name': 'University of Central Lancashire', 'logo': 'https://media.licdn.com/dms/image/C4E0BAQEpYjLJop5d3g/company-logo_400_400/0/1663750298072?e=1700697600&v=beta&t=Kf5qh_i4SHqMM0gA7QK24CUM--hq1mu0HYEoQp-oGMI', 'url': 'https://www.linkedin.com/school/university-of-central-lancashire/'}, 'degree_name': 'Diploma Certificates', 'field_of_study': 'Physics, IT and Cosmology'}, {'date': {'start': {'month': None, 'day': None, 'year': 2009}, 'end': {'month': None, 'day': None, 'year': 2010}}, 'school': {'name': 'Brigham Young University', 'logo': 'https://media.licdn.com/dms/image/C560BAQFRMyoXTVO86A/company-logo_400_400/0/1646864910207?e=1700697600&v=beta&t=uUloQQBQbeqz0F8-xEaS_Qk89Zx7Is-4HRrCqCkamE4', 'url': 'https://www.linkedin.com/school/brigham-young-university/'}, 'degree_name': ""Associate's degree"", 'field_of_study': 'Physics'}]",[],"[{'title': 'EU TASQ travel grant', 'description': None, 'issuer': 'Nicolaus Copernicus University in Toruń, Poland', 'date': {'month': 2, 'day': None, 'year': 2019}}, {'title': 'Supplementary Program Scholarship', 'description': None, 'issuer': 'Masr El Kheir Foundation', 'date': {'month': 2, 'day': None, 'year': 2017}}, {'title': 'Supplementary Program Scholarship', 'description': None, 'issuer': 'Masr El Kheir Foundation', 'date': {'month': 8, 'day': None, 'year': 2016}}, {'title': 'Cultural and Innovational Scholarship', 'description': None, 'issuer': 'The American University in Cairo', 'date': {'month': 9, 'day': None, 'year': 2015}}, {'title': 'Outstanding Academic Achievement', 'description': None, 'issuer': 'Department of Physics, the American University in Cairo', 'date': {'month': 4, 'day': None, 'year': 2015}}, {'title': 'Supplementary Program Scholarship', 'description': None, 'issuer': 'Masr El Kheir Foundation', 'date': {'month': 2, 'day': None, 'year': 2015}}, {'title': 'Cultural and Innovational Scholarship', 'description': None, 'issuer': 'The American University in Cairo', 'date': {'month': 9, 'day': None, 'year': 2014}}, {'title': 'Exemplary Student', 'description': None, 'issuer': 'Department of Physics, the American University in Cairo', 'date': {'month': 4, 'day': None, 'year': 2014}}, {'title': 'Highest GPA & Outstanding Academic Achievement', 'description': None, 'issuer': 'Department of Physics, the American University in Cairo', 'date': {'month': 4, 'day': None, 'year': 2014}}, {'title': 'Supplementary Program Scholarship', 'description': None, 'issuer': 'Masr El Kheir Foundation', 'date': {'month': 2, 'day': None, 'year': 2014}}, {'title': 'Cultural and Innovational Scholarship', 'description': None, 'issuer': 'The American University in Cairo', 'date': {'month': 9, 'day': None, 'year': 2013}}, {'title': 'Supplementary Program Scholarship', 'description': None, 'issuer': 'Masr El Kheir Foundation', 'date': {'month': 2, 'day': None, 'year': 2013}}, {'title': 'Cultural and Innovational Scholarship', 'description': None, 'issuer': 'The American University in Cairo', 'date': {'month': 9, 'day': None, 'year': 2012}}, {'title': 'Cultural and Innovational Scholarship', 'description': None, 'issuer': 'The American University in Cairo', 'date': {'month': 9, 'day': None, 'year': 2011}}]","[{'name': 'IBM Quantum Challenge: Spring 2023 ', 'date': {'start': {'month': 5, 'day': None, 'year': 2023}, 'end': {'month': None, 'day': None, 'year': None}}, 'authority': 'IBM', 'url': 'https://www.credly.com/badges/996b96b3-1105-4433-8aab-6a68d718ff4e/public_url', 'license_number': None, 'display_source': 'credly.com', 'company': {'id': None, 'name': 'IBM', 'logo': 'https://media.licdn.com/dms/image/D560BAQGiz5ecgpCtkA/company-logo_400_400/0/1688684715427?e=1700697600&v=beta&t=u5Re06Myc9BstE2M6qN9MMORKODl8XmTlCBTPMoVtXk', 'url': None}}, {'name': 'Quantum Computing for Chemistry – The Next Revolution', 'date': {'start': {'month': 10, 'day': None, 'year': 2022}, 'end': {'month': None, 'day': None, 'year': None}}, 'authority': 'University of Strasbourg', 'url': None, 'license_number': None, 'display_source': None, 'company': {'id': None, 'name': 'University of Strasbourg', 'logo': 'https://media.licdn.com/dms/image/C4D0BAQHbW1O_4GqwEw/company-logo_400_400/0/1519863750189?e=1700697600&v=beta&t=6Sf92mmhTsOW_sobeDMSEHtS1Op5ixkbGEEJDIHacLw', 'url': None}}, {'name': 'Qiskit Global Summer School 2022 - Quantum Simulations', 'date': {'start': {'month': 8, 'day': None, 'year': 2022}, 'end': {'month': None, 'day': None, 'year': None}}, 'authority': 'IBM', 'url': 'https://www.credly.com/badges/0b6bb23c-12e1-4ba2-bfc7-24f3f3be8be4/linked_in_profile', 'license_number': None, 'display_source': 'credly.com', 'company': {'id': None, 'name': 'IBM', 'logo': 'https://media.licdn.com/dms/image/D560BAQGiz5ecgpCtkA/company-logo_400_400/0/1688684715427?e=1700697600&v=beta&t=u5Re06Myc9BstE2M6qN9MMORKODl8XmTlCBTPMoVtXk', 'url': None}}, {'name': 'Quantum Evangelist - Associate', 'date': {'start': {'month': 3, 'day': None, 'year': 2022}, 'end': {'month': None, 'day': None, 'year': None}}, 'authority': 'QT4HC | Quantum Tech for Healthcare', 'url': 'https://www.credential.net/2d5f66d7-16ac-4131-b78d-1895ec9334b9', 'license_number': '47497461', 'display_source': 'credential.net', 'company': {'id': None, 'name': 'QT4HC | QuantumTech for Healthcare', 'logo': 'https://media.licdn.com/dms/image/C4E0BAQGfJjoiIQPwIw/company-logo_400_400/0/1643979168533?e=1700697600&v=beta&t=_TSw9bSfWWWxElEyJu_mugI4eqvQ_Zy8lLdX_6D1EQ4', 'url': None}}, {'name': 'The Data Science of Healthcare, Medicine, and Public Health, with Barton Poulson', 'date': {'start': {'month': 7, 'day': None, 'year': 2020}, 'end': {'month': None, 'day': None, 'year': None}}, 'authority': 'LinkedIn', 'url': 'https://www.linkedin.com/learning/certificates/2b02ef2fa504425c501f81cf7a74b2901571148064ab956c61cdbd3b32e9c3ec?trk=backfilled_certificate', 'license_number': None, 'display_source': 'linkedin.com', 'company': {'id': None, 'name': 'LinkedIn', 'logo': 'https://media.licdn.com/dms/image/C560BAQHaVYd13rRz3A/company-logo_400_400/0/1638831589865?e=1700697600&v=beta&t=e1FsZytsym0fLF5Jt7PFnH40bqJRRzdgJ5LH7Y3pJJM', 'url': None}}, {'name': 'M.Sc. of Physics: Theoretical/Chemical Physics, Femto & Atto Lasers, Materials & Ultrafast Dynamics', 'date': {'start': {'month': 7, 'day': None, 'year': 2017}, 'end': {'month': None, 'day': None, 'year': None}}, 'authority': 'Université de Bourgogne', 'url': None, 'license_number': None, 'display_source': None, 'company': None}, {'name': 'B.Sc. of Physics Major and Math Minor', 'date': {'start': {'month': 7, 'day': None, 'year': 2015}, 'end': {'month': None, 'day': None, 'year': None}}, 'authority': 'The American University in Cairo', 'url': 'http://aucegypt.edu/', 'license_number': None, 'display_source': 'aucegypt.edu', 'company': None}]","[{'name': 'AUC Times', 'position': 'Writer', 'date_start': {'month': 9, 'day': None, 'year': 2014}, 'date_end': {'month': 6, 'day': None, 'year': 2015}}, {'name': 'The Assembly', 'position': 'Writer', 'date_start': {'month': 9, 'day': None, 'year': 2014}, 'date_end': {'month': 6, 'day': None, 'year': 2015}}, {'name': 'Cosmos Radio', 'position': 'Founder and President', 'date_start': {'month': 2, 'day': None, 'year': 2013}, 'date_end': {'month': 2, 'day': None, 'year': 2015}}, {'name': 'Society of Physics Students', 'position': 'President', 'date_start': {'month': 2, 'day': None, 'year': 2012}, 'date_end': {'month': 6, 'day': None, 'year': 2014}}, {'name': 'AUC Science Outreach, School of Sciences and Engineering', 'position': 'Physics Outreach Assistant', 'date_start': {'month': 9, 'day': None, 'year': 2012}, 'date_end': {'month': 12, 'day': None, 'year': 2012}}, {'name': 'AUC Astronomy Club', 'position': 'Head of Academic Committee', 'date_start': {'month': 2, 'day': None, 'year': 2012}, 'date_end': {'month': 6, 'day': None, 'year': 2012}}]",[],"[{'name': 'Efficient computational methods for rovibrational transition rates in molecular collisions', 'publisher': 'The Journal of Chemical Physics (JCP)', 'url': 'https://aip.scitation.org/doi/10.1063/5.0102224', 'date': {'month': None, 'day': None, 'year': 2022}, 'authors': [{'type': 'standardizedContributor', 'first_name': 'Taha', 'last_name': 'Selim', 'name': None, 'headline': 'Co-founder/CEO @MolKet | Quantum Education Officer/Lecturer II @AUAS  | Ph.D. Candidate, Quantum Theoretical & Computational Chemistry @RUN | Founder & Developer @codemath.ai'}]}, {'name': ""Multi-channel distorted-wave Born approximation for rovibrational transition rates in molecular collisions (Editor's pick)"", 'publisher': 'Journal of Chemical Physics', 'url': 'https://aip.scitation.org/doi/10.1063/5.0058576', 'date': {'month': None, 'day': None, 'year': 2021}, 'authors': [{'type': 'standardizedContributor', 'first_name': 'Taha', 'last_name': 'Selim', 'name': None, 'headline': 'Co-founder/CEO @MolKet | Quantum Education Officer/Lecturer II @AUAS  | Ph.D. Candidate, Quantum Theoretical & Computational Chemistry @RUN | Founder & Developer @codemath.ai'}]}]","[{'name': 'Analytic Storytelling ', 'number': None}, {'name': 'Energy, Matter and the Universe', 'number': None}, {'name': 'Grant Writing Course', 'number': None}, {'name': 'IT for Astronomy', 'number': None}, {'name': 'Introduction to Cosmology', 'number': None}, {'name': 'Qiskit Global Summer School 2022 on Quantum Simulations', 'number': 'IBM Quantum'}, {'name': 'The 4th MOLIM Training School (BETS) Toruń 2018, Poland. COST action', 'number': None}, {'name': 'Toruń Astrophysics, Spectroscopy and Quantum Chemistry Summer School, 2019, Toruń, Poland', 'number': None}, {'name': 'Winter School on Theoretical Chemistry and Spectroscopy, 2017. Hans-sur-Lesse, Belgium, University of Amsterdam', 'number': None}, {'name': 'Winter School on Theoretical Chemistry and Spectroscopy, 2018 Hans-sur-Lesse, Belgium, University of Amsterdam', 'number': None}]","[{'name': 'The International English Language Testing System (IELTS) July 2015', 'score': '6.5/9', 'date': {'month': 7, 'day': None, 'year': 2015}}, {'name': 'The International English Language Testing System (IELTS) August 2011', 'score': '6.5/9.0', 'date': {'month': 8, 'day': None, 'year': 2011}}]","[{'company': {'id': 6945, 'name': 'Amsterdam University of Applied Sciences', 'logo': 'https://media.licdn.com/dms/image/C4E0BAQG5N3LiFgKyuA/company-logo_400_400/0/1659945616039?e=1700697600&v=beta&t=8OworEyD4oEfqFRti-s0k3rm_mMdhO39A-bQahfFVUg', 'url': 'https://www.linkedin.com/school/hogeschool-van-amsterdam/', 'employees': {'start': 1001, 'end': 5000}}, 'date': {'start': {'month': 8, 'day': None, 'year': 2023}, 'end': {'month': None, 'day': None, 'year': None}}, 'profile_positions': [{'location': 'Amsterdam, North Holland, Netherlands', 'date': {'start': {'month': 8, 'day': None, 'year': 2023}, 'end': {'month': None, 'day': None, 'year': None}}, 'company': 'Amsterdam University of Applied Sciences', 'description': None, 'title': 'Quantum Education Officer/Lecturer II', 'employment_type': 'Part-time'}]}, {'company': {'id': 81687949, 'name': 'MolKet', 'logo': 'https://media.licdn.com/dms/image/C4D0BAQHCBAmJv9fnyQ/company-logo_400_400/0/1642434886536?e=1700697600&v=beta&t=52yhfP9Vh3Slx4dMiPpXYIA-DHHS7WwhyxsNXoEjlSU', 'url': 'https://www.linkedin.com/company/molket/', 'employees': {'start': 2, 'end': 10}}, 'date': {'start': {'month': 4, 'day': None, 'year': 2023}, 'end': {'month': None, 'day': None, 'year': None}}, 'profile_positions': [{'location': 'Radboud University Nijmegen, the Netherlands', 'date': {'start': {'month': 4, 'day': None, 'year': 2023}, 'end': {'month': None, 'day': None, 'year': None}}, 'company': 'MolKet', 'description': 'Cloud-based software services & computational tools for molecular/chemical/material design & simulations using hybrid HPC/quantum computing.', 'title': 'Co-founder & Developer', 'employment_type': 'Part-time'}]}, {'company': {'id': 6901, 'name': 'Radboud University Nijmegen', 'logo': 'https://media.licdn.com/dms/image/C4E0BAQHgdni-2v0psQ/company-logo_400_400/0/1670846116863?e=1700697600&v=beta&t=vgJeC3CA6j7MZM594LPJ9niyV2uONRQXRNwcseFWVLI', 'url': 'https://www.linkedin.com/school/radboud-university-nijmegen/', 'employees': {'start': 5001, 'end': 10000}}, 'date': {'start': {'month': 9, 'day': None, 'year': 2017}, 'end': {'month': None, 'day': None, 'year': None}}, 'profile_positions': [{'location': 'Nijmegen Area, Netherlands', 'date': {'start': {'month': 9, 'day': None, 'year': 2017}, 'end': {'month': None, 'day': None, 'year': None}}, 'company': 'Radboud University', 'description': 'Thesis: Efficient algorithms for quantum molecular dynamics.\nWork included:\ndeveloping physical and theoretical models, algorithms, & computational models to simulate molecular collisions, collision rate calculations vs. radiative rates, heavy quantum chemistry modeling and calculations, high-performance computing, comparing calculations/models to experimental data, and high-resolution spectroscopy data.\nTasks/projects :\n- Developed a group of new algorithms and their software and optimized them for high-performance computing.\n- Analyzed the experimental and theoretical results, modeled them mathematically by advanced fitting techniques, and physically modeled/interpreted them.\n- Wrote multiple scientific papers and reports, gave presentations in international events, and wrote codes for the local GitHub/GitLab repositories.\nAchievements:\nNew quantum-theoretical models and computational methods to calculate the collision rates effectively and simulate molecular interactions, and calculate collision rates.\n\nTeaching:\nI have participated in teaching the following courses/labs:\nApplied Quantum Chemistry Computer lab (advanced B.Sc. level)\nQuantum Theoretical Chemistry (advanced B.Sc. level)\nQuantum Chemistry (Master Level)\nQuantum Dynamics (Master Level)\nNumerical Methods (Master Level)\nProgramming I (Bachelor level)\nProgramming II (Bachelor level)', 'title': 'PHD Candidate, Theoretical & Computational Chemistry', 'employment_type': 'Full-time'}, {'location': 'Arnhem-Nijmegen Region', 'date': {'start': {'month': 11, 'day': None, 'year': 2021}, 'end': {'month': 12, 'day': None, 'year': 2022}}, 'company': 'Radboud University', 'description': 'Nov 2021 - Dec 2022: based on education innovation grant. \nCreating JupyterHub applications and services for CS and numerical methods master degree courses, and programming courses for bachelor at Radboud University.', 'title': 'Instructor & Software Application Developer', 'employment_type': 'Contract'}]}, {'company': {'id': 43339166, 'name': 'codemath.ai', 'logo': 'https://media.licdn.com/dms/image/C4D0BAQHhdW7WkcAUUQ/company-logo_400_400/0/1599816688636?e=1700697600&v=beta&t=HWh7X6uBoanAtKOw80t-CQpb90s-yFG66u8KIRTMDyA', 'url': 'https://www.linkedin.com/company/code-math-ai/', 'employees': {'start': 0, 'end': 1}}, 'date': {'start': {'month': 5, 'day': None, 'year': 2022}, 'end': {'month': None, 'day': None, 'year': None}}, 'profile_positions': [{'location': 'Online', 'date': {'start': {'month': 5, 'day': None, 'year': 2022}, 'end': {'month': None, 'day': None, 'year': None}}, 'company': 'codemath.ai', 'description': 'A platform for free tutorials on numerical computing and modeling for academia and industry.', 'title': 'Founder & Algorithm Developer', 'employment_type': None}]}, {'company': {'id': 1165891, 'name': 'Paris-Sud University (Paris XI)', 'logo': 'https://media.licdn.com/dms/image/C4D0BAQGlw0NFg2zHlg/company-logo_400_400/0/1519878695237?e=1700697600&v=beta&t=i7-1AbPTwJguwEMgH4iWUsX5b1uibscpEFm7p2XrVk8', 'url': 'https://www.linkedin.com/school/universit-paris-sud/', 'employees': {'start': 5001, 'end': 10000}}, 'date': {'start': {'month': 2, 'day': None, 'year': 2017}, 'end': {'month': 8, 'day': None, 'year': 2017}}, 'profile_positions': [{'location': 'Orsay, France', 'date': {'start': {'month': 2, 'day': None, 'year': 2017}, 'end': {'month': 8, 'day': None, 'year': 2017}}, 'company': 'Paris-Sud University (Paris XI)', 'description': ""Research Intern at Dynamiques et Interactions: Rayonnement, Atomes, Molécules (DIRAM) Research Group, CNRS Lab, Institut des Sciences Moléculaires d'Orsay, - UMR 821, Paris Saclay Université and Paris SUD Université.\n\nTopic: Control of nuclear quantum interferences in molecular processes with working on MCTDHF Package . This work involved a theoretical and computational study fir MCTDHF code on the electronic wavepackets propagation for H2."", 'title': 'Intern Research Assistant', 'employment_type': None}]}, {'company': {'id': 34787, 'name': 'German University in Cairo', 'logo': 'https://media.licdn.com/dms/image/C4D0BAQEPcpt4gRL1hA/company-logo_400_400/0/1519856892421?e=1700697600&v=beta&t=zDG7Q3fyFX2mZ4HvXntaj4h02izF5HkRQjlSHyDTkaU', 'url': 'https://www.linkedin.com/school/german-university-in-cairo/', 'employees': {'start': 1001, 'end': 5000}}, 'date': {'start': {'month': 2, 'day': None, 'year': 2016}, 'end': {'month': 8, 'day': None, 'year': 2016}}, 'profile_positions': [{'location': 'New Cairo', 'date': {'start': {'month': 2, 'day': None, 'year': 2016}, 'end': {'month': 8, 'day': None, 'year': 2016}}, 'company': 'The German University in Cairo', 'description': 'Teaching Freshman Physics Problems: Mechanics, Electromagnetism, Thermodynamics, and Optics. \nAssisting the Supervision of Graduation Projects of Engineering Students.', 'title': 'Teaching Assistant', 'employment_type': None}]}, {'company': {'id': 15509, 'name': 'The American University in Cairo', 'logo': 'https://media.licdn.com/dms/image/C4E0BAQGjzyYT-NNNFw/company-logo_400_400/0/1610442280959?e=1700697600&v=beta&t=wl6nF_D6KqgBwjHIbY5ue4lOf-hkeRT2yi2xNfJ5U3A', 'url': 'https://www.linkedin.com/school/aucegypt/', 'employees': {'start': 1001, 'end': 5000}}, 'date': {'start': {'month': 2, 'day': None, 'year': 2016}, 'end': {'month': 6, 'day': None, 'year': 2016}}, 'profile_positions': [{'location': 'New Cairo', 'date': {'start': {'month': 2, 'day': None, 'year': 2016}, 'end': {'month': 6, 'day': None, 'year': 2016}}, 'company': 'The American University in Cairo', 'description': 'Teaching the Nuclear Physics Lab as assistant , Physics Department, AUC.', 'title': 'Teaching Assistant', 'employment_type': None}]}, {'company': {'id': 55699, 'name': 'Joint Institute for Nuclear Research', 'logo': 'https://media.licdn.com/dms/image/C4E0BAQGCnMpjZD-9Yg/company-logo_400_400/0/1519856640127?e=1700697600&v=beta&t=v7vpvyLfovbQxMRWLin2bc6e4YliC18orHpM9jacPmE', 'url': 'https://www.linkedin.com/company/joint-institute-for-nuclear-research/', 'employees': {'start': 5001, 'end': 10000}}, 'date': {'start': {'month': 5, 'day': None, 'year': 2015}, 'end': {'month': 6, 'day': None, 'year': 2015}}, 'profile_positions': [{'location': 'Dubna, Moscow, Russia.', 'date': {'start': {'month': 5, 'day': None, 'year': 2015}, 'end': {'month': 6, 'day': None, 'year': 2015}}, 'company': 'Joint Institute for Nuclear Research', 'description': 'Working on particle physics projects during the 7th International Summer School in Dubna.', 'title': 'Research Assistant', 'employment_type': None}]}, {'company': {'id': None, 'name': 'The American University in Cairo', 'logo': None, 'url': None, 'employees': {'start': None, 'end': None}}, 'date': {'start': {'month': 2, 'day': None, 'year': 2015}, 'end': {'month': 5, 'day': None, 'year': 2015}}, 'profile_positions': [{'location': 'Cairo, Egypt.', 'date': {'start': {'month': 2, 'day': None, 'year': 2015}, 'end': {'month': 5, 'day': None, 'year': 2015}}, 'company': 'The American University in Cairo', 'description': 'Working to help students doing experiments, analysis and correct assignments, and help the instructor for doing other academic tasks.', 'title': 'Undergraduate Teaching Assistant', 'employment_type': None}]}, {'company': {'id': None, 'name': 'Cosmos Radio', 'logo': None, 'url': None, 'employees': {'start': None, 'end': None}}, 'date': {'start': {'month': 2, 'day': None, 'year': 2013}, 'end': {'month': 5, 'day': None, 'year': 2014}}, 'profile_positions': [{'location': 'The American University in Cairo', 'date': {'start': {'month': 2, 'day': None, 'year': 2013}, 'end': {'month': 5, 'day': None, 'year': 2014}}, 'company': 'Cosmos Radio', 'description': 'Blending science with drama and music to make the scientific knowledge accessible for everyone. Presenting many science programs and social activities.', 'title': 'President', 'employment_type': None}]}]","[{'date': {'start': {'month': None, 'day': None, 'year': None}, 'end': {'month': None, 'day': None, 'year': None}}, 'role': 'Organizational Committee Member for many Community and Energy Conferences.', 'company': {'id': None, 'name': 'AUC, GUC, ASU, ...etc.', 'logo': None, 'url': None}, 'cause': None, 'description': 'Good Experience, learning a lot about Civil works and engage academic community to the public community. '}]","['Research', 'Statistics', 'Linux', 'Mathematics', 'Data Analysis', 'Higher Education', 'Electronics', 'Entrepreneurship', 'Project Management', 'Project Planning', 'Crisis Management', 'Machine Learning', 'Data Science', 'Algorithms', 'Modeling', 'Big Data', 'Matlab', 'Adobe Photoshop', 'Adobe Audition', 'Python (Programming Language)']",,,
