profile_id,first_name,last_name,sub_title,profile_picture,background_image,profile_type,entity_urn,object_urn,birth_date,summary,location,premium,influencer,treasury_media,languages,industry,education,patents,awards,certifications,organizations,projects,publications,courses,test_scores,position_groups,volunteer_experiences,skills,network_info,related_profiles,contact_info
julietmacdowell,Juliet,MacDowell,Helping YOU do good in the world 🌍,https://media.licdn.com/dms/image/D4E03AQHnWK_RQDA5AA/profile-displayphoto-shrink_800_800/0/1688988011747?e=1697673600&v=beta&t=UBDrAA6zKUhFNQZHWrCfMSDvcxZVs5Oj2GAV2d427fQ,https://media.licdn.com/dms/image/D4E16AQFqQyG_R3rsEg/profile-displaybackgroundimage-shrink_350_1400/0/1688987927155?e=1697673600&v=beta&t=VaCS3RAzkntpBGCsNkJuNQK2B_tO9A4R2a9KPKDCR_4,personal,ACoAAAC4JNQBaHGme4oWP_UE3Ngu_INtlXLbT-E,12068052,,"Armed with an insatiable curiosity and robust self-motivation, I've navigated diverse career paths - always within the realm of NGOs or social enterprises, finding success and fulfillment at each juncture.

Boasting over 25 years of experience in the NGO sector, I'm a business strategist with a burning passion for driving social change. I specialize in fundraising, marketing, and management, providing comprehensive solutions for development organizations to magnify their impact.

As a self-proclaimed do-gooder, I thrive in helping organizations unlock their potential to change the world. However, don't mistake my mission-driven mindset for softness - I adopt a no-nonsense approach to create tangible, lasting improvements.

If you're driven by the desire to make this world a better place and seek a partner who can provide strategic insights and robust solutions, let's join forces and set the wheels of change in motion!

 #Fundraising #BusinessDevelopment #socialEnterprise #copywriter  #creativewriter #communicationsspecialist #Proposalwriting #marketing #charity #Publicrelations #nonprofit","{'country': 'Netherlands', 'short': 'The Randstad, Netherlands', 'city': 'The Randstad', 'state': 'Netherlands', 'default': 'The Randstad, Netherlands'}",False,False,"[{'url': None, 'title': 'My timeline and skills visualized', 'description': None, 'image': 'https://media.licdn.com/dms/image/C4E2DAQFYG6tZXLXHRA/profile-treasury-document-cover-images_1920/0/1618901901251?e=1692964800&v=beta&t=68CiJgHkKXRL4pvMYKlOLMNAKhC_uzLcuZy6Aax_iVg'}, {'url': None, 'title': '20190225_163126.jpg', 'description': None, 'image': 'https://media.licdn.com/dms/image/C562DAQEsVFUKOfapFA/profile-treasury-image-shrink_8192_8192/0/1602588813256?e=1692964800&v=beta&t=lX6GRB4t_NxCIko5VmJ3Cv2v9b4wQtfMXczHyB_pE54'}, {'url': None, 'title': 'Medium', 'description': 'Medium', 'image': 'https://media.licdn.com/dms/image/C562DAQFinxOYD-w4eQ/profile-treasury-image-shrink_8192_8192/0/1598853991079?e=1692964800&v=beta&t=VUqh-RrT1y9RHkmupt28cPpRVtKDHK6x5CUfiPqEEao'}]","{'primary_locale': {'country': 'US', 'language': 'en'}, 'supported_locales': [{'country': 'US', 'language': 'en'}, {'country': 'ES', 'language': 'es'}, {'country': 'FR', 'language': 'fr'}], 'profile_languages': [{'name': 'Arabic ', 'proficiency': 'LIMITED_WORKING'}, {'name': 'Dutch', 'proficiency': 'ELEMENTARY'}, {'name': 'English ', 'proficiency': 'NATIVE_OR_BILINGUAL'}, {'name': 'French', 'proficiency': 'FULL_PROFESSIONAL'}, {'name': 'Spanish', 'proficiency': 'PROFESSIONAL_WORKING'}]}",Philanthropy,"[{'date': {'start': {'month': None, 'day': None, 'year': None}, 'end': {'month': None, 'day': None, 'year': None}}, 'school': {'name': 'Columbia | SIPA', 'logo': 'https://media.licdn.com/dms/image/C560BAQExiSf7QUxTWA/company-logo_400_400/0/1656672852966?e=1700697600&v=beta&t=yzaii4fur8jo5TQh04l-qNogB9NFXoOj9frZL2zBx5Q', 'url': 'https://www.linkedin.com/school/columbia-sipa/'}, 'degree_name': 'Master of Arts', 'field_of_study': 'Economic Development'}, {'date': {'start': {'month': None, 'day': None, 'year': None}, 'end': {'month': None, 'day': None, 'year': None}}, 'school': {'name': 'Mohammed V University in Rabat', 'logo': 'https://media.licdn.com/dms/image/C560BAQHDcX9JpjpEVA/company-logo_400_400/0/1573470542756?e=1700697600&v=beta&t=b9-wgBp3SzB4rU3diIsCWhEcI1BXXErXl6eAp0QFSU8', 'url': 'https://www.linkedin.com/school/um5rabat/'}, 'degree_name': None, 'field_of_study': 'Arabic Language and Literature'}, {'date': {'start': {'month': None, 'day': None, 'year': None}, 'end': {'month': None, 'day': None, 'year': None}}, 'school': {'name': 'The City University of New York', 'logo': 'https://media.licdn.com/dms/image/D560BAQGCZWsJRWc__Q/company-logo_400_400/0/1683119150128?e=1700697600&v=beta&t=PT1Fb8GdFJU5TXf0Jb98dC6_3x0ySjSOGarQjesXAtA', 'url': 'https://www.linkedin.com/school/city-university-of-new-york/'}, 'degree_name': 'Bachelor of Arts', 'field_of_study': 'International Relations'}, {'date': {'start': {'month': None, 'day': None, 'year': None}, 'end': {'month': None, 'day': None, 'year': None}}, 'school': {'name': 'The Bronx High School of Science', 'logo': 'https://media.licdn.com/dms/image/C4E0BAQHP0Gi0RFX8Fg/company-logo_400_400/0/1586855766716?e=1700697600&v=beta&t=hVZobpZmDy9ELDKnwXUNmbcvn32RbFGBJ3YY0HeqzMM', 'url': 'https://www.linkedin.com/school/the-bronx-high-school-of-science/'}, 'degree_name': 'High School Diploma', 'field_of_study': None}]",[],[],"[{'name': 'Shipley Business Development Certification ', 'date': {'start': {'month': None, 'day': None, 'year': None}, 'end': {'month': None, 'day': None, 'year': None}}, 'authority': None, 'url': None, 'license_number': None, 'display_source': None, 'company': None}]",[],[],"[{'name': 'Mobilizing Agricultural Finance', 'publisher': 'AGRA', 'url': 'https://agra.org/wp-content/uploads/2021/02/Mobilizing-agricultural-finance-2021-02.pdf', 'date': {'month': None, 'day': None, 'year': 2021}, 'authors': [{'type': 'standardizedContributor', 'first_name': 'Juliet', 'last_name': 'MacDowell', 'name': None, 'headline': 'Helping YOU do good in the world 🌍'}]}, {'name': 'The Importance of a Common Language', 'publisher': 'Medium', 'url': 'https://medium.com/@jmacdow/the-importance-of-a-common-language-36f6e447dc53?sk=0b0f185e149213bf1bbdc3ad696c7d39', 'date': {'month': None, 'day': None, 'year': 2019}, 'authors': [{'type': 'standardizedContributor', 'first_name': 'Juliet', 'last_name': 'MacDowell', 'name': None, 'headline': 'Helping YOU do good in the world 🌍'}]}, {'name': 'VERMOGENS EN INSTITUTIONELE FONDSENWERVING: IETS VOOR JOU? ', 'publisher': 'https://nlfl.nl/webinars/institutionele-fondsenwerving-iets-voor-jou', 'url': 'https://nlfl.nl/webinars/institutionele-fondsenwerving-iets-voor-jou', 'date': {'month': None, 'day': None, 'year': 2018}, 'authors': [{'type': 'standardizedContributor', 'first_name': 'Juliet', 'last_name': 'MacDowell', 'name': None, 'headline': 'Helping YOU do good in the world 🌍'}]}, {'name': 'Increasing Access to Prevention of Postpartum Hemorrhage Interventions for Births in Health Facilities and at Home in Four Districts of Rwanda', 'publisher': 'African Journal of Reproductive Health', 'url': 'https://www.jstor.org/stable/24877610', 'date': {'month': None, 'day': None, 'year': 2015}, 'authors': [{'type': 'standardizedContributor', 'first_name': 'Blami', 'last_name': 'Dao', 'name': None, 'headline': 'Technical Director '}, {'type': 'nonStandardizedContributor', 'first_name': None, 'last_name': None, 'name': 'fidele ngabo', 'headline': None}, {'type': 'standardizedContributor', 'first_name': 'Jeremie', 'last_name': 'Zoungrana', 'name': None, 'headline': 'Nigeria Country Office Director at Bill & Melinda Gates Foundation'}, {'type': 'standardizedContributor', 'first_name': 'Barbara', 'last_name': 'Rawlins', 'name': None, 'headline': 'Senior Implementation Research Advisor at USAID - Bureau for Global Health'}, {'type': 'nonStandardizedContributor', 'first_name': None, 'last_name': None, 'name': 'Beata Mukarugwiro', 'headline': None}, {'type': 'nonStandardizedContributor', 'first_name': None, 'last_name': None, 'name': 'Pascal Musoni', 'headline': None}, {'type': 'nonStandardizedContributor', 'first_name': None, 'last_name': None, 'name': 'rachel favero', 'headline': None}, {'type': 'standardizedContributor', 'first_name': 'Juliet', 'last_name': 'MacDowell', 'name': None, 'headline': 'Helping YOU do good in the world 🌍'}, {'type': 'nonStandardizedContributor', 'first_name': None, 'last_name': None, 'name': 'Kanyamanza Eugene', 'headline': None}]}, {'name': 'Mobilizing Private Capital to Provide Low Cost Lighting Services to Marginalized Communities in India', 'publisher': 'USAID', 'url': 'https://www.microlinks.org/blog/time-bed-down-two-vignettes-sleep', 'date': {'month': None, 'day': None, 'year': 2015}, 'authors': [{'type': 'standardizedContributor', 'first_name': 'Juliet', 'last_name': 'MacDowell', 'name': None, 'headline': 'Helping YOU do good in the world 🌍'}, {'type': 'standardizedContributor', 'first_name': 'Kailash Hariharan', 'last_name': 'Iyer', 'name': None, 'headline': 'Sustainability | International Development | Resilient Agriculture | Head of Oxfam Investment Fund'}]}, {'name': 'Finding Sustainable Solutions to Urban Sanitation: Environment-friendly toilets for Bangladesh', 'publisher': 'InterAction', 'url': 'https://www.interaction.org/blog/finding-sustainable-solutions-urban-sanitation-environment-friendly-toilets-bangladesh', 'date': {'month': None, 'day': None, 'year': 2015}, 'authors': [{'type': 'standardizedContributor', 'first_name': 'Juliet', 'last_name': 'MacDowell', 'name': None, 'headline': 'Helping YOU do good in the world 🌍'}]}, {'name': 'Catalyzing Economic Growth in Rwanda', 'publisher': 'InterAction', 'url': 'https://www.interaction.org/blog/catalyzing-economic-growth-rwanda', 'date': {'month': None, 'day': None, 'year': 2015}, 'authors': [{'type': 'standardizedContributor', 'first_name': 'Juliet', 'last_name': 'MacDowell', 'name': None, 'headline': 'Helping YOU do good in the world 🌍'}]}, {'name': 'Benin Doctor’s Private Clinic Addresses Urban Health Needs', 'publisher': 'Jhpiego website', 'url': 'https://www.jhpiego.org/success-story/benin-doctors-private-clinic-addresses-urban-health-needs/', 'date': {'month': None, 'day': None, 'year': 2012}, 'authors': [{'type': 'standardizedContributor', 'first_name': 'Juliet', 'last_name': 'MacDowell', 'name': None, 'headline': 'Helping YOU do good in the world 🌍'}, {'type': 'nonStandardizedContributor', 'first_name': None, 'last_name': None, 'name': 'Horowitz, A', 'headline': None}, {'type': 'nonStandardizedContributor', 'first_name': None, 'last_name': None, 'name': 'Lougbegnon, M', 'headline': None}]}, {'name': 'Quality of Care for Prevention and Management of Common Maternal and Newborn Complications', 'publisher': 'USAID', 'url': 'https://www.mchip.net/sites/default/files/Rwanda_QoC.PDF', 'date': {'month': None, 'day': None, 'year': 2012}, 'authors': [{'type': 'standardizedContributor', 'first_name': 'Juliet', 'last_name': 'MacDowell', 'name': None, 'headline': 'Helping YOU do good in the world 🌍'}]}, {'name': 'Community Health Workers Are Key in Rwanda', 'publisher': 'Jhpiego', 'url': 'https://www.jhpiego.org/success-story/saving-womens-lives-community-health-workers-are-key-in-rwanda/', 'date': {'month': None, 'day': None, 'year': 2011}, 'authors': [{'type': 'standardizedContributor', 'first_name': 'Juliet', 'last_name': 'MacDowell', 'name': None, 'headline': 'Helping YOU do good in the world 🌍'}]}, {'name': 'Increasing access to and use of skilled maternal and newborn care in Dumka district of India', 'publisher': ""Proceedings  Int'l Health Conference at Yale"", 'url': None, 'date': {'month': None, 'day': None, 'year': 2008}, 'authors': [{'type': 'standardizedContributor', 'first_name': 'Juliet', 'last_name': 'MacDowell', 'name': None, 'headline': 'Helping YOU do good in the world 🌍'}]}, {'name': 'Saving Premature and Small Newborns: Introduction and Expansion of KMC Services in Rwanda', 'publisher': None, 'url': 'http://www.accesstohealth.org/about/pgmnews/presentations/20080600a_aloPPTrw.pdf', 'date': {'month': None, 'day': None, 'year': 2008}, 'authors': [{'type': 'standardizedContributor', 'first_name': 'Juliet', 'last_name': 'MacDowell', 'name': None, 'headline': 'Helping YOU do good in the world 🌍'}, {'type': 'nonStandardizedContributor', 'first_name': None, 'last_name': None, 'name': 'Lo, A', 'headline': None}, {'type': 'nonStandardizedContributor', 'first_name': None, 'last_name': None, 'name': 'de Graft Johnson, J', 'headline': None}]}, {'name': 'Faith Based Models for Improving Maternal and Newborn Health', 'publisher': 'USAID', 'url': 'https://pdf.usaid.gov/pdf_docs/Pnadk571.pdf', 'date': {'month': None, 'day': None, 'year': 2007}, 'authors': [{'type': 'standardizedContributor', 'first_name': 'Juliet', 'last_name': 'MacDowell', 'name': None, 'headline': 'Helping YOU do good in the world 🌍'}]}, {'name': 'Beyond Sun and Sand: Caribbean Environmentalisms', 'publisher': 'Rutgers University Press', 'url': 'https://books.google.nl/books?id=WQfkFqhW0qwC&pg=PA65&lpg=PA65&dq=juliet+macdowell&source=bl&ots=y9ioPwS0RR&sig=DPqsV1IgAhTkSttbIGLdAvBg6w0&hl=en&sa=X&ved=0ahUKEwi3nKrBl5zQAhUJBMAKHXxpCPM4ChDoAQghMAA#v=onepage&q=juliet%20macdowell&f=false', 'date': {'month': None, 'day': None, 'year': 2006}, 'authors': [{'type': 'standardizedContributor', 'first_name': 'Juliet', 'last_name': 'MacDowell', 'name': None, 'headline': 'Helping YOU do good in the world 🌍'}]}, {'name': 'Reaching the poor through workplace HIV/AIDS interventions', 'publisher': 'Proceedings for the 2004 HIV/AIDS Conference in Bangkok, Thailand', 'url': None, 'date': {'month': None, 'day': None, 'year': 2004}, 'authors': [{'type': 'standardizedContributor', 'first_name': 'Juliet', 'last_name': 'MacDowell', 'name': None, 'headline': 'Helping YOU do good in the world 🌍'}]}]",[],[],"[{'company': {'id': 71715069, 'name': 'Communicologists Today', 'logo': 'https://media.licdn.com/dms/image/C4E0BAQE5co0j3sDB3A/company-logo_400_400/0/1657257010367?e=1700697600&v=beta&t=8Y5Df-0NaJPV5nWdntIfsiOgoM9CIrYX90NyjZFWmkw', 'url': 'https://www.linkedin.com/company/communicologists-today/', 'employees': {'start': 2, 'end': 10}}, 'date': {'start': {'month': 12, 'day': None, 'year': 2020}, 'end': {'month': None, 'day': None, 'year': None}}, 'profile_positions': [{'location': 'The Randstad, Netherlands', 'date': {'start': {'month': 12, 'day': None, 'year': 2020}, 'end': {'month': None, 'day': None, 'year': None}}, 'company': 'Communicologists Today', 'description': ""🌍 Change Catalyst & Founder of Communicologists Today: Amplifying Impact through Strategic Communication\n\n💡 Visionary Founder: Launched Communicologists Today with an audacious goal - to create a consultancy that makes a difference. Not just for our clients, but for society as a whole.\n\n🤝 Impact Facilitator: Have had the privilege of partnering with countless non-profits and social enterprises, providing the springboard they need to enhance visibility, expand funding sources, and deliver impactful e-learning programs.\n\n💬 Communication Strategists: Our strength lies not just in our comprehensive suite of communication, marketing, and fundraising solutions but also in our approach. We believe in the power of storytelling and strive to help organizations narrate their unique stories in compelling ways.\n\n🏆 Performance Enablers: From securing vital bids to orchestrating emotionally resonant campaigns, we've championed NGOs in standing out online and forging deeper connections with their audience.\n\n🎓 E-Learning Pioneers: Alongside our tailored fundraising and communication strategies, we offer meticulously designed e-learning courses to meet the specific needs of our clients.\n\n🎯 Impact-First Leaders: The pride of our journey is witnessing the transformative ripple effect of our work, as NGOs and social enterprises broaden their reach, heighten their impact, and progress their missions.\n\n💪 Advocate for Effective Communication: Each day, I witness the transformative power of effective communication, as our clients triumph in their endeavors - validating our belief and driving us to deliver more.\n\nIf you're ignited by your mission and seek a partner who can amplify your message, enhance your visibility, and empower you to achieve your goals, let's connect."", 'title': 'Founder', 'employment_type': 'Freelance'}]}, {'company': {'id': 2658205, 'name': 'SCOPEinsight', 'logo': 'https://media.licdn.com/dms/image/C4E0BAQEjGERDbYCgmQ/company-logo_400_400/0/1523882948840?e=1700697600&v=beta&t=6IcsYc74ZB9k3oMaNhGd48u3sk5ai-WtZt1aX1cbDz4', 'url': 'https://www.linkedin.com/company/scopeinsight/', 'employees': {'start': 2, 'end': 10}}, 'date': {'start': {'month': 11, 'day': None, 'year': 2018}, 'end': {'month': 6, 'day': None, 'year': 2022}}, 'profile_positions': [{'location': 'Utrecht Area, Netherlands', 'date': {'start': {'month': 11, 'day': None, 'year': 2018}, 'end': {'month': 6, 'day': None, 'year': 2022}}, 'company': 'SCOPEinsight', 'description': ""📈 Marketing Mastery:\n\n🎯 Lead Generation Dynamo: Engineered strategic marketing mix, supercharging lead generation by 27%.\n\n🔍 SEO Wizard: Unveiled an aggressive SEO plan, rocketing our Moz score by 56% and fueling a 42% rise in organic website conversions.\n\n📱 User Experience Architect: Conceived a refreshed website and mobile UX, driving a 29% surge in conversion rates and slashing bounce rates by 21%.\n\n📡 Holistic Marketer: Choreographed a blend of digital, traditional, and social media marketing strategies, complemented by email nurturing campaigns and communication plans.\n\n🖊️ Thought Leader: Authored white papers and abstracts, and led highly attended webinars, elevating SCOPEinsight's reputation as a sector leader.\n\n🛠️ Product Development Ally: Supported product evolution with SCOPEinsight events, explanatory webinars, trial sessions, and product launches. Gathered crucial feedback on tools, methodologies, and strategic considerations.\n\n🎁 Sales Enablement: Designed compelling brochures, presentations, and other sales support materials, fueling the effectiveness of our sales team.\n\n💼 Business Development Expertise:\n\n🤝 Strategic Relationship Cultivator: Developed essential partnerships to boost donor-led initiatives.\n\n📜 Proposal Maestro: Authored persuasive proposals, and developed a 'shelf language' for streamlined proposal submissions.\n\n📋 Process Innovator: Established and enforced robust bidding procedures, supporting colleagues in proposal development."", 'title': 'Marketing & Development Director', 'employment_type': None}]}, {'company': {'id': 1399745, 'name': 'BoP Innovation Center', 'logo': 'https://media.licdn.com/dms/image/C4E0BAQFZ1X9nk7PFeQ/company-logo_400_400/0/1593533186486?e=1700697600&v=beta&t=BcUO4wUnx0r_cjAFAyIQOxk1TWuS_3RBfNpnvll4dxg', 'url': 'https://www.linkedin.com/company/bopinc/', 'employees': {'start': 11, 'end': 50}}, 'date': {'start': {'month': 7, 'day': None, 'year': 2017}, 'end': {'month': 10, 'day': None, 'year': 2018}}, 'profile_positions': [{'location': 'Utrecht Area, Netherlands', 'date': {'start': {'month': 7, 'day': None, 'year': 2017}, 'end': {'month': 10, 'day': None, 'year': 2018}}, 'company': 'Bopinc', 'description': ""⚡ Results-Driven Business Development Leader ⚡\n\n🎯 Mission and Goals: With the management team, contributed to developing organizational goals, targets, and strategic fundraising plans to secure sustainable growth and profitability.\n\n💼 Strategic Communications: Skillfully stewarded the conception, development, and execution of the company's comprehensive communications plan, ensuring brand consistency and reach.\n\n🔍 Business Intelligence Hub: Proactively served as a key resource, undertaking rigorous analysis and synthesis of crucial data to predict and prepare for new business opportunities.\n\n🌐 Relationship Management: Forged and nurtured strategic partnerships, solidifying our network and creating a robust ecosystem of potential collaborators.\n\n🎓 Team Empowerment: Acted as a mentor and guide to regional offices, imparting Business Development wisdom, fostering an environment of shared learning and growth.\n\n🖋️ Master Storyteller: Principal author of persuasive communications and proposals, winning stakeholder hearts and minds with compelling narratives.\n\n💰 Financial Achievements: Strategically positioned the organization to excel in its industry, successfully doubling revenue and enhancing fiscal performance."", 'title': 'Business Development and Communications Director', 'employment_type': None}]}, {'company': {'id': 1058484, 'name': 'i+solutions', 'logo': 'https://media.licdn.com/dms/image/C4D0BAQG5HvAsbJm61w/company-logo_400_400/0/1620051563749?e=1700697600&v=beta&t=D4zdxsS13msG5YKLlCPuzqsbzMkSZ3luCYsa8Sg-U14', 'url': 'https://www.linkedin.com/company/iplussolutions/', 'employees': {'start': 51, 'end': 200}}, 'date': {'start': {'month': 1, 'day': None, 'year': 2016}, 'end': {'month': 6, 'day': None, 'year': 2017}}, 'profile_positions': [{'location': 'Netherlands', 'date': {'start': {'month': 1, 'day': None, 'year': 2016}, 'end': {'month': 6, 'day': None, 'year': 2017}}, 'company': 'i+solutions', 'description': '💡 Dynamic Business Development Strategist 💡\n\n📈 Portfolio Expansion: Demonstrated stellar strategic acumen by driving a 25% portfolio expansion, thus solidifying our financial growth and market position.\n\n🌍 Global Opportunity Hunter: Scoured the global market and a diverse donor pool, pinpointing untapped opportunities perfectly aligned with donor priorities.\n\n🔍 Business Intelligence Hub: Functioned as a pivotal resource, adeptly analyzing, synthesizing, and disseminating advance intelligence for new business development.\n\n🗓️ Strategic Planning Maestro: Sculpted annual and quarterly strategic plans for business development, tailoring action plans for specific opportunities to ensure optimal outcomes.\n\n🤝 Client Relationship Builder: Amplified our client base, reinforcing efforts to maintain and expand our network of key contacts in funding agencies, with a particular focus on health and pharmaceutical supply chain funding.\n\n🎯 Technical Approach Developer: Devised marketable technical strategies, ensuring our offerings remain cutting-edge and competitive.', 'title': 'Business Development Consultant', 'employment_type': None}]}, {'company': {'id': None, 'name': 'Nonprofit Solutions,  Llc', 'logo': None, 'url': None, 'employees': {'start': None, 'end': None}}, 'date': {'start': {'month': 10, 'day': None, 'year': 2015}, 'end': {'month': 5, 'day': None, 'year': 2017}}, 'profile_positions': [{'location': 'Washington D.C. Metro Area', 'date': {'start': {'month': 10, 'day': None, 'year': 2015}, 'end': {'month': 5, 'day': None, 'year': 2017}}, 'company': 'Nonprofit Solutions,  Llc', 'description': ""🌟 Pioneering Leader at a High-Impact Consultancy 🌟\n\nSpearheading a dedicated team of 6 consultants, we are the secret weapon powering non-profit organizations including INGOs, CBOs, Universities, and Hospitals. We provide a comprehensive suite of services tailored to the unique needs of the non-profit sector:\n\n🔍 Foundation Fundraising: We delve into the landscape, strategize, and craft compelling proposals, fueling your funding goals.\n\n💼 Institutional Fundraising: We're masters of the institutional funding landscape, conducting competitive analyses, carving out strategic approaches, and authoring persuasive proposals to garner substantial support.\n\n🎯 Individual Fundraising: We craft customized communication plans, harnessing demographic and other market segmentation data, to engage your donor base effectively.\n\n🌐 Brand and Product Development: We breathe life into your brand and product visions, shaping your organization's identity and portfolio for maximum impact.\n\n📡 Communications Strategy: We develop comprehensive communication strategies that resonate with your target audience, amplifying your message and your mission.\n\n🎉 Event & Campaign Creation: We design, develop and execute captivating events and campaigns that mobilize support and foster community engagement."", 'title': 'Principal', 'employment_type': None}]}, {'company': {'id': 19919, 'name': 'ICCO Cooperation', 'logo': 'https://media.licdn.com/dms/image/C4D0BAQHDrbO9g0IRkQ/company-logo_400_400/0/1609922766870?e=1700697600&v=beta&t=0Gq_COpZbPyD-uIlScluStVtQuDYyC9CfSOMld1Edzs', 'url': 'https://www.linkedin.com/company/iccopartofcordaid/', 'employees': {'start': 201, 'end': 500}}, 'date': {'start': {'month': 11, 'day': None, 'year': 2014}, 'end': {'month': 12, 'day': None, 'year': 2015}}, 'profile_positions': [{'location': 'Washington D.C. Metro Area', 'date': {'start': {'month': 11, 'day': None, 'year': 2014}, 'end': {'month': 12, 'day': None, 'year': 2015}}, 'company': 'ICCO (Part of Cordaid)', 'description': ""💼 Strategic Pioneer for ICCO's U.S. Presence\n\n🚀 Establishment Leadership: Trailblazed the initiation of ICCO's presence in the U.S, laying the groundwork for our successful penetration into this key market.\n\n👥 Board Architect: Handpicked an exceptional roster for the Board of Directors, pooling together a powerhouse of talent and influence.\n\n🛠️ Foundation Builder: Instrumental in creating a solid foundation for success in fundraising, marketing, and strategic communications across the U.S. landscape.\n\n🤝 Partnership Weaver: Offered expert guidance in identifying, forging, and nurturing impactful partnerships with U.S.-based organizations and donors.\n\n🎯 USG Opportunity Spotter: Assisted regional offices to spot, analyze, and seize lucrative USG opportunities, bolstering our competitive edge.\n\n💰 Fundraising Strategist: Developed and orchestrated the U.S. fundraising strategy, focusing on USG, Corporations, and foundations, driving financial growth and sustainability.\n\n🌐 Relationship Guru: Built and fostered high-level relationships, ensuring enduring partnership support through the strength of our professional network.\n\n📣 Brand Ambassador: Served as ICCO's U.S. figurehead in internal and external forums, championing our mission, values, and vision.\n\n🔮 Strategic Visionary: Led initiatives in strategic positioning, grant development, and communications to augment ICCO's brand image, build new constituencies, and rally increasing support for ICCO's cause."", 'title': 'VP & Director of US Institutional Relations', 'employment_type': None}]}, {'company': {'id': 165557, 'name': 'Project HOPE', 'logo': 'https://media.licdn.com/dms/image/C4E0BAQGKC9mUgd_xYw/company-logo_400_400/0/1536070607675?e=1700697600&v=beta&t=ad6aZCLNERy2NjfZAUIIwLTjzcABi2WyNXEwVVbLzWw', 'url': 'https://www.linkedin.com/company/project-hope/', 'employees': {'start': 501, 'end': 1000}}, 'date': {'start': {'month': 9, 'day': None, 'year': 2013}, 'end': {'month': 11, 'day': None, 'year': 2014}}, 'profile_positions': [{'location': 'Washington D.C. Metro Area', 'date': {'start': {'month': 9, 'day': None, 'year': 2013}, 'end': {'month': 11, 'day': None, 'year': 2014}}, 'company': 'Project HOPE', 'description': ""🚀 Driving Force Behind Vision 2015 Implementation at Project HOPE\n\n🎯 Public Sector Strategy Maestro: Championed the execution of Project HOPE's public sector business development strategy, ensuring alignment with our overarching vision.\n\n💰 Fundraising Champion: Designed and enacted ambitious fundraising goals for the department, including an impressive 100% surge in USAID awards.\n\n📜 Policy Architect: Played an integral role in crafting the policies and procedures that now underpin our business development endeavors, enhancing organizational efficiency and effectiveness.\n\n🎓 Mentor and Guide: Provided pivotal mentorship to staff (at both field and headquarters) on pre-positioning and bid response, fostering a culture of shared knowledge and growth.\n\n🔍 Capture Management Leader: Led the charge in capture management for large procurements, while maintaining a vigilant oversight on all business development activities.\n\n📝 Compliance Overseer: Developed meticulous funder compliance protocols, ensuring alignment with donor expectations and regulatory standards.\n\n🏆 Quality Assurance Guardian: Ensured each proposal was of the highest quality and met donor needs, driving our reputation for excellence and responsiveness.\n\n🌐 Innovative Product Developer: Collaborated with senior technical advisors, the Global Health and Development, and Communication departments to conceive and promote marketable products, leveraging Project HOPE's rich experience and expertise."", 'title': 'Acting Sr Director & Director Business Development', 'employment_type': None}]}, {'company': {'id': 34978, 'name': 'JHPIEGO', 'logo': 'https://media.licdn.com/dms/image/D4E0BAQGAESwemprtzA/company-logo_400_400/0/1688131246398?e=1700697600&v=beta&t=22rvyQwfLHQRY8j-Auy8sqqt66qH5ZqSxKt8o660hy0', 'url': 'https://www.linkedin.com/company/jhpiego/', 'employees': {'start': 1001, 'end': 5000}}, 'date': {'start': {'month': 5, 'day': None, 'year': 2006}, 'end': {'month': 9, 'day': None, 'year': 2013}}, 'profile_positions': [{'location': None, 'date': {'start': {'month': 10, 'day': None, 'year': 2011}, 'end': {'month': 9, 'day': None, 'year': 2013}}, 'company': 'Jhpiego', 'description': '💼 Strategic Guide and Business Development Maestro for West Africa\n\n🌍 Regional Strategy Navigator: Empowered and guided the crafting of regional business development strategies, paving the way for sustainable growth and regional influence.\n\n🔍 Opportunity Cartographer: Specialized in mapping out exciting new opportunities in West African countries, unearthing potential in untapped markets.\n\n📘 Business Intelligence Hub: Acted as a pivotal resource for analyzing, synthesizing, and disseminating cutting-edge information on new business developments.\n\n🤝 Partnership Advisor: Provided expert recommendations on potential partners to engage, systematically vetting new and existing international and local partners for alignment with our mission and goals.\n\n🎯 Bid Facilitator: Played a key role in facilitating bid decisions in response to donor solicitations, driving the win-rate and expanding our funding sources.\n\n📋 Proposal Manager: Stepped up as Proposal Manager on regional or country bilaterals, overseeing the creation of persuasive narratives that resonated with our partners.\n\n🎓 Mentor: Mentored country teams on crafting compelling proposal pieces and strategic positioning to win awards, nurturing a winning mindset across the organization.\n\n🔎 Talent Scout: Identified and recruited proposal personnel, strengthening our team with the talent needed to drive our mission forward.', 'title': 'West & Central African Regional Liaison, New Program Development', 'employment_type': None}, {'location': None, 'date': {'start': {'month': 5, 'day': None, 'year': 2006}, 'end': {'month': 10, 'day': None, 'year': 2011}}, 'company': 'Jhpiego', 'description': ""🗺️ Program Leadership: Delivered strategic leadership for the seamless management and growth of our programs in Benin, Madagascar, and Rwanda.\n\n💡 Portfolio Expander: Took on the challenge of growing our portfolios in each country, driving new opportunities and increased funding.\n\n🤝 Partnership Facilitator: Fostered effective planning and implementation through collaborative decision making with diverse partners and stakeholders.\n\n📊 Performance Tracker: Managed the tracking of indicators and results, ensuring transparency and data-driven decision making.\n\n💰 Financial Steward: Oversaw the financial management of the program, safeguarding our resources and ensuring financial sustainability.\n\n🔊 Communication Liaison: Maintained open lines of communication with partners and donors, coordinating and supporting the program's financial and administrative functions.\n\n🎓 Mentor and Supervisor: Provided mentorship and supervision to our staff, nurturing their growth and professional development.\n\n📝 Research Publisher: Authored and published articles on program results in peer-reviewed journals, web communications, workshops, and international conferences, contributing to global knowledge in our field.\n\n🎙️ Program Ambassador: Represented our country programs at high-level meetings in the U.S. and in-country with the Ministry of Health, advocating for our mission and objectives.\n\n🔬 Technical Leader: Provided technical leadership, direction, and support to key projects, driving our impact and innovation."", 'title': 'Senior Program Manager', 'employment_type': None}]}, {'company': {'id': 165557, 'name': 'Project HOPE', 'logo': 'https://media.licdn.com/dms/image/C4E0BAQGKC9mUgd_xYw/company-logo_400_400/0/1536070607675?e=1700697600&v=beta&t=ad6aZCLNERy2NjfZAUIIwLTjzcABi2WyNXEwVVbLzWw', 'url': 'https://www.linkedin.com/company/project-hope/', 'employees': {'start': 501, 'end': 1000}}, 'date': {'start': {'month': 1, 'day': None, 'year': 2003}, 'end': {'month': 4, 'day': None, 'year': 2006}}, 'profile_positions': [{'location': 'Windhoek, Namibia', 'date': {'start': {'month': 1, 'day': None, 'year': 2003}, 'end': {'month': 4, 'day': None, 'year': 2006}}, 'company': 'Project HOPE', 'description': ""🌍 Pioneer of Project HOPE's In-Country Presence\n\n🏢 Establishment Pioneer: Spearheaded the establishment of Project HOPE's footprint in Namibia, paving the way for the organization's impactful interventions in the region.\n\n👥 Team Leader: Commanded a dynamic team of 15 staff and collaborated with various partner organizations, cultivating a culture of teamwork and mutual respect.\n\n🤝 Relationship Cultivator: Fostered robust working relationships with the U.S. Ambassador, donors, and partners, solidifying a network of support and cooperation.\n\n🎯 Strategic Navigator: Set the strategic direction to achieve fundraising goals in Namibia and beyond, ensuring alignment with the organization's mission and objectives.\n\n📑 Compliance Guardian: Ensured stringent compliance with grant requirements, safeguarding our commitments to donors and beneficiaries.\n\n📊 Program Reporter: Diligently reported on annual program targets and developed comprehensive workplans, fostering transparency and operational efficiency.\n\n🔎 Talent Spotter: Hired program staff, crafted scopes of work, contracts, and critically evaluated performance, reinforcing the organization's human capital.\n\n🚀 Business Development Strategist: Orchestrated strategic business development plans, excelled at proposal writing, and managed post-grant transitions, driving growth and sustainability.\n\n🌐 Collaborative Partner: Worked in close coordination with professional organizations and Ministries to attain program objectives, strengthening collective impact."", 'title': 'Country Director', 'employment_type': None}]}, {'company': {'id': 13663, 'name': 'The State University of New York', 'logo': 'https://media.licdn.com/dms/image/D560BAQHhdSqYulbrCw/company-logo_400_400/0/1685974170279?e=1700697600&v=beta&t=SeZt-uOkyv1pB0wNiEfq4eysCXoYU_T7s7TQAZRsLNc', 'url': 'https://www.linkedin.com/school/state-university-of-new-york/', 'employees': {'start': 10001, 'end': None}}, 'date': {'start': {'month': 1, 'day': None, 'year': 2002}, 'end': {'month': 12, 'day': None, 'year': 2002}}, 'profile_positions': [{'location': 'New York, NY', 'date': {'start': {'month': 1, 'day': None, 'year': 2002}, 'end': {'month': 12, 'day': None, 'year': 2002}}, 'company': 'The State University of New York', 'description': ""🌐 Conductor of  Dialogue in the Classroom: Teaching Contemporary World & European Affairs\n\n🎓 Curriculum Innovator: Masterminded a compelling curriculum for the Contemporary World Affairs course, delving into pressing global problems and issues through an interdisciplinary lens. This dynamic course, delivered to a class of engaged students, had a specific focus on conflict situations, providing students with a nuanced understanding of global dynamics.\n\n European Affairs Specialist: Developed and taught an insightful Contemporary European Affairs course to a class of eager students. This course explored challenges facing contemporary European society from an interdisciplinary perspective, offering students a multifaceted view of the issues at hand. Notably, this course took a deep dive into the European Union's monetary and foreign policies, equipping students with valuable insights into this complex political and economic landscape."", 'title': 'Lecturer - Political Science', 'employment_type': None}]}]","[{'date': {'start': {'month': 1, 'day': None, 'year': 2007}, 'end': {'month': 12, 'day': None, 'year': 2015}}, 'role': 'Family Mentor', 'company': {'id': None, 'name': 'International Rescue Committee', 'logo': 'https://media.licdn.com/dms/image/C4D0BAQGQf6U3mztrvg/company-logo_400_400/0/1522173173886?e=1700697600&v=beta&t=pBF7sGpHXRAsbxYVmubMgeRAMw5TAYcCeINmx2UnAeI', 'url': 'https://www.linkedin.com/company/international-rescue-committee/'}, 'cause': 'CHILDREN', 'description': '🌍 Empowering Refugee Families: Served as a dedicated mentor to newly arrived refugee families, providing vital support and guidance during their settlement process. Assisted with cultural acclimatization, navigation of bureaucratic procedures, educational support, and tackled various other resettlement challenges, enabling smoother transitions and fostering a sense of belonging and confidence within these families.'}, {'date': {'start': {'month': 9, 'day': None, 'year': 2022}, 'end': {'month': None, 'day': None, 'year': None}}, 'role': 'Spanish Teacher', 'company': {'id': None, 'name': 'De Vrije Ruimte', 'logo': 'https://media.licdn.com/dms/image/C560BAQFa-bkCs4H_1g/company-logo_400_400/0/1519865999921?e=1700697600&v=beta&t=Q67VA_yf7w9WXoxGYiZjiI6yi3P0fJd6HlUHNz9bNVE', 'url': 'https://www.linkedin.com/company/de-vrije-ruimte/'}, 'cause': 'CHILDREN', 'description': None}]","['Marketing', 'Social Responsibility', 'Cross-functional Team Leadership', 'Sustainability Metrics', 'Sustainability', 'Corporate Social Responsibility', 'Communication', 'Gender', 'University Teaching', 'Curriculum', 'Analytical Skills', 'Marketing Communications', 'Networking', 'Funding', 'Presentation Skills', 'Donors', 'Business Networking', 'Proposal Writing', 'Program Management', 'Grants']",,,
