profile_id,first_name,last_name,sub_title,profile_picture,background_image,profile_type,entity_urn,object_urn,birth_date,summary,location,premium,influencer,treasury_media,languages,industry,education,patents,awards,certifications,organizations,projects,publications,courses,test_scores,position_groups,volunteer_experiences,skills,network_info,related_profiles,contact_info
eloisa-kompier,Eloisa,Kompier,UX & UI Designer eager to create meaningful & innovative experiences through design,https://media.licdn.com/dms/image/C4E03AQGEXB1PEQh3tg/profile-displayphoto-shrink_800_800/0/1610032091795?e=1697673600&v=beta&t=ZCZl-2VM2RpN877kfTNeVye_4vAHf24LplucCsCM0DI,,personal,ACoAACTRW1sBk-niSbfSakFP0P3c0WUUVWUdtQ0,617700187,,"HI THERE! I am a designer eager to create meaningful experiences through design. I’m a creative, big-picture thinker obsessed with crafting the details and delivering quality products. I’m ambitious, delivery-focused, and adaptable to tasks. 

My passion lies in creating innovative design solutions that could contribute to a better living. I worked on projects across different industries, ranging from the healthcare sector to entertainment & education, smart mobility solutions, and underground pipeline infrastructure. I have experience working with teams to brainstorm and whiteboard concepts. I can create both digital and physical prototypes at varying levels of fidelity and create the design solution you are looking for. 

I enjoy learning new things and connecting with people across a range of industries, so don't hesitate to reach out if you'd like to get in touch!","{'country': 'Netherlands', 'short': 'Eindhoven, North Brabant', 'city': 'Eindhoven', 'state': 'North Brabant', 'default': 'Eindhoven, North Brabant, Netherlands'}",False,False,[],"{'primary_locale': {'country': 'NL', 'language': 'nl'}, 'supported_locales': [{'country': 'NL', 'language': 'nl'}], 'profile_languages': [{'name': 'Dutch', 'proficiency': 'NATIVE_OR_BILINGUAL'}, {'name': 'English', 'proficiency': 'FULL_PROFESSIONAL'}, {'name': 'Portuguese', 'proficiency': 'NATIVE_OR_BILINGUAL'}]}",Design,"[{'date': {'start': {'month': None, 'day': None, 'year': 2019}, 'end': {'month': 1, 'day': None, 'year': 2022}}, 'school': {'name': 'Eindhoven University of Technology', 'logo': 'https://media.licdn.com/dms/image/C560BAQG4PGSYiNG4CA/company-logo_400_400/0/1642150189320?e=1700697600&v=beta&t=N3DoxTNauqgq4Ut16o0uHUjMcyPlNKMdcMlRDP-M7E4', 'url': 'https://www.linkedin.com/school/eindhoven-university-of-technology/'}, 'degree_name': ""Master's degree"", 'field_of_study': 'Industrial and Product Design'}, {'date': {'start': {'month': None, 'day': None, 'year': 2016}, 'end': {'month': None, 'day': None, 'year': 2019}}, 'school': {'name': 'Eindhoven University of Technology', 'logo': 'https://media.licdn.com/dms/image/C560BAQG4PGSYiNG4CA/company-logo_400_400/0/1642150189320?e=1700697600&v=beta&t=N3DoxTNauqgq4Ut16o0uHUjMcyPlNKMdcMlRDP-M7E4', 'url': 'https://www.linkedin.com/school/eindhoven-university-of-technology/'}, 'degree_name': ""Bachelor's degree "", 'field_of_study': 'Industrial and Product Design'}, {'date': {'start': {'month': 9, 'day': None, 'year': 2018}, 'end': {'month': 12, 'day': None, 'year': 2018}}, 'school': {'name': 'Simon Fraser University', 'logo': 'https://media.licdn.com/dms/image/D560BAQG32aZCbMdpaQ/company-logo_400_400/0/1665523868261?e=1700697600&v=beta&t=jwYW3FvA5m_ium6tMI2sBdFSlOWxj2NGAYjrX42nY_0', 'url': 'https://www.linkedin.com/school/simon-fraser-university/'}, 'degree_name': 'Bachelor exchange program', 'field_of_study': 'School of Interactive Arts & Technology'}, {'date': {'start': {'month': 3, 'day': None, 'year': 2018}, 'end': {'month': 8, 'day': None, 'year': 2018}}, 'school': {'name': 'Netherlands-Asia Honours Summer School', 'logo': 'https://media.licdn.com/dms/image/C4D0BAQHkb9eSDCKTnQ/company-logo_400_400/0/1542979894971?e=1700697600&v=beta&t=lHIrLcVV_BlSizvjsTusvTRAC-N6_thaXkurtVZpD0k', 'url': 'https://www.linkedin.com/school/netherlands-asia-honours-summer-school/'}, 'degree_name': None, 'field_of_study': None}, {'date': {'start': {'month': 6, 'day': None, 'year': 2018}, 'end': {'month': 7, 'day': None, 'year': 2018}}, 'school': {'name': 'Peking University', 'logo': 'https://media.licdn.com/dms/image/C560BAQFNJ0xtCpaTmA/company-logo_400_400/0/1605082987804?e=1700697600&v=beta&t=P_LPafTO9d42844ED0nZaCNa5HEvmWyE5M2HNMlAYt8', 'url': 'https://www.linkedin.com/school/peking-university/'}, 'degree_name': 'Summer program', 'field_of_study': None}]",[],[],"[{'name': 'Foundations of User Experience (UX) Design', 'date': {'start': {'month': 11, 'day': None, 'year': 2022}, 'end': {'month': None, 'day': None, 'year': None}}, 'authority': 'Coursera', 'url': 'https://www.coursera.org/account/accomplishments/certificate/ZE6V8NAG442A', 'license_number': 'ZE6V8NAG442A', 'display_source': 'coursera.org', 'company': {'id': None, 'name': 'Coursera', 'logo': 'https://media.licdn.com/dms/image/C4D0BAQGexnfBxeEG-g/company-logo_400_400/0/1608039227697?e=1700697600&v=beta&t=oKIt6loOByFMfTbXJsSV0MxzKtgkMvIZ2QTzkZrNq70', 'url': None}}]","[{'name': 'Cineworks', 'position': 'UX/UI designer', 'date_start': None, 'date_end': None}, {'name': 'Daimler', 'position': None, 'date_start': None, 'date_end': None}, {'name': 'Marin', 'position': None, 'date_start': None, 'date_end': None}, {'name': 'No1Robotics', 'position': 'UX/UI designer', 'date_start': None, 'date_end': None}, {'name': 'Nutreco', 'position': 'Industrial Designer', 'date_start': None, 'date_end': None}, {'name': 'Phoenix Project', 'position': 'UX/UI designer', 'date_start': None, 'date_end': None}, {'name': 'Thales', 'position': 'Intern', 'date_start': None, 'date_end': None}]","[{'title': 'CINEWORKS', 'date': {'start': {'month': None, 'day': None, 'year': None}, 'end': {'month': None, 'day': None, 'year': None}}, 'description': None, 'contributors': [{'type': 'standardizedContributor', 'first_name': 'Eloisa', 'last_name': 'Kompier', 'name': None, 'headline': 'UX & UI Designer eager to create meaningful & innovative experiences through design'}]}, {'title': 'CIRCADIA', 'date': {'start': {'month': None, 'day': None, 'year': None}, 'end': {'month': None, 'day': None, 'year': None}}, 'description': None, 'contributors': [{'type': 'standardizedContributor', 'first_name': 'Eloisa', 'last_name': 'Kompier', 'name': None, 'headline': 'UX & UI Designer eager to create meaningful & innovative experiences through design'}]}, {'title': 'GLOE', 'date': {'start': {'month': None, 'day': None, 'year': None}, 'end': {'month': None, 'day': None, 'year': None}}, 'description': None, 'contributors': [{'type': 'standardizedContributor', 'first_name': 'Eloisa', 'last_name': 'Kompier', 'name': None, 'headline': 'UX & UI Designer eager to create meaningful & innovative experiences through design'}]}, {'title': 'MARIN', 'date': {'start': {'month': None, 'day': None, 'year': None}, 'end': {'month': None, 'day': None, 'year': None}}, 'description': None, 'contributors': [{'type': 'standardizedContributor', 'first_name': 'Eloisa', 'last_name': 'Kompier', 'name': None, 'headline': 'UX & UI Designer eager to create meaningful & innovative experiences through design'}]}, {'title': 'MOTION SICKNESS', 'date': {'start': {'month': None, 'day': None, 'year': None}, 'end': {'month': None, 'day': None, 'year': None}}, 'description': None, 'contributors': [{'type': 'standardizedContributor', 'first_name': 'Eloisa', 'last_name': 'Kompier', 'name': None, 'headline': 'UX & UI Designer eager to create meaningful & innovative experiences through design'}]}, {'title': 'MYSTERIOUS ENCOUNTERS', 'date': {'start': {'month': None, 'day': None, 'year': None}, 'end': {'month': None, 'day': None, 'year': None}}, 'description': None, 'contributors': [{'type': 'standardizedContributor', 'first_name': 'Eloisa', 'last_name': 'Kompier', 'name': None, 'headline': 'UX & UI Designer eager to create meaningful & innovative experiences through design'}]}, {'title': 'NUTRECO', 'date': {'start': {'month': None, 'day': None, 'year': None}, 'end': {'month': None, 'day': None, 'year': None}}, 'description': None, 'contributors': [{'type': 'standardizedContributor', 'first_name': 'Eloisa', 'last_name': 'Kompier', 'name': None, 'headline': 'UX & UI Designer eager to create meaningful & innovative experiences through design'}]}, {'title': 'PEPPER', 'date': {'start': {'month': None, 'day': None, 'year': None}, 'end': {'month': None, 'day': None, 'year': None}}, 'description': None, 'contributors': [{'type': 'standardizedContributor', 'first_name': 'Eloisa', 'last_name': 'Kompier', 'name': None, 'headline': 'UX & UI Designer eager to create meaningful & innovative experiences through design'}]}, {'title': 'PERSPECTO', 'date': {'start': {'month': None, 'day': None, 'year': None}, 'end': {'month': None, 'day': None, 'year': None}}, 'description': None, 'contributors': [{'type': 'standardizedContributor', 'first_name': 'Eloisa', 'last_name': 'Kompier', 'name': None, 'headline': 'UX & UI Designer eager to create meaningful & innovative experiences through design'}]}, {'title': 'PIPECT', 'date': {'start': {'month': None, 'day': None, 'year': None}, 'end': {'month': None, 'day': None, 'year': None}}, 'description': None, 'contributors': [{'type': 'standardizedContributor', 'first_name': 'Eloisa', 'last_name': 'Kompier', 'name': None, 'headline': 'UX & UI Designer eager to create meaningful & innovative experiences through design'}]}, {'title': 'THE CHAMELEON', 'date': {'start': {'month': None, 'day': None, 'year': None}, 'end': {'month': None, 'day': None, 'year': None}}, 'description': None, 'contributors': [{'type': 'standardizedContributor', 'first_name': 'Eloisa', 'last_name': 'Kompier', 'name': None, 'headline': 'UX & UI Designer eager to create meaningful & innovative experiences through design'}]}, {'title': 'TRUESIGHT BATTLE GRID', 'date': {'start': {'month': None, 'day': None, 'year': None}, 'end': {'month': None, 'day': None, 'year': None}}, 'description': None, 'contributors': [{'type': 'standardizedContributor', 'first_name': 'Eloisa', 'last_name': 'Kompier', 'name': None, 'headline': 'UX & UI Designer eager to create meaningful & innovative experiences through design'}]}]","[{'name': 'Truesight battle grid - Enhancing the game experience of tabletop role-playing through tangible data visualization', 'publisher': 'CHIPLAY 2020', 'url': 'https://www.researchgate.net/publication/345496565_Truesight_Battle_Grid_-_Enhancing_the_Game_Experience_of_Tabletop_Role-Playing_through_Tangible_Data_Visualization', 'date': {'month': None, 'day': None, 'year': 2020}, 'authors': [{'type': 'standardizedContributor', 'first_name': 'Eloisa', 'last_name': 'Kompier', 'name': None, 'headline': 'UX & UI Designer eager to create meaningful & innovative experiences through design'}, {'type': 'nonStandardizedContributor', 'first_name': None, 'last_name': None, 'name': 'Bas Plijnaer', 'headline': None}, {'type': 'standardizedContributor', 'first_name': 'Daisy', 'last_name': ""O'Neill"", 'name': None, 'headline': 'PhD Candidate @ TU/e | Measuring patient and staff experience '}, {'type': 'standardizedContributor', 'first_name': 'Günter', 'last_name': 'Wallner', 'name': None, 'headline': 'Professor for Game Computing at Johannes Kepler University Linz'}, {'type': 'standardizedContributor', 'first_name': 'Regina', 'last_name': 'Bernhaupt', 'name': None, 'headline': 'Professor for Digital-Physical Interaction Design'}]}]","[{'name': 'Aesthetics of Interaction', 'number': None}, {'name': 'Animation', 'number': None}, {'name': 'Applied physical sciences conceptual', 'number': None}, {'name': 'Calculus', 'number': None}, {'name': 'Constructive Design Research', 'number': None}, {'name': 'Creative Apps', 'number': None}, {'name': 'Creative Electronics', 'number': None}, {'name': 'Creative Programming', 'number': None}, {'name': 'Design <> Research', 'number': None}, {'name': 'Design Innovation Methods', 'number': None}, {'name': 'Embodying intelligent behavior in social context', 'number': None}, {'name': 'Engineering Design', 'number': None}, {'name': 'Entrepreneurship in action', 'number': None}, {'name': 'Ethics and history of technology', 'number': None}, {'name': 'Exploratory Sketching', 'number': None}, {'name': 'From Idea to Design', 'number': None}, {'name': 'Graphic Design', 'number': None}, {'name': 'Intelligent Products', 'number': None}, {'name': 'Interaction Design Methods', 'number': None}, {'name': 'Interface Design', 'number': None}]",[],"[{'company': {'id': 3894, 'name': 'ASML', 'logo': 'https://media.licdn.com/dms/image/C560BAQGssQfw50QsaQ/company-logo_400_400/0/1519855871260?e=1700697600&v=beta&t=UgEWDzOBAQjAM5WXvWbeD1f-c3NIp0kn6-vGF-0DWL8', 'url': 'https://www.linkedin.com/company/asml/', 'employees': {'start': 10001, 'end': None}}, 'date': {'start': {'month': 4, 'day': None, 'year': 2022}, 'end': {'month': None, 'day': None, 'year': None}}, 'profile_positions': [{'location': 'Veldhoven, North Brabant, Netherlands', 'date': {'start': {'month': 4, 'day': None, 'year': 2022}, 'end': {'month': None, 'day': None, 'year': None}}, 'company': 'ASML', 'description': None, 'title': 'UX & UI Designer', 'employment_type': 'Full-time'}]}, {'company': {'id': 142990, 'name': 'ENTER BV', 'logo': 'https://media.licdn.com/dms/image/C560BAQE5eIq31xpIZA/company-logo_400_400/0/1521032613924?e=1700697600&v=beta&t=TmHRskSCctjvvLb_1VOFwATW8cqvnWdHkI7kVvhyIgg', 'url': 'https://www.linkedin.com/company/enter-bv/', 'employees': {'start': 201, 'end': 500}}, 'date': {'start': {'month': 4, 'day': None, 'year': 2022}, 'end': {'month': None, 'day': None, 'year': None}}, 'profile_positions': [{'location': 'Veldhoven, North Brabant, Netherlands', 'date': {'start': {'month': 4, 'day': None, 'year': 2022}, 'end': {'month': None, 'day': None, 'year': None}}, 'company': 'ENTER BV', 'description': None, 'title': 'UX & UI Designer ', 'employment_type': 'Full-time'}]}, {'company': {'id': 1951, 'name': 'Thales', 'logo': 'https://media.licdn.com/dms/image/C4D0BAQEmnUAXTuLkJQ/company-logo_400_400/0/1530178704654?e=1700697600&v=beta&t=wZtfXVJ7PXckqDT5N1AuFMSBvzuHZdFcx4dpwyrNpxY', 'url': 'https://www.linkedin.com/company/thales/', 'employees': {'start': 10001, 'end': None}}, 'date': {'start': {'month': 2, 'day': None, 'year': 2021}, 'end': {'month': 2, 'day': None, 'year': 2022}}, 'profile_positions': [{'location': 'Delft, South Holland, Netherlands', 'date': {'start': {'month': 2, 'day': None, 'year': 2021}, 'end': {'month': 2, 'day': None, 'year': 2022}}, 'company': 'Thales', 'description': 'Thales Group is a French multinational company that designs and builds electrical systems and provides services within aerospace, defence, transportation and security markets. \n\nPositioned as a UX & UI design intern at Thales Research & Technology department to research possible concepts for the future command and control centre to enhance the communication and collaboration between navy operators. Overall responsible for conducting in-depth interviews and organising workshop sessions with former operators, collecting user insights for the design ideation. The design involved concept sketching, wireframing, and creating mockups to visualise the proposed concepts, acquiring feedback, programming, and prototyping a test environment to evaluate the design ideas and provide research insights through A/B testing for future research direction.', 'title': 'UX & UI Designer', 'employment_type': 'Internship'}]}, {'company': {'id': 34710942, 'name': 'no1robotics', 'logo': 'https://media.licdn.com/dms/image/C560BAQHxgcD0Vxiu1g/company-logo_400_400/0/1578487845162?e=1700697600&v=beta&t=X8-el1PBRcDCW3LyXZQi0OVoTpTertNtj31HZ9MZmck', 'url': 'https://www.linkedin.com/company/no1robotics/', 'employees': {'start': 2, 'end': 10}}, 'date': {'start': {'month': 8, 'day': None, 'year': 2019}, 'end': {'month': 2, 'day': None, 'year': 2021}}, 'profile_positions': [{'location': 'Best, North Brabant, Netherlands', 'date': {'start': {'month': 8, 'day': None, 'year': 2019}, 'end': {'month': 2, 'day': None, 'year': 2021}}, 'company': 'NO1ROBOTICS', 'description': ""No1Robotics believe in a future where social robots will be part of our everyday lives. They focus on training people in health care, education, local government and retail to make their first step in applying humanoid robots in the workspace. \n\nPositioned as a UX & UI designer to (re)design the Pepper robot's user interfaces and content management system (CMS) that enable user-friendly and exciting human interaction with the robot. Responsible for the product branding and strategy, creating user flows, wireframes and design mockups for both tablet and desktop. Produced additional content and animations for the application and collaborated closely with the programmer to develop the application and iterate. During the product launch, accountable for writing the user manual, presenting the product to the clients, and providing customer support."", 'title': 'UX & UI Designer', 'employment_type': 'Part-time'}]}, {'company': {'id': 397925, 'name': 'MARIN (Maritime Research Institute Netherlands)', 'logo': 'https://media.licdn.com/dms/image/C4D0BAQGrqNE7dzbxYg/company-logo_400_400/0/1571733730226?e=1700697600&v=beta&t=I1nxoU3XgY1t0R1fqm0jUWSIqj3ZK-2FzayYVIP-rLo', 'url': 'https://www.linkedin.com/company/marin/', 'employees': {'start': 201, 'end': 500}}, 'date': {'start': {'month': 2, 'day': None, 'year': 2020}, 'end': {'month': 7, 'day': None, 'year': 2020}}, 'profile_positions': [{'location': 'Wageningen, Gelderland, Netherlands', 'date': {'start': {'month': 2, 'day': None, 'year': 2020}, 'end': {'month': 7, 'day': None, 'year': 2020}}, 'company': 'MARIN (Maritime Research Institute Netherlands)', 'description': ""The Marine Research Institute Netherlands (MARIN) is one of the world's premier hydrodynamic research and maritime technology institutions.\n\nPositioned as a Design Researcher, the role was to research possible ways to control future autonomous ships from a shore-based control centre through a user interface instead of physical controllers. Created different graphical controls opportunities by sketching and producing design mockups. Accountable for creating a rapid test environment and executing A/B testing. It included conducting in-depth interviews and cognitive walkthroughs to provide research insights for future research direction."", 'title': 'Design Researcher', 'employment_type': 'Internship'}]}, {'company': {'id': 4838, 'name': 'Eindhoven University of Technology', 'logo': 'https://media.licdn.com/dms/image/C560BAQG4PGSYiNG4CA/company-logo_400_400/0/1642150189320?e=1700697600&v=beta&t=N3DoxTNauqgq4Ut16o0uHUjMcyPlNKMdcMlRDP-M7E4', 'url': 'https://www.linkedin.com/school/eindhoven-university-of-technology/', 'employees': {'start': 1001, 'end': 5000}}, 'date': {'start': {'month': 2, 'day': None, 'year': 2019}, 'end': {'month': 7, 'day': None, 'year': 2019}}, 'profile_positions': [{'location': 'Eindhoven, North Brabant, Netherlands', 'date': {'start': {'month': 2, 'day': None, 'year': 2019}, 'end': {'month': 7, 'day': None, 'year': 2019}}, 'company': 'Eindhoven University of Technology', 'description': 'The Phoenix Project, a FET-Open Horizon2020 funded project, is dedicated to developing novel techniques to explore underground and unacceptable environments. Their newly developed technology was being researched and considered an innovative concept to tackle pipeline inspection challenges. \n\nResponsible for (re)designing their software application, guiding clients through the pipeline inspection process transparently and intuitively. Overall responsible for connecting, interviewing and linking different stakeholders needs and goals, mapping out the current versus the desired inspection process, including the future prospected features of Phoenix technology. Conducted user validation and analysed insights for building the structure and visual design of the final design concept.', 'title': 'UX & UI Designer', 'employment_type': 'Internship'}]}, {'company': {'id': 13563, 'name': 'Nutreco', 'logo': 'https://media.licdn.com/dms/image/C4D0BAQHyd91fD0H6tg/company-logo_400_400/0/1619002863456?e=1700697600&v=beta&t=2r7IfGC1WmxZ-5CZHb6ilEln6UlN1a0sjidQa1Buq_Q', 'url': 'https://www.linkedin.com/company/nutreco/', 'employees': {'start': 10001, 'end': None}}, 'date': {'start': {'month': 3, 'day': None, 'year': 2018}, 'end': {'month': 8, 'day': None, 'year': 2018}}, 'profile_positions': [{'location': 'Beijing, China ', 'date': {'start': {'month': 3, 'day': None, 'year': 2018}, 'end': {'month': 8, 'day': None, 'year': 2018}}, 'company': 'Nutreco', 'description': 'Nutreco N.V. is a Dutch company that specialises in animal nutrition, fish feed, and processed meats. It has roughly 100 manufacturing plants and eight research centres spread across more than 30 nations.\n\nPositioned as an industrial designer in a multidisciplinary student team. We examined several digital trends in the Chinese animal feed and agricultural industry that could be applied by Nutreco within the following five to ten years. Responsible for brainstorming and visualising the final presented design concepts.', 'title': 'Industrial Designer', 'employment_type': None}]}]",[],"['userflows', 'Journey Mapping', 'Concept Testing', 'Storyboarding', 'A/B Testing', 'Wireframing', 'Design Systems', 'Usability Testing', 'Feature Writing', 'Figma (Software)', 'Miro Collaboration Platform', 'Sus testing', 'User Interface Design', 'User Experience Design (UED)', 'Visual Design', 'Research', 'User-centered Design', 'Video Editing', 'Information Architecture', 'Entrepreneurship']",,,
