profile_id,first_name,last_name,sub_title,profile_picture,background_image,profile_type,entity_urn,object_urn,birth_date,summary,location,premium,influencer,treasury_media,languages,industry,education,patents,awards,certifications,organizations,projects,publications,courses,test_scores,position_groups,volunteer_experiences,skills,network_info,related_profiles,contact_info
vincent-bretez,Vincent,Bretez,Customer Care Complain Supervisor,,,personal,ACoAABYmKsgBl0JLvNJbul8GYbWbTqS7UHVgnU8,371600072,,"I am a French man in my early thirties with a third level degree in History.  Since my graduation, I have mostly lived abroad. I have resided in Ireland and the Netherlands and I am currently undertaking a working holiday in New Zealand. 


During my time in Dublin and Amsterdam, I have made my trade in the B2C working environment by working at at Smartbox in Dublin and at Hellofresh in Amsterdam. I am coming back in Europe in July 2020 and look forward to further my career in this area.


In my previous employment, I have proved my abilities to give the best outcome to the customer and to handle difficult cases in a busy environment. My employers have always commented positively my hard working mind set, my team working abilities and my interpersonal skills. This is evident in the new tasks and responsibilities I was given after time in both roles.


By the end of my contract at HelloFresh, I was promoted to a senior staff role and held responsibility for customer complaints for  French and English speaking market in Belgium and France. My tasks including taking over difficult cases regarding customer issues and devising solutions which were acceptable to both the customer and the company. I also was involved in the training of new and current colleagues to in sure the best possible customer service experience for our clients. I was also tasked with the quality control of our English and French websites to in sure all information was up to date and that no bugs were present. These new tasks helped me enhance various skills such as communication, conflict resolution and attention to detail. I would like to further develop these skills in my next career step. 


","{'country': 'Netherlands', 'short': 'The Randstad, Netherlands', 'city': 'The Randstad', 'state': 'Netherlands', 'default': 'The Randstad, Netherlands'}",False,False,[],"{'primary_locale': {'country': 'FR', 'language': 'fr'}, 'supported_locales': [{'country': 'FR', 'language': 'fr'}], 'profile_languages': [{'name': 'English', 'proficiency': 'FULL_PROFESSIONAL'}, {'name': 'French', 'proficiency': 'NATIVE_OR_BILINGUAL'}, {'name': 'Spanish', 'proficiency': 'FULL_PROFESSIONAL'}]}",Consumer Services,"[{'date': {'start': {'month': None, 'day': None, 'year': 2010}, 'end': {'month': None, 'day': None, 'year': 2012}}, 'school': {'name': 'Université Rennes 2', 'logo': 'https://media.licdn.com/dms/image/C4E0BAQFSLabCzxgZCQ/company-logo_400_400/0/1519870937499?e=1700092800&v=beta&t=efAN80L2y72pi9N3IwZTwZGWX143yhlvu3KLFwY6p6w', 'url': 'https://www.linkedin.com/school/universit%C3%A9-rennes-2/'}, 'degree_name': 'Master of Arts (M.A.)', 'field_of_study': 'History of the International Relation.'}, {'date': {'start': {'month': None, 'day': None, 'year': 2007}, 'end': {'month': None, 'day': None, 'year': 2010}}, 'school': {'name': 'Le Mans Université', 'logo': 'https://media.licdn.com/dms/image/C4E0BAQGjkfNQ-TkHrQ/company-logo_400_400/0/1661762211274?e=1700092800&v=beta&t=lteNOdcHJTSiaPAt9VSff5jYDdGYlTvQ1sB4VQHM2BM', 'url': 'https://www.linkedin.com/school/universit%C3%A9-du-maine-le-mans-laval/'}, 'degree_name': 'Bachelor of Arts (B.A.)', 'field_of_study': 'History'}]",[],[],[],[],[],[],"[{'name': 'Theatre at the American Institute of Rennes', 'number': None}]","[{'name': 'TOEIC', 'score': '875', 'date': {'month': 4, 'day': None, 'year': 2014}}]","[{'company': {'id': 2454643, 'name': 'HelloFresh', 'logo': 'https://media.licdn.com/dms/image/D560BAQHY6c2H6XQmzg/company-logo_400_400/0/1690812933315?e=1700092800&v=beta&t=d4vp3sfkzPu4rQwAOlyy_1tH_VEZMCaWF6jWtAWmB_E', 'url': 'https://www.linkedin.com/company/hellofresh/', 'employees': {'start': 10001, 'end': None}}, 'date': {'start': {'month': 12, 'day': None, 'year': 2016}, 'end': {'month': 10, 'day': None, 'year': 2018}}, 'profile_positions': [{'location': 'Région de Amsterdam, Pays-Bas', 'date': {'start': {'month': 12, 'day': None, 'year': 2016}, 'end': {'month': 10, 'day': None, 'year': 2018}}, 'company': 'HelloFresh', 'description': 'Responsabilities:\n- to handle conversation by phone, email, chat at peak time to ensure the direct answer of customer question.\n-the treatment of payment issues escalated by my colleagues.\n-the track of fraud on vouchers and by the mean of payment.\n-the treatment of escalated major dispute to give the best outcome possible for the customer care.\n-the training of new colleage.\n-the quality check of conversation to give advise to my colleague if needed.\n-the support to our delivery fleet during our hours of delivery to insure that everything will go right.\n-the quality check of our websites to report any misinformation or bug present.', 'title': 'Customer Service Representative', 'employment_type': None}]}, {'company': {'id': 258639, 'name': 'Groupe Smart&co', 'logo': 'https://media.licdn.com/dms/image/D4E0BAQGv-IDBgBcbIg/company-logo_400_400/0/1686766396081?e=1700092800&v=beta&t=glqiakiwMGXU5BaTPw4mwU25dZ6FO2LTbjkx2ebUJ-c', 'url': 'https://www.linkedin.com/company/smartbox-group/', 'employees': {'start': 501, 'end': 1000}}, 'date': {'start': {'month': 6, 'day': None, 'year': 2015}, 'end': {'month': 6, 'day': None, 'year': 2016}}, 'profile_positions': [{'location': 'Dublin', 'date': {'start': {'month': 6, 'day': None, 'year': 2015}, 'end': {'month': 6, 'day': None, 'year': 2016}}, 'company': 'Smartbox Group', 'description': 'Responsibilities:\n-Delivering high quality support over the phone and by e-mail in order to resolve issues for Smartbox e.g. Use of product, booking, technical issue...\n-Keeping clear and effective notes of all cases.\n-Excelent customer service and telephone skills developed for this role.', 'title': 'Customer Service Representative', 'employment_type': None}]}, {'company': {'id': 75147, 'name': 'Keywords Studios', 'logo': 'https://media.licdn.com/dms/image/D4E0BAQEwpCF2doJ9AQ/company-logo_400_400/0/1692203746297?e=1700092800&v=beta&t=Rp1kcKPRey3GSvT0F4pQKnYFn8yoD_rRFpbB5wNN_dY', 'url': 'https://www.linkedin.com/company/keywordsstudios/', 'employees': {'start': 10001, 'end': None}}, 'date': {'start': {'month': 11, 'day': None, 'year': 2014}, 'end': {'month': 6, 'day': None, 'year': 2015}}, 'profile_positions': [{'location': 'Dublin', 'date': {'start': {'month': 11, 'day': None, 'year': 2014}, 'end': {'month': 6, 'day': None, 'year': 2015}}, 'company': 'Keywords Studios', 'description': 'Responsabilities:\n-Identify, isolate, and document bugs clearly and concisely in a bug database.\n-Run test suites, verify fixes, spot grammar and language mistakes in tested language.\n-Follow the documented processes at all stages of the testing process.\n-Verify that bugs have been fixed and implemented correctly.\n-Ensure that correct terminology is used.', 'title': 'Language Quality Asurance Tester', 'employment_type': None}]}, {'company': {'id': 607031, 'name': 'Clarion Hotel Cork', 'logo': 'https://media.licdn.com/dms/image/C4D0BAQEoAyRFTDwuIw/company-logo_400_400/0/1519881370233?e=1700092800&v=beta&t=UglPF3Dx30jbVqD_J5FPPzQ5f_oYTkiAc_U13XHgytk', 'url': 'https://www.linkedin.com/company/clarion-hotel-cork/', 'employees': {'start': 51, 'end': 200}}, 'date': {'start': {'month': 7, 'day': None, 'year': 2014}, 'end': {'month': 8, 'day': None, 'year': 2014}}, 'profile_positions': [{'location': 'Cork', 'date': {'start': {'month': 7, 'day': None, 'year': 2014}, 'end': {'month': 8, 'day': None, 'year': 2014}}, 'company': 'Clarion Hotel Cork', 'description': 'Responsibilities:\n- Ensured accurate room set up for events.\n- Delivered top quality service at all events.\n- Worked as waiter in the hotel restaurant.\n- Prepared the breakfast area and ensured that guests were served promptly.', 'title': 'Conference & Events Assistant', 'employment_type': None}]}]",[],"['Theatre', 'Microsoft Office', 'Management', 'Microsoft Excel', 'Leadership', 'Strategic Planning', 'Social Media', 'Marketing', 'Public Speaking', 'Event Planning', 'Salesforce.com', 'Customer Relationship Management (CRM)', 'Team Work', 'Spanish', 'Customer Service Experience', 'Zendesk', 'Purecloud', 'Smartdesk', 'selligent']",,,
