profile_id,first_name,last_name,sub_title,profile_picture,background_image,profile_type,entity_urn,object_urn,birth_date,summary,location,premium,influencer,treasury_media,languages,industry,education,patents,awards,certifications,organizations,projects,publications,courses,test_scores,position_groups,volunteer_experiences,skills,network_info,related_profiles,contact_info
audreylagarde,Audrey,Lagarde," Passionate, caring and trilingual teacher
",https://media.licdn.com/dms/image/C4E03AQFo0bPe76iLOQ/profile-displayphoto-shrink_800_800/0/1627382117202?e=1697673600&v=beta&t=uzJlYtIzPHxEL1pPFXQpgulTzKRZ02YKozgv7eBVz0w,https://media.licdn.com/dms/image/C4D16AQHmK12E97elIw/profile-displaybackgroundimage-shrink_350_1400/0/1525966787037?e=1697673600&v=beta&t=1q-V2uBahkV0-g6HyJseJsrDOxmjLHnRpVPn-ERsIVw,personal,ACoAACcg6YwBwDXgkR7OMdLmUmG6u1u363BqzsA,656468364,,"Passionnée par l'éducation et l'apprentissage des langues, j'aime développer des projets alliant créativité et efficacité afin de faire progresser mes élèves.

Enseignante depuis plusieurs années en Education Prioritaire, je travaille chaque jour avec de jeunes enfants possédant une autre langue maternelle que le français. Pour ces élèves allophones, acquérir rapidement des compétences en français constitue un enjeu crucial. Bien plus que l'apprentissage d'une autre langue, il s'agit pour eux de pouvoir communiquer avec leurs pairs pour s'intégrer et de réussir leur scolarité en France à long terme.

C'est ainsi que j'ai commencé à concevoir des projets spécifiques s’articulant autour de trois compétences orales fondamentales: décrire, expliquer et raconter. 
Au sein d’un groupe restreint, et à partir de supports ludiques, les élèves sont placés en situation de communication : chaque travail mené a pour finalité d’être partagé.

Pour favoriser l'acquisition de structures lexicales à l’oral, les tâches langagières proposées sont variées :  décrire les photographies d'une chorégraphie inventée, expliquer la recette réalisée en classe à un camarade pour qu'il la réalise à son tour, ou encore raconter à d'autres une histoire avec des marottes...","{'country': 'Netherlands', 'short': 'The Hague, South Holland', 'city': 'The Hague', 'state': 'South Holland', 'default': 'The Hague, South Holland, Netherlands'}",False,False,[],"{'primary_locale': {'country': 'FR', 'language': 'fr'}, 'supported_locales': [{'country': 'FR', 'language': 'fr'}, {'country': 'US', 'language': 'en'}], 'profile_languages': [{'name': 'Anglais', 'proficiency': 'NATIVE_OR_BILINGUAL'}, {'name': 'Arabe', 'proficiency': 'ELEMENTARY'}, {'name': 'Espagnol', 'proficiency': 'NATIVE_OR_BILINGUAL'}, {'name': 'Français', 'proficiency': 'NATIVE_OR_BILINGUAL'}, {'name': 'Néerlandais', 'proficiency': 'LIMITED_WORKING'}, {'name': 'Occitan', 'proficiency': 'ELEMENTARY'}]}",Primary/Secondary Education,"[{'date': {'start': {'month': None, 'day': None, 'year': 2018}, 'end': {'month': None, 'day': None, 'year': 2019}}, 'school': {'name': 'Université Sorbonne Nouvelle', 'logo': 'https://media.licdn.com/dms/image/D4E0BAQFSAb95geG2sw/company-logo_400_400/0/1681205861054?e=1700092800&v=beta&t=huqInXVUCt0p8A6HIYSUghIUQEfKfj6wJsdkbKqL3V8', 'url': 'https://www.linkedin.com/school/universit-paris-sorbonne-nouvelle/'}, 'degree_name': 'Degree in teaching French as a foreign language', 'field_of_study': None}, {'date': {'start': {'month': None, 'day': None, 'year': 2010}, 'end': {'month': None, 'day': None, 'year': 2012}}, 'school': {'name': 'Université Toulouse - Jean Jaurès', 'logo': 'https://media.licdn.com/dms/image/D4D0BAQGikOmvEDv0dg/company-logo_400_400/0/1686071427904?e=1700092800&v=beta&t=6O0Q_nJLfOkBhRMHKBEc9xH2JYkyCCZK3LbgAzhWNyY', 'url': 'https://www.linkedin.com/school/universit%C3%A9-toulouse---jean-jaur%C3%A8s/'}, 'degree_name': 'Master of Arts', 'field_of_study': None}, {'date': {'start': {'month': None, 'day': None, 'year': 2009}, 'end': {'month': None, 'day': None, 'year': 2010}}, 'school': {'name': 'Université Toulouse - Jean Jaurès', 'logo': 'https://media.licdn.com/dms/image/D4D0BAQGikOmvEDv0dg/company-logo_400_400/0/1686071427904?e=1700092800&v=beta&t=6O0Q_nJLfOkBhRMHKBEc9xH2JYkyCCZK3LbgAzhWNyY', 'url': 'https://www.linkedin.com/school/universit%C3%A9-toulouse---jean-jaur%C3%A8s/'}, 'degree_name': 'Bachelor of Arts', 'field_of_study': 'History'}, {'date': {'start': {'month': None, 'day': None, 'year': 2007}, 'end': {'month': None, 'day': None, 'year': 2009}}, 'school': {'name': 'Université de Caen Normandie', 'logo': 'https://media.licdn.com/dms/image/C560BAQFddaa2kyAHTQ/company-logo_400_400/0/1555063801894?e=1700092800&v=beta&t=65NNVOUQL0-oAQu9UkZJa0VQegcH8QLx5jD2lh5nuEM', 'url': 'https://www.linkedin.com/school/universite-de-caen-normandie/'}, 'degree_name': 'Bachelor of Arts', 'field_of_study': 'History'}]",[],[],"[{'name': 'CLES 2 Anglais', 'date': {'start': {'month': 6, 'day': None, 'year': 2011}, 'end': {'month': None, 'day': None, 'year': None}}, 'authority': 'Université Toulouse - Jean Jaurès', 'url': 'http://www.univ-tlse2.fr/accueil/formation-insertion/decouvrir-nos-formations/certificat-de-competences-en-langues-de-l-enseignement-superieur-cles-537975.kjsp', 'license_number': None, 'display_source': 'univ-tlse2.fr', 'company': {'id': None, 'name': 'Université Toulouse - Jean Jaurès', 'logo': 'https://media.licdn.com/dms/image/D4D0BAQGikOmvEDv0dg/company-logo_400_400/0/1686071427904?e=1700092800&v=beta&t=6O0Q_nJLfOkBhRMHKBEc9xH2JYkyCCZK3LbgAzhWNyY', 'url': None}}]",[],[],[],[],[],"[{'company': {'id': 10584704, 'name': 'European School The Hague', 'logo': 'https://media.licdn.com/dms/image/C560BAQHxsmnLtryU7A/company-logo_400_400/0/1531471111177?e=1700092800&v=beta&t=Qr18n0cyH89TDYIFyYiDA_huIr1u7xSK0MXUxUzFVOI', 'url': 'https://www.linkedin.com/school/european-school-the-hague/', 'employees': {'start': 201, 'end': 500}}, 'date': {'start': {'month': 8, 'day': None, 'year': 2019}, 'end': {'month': None, 'day': None, 'year': None}}, 'profile_positions': [{'location': 'The Hague, Netherlands', 'date': {'start': {'month': 8, 'day': None, 'year': 2019}, 'end': {'month': None, 'day': None, 'year': None}}, 'company': 'European School The Hague', 'description': 'I had the opportunity to grow and learn, in an international environment, where teamwork is a key factor. This experience taught me flexibility and allowed me to enhance my teaching skills.\n\n* Implemented a special course to help children develop coding skills\n* Taught French as a Foreign Language on a daily basis, at school as well as an independent private teacher\n* Organized theatre workshops', 'title': 'Primary Teacher - French Section', 'employment_type': 'Full-time'}]}, {'company': {'id': None, 'name': 'Freelance', 'logo': None, 'url': None, 'employees': {'start': None, 'end': None}}, 'date': {'start': {'month': 9, 'day': None, 'year': 2017}, 'end': {'month': 8, 'day': None, 'year': 2019}}, 'profile_positions': [{'location': 'Toulouse', 'date': {'start': {'month': 9, 'day': None, 'year': 2017}, 'end': {'month': 8, 'day': None, 'year': 2019}}, 'company': 'Freelance', 'description': 'As an independent entrepreneur, I was able to use my writing and editing skills to help various companies optimize their communication as well as improving their websites.\n\n* Provided 50+ content marketing pieces\n* Successfully and accurately delivered on time 30+ translation documents\n* Edited and optimized 100+ website pages for various companies', 'title': 'French Translator and Reviser', 'employment_type': 'Self-employed'}]}, {'company': {'id': 8059, 'name': ""Minsitère de l'Education Nationale"", 'logo': 'https://media.licdn.com/dms/image/C4D0BAQHij1vwU8a5zw/company-logo_400_400/0/1607588416410?e=1700092800&v=beta&t=YtyYJRX3YXS2UKdNkB1g78tYhZRuiWMy7TJxd1oQzZU', 'url': 'https://www.linkedin.com/school/ministere-education-nationale-et-jeunesse/', 'employees': {'start': 10001, 'end': None}}, 'date': {'start': {'month': 9, 'day': None, 'year': 2012}, 'end': {'month': 8, 'day': None, 'year': 2019}}, 'profile_positions': [{'location': 'Toulouse Area, France', 'date': {'start': {'month': 9, 'day': None, 'year': 2012}, 'end': {'month': 8, 'day': None, 'year': 2019}}, 'company': ""Ministère de l'Éducation nationale et de la Jeunesse"", 'description': ""Working in various schools has taught me the value of being exceptionally organized, planning effectively, as well as tailoring lessons to children's needs. The last three years, I organized my class following the principles of Maria Montessori.\n\n* Worked for 7 years in 5 different schools with children aged 3 to 11\n* Delivered creative lesson plans and projects on a daily basis\n* Balanced the different learning needs of students and supported them and their parents meet long-term goals\n* Developed innovative learning methodologies in class and partnerships between parents and the school environment\n*Designed an innovative program for non-French speaking students"", 'title': 'Primary School Teacher', 'employment_type': None}]}]",[],"['Enseignement à la petite enfance', 'Enseignement du Français Langue Etrangère (FLE)', 'Orthographe', 'Recherche', 'Microsoft Office', 'Microsoft Word', 'Microsoft PowerPoint', 'Enseignement', 'Leadership', 'Parler en public', 'Travail d’équipe', 'Didactique des langues', 'Audacity', 'Pédagogie', 'pedagogie', 'Édition', 'Correction de texte', 'Traduction', 'Logiciels Apple', 'Adaptabilité']",,,
