profile_id,first_name,last_name,sub_title,profile_picture,background_image,profile_type,entity_urn,object_urn,birth_date,summary,location,premium,influencer,treasury_media,languages,industry,education,patents,awards,certifications,organizations,projects,publications,courses,test_scores,position_groups,volunteer_experiences,skills,network_info,related_profiles,contact_info
mahricharyyeva,Mahri,Charyyeva,Technology M&A at Deloitte Netherlands,,,personal,ACoAAAyF2vsBSTNZYhFAoveXJeP-VeU_MlIaEZ8,210098939,,"Technology and risk professional with an international and broad profile, focusing on establishing new capabilities and propositions in Mergers and Acquisitions world, via enabling team culture through coaching talents.

Major strengths are solid technology and risk knowledge, high organizational skills, time management, ability to work with highly-structured or creative projects, being a team player, yet, having ability to perform high quality work alone.

Motivation is driven by challenge and curiosity to explore and create something new.","{'country': None, 'short': 'Netherlands', 'city': None, 'state': None, 'default': 'Netherlands'}",False,False,[],"{'primary_locale': {'country': 'US', 'language': 'en'}, 'supported_locales': [{'country': 'US', 'language': 'en'}], 'profile_languages': [{'name': 'Dutch', 'proficiency': 'LIMITED_WORKING'}, {'name': 'English', 'proficiency': 'PROFESSIONAL_WORKING'}, {'name': 'French', 'proficiency': 'ELEMENTARY'}, {'name': 'Russian', 'proficiency': 'NATIVE_OR_BILINGUAL'}, {'name': 'Turkish', 'proficiency': 'PROFESSIONAL_WORKING'}, {'name': 'Turkmen', 'proficiency': 'NATIVE_OR_BILINGUAL'}]}",Management Consulting,"[{'date': {'start': {'month': None, 'day': None, 'year': 2016}, 'end': {'month': None, 'day': None, 'year': 2017}}, 'school': {'name': 'Tilburg University', 'logo': 'https://media.licdn.com/dms/image/C4D0BAQHNJkPAcEjYEg/company-logo_400_400/0/1631003396114?e=1700697600&v=beta&t=pmxkaQ2W7K-vpqyiSW215OvNG5wTY3voV4Aj1sLAp2s', 'url': 'https://www.linkedin.com/school/tilburg-university/'}, 'degree_name': 'MSc Information Management', 'field_of_study': 'Information Management'}, {'date': {'start': {'month': None, 'day': None, 'year': 2015}, 'end': {'month': None, 'day': None, 'year': 2017}}, 'school': {'name': 'Aix-Marseille Graduate School of Management - IAE', 'logo': 'https://media.licdn.com/dms/image/C4D0BAQF-1ZSwb2pZ5Q/company-logo_400_400/0/1542701341772?e=1700697600&v=beta&t=SFEqahLCN5XSNvYNpSA6QCjmCkGezXQTBC7X-48eMKo', 'url': 'https://www.linkedin.com/school/iae-aix-marseille-graduate-school-of-management/'}, 'degree_name': 'International Master in Management of IT (IMMIT)', 'field_of_study': 'Management of Information Technology'}, {'date': {'start': {'month': None, 'day': None, 'year': 2015}, 'end': {'month': None, 'day': None, 'year': 2017}}, 'school': {'name': 'Turku School of Economics at the University of Turku', 'logo': 'https://media.licdn.com/dms/image/C560BAQHxiyqfe0HW8A/company-logo_400_400/0/1544705716906?e=1700697600&v=beta&t=aSeJ3DJ64s1JoRDX_4HXhtbV1BvpwColZnrY74Mgci4', 'url': 'https://www.linkedin.com/school/turku-school-of-economics/'}, 'degree_name': 'International Master in Management of IT (IMMIT)', 'field_of_study': 'Management of Information Technology'}, {'date': {'start': {'month': None, 'day': None, 'year': 2014}, 'end': {'month': None, 'day': None, 'year': 2015}}, 'school': {'name': 'Prague University of Economics and Business', 'logo': 'https://media.licdn.com/dms/image/C4E0BAQECmoHvple3Xw/company-logo_400_400/0/1677492469528?e=1700697600&v=beta&t=JlvXE03oyptoAbDz1jJN_OfNN7YFUCg_De5MypOjLro', 'url': 'https://www.linkedin.com/school/vysok%C3%A1-%C5%A1kola-ekonomick%C3%A1-v-praze/'}, 'degree_name': 'Bachelor of Business Administration (B.B.A.)', 'field_of_study': 'Business Administration and Management Information Systems'}, {'date': {'start': {'month': None, 'day': None, 'year': 2011}, 'end': {'month': None, 'day': None, 'year': 2015}}, 'school': {'name': 'Özyeğin University', 'logo': 'https://media.licdn.com/dms/image/D4D0BAQF01wmJyR6vTw/company-logo_400_400/0/1680703270859?e=1700697600&v=beta&t=t7440XP2TzLMDOwfTyV-FE_ZVLYBdwgKVzwVpzpcNFM', 'url': 'https://www.linkedin.com/school/ozyeginuniversitesi/'}, 'degree_name': 'Bachelor of Business Administration (B.B.A.)', 'field_of_study': 'Business Administration, Management Information System'}, {'date': {'start': {'month': None, 'day': None, 'year': 2011}, 'end': {'month': None, 'day': None, 'year': 2011}}, 'school': {'name': 'George Mason University', 'logo': 'https://media.licdn.com/dms/image/C510BAQEqP3qWiv-ZEw/company-logo_400_400/0/1519856326478?e=1700697600&v=beta&t=Tk_ZWDtuKFWiZdAiykILtd06OlGnIEg8zONcllWGVNQ', 'url': 'https://www.linkedin.com/school/george-mason-university/'}, 'degree_name': 'Summer School', 'field_of_study': 'Peace Studies and Conflict Resolution'}, {'date': {'start': {'month': None, 'day': None, 'year': 2004}, 'end': {'month': None, 'day': None, 'year': 2009}}, 'school': {'name': 'Turkmen-Turkish High School', 'logo': None, 'url': None}, 'degree_name': 'High School Diploma', 'field_of_study': None}]",[],"[{'title': 'GLO-BUS: Developing Winning Competitive Strategies - Industry Winner', 'description': ""This award signifies the participant's extensive performance as senior executive at the best-performing company in an industry setting where teams of students ran companies and crafted strategies aimed at achieving superior financial performance and market leadership; the exercise was conducted in a course at Ozyegin University.\n\n"", 'issuer': 'Glo-Bus Software', 'date': {'month': 6, 'day': None, 'year': 2015}}, {'title': 'High Honors Graduate', 'description': ""To become a High Honors Graduate requires high academic performance, alongside with social involvement within university's student life. In total, during the graduation year of 2015, there have been 5 High Honors Graduates."", 'issuer': 'Ozyegin University', 'date': {'month': 6, 'day': None, 'year': 2015}}, {'title': 'JATCAFA Nippon Foundation Scholarship for Successful Students', 'description': 'This scholarship was granted by JATCAFA (Japan Turkey Central Asia Friendship Association) to Successful Students from Central Asian Countries studying in Turkey. The selection process requires high academic outstanding and well-performing social skills like leadership, team work, etc.\n\nThe scholarship is awarded for two years and requires active involvement in various social events throughout the year.', 'issuer': 'JATFACA (Japan Turkey Central Asia Friendship Association)', 'date': {'month': 10, 'day': None, 'year': 2013}}, {'title': 'Success Scholarship', 'description': ""This scholarship is granted on the basis of student's previous year's performance. The amount of credits completed should be higher than 60 ECTS, and therefore, the ranking of the student within the whole department should be in first 5%.\n\nThe scholarship is granted as cash installments to student's bank account on the period of 9 academic month."", 'issuer': 'Ozyegin University', 'date': {'month': 9, 'day': None, 'year': 2012}}, {'title': 'Performance Scholarship - Full Tuition Fee Waiver', 'description': 'The Performance Scholarship has been granted on the basis of ranking based on entrant students for the year of application. To obtain a Full Tuition Waiver a prospect student should be ranked in top 5% of all entrants.\n\nThe Performance Scholarship provides a student with a full tuition waiver for the period of 4 academic years ,and additionally, exempts from technological fees.\n\nThe scholarship is viable only if student sustains a GPA of 3.0 and higher.', 'issuer': 'Ozyegin University', 'date': {'month': 9, 'day': None, 'year': 2011}}, {'title': 'JA Asia Pacific Company of the Year Competition (JA AP COY)', 'description': 'The 3 day competition is JA Asia Pacific’s annual celebration of the achievements of JA Company Program students in the region. JA Asia Pacific, the Regional Operating Center of JA Worldwide, is the organizer of the competition in the region, supported by a JA member (Host country for the competition) as the event travel to different countries each year.\n \nThe competition is not simply a business competition for young people. The goal is to balance the business achievements of each company as a whole with the personal development of each individual member.\n \nTherefore, for a company to win this award, it is not sufficient just to run a financially successful JA company or to have created an exciting product or service. JA company members must also demonstrate that they understand how and why the company performed as it did.\n \nJudges will be looking for evidence of innovation and the application of new ideas in all aspects of running the company. They also will look for an understanding that continuous improvement through innovation is essential to the success of a business.\n\nThe team from Turkmenistan was awarded 1st place during the year of 2011, out-beating 10 other teams from countries like China, Japan, Guam, Thailand, Philippines, Sri Lanka, and more. My role in this competition was ""Company\'s President"" and responsibilities have been managing the company on all levels.', 'issuer': 'Junior Achievement Asia Pacific and FedEx', 'date': {'month': 1, 'day': None, 'year': 2011}}]","[{'name': 'Certified Information Systems Auditor (CISA)', 'date': {'start': {'month': 1, 'day': None, 'year': 2023}, 'end': {'month': None, 'day': None, 'year': None}}, 'authority': 'ISACA', 'url': 'https://www.credly.com/badges/55255b2f-dd94-492d-955f-c05edaed7f80/public_url', 'license_number': '232047948', 'display_source': 'credly.com', 'company': {'id': None, 'name': 'ISACA', 'logo': 'https://media.licdn.com/dms/image/C4E0BAQEbgaF0IMoyIw/company-logo_400_400/0/1580742431409?e=1700697600&v=beta&t=Kx_-xoTRoNHDTBI1mfQFydxLS0FooASZ_5df-KMWuqY', 'url': None}}, {'name': 'Digital Leadership', 'date': {'start': {'month': 9, 'day': None, 'year': 2022}, 'end': {'month': None, 'day': None, 'year': None}}, 'authority': 'Growth Tribe', 'url': 'https://certificates.growthtribe.io/en/verify/12771932632063?ref=email', 'license_number': '12771932632063', 'display_source': 'growthtribe.io', 'company': {'id': None, 'name': 'Growth Tribe', 'logo': 'https://media.licdn.com/dms/image/C560BAQHeR_dfrmhFUQ/company-logo_400_400/0/1527590806559?e=1700697600&v=beta&t=el1PmAM0iY73T0sH5q0TJ3Mmjh8Iyo5OLTFCwXbJEtQ', 'url': None}}]",[],"[{'title': 'Next Generation Feedback e-Learning Service – A Novel Case Study by ICT-portti and GetListed!', 'date': {'start': {'month': 12, 'day': None, 'year': 2015}, 'end': {'month': 5, 'day': None, 'year': 2016}}, 'description': 'The CEO of Liitos, Risto Ahonen, Leadership Instructor, and Sirke Lohtaja-Ahonen, Communications Instructor, needed help in developing their well-established feedback training to the next level. Their goal was to gain more scalability and to increase volume. Their ideas about deploying gamification and e-services reached project researcher Jesse Kaukola and lecturer Antti Tuomisto from ICT-portti at the Innostu! ICT:stä -seminar in October 2015.\n\nThere were immediate agreement on the research project, and the project plan was established by December 2015. The project included specification of the new service and a design of the gamified parts of the service. These two parts are delivered together with University of Turku and Turku School of Applied Sciences.\n\nGet Listed (GL) service took care of the team creation at Turku University. The team was formed: Lisa Ratz (IoT and machine learning), Mahri Charyyeva (IT and business communications), Nella Sarapelto (games and holistic systems), and Esa Grönberg (IT system specialist). Esa is currently studying at IT department, and the others are students at Turku School of Economics.', 'contributors': [{'type': 'standardizedContributor', 'first_name': 'Mahri', 'last_name': 'Charyyeva', 'name': None, 'headline': 'Technology M&A at Deloitte Netherlands'}]}]",[],[],[],"[{'company': {'id': 1038, 'name': 'Deloitte', 'logo': 'https://media.licdn.com/dms/image/C560BAQGNtpblgQpJoQ/company-logo_400_400/0/1662120927694?e=1700697600&v=beta&t=n7VJdkStQwpgnGL7fb3Osu6DyQ3zuX3PPtOiDGQNVLI', 'url': 'https://www.linkedin.com/company/deloitte/', 'employees': {'start': 10001, 'end': None}}, 'date': {'start': {'month': 11, 'day': None, 'year': 2022}, 'end': {'month': None, 'day': None, 'year': None}}, 'profile_positions': [{'location': 'Amsterdam, North Holland, Netherlands', 'date': {'start': {'month': 11, 'day': None, 'year': 2022}, 'end': {'month': None, 'day': None, 'year': None}}, 'company': 'Deloitte', 'description': 'Developing Technology Due Diligence capabilities and propositions with Deloitte Value Creation Services.\n\nThe capabilities consist of:\n- IT DD evaluations;\n- Product & Platform Software DD;\n- Cyber security DD;\n- Separation/carve-out Technology evaluations and support.\n\nDaily activities include the following:\n- Conducting Technology Due Diligence and pre-deal IT M&A assessments;\n- Analyzing relevant industry developments and reviewing business and technology strategies;\n- Mapping current and end-state technology, business models and architecture;\n- Assessing technology stacks, core processes and technology spend and reviewing investment plans;\n- Developing and pitching deal-related technology insights to clients;\n- Shaping and further developing a very successful proposition.', 'title': 'Manager | Technology M&A', 'employment_type': 'Full-time'}]}, {'company': {'id': 11348, 'name': 'Booking.com', 'logo': 'https://media.licdn.com/dms/image/C4E0BAQEgzF5azm3fNA/company-logo_400_400/0/1628510256914?e=1700697600&v=beta&t=oaxCkHySuLgrEFLXxw_Q9XDv1cHJeWHoyplnre8Oexo', 'url': 'https://www.linkedin.com/company/booking.com/', 'employees': {'start': 10001, 'end': None}}, 'date': {'start': {'month': 3, 'day': None, 'year': 2020}, 'end': {'month': 11, 'day': None, 'year': 2022}}, 'profile_positions': [{'location': 'Amsterdam, North Holland, Netherlands', 'date': {'start': {'month': None, 'day': None, 'year': 2021}, 'end': {'month': 11, 'day': None, 'year': 2022}}, 'company': 'Booking.com', 'description': 'IT Controls:\n• Support process and control owners to understand risks within SOX, PCI or GDPR, business continuity etc. and assist them in determining optimal controls to mitigate risks\n• Identify controls based on risks for compliance areas in each of the IT and business processes\n• Provide support in the design, implementation and amendment of controls\n• Enable continuous improvement, maintaining our Booking.com controls catalogue, by providing general and technical guidance on how to maintain relevant controls\n• Monitor control performance of IT controls across the business for timely and effective execution\n\nGovernance & Change Management:\n• Report on risks and control effectiveness to internal and external risk / audit committee boards\n• Set the standards, operating procedures, templates and tooling\n• Maintain risk register and track risk exposures against risk appetite\n• Escalate any challenges in executing change (e.g. stakeholder commitment, technical complexity or resource limitations) in a timely manner\n• Embed ownership and awareness in 1st line of defence via training and communication to control owners\n• Foster an intelligent risk culture across B.com through communication, training etc.\n• Update management on change progress\n\nAudit Management:\n• Support coordination of Internal Audit and External Audit efforts with the business\n• Lead the program management of testing cycles and engagement with internal and external\n• Track the mitigation of confirmed deficiencies from Internal and External audit, working closely with business partnering team\n• Communicate and agree on control objectives with stakeholders to determine optimal and scalable solutions to mitigate relevant risks\n• Obtain stakeholder commitment for implementing the required changes\n• Escalate any challenges to meeting audit cycle timelines in a timely manner\n• Coordinate & monitor implementation of changes by business units and functions', 'title': 'IT Risk and Controls Officer', 'employment_type': 'Full-time'}, {'location': 'Amsterdam, North Holland, Netherlands', 'date': {'start': {'month': 3, 'day': None, 'year': 2020}, 'end': {'month': None, 'day': None, 'year': 2021}}, 'company': 'Booking.com', 'description': 'As an IT Risk and Controls Analyst, I am responsible for supporting process owners throughout to document, maintain & monitor internal controls in line with our risk appetite and to maintain the quality of our processes.\n\nMy key areas of responsibility include, but not limited to:\n• Conducting design and operational testing of internal controls within agreed timescales;\n• Coordination with process owners regarding control documentation, testing, evaluation, and necessary remediation;\n• Identification of control weaknesses and supporting of the control team to influence process owners to implement agreed changes in a timely and effective manner;\n• Supporting the team to identify ways to increase their business impact and improve the team’s product(s) and ways of working;\n• Supporting audit activities and helping to close any controls deficiencies identified.\n\nThe above mentioned activities help me building and supporting my professional knowledge of regulations like SOx, PCI DSS, GDPR and various consumer and competition compliance regulations, as well as frameworks like ERM and COBIT 2019. Moreover, the nature of Booking.com allows me gaining knowledge on how the risk management works in DevOps environment and get acquainted working with tools such as Puppet, Git, Docker and Kubernetes.', 'title': 'IT Risk and Controls Analyst', 'employment_type': 'Full-time'}]}, {'company': {'id': 1073, 'name': 'EY', 'logo': 'https://media.licdn.com/dms/image/C510BAQGpRhkpxp5A9A/company-logo_400_400/0/1561962168715?e=1700697600&v=beta&t=2XXtIwvyoU-JRPHXPNsuavc3eNpQj1bdsQWU8vVx5Ec', 'url': 'https://www.linkedin.com/company/ernstandyoung/', 'employees': {'start': 10001, 'end': None}}, 'date': {'start': {'month': 2, 'day': None, 'year': 2017}, 'end': {'month': 3, 'day': None, 'year': 2020}}, 'profile_positions': [{'location': 'Amsterdam Area, Netherlands', 'date': {'start': {'month': 2, 'day': None, 'year': 2017}, 'end': {'month': 3, 'day': None, 'year': 2020}}, 'company': 'EY', 'description': 'My main responsibility is to perform general and application control reviews for various computer information systems. In addition, my responsibility involves information control reviews to include system development standards, operating procedures, system security, programming controls, communication controls, backup and disaster recovery, and system maintenance. Alongside, preparation of audit finding memoranda and working papers is in my responsibilities to ensure that adequate documentation exists to support the completed audit and conclusions.\n\nIn a nutshell, I am skilled in performing IT Audit procedures in relation to financial statements, SOx 404 reviews, ISAE 3402 Type I&II and IT maturity assessments. I have worked with industries in Retail, Financial Services and Logistics and was exposed to projects execution in countries like Netherlands, Sweden, and France. Moreover, during my professional experience I was teamed and supported engagements in The Netherlands and India. During past two years I have acquired working knowledge of ERPs such as SAP and Infor, as well as tools like SAP GRC and SAP BW, HR SuccessFactors, SharePoint and ITSM tools like ServiceNow.\n\nSkills:\nRisk assessment ability\nInternal audit experience\nCommunication skills\nInterpersonal skills\nSecurity testing experience\nIT security and infrastructure knowledge\nKnowledge of operating system platforms\nReport writing skills\nAnalytical skills', 'title': 'IT Audit & Technology Risk Advisor', 'employment_type': None}, {'location': 'Amsterdam Area, Netherlands', 'date': {'start': {'month': 2, 'day': None, 'year': 2017}, 'end': {'month': 6, 'day': None, 'year': 2017}}, 'company': 'EY', 'description': 'The internship is performed in Financial IT Audit department of EY Netherlands.\nThis internship is a part of IMMIT master program. The requirement of the program is to fulfill the last semester of studies performing an internship in a company, while writing a master thesis.\n\nMaster thesis is related to professional judgment and decision-making within IT audit processes.\nThe research question is: ""What procedure can be identified to systemize judgment and decision-making of risk assessment in a customized IT environment?"".\n\nMaster thesis grade: 9.0.\n\nSkills of focus: IT audit, IT controls affecting financial statements, IT landscape and infrastructure, behavioral decision-making.', 'title': 'Research Intern', 'employment_type': None}]}, {'company': {'id': 337359, 'name': 'Asset | SBIT', 'logo': 'https://media.licdn.com/dms/image/C4D0BAQEaDaeBNUTbLQ/company-logo_400_400/0/1519862843834?e=1700697600&v=beta&t=UgwGKE9D-CGSPflQmSAp83NH4QaAbhfTwSzdRjQFQ9s', 'url': 'https://www.linkedin.com/company/asset-sbit/', 'employees': {'start': 11, 'end': 50}}, 'date': {'start': {'month': 9, 'day': None, 'year': 2016}, 'end': {'month': 8, 'day': None, 'year': 2017}}, 'profile_positions': [{'location': 'Tilburg Area, Netherlands', 'date': {'start': {'month': 9, 'day': None, 'year': 2016}, 'end': {'month': 8, 'day': None, 'year': 2017}}, 'company': 'Asset | SBIT', 'description': 'Performed a role of international committee member that organizes various activities for both Dutch and international students of Information Management master track.', 'title': 'Active Member', 'employment_type': None}]}, {'company': {'id': 2490169, 'name': 'HemenKiralik.com', 'logo': 'https://media.licdn.com/dms/image/C560BAQGQv8q-lsO2QQ/company-logo_400_400/0/1519880930186?e=1700697600&v=beta&t=o3bXFGm4eXM5XUVq6qoos77vfyyxNwJEptT81gxQcME', 'url': 'https://www.linkedin.com/company/hemenkiralik-com/', 'employees': {'start': 11, 'end': 50}}, 'date': {'start': {'month': 3, 'day': None, 'year': 2014}, 'end': {'month': 5, 'day': None, 'year': 2015}}, 'profile_positions': [{'location': 'Istanbul, Turkey', 'date': {'start': {'month': 3, 'day': None, 'year': 2014}, 'end': {'month': 5, 'day': None, 'year': 2015}}, 'company': 'HemenKiralik.com', 'description': 'This is a part time freelance job that required written translations from Turkish language to English.\n\nMost of the translations have been of a descriptive nature, involving understanding of real estate jargon.\n\nSkills of focus: real estate jargon, written translations, Turkish, English, time management, discipline.', 'title': 'Turkish-English Written Translations (Freelance)', 'employment_type': None}]}, {'company': {'id': None, 'name': 'SHX Trading (SPYobchod.cz)', 'logo': None, 'url': None, 'employees': {'start': None, 'end': None}}, 'date': {'start': {'month': 11, 'day': None, 'year': 2014}, 'end': {'month': 1, 'day': None, 'year': 2015}}, 'profile_positions': [{'location': 'Prague, The Capital, Czech Republic', 'date': {'start': {'month': 11, 'day': None, 'year': 2014}, 'end': {'month': 1, 'day': None, 'year': 2015}}, 'company': 'SHX Trading (SPYobchod.cz)', 'description': ""This internship required me to provide support in online market research, development of online advertisement and testing of the online shop.\n\nThe market research included analyzing the new potential martkets for online shop's expansion in near future. Markets that have been analyzed are Slovakia, Austria, Germany, Russia, Turkey. \n\nOnline advertisement has been performed via email marketing service Mail Chimp. The development of advertisements required desining the newsletter, sending out to customers and analysis of responses and follow-ups afterwards.\n\nTesting of webshop has been performed over an English version of the online shop, which has been translated from Czech into English. The testing required analyzing deficient functionalities of hyperlinks within the webshop, checking upon grammar and design consistency with the original Czech website.\n\nSkills of focus: analytical skills, grammar check, marketing research, PHP."", 'title': 'Marketing Department Intern', 'employment_type': None}]}, {'company': {'id': 15131310, 'name': 'Ozyegin University', 'logo': 'https://media.licdn.com/dms/image/D4D0BAQF01wmJyR6vTw/company-logo_400_400/0/1680703270859?e=1700697600&v=beta&t=t7440XP2TzLMDOwfTyV-FE_ZVLYBdwgKVzwVpzpcNFM', 'url': 'https://www.linkedin.com/school/ozyeginuniversitesi/', 'employees': {'start': 501, 'end': 1000}}, 'date': {'start': {'month': 2, 'day': None, 'year': 2012}, 'end': {'month': 1, 'day': None, 'year': 2015}}, 'profile_positions': [{'location': 'Istanbul, Turkey', 'date': {'start': {'month': 2, 'day': None, 'year': 2012}, 'end': {'month': 1, 'day': None, 'year': 2015}}, 'company': 'Özyeğin University', 'description': ""Teaching assistants responsibility is course and outline preparation, attendance of the lab sessions, where business concepts are applied to the Microsoft Excel program, arrangements of the help sessions and office hours, homework assignments, quizzes, midterms and finals. Teaching the course to first year business and engineering students twice a week.\n\nFront Office Manager's responsibility is managing the team of fellow assistants that are involved in face-to-face teaching and assisting of students. Preparation of weekly teaching material, and communication to the team on a weekly basis are main activities of a Front Office Manager. At the same time, management of course files on Learning Management System (LMS) is one of responsibilities.\n\nSkills of focus: teaching, business concepts, MS Excel, team work, leadership, LMS."", 'title': 'Teaching Assistant and Front Office Manager', 'employment_type': None}]}, {'company': {'id': 233147, 'name': 'Arkan & Ergin', 'logo': 'https://media.licdn.com/dms/image/C4E0BAQFe-1eUdnkkyQ/company-logo_400_400/0/1645609654287?e=1700697600&v=beta&t=w3vTrfFzJJF571lpCb2OWNboBVNL8EOwJxMsR7jpUx8', 'url': 'https://www.linkedin.com/company/arkan-&-ergin/', 'employees': {'start': 51, 'end': 200}}, 'date': {'start': {'month': 7, 'day': None, 'year': 2014}, 'end': {'month': 9, 'day': None, 'year': 2014}}, 'profile_positions': [{'location': 'Istanbul, Turkey', 'date': {'start': {'month': 7, 'day': None, 'year': 2014}, 'end': {'month': 9, 'day': None, 'year': 2014}}, 'company': 'RSM Turkey Corporate Finance', 'description': None, 'title': 'Corporate Finance Intern', 'employment_type': None}]}, {'company': {'id': None, 'name': 'Binyat Gurluşyk', 'logo': None, 'url': None, 'employees': {'start': None, 'end': None}}, 'date': {'start': {'month': 6, 'day': None, 'year': 2014}, 'end': {'month': 7, 'day': None, 'year': 2014}}, 'profile_positions': [{'location': 'Ashgabat, Turkmenistan', 'date': {'start': {'month': 6, 'day': None, 'year': 2014}, 'end': {'month': 7, 'day': None, 'year': 2014}}, 'company': 'Binyat Gurluşyk', 'description': None, 'title': 'Accounting Intern', 'employment_type': None}]}, {'company': {'id': None, 'name': 'Ak-Mahri', 'logo': None, 'url': None, 'employees': {'start': None, 'end': None}}, 'date': {'start': {'month': 2, 'day': None, 'year': 2011}, 'end': {'month': 9, 'day': None, 'year': 2011}}, 'profile_positions': [{'location': 'Ashgabat', 'date': {'start': {'month': 2, 'day': None, 'year': 2011}, 'end': {'month': 9, 'day': None, 'year': 2011}}, 'company': 'Ak-Mahri', 'description': 'Dealt with the preparation of the designs of the plastic bags and ordering of the clichés\nManaging the ordering and logistics along with all the needed documentation of the spare parts, raw materials for the factory production and clichés for plastic bag printing\nWorking with banks, composing of the import/export contracts with other companies, working with ministries of Turkmenistan for obtaining the certificates of accordance for the plastic bags produced by the company', 'title': 'Manager/designer', 'employment_type': None}]}]","[{'date': {'start': {'month': 6, 'day': None, 'year': 2017}, 'end': {'month': 12, 'day': None, 'year': 2019}}, 'role': 'Volunteer', 'company': {'id': None, 'name': 'Windmill Tournament', 'logo': 'https://media.licdn.com/dms/image/C510BAQGhwCnI-nSEUA/company-logo_400_400/0/1519893667043?e=1700697600&v=beta&t=Ul24VXCVjwUy1grI8WjMWkiSVA5jnT4h8K7FKP3CW1M', 'url': 'https://www.linkedin.com/company/windmill/'}, 'cause': None, 'description': None}, {'date': {'start': {'month': None, 'day': None, 'year': 2006}, 'end': {'month': None, 'day': None, 'year': 2011}}, 'role': 'Volunteer', 'company': {'id': None, 'name': 'American Councils for International Education', 'logo': 'https://media.licdn.com/dms/image/C4D0BAQGqpDKwyKn79w/company-logo_400_400/0/1529426135069?e=1700697600&v=beta&t=85FBsBhExJWGnIUOTE-hIyd1wfS4hmxWdXA9fLpNBF0', 'url': 'https://www.linkedin.com/company/american-councils-for-international-education/'}, 'cause': 'EDUCATION', 'description': 'During this period of volunteering for American Councils in Ashgabat, Turkmenistan, I have been involved in a lot of various projects. Taking various courses on self-development, leadership, team building, public speaking, and more, I have also provided some courses to other fellow volunteers and students. The courses were organized on a volunteering basis at the library of American Councils. I held courses in ""TOEFL for beginners"" and ""Vocabulary for SAT"". Additionally, I have taken an active role in preparation various summer schools in collaboration with American Councils and Information Resource Center (IRC) in Ashgabat, Turkmenistan. Moreover, I have organized several community projects like visits to elderly care houses and city cleaning activities. The last, but not the least, is my involvement as an organizer of Ultimate Frisbee Tournament in Ashgabat, Turkmenistan.'}]","['IT Management', 'English', 'Teaching', 'Risk Management', 'Research', 'Statistics', 'Entrepreneurship', 'Translation', 'Data Analysis', 'Event Planning', 'Volunteering', 'Social Media', 'Analysis', 'Data Mining', 'Market Research', 'Business Strategy', 'Business Analysis', 'Analytical Skills', 'IT Audit', 'Project Management']",,,
