profile_id,first_name,last_name,sub_title,profile_picture,background_image,profile_type,entity_urn,object_urn,birth_date,summary,location,premium,influencer,treasury_media,languages,industry,education,patents,awards,certifications,organizations,projects,publications,courses,test_scores,position_groups,volunteer_experiences,skills,network_info,related_profiles,contact_info
erjanmx,Erzhan,K.,Senior Software Engineer / Team Lead at Corsearch,https://media.licdn.com/dms/image/C4E03AQHff7tXUMObqA/profile-displayphoto-shrink_800_800/0/1541155651697?e=1697673600&v=beta&t=56Cy-WXOORPudceV6VPQ3MqqO5C8rBIbU2uMTcv5E8c,,personal,ACoAABBd2VYBHWn3bLwlwIL9RhP44LBHHw-hhY8,274585942,,"Software developer with 10+ years of experience. Masters Degree in Software Engineering and Information Security. Currently working as a full-stack developer in Amsterdam. 

Have experience architecting, engineering, testing, and deploying multiple high-load services (mono and microservices)

I am proficient in Python (Django, Flask), PHP (Laravel, Symfony, Yii), comfortable with JavaScript (Vue, React), worked with C++, Java, and Dart

I have worked with MySQL/PostgreSQL/MongoDB, Redis, Kafka/RabbitMQ, and Elasticsearch. 

I can use the version control Git with knowledge of advanced features following agile development principles with automated tests and continuous delivery using Docker, SemaphoreCI/TravisCI/Jenkins with Cloud Computing Services such as AWS and GCP

Very familiar with machine learning (sklearn, numpy, pandas) and computer vision (tensorflow, cv2, tesseract, paddleOCR), image processing (similarity search, object detection) have developed solutions to find, count, and authorize vehicles based on their shape, color and registration tag (2015).

Love to solve problems. Was ranked first in the Republican competitive programming contest (Kyrgyzstan 2008) and in Urban Data Hackathon 2016 (#UDH2016)

Github: https://github.com/erjanmx","{'country': 'Netherlands', 'short': 'Amsterdam, North Holland', 'city': 'Amsterdam', 'state': 'North Holland', 'default': 'Amsterdam, North Holland, Netherlands'}",False,False,"[{'url': 'https://github.com/erjanmx', 'title': 'erjanmx (Erjan)', 'description': 'erjanmx has 6 repositories available. Follow their code on GitHub.', 'image': 'https://media.licdn.com/dms/image/sync/C4D27AQHasEz3zPM5qw/articleshare-shrink_800/0/1691583535341?e=1692939600&v=beta&t=MSq-8PHDZyWvKnnpOle-1S-pzjpfQ4xS4h-mMA1vEPY'}]","{'primary_locale': {'country': 'US', 'language': 'en'}, 'supported_locales': [{'country': 'US', 'language': 'en'}], 'profile_languages': [{'name': 'Dutch', 'proficiency': 'LIMITED_WORKING'}, {'name': 'English', 'proficiency': 'FULL_PROFESSIONAL'}, {'name': 'Kyrgyz', 'proficiency': 'NATIVE_OR_BILINGUAL'}]}",Computer Software,"[{'date': {'start': {'month': None, 'day': None, 'year': 2016}, 'end': {'month': None, 'day': None, 'year': 2018}}, 'school': {'name': 'National Research Nuclear University MEPhI (Moscow Engineering Physics Institute)', 'logo': 'https://media.licdn.com/dms/image/C4E0BAQGcmwJrDX3Xeg/company-logo_400_400/0/1638366425026?e=1700697600&v=beta&t=RYqiadYbo9tMCc5L7SQB0WvyevS086RmQM_bTL_M95E', 'url': 'https://www.linkedin.com/school/%D0%BD%D0%B0%D1%86%D0%B8%D0%BE%D0%BD%D0%B0%D0%BB%D1%8C%D0%BD%D1%8B%D0%B9-%D0%B8%D1%81%D1%81%D0%BB%D0%B5%D0%B4%D0%BE%D0%B2%D0%B0%D1%82%D0%B5%D0%BB%D1%8C%D1%81%D0%BA%D0%B8%D0%B9-%D1%8F%D0%B4%D0%B5%D1%80%D0%BD%D1%8B%D0%B9-%D1%83%D0%BD%D0%B8%D0%B2%D0%B5%D1%80%D1%81%D0%B8%D1%82%D0%B5%D1%82-%D0%BC%D0%B8%D1%84%D0%B8-/'}, 'degree_name': ""Master's degree"", 'field_of_study': 'Computer and Information Systems Security/Information Assurance'}, {'date': {'start': {'month': None, 'day': None, 'year': 2010}, 'end': {'month': None, 'day': None, 'year': 2016}}, 'school': {'name': 'Kyrgyz Russian Slavic University', 'logo': None, 'url': None}, 'degree_name': 'Specialist degree', 'field_of_study': 'Computer Software Engineering'}]",[],[],"[{'name': 'Advanced Python', 'date': {'start': {'month': 7, 'day': None, 'year': 2021}, 'end': {'month': None, 'day': None, 'year': None}}, 'authority': 'LinkedIn', 'url': 'https://www.linkedin.com/learning/certificates/749dc41fb7da6df32fb7ab34e1780805d41710e04d5e9fff87a3ac9746a018d7?trk=backfilled_certificate', 'license_number': None, 'display_source': 'linkedin.com', 'company': {'id': None, 'name': 'LinkedIn', 'logo': 'https://media.licdn.com/dms/image/C560BAQHaVYd13rRz3A/company-logo_400_400/0/1638831589865?e=1700697600&v=beta&t=e1FsZytsym0fLF5Jt7PFnH40bqJRRzdgJ5LH7Y3pJJM', 'url': None}}, {'name': 'Improving Your Memory', 'date': {'start': {'month': 7, 'day': None, 'year': 2021}, 'end': {'month': None, 'day': None, 'year': None}}, 'authority': 'LinkedIn', 'url': 'https://www.linkedin.com/learning/certificates/84f7f255c6faeb7d594ec6c3c5502eb2d3354ff21b23f0e444b83024a4a88089?trk=backfilled_certificate', 'license_number': None, 'display_source': 'linkedin.com', 'company': {'id': None, 'name': 'LinkedIn', 'logo': 'https://media.licdn.com/dms/image/C560BAQHaVYd13rRz3A/company-logo_400_400/0/1638831589865?e=1700697600&v=beta&t=e1FsZytsym0fLF5Jt7PFnH40bqJRRzdgJ5LH7Y3pJJM', 'url': None}}, {'name': 'The Complete Hands-On Course to Master Apache Airflow', 'date': {'start': {'month': 12, 'day': None, 'year': 2019}, 'end': {'month': None, 'day': None, 'year': None}}, 'authority': 'Udemy', 'url': 'https://ude.my/UC-UFW2UA0N', 'license_number': 'UC-UFW2UA0N', 'display_source': 'ude.my', 'company': {'id': None, 'name': 'Udemy', 'logo': 'https://media.licdn.com/dms/image/C4D0BAQFQr9e68bBOPQ/company-logo_400_400/0/1626275253364?e=1700697600&v=beta&t=NbESr4MHBCDFYGXOE7Q6_FRU7VTOES62r3OtQt9nvCo', 'url': None}}, {'name': 'Apache Spark 2 with Scala - Hands On with Big Data', 'date': {'start': {'month': 11, 'day': None, 'year': 2019}, 'end': {'month': None, 'day': None, 'year': None}}, 'authority': 'Udemy', 'url': 'http://ude.my/UC-IXRSSBFD', 'license_number': 'UC-IXRSSBFD', 'display_source': 'ude.my', 'company': {'id': None, 'name': 'Udemy', 'logo': 'https://media.licdn.com/dms/image/C4D0BAQFQr9e68bBOPQ/company-logo_400_400/0/1626275253364?e=1700697600&v=beta&t=NbESr4MHBCDFYGXOE7Q6_FRU7VTOES62r3OtQt9nvCo', 'url': None}}, {'name': 'ISO/IEC 27001:2013 Information Security', 'date': {'start': {'month': 6, 'day': None, 'year': 2016}, 'end': {'month': None, 'day': None, 'year': None}}, 'authority': 'BAS University www.bas.kz', 'url': None, 'license_number': None, 'display_source': None, 'company': None}]",[],[],[],[],[],"[{'company': {'id': 2593860, 'name': 'Corsearch', 'logo': 'https://media.licdn.com/dms/image/D4E0BAQEKMrzDBYF8Yw/company-logo_400_400/0/1687982050623?e=1700697600&v=beta&t=nvN3VkDTq6F-LhvhQn2_6Cd1dY7N-xQf4DjEhML49z8', 'url': 'https://www.linkedin.com/company/corsearchinc/', 'employees': {'start': 1001, 'end': 5000}}, 'date': {'start': {'month': 1, 'day': None, 'year': 2020}, 'end': {'month': None, 'day': None, 'year': None}}, 'profile_positions': [{'location': 'Amsterdam Area', 'date': {'start': {'month': 6, 'day': None, 'year': 2022}, 'end': {'month': None, 'day': None, 'year': None}}, 'company': 'Corsearch', 'description': ""As a Tech Lead of a team that specializes in Imaging technology I am responsible for guiding my team to deliver high-quality software products that utilize advanced various aspects of image processing\n\n- Led a team of developers to develop and deploy advanced algorithms for similarity search and logo detection, resulting in improved accuracy and efficiency.\n- Integrated into the pipeline innovative solutions for watermark detection, reducing the risk of copyright infringement and ensuring compliance with legal requirements.\n- Successfully managed the services with daily processing of 80 million images, leveraging technical expertise to optimize system performance and deliver accurate results\n- Collaborated closely with stakeholders to understand their requirements and provide technical solutions that met their needs.\n- Conducted regular performance reviews and provided mentorship to team members, resulting in improved productivity and job satisfaction.\n- Contributed to the development of the company's technical roadmap, providing input on imaging technology and risk rule analysis"", 'title': 'Engineering Team Lead', 'employment_type': 'Full-time'}, {'location': 'Amsterdam Area, Netherlands', 'date': {'start': {'month': 1, 'day': None, 'year': 2020}, 'end': {'month': 6, 'day': None, 'year': 2022}}, 'company': 'Corsearch', 'description': '- As a member of the ETL team developed and deployed a workflow mechanism to collect, clean up and enrich data \n- Engineered services processing 10M+ messages containing image data to update store and search objects\n- Continuous refactoring of past and current microservices to adapt the TDD approach\n- Took part in interviewing and onboarding new members of the team', 'title': 'Software Engineer', 'employment_type': 'Full-time'}]}, {'company': {'id': 3252922, 'name': 'Pointer Brand Protection & Research', 'logo': 'https://media.licdn.com/dms/image/C4E0BAQFgursn7LP3oA/company-logo_400_400/0/1580744874811?e=1700697600&v=beta&t=RVa1imQ6bon1Yq5JCf0Ez5AsHqm1QBEM-5vBtyPB14I', 'url': 'https://www.linkedin.com/company/pointer-brand-protection-&-research/', 'employees': {'start': 51, 'end': 200}}, 'date': {'start': {'month': 9, 'day': None, 'year': 2018}, 'end': {'month': 1, 'day': None, 'year': 2020}}, 'profile_positions': [{'location': 'Amsterdam Area, Netherlands', 'date': {'start': {'month': 9, 'day': None, 'year': 2018}, 'end': {'month': 1, 'day': None, 'year': 2020}}, 'company': 'Pointer Brand Protection & Research', 'description': '- Worked on the main company high-load product that focused on brand protection by maintaining and developing new features in both front-end and back-end (php7, Symfony, MySQL, angular, react, elasticsearch, docker)\n- Developed a new micro-service to predict counterfeit products by analyzing listings descriptions using machine learning (python, MongoDB, rabbitmq)\n- Worked on a project to do a fast text search on large amounts (millions a day) of listing title/descriptions in order to do an auto-tagging of the adverts (python, grpc)\n- Contributed to the features that work with listing images including image categorization (python, TensorFlow) and reverse image search using perceptual hash (node.js, rabbitmq)\n- Worked on a project to do seller clustering using GraphDB\n- Used Camunda BPM to build a workflow and decision automation system\n- Worked on the ETL process using AirFlow and Spark on AWS (S3, DMS)\n- Improved the deployment process that was built using Capistrano and docker\n- Won as a team during company organized hackathon with a project to help to get to know colleagues (php, laravel, vuejs)', 'title': 'Software Engineer', 'employment_type': None}]}, {'company': {'id': None, 'name': 'Smart Solutions', 'logo': None, 'url': None, 'employees': {'start': None, 'end': None}}, 'date': {'start': {'month': 9, 'day': None, 'year': 2016}, 'end': {'month': 9, 'day': None, 'year': 2018}}, 'profile_positions': [{'location': 'Moscow, Russian Federation', 'date': {'start': {'month': 9, 'day': None, 'year': 2016}, 'end': {'month': 9, 'day': None, 'year': 2018}}, 'company': 'Smart Solutions', 'description': 'Developed scalable data collection system through APIs and parsers\nRefactored and extended the Laravel-based analytics platform layer to support additional traffic selling sites\nDesigned and implemented REST APIs for ReactJS based front-end client.\nTook part in developing the back-end platform for a self-service advertising system\nDeveloped reports system that gathers all the data from different sources, aggregates and shows as charts and tables in Google Spreadsheets \nTechnologies: PHP 5/7, Laravel 4/5, JavaScript, React, Docker, GCloud, MySQL, Redis, Beanstalkd,  HTML\nR&D in computer vision and image classification/categorization system\nWorked on a project of HFT in cryptocurrency exchanges (Using python/php, rabbitmq, Docker, PostgreSQL)', 'title': 'Full Stack Developer', 'employment_type': None}]}, {'company': {'id': None, 'name': 'Infocom', 'logo': None, 'url': None, 'employees': {'start': None, 'end': None}}, 'date': {'start': {'month': 12, 'day': None, 'year': 2013}, 'end': {'month': 8, 'day': None, 'year': 2016}}, 'profile_positions': [{'location': 'Kyrgyzstan', 'date': {'start': {'month': 12, 'day': None, 'year': 2013}, 'end': {'month': 8, 'day': None, 'year': 2016}}, 'company': 'Infocom', 'description': 'Developed a PHP YII based web apps for in-office uses\nDesigned and implemented secure REST APIs for mobile clients.\nAnalyzed and re-wrote inefficient SQL queries.\n\nTechnologies: PHP, Yii, Python MySQL, PostgreSQL', 'title': 'Software Engineer', 'employment_type': None}]}, {'company': {'id': None, 'name': 'CryptoCentre', 'logo': None, 'url': None, 'employees': {'start': None, 'end': None}}, 'date': {'start': {'month': 12, 'day': None, 'year': 2012}, 'end': {'month': 12, 'day': None, 'year': 2013}}, 'profile_positions': [{'location': 'Kyrgyzstan', 'date': {'start': {'month': 12, 'day': None, 'year': 2012}, 'end': {'month': 12, 'day': None, 'year': 2013}}, 'company': 'CryptoCentre', 'description': 'Took part in development of cryptography software compatible with RFC and Russian GOST\nDeveloped the micro-services for above mentioned system\n\nTechnologies: PHP (Yii), C++', 'title': 'Software developer', 'employment_type': None}]}, {'company': {'id': None, 'name': 'Инфоком', 'logo': None, 'url': None, 'employees': {'start': None, 'end': None}}, 'date': {'start': {'month': 1, 'day': None, 'year': 2012}, 'end': {'month': 12, 'day': None, 'year': 2012}}, 'profile_positions': [{'location': None, 'date': {'start': {'month': 1, 'day': None, 'year': 2012}, 'end': {'month': 12, 'day': None, 'year': 2012}}, 'company': 'Инфоком', 'description': 'Developing and deploying software solutions to automate processes at state registration service', 'title': 'Software developer', 'employment_type': None}]}]","[{'date': {'start': {'month': 6, 'day': None, 'year': 2012}, 'end': {'month': 8, 'day': None, 'year': 2012}}, 'role': 'English language volunteer', 'company': {'id': None, 'name': 'Camp Almaty 2012', 'logo': None, 'url': None}, 'cause': 'CHILDREN', 'description': None}]","['Cloud Computing', 'Elastic Stack (ELK)', 'RabbitMQ', 'Apache Avro', 'Go (Programming Language)', 'Apache Kafka', 'TensorFlow', 'Elasticsearch', 'Django', 'Node.js', 'React.js', 'Docker', 'PHP', 'Laravel', 'Machine Learning', 'Computer Vision', 'MySQL', 'PostgreSQL', 'Web Development', 'Information Security']",,,
