profile_id,first_name,last_name,sub_title,profile_picture,background_image,profile_type,entity_urn,object_urn,birth_date,summary,location,premium,influencer,treasury_media,languages,industry,education,patents,awards,certifications,organizations,projects,publications,courses,test_scores,position_groups,volunteer_experiences,skills,network_info,related_profiles,contact_info
zanjun-chen-54ba8058,Zanjun,Chen,Team Leader at Equiinet China,https://media.licdn.com/dms/image/C5103AQH5e42PkFA6oQ/profile-displayphoto-shrink_800_800/0/1517073981467?e=1697673600&v=beta&t=cVQzSqTdtrpxChhpENX7Ftu6bpm_WLICp5pY36Zkgzg,,personal,ACoAAAxCwwsBkCHhpaghcMWDkq1DSx4lYvUf-AQ,205701899,,"I have a true passion about innovative product and service, and love to work for it. I am a fast learner and can adapt myself to the change quickly. 

I believe that ""It is not the strongest of the species that survives, nor the most intelligent that survives. It is the one that is the most adaptable to change.""(Charles Darwin)

With Chinese culture background, i can use the cultural difference to find and improve something different from western culture.

Being a volunteer of 2008 Beijing Olympic Games and chairman of Volunteer Federation in my university give me the chance to improve my capability of working as a team member and leader.

Studying Strategic Innovation Management in University of Groningen from Sept. 2012 to Aug. 2013

chen19891010@live.cn
+31 (0) 6 34388609","{'country': 'Netherlands', 'short': 'Greater Groningen Area', 'city': None, 'state': None, 'default': 'Greater Groningen Area'}",False,False,[],"{'primary_locale': {'country': 'US', 'language': 'en'}, 'supported_locales': [{'country': 'US', 'language': 'en'}], 'profile_languages': [{'name': 'Chinese', 'proficiency': None}, {'name': 'English', 'proficiency': None}]}",Management Consulting,"[{'date': {'start': {'month': None, 'day': None, 'year': 2012}, 'end': {'month': None, 'day': None, 'year': 2013}}, 'school': {'name': 'University of Groningen', 'logo': 'https://media.licdn.com/dms/image/C560BAQHjFD1KsBlUnQ/company-logo_400_400/0/1519868080428?e=1700697600&v=beta&t=d2tRvbRlXMKelxD8kEz9CA-lmIOif13yVqBXFWP5Jc4', 'url': 'https://www.linkedin.com/school/rijksuniversiteit-groningen/'}, 'degree_name': 'Master of Science (MSc)', 'field_of_study': 'strategic innovation management'}, {'date': {'start': {'month': None, 'day': None, 'year': 2007}, 'end': {'month': None, 'day': None, 'year': 2010}}, 'school': {'name': 'Beijing information sciece&technology university', 'logo': None, 'url': None}, 'degree_name': 'Bachelor of Business Administration (BBA)', 'field_of_study': 'Business Administration and Management, General'}]",[],"[{'title': 'Microsoft 365 Certified：Teams Administrator Associate', 'description': None, 'issuer': 'Microsoft', 'date': {'month': 2, 'day': None, 'year': 2021}}]",[],[],[],[],"[{'name': 'Capturing Value from Innovation', 'number': None}, {'name': 'Cooperating for Innovation', 'number': None}, {'name': 'Developing for market', 'number': None}, {'name': 'Developing from Technology', 'number': None}, {'name': 'Innovation in Services', 'number': None}, {'name': 'Orgnization for innovation', 'number': None}, {'name': 'Policies for a Dynamic Economy', 'number': None}, {'name': 'Strategic innovation management', 'number': None}]",[],"[{'company': {'id': 6398195, 'name': 'Equiinet China', 'logo': 'https://media.licdn.com/dms/image/C4E0BAQGg_ZYO8HIYAw/company-logo_400_400/0/1519910799696?e=1700697600&v=beta&t=zeGGNob2BsHDjmtv02Nf7qgAjXsP0G4QB2p3hF2VJB0', 'url': 'https://www.linkedin.com/company/equiinet-china/', 'employees': {'start': 11, 'end': 50}}, 'date': {'start': {'month': 11, 'day': None, 'year': 2014}, 'end': {'month': None, 'day': None, 'year': None}}, 'profile_positions': [{'location': 'Beijing City, China', 'date': {'start': {'month': 11, 'day': None, 'year': 2014}, 'end': {'month': None, 'day': None, 'year': None}}, 'company': 'Equiinet China', 'description': None, 'title': 'Team Leader', 'employment_type': None}]}, {'company': {'id': None, 'name': 'Beijing Linking-Bridge Consulting  Co. , Ltd', 'logo': None, 'url': None, 'employees': {'start': None, 'end': None}}, 'date': {'start': {'month': 4, 'day': None, 'year': 2014}, 'end': {'month': None, 'day': None, 'year': None}}, 'profile_positions': [{'location': 'Beijing City, China', 'date': {'start': {'month': 4, 'day': None, 'year': 2014}, 'end': {'month': None, 'day': None, 'year': None}}, 'company': 'Beijing Linking-Bridge Consulting  Co. , Ltd', 'description': 'Mainly responsible for business negotiation and enterprise business consulting project to China through diagnostic analyzing customer needs and problems and provide comprehensive consulting services and solutions.\n\nhttp://www.lkbc.com.cn/', 'title': 'International Project Director', 'employment_type': None}]}, {'company': {'id': None, 'name': 'China Oxbridge Academy', 'logo': None, 'url': None, 'employees': {'start': None, 'end': None}}, 'date': {'start': {'month': 12, 'day': None, 'year': 2011}, 'end': {'month': 6, 'day': None, 'year': 2012}}, 'profile_positions': [{'location': None, 'date': {'start': {'month': 12, 'day': None, 'year': 2011}, 'end': {'month': 6, 'day': None, 'year': 2012}}, 'company': 'China Oxbridge Academy', 'description': 'Teach Chinese student about the skill of Ielts exam in oral part and some skills about Toefl oral part', 'title': 'Ielts oral teacher', 'employment_type': None}]}, {'company': {'id': None, 'name': 'Beijing Zhi Zhen XinTong technology co., LTD', 'logo': None, 'url': None, 'employees': {'start': None, 'end': None}}, 'date': {'start': {'month': 10, 'day': None, 'year': 2009}, 'end': {'month': 2, 'day': None, 'year': 2010}}, 'profile_positions': [{'location': None, 'date': {'start': {'month': 10, 'day': None, 'year': 2009}, 'end': {'month': 2, 'day': None, 'year': 2010}}, 'company': 'Beijing Zhi Zhen XinTong technology co., LTD', 'description': 'Support the sales team and orgnize the data they got', 'title': 'Internship at Marketing department', 'employment_type': None}]}]",[],"['Teamwork', 'Patience', 'Fast Learner', 'Microsoft Office', 'Microsoft Excel', 'PowerPoint', 'Leadership', 'Time Management', 'Microsoft Word', 'Public Speaking', 'Team Leadership', 'Social Media', 'Strategic Planning', 'Marketing', 'Event Planning']",,,
