profile_id,first_name,last_name,sub_title,profile_picture,background_image,profile_type,entity_urn,object_urn,birth_date,summary,location,premium,influencer,treasury_media,languages,industry,education,patents,awards,certifications,organizations,projects,publications,courses,test_scores,position_groups,volunteer_experiences,skills,network_info,related_profiles,contact_info
bianca-carague,Bianca,Carague, Designer,https://media.licdn.com/dms/image/C4D03AQELG3fIpgYB3g/profile-displayphoto-shrink_800_800/0/1600279962011?e=1697673600&v=beta&t=U9d-ccIlIzSxiaKPI9whCgKcAsY0aMbOAo4yLnZAiEE,https://media.licdn.com/dms/image/C4E16AQH9dgGfKafAxg/profile-displaybackgroundimage-shrink_350_1400/0/1661066576923?e=1697673600&v=beta&t=jmeCx75UXWQIQzpdfIXVMl71PJK1ORUAfXS6e_jAYHU,personal,ACoAAAh9Vc0BNb48ihgz4DKHJydVXf5xLwFXQu8,142431693,,"Bianca Carague is a Netherlands-based Filipino artist and designer. She creates captivating virtual landscapes and environments that allude to alternate worlds and possible futures. She uniquely blends design research with fiction and worldbuilding to create thought-provoking narratives that explore social issues and emerging technologies.

Her unique perspective on worldbuilding and pioneering work in game world therapy have gained her recognition across prestigious platforms around the world such as Vogue, Elle Decor, and FRAME Magazine.

Bianca's recent solo exhibition, 'Gen C: Children of 2050,' demonstrated her ability to spark critical and creative thinking about the future through immersive installations and accompanying workshops, which allowed thousands of participants to build off of her work about the climate crisis. Her game-changing project, Bump Galaxy, where she created a Minecraft server for mental healthcare, showcased her ingenuity, as she provided virtual landscapes and gaming experiences for care during the challenging times of the COVID-19 pandemic. During that time, she grew it to 3,000,000+ sqm of digital biomes for various forms of therapy and proved that playing together could mean caring for each other.

She has exhibited in Dutch Design Week, London Design Biennale, Triennale di Milano, Het Nieuwe Instituut and Tetem. She has even collaborated with Vogue Philippines on a 16-page spread and cover story on Philippine identity in the metaverse.

Through her workshops across Europe and Asia, she also shares her expertise with young people to learn about Futures Literacy through art. Collaborating with esteemed institutions such as Tetem, Iceland University of the Arts, Hogeschool voor de Kunsten Utrecht (HKU) and University of San Marino, Bianca has made a significant impact in fostering creativity and futures thinking.

Bianca Carague's body of work serves as a testament to her dedication to provoke thought about the world we live in and the world we aspire to create.

https://bianca-carague.com/","{'country': 'Netherlands', 'short': 'Rotterdam, South Holland', 'city': 'Rotterdam', 'state': 'South Holland', 'default': 'Rotterdam, South Holland, Netherlands'}",False,False,[],"{'primary_locale': {'country': 'US', 'language': 'en'}, 'supported_locales': [{'country': 'US', 'language': 'en'}], 'profile_languages': [{'name': 'Dutch', 'proficiency': 'LIMITED_WORKING'}, {'name': 'English', 'proficiency': 'NATIVE_OR_BILINGUAL'}, {'name': 'Filipino', 'proficiency': 'NATIVE_OR_BILINGUAL'}, {'name': 'Spanish', 'proficiency': 'ELEMENTARY'}]}",Design,"[{'date': {'start': {'month': None, 'day': None, 'year': 2018}, 'end': {'month': None, 'day': None, 'year': 2020}}, 'school': {'name': 'Design Academy Eindhoven', 'logo': 'https://media.licdn.com/dms/image/C560BAQGmlXZzkFLyvQ/company-logo_400_400/0/1602170102013?e=1700697600&v=beta&t=qeMLWMiVBIA3AbkOKnmEGrRECyRvmxqFjC3cXzs9p9g', 'url': 'https://www.linkedin.com/school/design-academy-eindhoven/'}, 'degree_name': 'Master of Fine Arts - MFA', 'field_of_study': 'Social Design'}, {'date': {'start': {'month': None, 'day': None, 'year': 2012}, 'end': {'month': None, 'day': None, 'year': 2016}}, 'school': {'name': 'De La Salle-College of Saint Benilde', 'logo': 'https://media.licdn.com/dms/image/C4E0BAQEAxTQooR-24g/company-logo_400_400/0/1519871707597?e=1700697600&v=beta&t=2wCObNlofkMX6EWKnIPDBy89pnvzRsTRt6w2TuyvrRI', 'url': 'https://www.linkedin.com/school/dlscsb/'}, 'degree_name': 'Bachelor of Science - BS', 'field_of_study': 'Industrial Design'}, {'date': {'start': {'month': None, 'day': None, 'year': 2015}, 'end': {'month': None, 'day': None, 'year': 2015}}, 'school': {'name': 'Copenhagen Institute of Interaction Design', 'logo': None, 'url': None}, 'degree_name': 'Summer School', 'field_of_study': 'Interaction Design'}, {'date': {'start': {'month': None, 'day': None, 'year': 2016}, 'end': {'month': None, 'day': None, 'year': 2016}}, 'school': {'name': 'International Institute of Digital Marketing', 'logo': None, 'url': None}, 'degree_name': 'Certified Digital Marketer Acceleration Program', 'field_of_study': None}]",[],"[{'title': 'First Prize - Cisco Meet & Work in VR Competition', 'description': 'Designed a virtual reality experience for multi-dimensional communication among stakeholders in construction projects for a competition by Domus Academy Milan in partnership with Cisco.', 'issuer': 'Domus Academy', 'date': {'month': 5, 'day': None, 'year': 2018}}, {'title': 'Magna Cum Laude', 'description': 'Graduated with the highest cumulative GPA in the entire graduating batch of 900 students.', 'issuer': 'De La Salle-College of Saint Benilde', 'date': {'month': 3, 'day': None, 'year': 2017}}, {'title': 'Semi-Finalist - Benilde Prize: Innovation for Inclusion', 'description': 'Semi-finalist for a national university-based social design and innovation competition for designing an inclusive business model that aimed to help sugarcane farmers and significantly reduce waste through the production of bioplastic products.', 'issuer': 'HIFI (Hub of Innovation for Inclusion)', 'date': {'month': 3, 'day': None, 'year': 2015}}, {'title': ""Dean's Honor List, Top 10 (#1)"", 'description': 'Received a plaque of recognition for being the top student out of 14,000 in the college with a GPA of 3.91 for SY 2013-2014.', 'issuer': 'De La Salle - College of Saint Benilde', 'date': {'month': 12, 'day': None, 'year': 2014}}, {'title': 'School of Design & Arts Grant', 'description': 'Full scholarship from freshman to senior year.', 'issuer': 'De La Salle - College of Saint Benilde', 'date': {'month': None, 'day': None, 'year': None}}]","[{'name': 'Usui Reiki Master', 'date': {'start': {'month': 3, 'day': None, 'year': 2020}, 'end': {'month': None, 'day': None, 'year': None}}, 'authority': 'Natural Healer Society', 'url': None, 'license_number': None, 'display_source': None, 'company': None}, {'name': 'Writing a Compelling Blog Post', 'date': {'start': {'month': 8, 'day': None, 'year': 2019}, 'end': {'month': None, 'day': None, 'year': None}}, 'authority': 'LinkedIn', 'url': 'https://www.linkedin.com/learning/certificates/356649e5e43f8ff96b9cac504cf7e837b0643acde6a46d0e5d36e1e0e2c8892d?trk=backfilled_certificate', 'license_number': None, 'display_source': 'linkedin.com', 'company': {'id': None, 'name': 'LinkedIn', 'logo': 'https://media.licdn.com/dms/image/C560BAQHaVYd13rRz3A/company-logo_400_400/0/1638831589865?e=1700697600&v=beta&t=e1FsZytsym0fLF5Jt7PFnH40bqJRRzdgJ5LH7Y3pJJM', 'url': None}}, {'name': 'The Brain and Space', 'date': {'start': {'month': 2, 'day': None, 'year': 2018}, 'end': {'month': None, 'day': None, 'year': None}}, 'authority': 'Coursera', 'url': None, 'license_number': None, 'display_source': None, 'company': {'id': None, 'name': 'Coursera', 'logo': 'https://media.licdn.com/dms/image/C4D0BAQGexnfBxeEG-g/company-logo_400_400/0/1608039227697?e=1700697600&v=beta&t=oKIt6loOByFMfTbXJsSV0MxzKtgkMvIZ2QTzkZrNq70', 'url': None}}, {'name': 'Visual Perception and the Brain', 'date': {'start': {'month': 1, 'day': None, 'year': 2018}, 'end': {'month': None, 'day': None, 'year': None}}, 'authority': 'Coursera', 'url': 'https://www.coursera.org/account/accomplishments/verify/S7S5C6K7WFKH', 'license_number': 'S7S5C6K7WFKH', 'display_source': 'coursera.org', 'company': {'id': None, 'name': 'Coursera', 'logo': 'https://media.licdn.com/dms/image/C4D0BAQGexnfBxeEG-g/company-logo_400_400/0/1608039227697?e=1700697600&v=beta&t=oKIt6loOByFMfTbXJsSV0MxzKtgkMvIZ2QTzkZrNq70', 'url': None}}, {'name': 'Data Storytelling for Business', 'date': {'start': {'month': 2, 'day': None, 'year': 2017}, 'end': {'month': None, 'day': None, 'year': None}}, 'authority': 'StoryIQ (formerly DataSeer)', 'url': None, 'license_number': None, 'display_source': None, 'company': {'id': None, 'name': 'StoryIQ', 'logo': 'https://media.licdn.com/dms/image/C560BAQFqb5OE8U8qiA/company-logo_400_400/0/1625203441549?e=1700697600&v=beta&t=5WbLfxy5f7noL9hA5ZRV7hmiJDENvygLMQIq-cicCA8', 'url': None}}, {'name': 'Certified Digital Marketer Acceleration Program', 'date': {'start': {'month': 2, 'day': None, 'year': 2016}, 'end': {'month': 3, 'day': None, 'year': 2016}}, 'authority': 'International Institute Of Digital Marketing', 'url': None, 'license_number': None, 'display_source': None, 'company': {'id': None, 'name': 'International Institute Of Digital Marketing', 'logo': None, 'url': None}}, {'name': 'PADI Open Water Diver', 'date': {'start': {'month': 6, 'day': None, 'year': 2015}, 'end': {'month': None, 'day': None, 'year': None}}, 'authority': 'PADI', 'url': None, 'license_number': None, 'display_source': None, 'company': {'id': None, 'name': 'PADI', 'logo': 'https://media.licdn.com/dms/image/C4D0BAQGt15EDpU4Jhg/company-logo_400_400/0/1538160453888?e=1700697600&v=beta&t=y_MgSCsAjOv_swPndcn3hA6cgvXCMbqELUmJHHU7Czs', 'url': None}}, {'name': 'Design Thinking', 'date': {'start': {'month': None, 'day': None, 'year': None}, 'end': {'month': None, 'day': None, 'year': None}}, 'authority': 'Tandemic', 'url': None, 'license_number': None, 'display_source': None, 'company': {'id': None, 'name': 'Tandemic', 'logo': 'https://media.licdn.com/dms/image/C560BAQGKH-LLIn4Gvg/company-logo_400_400/0/1519878650749?e=1700697600&v=beta&t=RU7oSin8GhYeMFtDAAgwNzJUeo6AgiL9N3JwJI10Nb8', 'url': None}}, {'name': 'User Experience & Rapid Prototyping', 'date': {'start': {'month': None, 'day': None, 'year': None}, 'end': {'month': None, 'day': None, 'year': None}}, 'authority': 'Axure - UX & RP', 'url': None, 'license_number': None, 'display_source': None, 'company': {'id': None, 'name': 'Axure - UX & RP', 'logo': 'https://media.licdn.com/dms/image/C4D0BAQEPvEGgDVfggg/company-logo_400_400/0/1519907260222?e=1700697600&v=beta&t=OZghwfhQwYb6yq6vqb8BaBq1rKqQFYyG_BiXrR3hN7s', 'url': None}}]",[],"[{'title': 'Virtual Design Week: Reflections on A New Digital Earth', 'date': {'start': {'month': 6, 'day': None, 'year': 2020}, 'end': {'month': None, 'day': None, 'year': None}}, 'description': 'Virtual Design Week: Reflections on a New Digital Earth is the first online design festival solely focusing on designs made in the digital space for the digital space. Through an online exhibition and discussions, designers are invited to reflect on virtual design through the lenses of sustainability, equality and community.', 'contributors': [{'type': 'standardizedContributor', 'first_name': 'Bianca', 'last_name': 'Carague', 'name': None, 'headline': ' Designer'}]}, {'title': 'Bump Galaxy', 'date': {'start': {'month': 1, 'day': None, 'year': 2020}, 'end': {'month': None, 'day': None, 'year': None}}, 'description': 'Bump Galaxy is a virtual world and community for mental health. It deinstitutionalizes healthcare by bringing people together across national borders, care practices and knowledge worlds, blurring the lines between a consumer and producer of knowledge; a giver and receiver of care.', 'contributors': [{'type': 'standardizedContributor', 'first_name': 'Bianca', 'last_name': 'Carague', 'name': None, 'headline': ' Designer'}]}, {'title': 'You Will Not Be', 'date': {'start': {'month': 1, 'day': None, 'year': 2019}, 'end': {'month': None, 'day': None, 'year': None}}, 'description': 'Exhibited in Triennale di Milano (Milan, Italy) & Het Nieuwe Instituut (Rotterdam, Netherlands). You Will Not Be is an exhibition and performance that dares to question the true meaning of efficiency (and 24/7 economy) in the world today.', 'contributors': [{'type': 'standardizedContributor', 'first_name': 'Bianca', 'last_name': 'Carague', 'name': None, 'headline': ' Designer'}]}, {'title': 'BentaMobile', 'date': {'start': {'month': 9, 'day': None, 'year': 2015}, 'end': {'month': None, 'day': None, 'year': None}}, 'description': 'BentaMobile was a social design endeavor which aimed to respond to the pains and aspirations of informal street vendors by helping them become recognized members of the community, formalizing their businesses by conducting field research and routine immersions within local communities in the city of Manila and involving community stakeholders in the design of innovative solutions to social problems.', 'contributors': [{'type': 'standardizedContributor', 'first_name': 'Bianca', 'last_name': 'Carague', 'name': None, 'headline': ' Designer'}, {'type': 'standardizedContributor', 'first_name': 'Nielsen Cedrick', 'last_name': 'Donato', 'name': None, 'headline': 'Veterinary Medicine Student'}]}, {'title': 'Oasis', 'date': {'start': {'month': 3, 'day': None, 'year': 2019}, 'end': {'month': 6, 'day': None, 'year': 2019}}, 'description': 'Major cities across the world are in danger of losing water in the next few decades, unless their water use radically changes. Oasis rekindles our relationship with our most valuable resource by making us imagine a world without it.', 'contributors': [{'type': 'standardizedContributor', 'first_name': 'Bianca', 'last_name': 'Carague', 'name': None, 'headline': ' Designer'}]}, {'title': 'Voluminous Territories', 'date': {'start': {'month': 3, 'day': None, 'year': 2019}, 'end': {'month': 6, 'day': None, 'year': 2019}}, 'description': 'Soon to be exhibited in “Designers at the Borders” augmented reality exhibition. Using Cyprus’ political and economic climate as a case study, Voluminous Territories demonstrates  through data visualisation in the form of physical models and an archive how private companies are reshaping our world and transforming our notions of territory.', 'contributors': [{'type': 'standardizedContributor', 'first_name': 'Bianca', 'last_name': 'Carague', 'name': None, 'headline': ' Designer'}]}, {'title': 'Manolo Living x Aeta Collaboration', 'date': {'start': {'month': 8, 'day': None, 'year': 2017}, 'end': {'month': 12, 'day': None, 'year': 2017}}, 'description': 'Livelihood project wherein we collaborated with an indigenous Aeta community in the Philippines to design and produce woven home accessories.', 'contributors': [{'type': 'standardizedContributor', 'first_name': 'Bianca', 'last_name': 'Carague', 'name': None, 'headline': ' Designer'}]}]","[{'name': 'How A Team of Creatives Brought The Terno Into The Metaverse', 'publisher': 'Vogue Philippines', 'url': 'https://vogue.ph/fashion/how-a-team-of-creatives-came-together-to-bring-the-terno-into-the-metaverse/', 'date': {'month': None, 'day': None, 'year': 2022}, 'authors': [{'type': 'standardizedContributor', 'first_name': 'Bianca', 'last_name': 'Carague', 'name': None, 'headline': ' Designer'}]}, {'name': 'Pixel Perfect', 'publisher': 'Elle Decor', 'url': None, 'date': {'month': None, 'day': None, 'year': 2022}, 'authors': [{'type': 'standardizedContributor', 'first_name': 'Bianca', 'last_name': 'Carague', 'name': None, 'headline': ' Designer'}]}, {'name': 'Bianca Carague Designs Virtual Realms for Your Mental Wellbeing', 'publisher': 'Vogue Philippines', 'url': 'https://vogue.ph/lifestyle/people/bianca-carague-social-designer-bump-galaxy/', 'date': {'month': None, 'day': None, 'year': 2022}, 'authors': [{'type': 'standardizedContributor', 'first_name': 'Bianca', 'last_name': 'Carague', 'name': None, 'headline': ' Designer'}]}, {'name': 'Mental Wellness: Can Digital Arenas Help Us De-stress', 'publisher': 'FRAME Magazine', 'url': 'https://frameweb.com/article/mental-wellness-can-digital-arenas-help-us-de-stress', 'date': {'month': None, 'day': None, 'year': 2022}, 'authors': [{'type': 'standardizedContributor', 'first_name': 'Bianca', 'last_name': 'Carague', 'name': None, 'headline': ' Designer'}]}, {'name': 'Worldbuilding and Designing for the Pluriverse', 'publisher': 'Bluprint ', 'url': 'https://bluprint.onemega.com/aciiid-trend-report-worldbuilding-and-designing-for-the-pluriverse-with-bianca-carague/', 'date': {'month': None, 'day': None, 'year': 2022}, 'authors': [{'type': 'standardizedContributor', 'first_name': 'Bianca', 'last_name': 'Carague', 'name': None, 'headline': ' Designer'}]}, {'name': 'Vogue’s Talent to Watch', 'publisher': 'Vogue Netherlands', 'url': 'https://www.vogue.nl/cultuur/voices/talent-to-watch-bianca-carague-mentale-gezondheidszorg-metaverse/', 'date': {'month': None, 'day': None, 'year': 2022}, 'authors': [{'type': 'standardizedContributor', 'first_name': 'Bianca', 'last_name': 'Carague', 'name': None, 'headline': ' Designer'}]}, {'name': 'International Pavilion — The New Intimacy in Dutch Design Week', 'publisher': 'Barcelona Design Week', 'url': 'https://barcelonadesignweek.com/en/activities/international-pavilion-the-new-intimacy-in-dutch-design-week/', 'date': {'month': None, 'day': None, 'year': 2020}, 'authors': [{'type': 'standardizedContributor', 'first_name': 'Bianca', 'last_name': 'Carague', 'name': None, 'headline': ' Designer'}]}, {'name': 'A Virtual World of Interactive Therapy', 'publisher': 'LS:N Global', 'url': 'https://www.lsnglobal.com/news/article/26184/a-virtual-world-of-interactive-therapy', 'date': {'month': None, 'day': None, 'year': 2020}, 'authors': [{'type': 'standardizedContributor', 'first_name': 'Bianca', 'last_name': 'Carague', 'name': None, 'headline': ' Designer'}]}, {'name': 'Building Video Games for a Better World', 'publisher': 'Future of Video Gaming', 'url': 'https://www.futureofvideogaming.com/', 'date': {'month': None, 'day': None, 'year': 2020}, 'authors': [{'type': 'standardizedContributor', 'first_name': 'Bianca', 'last_name': 'Carague', 'name': None, 'headline': ' Designer'}]}, {'name': 'New Agency for New Intimacy', 'publisher': 'Dutch Design Week Magazine', 'url': 'https://ddw.nl/magazine-archive/588/new-agency-for-new-intimacy', 'date': {'month': None, 'day': None, 'year': 2020}, 'authors': [{'type': 'standardizedContributor', 'first_name': 'Bianca', 'last_name': 'Carague', 'name': None, 'headline': ' Designer'}]}, {'name': 'The Virtual Community for Mental Health and Care in A Game Form', 'publisher': 'Design Indaba', 'url': 'https://www.designindaba.com/articles/creative-work/virtual-community-mental-health-and-care-game-form', 'date': {'month': None, 'day': None, 'year': 2020}, 'authors': [{'type': 'standardizedContributor', 'first_name': 'Bianca', 'last_name': 'Carague', 'name': None, 'headline': ' Designer'}]}, {'name': 'Learning from COVID19: Reflections on knowledge-related commons and practices of self-organization amidst COVID19', 'publisher': 'School of Commons', 'url': 'https://medium.com/learning-from-covid19/bump-galaxy-a245d3765be8', 'date': {'month': None, 'day': None, 'year': 2020}, 'authors': [{'type': 'standardizedContributor', 'first_name': 'Bianca', 'last_name': 'Carague', 'name': None, 'headline': ' Designer'}]}, {'name': 'Innovation for Inclusion: Sugarcane Dental Kit', 'publisher': 'Adobo Magazine Issue 59', 'url': None, 'date': {'month': None, 'day': None, 'year': 2015}, 'authors': [{'type': 'standardizedContributor', 'first_name': 'Bianca', 'last_name': 'Carague', 'name': None, 'headline': ' Designer'}, {'type': 'nonStandardizedContributor', 'first_name': None, 'last_name': None, 'name': 'Abigail Mapua-Cabanilla', 'headline': None}, {'type': 'standardizedContributor', 'first_name': 'LA', 'last_name': 'Aguilar', 'name': None, 'headline': 'Transformation Experience Design Specialist, Lead for Advisor and Employee Ecosystem at Sun Life'}]}]","[{'name': 'Anthropometrics & Ergonomics', 'number': None}, {'name': 'Artifacts of the Future', 'number': None}, {'name': 'Biodesign', 'number': None}, {'name': 'Biomimicry', 'number': None}, {'name': 'Data Storytelling for Business', 'number': None}, {'name': 'Design Thinking', 'number': None}, {'name': 'Digital Marketing', 'number': None}, {'name': 'Exhibition Design & Visual Merchandising', 'number': None}, {'name': 'Furniture Design', 'number': None}, {'name': 'Future Materials', 'number': None}, {'name': 'Future of Democracy', 'number': None}, {'name': 'Multiple Capitals for Tackling Complex Challenges', 'number': None}, {'name': 'The Brain & Space', 'number': None}, {'name': 'Toy Design', 'number': None}, {'name': 'Transportation Design', 'number': None}, {'name': 'User Interface, Experience & Rapid Prototyping', 'number': None}, {'name': 'Visual Perception & The Brain', 'number': None}]",[],"[{'company': {'id': None, 'name': 'Bianca Carague', 'logo': None, 'url': None, 'employees': {'start': None, 'end': None}}, 'date': {'start': {'month': 10, 'day': None, 'year': 2020}, 'end': {'month': None, 'day': None, 'year': None}}, 'profile_positions': [{'location': 'Rotterdam, South Holland, Netherlands', 'date': {'start': {'month': 10, 'day': None, 'year': 2020}, 'end': {'month': None, 'day': None, 'year': None}}, 'company': 'Bianca Carague', 'description': '•  Concept design to production of hybrid physical and digital exhibitions that reflect on social issues and emerging technologies.\n•  Design and facilitation of workshops about worldbuilding and futures literacy for young people across Europe and Asia.\n•  Design and facilitation of workshops for mental healthcare professionals who seek creative applications of their practice.\n•  Developed the concept of ‘game world therapy’. Worked directly with different mental healthcare professionals to produce online care programs that use gaming environments & mechanics to facilitate various forms of therapy.\n•  Design and production of virtual environments, games and social experiences for online platforms such as Minecraft, The Sandbox and Somnium Space.\n•  Collaborated with local government in The Philippines to design for inclusive FinTech adoption within informal economies and marginalized communities.', 'title': 'Artist', 'employment_type': 'Self-employed'}]}, {'company': {'id': 86755904, 'name': 'Bzaar Labs', 'logo': 'https://media.licdn.com/dms/image/C4E0BAQHA7BN9pvZfpg/company-logo_400_400/0/1658596336840?e=1700697600&v=beta&t=VY3f96TnuFjqFy5eKMcc9nRdy_6U1fwkaeHUxJsVpqk', 'url': 'https://www.linkedin.com/company/bzaarlabs/', 'employees': {'start': 11, 'end': 50}}, 'date': {'start': {'month': 4, 'day': None, 'year': 2022}, 'end': {'month': 12, 'day': None, 'year': 2022}}, 'profile_positions': [{'location': None, 'date': {'start': {'month': 4, 'day': None, 'year': 2022}, 'end': {'month': 12, 'day': None, 'year': 2022}}, 'company': 'Bzaar Labs', 'description': '• Creative direction for digital fashion collaborations.\n• Designed UX & UI for in-house 3D fashion design tool.', 'title': 'Creative Director', 'employment_type': None}]}, {'company': {'id': 65114073, 'name': 'ACIIID', 'logo': 'https://media.licdn.com/dms/image/C4E0BAQGchKQHb6XR_g/company-logo_400_400/0/1585299328052?e=1700697600&v=beta&t=egDyPlnaL8lG995ongAGWOe07E5FR_u3ncwmzt02sr0', 'url': 'https://www.linkedin.com/company/aciiid/', 'employees': {'start': 2, 'end': 10}}, 'date': {'start': {'month': 4, 'day': None, 'year': 2020}, 'end': {'month': 12, 'day': None, 'year': 2020}}, 'profile_positions': [{'location': 'Rotterdam, South Holland, Netherlands', 'date': {'start': {'month': 4, 'day': None, 'year': 2020}, 'end': {'month': 12, 'day': None, 'year': 2020}}, 'company': 'ACIIID', 'description': '•  Horizon scanning for design trends and researched on social impact of design.\n•  Oversaw production of a virtual design event from concept and planning to curation and execution.', 'title': 'Trend Researcher - Design & Social Impact', 'employment_type': 'Part-time'}]}, {'company': {'id': 13404631, 'name': 'Sta. Paulina Properties', 'logo': 'https://media.licdn.com/dms/image/C4D0BAQF0bW2HqpFFCA/company-logo_400_400/0/1519921062825?e=1700697600&v=beta&t=dSsmjN-9h_v9Cfw9-BMFLpwmqjyzMEf_BElGYhbOTjA', 'url': 'https://www.linkedin.com/company/sta-paulina-properties/', 'employees': {'start': 0, 'end': 1}}, 'date': {'start': {'month': 7, 'day': None, 'year': 2017}, 'end': {'month': 7, 'day': None, 'year': 2018}}, 'profile_positions': [{'location': 'Manila, National Capital Region, Philippines', 'date': {'start': {'month': 7, 'day': None, 'year': 2017}, 'end': {'month': 7, 'day': None, 'year': 2018}}, 'company': 'Sta. Paulina Properties', 'description': '•  Designed user interface and information architecture of website. •  Grew social media presence on LinkedIn, Instagram and Facebook for a real estate company.\n•  Managed online property listings and communicated sale/rental terms with real estate brokers & agents.', 'title': 'Associate Marketing Manager', 'employment_type': 'Part-time'}]}, {'company': {'id': 13285439, 'name': 'Manolo Living', 'logo': 'https://media.licdn.com/dms/image/C510BAQEmuPH0ESwryA/company-logo_400_400/0/1519863925703?e=1700697600&v=beta&t=vcUK5wfwXpH9EmbaxTRZQiMaJmlcYCWQN2z1sxyodSo', 'url': 'https://www.linkedin.com/company/manololiving/', 'employees': {'start': 2, 'end': 10}}, 'date': {'start': {'month': 1, 'day': None, 'year': 2017}, 'end': {'month': 3, 'day': None, 'year': 2018}}, 'profile_positions': [{'location': 'Manila, National Capital Region, Philippines', 'date': {'start': {'month': 4, 'day': None, 'year': 2017}, 'end': {'month': 3, 'day': None, 'year': 2018}}, 'company': 'Manolo Living', 'description': '•  Coordinated between clients, suppliers, manufacturers and design team to effectively deliver furniture and interior projects.\n•  Handled budgeting and product pricing for custom furniture.', 'title': 'Project Manager', 'employment_type': 'Full-time'}, {'location': None, 'date': {'start': {'month': 1, 'day': None, 'year': 2017}, 'end': {'month': 4, 'day': None, 'year': 2017}}, 'company': 'Manolo Living', 'description': '•  Decided on color and material combinations for seasonal releases of furniture pieces and home decor collections.\n• Researched and presented proposals for use of new materials, finishes and production techniques in line with brand direction.\n•  Designed and planned a collection of home decor through a livelihood project in co-creation with an indigenous community and independent artists.', 'title': 'Furniture Designer', 'employment_type': 'Full-time'}]}, {'company': {'id': None, 'name': 'Bentamobile', 'logo': None, 'url': None, 'employees': {'start': None, 'end': None}}, 'date': {'start': {'month': 8, 'day': None, 'year': 2015}, 'end': {'month': 1, 'day': None, 'year': 2017}}, 'profile_positions': [{'location': 'Manila, National Capital Region, Philippines', 'date': {'start': {'month': 8, 'day': None, 'year': 2015}, 'end': {'month': 1, 'day': None, 'year': 2017}}, 'company': 'Bentamobile', 'description': '•  Transformed qualitative research into personas, user journeys, sitemaps, wireframes and a working prototype.\n• Designed mobile food delivery app, from concept to wireframing,  information architecture, user interface & minimum viable product.\n•  Piloted a multidisciplinary team of designers, businesspeople, marketers and app developers to develop a mobile app and social business ecosystem.\n•  Conducted fieldwork, stakeholder workshops and user tests, gathered qualitative and quantitative data to develop insights on formalizing and digitizing businesses of illegal street vendors.\n•  Engaged multiple stakeholders, specifically informal street vendors and their local government, throughout the design process.', 'title': 'Service Designer & Project Lead', 'employment_type': 'Full-time'}]}, {'company': {'id': None, 'name': 'Rastrullo Design Studio', 'logo': None, 'url': None, 'employees': {'start': None, 'end': None}}, 'date': {'start': {'month': 1, 'day': None, 'year': 2015}, 'end': {'month': 1, 'day': None, 'year': 2016}}, 'profile_positions': [{'location': 'Manila, National Capital Region, Philippines', 'date': {'start': {'month': 1, 'day': None, 'year': 2015}, 'end': {'month': 1, 'day': None, 'year': 2016}}, 'company': 'Rastrullo Design Studio', 'description': '•  Designed furniture pieces and curated customized color, material and finish palettes for clients in line with brand direction.\n•  Assisted with exhibition installations and production.\n•  3D modeling and technical drawings.', 'title': 'Design Associate', 'employment_type': 'Internship'}]}, {'company': {'id': None, 'name': 'Ursus Et Cervus', 'logo': None, 'url': None, 'employees': {'start': None, 'end': None}}, 'date': {'start': {'month': 7, 'day': None, 'year': 2013}, 'end': {'month': 3, 'day': None, 'year': 2015}}, 'profile_positions': [{'location': None, 'date': {'start': {'month': 7, 'day': None, 'year': 2013}, 'end': {'month': 3, 'day': None, 'year': 2015}}, 'company': 'Ursus Et Cervus', 'description': 'Oversaw designs of home and fashion accessories from concept to production; visual merchandising for events.', 'title': 'Lifestore Director', 'employment_type': 'Self-employed'}]}]",[],"['Trend Research', 'Design Research', 'Worldbuilding', 'Storytelling', 'Product Design', 'Design Thinking', 'User Experience', 'Project Management', 'Experience Design', 'Art Direction', 'Branding & Identity', 'Interaction Design', 'Rapid Prototyping', 'Retail Design', 'Sustainable Design', 'Graphic Design', 'Product Innovation', 'User-centered Design', 'User Interface Design', 'Writing']",,,
