profile_id,first_name,last_name,sub_title,profile_picture,background_image,profile_type,entity_urn,object_urn,birth_date,summary,location,premium,influencer,treasury_media,languages,industry,education,patents,awards,certifications,organizations,projects,publications,courses,test_scores,position_groups,volunteer_experiences,skills,network_info,related_profiles,contact_info
wessam00,Wessam,Abdelazim,Paid Advertising & Social Media Specialist @Elsevier,https://media.licdn.com/dms/image/D4E03AQGI6zMdMcnsXw/profile-displayphoto-shrink_800_800/0/1683539916062?e=1697673600&v=beta&t=MqPAcgmdYnxCXb1fnd4YxpF0BdrUR1L0hT-OU_KMx4U,https://media.licdn.com/dms/image/D4E16AQFyeJPu1Xe4Aw/profile-displaybackgroundimage-shrink_350_1400/0/1683486940125?e=1697673600&v=beta&t=ITZjqvCG78ao6Ci93dPjbVWeRwKDRz-aBsbLQkR2Zl0,personal,ACoAAApd0sYBwCJvRYQ_MOpb80p9lPFwyODl46M,173920966,,"Eager, data-driven and ambitious marketeer with a demonstrated record of working in the creative and digital industries. Focused on social media marketing, social advertising, Google Ads, media buying, digital strategy, social campaign production, online brand activations, and community-building. 

I worked in the spectrum of both client and agency-side for a wide palette of regional and global brands like Toyota, Uber, Volkswagen, Philips, IKEA, OneFootball, Burger King, NESCAFE, Careem, LEXUS, Amadeus, Panda, FAW, Intel and more.

If you need someone to come up with fresh ideas, new approaches, and look for measurable results, not afraid to fail but most eager to improve and inspire. Message me.","{'country': 'Netherlands', 'short': 'Amsterdam, North Holland', 'city': 'Amsterdam', 'state': 'North Holland', 'default': 'Amsterdam, North Holland, Netherlands'}",False,False,"[{'url': 'https://certificates.growthtribe.io/en/verify/74532004195176?ref=email', 'title': 'Digital Marketing | Growth Tribe', 'description': None, 'image': 'https://media.licdn.com/dms/image/sync/D4E27AQH062BtBD7-CQ/articleshare-shrink_1280_800/0/1692041938721?e=1692946800&v=beta&t=0nKxHbyE_6rLxHKkoJ-C-d1DLTOUj2WoSPerFMSS5ns'}, {'url': 'https://www.credly.com/badges/c7368206-163a-428e-bd5e-610fac4c529f', 'title': 'Certified Digital Marketing Associate | Meta', 'description': None, 'image': 'https://media.licdn.com/dms/image/sync/D4E27AQFCiDvm8x0BSg/articleshare-shrink_800/0/1692041937942?e=1692946800&v=beta&t=DwMQ3HUQr1FZPQOkMpWB1Nr3sn0tzu0LPKEfPQWyJaw'}, {'url': None, 'title': 'Sprinklr Media Planner Pro Certificate', 'description': ""View my recent certificate with Sprinklr tool's course - Media Planner Pro where I learnt how to leverage advanced Modern Advertising features to maximize efficiency in building Campaigns in Sprinklr while collaborating with other teams to leverage existing audience data.\n\nLink: https://bit.ly/3C8JHHS"", 'image': 'https://media.licdn.com/dms/image/C4E2DAQEFq8O3a8_1IA/profile-treasury-document-cover-images_1920/0/1634656484000?e=1692946800&v=beta&t=8xin_uj_lE2RaEFsy9p2rXsPWJ_qXaE7XndusKuz5Ho'}]","{'primary_locale': {'country': 'US', 'language': 'en'}, 'supported_locales': [{'country': 'US', 'language': 'en'}], 'profile_languages': [{'name': 'Arabic', 'proficiency': 'NATIVE_OR_BILINGUAL'}, {'name': 'Dutch', 'proficiency': 'ELEMENTARY'}, {'name': 'English', 'proficiency': 'NATIVE_OR_BILINGUAL'}, {'name': 'German', 'proficiency': 'LIMITED_WORKING'}, {'name': 'Russian', 'proficiency': 'LIMITED_WORKING'}]}",Marketing & Advertising,"[{'date': {'start': {'month': None, 'day': None, 'year': 2012}, 'end': {'month': None, 'day': None, 'year': 2012}}, 'school': {'name': 'The American University in Cairo', 'logo': 'https://media.licdn.com/dms/image/C4E0BAQGjzyYT-NNNFw/company-logo_400_400/0/1610442280959?e=1700697600&v=beta&t=wl6nF_D6KqgBwjHIbY5ue4lOf-hkeRT2yi2xNfJ5U3A', 'url': 'https://www.linkedin.com/school/aucegypt/'}, 'degree_name': 'Professional Diploma of Integrated Marketing Communications', 'field_of_study': 'Marketing/Marketing Management, General'}, {'date': {'start': {'month': None, 'day': None, 'year': 2009}, 'end': {'month': None, 'day': None, 'year': 2013}}, 'school': {'name': 'Cairo University', 'logo': 'https://media.licdn.com/dms/image/C560BAQGYnGDX58wwLQ/company-logo_400_400/0/1519883636339?e=1700697600&v=beta&t=n0CUBqxTOYwbZG7lNwImPbXuAEIo_MpEYQ9_mXvnYN4', 'url': 'https://www.linkedin.com/school/cairo-university/'}, 'degree_name': 'Bachelor of Business Administration (B.B.A.)', 'field_of_study': 'Business Administration and Management, General'}, {'date': {'start': {'month': None, 'day': None, 'year': 2013}, 'end': {'month': None, 'day': None, 'year': 2014}}, 'school': {'name': 'Stanford Technology Ventures Capital', 'logo': None, 'url': None}, 'degree_name': 'Enrollee', 'field_of_study': 'Entrepreneurship and Innovation'}]",[],"[{'title': 'Employee of The Month', 'description': None, 'issuer': 'Digital Cloud', 'date': {'month': 8, 'day': None, 'year': 2015}}, {'title': 'Superior Performance', 'description': None, 'issuer': 'Intel Egypt', 'date': {'month': 10, 'day': None, 'year': 2013}}]","[{'name': 'Digital Marketing', 'date': {'start': {'month': 2, 'day': None, 'year': 2023}, 'end': {'month': None, 'day': None, 'year': None}}, 'authority': 'Growth Tribe', 'url': 'https://certificates.growthtribe.io/en/verify/74532004195176', 'license_number': '74532004195176', 'display_source': 'growthtribe.io', 'company': {'id': None, 'name': 'Growth Tribe', 'logo': 'https://media.licdn.com/dms/image/C560BAQHeR_dfrmhFUQ/company-logo_400_400/0/1527590806559?e=1700697600&v=beta&t=el1PmAM0iY73T0sH5q0TJ3Mmjh8Iyo5OLTFCwXbJEtQ', 'url': None}}, {'name': 'Facebook Certified Digital Marketing Associate', 'date': {'start': {'month': 11, 'day': None, 'year': 2021}, 'end': {'month': 11, 'day': None, 'year': 2023}}, 'authority': 'Meta', 'url': 'https://www.credly.com/badges/c7368206-163a-428e-bd5e-610fac4c529f?source=linked_in_profile', 'license_number': None, 'display_source': 'credly.com', 'company': {'id': None, 'name': 'Meta', 'logo': 'https://media.licdn.com/dms/image/C4E0BAQFdNatYGiBelg/company-logo_400_400/0/1636138753911?e=1700697600&v=beta&t=o60_o61Hzq6SGAYalJSkUh3J8cHVkVbE7sip7dn1Wc8', 'url': None}}, {'name': 'Social Media Marketing: ROI', 'date': {'start': {'month': 5, 'day': None, 'year': 2020}, 'end': {'month': 5, 'day': None, 'year': 2021}}, 'authority': 'LinkedIn', 'url': 'https://www.linkedin.com/learning/certificates/aafa10bc451d3f8cae30bc77bb3cac7b1c623d9cb84f12aa42dc6d4ac225799f?trk=backfilled_certificate', 'license_number': None, 'display_source': 'linkedin.com', 'company': {'id': None, 'name': 'LinkedIn', 'logo': 'https://media.licdn.com/dms/image/C560BAQHaVYd13rRz3A/company-logo_400_400/0/1638831589865?e=1700697600&v=beta&t=e1FsZytsym0fLF5Jt7PFnH40bqJRRzdgJ5LH7Y3pJJM', 'url': None}}, {'name': 'Social Media for Photo and Video Pros', 'date': {'start': {'month': 10, 'day': None, 'year': 2017}, 'end': {'month': 10, 'day': None, 'year': 2018}}, 'authority': 'LinkedIn', 'url': 'https://www.linkedin.com/learning/certificates/c94be44949c8761714aeb6b987a6fb3b63bc021ac8c2d8cb1c10f36bae640b40?trk=backfilled_certificate', 'license_number': None, 'display_source': 'linkedin.com', 'company': {'id': None, 'name': 'LinkedIn', 'logo': 'https://media.licdn.com/dms/image/C560BAQHaVYd13rRz3A/company-logo_400_400/0/1638831589865?e=1700697600&v=beta&t=e1FsZytsym0fLF5Jt7PFnH40bqJRRzdgJ5LH7Y3pJJM', 'url': None}}, {'name': 'Social Media Marketing for Small Business', 'date': {'start': {'month': 9, 'day': None, 'year': 2017}, 'end': {'month': 9, 'day': None, 'year': 2018}}, 'authority': 'LinkedIn', 'url': 'https://www.linkedin.com/learning/certificates/909ee902f81b8af12207d8d637275636d674b61ac3549666de73ad9df7c1abe0?trk=backfilled_certificate', 'license_number': None, 'display_source': 'linkedin.com', 'company': {'id': None, 'name': 'LinkedIn', 'logo': 'https://media.licdn.com/dms/image/C560BAQHaVYd13rRz3A/company-logo_400_400/0/1638831589865?e=1700697600&v=beta&t=e1FsZytsym0fLF5Jt7PFnH40bqJRRzdgJ5LH7Y3pJJM', 'url': None}}, {'name': 'Advertising on Instagram [2017]', 'date': {'start': {'month': 3, 'day': None, 'year': 2017}, 'end': {'month': 3, 'day': None, 'year': 2018}}, 'authority': 'LinkedIn', 'url': 'https://www.linkedin.com/learning/certificates/cfb24ba974ee3f7282a034cc730973c93eda2c8103c58248d7d3b6daa46bfa94?trk=backfilled_certificate', 'license_number': None, 'display_source': 'linkedin.com', 'company': {'id': None, 'name': 'LinkedIn', 'logo': 'https://media.licdn.com/dms/image/C560BAQHaVYd13rRz3A/company-logo_400_400/0/1638831589865?e=1700697600&v=beta&t=e1FsZytsym0fLF5Jt7PFnH40bqJRRzdgJ5LH7Y3pJJM', 'url': None}}, {'name': 'Contagious Viral Marketing', 'date': {'start': {'month': 2, 'day': None, 'year': 2017}, 'end': {'month': 2, 'day': None, 'year': 2018}}, 'authority': 'University of Pennsylvania - The Wharton School', 'url': 'http://www.coursera.com', 'license_number': 'UPTWS-2104F', 'display_source': 'coursera.com', 'company': None}, {'name': 'Analyzing and Visualizing Data with Excel', 'date': {'start': {'month': 8, 'day': None, 'year': 2016}, 'end': {'month': 8, 'day': None, 'year': 2017}}, 'authority': 'edX', 'url': 'https://courses.edx.org/courses/course-v1:Microsoft+DAT206x+5T2016', 'license_number': None, 'display_source': 'edx.org', 'company': {'id': None, 'name': 'edX', 'logo': 'https://media.licdn.com/dms/image/D4E0BAQFG13a41008Dg/company-logo_400_400/0/1688142646058?e=1700697600&v=beta&t=uVp_ufik30GkEu6GtXtW5PsA8ZvYAvrrlPO54QVEYjQ', 'url': None}}, {'name': 'Hootsuite Certified Professional', 'date': {'start': {'month': 7, 'day': None, 'year': 2016}, 'end': {'month': 8, 'day': None, 'year': 2017}}, 'authority': 'Hootsuite Media Inc.', 'url': 'https://learn.hootsuite.com/u/wessam00', 'license_number': None, 'display_source': 'hootsuite.com', 'company': {'id': None, 'name': 'Hootsuite', 'logo': 'https://media.licdn.com/dms/image/C4E0BAQHcA9BFHlVlqA/company-logo_400_400/0/1657641701731?e=1700697600&v=beta&t=NdzsxzzaVesgCBsJCpFRIkq6v8KU8tUrOEuB9xK0LhM', 'url': None}}, {'name': 'Social Media Marketing Specialization', 'date': {'start': {'month': 4, 'day': None, 'year': 2016}, 'end': {'month': 4, 'day': None, 'year': 2018}}, 'authority': 'Northwestern University', 'url': 'http://www.coursera.com', 'license_number': 'NWC-5009r', 'display_source': 'coursera.com', 'company': {'id': None, 'name': 'Northwestern University', 'logo': 'https://media.licdn.com/dms/image/C4E0BAQH-sXOOSUF3aA/company-logo_400_400/0/1519856314413?e=1700697600&v=beta&t=_0zQQK9Kkoo9bfJV8lFAZWZfzuYcI9kRFdCPp6iSxIM', 'url': None}}, {'name': 'Account Leadership', 'date': {'start': {'month': 2, 'day': None, 'year': 2016}, 'end': {'month': 2, 'day': None, 'year': 2017}}, 'authority': 'Twitter', 'url': 'https://twitterflightschool.com', 'license_number': None, 'display_source': 'twitterflightschool.com', 'company': {'id': None, 'name': 'Twitter', 'logo': 'https://media.licdn.com/dms/image/D560BAQEJZABhJ-eE0g/company-logo_400_400/0/1690242316938?e=1700697600&v=beta&t=dMxdH9vsYbXJhyrqyQs2IFqvcIFxKmzIQDmmimJ9VtU', 'url': None}}, {'name': 'SEO Training - Complete Course', 'date': {'start': {'month': 1, 'day': None, 'year': 2016}, 'end': {'month': 1, 'day': None, 'year': 2017}}, 'authority': 'Udemy', 'url': 'http://ude.my/KHDA5H6V', 'license_number': 'UC-KHDA5H6V', 'display_source': 'ude.my', 'company': {'id': None, 'name': 'Udemy', 'logo': 'https://media.licdn.com/dms/image/C4D0BAQFQr9e68bBOPQ/company-logo_400_400/0/1626275253364?e=1700697600&v=beta&t=NbESr4MHBCDFYGXOE7Q6_FRU7VTOES62r3OtQt9nvCo', 'url': None}}, {'name': 'PPC Training - Complete Course', 'date': {'start': {'month': 12, 'day': None, 'year': 2015}, 'end': {'month': 12, 'day': None, 'year': 2016}}, 'authority': 'Udemy', 'url': 'http://ude.my/UC-IQ5P1C1R', 'license_number': 'UC-IQ5P1C1R', 'display_source': 'ude.my', 'company': {'id': None, 'name': 'Udemy', 'logo': 'https://media.licdn.com/dms/image/C4D0BAQFQr9e68bBOPQ/company-logo_400_400/0/1626275253364?e=1700697600&v=beta&t=NbESr4MHBCDFYGXOE7Q6_FRU7VTOES62r3OtQt9nvCo', 'url': None}}, {'name': 'LinkedIn Marketing', 'date': {'start': {'month': 9, 'day': None, 'year': 2015}, 'end': {'month': 9, 'day': None, 'year': 2016}}, 'authority': 'Udemy', 'url': 'http://ude.my/UC-F0W2H3DT', 'license_number': 'UC-F0W2H3DT', 'display_source': 'ude.my', 'company': {'id': None, 'name': 'Udemy', 'logo': 'https://media.licdn.com/dms/image/C4D0BAQFQr9e68bBOPQ/company-logo_400_400/0/1626275253364?e=1700697600&v=beta&t=NbESr4MHBCDFYGXOE7Q6_FRU7VTOES62r3OtQt9nvCo', 'url': None}}, {'name': 'Effective Small Business Marketing', 'date': {'start': {'month': 8, 'day': None, 'year': 2015}, 'end': {'month': 8, 'day': None, 'year': 2016}}, 'authority': 'Udemy', 'url': 'http://ude.my/UC-XMQJO8MQ', 'license_number': 'UC-XMQJO8MQ', 'display_source': 'ude.my', 'company': {'id': None, 'name': 'Udemy', 'logo': 'https://media.licdn.com/dms/image/C4D0BAQFQr9e68bBOPQ/company-logo_400_400/0/1626275253364?e=1700697600&v=beta&t=NbESr4MHBCDFYGXOE7Q6_FRU7VTOES62r3OtQt9nvCo', 'url': None}}, {'name': 'Social Media Strategizing', 'date': {'start': {'month': 8, 'day': None, 'year': 2015}, 'end': {'month': 8, 'day': None, 'year': 2016}}, 'authority': 'Udemy', 'url': 'http://ude.my/UC-IE627UZE', 'license_number': 'UC-IE627UZE', 'display_source': 'ude.my', 'company': {'id': None, 'name': 'Udemy', 'logo': 'https://media.licdn.com/dms/image/C4D0BAQFQr9e68bBOPQ/company-logo_400_400/0/1626275253364?e=1700697600&v=beta&t=NbESr4MHBCDFYGXOE7Q6_FRU7VTOES62r3OtQt9nvCo', 'url': None}}, {'name': 'Instagram Marketing', 'date': {'start': {'month': 7, 'day': None, 'year': 2015}, 'end': {'month': 7, 'day': None, 'year': 2016}}, 'authority': 'Udemy', 'url': 'http://ude.my/UC-W80AUYTY', 'license_number': 'UC-W80AUYTY', 'display_source': 'ude.my', 'company': {'id': None, 'name': 'Udemy', 'logo': 'https://media.licdn.com/dms/image/C4D0BAQFQr9e68bBOPQ/company-logo_400_400/0/1626275253364?e=1700697600&v=beta&t=NbESr4MHBCDFYGXOE7Q6_FRU7VTOES62r3OtQt9nvCo', 'url': None}}, {'name': 'MS Excel - Huge Data Analyzing', 'date': {'start': {'month': 7, 'day': None, 'year': 2015}, 'end': {'month': 7, 'day': None, 'year': 2016}}, 'authority': 'Udemy', 'url': 'http://ude.my/UC-AUSRIZ1B', 'license_number': 'UC-AUSRIZ1B', 'display_source': 'ude.my', 'company': {'id': None, 'name': 'Udemy', 'logo': 'https://media.licdn.com/dms/image/C4D0BAQFQr9e68bBOPQ/company-logo_400_400/0/1626275253364?e=1700697600&v=beta&t=NbESr4MHBCDFYGXOE7Q6_FRU7VTOES62r3OtQt9nvCo', 'url': None}}, {'name': 'MS Excel 2010 Basics for Beginners', 'date': {'start': {'month': 7, 'day': None, 'year': 2015}, 'end': {'month': 7, 'day': None, 'year': 2016}}, 'authority': 'Udemy', 'url': 'http://ude.my/UC-WQNID92P', 'license_number': 'UC-WQNID92P', 'display_source': 'ude.my', 'company': {'id': None, 'name': 'Udemy', 'logo': 'https://media.licdn.com/dms/image/C4D0BAQFQr9e68bBOPQ/company-logo_400_400/0/1626275253364?e=1700697600&v=beta&t=NbESr4MHBCDFYGXOE7Q6_FRU7VTOES62r3OtQt9nvCo', 'url': None}}, {'name': 'MS Excel 2010 Fundamentals', 'date': {'start': {'month': 7, 'day': None, 'year': 2015}, 'end': {'month': 7, 'day': None, 'year': 2016}}, 'authority': 'Udemy', 'url': 'http://ude.my/UC-UXN1RRP2', 'license_number': 'UC-UXN1RRP2', 'display_source': 'ude.my', 'company': {'id': None, 'name': 'Udemy', 'logo': 'https://media.licdn.com/dms/image/C4D0BAQFQr9e68bBOPQ/company-logo_400_400/0/1626275253364?e=1700697600&v=beta&t=NbESr4MHBCDFYGXOE7Q6_FRU7VTOES62r3OtQt9nvCo', 'url': None}}]","[{'name': 'Commerce syndicate ', 'position': 'Member', 'date_start': {'month': 3, 'day': None, 'year': 2015}, 'date_end': None}]","[{'title': 'Startup Weekend Giza, SW', 'date': {'start': {'month': 12, 'day': None, 'year': 2012}, 'end': {'month': 12, 'day': None, 'year': 2012}}, 'description': '- Establishing Digital Media channels i.e:-\n• Facebook\n• Twitter', 'contributors': [{'type': 'standardizedContributor', 'first_name': 'Wessam', 'last_name': 'Abdelazim', 'name': None, 'headline': 'Paid Advertising & Social Media Specialist @Elsevier'}, {'type': 'standardizedContributor', 'first_name': 'Mohamed Amr', 'last_name': 'Samy', 'name': None, 'headline': 'Business Development & Marketing professional | Growth architect | B2B | Venture builder'}, {'type': 'standardizedContributor', 'first_name': 'Mahmoud', 'last_name': 'N. Kelany', 'name': None, 'headline': 'Product Manager | Data-Driven Strategies | Cross-Functional Leadership | Customer Experience | Driving Growth & Innovation | Accomplished in Agile Methodologies'}]}, {'title': 'Topnotch HR Consultancy', 'date': {'start': {'month': 7, 'day': None, 'year': 2012}, 'end': {'month': 7, 'day': None, 'year': 2012}}, 'description': '- Establishing Digital Media channels i.e:-\n• Facebook\n• Youtube\n• Twitter', 'contributors': [{'type': 'standardizedContributor', 'first_name': 'Wessam', 'last_name': 'Abdelazim', 'name': None, 'headline': 'Paid Advertising & Social Media Specialist @Elsevier'}, {'type': 'standardizedContributor', 'first_name': 'Kariman', 'last_name': 'Maher, PCC', 'name': None, 'headline': 'Executive Coach'}, {'type': 'standardizedContributor', 'first_name': 'Ahmed', 'last_name': 'Ghanem', 'name': None, 'headline': 'Commercial Diplomat at Egyptian Commercial Service - (ECS)'}]}, {'title': 'Think Co.', 'date': {'start': {'month': 6, 'day': None, 'year': 2012}, 'end': {'month': 6, 'day': None, 'year': 2012}}, 'description': '- Establishing Digital Media channels i.e:-\n• Facebook\n• Twitter\n• Linked in\n• Youtube\n• Google+', 'contributors': [{'type': 'standardizedContributor', 'first_name': 'Wessam', 'last_name': 'Abdelazim', 'name': None, 'headline': 'Paid Advertising & Social Media Specialist @Elsevier'}, {'type': 'standardizedContributor', 'first_name': 'Mohamed Amr', 'last_name': 'Samy', 'name': None, 'headline': 'Business Development & Marketing professional | Growth architect | B2B | Venture builder'}]}, {'title': 'Wasleen by ingredients Corp.', 'date': {'start': {'month': 5, 'day': None, 'year': 2012}, 'end': {'month': 5, 'day': None, 'year': 2012}}, 'description': '- Participating in Launchment Digital Media channel i.e:-\n• Facebook', 'contributors': [{'type': 'standardizedContributor', 'first_name': 'Wessam', 'last_name': 'Abdelazim', 'name': None, 'headline': 'Paid Advertising & Social Media Specialist @Elsevier'}]}, {'title': 'Royal Netherlands Embassy in Egypt', 'date': {'start': {'month': 5, 'day': None, 'year': 2011}, 'end': {'month': 5, 'day': None, 'year': 2011}}, 'description': '- Establishing Digital Media channel i.e:-\n• Facebook', 'contributors': [{'type': 'standardizedContributor', 'first_name': 'Wessam', 'last_name': 'Abdelazim', 'name': None, 'headline': 'Paid Advertising & Social Media Specialist @Elsevier'}]}, {'title': '10,000 Scholarships', 'date': {'start': {'month': 3, 'day': None, 'year': 2021}, 'end': {'month': 6, 'day': None, 'year': 2021}}, 'description': 'SPARK joined forces with Education Above All Foundation to celebrate 10,000 scholarships awarded to refugees, IDPs and youth from host communities since 2016.\n\nThe event had Her Majesty Queen Máxima of The Netherlands. Her Highness, Sheikha Moza bint Nasser of Qatar, spoke with several Syrian students during the virtual celebration across social media, where I had the pleasure of planning, executing, and managing the whole campaign on June 2021.', 'contributors': [{'type': 'standardizedContributor', 'first_name': 'Wessam', 'last_name': 'Abdelazim', 'name': None, 'headline': 'Paid Advertising & Social Media Specialist @Elsevier'}]}, {'title': 'Digital Cloud', 'date': {'start': {'month': 4, 'day': None, 'year': 2015}, 'end': {'month': 5, 'day': None, 'year': 2018}}, 'description': 'Handling & Managing the Social Media platforms for:\n- Toyota Saudi Arabia\n- Toyota Oil Saudi Arabia\n- Bab Rizq Jameel \n- Community Jameel\n- Panda KSA\n- Careem KSA\n- Alsabban Furniture \n- Attar Travel \n- Amadeus KSA\n- Sloanes KSA\n- ALJ Body & Paints\n- Alsagr Insurance\n- Zumrod\n- Geidea\n- Amadeus\n- Dr. Sameer Abbas Hospital\n- Toyota Material Handling', 'contributors': [{'type': 'standardizedContributor', 'first_name': 'Wessam', 'last_name': 'Abdelazim', 'name': None, 'headline': 'Paid Advertising & Social Media Specialist @Elsevier'}]}, {'title': 'Kitab Sawti', 'date': {'start': {'month': 2, 'day': None, 'year': 2017}, 'end': {'month': 3, 'day': None, 'year': 2017}}, 'description': '- Kitab Sawti', 'contributors': [{'type': 'standardizedContributor', 'first_name': 'Wessam', 'last_name': 'Abdelazim', 'name': None, 'headline': 'Paid Advertising & Social Media Specialist @Elsevier'}]}, {'title': 'ARQQA ', 'date': {'start': {'month': 1, 'day': None, 'year': 2013}, 'end': {'month': 2, 'day': None, 'year': 2016}}, 'description': '- Cottonil\n- Betna Furniture\n- Smart Furniture\n- Fawry', 'contributors': [{'type': 'standardizedContributor', 'first_name': 'Wessam', 'last_name': 'Abdelazim', 'name': None, 'headline': 'Paid Advertising & Social Media Specialist @Elsevier'}]}, {'title': 'Freelance', 'date': {'start': {'month': 1, 'day': None, 'year': 2013}, 'end': {'month': 4, 'day': None, 'year': 2015}}, 'description': '- Coffeshop company\n- VW auto\n- Crevettee sushi\n- The smith Cafe & Restaurant', 'contributors': [{'type': 'standardizedContributor', 'first_name': 'Wessam', 'last_name': 'Abdelazim', 'name': None, 'headline': 'Paid Advertising & Social Media Specialist @Elsevier'}]}, {'title': 'eDigits', 'date': {'start': {'month': None, 'day': None, 'year': None}, 'end': {'month': None, 'day': None, 'year': None}}, 'description': '- Saffa Insaat', 'contributors': [{'type': 'standardizedContributor', 'first_name': 'Wessam', 'last_name': 'Abdelazim', 'name': None, 'headline': 'Paid Advertising & Social Media Specialist @Elsevier'}]}]",[],"[{'name': 'Advertising', 'number': None}, {'name': 'Basics of Finance', 'number': None}, {'name': 'Branding', 'number': None}, {'name': 'Entrepreneurship', 'number': None}, {'name': 'Global Marketing and Entreprenurship', 'number': None}, {'name': 'International Marketing', 'number': None}, {'name': 'Market Planning', 'number': None}, {'name': 'Marketing Communications', 'number': None}, {'name': 'Marketing Fundmentals', 'number': None}, {'name': 'Marketing Strategy', 'number': None}, {'name': 'Professional Marketing and Sales', 'number': None}]",[],"[{'company': {'id': 3027, 'name': 'Elsevier', 'logo': 'https://media.licdn.com/dms/image/D4E0BAQFvlGwwa4KXFA/company-logo_400_400/0/1688142511630?e=1700697600&v=beta&t=wKSwKv6rIJKKj6tGlzeI42wL-UV3k2iPSKLp9KgoZB8', 'url': 'https://www.linkedin.com/company/elsevier/', 'employees': {'start': 5001, 'end': 10000}}, 'date': {'start': {'month': 6, 'day': None, 'year': 2022}, 'end': {'month': None, 'day': None, 'year': None}}, 'profile_positions': [{'location': 'Amsterdam, North Holland, Netherlands', 'date': {'start': {'month': 6, 'day': None, 'year': 2022}, 'end': {'month': None, 'day': None, 'year': None}}, 'company': 'Elsevier', 'description': ""• Developed the business unit's paid social strategy, including funnel structure and customer acquisition & retention journey.\n• Managed the global PPC campaigns via external agencies and implementation of paid social campaigns by internal MarCom teams.\n• Co-established and maintained scalable processes to support internal marketing teams with best practices in social management and paid campaigns.\n• Acted as the point of contact to discuss technical implementation of marketing tech stack where needed to implement paid campaigns, i.e. Adobe implementation, Sprinklr integrations.\n• Worked with the data & analytics team to ensure the measurement and optimisation of paid campaigns using vendor-specific dashboards, Adobe Analytics, and landing page source reports.\n• Developed and automated paid and organic social reports for internal use.\n• Liaised incoming projects and developments with cross-functional stakeholders.\n\nTools:\nSprinklr, Twitter Ads Manager, Facebook Business Manager, LinkedIn Ads Manager, Google ads manager, Adobe Analytics, Confluence, Jira, Miro, Tableau."", 'title': 'Paid Advertising and Social Media Specialist', 'employment_type': 'Full-time'}]}, {'company': {'id': 18601, 'name': 'Stichting SPARK', 'logo': 'https://media.licdn.com/dms/image/C4E0BAQHIyqQNd5uaTg/company-logo_400_400/0/1584464910424?e=1700697600&v=beta&t=jBwzmcvS8eljLYBOUR23L_Ywn82Dnrgul3ZYN6O-7yM', 'url': 'https://www.linkedin.com/company/spark/', 'employees': {'start': 51, 'end': 200}}, 'date': {'start': {'month': 8, 'day': None, 'year': 2020}, 'end': {'month': 5, 'day': None, 'year': 2022}}, 'profile_positions': [{'location': 'Amsterdam, North Holland, Netherlands', 'date': {'start': {'month': 8, 'day': None, 'year': 2020}, 'end': {'month': 5, 'day': None, 'year': 2022}}, 'company': 'Stichting SPARK', 'description': ""• Developed the global social media strategy of SPARK and maintained the implementation on regional accounts.\n• Ran and optimised paid social campaigns, including campaign strategy and tactical execution per region.\n• Developed and maintained the content and design creation processes with the regional teams to serve active social channels in the Middle East, Europe, and Eastern sub-Saharan Africa. \n• Established SPARK's social media presence in new countries like (Rwanda and South Sudan).\n• Managed the regional paid campaigns via external agencies, including briefing, communication and performance monitoring.\nCreated and automated the paid social, organic social and website performance analysis reports.\nSupported internal teams with custom training on paid ads and social media. \n\nTools:\nSproutSocial, Facebook Business Manager, Twitter Ads Manager, LinkedIn Ads Manager, Google Ad Manager, Google Analytics, Restream, Mailchimp, WordPress."", 'title': 'Global Social Media & Paid Ads Officer', 'employment_type': 'Full-time'}]}, {'company': {'id': None, 'name': None, 'logo': None, 'url': None, 'employees': {'start': None, 'end': None}}, 'date': {'start': {'month': 3, 'day': None, 'year': 2020}, 'end': {'month': 7, 'day': None, 'year': 2020}}, 'profile_positions': [{'location': 'Netherlands', 'date': {'start': {'month': 3, 'day': None, 'year': 2020}, 'end': {'month': 7, 'day': None, 'year': 2020}}, 'company': None, 'description': '• Worked with companies to develop and execute paid social campaigns in multiple regions. \n• Managed paid social lead generation, engagement and retention strategies. \n• Defined and measured the relevant paid social KPIs.\n• setting up and configuring event tracking.\n• Overseeing media plans and paid social budget >€1M.\n• Writing and Proofreading: Bespoke written content for corporate social platforms, digital campaigns, blogs, news features or opinion pieces related to the digital and social media industry.\n\nTools:\nSprinklr, Facebook business manager, Twitter Ads Manager, Snapchat Business Manager, Qlik, segment, funnel.io, mixpanel, Google Analytics.', 'title': 'Social Advertising Consultant', 'employment_type': 'Freelance'}]}, {'company': {'id': 18626226, 'name': 'MAVINZ', 'logo': 'https://media.licdn.com/dms/image/C4E0BAQEFY4gkI4_AZA/company-logo_400_400/0/1525797236592?e=1700697600&v=beta&t=RwtSd_COFxFyT20IfzBU4-9DitYmjEAqSl4xxaN5-Rk', 'url': 'https://www.linkedin.com/company/mavinz-digital/', 'employees': {'start': 51, 'end': 200}}, 'date': {'start': {'month': 3, 'day': None, 'year': 2019}, 'end': {'month': 2, 'day': None, 'year': 2020}}, 'profile_positions': [{'location': 'Egypt', 'date': {'start': {'month': 3, 'day': None, 'year': 2019}, 'end': {'month': 2, 'day': None, 'year': 2020}}, 'company': 'MAVINZ', 'description': ""• Developed the company's social media strategies and proposals.  \n• Re-formed the brainstorming sessions with the creative team. \n• Managed the workflow within the creative team. \n• Aligned the daily tasks with the performance, commercial and marketing teams. \n• Set-up social and display ad campaigns.\n• Optimizing campaigns and measuring results.\n• Built all the social media & community moderation relevant reports.\n• Led the creative team's communication online and offline with clients.\n• Oversaw community moderation on a daily basis measured with SLAs.\n• Optimized content research and creation for all clients' social networks.\n• Developed + implemented multiple social campaigns from ideation to cross-channel execution and reporting.\n• Led resource management over the team.\n• Participated in the process of developing the team's technical performance and skills on a monthly/quarterly plan.\n• Coordinated external projects with freelancers and marketing influencers.\n\nOther Achievements:\n• Helped in increasing the social proposals' technical acceptance rate to 90% in under 8 months.\n• Increased the impressions rate on clients' Facebook pages to +130%, and Engagement to +60% organic.\n\nTools:\n• Hootsuite, Buffer, Socialbakers, Iconosquare, Keyhole, Mention, Google Alerts, Buzzsumo, Google Analytics."", 'title': 'Social Media Manager', 'employment_type': 'Full-time'}]}, {'company': {'id': 15203879, 'name': 'DUGOUT (A OneFootball Company)', 'logo': 'https://media.licdn.com/dms/image/C4D0BAQEuBd83Co3-NA/company-logo_400_400/0/1611845055039?e=1700697600&v=beta&t=CJNGEpknBQh_ef1nt7HwHgxTF9k-FOSYTSw83G2w8QY', 'url': 'https://www.linkedin.com/company/dugout-ltd/', 'employees': {'start': 51, 'end': 200}}, 'date': {'start': {'month': 5, 'day': None, 'year': 2018}, 'end': {'month': 2, 'day': None, 'year': 2019}}, 'profile_positions': [{'location': 'United Kingdom', 'date': {'start': {'month': 5, 'day': None, 'year': 2018}, 'end': {'month': 2, 'day': None, 'year': 2019}}, 'company': 'DUGOUT (A OneFootball Company)', 'description': ""• Led the social & digital team across the MENA region. \n• Set the social and digital strategy for DUGOUT MENA platforms, especially during the world cup 2018.\n• Optimized + implemented the monthly editorial calendar synced with the global team. \n• Set-up social and display ad campaigns.\n• Optimizing campaigns and measuring results.\n• Produced + implemented social competitions and campaigns with partner-clubs like Barcelona, Real Madrid, Inter, PSG, Liverpool, Man City and Juventus. \n• Worked with the regional and global content teams to provide MENA audience with instant access to exclusive backstage video content from partner clubs.\n• Worked with each partner club's digital media editor to produce and upload creative and live content made by the players themselves to use on social networks like Mbappé, CR7, Elneny and Asamoah.\n• participated in increasing the video views on dugout.com to 5M in under 6 months.\n• Increased Twitter Followers from 0 to +15K, Engagements +100K, organic in under 6 months. \n• Increased Facebook Fans from 0 to 5.5K organic in under 6 months. \n• Developed content look & feel that got engaged by top football players like Michael Ballack, Miralem Pjanić, Vinicius Jr, Del Piero, Elhadary, Mido and Abu Treka.\n\nOther achievements:\n• Set the social strategy for an Irish sister company operating in MENA named ALTV (Entertaining Video Content Platform).\n• Developed the monthly editorial calendars.\n• Coordinated the workflow between social media and community teams to organize the content produced and published for influencers and weekly shows. \n• Established ALTV Crew channel on Facebook to host talents in various categories like Football, Cinema, Travel, Cooking to start their shows broadcasted from ALTV studio. \n• Increased ALTV Crew Facebook fans from 0 to +4K organic in under 5 months.\n\nTools:\n• Social Studio, Hootsuite, Socialbakers, Iconosquare, Buzzsumo, Facebook Pages Insights, Facebook Business Manager, Twitter Account Insights."", 'title': 'Regional Social Media & Paid Ads Manager', 'employment_type': 'Full-time'}]}, {'company': {'id': 1561059, 'name': 'DCE', 'logo': 'https://media.licdn.com/dms/image/D4D0BAQHRlZ20_mqTnw/company-logo_400_400/0/1664712216894?e=1700697600&v=beta&t=E0nAAwsFed08rPUrkbfcCdOa-56hQ7hXWMT8cwCsOf0', 'url': 'https://www.linkedin.com/company/dceksa/', 'employees': {'start': 51, 'end': 200}}, 'date': {'start': {'month': 4, 'day': None, 'year': 2015}, 'end': {'month': 5, 'day': None, 'year': 2018}}, 'profile_positions': [{'location': 'Saudi Arabia', 'date': {'start': {'month': 2, 'day': None, 'year': 2017}, 'end': {'month': 5, 'day': None, 'year': 2018}}, 'company': 'DCE | دي سي إي ', 'description': ""• Strategized, defined and executed customers' social media plans. Including number and type of posts, frequency, creative ideas, and channels’ progress.\n• Performed research on current benchmark trends and audience preferences.\n• Assessed quarterly social media trends - making and acting upon recommendations to leverage learning.\n• Worked with Account Managers to create a social media strategy that collaborates with marketing, PR and advertising campaigns, researched top influencers, competitors, and trends in clients' industries.\n• Analyzed and reported social media actions on a monthly basis for successes and new opportunities.\n• Implemented Social Media SEO tactics aligned with our clients’ keyword and SEO strategies.\n• Built and developed the department’s plans and the proposal sent to the clients.\n• Suggested and implemented new features to develop brand awareness, like promotions and competitions.\n\nTools:\n• Hootsuite, SproutSocial, Socialbakers, Iconosquare, Klear, Google Trends, Buzzsumo, Facebook Business Manager, Twitter Ad Manager, Meltwater, Synthesio, Crimson Hexagon, Brand24, Quintly."", 'title': 'Social Media Manager', 'employment_type': 'Full-time'}, {'location': 'Saudi Arabia', 'date': {'start': {'month': 9, 'day': None, 'year': 2016}, 'end': {'month': 2, 'day': None, 'year': 2017}}, 'company': 'DCE | دي سي إي ', 'description': '• Supervised the social media strategy for the company, ensuring it aligns with the company’s brand digital guidelines.\n• Ensured that approaches to social media are relevant and appropriate for each medium.\n• Built reporting frameworks to evaluate ROI on the various platforms.\n• Researched Continuously into new relevant social media channels and their impact on the brands’ marketing.\n• Worked with the planning team to look at ways social media can work within wider campaigns. \n• Analyzed the social media insights on monthly basis to guide the future social media campaigns.\n• Developed the content process & quality across all platforms ensuring a constant supply of relevant content.\n• Held continuous workshops for the team to elevate the performance.\n• Created and supervised the creative content for all clients.\n• Built and developed the social media plans and proposals sent to the clients.\n• Assisted in all brands related campaigns for clients.', 'title': 'Senior Social Media Specialist', 'employment_type': 'Full-time'}, {'location': 'Saudi Arabia', 'date': {'start': {'month': 4, 'day': None, 'year': 2015}, 'end': {'month': 8, 'day': None, 'year': 2016}}, 'company': 'DCE | دي سي إي ', 'description': ""• Created creative and compelling content for all Social Media accounts.\n• Maintained and executing the day-to-day operations of fan pages on social networks.\n• Monitored and tracking the social account's performance.\n• Created end of campaign reports for clients.\n• Worked with internal departments to research and develop key issue communications for Social Media and respond to any customer issue that comes through social channels.\n• Transformed insights into effective strategies to develop the key performance results."", 'title': 'Social Media Specialist', 'employment_type': 'Full-time'}]}, {'company': {'id': 18013504, 'name': '36T Digital', 'logo': 'https://media.licdn.com/dms/image/C4E0BAQFRhfGaHfuSTQ/company-logo_400_400/0/1519885501193?e=1700697600&v=beta&t=9l1uySy7BIEGurFCHY4AcLEgK2rwwo9dtRqnfDsqu2E', 'url': 'https://www.linkedin.com/company/3sixty-digital/', 'employees': {'start': 11, 'end': 50}}, 'date': {'start': {'month': 3, 'day': None, 'year': 2017}, 'end': {'month': 6, 'day': None, 'year': 2017}}, 'profile_positions': [{'location': 'United Arab Emirates', 'date': {'start': {'month': 3, 'day': None, 'year': 2017}, 'end': {'month': 6, 'day': None, 'year': 2017}}, 'company': '36T Digital', 'description': '• Oversaw the social media strategy for the company ensuring it aligns with the company’s brand.\n• Ensured that approaches to social media are relevant and appropriate for each medium.\n• Built reporting frameworks to evaluate ROI on the various platforms.\n• Developed the content across all platforms ensuring a constant supply of relevant content.\n• Searched social media for off-diary stories and content.\n• Created and supervising the creative content for all clients.\n• Built and develop social media plans and proposals sent to the clients.\n\nTools:\n• Hootsuite, Socialbakers, Keyhole, Buzzsumo, Facebook Pages Insights, Twitter Account Insights.', 'title': 'Social Media Manager (Freelance)', 'employment_type': 'Freelance'}]}, {'company': {'id': 10587972, 'name': 'Kitab Sawti - كتاب صوتي', 'logo': 'https://media.licdn.com/dms/image/C4D0BAQHrTTfk9va-WA/company-logo_400_400/0/1594106525338?e=1700697600&v=beta&t=iHSefTanT_NwwO97Jx6XFW13XLOtPENXBIYVPrYfGVw', 'url': 'https://www.linkedin.com/company/kitab-sawti-ab/', 'employees': {'start': 11, 'end': 50}}, 'date': {'start': {'month': 11, 'day': None, 'year': 2016}, 'end': {'month': 1, 'day': None, 'year': 2017}}, 'profile_positions': [{'location': 'Sweden', 'date': {'start': {'month': 11, 'day': None, 'year': 2016}, 'end': {'month': 1, 'day': None, 'year': 2017}}, 'company': 'Kitab Sawti - كتاب صوتي (Acquired by Storytel)', 'description': '• Managed the social media platforms for Kitab Sawti.\n• Conducted brand and competition analysis report for overall online performance on monthly basis.\n• Worked closely with the operation team to plan for on-ground marketing activities\n• Worked with the media planning team to enhance the Ads qualitative results \n• Coordinated with the design team for all the creative visuals needed.\n• Created Kitab Sawti social media strategy through competitive research, platform determination, benchmarking, messaging and audience identification.\n\nTools:\n• Twitter Account Insights, Facebook Pages Insights, Facebook Business Manager, Quintly.', 'title': 'Social Media Manager (Freelance)', 'employment_type': 'Freelance'}]}, {'company': {'id': 5042700, 'name': 'eDigits', 'logo': 'https://media.licdn.com/dms/image/C4E0BAQGCWEmUdLpxow/company-logo_400_400/0/1519870161203?e=1700697600&v=beta&t=2Z4Wnp4muK0y9VBOyYmTeI62U1LzHeps1HrzMxzJ3Tk', 'url': 'https://www.linkedin.com/company/edigits/', 'employees': {'start': 51, 'end': 200}}, 'date': {'start': {'month': 4, 'day': None, 'year': 2016}, 'end': {'month': 9, 'day': None, 'year': 2016}}, 'profile_positions': [{'location': 'Egypt', 'date': {'start': {'month': 4, 'day': None, 'year': 2016}, 'end': {'month': 9, 'day': None, 'year': 2016}}, 'company': 'eDigits', 'description': '• Managed the social media platforms for clients.\n• Contributed in creating the proposals sent to the clients.\n• Conducted weekly/monthly reports for overall online performance on monthly basis.\n• Worked on the submitted plans for brand from the clients to achieve the targets\nneeded from social media.\n• Coordinated with the design team for all the creative needed.\n• Worked closely with the digital media team to apply the promoted content needed \n• Executed the daily tasks of social media strategy across identified social platforms (Facebook, Instagram, YouTube, Google+, LinkedIn.)', 'title': 'Social Media Manager (Freelance)', 'employment_type': 'Freelance'}]}, {'company': {'id': 2692622, 'name': 'ARQQA Digital Marketing and Social Media Managment Egypt', 'logo': 'https://media.licdn.com/dms/image/C4E0BAQFXmYiIGAD_Aw/company-logo_400_400/0/1519891744354?e=1700697600&v=beta&t=zaXefCdFbbo91ByetZV5rb0-xQGU_fMq-54dSws7Ia4', 'url': 'https://www.linkedin.com/company/digital-marketing-social-media-managment-egypt/', 'employees': {'start': 11, 'end': 50}}, 'date': {'start': {'month': 12, 'day': None, 'year': 2015}, 'end': {'month': 2, 'day': None, 'year': 2016}}, 'profile_positions': [{'location': 'Egypt', 'date': {'start': {'month': 12, 'day': None, 'year': 2015}, 'end': {'month': 2, 'day': None, 'year': 2016}}, 'company': 'ARQQA Digital', 'description': ""• Conducted brand analysis report for overall online performance on monthly basis.\n• Coordinate with the marketing team from the client's side to develop aligned plans to assure consistency.\n• Created a weekly and monthly content that suits each digital channel.\n•  Analyzed competitor performance on a digital basis.\n• Coordinated with the design team for all the creative needed.\n• Contributed in creating the proposals sent for clients.\n• Generated a monthly report and end of campaign detailed-reports."", 'title': 'Social Media Manager (Freelance)', 'employment_type': 'Freelance'}]}]","[{'date': {'start': {'month': 11, 'day': None, 'year': 2012}, 'end': {'month': 1, 'day': None, 'year': 2020}}, 'role': 'Egypt community lead & Marketing Director', 'company': {'id': None, 'name': 'Startup Weekend Egypt', 'logo': 'https://media.licdn.com/dms/image/C4E0BAQETZkRJdFeFNg/company-logo_400_400/0/1519900071247?e=1700697600&v=beta&t=sq6XLK78EQdxvw6C_YX2wkY77fLUf4nJN154FVUE-xs', 'url': 'https://www.linkedin.com/company/startup-weekend-egypt/'}, 'cause': 'SOCIAL_SERVICES', 'description': ""• Communicating the Start-up Weekend Message.\n• Representing Start-up Weekend to the Local Community.\n• Representing Global & Regional Sponsors. \n• Interfacing with Event VIP's, and Ensuring Event Information is Clearly Communicated.\n• Enhancing the local community with Culture of Startups and Entrepreneurship by the global brand.""}, {'date': {'start': {'month': 12, 'day': None, 'year': 2016}, 'end': {'month': None, 'day': None, 'year': None}}, 'role': 'Contributing Writer', 'company': {'id': None, 'name': 'Think Marketing Magazine', 'logo': 'https://media.licdn.com/dms/image/C4D0BAQGkTNdhl241lw/company-logo_400_400/0/1598786580955?e=1700697600&v=beta&t=JMfkpIC-bx5IXz-KfexFejiU6GoDBInvRyi2cUNFuBg', 'url': 'https://www.linkedin.com/company/think-marketing-magazine/'}, 'cause': 'SCIENCE_AND_TECHNOLOGY', 'description': '• Writing various types of articles on a wide range of topics related to ""Social Media, Marketing"".\n• Research, write/edit and create layout for new articles'}, {'date': {'start': {'month': 8, 'day': None, 'year': 2017}, 'end': {'month': None, 'day': None, 'year': None}}, 'role': 'Contributing Writer', 'company': {'id': None, 'name': 'MENAbytes', 'logo': 'https://media.licdn.com/dms/image/C560BAQGCTpessM4npQ/company-logo_400_400/0/1519873549032?e=1700697600&v=beta&t=o5XErqwiyWRLtVwjKDPX-uIfKaLXpZp-kvArZOE6vRo', 'url': 'https://www.linkedin.com/company/menabytes/'}, 'cause': 'SCIENCE_AND_TECHNOLOGY', 'description': '• Writing various types of articles on a wide range of topics related to ""Social Media, Marketing, Tech and Entrepreneurship"".\n• Research, write/edit and create layout for new articles'}, {'date': {'start': {'month': 1, 'day': None, 'year': 2016}, 'end': {'month': 5, 'day': None, 'year': 2017}}, 'role': 'Contributing Writer', 'company': {'id': None, 'name': 'Niume Ltd.', 'logo': 'https://media.licdn.com/dms/image/C4E0BAQHgoSmfHngrRw/company-logo_400_400/0/1519911091234?e=1700697600&v=beta&t=C_qRjBmfOYLuE1FlAZlackf7QAZgzaHwY6_F333LhBA', 'url': 'https://www.linkedin.com/company/niume-ltd-/'}, 'cause': 'SCIENCE_AND_TECHNOLOGY', 'description': '• Writing various types of articles on a wide range of topics related to ""Social Media, Marketing"".\n• Perform continuous enhancements and modifications to the blog.\n• Research, write/edit and create layout for new articles'}, {'date': {'start': {'month': 7, 'day': None, 'year': 2012}, 'end': {'month': 4, 'day': None, 'year': 2014}}, 'role': 'Student Ambassador', 'company': {'id': None, 'name': 'Google', 'logo': 'https://media.licdn.com/dms/image/C4D0BAQHiNSL4Or29cg/company-logo_400_400/0/1519856215226?e=1700697600&v=beta&t=J9ZwRSZnZlBISDQCRp4JiThViE6opp_o6iyirV7HgFY', 'url': 'https://www.linkedin.com/company/google/'}, 'cause': 'EDUCATION', 'description': '• Representing Google company in Cairo University and Egypt.\n• Coordinating for all events made by Google at Cairo University.\n• Connecting to Google and students and all educational circle.\n• Collaborating with other ambassadors from Middle-East and North-Africa.\n• Illustrating the new apps which provide it Google in addition to innovating steps towards new technologies.'}, {'date': {'start': {'month': 12, 'day': None, 'year': 2012}, 'end': {'month': None, 'day': None, 'year': None}}, 'role': 'Translation Contributor ', 'company': {'id': None, 'name': 'Twitter', 'logo': 'https://media.licdn.com/dms/image/D560BAQEJZABhJ-eE0g/company-logo_400_400/0/1690242316938?e=1700697600&v=beta&t=dMxdH9vsYbXJhyrqyQs2IFqvcIFxKmzIQDmmimJ9VtU', 'url': 'https://www.linkedin.com/company/twitter/'}, 'cause': 'SCIENCE_AND_TECHNOLOGY', 'description': '• Translating English contexts and content into Arabic.\n• Evaluating and voting on the approved translations by other Arabic Translators.\n• Voting on MENA Profiles to get twitter verified Badges.\n• Translating Docs,letter,contracts,apps web, ..etc into Arabic.\n• Reporting fake, misused and impersonated twitter accounts.'}, {'date': {'start': {'month': 2, 'day': None, 'year': 2016}, 'end': {'month': None, 'day': None, 'year': None}}, 'role': 'Translation Contributor', 'company': {'id': None, 'name': 'Meta', 'logo': 'https://media.licdn.com/dms/image/C4E0BAQFdNatYGiBelg/company-logo_400_400/0/1636138753911?e=1700697600&v=beta&t=o60_o61Hzq6SGAYalJSkUh3J8cHVkVbE7sip7dn1Wc8', 'url': 'https://www.linkedin.com/company/meta/'}, 'cause': 'SCIENCE_AND_TECHNOLOGY', 'description': '• Translating English contexts into Arabic.\n• Evaluating and voting on the approved translations by other Arabic Translators.\n• Proofreading the Arabic contexts spelling and grammar.'}, {'date': {'start': {'month': 2, 'day': None, 'year': 2016}, 'end': {'month': None, 'day': None, 'year': None}}, 'role': 'Translation Contributor', 'company': {'id': None, 'name': 'Google', 'logo': 'https://media.licdn.com/dms/image/C4D0BAQHiNSL4Or29cg/company-logo_400_400/0/1519856215226?e=1700697600&v=beta&t=J9ZwRSZnZlBISDQCRp4JiThViE6opp_o6iyirV7HgFY', 'url': 'https://www.linkedin.com/company/google/'}, 'cause': 'SCIENCE_AND_TECHNOLOGY', 'description': '• Contribute to improving the quality of Google Translate and its advanced uses.\n• Translating English contexts into Arabic.\n• Evaluating and voting on the approved translations by other Arabic Translators.\n• Proofreading the Arabic contexts spelling and grammar.'}, {'date': {'start': {'month': 12, 'day': None, 'year': 2013}, 'end': {'month': 2, 'day': None, 'year': 2015}}, 'role': 'Curator', 'company': {'id': None, 'name': 'Startup Genome', 'logo': 'https://media.licdn.com/dms/image/C560BAQFUkAvghtC9dQ/company-logo_400_400/0/1555611944968?e=1700697600&v=beta&t=2ZzhOcqvLmAM3goKUCOIG-DJ1XU2iGJkrEHQmGzuaq4', 'url': 'https://www.linkedin.com/company/startupgenome/'}, 'cause': 'SOCIAL_SERVICES', 'description': ""• Keep our community's map of start-ups up-to-date.\n• Listing all start-ups and SMEs in both cities.\n• Mapping all entrepreneurial entities in both cities.\n• Recruit other local community builders to help my curate.\n• Promote my map with both cities: Cairo and Giza.""}, {'date': {'start': {'month': 10, 'day': None, 'year': 2010}, 'end': {'month': 6, 'day': None, 'year': 2012}}, 'role': 'IGCDP Member', 'company': {'id': None, 'name': 'AIESEC', 'logo': 'https://media.licdn.com/dms/image/C4E0BAQFNIFKL5h461A/company-logo_400_400/0/1628881223590?e=1700697600&v=beta&t=N9_Qw7UxPSG6gy1Yq3mVPyLeyST4NTtfmgkHToRAB54', 'url': 'https://www.linkedin.com/company/aiesec/'}, 'cause': None, 'description': '- Participating in events.\n- Creating press releases.\n- Guiding new AIESECers in Egypt.\n'}, {'date': {'start': {'month': 6, 'day': None, 'year': 2013}, 'end': {'month': 1, 'day': None, 'year': 2015}}, 'role': 'Gangster', 'company': {'id': None, 'name': 'makesense', 'logo': 'https://media.licdn.com/dms/image/D4E0BAQFudsQ3JpA6GA/company-logo_400_400/0/1663660096815?e=1700697600&v=beta&t=iBv-0c-MAn4Ny1EnHbgBeCTwKEgGTyAWUT01oDqz5Wo', 'url': 'https://www.linkedin.com/company/makesense/'}, 'cause': 'SOCIAL_SERVICES', 'description': '• Expanding the scale of MakeSense movement in Egypt and MENA.\n• Gangster in taking the challenges and solving them. \n• Helping in creating the tools, figuring out the answers and solutions to Startups.\n• Participating in boosting the impact of social entrepreneurs by connecting them with supercool individuals and enabling them to take up the challenges. In addition, and in order to sustain their social impact, we promote the concept of social business.'}, {'date': {'start': {'month': 10, 'day': None, 'year': 2009}, 'end': {'month': 4, 'day': None, 'year': 2010}}, 'role': 'Vice Head of PR', 'company': {'id': None, 'name': 'Our Vision', 'logo': None, 'url': None}, 'cause': None, 'description': 'the first challenge for me to face new circles and create the basic step in my independent career so I had the opportunity to be responsible for PR Committee for 6 months and be the assistant of committee head in all roles such as: commanding of ushering ,Media following , planning of segments , the internal and external  relations for module inside Cairo University ,recruiting new members , , getting the media coverage and VIP characters to attend the official ceremonies whether in the university or outside.'}, {'date': {'start': {'month': 10, 'day': None, 'year': 2010}, 'end': {'month': 5, 'day': None, 'year': 2011}}, 'role': 'Head of Marketing & PR', 'company': {'id': None, 'name': 'ABC', 'logo': None, 'url': None}, 'cause': 'ECONOMIC_EMPOWERMENT', 'description': 'I had the opportunity to be responsible for MPR Committee for 6 months and be commanding of ushering ,Media following , planning of segments , the internal relations for module inside cairo university ,recruiting new members , interviewer , practise new team of members to learn its role and take the lead after , getting the media coverage and VIP characters to attend the official ceremonies whether in the university or outside. '}]","['Paid Social Media Advertising', 'Online Marketing', 'Social Media Marketing', 'Pay Per Click (PPC)', 'Facebook Marketing', 'Twitter Ads', 'Instagram Advertising', 'Online Advertising', 'Media Buying', 'Google Ads', 'Customer Acquisition', 'Customer Retention', 'Content Strategy', 'Digital Strategy', 'Google Analytics', 'Twitter Marketing', 'Marketing', 'Social Media Analytics', 'Brand Building', 'Microsoft Office']",,,
