profile_id,first_name,last_name,sub_title,profile_picture,background_image,profile_type,entity_urn,object_urn,birth_date,summary,location,premium,influencer,treasury_media,languages,industry,education,patents,awards,certifications,organizations,projects,publications,courses,test_scores,position_groups,volunteer_experiences,skills,network_info,related_profiles,contact_info
mariahorvath19790401,Maria,Horvath,Senior Business Development Manager,https://media.licdn.com/dms/image/C4D03AQE6zF2Brb1RCg/profile-displayphoto-shrink_800_800/0/1641209209103?e=1697673600&v=beta&t=k75dIR1IUyoxwrGPAw8M8s0UqFAODCl2SPYPlrn9yKg,https://media.licdn.com/dms/image/C4D16AQHMMwo2QyyJRA/profile-displaybackgroundimage-shrink_350_1400/0/1641209506689?e=1697673600&v=beta&t=StJD84qyZbj41E2S0Rw-wegnUliMo7gQ9BAdhBKtTzc,personal,ACoAAAMSyP8BCat2OC-DRSAzX61juWd9qkJ-TKM,51562751,,"I'm a passionate and driven woman. 
I’m curious and open-minded. 
I love Mozart. And at the same time The Queen and André Hazes. 
I’m a fan of IT gadgets and innovations as well as of psychology. 
And I like soccer. 
I've climbed the career ladder and I reached heights with hard work, of which I'm proud. I'm a loyal professional with a broad range of experiences in business development and general management. I’m exceptional in sales, negotiation, consulting and in coaching. 
I lived already in 4 countries, so I speak various languages and I’m familiar with different cultures as well. 
The last 2 years I spent at home with my baby daughter and now off to a fresh new start.","{'country': 'Netherlands', 'short': 'Tilburg, North Brabant', 'city': 'Tilburg', 'state': 'North Brabant', 'default': 'Tilburg, North Brabant, Netherlands'}",False,False,[],"{'primary_locale': {'country': 'US', 'language': 'en'}, 'supported_locales': [{'country': 'US', 'language': 'en'}], 'profile_languages': [{'name': 'English', 'proficiency': 'FULL_PROFESSIONAL'}, {'name': 'Hungarian', 'proficiency': 'NATIVE_OR_BILINGUAL'}, {'name': 'Portuguese', 'proficiency': 'ELEMENTARY'}, {'name': 'Russian', 'proficiency': 'ELEMENTARY'}, {'name': 'Spanish', 'proficiency': 'FULL_PROFESSIONAL'}]}",Information Technology & Services,"[{'date': {'start': {'month': None, 'day': None, 'year': 1999}, 'end': {'month': None, 'day': None, 'year': 2004}}, 'school': {'name': 'Eötvös Loránd University', 'logo': 'https://media.licdn.com/dms/image/D4D0BAQHxEjuJ-Jkxbg/company-logo_400_400/0/1687438432441?e=1700697600&v=beta&t=CpiuF4dG0Ds-FuS0jGn8C0OEVZW6NKVlWZaKwqZ25U4', 'url': 'https://www.linkedin.com/school/eotvos-lorand-university-/'}, 'degree_name': ""Master's degree"", 'field_of_study': 'MA Studies: Faculty of Education and Psychology; Faculty of Humanities'}, {'date': {'start': {'month': None, 'day': None, 'year': None}, 'end': {'month': None, 'day': None, 'year': None}}, 'school': {'name': 'Dale Carnegie Training Centre', 'logo': None, 'url': None}, 'degree_name': '2013', 'field_of_study': 'Presentation Effectiveness Master Course'}, {'date': {'start': {'month': None, 'day': None, 'year': None}, 'end': {'month': None, 'day': None, 'year': None}}, 'school': {'name': 'Dale Carnegie Training Centre', 'logo': None, 'url': None}, 'degree_name': '2011', 'field_of_study': 'Sales Seminar'}, {'date': {'start': {'month': None, 'day': None, 'year': None}, 'end': {'month': None, 'day': None, 'year': None}}, 'school': {'name': 'Kanoa Training Centre', 'logo': None, 'url': None}, 'degree_name': '2008', 'field_of_study': 'Presentation Techniques Course'}, {'date': {'start': {'month': None, 'day': None, 'year': None}, 'end': {'month': None, 'day': None, 'year': None}}, 'school': {'name': 'Oracle', 'logo': None, 'url': None}, 'degree_name': '2008', 'field_of_study': 'Partner Induction Bootcamp I., II. (Competitive Analysis Workshop)'}]",[],[],[],[],[],[],[],[],"[{'company': {'id': 393845, 'name': 'Studyportals', 'logo': 'https://media.licdn.com/dms/image/C4D0BAQGrvoOjPCFoGw/company-logo_400_400/0/1630502060928?e=1700697600&v=beta&t=UCQaiYkyIs9rzisafUG3O1hg4kQVFJ05g-aADM1vKNc', 'url': 'https://www.linkedin.com/company/studyportals/', 'employees': {'start': 201, 'end': 500}}, 'date': {'start': {'month': 7, 'day': None, 'year': 2018}, 'end': {'month': 6, 'day': None, 'year': 2020}}, 'profile_positions': [{'location': None, 'date': {'start': {'month': 1, 'day': None, 'year': 2019}, 'end': {'month': 6, 'day': None, 'year': 2020}}, 'company': 'Studyportals', 'description': ""I'm responsible for the business development of the Higher Education market within the EMEA region, supporting the internationalization of public and private Universities, helping them to find the best candidates for their English-taught programs.\nMy goal is to listen to my clients, to understand their needs, to consult their upcoming plans for internationalization, to give them support in strategic business planning, in one word:\nto create a valuable PARTNERSHIP that is mutually beneficial and is efficient in the long-run and also helps students to find their best option to be able to study abroad, start their adult life, opening up the door to the world for them."", 'title': 'Senior Business Developer, Strategic Partnerships, EMEA', 'employment_type': None}, {'location': 'Eindhoven Area, Netherlands', 'date': {'start': {'month': 7, 'day': None, 'year': 2018}, 'end': {'month': 12, 'day': None, 'year': 2018}}, 'company': 'Studyportals', 'description': None, 'title': 'Business Development Manager', 'employment_type': None}]}, {'company': {'id': 5076480, 'name': 'BenQ Europe', 'logo': 'https://media.licdn.com/dms/image/C4D0BAQGJkmn8tor18A/company-logo_400_400/0/1627887496163?e=1700697600&v=beta&t=1bM95z5KJYKsGRZy3iUy7L1LxAqW04mHTxpRk97ndls', 'url': 'https://www.linkedin.com/company/benq-europe/', 'employees': {'start': 201, 'end': 500}}, 'date': {'start': {'month': 3, 'day': None, 'year': 2017}, 'end': {'month': 6, 'day': None, 'year': 2018}}, 'profile_positions': [{'location': 'Eindhoven Area, Netherlands', 'date': {'start': {'month': 3, 'day': None, 'year': 2017}, 'end': {'month': 6, 'day': None, 'year': 2018}}, 'company': 'BenQ Europe Corporate', 'description': 'BenQ is a world-leading IT, human technology and solutions provider. \nAs a Contact Centre Management Specialist at the European HQ, besides the classical CC management daily tasks I’m responsible for: \n- ‘Voice of Customer’ project management: strategy for communication on public forums \n- Chat development project: language distribution, quality control\n- Website communication development\n- Procedure development: management of CC procedures, efficiency, quality check \n- Communication training: development for Agents', 'title': 'Contact Centre Management Specialist', 'employment_type': None}]}, {'company': {'id': 2479861, 'name': 'Opticnet Hungary Egyesülés', 'logo': 'https://media.licdn.com/dms/image/C560BAQE9TSrhPpAgAg/company-logo_400_400/0/1519893974471?e=1700697600&v=beta&t=2i2GZdzk-0FELHN6TnFEUg6FeuYVqs_6K4Gouluyz0A', 'url': 'https://www.linkedin.com/company/opticnet-hungary-egyes-l-s/', 'employees': {'start': 2, 'end': 10}}, 'date': {'start': {'month': 6, 'day': None, 'year': 2013}, 'end': {'month': 6, 'day': None, 'year': 2015}}, 'profile_positions': [{'location': 'Budapest', 'date': {'start': {'month': 6, 'day': None, 'year': 2013}, 'end': {'month': 6, 'day': None, 'year': 2015}}, 'company': 'Opticnet Hungary Egyesülés', 'description': 'Opticnet Hungary is the biggest Hungarian optical chain consisting of 110 private-owned optical shops in the country. \nIt offers to its members: \na.) marketing services \nb.) (as a buying group) the best supplying conditions on the Hungarian optical market \nc.) professional trainings (commerce/sales, leadership). \nKey achievements:\n- develop and grow a franchise from a group of VIP partners\n- creating a new strategy for brand building campaign (also of our private label contact lenses)\n- expanding Opticnet in the EU: new partner members in Croatia \n- new partner members joining our company\n- negotiated better buying conditions from our suppliers: higher turnover in frame and contact lens sales', 'title': 'Company Director', 'employment_type': None}]}, {'company': {'id': None, 'name': 'OpticPro Magyarország Ltd.', 'logo': None, 'url': None, 'employees': {'start': None, 'end': None}}, 'date': {'start': {'month': 6, 'day': None, 'year': 2013}, 'end': {'month': 6, 'day': None, 'year': 2015}}, 'profile_positions': [{'location': 'Budapest', 'date': {'start': {'month': 6, 'day': None, 'year': 2013}, 'end': {'month': 6, 'day': None, 'year': 2015}}, 'company': 'OpticPro Magyarország Ltd.', 'description': 'OpticPro Ltd. is the subsidiary of Opticnet Hungary (and Hoya Lens Hungary), it’s a frame, sunglasses and contact lens distributor. \nKey achievements:\n- lead OpticPro onto the Hungarian market (instead of being only a “home supplier” for Opticnet)\n- production of private label frames\n- special cooperation with a world leader contact lens manufacturer: best prices on the market for branded products', 'title': 'Managing Director', 'employment_type': None}]}, {'company': {'id': 15884, 'name': 'Hoya', 'logo': 'https://media.licdn.com/dms/image/C4E0BAQFUItOjzRNIJQ/company-logo_400_400/0/1519856357193?e=1700697600&v=beta&t=y6RwGiYN6b1R6FTmnEEwZuba5Vs_7sOR0fBBphZBGow', 'url': 'https://www.linkedin.com/company/hoya/', 'employees': {'start': 10001, 'end': None}}, 'date': {'start': {'month': 6, 'day': None, 'year': 2010}, 'end': {'month': 6, 'day': None, 'year': 2013}}, 'profile_positions': [{'location': 'Hungary', 'date': {'start': {'month': 6, 'day': None, 'year': 2010}, 'end': {'month': 6, 'day': None, 'year': 2013}}, 'company': 'Hoya', 'description': 'Hoya Lens is the world’s leading manufacturer and distributor of ophthalmic lenses for spectacles.\nAs an Account Manager I worked on the sales of lenses, ophthalmic and optical diagnostic systems in the North-East region of Hungary. I was responsible for a region of 400 M HUF (1,3 M EUR).\nKey achievements:\n- I became the „Country Champion” with achievements of 134% in sales (European Sales Competition in 2012/2013) and I reached rank 9 between the European account managers\n- after 3 years I was promoted to be the Company Director of Opticnet and Managing Director of OpticPro (subsidiaries of Hoya Lens)', 'title': 'Account Manager (North-East of Hungary)', 'employment_type': None}]}, {'company': {'id': 2991069, 'name': 'Nextent Informatics Co.', 'logo': 'https://media.licdn.com/dms/image/C4E0BAQHN-_KwZ5JpZQ/company-logo_400_400/0/1519896651093?e=1700697600&v=beta&t=Kv15DeVBU_dcwQ_WKlB8kgxZQ8yAFyt_IbguQ1w8WMM', 'url': 'https://www.linkedin.com/company/nextent-informatika/', 'employees': {'start': 51, 'end': 200}}, 'date': {'start': {'month': 12, 'day': None, 'year': 2007}, 'end': {'month': 3, 'day': None, 'year': 2010}}, 'profile_positions': [{'location': 'Budapest, Hungary', 'date': {'start': {'month': 12, 'day': None, 'year': 2007}, 'end': {'month': 3, 'day': None, 'year': 2010}}, 'company': 'Nextent Informatics Co.', 'description': 'Nextent is an IT developer company creating and developing unique IT solutions for enterprises in the Telecommunication, Financial, Pharmeceutical industry. \nMain tasks:\n- selling IT solutions, such as \n• VoiceMinerTM: a special data mining system that could elaborate and distinguish emotions according to the voice tone\n• Pharma BI: a reporting system containing up-to-date database of OTC and RX data. \nMain partners:\n- Telenor Hungary, Generali Group Co.', 'title': 'Business development manager', 'employment_type': None}]}, {'company': {'id': None, 'name': 'metacom holding', 'logo': None, 'url': None, 'employees': {'start': None, 'end': None}}, 'date': {'start': {'month': 1, 'day': None, 'year': 2007}, 'end': {'month': 10, 'day': None, 'year': 2007}}, 'profile_positions': [{'location': 'Budapest, Hungary', 'date': {'start': {'month': 1, 'day': None, 'year': 2007}, 'end': {'month': 10, 'day': None, 'year': 2007}}, 'company': 'metacom holding', 'description': 'Metacom Holding is working on R&D and sales of products/services, based on GSM non-voice and other wireless telecommunication technologies. \nKey achievements:   \n• sales of our own developed GPS tracking system\n• sales of wireless advertisement tools (Nokia marketing campaign)', 'title': 'Project manager', 'employment_type': None}]}, {'company': {'id': 2991094, 'name': 'LSK Hungaria Ltd.', 'logo': 'https://media.licdn.com/dms/image/C4E0BAQE5vklZkGK9aw/company-logo_400_400/0/1519895826324?e=1700697600&v=beta&t=IS11CmxnUgxfj4-cIFI38Lk9VVbMo37fGdjB6l1FuVo', 'url': 'https://www.linkedin.com/company/lsk-hung-ria-kft-/', 'employees': {'start': 11, 'end': 50}}, 'date': {'start': {'month': 9, 'day': None, 'year': 2004}, 'end': {'month': 9, 'day': None, 'year': 2006}}, 'profile_positions': [{'location': 'Budapest, Hungary', 'date': {'start': {'month': 9, 'day': None, 'year': 2004}, 'end': {'month': 9, 'day': None, 'year': 2006}}, 'company': 'LSK Hungaria Ltd.', 'description': 'LSK is a Hungarian Distribution Company of visual technology products and solutions. I started as an assistant and quickly became a valued team member. My main tasks were to find B2B partners for products and solution distribution and to introduce the interactive whiteboards to the Hungarian market.\nMain Partners: \n• Projecta B.V. (Weert, The Netherlands): projection screens\n• InFocus (USA, EU Headquarter in Amsterdam, The Netherlands): digital projectors\n• SMART Technologies Co. (Canada): interactive whiteboards', 'title': 'Key account manager', 'employment_type': None}]}]",[],"['General Management', 'Business Planning', 'Business Development', 'Business Strategy', 'Negotiation', 'Optics', 'Lenses', 'Contact Lenses', 'IT Management', 'Oracle Database', 'Competitive Analysis', 'Foreign Languages', 'CRM', 'Management', 'Sales', 'Strategic Planning', 'Sales Management', 'Strategy', 'Account Management', 'Business-to-Business (B2B)']",,,
