profile_id,first_name,last_name,sub_title,profile_picture,background_image,profile_type,entity_urn,object_urn,birth_date,summary,location,premium,influencer,treasury_media,languages,industry,education,patents,awards,certifications,organizations,projects,publications,courses,test_scores,position_groups,volunteer_experiences,skills,network_info,related_profiles,contact_info
saskia-van-den-brande-graus-75a1b671,Saskia,van den Brande-Graus,KS&I Inkomstenbelasting bij Belastingdienst,https://media.licdn.com/dms/image/C4E03AQG8lHHgWO8xLg/profile-displayphoto-shrink_800_800/0/1516430134747?e=1697673600&v=beta&t=AjBTBk5dkfhbM5uhMpmntFC-9Imuqr0xillVIHuf-HU,,personal,ACoAAA8oQ7YBrU2vOiAypgLQOnaLhI4aUwicGmQ,254297014,,"Ook al ben ik 55 jaar en de meeste mensen denken aan wat minder te werken, ben ik juist op zoek naar meer uitdaging.
Ben zeer gestructureerd en accuraat in het werk, want dan kun je alles beter en snel terug vinden, denk aan alles goed labellen, alles in de aangemaakte  mappen opbergen, etc . Bij mijn huidige baan heb ik alle producten in dozen, op volgorde van maat en kleur opgeruimd en gelabeld, zodat het zoeken sneller kon worden uitgevoerd.
Graag hou ik  overzicht over het deel waar ik in werk, aangezien ik snel de fouten wil ontdekken en het  verbeteren. 

 Verder probeer ik iedereen te behandelen, zoals ik behandeld zou willen worden. Representatief, probeer er altijd goed uit te zien en klantvriendelijk, probeer altijd een glimlach te creëren.
Ben zeker een doorzetter, wat ik gelukkig aan mijn kinderen heb doorgegeven. Ondanks tegenslagen,  ben ik doorgegaan en sterker geworden. 

Mocht u nog vragen hebben, ben ik altijd bereid om die toe te lichten.","{'country': 'Netherlands', 'short': 'Tilburg, North Brabant', 'city': 'Tilburg', 'state': 'North Brabant', 'default': 'Tilburg, North Brabant, Netherlands'}",False,False,[],"{'primary_locale': {'country': 'NL', 'language': 'nl'}, 'supported_locales': [{'country': 'NL', 'language': 'nl'}], 'profile_languages': [{'name': 'Native Spaans', 'proficiency': None}]}",Government Administration,"[{'date': {'start': {'month': None, 'day': None, 'year': None}, 'end': {'month': None, 'day': None, 'year': None}}, 'school': {'name': 'MEAO, Secretaresse diploma Andorra, Janer Andorra, Koningshof', 'logo': None, 'url': None}, 'degree_name': None, 'field_of_study': None}]",[],[],[],[],[],[],[],[],"[{'company': {'id': 162682, 'name': 'Belastingdienst', 'logo': 'https://media.licdn.com/dms/image/D4E0BAQGIDOnwZ05VDQ/company-logo_400_400/0/1691398244132?e=1700697600&v=beta&t=ed3RTzMQBJyHzQl8nUWJgL_KyoyTt5QaRVUTKCg0P6o', 'url': 'https://www.linkedin.com/company/belastingdienst/', 'employees': {'start': 10001, 'end': None}}, 'date': {'start': {'month': 4, 'day': None, 'year': 2018}, 'end': {'month': None, 'day': None, 'year': None}}, 'profile_positions': [{'location': 'Eindhoven', 'date': {'start': {'month': 4, 'day': None, 'year': 2018}, 'end': {'month': None, 'day': None, 'year': None}}, 'company': 'Belastingdienst', 'description': 'Alle klanten fiscaal helpen als tweede lijn bij de Inkomstenbelasting.', 'title': 'KS&I Inkomstenbelasting', 'employment_type': None}]}, {'company': {'id': 1048887, 'name': 'HOBIJ Pioneers at Work', 'logo': 'https://media.licdn.com/dms/image/C4E0BAQFfoNJKKbc98g/company-logo_400_400/0/1680087275755?e=1700697600&v=beta&t=Wm9I9LdivZcXOYrICxFtyEsPy8GTbxg7HIq57_oSs6k', 'url': 'https://www.linkedin.com/company/hobij/', 'employees': {'start': 1001, 'end': 5000}}, 'date': {'start': {'month': 10, 'day': None, 'year': 2017}, 'end': {'month': 4, 'day': None, 'year': 2018}}, 'profile_positions': [{'location': 'Waalwijk en Veghel', 'date': {'start': {'month': 10, 'day': None, 'year': 2017}, 'end': {'month': 4, 'day': None, 'year': 2018}}, 'company': 'HOBIJ', 'description': 'Contracten in orde maken en alles wat daarbij komt voor de flexwerkers.', 'title': 'Administratief medewerker', 'employment_type': None}]}, {'company': {'id': None, 'name': 'Beenmode.nl', 'logo': None, 'url': None, 'employees': {'start': None, 'end': None}}, 'date': {'start': {'month': 9, 'day': None, 'year': 2015}, 'end': {'month': 9, 'day': None, 'year': 2017}}, 'profile_positions': [{'location': 'Haaren', 'date': {'start': {'month': 9, 'day': None, 'year': 2015}, 'end': {'month': 9, 'day': None, 'year': 2017}}, 'company': 'Beenmode.nl', 'description': None, 'title': 'verkoop administratief', 'employment_type': None}]}, {'company': {'id': None, 'name': 'Cargo Control en Platinum', 'logo': None, 'url': None, 'employees': {'start': None, 'end': None}}, 'date': {'start': {'month': None, 'day': None, 'year': 2009}, 'end': {'month': None, 'day': None, 'year': 2012}}, 'profile_positions': [{'location': 'Goirle', 'date': {'start': {'month': None, 'day': None, 'year': 2009}, 'end': {'month': None, 'day': None, 'year': 2012}}, 'company': 'Cargo Control en Platinum', 'description': 'Algemene boekhouding, telefoon aannemen, mail beantwoorden, inkoop, verkoop, voorraad beheer,\nkas bijhouden', 'title': 'Administratief secretaresse', 'employment_type': None}]}, {'company': {'id': 239801, 'name': 'Wijdeven', 'logo': 'https://media.licdn.com/dms/image/C560BAQE5QoUsPR5OmA/company-logo_400_400/0/1528095907250?e=1700697600&v=beta&t=vnBm0clRsmjqEv5sSRKpft3oRkYufTx2iwzTQ3tDbB8', 'url': 'https://www.linkedin.com/company/kukwijdeven/', 'employees': {'start': 51, 'end': 200}}, 'date': {'start': {'month': None, 'day': None, 'year': 2001}, 'end': {'month': None, 'day': None, 'year': 2009}}, 'profile_positions': [{'location': 'Oirschot', 'date': {'start': {'month': None, 'day': None, 'year': 2001}, 'end': {'month': None, 'day': None, 'year': 2009}}, 'company': 'Wijdeven', 'description': 'Controleren van de inkooporder met de factuur en het inboeken ervan.\nKas bijhouden', 'title': 'Crediteurenadministratie', 'employment_type': None}]}, {'company': {'id': None, 'name': 'Wijdeven Transformatoren', 'logo': None, 'url': None, 'employees': {'start': None, 'end': None}}, 'date': {'start': {'month': None, 'day': None, 'year': 2001}, 'end': {'month': None, 'day': None, 'year': 2009}}, 'profile_positions': [{'location': None, 'date': {'start': {'month': None, 'day': None, 'year': 2001}, 'end': {'month': None, 'day': None, 'year': 2009}}, 'company': 'Wijdeven Transformatoren', 'description': None, 'title': 'Crediteurenadministratie', 'employment_type': None}]}, {'company': {'id': None, 'name': 'Graus Transformatoren b.v.', 'logo': None, 'url': None, 'employees': {'start': None, 'end': None}}, 'date': {'start': {'month': None, 'day': None, 'year': 1987}, 'end': {'month': None, 'day': None, 'year': 2001}}, 'profile_positions': [{'location': 'Hilvarenbeek', 'date': {'start': {'month': None, 'day': None, 'year': 1987}, 'end': {'month': None, 'day': None, 'year': 2001}}, 'company': 'Graus Transformatoren b.v.', 'description': 'Algemene boekhouding, debiteuren, crediteuren, kas, bank ,salarisadministratie\nTelefoon aannemen en doorverbinden', 'title': 'Secretaresse, financieel administratie', 'employment_type': None}]}]","[{'date': {'start': {'month': None, 'day': None, 'year': None}, 'end': {'month': None, 'day': None, 'year': None}}, 'role': 'receptioniste', 'company': {'id': None, 'name': 'Clossenborgh', 'logo': None, 'url': None}, 'cause': 'SOCIAL_SERVICES', 'description': 'Een half jaar receptioniste geweest bij de Clossenborgh, vond het leuk werk.\nVooral een praatje kunnen maken met mensen, die vaak eenzaam zijn.'}]","['Customer Service', 'Microsoft Office', 'Management', 'Microsoft Excel', 'Microsoft Word', 'Strategic Planning', 'Project Management', 'Team Building', 'Sales', 'Leadership', 'Operations Management', 'PowerPoint']",,,
