profile_id,first_name,last_name,sub_title,profile_picture,background_image,profile_type,entity_urn,object_urn,birth_date,summary,location,premium,influencer,treasury_media,languages,industry,education,patents,awards,certifications,organizations,projects,publications,courses,test_scores,position_groups,volunteer_experiences,skills,network_info,related_profiles,contact_info
marco-ferrario-622435,Marco,Ferrario,Social Entrepreneur. Co-Founder at mHS CITY LAB,https://media.licdn.com/dms/image/C5603AQHzWPLTTKpcwA/profile-displayphoto-shrink_800_800/0/1578580470736?e=1697673600&v=beta&t=BtnLYcnEvcwbJOdQLzLHcgdiZA6HpK5fSqwVRQT0N2o,,personal,ACoAAAAQSDoB4-ePc93f4q28PfXePBKyFC7ffh4,1067066,,"https://web.neev.cloud/
""Organize and digitalize the world’s housing and sanitation construction information and make it universally accessible and easy to use"". This is the ambitious mission that I've been leading since the past four years at mHS! We do believe in the critical role that access to construction technical inputs could play for low-income communities to improve quality and safety (resilience) of buildings! CTA (Construction Technical Assistance) leads also to better financial planning, maintenance, retrofitting and reconstruction practices. For our project we adopt digital and mobile connected platforms to bridge the gap between professionals and low-income communities to bring customized technical input at scale in a way never explored before. Look at our digital tool NEEV at thttps://web.neev.cloud/
[Thanks to our supporter: CISCO USA, Access, SVAM International, NASSCOM]

NEEV is a B2B digital platform that gives simple, efficient and expert housing solutions for end-users and agencies  offering housing products. Designed to make technical constructional information more accessible, it hopes to facilitate transparent and trustworthy relationships between homeowners and financial institutions.

","{'country': None, 'short': 'Netherlands', 'city': None, 'state': None, 'default': 'Netherlands'}",True,False,"[{'url': None, 'title': 'Building Date Made Simple', 'description': 'Organize and digitalize the world’s housing and sanitation construction information\xa0to make it universally accessible and easy to use.', 'image': None}, {'url': None, 'title': 'Inclusive Design: Right to safe and affordable housing for low income communities', 'description': 'My talk trying to explain what we have been working on at mHS, still so relevant after two more years of work! Still working for the same vision and goal, some great partners onboard to support us!', 'image': None}]","{'primary_locale': {'country': 'US', 'language': 'en'}, 'supported_locales': [{'country': 'US', 'language': 'en'}], 'profile_languages': [{'name': 'English', 'proficiency': 'FULL_PROFESSIONAL'}, {'name': 'French', 'proficiency': 'ELEMENTARY'}, {'name': 'Italian', 'proficiency': 'NATIVE_OR_BILINGUAL'}]}",Non-profit Organization Management,"[{'date': {'start': {'month': None, 'day': None, 'year': 1996}, 'end': {'month': None, 'day': None, 'year': 2002}}, 'school': {'name': 'Politecnico di Milano', 'logo': 'https://media.licdn.com/dms/image/C560BAQGRQliQAbXOSQ/company-logo_400_400/0/1519878058613?e=1700697600&v=beta&t=8alk6M3bMHLZ7xiE5GRKM0tLmTJ32YgKsIlwpSvhUBY', 'url': 'https://www.linkedin.com/school/polimi/'}, 'degree_name': 'Master Degree', 'field_of_study': 'Architectural, Urban Planning'}]",[],[],"[{'name': 'Abilitation to Profession of Architect and Urban Designer', 'date': {'start': {'month': 1, 'day': None, 'year': 2003}, 'end': {'month': None, 'day': None, 'year': None}}, 'authority': 'Government of Italy', 'url': None, 'license_number': None, 'display_source': None, 'company': None}, {'name': 'edX Honor Code Certificate for Justice', 'date': {'start': {'month': None, 'day': None, 'year': None}, 'end': {'month': None, 'day': None, 'year': None}}, 'authority': 'edX', 'url': 'https://s3.amazonaws.com/verify.edx.org/downloads/2662e42b127249e3842ba0b669d5427b/Certificate.pdf', 'license_number': None, 'display_source': None, 'company': {'id': None, 'name': 'edX', 'logo': 'https://media.licdn.com/dms/image/D4E0BAQFG13a41008Dg/company-logo_400_400/0/1688142646058?e=1700697600&v=beta&t=uVp_ufik30GkEu6GtXtW5PsA8ZvYAvrrlPO54QVEYjQ', 'url': None}}]",[],[],"[{'name': 'Universitas Forum', 'publisher': None, 'url': None, 'date': {'month': None, 'day': None, 'year': None}, 'authors': [{'type': 'standardizedContributor', 'first_name': 'Marco', 'last_name': 'Ferrario', 'name': None, 'headline': 'Social Entrepreneur. Co-Founder at mHS CITY LAB'}, {'type': 'standardizedContributor', 'first_name': 'Rakhi', 'last_name': 'Mehra', 'name': None, 'headline': 'Passionate and driven social entrepreneur from India. Eager for a new role/ challenge at the nexus of education, innovation, entrepreneurship for climate action & social impact.'}, {'type': 'standardizedContributor', 'first_name': 'Mukta', 'last_name': 'Naik', 'name': None, 'headline': 'Fellow at Centre for Policy Research'}, {'type': 'standardizedContributor', 'first_name': 'Gregory', 'last_name': 'Randolph', 'name': None, 'headline': 'Scholar, writer, policy specialist | gregoryrandolph.net'}]}]",[],[],"[{'company': {'id': None, 'name': 'Stichting mHS Global Impact', 'logo': None, 'url': None, 'employees': {'start': None, 'end': None}}, 'date': {'start': {'month': 3, 'day': None, 'year': 2020}, 'end': {'month': None, 'day': None, 'year': None}}, 'profile_positions': [{'location': 'Amsterdam Area', 'date': {'start': {'month': 3, 'day': None, 'year': 2020}, 'end': {'month': None, 'day': None, 'year': None}}, 'company': 'Stichting mHS Global Impact', 'description': None, 'title': 'Co-Founder, Director', 'employment_type': 'Full-time'}]}, {'company': {'id': 13217094, 'name': 'mHS CITY LAB', 'logo': 'https://media.licdn.com/dms/image/C4D0BAQE3-tJM2tXybg/company-logo_400_400/0/1519921994648?e=1700697600&v=beta&t=mwjOn_QZqhJq0TKtcgM0TFP-z0NthTrBLENxE1z35Lg', 'url': 'https://www.linkedin.com/company/mhs-city-lab/', 'employees': {'start': 2, 'end': 10}}, 'date': {'start': {'month': 3, 'day': None, 'year': 2009}, 'end': {'month': None, 'day': None, 'year': None}}, 'profile_positions': [{'location': None, 'date': {'start': {'month': 3, 'day': None, 'year': 2009}, 'end': {'month': None, 'day': None, 'year': None}}, 'company': 'mHS CITY LAB', 'description': 'mHS CITY LAB is an interdisciplinary social venture working towards the creation of socially inclusive and resilient cities.\nWith the ongoing rapid urbanisation, informal settlements are offering affordable housing to millions in Indian cities today, including new migrants looking for livelihood opportunities in urban centers. \nApart from the lack of basic services, these settlements suffer from poor quality construction which is often seismically unsafe. \nSince its inception in 2009, mHS has been designing projects and services to catalyze the incremental construction in these settlements. A particular focus is on how to provide access to technical assistance to people engaging in incremental housing to make these communities more resilient to climate change and natural hazards.', 'title': 'Co-Founder, Director', 'employment_type': None}]}, {'company': {'id': None, 'name': 'architectural offices', 'logo': None, 'url': None, 'employees': {'start': None, 'end': None}}, 'date': {'start': {'month': 12, 'day': None, 'year': 2003}, 'end': {'month': 3, 'day': None, 'year': 2009}}, 'profile_positions': [{'location': None, 'date': {'start': {'month': 12, 'day': None, 'year': 2003}, 'end': {'month': 3, 'day': None, 'year': 2009}}, 'company': 'architectural offices', 'description': '2003/2009 -Own Practice. Milan\n2008\t-CBT Architects- Childs Bertman Tseckares. Boston, USA\n2006\t-scda Architects, Singapore\n2005\t-Design Architect, Romi Khosla Design Studio, New Delhi, India', 'title': 'architect designer', 'employment_type': None}]}]",[],"['Technological Innovation', 'Design', 'Software Design', 'Project Management', 'Sustainable Development', 'Urban Planning', 'Sustainable Design', 'Urban', 'Sustainable Architecture', 'Urban Design', 'SketchUp', 'Comprehensive Planning', 'Architecture', 'Design Research', 'Mixed-use', 'Urbanism', 'Architectural Design', 'Green Building', 'Architectures', 'AutoCAD']",,,
