profile_id,first_name,last_name,sub_title,profile_picture,background_image,profile_type,entity_urn,object_urn,birth_date,summary,location,premium,influencer,treasury_media,languages,industry,education,patents,awards,certifications,organizations,projects,publications,courses,test_scores,position_groups,volunteer_experiences,skills,network_info,related_profiles,contact_info
ralph-schmitt-6b0bbb14b,Ralph,Schmitt,"Pharmacist (Quality Assurance, Regulatory & Pharmacovigilance)",https://media.licdn.com/dms/image/C5603AQFM-7XAqieAbg/profile-displayphoto-shrink_800_800/0/1517882603578?e=1697673600&v=beta&t=QT1pZKC7JCzyFBYpWMmDdMmhhOtAPgDBw58AzzQWBgk,,personal,ACoAACROvSQB36Z5lh-ijGUtzLb8yWMmr4f8stk,609140004,,"• An accomplished professional with extensive experience in the management of Regulatory Affairs, Quality Assurance and Pharmacovigilance Systems.
• 4 years experience in the pharmaceutical industry with in-depth knowledge of current Good Manufacturing Practice (cGMP); current Good Distribution Practice (cGDP) and current Good Warehouse Practice (cGWP).
• Variation compilation and submissions to local authorities.
• Distribution experience related to pharmaceutical products, medical devices, and controlled substances.
• Quality and Regulatory management experience with extensive experience in management of Deviations, Change Controls and CAPAs.","{'country': 'Netherlands', 'short': 'Woerden, Utrecht', 'city': 'Woerden', 'state': 'Utrecht', 'default': 'Woerden, Utrecht, Netherlands'}",False,False,[],"{'primary_locale': {'country': 'US', 'language': 'en'}, 'supported_locales': [{'country': 'US', 'language': 'en'}], 'profile_languages': []}",Pharmaceuticals,"[{'date': {'start': {'month': None, 'day': None, 'year': 2011}, 'end': {'month': None, 'day': None, 'year': 2014}}, 'school': {'name': 'North-West University / Noordwes-Universiteit', 'logo': 'https://media.licdn.com/dms/image/C4D0BAQGNNrhwRYYSig/company-logo_400_400/0/1606970390460?e=1700697600&v=beta&t=tVmJBo_mzPFxve7TBP31ZdRi3_VcStH0IVNsoZ-7Pgg', 'url': 'https://www.linkedin.com/school/northwestuniversity/'}, 'degree_name': 'Baccalaureus Pharmaciae Degree', 'field_of_study': 'Pharmacy'}]",[],[],[],[],[],[],[],[],"[{'company': {'id': 535536, 'name': 'Viroclinics-DDL', 'logo': 'https://media.licdn.com/dms/image/D4E0BAQGbxAnzz_lWxA/company-logo_400_400/0/1687415847074?e=1700697600&v=beta&t=fwk7n4J-mazxaz_PKIrlXH-3vefFrEk_CHVvmdgVTks', 'url': 'https://www.linkedin.com/company/viroclinics-ddl/', 'employees': {'start': 201, 'end': 500}}, 'date': {'start': {'month': 5, 'day': None, 'year': 2023}, 'end': {'month': None, 'day': None, 'year': None}}, 'profile_positions': [{'location': 'Rotterdam, South Holland, Netherlands', 'date': {'start': {'month': 5, 'day': None, 'year': 2023}, 'end': {'month': None, 'day': None, 'year': None}}, 'company': 'Viroclinics-DDL', 'description': 'New adventure and start in the Netherlands.', 'title': 'Quality Assurance Officer', 'employment_type': 'Full-time'}]}, {'company': {'id': 7195743, 'name': 'Pharmaco Distribution Pty Ltd.', 'logo': 'https://media.licdn.com/dms/image/C4E0BAQGsU4WIUgbXsQ/company-logo_400_400/0/1634660882261?e=1700697600&v=beta&t=yMFhcUW81042riNa_o_1PQ2t2dcSN0_rbg4bicpXTTg', 'url': 'https://www.linkedin.com/company/pharmaco-distribution-pty-ltd-/', 'employees': {'start': 51, 'end': 200}}, 'date': {'start': {'month': 9, 'day': None, 'year': 2021}, 'end': {'month': 5, 'day': None, 'year': 2023}}, 'profile_positions': [{'location': 'Gauteng, South Africa', 'date': {'start': {'month': 9, 'day': None, 'year': 2021}, 'end': {'month': 5, 'day': None, 'year': 2023}}, 'company': 'Pharmaco Distribution (Pty) Ltd.', 'description': '•Compilation of pharmaceutical and analytical variations;\n•Marketing Authorization Transfer submissions;\n•Submission of variations to South Africa, Botswana and Namibia regulatory authorities;\n•Deputy qualified person responsible for Pharmacovigilance (PV);\n•Reporting of CIOMS & compilation of PV reconciliations; \n•Pharmaceutical Labelling and Artwork compliance;\n•Infant formula and enteral feed compliance;\n•Communication with international partners;\n•QMS management, e,g., Audits, CC’s, Deviations, etc.;\n•Execution of Mock recalls and self-inspections.\n•INCB import permit applications with SAHPRA;\n•Annual narcotic and psychotropic returns;\n•Release of registered imported stock.', 'title': 'Regulatory Affairs & Quality Assurance & Pharmacovigilance Pharmacist ', 'employment_type': 'Full-time'}]}, {'company': {'id': 1054212, 'name': 'AXIM', 'logo': 'https://media.licdn.com/dms/image/C560BAQG6RkxjwsfJXg/company-logo_400_400/0/1572375205982?e=1700697600&v=beta&t=blgqnhhBJcPDPXp1027gwpRph6At0KRhP7cBwnHZVSs', 'url': 'https://www.linkedin.com/company/axim_2/', 'employees': {'start': 201, 'end': 500}}, 'date': {'start': {'month': 10, 'day': None, 'year': 2019}, 'end': {'month': 9, 'day': None, 'year': 2021}}, 'profile_positions': [{'location': 'Midrand', 'date': {'start': {'month': 10, 'day': None, 'year': 2019}, 'end': {'month': 9, 'day': None, 'year': 2021}}, 'company': 'AXIM', 'description': '•Quality Assurance (QA) release officer;\n•Pharmacovigilance Officer (PVO);\n•Regulatory liaison for registered products;\n•Ensure registration and licensing with Authorities;\n•Good documentation control and archiving;\n•Ensure up to date GWP/GMP/GDP knowledge;\n•Ensure inspection readiness (SAPC, SAHPRA etc);\n•Conducting external audits and self-inspections;\n•Deviations, CAPA’s, CC’s and QMS management;\n•Ensure SLA’s/TQA’s are in place and up to date;\n•Import, storage and distribution validations;\n•Create, maintain and update SOP’s;\n•Temperature control, cleaning, maintenance;\n•Sampling and retention of newly imported batches;\n•Training of personnel (warehouse, PV, GMP, etc. procedures);\n•Ensure safe disposal and destruction of medicines;\n•Assess stability for cold chain shipments.', 'title': 'Warehouse Responsible Pharmacist & QA Officer & PV Officer & Regulatory liaison', 'employment_type': 'Full-time'}]}, {'company': {'id': 34981606, 'name': 'AXIM PHARMACEUTICALS', 'logo': None, 'url': 'https://www.linkedin.com/company/axim-pharmaceuticals/', 'employees': {'start': None, 'end': None}}, 'date': {'start': {'month': 2, 'day': None, 'year': 2019}, 'end': {'month': 9, 'day': None, 'year': 2019}}, 'profile_positions': [{'location': 'Midrand', 'date': {'start': {'month': 2, 'day': None, 'year': 2019}, 'end': {'month': 9, 'day': None, 'year': 2019}}, 'company': 'AXIM PHARMACEUTICALS', 'description': '• Evaluating prescriptions for radioactive dosages;\n• Reconstitution of Radio actives for treatment/diagnostic use;\n• Quality Control of imported S21 peptides;\n• Product release;\n• Inventory Control;\n• Distribution of medication locally, to Botswana and Namibia;\n• Compiling quotes for various companies;\n• Handling of customer complaints;\n• Labelling of white blood cells with radioactive tracers;\n• Evaluating temperature excursions during shipments;\n• Performing tests on equipment for dose calibrations;\n• Schedule personnel work hours and allocation of duties;\n• Updating and implementation of SOP’s;\n• Conducting supplier audits.', 'title': 'Nuclear Pharmacist', 'employment_type': 'Full-time'}]}, {'company': {'id': None, 'name': 'Life Groenkloof', 'logo': None, 'url': None, 'employees': {'start': None, 'end': None}}, 'date': {'start': {'month': 4, 'day': None, 'year': 2018}, 'end': {'month': 1, 'day': None, 'year': 2019}}, 'profile_positions': [{'location': 'Groenkloof', 'date': {'start': {'month': 4, 'day': None, 'year': 2018}, 'end': {'month': 1, 'day': None, 'year': 2019}}, 'company': 'Life Groenkloof', 'description': '• Evaluate prescriptions for drug interactions, allergies, etc.;\n• Dispense medication;\n• Evaluating prescriptions dispensed by assistants;\n• Handling medical aid queries;\n• Contacting prescribers in case of discrepancies;\n• Inventory control - Managing S5, S6 & Section 21 medication;\n• Distribution of medication to hospital wards;\n• Processing Section 21 applications;\n• Quarterly balance S5 & S6 registers - pharmacy & wards;\n• Handling recalls;\n• Handling credit discrepancies;\n• Comply with all laws governing pharmacy practice.', 'title': 'Hospital Pharmacist', 'employment_type': 'Full-time'}]}, {'company': {'id': 20720685, 'name': 'MEDIRITE LIMITED', 'logo': None, 'url': 'https://www.linkedin.com/company/medirite-limited/', 'employees': {'start': None, 'end': None}}, 'date': {'start': {'month': 1, 'day': None, 'year': 2017}, 'end': {'month': 3, 'day': None, 'year': 2018}}, 'profile_positions': [{'location': 'Mayville', 'date': {'start': {'month': 1, 'day': None, 'year': 2017}, 'end': {'month': 3, 'day': None, 'year': 2018}}, 'company': 'MEDIRITE LIMITED', 'description': '•\tResponsible Pharmacist, Manager and registered Tutor at Medirite Mayville\n•\tTraining of Pharmacy Students\n•\t Tutor for Basic and Learner Basic Assistants\n•\tDispensing of medication\n•\tCheck & sign off prescriptions dispensed by Pharmacist Assistants\n•\tChecking pre-packed parcels\n•\tWorking on systems: Allegra, Unisolv, Orderwise and WFM (Work Force Management)\n•\tDealing with Medical Aid problems\n•\tContacting Prescribers\n•\tCCMDD (Centralised Chronic Medicine Dispensing & Distribution) – receiving, documenting and dispensing of parcels \n•\tOrdering of medication and packaging\n•\tSupervising short dated stock – IBT to different branches when needed\n•\tSupervising dormant stock – returning to Transpharm Wholesaler if needed\n•\tKeeping SOP’s and reports up to date\n•\tReporting to Regional Managers\n•\tMonthly meetings with staff members with regards to procedures to adhere to\n•\tWeekly meetings with staff to keep everyone informed with regards to the coming week’s tasks / improvement needed for incidents of the past week\n•\tHandling personnel requests and problems\n•\tScheduling of staff: week- and weekend hours & submitting hours to be paid\n•\tScheduling staff logistics (banking, lunch and stock rotation)\n•\tChecking daily banking and corresponding amounts', 'title': 'Responsible Pharmacist Retail', 'employment_type': 'Full-time'}]}, {'company': {'id': None, 'name': 'Department of Health ', 'logo': None, 'url': None, 'employees': {'start': None, 'end': None}}, 'date': {'start': {'month': 1, 'day': None, 'year': 2016}, 'end': {'month': 12, 'day': None, 'year': 2016}}, 'profile_positions': [{'location': 'Kimberley Area, South Africa', 'date': {'start': {'month': 1, 'day': None, 'year': 2016}, 'end': {'month': 12, 'day': None, 'year': 2016}}, 'company': 'Department of Health ', 'description': '•\tWard Pharmacist \n•\tWard rounds \n•\tSupply medicine to wards \n•\tPharmacist at Oncology and Renal Pharmacy\n•\tMixing of Oncology medication\n•\tPharmacist at Dermatology, Urology and Cardiac clinic \n•\tPharmacist at Paediatric clinic\n•\tPharmacist at Ophthalmic and Orthopaedic Pharmacy\n•\tBatho Pele Principles\n•\tOn call\n•\tHandle referrals to Galeshewe Day Hospital and 13-local clinics to ensure stock availability. \n•\tStock rotation to minimalize expiry of medication (in wards, pharmacies and warehouse for surgical items and medication)\n•\tDo presentations to colleagues on medical topics to keep all staff up to date \n•\tCompleted research on ARV’s which was presented to all Community Service Pharmacists and Responsible Pharmacists', 'title': 'Hospital Community Service Pharmacist', 'employment_type': None}]}]",[],"['Training', 'Quality Management', 'Regulatory Affairs', 'Pharmacovigilance', 'Communication', 'Good Manufacturing Practice (GMP)', 'Quality Assurance', 'QMS', 'Healthcare', 'Oncology', 'Pharmaceutical Industry', 'Analysing', 'Microsoft Outlook', 'Microsoft PowerPoint', 'Team Leadership', 'Skilled Multi-tasker', 'Challenge Driven', 'Hospital Pharmacy', 'sterile manufacturing', 'Motivated']",,,
