profile_id,first_name,last_name,sub_title,profile_picture,background_image,profile_type,entity_urn,object_urn,birth_date,summary,location,premium,influencer,treasury_media,languages,industry,education,patents,awards,certifications,organizations,projects,publications,courses,test_scores,position_groups,volunteer_experiences,skills,network_info,related_profiles,contact_info
leondeleeuw,Leon,de Leeuw,Senior Clinical Contract Manager / Pharmaceutics / Clinical Research / CRO / Interim / Working internationally.,https://media.licdn.com/dms/image/D4D03AQGI2_BH_nhvYA/profile-displayphoto-shrink_800_800/0/1663439214433?e=1697673600&v=beta&t=yt219EYMGA7aqe6STAabhV7a6g7IziLBM5CCR57A_bI,https://media.licdn.com/dms/image/C5616AQEAVlnabwFV7g/profile-displaybackgroundimage-shrink_350_1400/0/1622705815294?e=1697673600&v=beta&t=F5nRCml46PSn5J6B-ingwCjMhYNHcNGxB1Ufxf5lYO4,personal,ACoAAAz9oSIBxEtCOXDHT9NgB9JSZkczQAJs83I,217948450,,"• hello@leondeleeuw.net 
+359878838624
• www.leondeleeuw.net/resume

Currently at the Netherlands Cancer Institute, composing budgets for phase 1, 2 and 3 oncology studies. Negotiating legal wording in clinical trial agreements, funding agreements and contract amendments.

For Marshall Denning I was a Legal lead for 15 million Euro private sector IT deals and public tenders in Belgium, France and the Netherlands.

For IQVIA I executed clinical contracts with large hospitals and GP sites in the Netherlands in Belgium, mostly for Phase 3b and 4 studies. 

Working abroad and with cross-cultural teams on challenging projects while maintaining high client satisfaction are the red line throughout the functions I'm in. Strong background in international business.

Dutch citizen with EU working rights. Able to relocate globally.","{'country': 'Netherlands', 'short': 'Amsterdam, North Holland', 'city': 'Amsterdam', 'state': 'North Holland', 'default': 'Amsterdam, North Holland, Netherlands'}",False,False,[],"{'primary_locale': {'country': 'NL', 'language': 'nl'}, 'supported_locales': [{'country': 'NL', 'language': 'nl'}], 'profile_languages': [{'name': 'Bulgarian', 'proficiency': 'FULL_PROFESSIONAL'}, {'name': 'Dutch', 'proficiency': 'NATIVE_OR_BILINGUAL'}, {'name': 'English', 'proficiency': 'NATIVE_OR_BILINGUAL'}, {'name': 'French', 'proficiency': 'LIMITED_WORKING'}, {'name': 'German', 'proficiency': 'LIMITED_WORKING'}, {'name': 'Italian', 'proficiency': 'ELEMENTARY'}, {'name': 'Romanian', 'proficiency': 'ELEMENTARY'}, {'name': 'Russian', 'proficiency': 'LIMITED_WORKING'}, {'name': 'Spanish', 'proficiency': 'ELEMENTARY'}]}",Pharmaceuticals,"[{'date': {'start': {'month': None, 'day': None, 'year': 2010}, 'end': {'month': None, 'day': None, 'year': 2013}}, 'school': {'name': 'Tio Business School', 'logo': 'https://media.licdn.com/dms/image/C4E0BAQE4ERVEvNuVeg/company-logo_400_400/0/1661958074166?e=1700697600&v=beta&t=7Uwd5DhSWQV4loVUiWSphm9DlGHAN6B_g1sJVzvQrh8', 'url': 'https://www.linkedin.com/school/tiobusinessschool/'}, 'degree_name': 'Bachelor of Business Administration - BBA', 'field_of_study': 'International Business/Trade/Commerce'}]",[],[],"[{'name': 'BSAFE Security certification for foreign workers and Active Shooter Incidents response training', 'date': {'start': {'month': None, 'day': None, 'year': None}, 'end': {'month': None, 'day': None, 'year': None}}, 'authority': 'United Nations', 'url': None, 'license_number': None, 'display_source': None, 'company': {'id': None, 'name': 'United Nations', 'logo': 'https://media.licdn.com/dms/image/C4D0BAQEJd9iXSB3aTQ/company-logo_400_400/0/1604441643356?e=1700697600&v=beta&t=OwEMFF0ekrVG7pO-I7j1kYQhuuBfmeLak07StE-5YWA', 'url': None}}, {'name': 'Diplomacy', 'date': {'start': {'month': None, 'day': None, 'year': None}, 'end': {'month': None, 'day': None, 'year': None}}, 'authority': 'University of London', 'url': None, 'license_number': None, 'display_source': None, 'company': {'id': None, 'name': 'University of London', 'logo': 'https://media.licdn.com/dms/image/D4E0BAQHhJJQ6PkLcBg/company-logo_400_400/0/1688384748631?e=1700697600&v=beta&t=LbaMa1MFJJ3TYqyXhVSNQHt1NDIGkrHAXzYFxxn0EIk', 'url': None}}, {'name': 'Good Clinical Practice: Expert', 'date': {'start': {'month': None, 'day': None, 'year': None}, 'end': {'month': None, 'day': None, 'year': None}}, 'authority': 'Barnett International', 'url': None, 'license_number': None, 'display_source': None, 'company': {'id': None, 'name': 'Barnett International', 'logo': 'https://media.licdn.com/dms/image/C4E0BAQHHMMt34dUXyQ/company-logo_400_400/0/1519877093001?e=1700697600&v=beta&t=fms3ZXu1ABKjuwso4kzO3FIMP42eh-n-UIKJjtUu7OY', 'url': None}}, {'name': 'International Relations', 'date': {'start': {'month': None, 'day': None, 'year': None}, 'end': {'month': None, 'day': None, 'year': None}}, 'authority': 'National Research University — Higher School of Economics', 'url': None, 'license_number': None, 'display_source': None, 'company': {'id': None, 'name': 'National Research University — Higher School of Economics', 'logo': 'https://media.licdn.com/dms/image/C4E0BAQEMnvwpIPSHTw/company-logo_400_400/0/1549548976472?e=1700697600&v=beta&t=bVaJ97VN-B--ymIe5_RTBue0ogfU41uu23YMIMlu1GI', 'url': None}}, {'name': 'International Security Management', 'date': {'start': {'month': None, 'day': None, 'year': None}, 'end': {'month': None, 'day': None, 'year': None}}, 'authority': 'Erasmus University Rotterdam', 'url': None, 'license_number': None, 'display_source': None, 'company': {'id': None, 'name': 'Erasmus University Rotterdam', 'logo': 'https://media.licdn.com/dms/image/C4E0BAQH6a-XX__UABw/company-logo_400_400/0/1564983668078?e=1700697600&v=beta&t=EXGjlpwF6hw4cke4JYowikAr6lRm_EPanhLZJO9VXpk', 'url': None}}, {'name': 'Suicide Interventionist Certification', 'date': {'start': {'month': None, 'day': None, 'year': None}, 'end': {'month': None, 'day': None, 'year': None}}, 'authority': 'Substance Abuse and Mental Health Services Administration (SAMHSA)', 'url': None, 'license_number': None, 'display_source': None, 'company': {'id': None, 'name': 'Substance Abuse and Mental Health Services Administration (SAMHSA)', 'logo': 'https://media.licdn.com/dms/image/C560BAQFiXyPqLrQKCw/company-logo_400_400/0/1674063830567?e=1700697600&v=beta&t=IQ1sZuvfvi5ofGEWtkf8rCyqCYbsLi8Xv5cOWcbJ3DM', 'url': None}}]",[],[],"[{'name': 'Poems and Stuff', 'publisher': None, 'url': 'http://www.leondeleeuw.net/books', 'date': {'month': None, 'day': None, 'year': 2018}, 'authors': [{'type': 'standardizedContributor', 'first_name': 'Leon', 'last_name': 'de Leeuw', 'name': None, 'headline': 'Senior Clinical Contract Manager / Pharmaceutics / Clinical Research / CRO / Interim / Working internationally.'}]}, {'name': 'Solo Travel and Living Abroad Alone', 'publisher': None, 'url': 'http://www.leondeleeuw.net/books', 'date': {'month': None, 'day': None, 'year': 2018}, 'authors': [{'type': 'standardizedContributor', 'first_name': 'Leon', 'last_name': 'de Leeuw', 'name': None, 'headline': 'Senior Clinical Contract Manager / Pharmaceutics / Clinical Research / CRO / Interim / Working internationally.'}]}, {'name': 'Darko', 'publisher': None, 'url': 'http://www.lulu.com/spotlight/leon_de_leeuw', 'date': {'month': None, 'day': None, 'year': 2017}, 'authors': [{'type': 'standardizedContributor', 'first_name': 'Leon', 'last_name': 'de Leeuw', 'name': None, 'headline': 'Senior Clinical Contract Manager / Pharmaceutics / Clinical Research / CRO / Interim / Working internationally.'}]}, {'name': 'The Abandoned Buildings of Bulgaria', 'publisher': None, 'url': 'http://www.lulu.com/spotlight/leon_de_leeuw', 'date': {'month': None, 'day': None, 'year': 2017}, 'authors': [{'type': 'standardizedContributor', 'first_name': 'Leon', 'last_name': 'de Leeuw', 'name': None, 'headline': 'Senior Clinical Contract Manager / Pharmaceutics / Clinical Research / CRO / Interim / Working internationally.'}]}, {'name': 'Short Stories and Ramblings', 'publisher': None, 'url': 'http://www.lulu.com/spotlight/leon_de_leeuw', 'date': {'month': None, 'day': None, 'year': 2017}, 'authors': [{'type': 'standardizedContributor', 'first_name': 'Leon', 'last_name': 'de Leeuw', 'name': None, 'headline': 'Senior Clinical Contract Manager / Pharmaceutics / Clinical Research / CRO / Interim / Working internationally.'}]}]",[],[],"[{'company': {'id': 11408925, 'name': 'Syneos Health', 'logo': 'https://media.licdn.com/dms/image/C4D0BAQHBsEZeIFwfmQ/company-logo_400_400/0/1519888772014?e=1700697600&v=beta&t=SfpVjEhHMejfjPxFNakhEPAXb2nnISXeBrzscVUrJUY', 'url': 'https://www.linkedin.com/company/syneos-health/', 'employees': {'start': 10001, 'end': None}}, 'date': {'start': {'month': None, 'day': None, 'year': 2023}, 'end': {'month': None, 'day': None, 'year': None}}, 'profile_positions': [{'location': 'Bulgaria', 'date': {'start': {'month': None, 'day': None, 'year': 2023}, 'end': {'month': None, 'day': None, 'year': None}}, 'company': 'Syneos Health', 'description': ""• Leading multi-country projects including negotiating and preparing contracts, budgets, and documents for participation in industry-sponsored clinical trials.  \n• Administering all contract management processes, including coordination with relevant protocol, informed consent, institution, investigator, vendor, consultant, and customer agreement documents at a project level.\n• Working closely with Site Contract Service Center and Legal to harmonize site contract to reflect sponsor's master service agreement terms.\n• Working closely with SSU lead, Clinical Operations and Finance to validate the load of departmental budgets and corresponding backlog.\n• Providing support to business development and represents site contracts/Site Start-Up (SSU) at internal or customer meetings.\n• Working within the forecasted country/site contracting timelines, ensuring they are complied with and tracking milestone progress in agreed upon SSU tracking system in real-time.\n• Serving as key communication liaison between site contracts staff and internal and external customers.  Providing functional guidance and keeping internal and external teams aware of all contract statuses or pending issues.\n• Training and mentoring less experienced staff members on departmental Standard Operating Procedures (SOPs), and ensuring quality of team work products. Maintaining and updating training material for site contract team.\n• Actively participating in higher level discussions about overall company goals, departmental objectives, and specific project aims.\n• Facilitating the execution of contracts by company signatories.\n• Monitoring financial aspects of the project and the number of hours/tasks available per contract; escalating discrepancies in a timely fashion."", 'title': 'Senior Site Contracts Specialist', 'employment_type': 'Contract'}]}, {'company': {'id': 8373242, 'name': 'The Netherlands Cancer Institute', 'logo': 'https://media.licdn.com/dms/image/C560BAQEqz4HPV21a-Q/company-logo_400_400/0/1519888856405?e=1700697600&v=beta&t=6LwviCLR9ot0UlsGa7_yMD8XGO1pCYnLRKV2nECIf6s', 'url': 'https://www.linkedin.com/company/the-netherlands-cancer-institute/', 'employees': {'start': 1001, 'end': 5000}}, 'date': {'start': {'month': None, 'day': None, 'year': 2021}, 'end': {'month': None, 'day': None, 'year': 2023}}, 'profile_positions': [{'location': 'Amsterdam, the Netherlands', 'date': {'start': {'month': None, 'day': None, 'year': 2021}, 'end': {'month': None, 'day': None, 'year': 2023}}, 'company': 'The Netherlands Cancer Institute', 'description': '• Directly negotiated with pharmaceutical firms and legal representatives;\n\n- budgets for phase 1, 2 and 3 oncology clinical trials and medical device studies. In close contact with finance, the hospital pharmacy, radiology and nuclear medicine departments to include the correct procedures and pricing.\n- legal wording in contracts, amendments and confidentiality agreements. Negotiating contract clauses to ensure patient safety, securing confidential patient data.\n\n• Setting up investigator-initiated clinical trials in the Netherlands, Italy and the US; \n\n- determining, in close collaboration with investigators, the interventions, study cycles, therapy administering and scans that take place.\n- composing schedules of assessments, study budgets, drafting funding agreements with local clinics, institutions and universities.\n- arranging local monitoring and insurance as per regulatory guidelines. \n- attending meetings with investigators and participating sites to determine study budgets and study start-up.\n\n• Guiding and mentoring colleagues on how to work with tight deadlines, difficulties and logistical challenges with clinical trials and writing contract clauses.', 'title': 'Senior Clinical Contract Manager', 'employment_type': 'Contract'}]}, {'company': {'id': 16250048, 'name': 'Marshall Denning', 'logo': 'https://media.licdn.com/dms/image/C560BAQHMl1NgXyCyTQ/company-logo_400_400/0/1519861701398?e=1700697600&v=beta&t=H5R2ieHl1bltDCvUy5FbcWZlU3q1jSSLQ_YJjuel1w0', 'url': 'https://www.linkedin.com/company/marshall-denning/', 'employees': {'start': 201, 'end': 500}}, 'date': {'start': {'month': None, 'day': None, 'year': 2019}, 'end': {'month': None, 'day': None, 'year': 2021}}, 'profile_positions': [{'location': 'France, Belgium', 'date': {'start': {'month': None, 'day': None, 'year': 2019}, 'end': {'month': None, 'day': None, 'year': 2021}}, 'company': 'Marshall Denning', 'description': '• Legal lead for public tenders and commercial contracts up to the value of 15 million Euros.\n• Set up and negotiated contracts and amendments for IT services, cloud migration and consultancy to hospitals and pharmaceutical clients.\n• Liaised directly with corporate clients and the business team on the finance, margin and sales forecast to ensure profitability.\n• Prepared risk assessments and mitigations to inform teams on commercial and legal implications and to limit risk exposure for the contract under negotiation.\n• Drafted non-disclosure agreements, proposals, amendments, extensions and contract clauses for topics such as GDPR, benchmarking, audits, non-compete and non-hire.\n• Directly negotiated on contract wording, intellectual property, payment terms, service level agreements, audit and benchmarking clauses and financial terms with high-stake clients.\n• Interpreted ongoing contracts, addressing specific concerns from the Business and Delivery teams. Ensured correct signing of new contracts and online archiving for retrieval.\n• Advised on dispute resolution and settlement, keeping the balance between business interests and client relationships.\n• Wrote client communication, internal escalations and approval requests on behalf of the company lawyer and business teams.', 'title': 'Contract Manager', 'employment_type': 'Full-time'}]}, {'company': {'id': 4057, 'name': 'IQVIA', 'logo': 'https://media.licdn.com/dms/image/C560BAQFW8oSPns4-Cw/company-logo_400_400/0/1678802429083?e=1700697600&v=beta&t=DvqdfvJOexoGS3cONAdQKBpQ9lBaGHNoZJFFZQyq5ck', 'url': 'https://www.linkedin.com/company/iqvia/', 'employees': {'start': 10001, 'end': None}}, 'date': {'start': {'month': None, 'day': None, 'year': 2016}, 'end': {'month': None, 'day': None, 'year': 2019}}, 'profile_positions': [{'location': 'Belgium', 'date': {'start': {'month': None, 'day': None, 'year': 2017}, 'end': {'month': None, 'day': None, 'year': 2019}}, 'company': 'IQVIA', 'description': '• Managed a team of fifteen start-up specialists / CRA’s during site start-up, followed up and kept track of the submission process and contracting, for phase 3 and 4 clinical studies.\n• Handled the grand study budget to determine the country and site budgets. Reviewed site budget requests and decided on acceptance or a counter-proposal to further negotiate.\n• Ensured that the Trial Master File was continuously updated with email communication and site visit reports.\n• Kept close contact with study sponsors to discuss the identification and selection of sites. Reported on the contract process, site initiation, patient inclusion and monitoring findings.', 'title': 'Regulatory / Study Start-Up Manager', 'employment_type': 'Full-time'}, {'location': 'Belgium', 'date': {'start': {'month': None, 'day': None, 'year': 2016}, 'end': {'month': None, 'day': None, 'year': 2017}}, 'company': 'IQVIA', 'description': '• Performed site identification, inclusion, contracting, initiation visits, training, monitoring, reporting of protocol deviations, close-out visits and trial master file archiving. \n• Independently executed contracts for studies with all major Dutch and Belgian hospitals, as well as GP practices. Submitted clinical studies for regulatory / ethics committee approval.\n• Trained investigators, study coordinators and study nurses on clinical protocols and data registry systems. Mentored junior colleagues on projects.\n• Ran vendor management, the creation of purchase orders, invoice proposals with pre-\ncalculated fees – in order to pay clinical investigators, ethics committees, regulatory authorities payments. Led payment cycles and provided updates on the payment status.', 'title': 'Regulatory / Study Start-Up Specialist / Monitor', 'employment_type': 'Full-time'}]}, {'company': {'id': 2848937, 'name': 'MSD', 'logo': 'https://media.licdn.com/dms/image/D4E0BAQFOyCKkwPCg2w/company-logo_400_400/0/1688564261568?e=1700697600&v=beta&t=uflMYnNeKLALd8IXUsmmVAFZ71gSVAyFNhvUM9YFpZc', 'url': 'https://www.linkedin.com/company/msd-global/', 'employees': {'start': 10001, 'end': None}}, 'date': {'start': {'month': None, 'day': None, 'year': 2014}, 'end': {'month': None, 'day': None, 'year': 2016}}, 'profile_positions': [{'location': 'Bulgaria', 'date': {'start': {'month': None, 'day': None, 'year': 2014}, 'end': {'month': None, 'day': None, 'year': 2016}}, 'company': 'MSD', 'description': '• Reported and escalated medicine production outages in high detail to avoid production halt.\n• Solved Word / Excel / Outlook / Expense report / SAP inquiries of pharma representatives.\n• Handled requests by phone, email and chat or through screen sharing.', 'title': 'IT Specialist', 'employment_type': 'Full-time'}]}]",[],"['International Business', 'Negotiation', 'Diplomacy', 'SEO', 'Research', 'Online Marketing', 'Project Management', 'Data Analysis', 'Contract Management', 'Database Administration', 'Data Science', 'International Relations', 'Outsourcing', 'Business Process Outsourcing (BPO)', 'IT Outsourcing', 'Business Analysis', 'Pharmaceutics', 'Clinical Research', 'Data Management', 'Good Clinical Practice (GCP)']",,,
