profile_id,first_name,last_name,sub_title,profile_picture,background_image,profile_type,entity_urn,object_urn,birth_date,summary,location,premium,influencer,treasury_media,languages,industry,education,patents,awards,certifications,organizations,projects,publications,courses,test_scores,position_groups,volunteer_experiences,skills,network_info,related_profiles,contact_info
emiliorocchi,Emilio F.,Rocchi,"Director Market Planning International, LexisNexis Risk Solutions. Helping clients to create a seamless UX by reducing risk & fraud.",https://media.licdn.com/dms/image/D4E03AQFcOs_MRDJpzQ/profile-displayphoto-shrink_800_800/0/1677868086956?e=1697673600&v=beta&t=IutCWoNMDaPWlN6jDpb2wT0r0I7ERaLrFS0k6sHZO0A,https://media.licdn.com/dms/image/C4E16AQFwrUnedOZ2jA/profile-displaybackgroundimage-shrink_350_1400/0/1588613944427?e=1697673600&v=beta&t=SXh666sRYbQedpUzHA0gZcKw4PH9a7GZG9bOAjKM8WA,personal,ACoAAAAWS-cBeR3fRzmhenWEbpQwn2xmmyH-9kk,1461223,,"Global, Highly Skilled and Motivated Professional in Payment,    Technology, e-Commerce and International Relations and International Cooperation for local & regional Development. 

Extensive working experience in Argentina, Germany, Belgium and The    Netherlands. Coupled with a strong academic background: Masters in   Public Administration (Magister Rerum Publicarum 2000), Masters in International Relations, EU  and German Public Laws (1997) and MBA in E-commerce (2012).

I am currently working at LexisNexis as a Senior Solutions Consultant Fraud and Identity. LexisNexis® Risk Solutions leverages advanced analytics, vast data resources and proprietary linking technology to help organizations transform opportunity and risk assessment. Our solutions help customers across industries solve daily business challenges such as identity verification and authentication, fraud defense, compliance and due diligence while streamlining workflows, increasing productivity and maximizing revenue. https://risk.lexisnexis.com

I also have a comprehensive  commercial experience in Operation, Sales and Account Management. Extensive experience in public as well as private sector.   

Fluency in Spanish, English and German. Working knowledge in Italian, Portuguese and Dutch.","{'country': 'Netherlands', 'short': 'Amsterdam, North Holland', 'city': 'Amsterdam', 'state': 'North Holland', 'default': 'Amsterdam, North Holland, Netherlands'}",False,False,"[{'url': None, 'title': 'NextGen Nordics 2023', 'description': 'Discussing about CBDCs and their role in payment innovation and economic stability at #NextGenNordics in Stockholm, 25th April 2023.', 'image': 'https://media.licdn.com/dms/image/D4E2DAQGYk8AzTRou-g/profile-treasury-image-shrink_800_800/0/1682938164413?e=1692954000&v=beta&t=Ekyhc9D6o-3dikfV2C9NH86i_U97X5HchPZFmr_noGs'}, {'url': None, 'title': 'Digital Identity Meet Up', 'description': 'Presenting at the Digital Identity Meet up in Madrid, September 2022. LexisNexis Risk Solutions.', 'image': 'https://media.licdn.com/dms/image/D4E2DAQGwoPWJSCqJkA/profile-treasury-image-shrink_8192_8192/0/1666998051401?e=1692954000&v=beta&t=yNdxohI6N9DJzfQn6Mm5CQl22qcOGJHXTWV9Oa3wD5I'}, {'url': None, 'title': 'Keynote speaker at Samsung Smart Center in Milan, Italy.', 'description': 'Keynote speaker at #samsungsmartcenter in Milan. #fintech #keynotespeaker #milano #italy', 'image': 'https://media.licdn.com/dms/image/C562DAQFqGOxiofKnUg/profile-treasury-image-shrink_8192_8192/0/1621762759019?e=1692954000&v=beta&t=yAubU-PhQr6OVVgLUd3X8YDlO6fwIxrgVKe5kJwP6Kk'}]","{'primary_locale': {'country': 'US', 'language': 'en'}, 'supported_locales': [{'country': 'US', 'language': 'en'}], 'profile_languages': []}",Information Technology & Services,"[{'date': {'start': {'month': None, 'day': None, 'year': 1998}, 'end': {'month': None, 'day': None, 'year': 2000}}, 'school': {'name': 'German University of Administrative Sciences Speyer', 'logo': 'https://media.licdn.com/dms/image/C560BAQFWt7X9w7Ua6w/company-logo_400_400/0/1519881731121?e=1700697600&v=beta&t=N-hK6EyKChVhYnT-waYO2rsDl8_bc-efP2K-jzO9eQ4', 'url': 'https://www.linkedin.com/school/deutsche-universit%C3%A4t-f%C3%BCr-verwaltungswissenschaften-speyer/'}, 'degree_name': 'MPA (Master in Public Administration) Magister rerum publicarum', 'field_of_study': 'Magister in Public Administration'}, {'date': {'start': {'month': None, 'day': None, 'year': 2009}, 'end': {'month': None, 'day': None, 'year': 2011}}, 'school': {'name': 'Universidad Politécnica de Madrid', 'logo': 'https://media.licdn.com/dms/image/D4D0BAQHJPlcA68PA2Q/company-logo_400_400/0/1686904766425?e=1700697600&v=beta&t=eNJsY_g2ewUp6wHnnnYKnMpkbV2RC6gVVEqzkxh9E4Y', 'url': 'https://www.linkedin.com/school/universidad-politecnica-de-madrid/'}, 'degree_name': 'Master en E-Business & E-Commerce', 'field_of_study': 'E-Business; E-Commerce; Mobile Business; International Marketing; Business Intelligence'}, {'date': {'start': {'month': None, 'day': None, 'year': 1991}, 'end': {'month': None, 'day': None, 'year': 1997}}, 'school': {'name': 'Universidad Nacional de Rosario', 'logo': 'https://media.licdn.com/dms/image/C560BAQE6w4XO8Mi67g/company-logo_400_400/0/1565275258491?e=1700697600&v=beta&t=MPvrJ-dPdnHW56xZqKZLwgi-ESfZzlsK-ZqpiP1hhSo', 'url': 'https://www.linkedin.com/school/unroficial/'}, 'degree_name': 'Licenciado in International Relations', 'field_of_study': 'International Relations, International Public Law, International Economy and Foreign Policy'}]",[],[],"[{'name': 'Green Belt (Business/Tech Executives)', 'date': {'start': {'month': 6, 'day': None, 'year': 2021}, 'end': {'month': None, 'day': None, 'year': None}}, 'authority': 'Security Journey', 'url': 'https://rsg.securityjourney.com/internal_api/v1/roles/77/certificates.pdf', 'license_number': '24823', 'display_source': 'securityjourney.com', 'company': {'id': None, 'name': 'Security Journey', 'logo': 'https://media.licdn.com/dms/image/C4E0BAQEr8eLekew0HA/company-logo_400_400/0/1660746854985?e=1700697600&v=beta&t=XeoOd1KaWWuYzykA2pRMBLcmGDSf0-VAK-iJ6uzr9Cs', 'url': None}}, {'name': 'Goethe-Zertifikat C2: Großes Deutsches Sprachdiplom (GDS)', 'date': {'start': {'month': 11, 'day': None, 'year': 2016}, 'end': {'month': None, 'day': None, 'year': None}}, 'authority': 'Goethe-Institut e.V.', 'url': 'https://www.goethe.de/ins/de/de/prf/ort/ber/gzc2.cfm', 'license_number': '2012-AC2A-0000121328', 'display_source': 'goethe.de', 'company': {'id': None, 'name': 'Goethe-Institut e.V.', 'logo': 'https://media.licdn.com/dms/image/C510BAQEAUmE98bh11g/company-logo_400_400/0/1519881950154?e=1700697600&v=beta&t=h9Lk6tYvLxGOy-P4jSXfAHsHiRuDkSEDsD1VkLoTkAY', 'url': None}}, {'name': 'First Certificate in English - Grade A', 'date': {'start': {'month': 2, 'day': None, 'year': 2006}, 'end': {'month': None, 'day': None, 'year': None}}, 'authority': 'University of Cambridge', 'url': 'https://www.cambridgeenglish.org/exams-and-tests/', 'license_number': '0015027906', 'display_source': 'cambridgeenglish.org', 'company': {'id': None, 'name': 'University of Cambridge', 'logo': 'https://media.licdn.com/dms/image/C4E0BAQGLqHVOwtQeUQ/company-logo_400_400/0/1663833278405?e=1700697600&v=beta&t=wJZ3qsiN1k9S5kLW0xqLdlCZFIknx3jeaHn5KZHPbgA', 'url': None}}, {'name': ""Certificate 'Mastery in the role of Business Security Champion'. Yellow Belt"", 'date': {'start': {'month': None, 'day': None, 'year': None}, 'end': {'month': None, 'day': None, 'year': None}}, 'authority': 'Security Journey', 'url': 'https://rsg.securityjourney.com/internal_api/v1/roles/76/certificates.pdf', 'license_number': '24557', 'display_source': 'securityjourney.com', 'company': {'id': None, 'name': 'Security Journey', 'logo': 'https://media.licdn.com/dms/image/C4E0BAQEr8eLekew0HA/company-logo_400_400/0/1660746854985?e=1700697600&v=beta&t=XeoOd1KaWWuYzykA2pRMBLcmGDSf0-VAK-iJ6uzr9Cs', 'url': None}}]",[],[],"[{'name': 'Kann der Bezirksverband Pfalz im Prozess der Europäisierung als Modell für andere grenznahe Regionen dienen? Was müsste ggf. verändert werden?', 'publisher': 'Diplomica', 'url': 'https://books.google.nl/books?id=GX_aAQAAQBAJ', 'date': {'month': None, 'day': None, 'year': 2000}, 'authors': [{'type': 'standardizedContributor', 'first_name': 'Emilio F.', 'last_name': 'Rocchi', 'name': None, 'headline': 'Director Market Planning International, LexisNexis Risk Solutions. Helping clients to create a seamless UX by reducing risk & fraud.'}]}]",[],[],"[{'company': {'id': 10371941, 'name': 'LexisNexis Risk Solutions', 'logo': 'https://media.licdn.com/dms/image/C560BAQG_htUOuNnFUQ/company-logo_400_400/0/1519898261961?e=1700697600&v=beta&t=VXhqbqPNGRBgl1uXFR8cXFz4NXu4EdrPnsZsXF-HaLY', 'url': 'https://www.linkedin.com/company/lexisnexis-risk-solutions/', 'employees': {'start': 10001, 'end': None}}, 'date': {'start': {'month': 10, 'day': None, 'year': 2016}, 'end': {'month': None, 'day': None, 'year': None}}, 'profile_positions': [{'location': 'Amsterdam, North Holland, Netherlands', 'date': {'start': {'month': 6, 'day': None, 'year': 2022}, 'end': {'month': None, 'day': None, 'year': None}}, 'company': 'LexisNexis Risk Solutions', 'description': 'Provide strategic and tactical direction for International Fraud & Identity. Define the strategy goals and objectives for the market area and facilitate action in the accomplishment of those goals. Ensure the maximum revenue growth for the market area.', 'title': 'Director Market Planning International Fraud & Identity ', 'employment_type': 'Full-time'}, {'location': 'Amsterdam Area, Netherlands', 'date': {'start': {'month': 4, 'day': None, 'year': 2018}, 'end': {'month': 6, 'day': None, 'year': 2022}}, 'company': 'LexisNexis Risk Solutions', 'description': 'At LexisNexis Risk Solutions, I present world-class solutions utilizing the company’s innovative product and extensive experience. I work closely with potential and existing customers to understand their business problems in order to mitigate or solve them using LexisNexis Risk Solutions’ family of products and services. As a digital Payment and E-commerce SME, I support sales productivity and deal flow by securing the “technical close” in complex organizations. I collaborate with Sales, Operations, and Engineering to ensure proposed solutions accurately address customer needs, are aligned with the functionality of the LexisNexis Risk Solutions family of products, and are measurable by key customer performance metrics. My main focus is eComm, Fintech, PSPs and government organizations in EMEA (specially South Europe, DACH, Scandinavia and Benelux). I am keynote speaker and represent LexisNexis Risk Solutions ThreatMetrix products at events and payment industry related seminars and events.', 'title': 'Senior Solutions Consultant, Fraud & Identity', 'employment_type': 'Full-time'}, {'location': 'Amsterdam Area, Netherlands', 'date': {'start': {'month': 10, 'day': None, 'year': 2016}, 'end': {'month': 4, 'day': None, 'year': 2018}}, 'company': 'LexisNexis Risk Solutions', 'description': 'LexisNexis® Risk Solutions leverages advanced analytics, vast data resources and proprietary linking technology to help organizations transform opportunity and risk assessment. Our solutions help customers across industries solve daily business challenges such as identity verification and authentication, fraud defense, compliance and due diligence while streamlining workflows, increasing productivity and maximizing revenue.', 'title': 'Senior Solutions Consultant,   LexisNexis Risk Solutions ThreatMetrix', 'employment_type': None}]}, {'company': {'id': 75649298, 'name': 'Ingenico ePayments', 'logo': 'https://media.licdn.com/dms/image/D4E0BAQGiuaCwV1qfLg/company-logo_400_400/0/1664896740459?e=1700697600&v=beta&t=m5d8zaIP2pPJQ8TphkJL7fnQuyZtKeKo9Eh3BBybkQM', 'url': 'https://www.linkedin.com/company/worldline-merchant-services/', 'employees': {'start': 10001, 'end': None}}, 'date': {'start': {'month': None, 'day': None, 'year': 2008}, 'end': {'month': None, 'day': None, 'year': 2016}}, 'profile_positions': [{'location': 'Amsterdam Area, Netherlands', 'date': {'start': {'month': None, 'day': None, 'year': 2014}, 'end': {'month': None, 'day': None, 'year': 2016}}, 'company': 'Worldline Merchant Services', 'description': ""I am a trusted advisor on the complete product and service portfolio of GlobalCollect to both existing clients and prospects as well as to the internal sales organization. I am extensively involved in large and complex bids and therefore work closely together with sales and other internal and external stakeholders.\n\nI am responsible for defining of fitting solutions based on clients'\u200b needs given the products and services offered by GlobalCollect. During the development of customized solutions, I  qualify, document the needs of the client, architect a solution together with both client and GlobalCollect staff and lead the realization effort. I present the complete solution to the client together with sales and bid manager.\n\nGlobalCollect, part of Ingenico Group (Euronext: FR0000125346 - ING), is the most knowledgeable global Payment Service Provider in the world. The company processes international eCommerce payments for more than 600 of the world's most recognized brands in the digital goods and services, travel, retail and video gaming industries, among many others."", 'title': 'E-Commerce Consultant', 'employment_type': None}, {'location': 'Amsterdam Area, Netherlands', 'date': {'start': {'month': None, 'day': None, 'year': 2010}, 'end': {'month': None, 'day': None, 'year': 2015}}, 'company': 'Worldline Merchant Services', 'description': 'I am responsible for managing and growing merchant relationships within a selected number of high growth strategic industries such as Retail, (e)Publishing and Software. I am also managing the relationship with a strategic partner (PSP reseller) for international payment processing in Latin America, USA and EMEA. Extensive working knowledge of all global payment methods (online and offline) and relationships with Acquirers and Financial institutions.', 'title': 'Account Manager EMEA', 'employment_type': None}, {'location': None, 'date': {'start': {'month': None, 'day': None, 'year': 2008}, 'end': {'month': None, 'day': None, 'year': 2010}}, 'company': 'Worldline Merchant Services', 'description': 'As an Implementation Manager at GlobalCollect my main objective is the implementation of local e-payment solutions for international Customer businesses. I manage and coordinate new merchants, products and suppliers.\n\nMy key responsibilities are:\n\n•Co-ordination with the various teams; Product Development, Marketing &amp; Sales, Operations & ICT, Merchant Accounting and Finance to manage implementations \n\n•Dealing with external suppliers that provide services related to implementations \n\n•Consultancy for merchants prior to actual implementation process; \n\n•Co-managing the relation with merchants and suppliers during an implementation process\n \n•Accreditation Testing \n\n•Setting implementation priorities to allocate available resources; \n\n•Reporting on hours spent and other costs incurred \n\n•Identifying and advising on possibilities to improve products, processes and procedures \n\n•Identifying and advising on exceptions', 'title': 'Implementation Manager', 'employment_type': None}]}, {'company': {'id': 165709, 'name': 'RES Software', 'logo': 'https://media.licdn.com/dms/image/C560BAQGCB8htI1ArJg/company-logo_400_400/0/1519913436606?e=1700697600&v=beta&t=C3mnaGak3XsjRnJxuK9GTTU5P9_ahp-wpBDn49asZ64', 'url': 'https://www.linkedin.com/company/ressoftware/', 'employees': {'start': 201, 'end': 500}}, 'date': {'start': {'month': None, 'day': None, 'year': 2007}, 'end': {'month': None, 'day': None, 'year': 2008}}, 'profile_positions': [{'location': None, 'date': {'start': {'month': None, 'day': None, 'year': 2007}, 'end': {'month': None, 'day': None, 'year': 2008}}, 'company': 'RES Software', 'description': ""RES Software is a leading provider of proven management and maintenance solutions for Microsoft Windows® environments. RES Software solutions work in harmony with any IT infrastructure, and can adapt to any business model or hardware topology. RES Software has offices in the Netherlands, UK, USA and Germany.\n\nNow as an International Consultant my main role is to demonstrate how RES Software’s full product line fulfill and meet  IT Compplaince and Business Processes' requirements in every Organization by providing centralised management and maintenance solutions for Microsoft Windows® environments. In order to achieve this I deliver technical presentations, attend partners' events, develop analytical solutions and implement actions required to solve sales issues.  I am also responsible for explaining how RES Software’s technology can fit into customer architecture, and  deliver proof of concepts on emerging technology."", 'title': 'International Enterprise Services Consultant', 'employment_type': None}]}, {'company': {'id': 11117, 'name': 'Ipswitch', 'logo': 'https://media.licdn.com/dms/image/C4D0BAQES9NsFuvmS6w/company-logo_400_400/0/1591632780289?e=1700697600&v=beta&t=CteX36O9RYmA9BAB16WxuPj1sIqbl0Rp0kh58_3PIIg', 'url': 'https://www.linkedin.com/company/ipswitch-inc-/', 'employees': {'start': 201, 'end': 500}}, 'date': {'start': {'month': None, 'day': None, 'year': 2001}, 'end': {'month': None, 'day': None, 'year': 2007}}, 'profile_positions': [{'location': None, 'date': {'start': {'month': None, 'day': None, 'year': 2005}, 'end': {'month': None, 'day': None, 'year': 2007}}, 'company': 'Ipswitch, Inc.', 'description': ""Provides evaluation assistance of a technical nature to companies interested in Ipswitch software products. I am also involved in soliciting new prospects via Webinars, Trade shows  and desktop researches. It includes: \n* Developing technical sales strategies to understand and fulfill new prospects' needs.\n* Providing technical and selling skills with Ipswitch products.\n* Serving as technical consultant for Sales and Channels in all pre-sales environments, such as email, product demonstrations, off-site seminars, trade shows, and assist with presentation development.\n*Working on leads with sales organizations of the major EMEA distributors.\n*Visiting distributors, resellers and VAR's to train respective pre-sales/tech staffs on sale/support of Ipswitch products.\n*Working closely with Product Marketing and Product Management as a prospect advocate to ensure market needs are communicated from a technical perspective."", 'title': 'Pre-Sales Engineer', 'employment_type': None}, {'location': None, 'date': {'start': {'month': None, 'day': None, 'year': 2001}, 'end': {'month': None, 'day': None, 'year': 2005}}, 'company': 'Ipswitch, Inc.', 'description': 'On an Ipswitch product specific basis, provide pre and post- sales technical support and assistance to EMEA distributors and resellers (i.e. channel partners) and, when required, end-users.  Support members of the internal EMEA sales organization as needed and when directed. Proactively train the channel partners, and, as necessary, end-users and internal staff.  Provide internal IT support.', 'title': 'EMEA Product Specialist', 'employment_type': None}]}, {'company': {'id': None, 'name': 'ICL Bv', 'logo': None, 'url': None, 'employees': {'start': None, 'end': None}}, 'date': {'start': {'month': 6, 'day': None, 'year': 2000}, 'end': {'month': 9, 'day': None, 'year': 2001}}, 'profile_positions': [{'location': None, 'date': {'start': {'month': 6, 'day': None, 'year': 2000}, 'end': {'month': 9, 'day': None, 'year': 2001}}, 'company': 'ICL Bv', 'description': 'Courses and Participation on the following projects: \n-Call Coaching Training. ICL Management Development Program\n-Process Management Course. ICL Management Development Program\n- The New Manager Training. ICL Management Development \nProgram\n- Trainer: Spanish for Beginners', 'title': 'Pan European Product Specialist', 'employment_type': 'Full-time'}]}, {'company': {'id': None, 'name': 'Representation of Rhein-Palatinate at the European Union', 'logo': None, 'url': None, 'employees': {'start': None, 'end': None}}, 'date': {'start': {'month': 9, 'day': None, 'year': 1999}, 'end': {'month': 11, 'day': None, 'year': 1999}}, 'profile_positions': [{'location': None, 'date': {'start': {'month': 9, 'day': None, 'year': 1999}, 'end': {'month': 11, 'day': None, 'year': 1999}}, 'company': 'Representation of Rhein-Palatinate at the European Union', 'description': 'Internship at the Regional Representation of Rhein-Palatinate at the European Union in Brussels, Belgium.', 'title': 'Internship', 'employment_type': 'Full-time'}]}, {'company': {'id': None, 'name': 'Municipal Government of Heidelberg', 'logo': None, 'url': None, 'employees': {'start': None, 'end': None}}, 'date': {'start': {'month': 3, 'day': None, 'year': 1999}, 'end': {'month': 4, 'day': None, 'year': 1999}}, 'profile_positions': [{'location': None, 'date': {'start': {'month': 3, 'day': None, 'year': 1999}, 'end': {'month': 4, 'day': None, 'year': 1999}}, 'company': 'Municipal Government of Heidelberg', 'description': 'Internship at the Municipal Government of Heidelberg, Germany.', 'title': 'Internship', 'employment_type': 'Full-time'}]}, {'company': {'id': None, 'name': 'International Relations Office of the Municipality of Rosario', 'logo': None, 'url': None, 'employees': {'start': None, 'end': None}}, 'date': {'start': {'month': 12, 'day': None, 'year': 1996}, 'end': {'month': 9, 'day': None, 'year': 1998}}, 'profile_positions': [{'location': None, 'date': {'start': {'month': 12, 'day': None, 'year': 1996}, 'end': {'month': 9, 'day': None, 'year': 1998}}, 'company': 'International Relations Office of the Municipality of Rosario', 'description': 'At the International Relations Office of the Municipality of Rosario. Activities: Organisation and Administration of international Training Seminaries on Technical Co-operation such as the URBAL Project, Agencia Espanola de Cooperacion Internacional, and WACAP, internal organisations questions, follow-up work in the area of Cities partnerships, Mercociudades (Cities Networks within MERCOSUR) administrative work, ceremonial protocol and technical translations: Spanish, English, German and Portuguese.\n1997-1998\tInternship in the Regional Office of Educating Cities, Municipality of Rosario, Argentina.', 'title': 'Public Administrator', 'employment_type': None}]}]",[],"['Product Management', 'E-commerce', 'Salesforce.com', 'Strategic Partnerships', 'SaaS', 'Sales Management', 'Team Management', 'Telecommunications', 'Coaching', 'Business Analysis', 'Management', 'Product Marketing', 'Product Development', 'Solution Selling', 'Pre-sales', 'Outsourcing', 'Sales', 'Integration', 'Channel Partners', 'Marketing']",,,
