profile_id,first_name,last_name,sub_title,profile_picture,background_image,profile_type,entity_urn,object_urn,birth_date,summary,location,premium,influencer,treasury_media,languages,industry,education,patents,awards,certifications,organizations,projects,publications,courses,test_scores,position_groups,volunteer_experiences,skills,network_info,related_profiles,contact_info
dilettalparone,Diletta M. L.,Alparone,Project Supporter bij PZH || Public Sector || Cum Laude Graduate Adv. MSc IR and Diplomacy,https://media.licdn.com/dms/image/C4E03AQG3v649ncHIMw/profile-displayphoto-shrink_800_800/0/1655827489699?e=1697673600&v=beta&t=Q7TxtV8ikKAnPnLRB9B0JE-38A4LKBwJ7mYfYrN5CC0,https://media.licdn.com/dms/image/D4E16AQF0HuapnKvx4A/profile-displaybackgroundimage-shrink_350_1400/0/1673535884805?e=1697673600&v=beta&t=KIZU0N6Wwfigl5kQRBanW3GZ6aeodjgrTmHimVHJRzg,personal,ACoAABXWVHUB3gJg2VJen2sKWK8RJlineYOsy5E,366367861,,"--> Enthusiastic, driven and self-motivated Cum Laude graduate of the Advanced MSc International Relations and Diplomacy from Leiden University and The Clingendael Institute. 
--> First-class degree (BA) in International Relations from the University of Exeter. 
--> Passionate about EU matters, Security studies, Militarized AI, Arms Control, Disarmament, Environmental issues
--> Good at managing time pressure and comfortable in public speaking, events organisation and group work.  
--> Fluent in Italian and English. Advanced in Spanish and Dutch.","{'country': 'Netherlands', 'short': 'Zoetermeer, South Holland', 'city': 'Zoetermeer', 'state': 'South Holland', 'default': 'Zoetermeer, South Holland, Netherlands'}",False,False,[],"{'primary_locale': {'country': 'US', 'language': 'en'}, 'supported_locales': [{'country': 'US', 'language': 'en'}], 'profile_languages': [{'name': 'Dutch', 'proficiency': 'FULL_PROFESSIONAL'}, {'name': 'English', 'proficiency': 'NATIVE_OR_BILINGUAL'}, {'name': 'Italian', 'proficiency': 'NATIVE_OR_BILINGUAL'}, {'name': 'Spanish', 'proficiency': 'FULL_PROFESSIONAL'}]}",Government Administration,"[{'date': {'start': {'month': None, 'day': None, 'year': 2019}, 'end': {'month': None, 'day': None, 'year': 2021}}, 'school': {'name': 'Leiden University', 'logo': 'https://media.licdn.com/dms/image/C4D0BAQEFlK1wNecYbA/company-logo_400_400/0/1519855876129?e=1700697600&v=beta&t=KwFN5kUM6lyLgjAXaylWnuNQ6g0XLwvWDjTK4Ug_mEg', 'url': 'https://www.linkedin.com/school/leiden-university/'}, 'degree_name': 'Master of Science - MS', 'field_of_study': 'International Relations and Diplomacy '}, {'date': {'start': {'month': None, 'day': None, 'year': 2019}, 'end': {'month': None, 'day': None, 'year': 2019}}, 'school': {'name': 'Beijing Normal University', 'logo': 'https://media.licdn.com/dms/image/C4E0BAQGdY-bDR3sb2w/company-logo_400_400/0/1585974126311?e=1700697600&v=beta&t=AOUKjlH6iW4zlJnUqeuvsJAiUGgtKc-5pdjDm14HtGk', 'url': 'https://www.linkedin.com/school/beijingnormaluniversity/'}, 'degree_name': 'Placement, StudyChina2019 ', 'field_of_study': 'Mandarin '}, {'date': {'start': {'month': None, 'day': None, 'year': 2015}, 'end': {'month': None, 'day': None, 'year': 2019}}, 'school': {'name': 'University of Exeter', 'logo': 'https://media.licdn.com/dms/image/D4E0BAQFzetwKyeH37g/company-logo_400_400/0/1688119932695?e=1700697600&v=beta&t=LHCL6-kgCymX10smVfNZOmd6lRfR3PWHSSuz9y_OCys', 'url': 'https://www.linkedin.com/school/university-of-exeter/'}, 'degree_name': 'Bachelor of Arts - BA', 'field_of_study': 'International Relations WSA and Proficiency in Spanish'}, {'date': {'start': {'month': None, 'day': None, 'year': 2017}, 'end': {'month': None, 'day': None, 'year': 2018}}, 'school': {'name': 'Uppsala University', 'logo': 'https://media.licdn.com/dms/image/C4E0BAQE7ERkqy7WU_w/company-logo_400_400/0/1519886318380?e=1700697600&v=beta&t=51OMzVYsKTtBbPaflp0ap1x9UO2ZtaZPohaYvr2qn9E', 'url': 'https://www.linkedin.com/school/uppsala-university/'}, 'degree_name': 'Erasmus ', 'field_of_study': 'Politics and IR (Sweden)'}, {'date': {'start': {'month': None, 'day': None, 'year': 2010}, 'end': {'month': None, 'day': None, 'year': 2015}}, 'school': {'name': 'Liceo Classico Giovanni XXIII', 'logo': None, 'url': None}, 'degree_name': 'High School Diploma', 'field_of_study': 'Classical studies (Italy)'}]",[],"[{'title': ""Dean's Commendation for Exceptional Performance"", 'description': 'An award for the highest performing students of the College of Social Science', 'issuer': 'University of Exeter', 'date': {'month': 6, 'day': None, 'year': 2017}}, {'title': 'Non contact Boxing Tutor', 'description': None, 'issuer': 'GB National Boxing Awards', 'date': {'month': 10, 'day': None, 'year': 2016}}]","[{'name': 'Negotiation: Theory & Practice ', 'date': {'start': {'month': 3, 'day': None, 'year': 2021}, 'end': {'month': None, 'day': None, 'year': None}}, 'authority': 'The Clingendael Institute', 'url': None, 'license_number': None, 'display_source': None, 'company': {'id': None, 'name': 'The Clingendael Institute', 'logo': 'https://media.licdn.com/dms/image/C4E0BAQEqPcVNCk-H8Q/company-logo_400_400/0/1675948013157?e=1700697600&v=beta&t=LXNTRsGIOTr94pnIq5roOZcGRepnP287gCD5uZaKUc0', 'url': None}}, {'name': 'Certificate of Achievement: Global Health and Human Rights', 'date': {'start': {'month': 7, 'day': None, 'year': 2016}, 'end': {'month': None, 'day': None, 'year': None}}, 'authority': 'Université de Genève', 'url': None, 'license_number': None, 'display_source': None, 'company': {'id': None, 'name': 'University of Geneva', 'logo': 'https://media.licdn.com/dms/image/C560BAQGs9sQXQg_thg/company-logo_400_400/0/1519885766136?e=1700697600&v=beta&t=53bTO2Flzjpj1AYiknSNDKta9X-x4iLWul4WfpzHvfs', 'url': None}}, {'name': 'IELTS Academic Certificate', 'date': {'start': {'month': 2, 'day': None, 'year': 2015}, 'end': {'month': 2, 'day': None, 'year': 2017}}, 'authority': 'British Council', 'url': None, 'license_number': None, 'display_source': None, 'company': {'id': None, 'name': 'British Council', 'logo': 'https://media.licdn.com/dms/image/C4D0BAQEbgQMpvEqVNw/company-logo_400_400/0/1581068895810?e=1700697600&v=beta&t=ia623e8pl_tA678NluBvGLmcFLcSl2NU-VPPBCq-Bew', 'url': None}}, {'name': 'Cambridge English: First (FCE)', 'date': {'start': {'month': 7, 'day': None, 'year': 2014}, 'end': {'month': None, 'day': None, 'year': None}}, 'authority': 'Cambridge English Language Assessment', 'url': None, 'license_number': None, 'display_source': None, 'company': {'id': None, 'name': 'Cambridge University Press & Assessment English', 'logo': 'https://media.licdn.com/dms/image/C4E0BAQF764moHT29Og/company-logo_400_400/0/1650876512808?e=1700697600&v=beta&t=kXntkmuOOUBpZ1PTzmgzO3O1xC1BedVEEa-CiF-uO-Y', 'url': None}}]","[{'name': 'United Nations Laboratory', 'position': 'Delegate', 'date_start': {'month': 4, 'day': None, 'year': 2013}, 'date_end': {'month': 3, 'day': None, 'year': 2015}}]","[{'title': 'Grand Challenges - Confronting the complex security challenges of the future. Do nuclear weapons have a future?', 'date': {'start': {'month': 6, 'day': None, 'year': 2016}, 'end': {'month': 6, 'day': None, 'year': 2016}}, 'description': '\uf0d8\tGrand Challenges has been an extremely useful project that helped me to acquire some key lifetime skills such as problem solving, critical analysis and team working. We assumed the role of key decision-makers, analysing the issue of nuclear proliferation and making predictions of future possible scenarios as well as what the UK’s role should be in each specific context.\n\n\uf0d8\t As part of the Grand Challenges, every student has realized a piece of applied writing in the form of a Ministerial Submission. This task was fulfilled after an intense research-based learning, presenting our personal understanding of the issue we have been tackling during the week. \n\n\uf0d8\tAs students of Strategic Security, we had the great opportunity to further our personal \nknowledge attending lectures led by key guests such Rob Wainwright (Director of Europol), Sir Jon Day (Chair of the Joint Intelligence Committee), and Sir Paul Newton (he retired as a Lieutenant General (3*) in 2012) followed by a Q&A. We gained a valuable insight into general security, re-evaluating my ideas in confronting the complex problems.  \n', 'contributors': [{'type': 'standardizedContributor', 'first_name': 'Diletta M. L.', 'last_name': 'Alparone', 'name': None, 'headline': 'Project Supporter bij PZH || Public Sector || Cum Laude Graduate Adv. MSc IR and Diplomacy'}, {'type': 'standardizedContributor', 'first_name': 'Sarah', 'last_name': 'Witty', 'name': None, 'headline': 'Sr. Product Strategist with Fusion, an enterprise accelerator at UnitedHealth Group'}, {'type': 'standardizedContributor', 'first_name': 'Hannah', 'last_name': 'Priest', 'name': None, 'headline': 'Masters Graduate with Distinction MA Public Policy'}]}, {'title': ""Sprint Programme: women's development for undergraduate"", 'date': {'start': {'month': 3, 'day': None, 'year': 2016}, 'end': {'month': 3, 'day': None, 'year': 2016}}, 'description': 'Sprint is a programme designed for undergraduate women who want to further discover and develop their skills in a working environment. The project consisted in a 3-day workshop during which we worked on the importance of self-branding, networking, time-management, the concepts of power and assertiveness, defining our core values and strenghts as well as learning valuable techniques to deal with negative feelings that may inhibit our personal development.  \n\nWe also had the great opportunity to get inspired by strong and incredible women such as Barbara Harvey (Managing Director - Accenture), Vicky Wilkinson (RBS) and Caroline Birkby (Project Manger: Dynamics Global Domain - Microsoft).\nThe project will end with a half day workshop in April, where my group will deliver a Presentation about ""Tomorrow\'s Women"", followed by a mock interview', 'contributors': [{'type': 'standardizedContributor', 'first_name': 'Diletta M. L.', 'last_name': 'Alparone', 'name': None, 'headline': 'Project Supporter bij PZH || Public Sector || Cum Laude Graduate Adv. MSc IR and Diplomacy'}, {'type': 'standardizedContributor', 'first_name': 'Laetitia', 'last_name': 'Devoud', 'name': None, 'headline': 'Strategy Consultant at Arthur D. Little | ESCP'}]}, {'title': ""'The Future and Past of Brexit' "", 'date': {'start': {'month': 3, 'day': None, 'year': 2019}, 'end': {'month': 3, 'day': None, 'year': 2019}}, 'description': ""I have worked in a student-organising committee to help organising a series of events named 'The Future and Past of Brexit', which took place on March 28th, 2019, the day before the expected Brexit day.  \nThe first event of the day was divided into two parts: the first part was a classic roundtable discussion, where the speakers talked about the How, Why, and 'What Next' of Brexit; the second part was a group-discussion where the speakers engaged with students and tried to tackle problems like the future UK-EU relationship, how Brexit will affect the UK, how the EU will change without Great Britain and how Brexit affects people.\nDuring the session, I played the role of moderator, chairing the event, introducing the speakers and trying to make the discussion run smoothly. \n\nOur guests included: Professor Alison Harcourt, Dr Alex Prichard, Professor Helen Drake and Sir Ivan Rogers "", 'contributors': [{'type': 'standardizedContributor', 'first_name': 'Diletta M. L.', 'last_name': 'Alparone', 'name': None, 'headline': 'Project Supporter bij PZH || Public Sector || Cum Laude Graduate Adv. MSc IR and Diplomacy'}]}, {'title': 'Global Health and Human Rights - Geneva Summer School', 'date': {'start': {'month': 6, 'day': None, 'year': 2016}, 'end': {'month': 7, 'day': None, 'year': 2016}}, 'description': 'I have attended a two week course about Global Health and Human Rights at the University of Geneva. The course focused on the interconnection between the two above-mentioned fields, looking at key elements such as the social determinants of health, the states\' role and attitude towards Treaties and Conventions (UNDHR, the Convention of the rights of the child, Convention against Torture and Other Cruel, Inhuman or Degrading Treatment or Punishment etc.), the impact of globalization on the health of the population, health policies fostering non-discrimination of patients and vulnerable groups ( people with disabilities and elderly). \n\nAs part of the course, we had the opportunity to visit the World Health Organization (WHO), the Palais des Nations,The Joint United Nations Programme on HIV/AIDS (UNAIDS), the Redcross, and the EU permanent mission in Geneva. \n\nAmong the speakers, we had the pleasure to meet Quinten lataire (Human Rights Officer, UNAIDS), Facundo Chavez (Human Rights Disability Advisor, UNOHCHR), Alexander Breitegger (Legal Advisor, Thematic Legal Advise Unit, ICRC), Carmen Williams (Executive Editor, Health and Human Rights Journal), Jean-Sébastien Blanc (Detention Advisor, APT)\n\nAt the end of the course, my group and I have been assessed with a 10 page report and a 20 minute presentation about the Elderly (""How discrimination of the Elderly affects their health).', 'contributors': [{'type': 'standardizedContributor', 'first_name': 'Diletta M. L.', 'last_name': 'Alparone', 'name': None, 'headline': 'Project Supporter bij PZH || Public Sector || Cum Laude Graduate Adv. MSc IR and Diplomacy'}]}]","[{'name': ""Alparone, D. (2022), 'Not Always Diplomatic: An Australian Woman’s Journey through International Affairs'"", 'publisher': 'The Hague Journal of Diplomacy, Brill', 'url': 'https://brill.com/view/journals/hjd/aop/article-10.1163-1871191x-bja10122/article-10.1163-1871191x-bja10122.xml', 'date': {'month': None, 'day': None, 'year': 2022}, 'authors': [{'type': 'standardizedContributor', 'first_name': 'Diletta M. L.', 'last_name': 'Alparone', 'name': None, 'headline': 'Project Supporter bij PZH || Public Sector || Cum Laude Graduate Adv. MSc IR and Diplomacy'}]}, {'name': ""Alparone, D. and Kumar, A. (2022), 'FOCUS 78 – Saving the United Nations from the Shadow of The Great Hall of People – Perspectives from an Indo-Italian Dialogue'."", 'publisher': 'South Asia Democratic Forum (SADF)', 'url': 'https://www.sadf.eu/focus-78-saving-the-united-nations-from-the-shadow-of-the-great-hall-of-people-perspectives-from-an-indo-italian-dialogue/', 'date': {'month': None, 'day': None, 'year': 2022}, 'authors': [{'type': 'standardizedContributor', 'first_name': 'Diletta M. L.', 'last_name': 'Alparone', 'name': None, 'headline': 'Project Supporter bij PZH || Public Sector || Cum Laude Graduate Adv. MSc IR and Diplomacy'}, {'type': 'standardizedContributor', 'first_name': 'Amit', 'last_name': 'Kumar', 'name': None, 'headline': 'Research Scholar | China - Afghanistan | Election Strategist'}]}, {'name': 'Alparone, D. (2021) \'‘The Norwegian Conflict Management Approach in Sri Lanka: The Limits of Weak Mediation & Bias"".', 'publisher': 'Strategy, Defence and Foreign Affairs (SDAFA).', 'url': 'https://www.sdafa.co.uk/the-norwegian-conflict-management-approach-in-sri-lanka-the-limits-of-weak-mediation-bias', 'date': {'month': None, 'day': None, 'year': 2021}, 'authors': [{'type': 'standardizedContributor', 'first_name': 'Diletta M. L.', 'last_name': 'Alparone', 'name': None, 'headline': 'Project Supporter bij PZH || Public Sector || Cum Laude Graduate Adv. MSc IR and Diplomacy'}]}, {'name': ""Alparone, D. (2021) '‘Nagorno-Karabakh: Ethnicization of Conflict: Identity & Intractability’."", 'publisher': 'Strategy, Defence and Foreign Affairs (SDAFA).', 'url': 'https://www.sdafa.co.uk/nagorno-karabakh-ethnicization-of-conflict-identity-intractability', 'date': {'month': None, 'day': None, 'year': 2021}, 'authors': [{'type': 'standardizedContributor', 'first_name': 'Diletta M. L.', 'last_name': 'Alparone', 'name': None, 'headline': 'Project Supporter bij PZH || Public Sector || Cum Laude Graduate Adv. MSc IR and Diplomacy'}]}, {'name': 'Alparone, D. (2021) ‘How to re-ripen a conflict after a failed deal: What the Biden administration can learn from the Bangsamoro Comprehensive Agreement’', 'publisher': 'Strategy, Defence and Foreign Affairs (SDAFA)', 'url': 'https://www.sdafa.co.uk/how-to-re-ripen-a-conflict-after-a-failed-deal-what-the-biden-administration-can-learn-from-the-bangsamoro-comprehensive-agreement', 'date': {'month': None, 'day': None, 'year': 2021}, 'authors': [{'type': 'standardizedContributor', 'first_name': 'Diletta M. L.', 'last_name': 'Alparone', 'name': None, 'headline': 'Project Supporter bij PZH || Public Sector || Cum Laude Graduate Adv. MSc IR and Diplomacy'}]}, {'name': ""Alparone, D. (2020) 'Realpolitik vs. Human Rights’ Protection: The Rohingya Crisis and The Failure of the Responsibility to Protect"", 'publisher': 'R2P Student Journal', 'url': 'http://r2pstudentjournal.leeds.ac.uk/issues/volume-5-issue-no-1/realpolitik-vs-human-rights-protection-the-rohingya-crisis-and-the-failure-of-the-responsibility-to-protect/', 'date': {'month': None, 'day': None, 'year': 2020}, 'authors': [{'type': 'standardizedContributor', 'first_name': 'Diletta M. L.', 'last_name': 'Alparone', 'name': None, 'headline': 'Project Supporter bij PZH || Public Sector || Cum Laude Graduate Adv. MSc IR and Diplomacy'}]}]",[],"[{'name': 'Esame di Stato', 'score': '100/100', 'date': {'month': 7, 'day': None, 'year': 2015}}, {'name': 'IELTS Academic Certificate', 'score': '7.0/9.0', 'date': None}]","[{'company': {'id': 12187, 'name': 'Provincie Zuid-Holland', 'logo': 'https://media.licdn.com/dms/image/C560BAQGhoCniBwtv-w/company-logo_400_400/0/1612163715141?e=1700697600&v=beta&t=zPAiYjsKSkA9ncrcrWz4cPhK_yFHO7PZen_2x88YGGc', 'url': 'https://www.linkedin.com/company/provincie-zuid-holland/', 'employees': {'start': 1001, 'end': 5000}}, 'date': {'start': {'month': 1, 'day': None, 'year': 2023}, 'end': {'month': None, 'day': None, 'year': None}}, 'profile_positions': [{'location': 'Den Haag, Zuid-Holland, Nederland', 'date': {'start': {'month': 1, 'day': None, 'year': 2023}, 'end': {'month': None, 'day': None, 'year': None}}, 'company': 'Provincie Zuid-Holland', 'description': 'Lopende projecten:\n- Goederenvervoer corridors (weg & spoor)\n- Duurzaam goederenvervoer over water\n- Internationale Mobiliteit \n- Smart Mobility \n- VTH (Vergunning-verlening, Toezicht, Handhaving)', 'title': 'Projectmedewerker - Mobiliteit & Milieu  ', 'employment_type': 'Full-time'}]}, {'company': {'id': 1814, 'name': 'Europol', 'logo': 'https://media.licdn.com/dms/image/C4D0BAQHUDJ07xXKYwA/company-logo_400_400/0/1576249322301?e=1700697600&v=beta&t=q9feHOUk9ANrLaHX0AAkuGVsWyjzcQ7APk7XMvaLWi0', 'url': 'https://www.linkedin.com/company/europol/', 'employees': {'start': 1001, 'end': 5000}}, 'date': {'start': {'month': 7, 'day': None, 'year': 2022}, 'end': {'month': 1, 'day': None, 'year': 2023}}, 'profile_positions': [{'location': 'The Hague, South Holland, Netherlands', 'date': {'start': {'month': 7, 'day': None, 'year': 2022}, 'end': {'month': 1, 'day': None, 'year': 2023}}, 'company': 'Europol', 'description': ""1. Supported the development of Europol's New Strategy by participating in senior\nmanagement interviews and contributing to the evaluation of Europol's strategic\npriorities (2023-2027);\n2. Gathered Open Source Intelligence (OSINT) to analyse a country's political situation before the Executive Director (ED) travelled on a mission;\n3. Assisted the Economic and Financial Crime Centre's work (EFECC) in relation to the Task Force Freeze and Seize;\n4. Facilitated the organization of the 2022 European Police Chief Convention (EPCC);\n5. Designed ad hoc presentations according to the business needs;\n6. Formulated (drafts) speeches and debriefings for topics of interest to the ED\n7. Advised Europol's participation in events of media interest."", 'title': 'Corporate Affairs Bureau Trainee (CAB-01)', 'employment_type': 'Full-time'}]}, {'company': {'id': 570052, 'name': 'Leiden University - Faculty of Governance and Global Affairs', 'logo': 'https://media.licdn.com/dms/image/C4D0BAQGp-JXK0LG2OQ/company-logo_400_400/0/1519911057372?e=1700697600&v=beta&t=h2Qth5YJF0nsvrcODQERyYS7gHFm01ifXzjWkR0g5tY', 'url': 'https://www.linkedin.com/company/faculty-of-governance-and-global-affairs/', 'employees': {'start': 201, 'end': 500}}, 'date': {'start': {'month': 4, 'day': None, 'year': 2022}, 'end': {'month': 12, 'day': None, 'year': 2022}}, 'profile_positions': [{'location': 'The Hague, South Holland, Netherlands', 'date': {'start': {'month': 9, 'day': None, 'year': 2022}, 'end': {'month': 12, 'day': None, 'year': 2022}}, 'company': 'Leiden University - Faculty of Governance and Global Affairs', 'description': '1. Supported the teaching of the module “Intro. To Diplomacy”, delivering a class on “Gender, Feminist Foreign Policy, and Diplomacy”.\n2. Provided feedback on op-eds and mini-essays concerning topics of International Politics\n3. Pre-graded essays on International Political Economy & Negotiation and Conflict Resolution.', 'title': 'Teaching Assistant', 'employment_type': 'Part-time'}, {'location': 'The Hague, South Holland, Netherlands', 'date': {'start': {'month': 4, 'day': None, 'year': 2022}, 'end': {'month': 9, 'day': None, 'year': 2022}}, 'company': 'Leiden University - Faculty of Governance and Global Affairs', 'description': 'As a programme assistant, my role included:\n1. Facilitating administrative tasks for the faculty and programme whilst supporting a\ndiverse team in the management of an advanced and unique IR focused master’s program\n2. Supporting the creation, planning and execution of 3 core events within the MIRD\ncurriculum: a trip to international institutions in Brussels; the annual ""Reconnect"" event\nwith alumni; the ""Thesis Symposium"".\n3. Maintaining contact and professional correspondence with think tanks, professors, EU\nand UN representatives to host them as guest speakers for various academic events', 'title': 'Programme Assistant ', 'employment_type': 'Part-time'}]}, {'company': {'id': None, 'name': 'Release Peace', 'logo': None, 'url': None, 'employees': {'start': None, 'end': None}}, 'date': {'start': {'month': 3, 'day': None, 'year': 2021}, 'end': {'month': 7, 'day': None, 'year': 2021}}, 'profile_positions': [{'location': 'Den Haag, South Holland, Netherlands', 'date': {'start': {'month': 3, 'day': None, 'year': 2021}, 'end': {'month': 7, 'day': None, 'year': 2021}}, 'company': 'Release Peace', 'description': 'My role included:\n1. Reviving the NGO\'s social media accounts (i.e., Facebook, Twitter) to create awareness of the importance of conflict prevention and the risks of conventional weapons falling into the wrong hands (e.g., book suggestions, daily posts concerning ""peace"" and ""conflict"");\n2. Networking and communicating with the local communities in Ghana', 'title': 'NGO Social Media Manager', 'employment_type': 'Part-time'}]}, {'company': {'id': 51617571, 'name': 'Secretaría de Relaciones Exteriores de México', 'logo': 'https://media.licdn.com/dms/image/C4E0BAQEl3w59r6LjOA/company-logo_400_400/0/1570124843803?e=1700697600&v=beta&t=sUNXJiT454Ud4uQd3-UgKcXjoZyybPCUWZMOIxs6M7Y', 'url': 'https://www.linkedin.com/company/sremx/', 'employees': {'start': 5001, 'end': 10000}}, 'date': {'start': {'month': 1, 'day': None, 'year': 2020}, 'end': {'month': 10, 'day': None, 'year': 2020}}, 'profile_positions': [{'location': 'The Hague Area, Netherlands', 'date': {'start': {'month': 1, 'day': None, 'year': 2020}, 'end': {'month': 10, 'day': None, 'year': 2020}}, 'company': 'Secretaría de Relaciones Exteriores de México', 'description': ""My traineeship has a special focus on multilateral diplomacy, i.e. on the relationship between Mexico and the Organization for the Prohibition of Chemical Weapons (OPCW). I support the Alternate Permanent Representative of Mexico to the Organisation for the Prohibition of Chemical Weapons (OPCQ), the Counselor Everardo Corona Aguilar. \n\nMy role included:\n1. Being responsible for gathering and reporting actual information by the OPCW to Mexico;\n2. Representing Mexico at the OPCW during the weekly meetings concerning the obligations specified under the Chemical Weapons Conventions (CWC);\n3. Attending the OPCW's Executive Councils (i.e. planetary meetings);\n4. Conducting academic research on chemical weapons disposed at sea."", 'title': 'Multilateral Affairs Intern at Embassy of Mexico in the Netherlands ', 'employment_type': 'Internship'}]}]","[{'date': {'start': {'month': 10, 'day': None, 'year': 2015}, 'end': {'month': 10, 'day': None, 'year': 2015}}, 'role': 'Start/Finish Marshal', 'company': {'id': None, 'name': 'go2events', 'logo': 'https://media.licdn.com/dms/image/C4E0BAQF4Z08Y3screw/company-logo_400_400/0/1519887413786?e=1700697600&v=beta&t=jD63TxxcAn6MTDxC5qoKH_qJaZB9ON0RTTJUx5yIFz4', 'url': 'https://www.linkedin.com/company/go2events/'}, 'cause': 'HEALTH', 'description': ""I volunteered at the Exeter's Great West Run, giving key information about the event and the purpose, supervising children during the school challenge, securing information plaques and finally, giving rewards to runners (e.g., medals) to have completed their challenge.""}, {'date': {'start': {'month': 10, 'day': None, 'year': 2018}, 'end': {'month': 6, 'day': None, 'year': 2019}}, 'role': 'Language Representative for French Beginners Fast-Track', 'company': {'id': None, 'name': 'University of Exeter', 'logo': 'https://media.licdn.com/dms/image/D4E0BAQFzetwKyeH37g/company-logo_400_400/0/1688119932695?e=1700697600&v=beta&t=LHCL6-kgCymX10smVfNZOmd6lRfR3PWHSSuz9y_OCys', 'url': 'https://www.linkedin.com/school/university-of-exeter/'}, 'cause': 'EDUCATION', 'description': 'My role included:\n1. Analysing feedbacks among students and implementing recommendations by consulting the\nLanguage Board of Education ;\n2. Team-building with the other ""course-leaders"";\n3. Solving complaints concerning the course and being responsible for the students\' satisfaction\n4. Bringing forward initiatives (i.e., language cafe)'}, {'date': {'start': {'month': 3, 'day': None, 'year': 2016}, 'end': {'month': 6, 'day': None, 'year': 2017}}, 'role': 'Social Events Coordinator ', 'company': {'id': None, 'name': 'Exeter University Amateur Boxing Club', 'logo': 'https://media.licdn.com/dms/image/C4E0BAQGSNlPk4YMKvw/company-logo_400_400/0/1564592863061?e=1700697600&v=beta&t=bZU6oxT8SD2H0-KPl7uPPrKdbG-TE2-I541Gg7ekcm0', 'url': 'https://www.linkedin.com/company/exeter-university-amateur-boxing-club/'}, 'cause': 'EDUCATION', 'description': 'Elected social secretary by the Boxing Club (200+ members), the role included:\n1. Organizing weekly and monthly social events;\n2. Planning the logistics during the UK Championships (i.e., transportation, hotels);\n3. Running/ Teaching the Beginners boxing sessions'}, {'date': {'start': {'month': 10, 'day': None, 'year': 2022}, 'end': {'month': None, 'day': None, 'year': None}}, 'role': 'BUDDY', 'company': {'id': None, 'name': 'Buddies HandicapNL', 'logo': 'https://media.licdn.com/dms/image/D4E0BAQFypByYUP0AaA/company-logo_400_400/0/1690959731001?e=1700697600&v=beta&t=Ncqa9QaoMMQxFVxWPN0WZwoXgLdQy8GpStSJK_SuqLI', 'url': 'https://www.linkedin.com/company/buddies-handicapnl/'}, 'cause': 'SOCIAL_SERVICES', 'description': None}]","['Teaching', 'Oral Communication', 'Public Speaking', 'Time Management', 'Social Media', 'Politics', 'Research', 'Event Management', 'Event Planning', 'Dutch', 'Management', 'International Relations', 'Environmental Awareness', 'Translation', 'Microsoft Office', 'Group Work', 'Critical Thinking', 'Teamwork', 'Customer Service', 'Team Leadership']",,,
