profile_id,first_name,last_name,sub_title,profile_picture,background_image,profile_type,entity_urn,object_urn,birth_date,summary,location,premium,influencer,treasury_media,languages,industry,education,patents,awards,certifications,organizations,projects,publications,courses,test_scores,position_groups,volunteer_experiences,skills,network_info,related_profiles,contact_info
julia-gorodecky-06ba219,Julia,Gorodecky,"Copy writing, proofreading, editing and Dutch-English translation services",https://media.licdn.com/dms/image/C5603AQF8rvMDrEesGw/profile-displayphoto-shrink_800_800/0/1517672844561?e=1697673600&v=beta&t=IY3XMv8YtXlR9H263SNbnSVGYkCdCe4w-UZMZawGj8E,,personal,ACoAAAHAsRMBi9-HaKTN0HGjj6FWxo42TFszrYo,29405459,,"Freelance copywriter, copy editor, proofreader and translator (NL-ENG), with 20+ years experience in marketing, PR & publishing. I have worked with international fashion, beauty, interiors & sportswear brands, as well as advertising, PR and recruitment agencies, restaurants, charitable organisations, museums and international publications. Very reliable with deadlines, flexible, impeccable attention to detail, and highly competitive rates. Contact: julia@gorodecky.com

- Fashion: Tommy Hilfiger Europe; Karl Lagerfeld; GANT; Vlisco; Dobotex; Suitsupply; WE Fashion; Colorful Licenses; VeldhovenGroup; Oilily; Mexx; The Finds; NoShirt 

- Sportswear: ASICS; Nike; PUMA; Adidas 

- Lifestyle: COSMANIA; Solaris; TEEEZ Cosmetics; LSA International; Adaptations

- Media: 5 Media; Flow (International Magazine, Specials, books & online); A-Mag/I amsterdam Magazine; MICEdition; AMS magazine; Amsterdam Luxury; Holland Herald (KLM magazine), Msafiri (Kenya Airways magazine), Sky High (KLM); Safaricom; Frame; Mo's Daughters Books; Time Out Amsterdam; Time Out Amsterdam City Guide Book (Editor); Elle Decor Italia; DK Top Ten Amsterdam Guide Book; MediaPartners Group; Uitgeverij van Oorschot 

- Agencies: Amsterdam Worldwide; 180 Amsterdam; Wieden+Kennedy Amsterdam; 72andSunny; PostPanic; Norvell Jefferson; Team Volvo; ExPRtease; Being There; het pr bureau; Press Only; FinchFactor; Kult&Ace; XXS; Cuttlefish Ink; Mount Scott

- Museums: Frans Hals Museum; Amsterdam Museum of Bags; Multatuli Museum

- Finance: Triodos Bank; IBS Capital Allies;

- Other: amsterdam&partners; Amsterdam Neuroscience (VUmc); Limelight Foundation; Twinxter Academy; Aflatoun; CompaNanny; Trifleet Leasing; KUOStudio; LibRT; IMEC recruitment; VDS Training; Deloitte; De Pioniers Fabriek; FinCo Fuel; Firma Fluks; China InRoads; On the Spot; Audentity

- Restaurants: Pianeta Terra (Amsterdam); Bordo (Warsaw). 

Specialties: Copywriting, proofreading, editing, translations, and press & marketing copy.","{'country': 'Netherlands', 'short': 'Amsterdam, North Holland', 'city': 'Amsterdam', 'state': 'North Holland', 'default': 'Amsterdam, North Holland, Netherlands'}",False,False,[],"{'primary_locale': {'country': 'US', 'language': 'en'}, 'supported_locales': [{'country': 'US', 'language': 'en'}], 'profile_languages': [{'name': 'Dutch', 'proficiency': None}, {'name': 'Polish', 'proficiency': None}]}",Public Relations & Communications,"[{'date': {'start': {'month': None, 'day': None, 'year': 1993}, 'end': {'month': None, 'day': None, 'year': 1995}}, 'school': {'name': 'London College of Fashion, University of the Arts London', 'logo': 'https://media.licdn.com/dms/image/C4E0BAQHzv7FNIj5Uxw/company-logo_400_400/0/1675251196608?e=1700697600&v=beta&t=3_zJb2oqBvmdtTShwGTYPaHMEntD_h4Hdg2aMLTV0Hw', 'url': 'https://www.linkedin.com/school/london-college-of-fashion/'}, 'degree_name': 'BTEC Higher National Diploma', 'field_of_study': 'Fashion Journalism; Broadcast Journalism; Marketing; Public Relations; Business Studies; Media'}, {'date': {'start': {'month': None, 'day': None, 'year': 1991}, 'end': {'month': None, 'day': None, 'year': 1993}}, 'school': {'name': 'Richmond College', 'logo': None, 'url': None}, 'degree_name': 'CAM Foundation', 'field_of_study': 'Marketing; Advertising; Public Relations; Sales Promotion; Direct Marketing; Media'}]",[],[],[],[],[],[],[],[],"[{'company': {'id': None, 'name': 'handblend', 'logo': None, 'url': None, 'employees': {'start': None, 'end': None}}, 'date': {'start': {'month': 6, 'day': None, 'year': 2004}, 'end': {'month': None, 'day': None, 'year': None}}, 'profile_positions': [{'location': 'Amsterdam, the Netherlands', 'date': {'start': {'month': 6, 'day': None, 'year': 2004}, 'end': {'month': None, 'day': None, 'year': None}}, 'company': 'handblend', 'description': ""Freelance copywriter, copy editor, proofreader and translator (NL-ENG), with 20+ years experience in marketing, PR & publishing. I have worked with international fashion, beauty, interiors & sportswear brands, as well as advertising, PR and recruitment agencies, restaurants, charitable organisations, museums and international publications. Very reliable with deadlines, flexible, impeccable attention to detail, and highly competitive rates. Contact: julia@gorodecky.com\n\nClients:\n- Fashion: Tommy Hilfiger Europe; Karl Lagerfeld; GANT; Vlisco; Dobotex; Suitsupply; WE Fashion; Colorful Licenses; VeldhovenGroup; Oilily; Mexx; The Finds; NoShirt \n\n- Sportswear: ASICS; Nike; PUMA; Adidas \n\n- Lifestyle: COSMANIA; Solaris; TEEEZ Cosmetics; LSA International; Adaptations\n\n- Media: 5 Media; Flow (International Magazine, Specials, books & online); A-Mag/I amsterdam Magazine; MICEdition; AMS magazine; Amsterdam Luxury; Holland Herald (KLM magazine), Msafiri (Kenya Airways magazine), Sky High (KLM); Safaricom; Frame; Mo's Daughters Books; Time Out Amsterdam; Time Out Amsterdam City Guide Book (Editor); Elle Decor Italia; DK Top Ten Amsterdam Guide Book; MediaPartners Group; Uitgeverij van Oorschot \n\n- Agencies: Amsterdam Worldwide; 180 Amsterdam; Wieden+Kennedy Amsterdam; 72andSunny; PostPanic; Norvell Jefferson; Team Volvo; ExPRtease; Being There; het pr bureau; Press Only; FinchFactor; Kult&Ace; XXS; Cuttlefish Ink; Mount Scott\n\n- Museums: Frans Hals Museum; Amsterdam Museum of Bags; Multatuli Museum\n\n- Finance: Triodos Bank; IBS Capital Allies;\n\n- Other: amsterdam&partners; Amsterdam Neuroscience (VUmc); Limelight Foundation; Twinxter Academy; Aflatoun; CompaNanny; Trifleet Leasing; KUOStudio; LibRT; IMEC recruitment; VDS Training; Deloitte; De Pioniers Fabriek; FinCo Fuel; Firma Fluks; China InRoads; On the Spot; Audentity\n\n- Restaurants: Pianeta Terra (Amsterdam); Bordo (Warsaw). \n\nSpecialties: Copywriting, proofreading, editing, translations, and press & marketing copy."", 'title': 'Professional Copywriter, Copy Editor, Proofreader & Translator (NL-ENG)', 'employment_type': 'Freelance'}]}, {'company': {'id': 7180, 'name': 'Mexx International', 'logo': 'https://media.licdn.com/dms/image/C4E0BAQEh0yyWV-O6gA/company-logo_400_400/0/1675413753045?e=1700697600&v=beta&t=4dq9L9-0XiV7nxVtSQAHSNQ7BB-l3GOTEdUJ1kaVYHg', 'url': 'https://www.linkedin.com/company/mexx/', 'employees': {'start': 501, 'end': 1000}}, 'date': {'start': {'month': 5, 'day': None, 'year': 2000}, 'end': {'month': 2, 'day': None, 'year': 2002}}, 'profile_positions': [{'location': None, 'date': {'start': {'month': 5, 'day': None, 'year': 2000}, 'end': {'month': 2, 'day': None, 'year': 2002}}, 'company': 'Mexx', 'description': 'Responsible for creating and implementing a new, synchronised PR strategy on an international level. Overseeing all PR activities and PR agencies. Writing of all press packs and releases, including business, financial, and seasonal fashion releases for all lines.', 'title': 'International PR Manager', 'employment_type': None}]}, {'company': {'id': None, 'name': 'Red Rooster PR', 'logo': None, 'url': None, 'employees': {'start': None, 'end': None}}, 'date': {'start': {'month': None, 'day': None, 'year': 1998}, 'end': {'month': 3, 'day': None, 'year': 2000}}, 'profile_positions': [{'location': None, 'date': {'start': {'month': None, 'day': None, 'year': 1998}, 'end': {'month': 3, 'day': None, 'year': 2000}}, 'company': 'Red Rooster PR', 'description': 'Responsible for day-to-day PR activities and marketing; writing proposals for new business and PR/marketing opportunities; overseeing launch of new Mexx stores in UK.', 'title': 'Account Manager/Account Director', 'employment_type': None}]}, {'company': {'id': 16016, 'name': 'Harvey Nichols', 'logo': 'https://media.licdn.com/dms/image/C4D0BAQGW8X1JqTCZWQ/company-logo_400_400/0/1538384157039?e=1700697600&v=beta&t=U85-GhOwmkdC-GnDQuLa7qhnD2vnQnMNsCjvlVoWP0s', 'url': 'https://www.linkedin.com/company/harvey-nichols/', 'employees': {'start': 1001, 'end': 5000}}, 'date': {'start': {'month': None, 'day': None, 'year': 1995}, 'end': {'month': None, 'day': None, 'year': 1998}}, 'profile_positions': [{'location': None, 'date': {'start': {'month': None, 'day': None, 'year': 1995}, 'end': {'month': None, 'day': None, 'year': 1998}}, 'company': 'Harvey Nichols', 'description': 'Positions from 1995 onwards: PR Officer; Marketing Officer; Events Manager; Publishing Manager', 'title': 'Marketing, Events & Publishing Manager', 'employment_type': None}]}]",[],"['Copywriting', 'Proofreading', 'Editing', 'Public Relations', 'Books', 'Advertising', 'Fashion', 'Publishing', 'Press Releases', 'Creative Writing', 'Copy Editing', 'Magazines', 'Marketing Communications', 'Journalism', 'Internal Communications', 'Graphic Design', 'Social Media', 'Online Marketing', 'Integrated Marketing', 'Layout']",,,
