profile_id,first_name,last_name,sub_title,profile_picture,background_image,profile_type,entity_urn,object_urn,birth_date,summary,location,premium,influencer,treasury_media,languages,industry,education,patents,awards,certifications,organizations,projects,publications,courses,test_scores,position_groups,volunteer_experiences,skills,network_info,related_profiles,contact_info
petronella-torin-94023169,Petronella ,Torin,"Cellist, Teacher, Mental trainer",https://media.licdn.com/dms/image/C4E03AQFF3K9SgEkPzA/profile-displayphoto-shrink_800_800/0/1528563969515?e=1697673600&v=beta&t=csWnDQ0_rEmdiJcvj1MkHBBRBf-mPQEnJsZ-n3DyUoI,https://media.licdn.com/dms/image/C4E16AQFZOy4cepTlNg/profile-displaybackgroundimage-shrink_350_1400/0/1528564345527?e=1697673600&v=beta&t=8Lpv8AxlGFZglcnPS4bJph-Fh5sPmFN8bUzTzlnMpL4,personal,ACoAAA5zJwABcVUpWhUwGYizRbydgYW1Qz6gzok,242427648,,"My musical education started in the local music school at the age of 9, where I discovered the cello. In High
School I attended an orchestra music program. Upon finishing my basic education I went on to study Cello
with Lars-Inge Bjärlestam at Ingesund University. My conservatory education began in Odense, Denmark at
the National Music Academy of Denmark. My professor for the three-year bachelor program was the solo
cellist of Malmö Orchestra, Niels Ullner.
In his letter of recommendation, Professor Niels Ullner writes:
""[...] Petronella Torin ... is a serious and hardworking student. [She] combines her fine musicality and sense of tone
production with a strong ambition to constantly improve her playing which has really paid off during the last years.""
I did an Erasmus year at the Maastricht Conservatory in the Netherlands, where I worked with Ursula Smith
(Professor, Guildhall School of Music, London & solo Cellist in Esbjerg Ensemble, Denmark).
For my master in ""Music Performance"", I choose the Royal Conservatory of Liège in Belgium and Professor
Jean-Paul Zanutel, solo cellist and member of the national ensemble ""Musiques Nouvelles"" in Belgium.
Playing the cello is not all I have been doing in my music education. When I was fourteen I started taking
singing lessons and today one of my specialities is to play the cello and sing at the same time. I am always
trying to challenge and expand the way of playing the cello. During a theatre project in the Toonelgroup
Maastricht I even played the cello while dancing.
In 2016 I started my own company called ""A Swedish Cellist"". ""Take Away Concerts – Feed your Ears"" was
my first project, the idea is that you can order a concert for your home like take away food. My mission is to
spread classical music and build bridges between people and music. I have since performed as ""A Swedish
Cellist"" around Europe, including in Belgium, Luxembourg, Germany & Sweden.
I have also so far interviewed more than 24 people for my podcast ""Master in Music"", with the aim to inspire
and spread valuable knowledge between artists and audiences.
Most recently, I have been working towards becoming an International Coach in Mental Training, following
a course from the Scandinavian International University in Sweden. My professor is Lars-Eric Unestål, the
founder of the Swedish model of mental training.","{'country': 'Netherlands', 'short': 'Maastricht, Limburg', 'city': 'Maastricht', 'state': 'Limburg', 'default': 'Maastricht, Limburg, Netherlands'}",False,False,"[{'url': 'https://swedishcellist.com/', 'title': 'Home', 'description': 'finaly i resived my beloved loop station. for you who are not femilliar with the magical powers of a loopstation the loop is: For the uninitiated, a loop is simply a snippet of audio that plays repeatedly. With a Loop Station, you can plug in a...', 'image': 'https://media.licdn.com/dms/image/sync/C5627AQFDvJCl1Vmk7w/articleshare-shrink_1280_800/0/1690871349966?e=1692957600&v=beta&t=Gdt8wUYlAApsHQ7y3ObTHJhjpjWd1RRe0kjWj0Nnxso'}]","{'primary_locale': {'country': 'DK', 'language': 'da'}, 'supported_locales': [{'country': 'DK', 'language': 'da'}, {'country': 'US', 'language': 'en'}], 'profile_languages': [{'name': 'Danska', 'proficiency': 'PROFESSIONAL_WORKING'}, {'name': 'Engelska', 'proficiency': 'FULL_PROFESSIONAL'}, {'name': 'Franska', 'proficiency': 'ELEMENTARY'}, {'name': 'Nederländska', 'proficiency': 'ELEMENTARY'}, {'name': 'Svenska', 'proficiency': 'NATIVE_OR_BILINGUAL'}, {'name': 'Tyska', 'proficiency': 'LIMITED_WORKING'}]}",Music,"[{'date': {'start': {'month': 1, 'day': None, 'year': 2019}, 'end': {'month': 5, 'day': None, 'year': 2022}}, 'school': {'name': 'Licensed Mental Trainer Coach, Scandinavian International Universety, Sweden', 'logo': None, 'url': None}, 'degree_name': 'Licensed Mental Trainer Coach', 'field_of_study': 'Performance psychology'}, {'date': {'start': {'month': 8, 'day': None, 'year': 2016}, 'end': {'month': 8, 'day': None, 'year': 2018}}, 'school': {'name': 'Conservatoire royal de Liège', 'logo': 'https://media.licdn.com/dms/image/C560BAQFMA03jMGIXyA/company-logo_400_400/0/1519892416850?e=1700697600&v=beta&t=tIhrTW8phwbE2RbwJq9eUqR8iwWJe-6kQ2X5rzACTeo', 'url': 'https://www.linkedin.com/school/conservatoire-royal-de-li-ge/'}, 'degree_name': 'Master in Music: Cello (with distinction), ', 'field_of_study': 'Cello'}, {'date': {'start': {'month': 8, 'day': None, 'year': 2015}, 'end': {'month': 7, 'day': None, 'year': 2016}}, 'school': {'name': 'Zuyd Hogeschool | Zuyd University of Applied Sciences', 'logo': 'https://media.licdn.com/dms/image/C4E0BAQFcG9BLnQDK2Q/company-logo_400_400/0/1678187904407?e=1700697600&v=beta&t=5yqg9xUfuCXDqd0MYkTvX21fXT7KMK8T6MW7oEEx-dg', 'url': 'https://www.linkedin.com/school/hogeschool-zuyd/'}, 'degree_name': 'Erasmus', 'field_of_study': 'Music-Cello'}, {'date': {'start': {'month': None, 'day': None, 'year': 2012}, 'end': {'month': None, 'day': None, 'year': 2015}}, 'school': {'name': 'Danish National Academy of Music', 'logo': None, 'url': None}, 'degree_name': 'Bachelor in Music', 'field_of_study': 'Music'}, {'date': {'start': {'month': 8, 'day': None, 'year': 2010}, 'end': {'month': 7, 'day': None, 'year': 2012}}, 'school': {'name': 'Ingesund School of Music, Arvika, Sweden', 'logo': None, 'url': None}, 'degree_name': None, 'field_of_study': None}]",[],[],[],[],[],[],[],[],"[{'company': {'id': None, 'name': None, 'logo': None, 'url': None, 'employees': {'start': None, 'end': None}}, 'date': {'start': {'month': 7, 'day': None, 'year': 2017}, 'end': {'month': None, 'day': None, 'year': None}}, 'profile_positions': [{'location': 'Belgum, Liége', 'date': {'start': {'month': 7, 'day': None, 'year': 2017}, 'end': {'month': None, 'day': None, 'year': None}}, 'company': None, 'description': 'Performing for one week the ""Best Of"" of the season program to close the 2017 season of the Opéra Wallonie\nin Liège, Belgium', 'title': 'Cellist, Opéra Wallonie, Liège', 'employment_type': 'Freelance'}]}, {'company': {'id': None, 'name': 'Egenföretagare', 'logo': None, 'url': None, 'employees': {'start': None, 'end': None}}, 'date': {'start': {'month': 10, 'day': None, 'year': 2016}, 'end': {'month': None, 'day': None, 'year': None}}, 'profile_positions': [{'location': 'Maastricht-området, The Nederlands', 'date': {'start': {'month': 10, 'day': None, 'year': 2016}, 'end': {'month': None, 'day': None, 'year': None}}, 'company': 'Egenföretagare', 'description': 'I started my own company ""A Swedish Cellist - Petronella Torin"" in the Netherlands in 2016, offering concerts\nas solo performer or in an ensemble, lessons in Mental Training, Cello and Music Introduction for Children &\nproducing the podcast ""Master in Music"".\nwww.swedishcellist.com', 'title': 'Artist,Teacher and Mental Trainer', 'employment_type': 'Self-employed'}]}, {'company': {'id': None, 'name': 'Stichting Jong voor Oud, Maastricht', 'logo': None, 'url': None, 'employees': {'start': None, 'end': None}}, 'date': {'start': {'month': 6, 'day': None, 'year': 2016}, 'end': {'month': None, 'day': None, 'year': None}}, 'profile_positions': [{'location': 'The Nederlands, Limburg', 'date': {'start': {'month': 6, 'day': None, 'year': 2016}, 'end': {'month': None, 'day': None, 'year': None}}, 'company': 'Stichting Jong voor Oud, Maastricht', 'description': 'I have been regularly contracted since 2016 to perform at concerts (both playing the cello & singing solo\nor in an ensemble) organized by ""Stichting Jong voor Oud"", an organization aiming to deliver high-quality\nperformances by young musicians for residents at elderly and care homes around Limburg.\nwww.muziekjongvooroud.nl', 'title': 'Performer,', 'employment_type': None}]}, {'company': {'id': None, 'name': 'Theather', 'logo': None, 'url': None, 'employees': {'start': None, 'end': None}}, 'date': {'start': {'month': 3, 'day': None, 'year': 2018}, 'end': {'month': 4, 'day': None, 'year': 2018}}, 'profile_positions': [{'location': 'Maastricht-området, Holland', 'date': {'start': {'month': 3, 'day': None, 'year': 2018}, 'end': {'month': 4, 'day': None, 'year': 2018}}, 'company': 'Theather', 'description': 'Talent Lab is a new form of talent development for the latest generation of performing artists.\nSeven talents are selected for each edition in the field of game, dance, music, design,\nperformance, choreography, direction and production.\nFor one month they work together on a presentation of collaborations that arise in the group: by\nlooking for duos and trios and exchanging these methods and arriving at something small.\nThey receive guidance from Paul Slangen, dramaturge Toneelgroep Maastricht, and Saartje\nHoogland, creative producer VIA ZUID.\nThe first edition of Talent Lab was Club Sandwich that played on 4 and 5 November 2017 in the\nBordenhal Maastricht.\nThe second edition of Talent Lab will take place on Saturday 21 and Sunday 22 April 2018\nTalent Lab is a collaboration between Toneelgroep Maastricht and VIA ZUID.\nhttp://www.toneelgroepmaastricht.nl/gezelschap/talent_lab/', 'title': 'Cellist in Talent LAB Toneelgroup 2018', 'employment_type': None}]}, {'company': {'id': 10864345, 'name': 'Théâtre de Liège', 'logo': 'https://media.licdn.com/dms/image/C510BAQFMPGQNsa8lHA/company-logo_400_400/0/1519900663671?e=1700697600&v=beta&t=4Ql9ublHdI7GNS7pmP_foPjMPV3JlnTQJSfj_5Z-GBs', 'url': 'https://www.linkedin.com/company/th%C3%A9%C3%A2tre-de-li%C3%A8ge/', 'employees': {'start': 51, 'end': 200}}, 'date': {'start': {'month': 10, 'day': None, 'year': 2017}, 'end': {'month': 12, 'day': None, 'year': 2017}}, 'profile_positions': [{'location': 'Liège-området, Belgien', 'date': {'start': {'month': 10, 'day': None, 'year': 2017}, 'end': {'month': 12, 'day': None, 'year': 2017}}, 'company': 'Théâtre de Liège', 'description': 'March - April 2019\nSeptember - December 2017\nCellist playing for the theatre of Liège in the production ""La voix Humaine"" by Jean Cocteau, directed by\nSalvatore Calcagno.\nwww.theatredeliege.be/evenement/la-voix-humaine-2/', 'title': 'Cellist', 'employment_type': None}]}, {'company': {'id': None, 'name': 'Kroppefjällshemmet', 'logo': None, 'url': None, 'employees': {'start': None, 'end': None}}, 'date': {'start': {'month': 6, 'day': None, 'year': 2015}, 'end': {'month': 8, 'day': None, 'year': 2017}}, 'profile_positions': [{'location': 'Sweden', 'date': {'start': {'month': 6, 'day': None, 'year': 2015}, 'end': {'month': 8, 'day': None, 'year': 2017}}, 'company': 'Kroppefjällshemmet', 'description': 'Caring for elderly people, palliative patients and people with disabilities in several institutions in Mellerud. My\nduties included but were not limited to: administrating medication, washing, feeding and social support.', 'title': 'Assistant Nurse', 'employment_type': None}]}, {'company': {'id': 2013863, 'name': 'Opéra royal de Wallonie', 'logo': 'https://media.licdn.com/dms/image/C560BAQGX0RDG37Ht7w/company-logo_400_400/0/1652116570043?e=1700697600&v=beta&t=whzkZ_s_-WyCNXxOliQqn-u9wDroKTMPmg3ZyJowePQ', 'url': 'https://www.linkedin.com/company/op-ra-royal-de-wallonie/', 'employees': {'start': 201, 'end': 500}}, 'date': {'start': {'month': 6, 'day': None, 'year': 2017}, 'end': {'month': 6, 'day': None, 'year': 2017}}, 'profile_positions': [{'location': 'Liège-området, Belgien', 'date': {'start': {'month': 6, 'day': None, 'year': 2017}, 'end': {'month': 6, 'day': None, 'year': 2017}}, 'company': 'Opéra Royal de Wallonie-Liège', 'description': 'Playing one Project in the opera orchestra', 'title': 'Cellist', 'employment_type': None}]}, {'company': {'id': None, 'name': 'Church Munkebjerg', 'logo': None, 'url': None, 'employees': {'start': None, 'end': None}}, 'date': {'start': {'month': 3, 'day': None, 'year': 2014}, 'end': {'month': 7, 'day': None, 'year': 2015}}, 'profile_positions': [{'location': 'Odense området, Danmark', 'date': {'start': {'month': 3, 'day': None, 'year': 2014}, 'end': {'month': 7, 'day': None, 'year': 2015}}, 'company': 'Church Munkebjerg', 'description': 'Alto Singer for church services at ""Munkeberkgs Försammling"" (paid)', 'title': 'Singer', 'employment_type': None}]}, {'company': {'id': 3352103, 'name': 'Arvika kommun', 'logo': 'https://media.licdn.com/dms/image/C560BAQESf7-LWmV3AQ/company-logo_400_400/0/1570521586017?e=1700697600&v=beta&t=m_JPgbwUukF8HxE3gT73qD1-uZDEYmS3SmhSTASNf_A', 'url': 'https://www.linkedin.com/company/arvika-kommun/', 'employees': {'start': 1001, 'end': 5000}}, 'date': {'start': {'month': 10, 'day': None, 'year': 2010}, 'end': {'month': 6, 'day': None, 'year': 2011}}, 'profile_positions': [{'location': 'Arvika', 'date': {'start': {'month': 10, 'day': None, 'year': 2010}, 'end': {'month': 6, 'day': None, 'year': 2011}}, 'company': 'Arvika kommun', 'description': 'Teaching beginner students in Oboe playing', 'title': 'Replacement Teacher, Arvikas Musikskola, Arvika, Sweden', 'employment_type': None}]}, {'company': {'id': 9240516, 'name': 'Melleruds Kommun', 'logo': 'https://media.licdn.com/dms/image/C4D0BAQG0oVnQja-nMg/company-logo_400_400/0/1573561786812?e=1700697600&v=beta&t=5xymAdCebJZCOZ3U5rZH4dOqhxowtO9R0NST1G1myA0', 'url': 'https://www.linkedin.com/company/melleruds-kommun/', 'employees': {'start': 501, 'end': 1000}}, 'date': {'start': {'month': 2, 'day': None, 'year': 2007}, 'end': {'month': 6, 'day': None, 'year': 2007}}, 'profile_positions': [{'location': 'Sweden', 'date': {'start': {'month': 2, 'day': None, 'year': 2007}, 'end': {'month': 6, 'day': None, 'year': 2007}}, 'company': 'Melleruds Kommun', 'description': 'substituting cello teacher', 'title': 'Cello teacher', 'employment_type': None}]}]",[],"['Coaching & Mentoring', 'Coaching', 'Online Marketing', 'Social Media Marketing', 'Musik', 'Musikundervisning', 'Musikproduktion', 'Musikteori', 'Koncerter', 'Undervisning', 'Klassisk', 'Engelsk']",,,
