profile_id,first_name,last_name,sub_title,profile_picture,background_image,profile_type,entity_urn,object_urn,birth_date,summary,location,premium,influencer,treasury_media,languages,industry,education,patents,awards,certifications,organizations,projects,publications,courses,test_scores,position_groups,volunteer_experiences,skills,network_info,related_profiles,contact_info
rostislav-fedorov-829219b2,Rostislav,Fedorov,"Shutdown / Turnaround / Outage, TAR",,https://media.licdn.com/dms/image/C4D16AQGbh9okm17v5A/profile-displaybackgroundimage-shrink_350_1400/0/1629469815921?e=1697673600&v=beta&t=lVFMFLeqlgRRoRCHBCY4FQog6IZYDIuEn6l0P2yuWzg,personal,ACoAABfhimEBzCZHdWwZ9VE750Y5M3AXbNmqTWc,400656993,,"Degree qualified, flexible and motivated professional, experienced in Shutdown/Turnaround and Maintenance Planning as well as Project Planning& Control.
Self-starter and good communicator with proven ability to take a lead role and perform against fixed deadlines.
Has strong analytical skills and in-depth experience in Planning in all aspects of scheduling from detail level to summary.
Experienced Primavera and SAP user.
More than 15-year experience working with and managing groups of multinational project and operation personnel in the Uzbekistan.","{'country': 'Netherlands', 'short': 'Amsterdam, North Holland', 'city': 'Amsterdam', 'state': 'North Holland', 'default': 'Amsterdam, North Holland, Netherlands'}",True,False,[],"{'primary_locale': {'country': 'US', 'language': 'en'}, 'supported_locales': [{'country': 'US', 'language': 'en'}], 'profile_languages': [{'name': 'Английский', 'proficiency': 'PROFESSIONAL_WORKING'}, {'name': 'Русский', 'proficiency': 'NATIVE_OR_BILINGUAL'}, {'name': 'Узбекский', 'proficiency': 'PROFESSIONAL_WORKING'}]}",Utilities,"[{'date': {'start': {'month': None, 'day': None, 'year': 2006}, 'end': {'month': None, 'day': None, 'year': 2008}}, 'school': {'name': 'Tashkent State Technical University', 'logo': 'https://media.licdn.com/dms/image/C4D0BAQFF1SZlPgsncw/company-logo_400_400/0/1586334886668?e=1700697600&v=beta&t=LbBPe6jsw1UGv60hqF2gwulr-UWrzNXXUEpO649jbcA', 'url': 'https://www.linkedin.com/school/uzbekistan-tashkent-state-technical-university/'}, 'degree_name': ""Master's degree"", 'field_of_study': 'Design and operation of Oil&Gas Pipelines, Oil Reservoirs and Tank Farms'}, {'date': {'start': {'month': None, 'day': None, 'year': 2002}, 'end': {'month': None, 'day': None, 'year': 2006}}, 'school': {'name': 'Tashkent State Technical University', 'logo': 'https://media.licdn.com/dms/image/C4D0BAQFF1SZlPgsncw/company-logo_400_400/0/1586334886668?e=1700697600&v=beta&t=LbBPe6jsw1UGv60hqF2gwulr-UWrzNXXUEpO649jbcA', 'url': 'https://www.linkedin.com/school/uzbekistan-tashkent-state-technical-university/'}, 'degree_name': ""Bachelor's degree"", 'field_of_study': 'Design and operation of Oil&Gas Pipelines, Oil Reservoirs and Tank Farms'}]",[],[],"[{'name': 'Contemporary challenges of mining project management', 'date': {'start': {'month': 11, 'day': None, 'year': 2021}, 'end': {'month': None, 'day': None, 'year': None}}, 'authority': 'National University of Science and Technology ""MISIS""\xa0 (Moscow Institute of Steel and Alloys)', 'url': None, 'license_number': '040000163059', 'display_source': None, 'company': {'id': None, 'name': 'National University of Science and Technology ""MISIS""\xa0 (Moscow Institute of Steel and Alloys)', 'logo': 'https://media.licdn.com/dms/image/C560BAQH5t3urZShOjQ/company-logo_400_400/0/1519908461367?e=1700697600&v=beta&t=I19K4Lvh53Jha2OlbQPCZGfJVYG1ka1zxHStSvpMBlA', 'url': None}}, {'name': 'Project management (Primavera P6 Advanced Rel 16.2)\n\n', 'date': {'start': {'month': 11, 'day': None, 'year': 2019}, 'end': {'month': None, 'day': None, 'year': None}}, 'authority': 'Softline Group', 'url': None, 'license_number': 'SL-1465', 'display_source': None, 'company': {'id': None, 'name': 'Softline Group', 'logo': 'https://media.licdn.com/dms/image/C4E0BAQFfBGlGLtQoNA/company-logo_400_400/0/1673969669454?e=1700697600&v=beta&t=KjzivnK-C4TvG5WRWOGfRwu6hSrQaP8g1oGC50YSnWo', 'url': None}}, {'name': 'Shutdown & Turnaround Management (International Master class) Fleming Europe (Tom Lenahan (UK))', 'date': {'start': {'month': 9, 'day': None, 'year': 2015}, 'end': {'month': None, 'day': None, 'year': None}}, 'authority': 'Tom Lenahan Limited', 'url': None, 'license_number': None, 'display_source': None, 'company': {'id': None, 'name': 'Tom Lenahan Limited', 'logo': None, 'url': None}}, {'name': 'Maintenance Processing: Operational Functions, Controlling & Reporting (PLM 315/316)', 'date': {'start': {'month': 11, 'day': None, 'year': 2014}, 'end': {'month': None, 'day': None, 'year': None}}, 'authority': 'SAP', 'url': 'https://training.sap.com/training-locations/ru/moscow-info-centretest', 'license_number': None, 'display_source': 'sap.com', 'company': {'id': None, 'name': 'SAP', 'logo': 'https://media.licdn.com/dms/image/D4E0BAQFgplzXUs8o1Q/company-logo_400_400/0/1688178771763?e=1700697600&v=beta&t=AlFKo6rn6570J7Px-legKnWF2AoF5CnKdaiOBBWalaU', 'url': None}}, {'name': 'Managing Technical Objects / Maintenance and Service Processing: Preventive (PLM 305/310', 'date': {'start': {'month': 11, 'day': None, 'year': 2014}, 'end': {'month': None, 'day': None, 'year': None}}, 'authority': 'SAP', 'url': None, 'license_number': None, 'display_source': None, 'company': {'id': None, 'name': 'SAP', 'logo': 'https://media.licdn.com/dms/image/D4E0BAQFgplzXUs8o1Q/company-logo_400_400/0/1688178771763?e=1700697600&v=beta&t=AlFKo6rn6570J7Px-legKnWF2AoF5CnKdaiOBBWalaU', 'url': None}}, {'name': 'Advanced Project Management in Primavera P6 Rel.7', 'date': {'start': {'month': 10, 'day': None, 'year': 2013}, 'end': {'month': None, 'day': None, 'year': None}}, 'authority': 'PMSOFT', 'url': None, 'license_number': None, 'display_source': None, 'company': {'id': None, 'name': 'PMSOFT', 'logo': 'https://media.licdn.com/dms/image/C4E0BAQHfs71jBGCxGA/company-logo_400_400/0/1519913457267?e=1700697600&v=beta&t=msLR_LiJHoXsHm76sxGqvzwPoVzZcYkxq7qllPqIuhE', 'url': None}}, {'name': 'Metrological ensuring of production process', 'date': {'start': {'month': 2, 'day': None, 'year': 2010}, 'end': {'month': None, 'day': None, 'year': None}}, 'authority': 'Uzbek National Institute of Metrology', 'url': None, 'license_number': None, 'display_source': None, 'company': None}]",[],"[{'title': 'CPF Kandym', 'date': {'start': {'month': 3, 'day': None, 'year': 2017}, 'end': {'month': 1, 'day': None, 'year': 2019}}, 'description': None, 'contributors': [{'type': 'standardizedContributor', 'first_name': 'Rostislav', 'last_name': 'Fedorov', 'name': None, 'headline': 'Shutdown / Turnaround / Outage, TAR'}]}, {'title': 'Etinde ', 'date': {'start': {'month': None, 'day': None, 'year': None}, 'end': {'month': None, 'day': None, 'year': None}}, 'description': None, 'contributors': [{'type': 'standardizedContributor', 'first_name': 'Rostislav', 'last_name': 'Fedorov', 'name': None, 'headline': 'Shutdown / Turnaround / Outage, TAR'}]}, {'title': 'Yoshlik I (AGMK)', 'date': {'start': {'month': None, 'day': None, 'year': None}, 'end': {'month': None, 'day': None, 'year': None}}, 'description': None, 'contributors': [{'type': 'standardizedContributor', 'first_name': 'Rostislav', 'last_name': 'Fedorov', 'name': None, 'headline': 'Shutdown / Turnaround / Outage, TAR'}]}]",[],"[{'name': 'Advanced Project Management in Primavera P6 Rel7', 'number': None}, {'name': 'Contemporary challenges of mining project management', 'number': '040000163059'}, {'name': 'Metrological ensuring of production process', 'number': '17767'}, {'name': 'Project Management - Primavera P6 Advanced Rel 16.2', 'number': 'SL-1465'}, {'name': 'SAP PM - Maintenance Processing: Operational Functions, Controlling & Reporting (PLM 315/316)', 'number': None}, {'name': 'SAP PM - Managing Technical Objects / Maintenance and Service Processing: Preventive (PLM 305/310)', 'number': None}, {'name': 'Shutdown & Turnaround Management (International Master class)\nFleming Europe (Tom Lenahan (UK))', 'number': None}]",[],"[{'company': {'id': 3109723, 'name': 'South Stream Transport B.V.', 'logo': 'https://media.licdn.com/dms/image/C4D0BAQH1zOJXOXCdcw/company-logo_400_400/0/1561030777271?e=1700697600&v=beta&t=q8nk02I42luHEKiQFD5Mhw7ztqWsZGpwaiP78Noqpt0', 'url': 'https://www.linkedin.com/company/project-south-stream-transport/', 'employees': {'start': 201, 'end': 500}}, 'date': {'start': {'month': 1, 'day': None, 'year': 2023}, 'end': {'month': None, 'day': None, 'year': None}}, 'profile_positions': [{'location': 'Amsterdam, North Holland, Netherlands', 'date': {'start': {'month': 1, 'day': None, 'year': 2023}, 'end': {'month': None, 'day': None, 'year': None}}, 'company': 'South Stream Transport B.V.', 'description': None, 'title': 'Shutdown Planning and Scheduling Specialist', 'employment_type': 'Full-time'}]}, {'company': {'id': 3548245, 'name': 'JSC Almalyk Mining And Metallurgical Complex', 'logo': 'https://media.licdn.com/dms/image/C4D0BAQHiMkfVILt-OQ/company-logo_400_400/0/1519893216536?e=1700697600&v=beta&t=fO02Tz8P-eeZOAiWpYeZt_HEWbfpAKOVQN0Bc1TwZ18', 'url': 'https://www.linkedin.com/company/jsc-almalyk-mining-and-metallurgical-complex/', 'employees': {'start': 10001, 'end': None}}, 'date': {'start': {'month': 8, 'day': None, 'year': 2021}, 'end': {'month': 12, 'day': None, 'year': 2022}}, 'profile_positions': [{'location': 'Olmaliq, Tashkent Region, Uzbekistan', 'date': {'start': {'month': 8, 'day': None, 'year': 2021}, 'end': {'month': 12, 'day': None, 'year': 2022}}, 'company': 'JSC Almalyk Mining And Metallurgical Complex', 'description': None, 'title': 'Senior Project Planner', 'employment_type': 'Full-time'}]}, {'company': {'id': 476423, 'name': 'New Age (African Global Energy) Limited', 'logo': 'https://media.licdn.com/dms/image/C560BAQFRlnRK76R8Cg/company-logo_400_400/0/1519905200414?e=1700697600&v=beta&t=ONjq7cowY_MRdXNX18cXWWGxoPVYx5NwI7_i7b5pU-Q', 'url': 'https://www.linkedin.com/company/newage-african-global-energy-/', 'employees': {'start': 51, 'end': 200}}, 'date': {'start': {'month': 8, 'day': None, 'year': 2020}, 'end': {'month': 8, 'day': None, 'year': 2021}}, 'profile_positions': [{'location': 'Cameroon', 'date': {'start': {'month': 8, 'day': None, 'year': 2020}, 'end': {'month': 8, 'day': None, 'year': 2021}}, 'company': 'New Age (African Global Energy) Limited', 'description': None, 'title': 'Senior Project Planner', 'employment_type': 'Full-time'}]}, {'company': {'id': 164782, 'name': 'LUKOIL', 'logo': 'https://media.licdn.com/dms/image/C4E0BAQEOwSlng66LvA/company-logo_400_400/0/1519883127928?e=1700697600&v=beta&t=BI5wiLv_ARUEJNmoX9V5mtkNFMckgn3PsYGx76ejPVE', 'url': 'https://www.linkedin.com/company/lukoil/', 'employees': {'start': 10001, 'end': None}}, 'date': {'start': {'month': 3, 'day': None, 'year': 2013}, 'end': {'month': 8, 'day': None, 'year': 2020}}, 'profile_positions': [{'location': 'Tashkent, Uzbekistan', 'date': {'start': {'month': 3, 'day': None, 'year': 2013}, 'end': {'month': 8, 'day': None, 'year': 2020}}, 'company': 'LUKOIL', 'description': '- Managing the preparation phase of all Operator’s objects Shutdowns;\n - Liaising with assets stakeholders and agreeing joint activities, interfacing with management for specific planning and scheduling tasks;\n - Developing and submitting the Shutdown observe and detailed plans of the all Operator’s objects;\n - Planning and controlling of the resource and material endowments for the needs of Shutdown execution. Relevant database management. Effective monitoring and controlling of supply chain down to delivery moment;\n - Daily monitoring (during the Shutdown execution phase) of the planned works execution status. Preparing and reporting to the Management of the current works completion. Analyzing and recommendation for corrective actions in case of backlogging;\n - Actualization of detailed plan during the execution phase, Shutdown deliverables analyzing, development and submitting of the Final Report. \n- Development of recommendations regarding the improving of Shutdown planning, preparation and execution process. Exploring new technologies and best practices, development and actualization of Local Regulations)\n - Determination and development of SAP ERP Plant maintenance module strategy (CMMS);\n - Quality control of input, using and correction of SAP ERP data, maintenance and expansion of Location Codes, analysis of the Maintenance performance.', 'title': 'Shutdown, Turnaround and Outage Manager', 'employment_type': 'Full-time'}]}, {'company': {'id': 1552659, 'name': 'PetroChina International', 'logo': 'https://media.licdn.com/dms/image/C4E0BAQGmjpI26ustgQ/company-logo_400_400/0/1519887888187?e=1700697600&v=beta&t=LX7zkn5PJqS_5h3jyn81Stnx6BhvFgFqDqaihBRXL9s', 'url': 'https://www.linkedin.com/company/petrochina-international/', 'employees': {'start': 201, 'end': 500}}, 'date': {'start': {'month': 10, 'day': None, 'year': 2009}, 'end': {'month': 3, 'day': None, 'year': 2013}}, 'profile_positions': [{'location': 'Tashkent, Uzbekistan', 'date': {'start': {'month': 4, 'day': None, 'year': 2010}, 'end': {'month': 3, 'day': None, 'year': 2013}}, 'company': 'PetroChina International', 'description': '- Monitoring the work of the Uzbekistan-China Pipeline metering stations shift team (6 inspecting engineers)\n - Collection, compilation and analysis of quantity and quality reports (daily and monthly);\n - Archiving of acceptance and transfer documents on Uzbekistan-China Pipeline; \n- Participating directly in regular and extraordinary checks of meters for quantity and quality; \n- Providing guidance and advice to staff with respect of transportation, storage and using of natural gas and self-need consumption.', 'title': 'Senior Planning and Inspecting Engineer', 'employment_type': 'Full-time'}, {'location': 'Tashkent, Uzbekistan', 'date': {'start': {'month': 10, 'day': None, 'year': 2009}, 'end': {'month': 4, 'day': None, 'year': 2010}}, 'company': 'PetroChina International', 'description': '- Collection, compilation and analysis of quantity and quality reports (daily and monthly); \n- Archiving of acceptance and transfer documents on Uzbekistan-China Pipeline;\n - Providing guidance and advice to staff with respect of transportation, storage and using of natural gas and self-need consumption', 'title': 'Planning and Inspecting Engineer', 'employment_type': 'Full-time'}]}, {'company': {'id': 75150971, 'name': 'Uztransgaz JSC', 'logo': 'https://media.licdn.com/dms/image/C4E0BAQG22slHFy9kIA/company-logo_400_400/0/1610979356135?e=1700697600&v=beta&t=qhAcSPmN3-hZJZs0ySx4z0UE3M3d4LbQRdwujqx7PkA', 'url': 'https://www.linkedin.com/company/uztransgaz-jsc/', 'employees': {'start': 5001, 'end': 10000}}, 'date': {'start': {'month': 5, 'day': None, 'year': 2007}, 'end': {'month': 8, 'day': None, 'year': 2009}}, 'profile_positions': [{'location': 'Tashkent, Uzbekistan', 'date': {'start': {'month': 1, 'day': None, 'year': 2008}, 'end': {'month': 8, 'day': None, 'year': 2009}}, 'company': 'Uztransgaz JSC', 'description': None, 'title': 'Head of the Planning Department for self-need consumption and technological losses assessment', 'employment_type': 'Full-time'}, {'location': 'Tashkent, Uzbekistan', 'date': {'start': {'month': 11, 'day': None, 'year': 2007}, 'end': {'month': 1, 'day': None, 'year': 2008}}, 'company': 'Uztransgaz JSC', 'description': None, 'title': 'Engineer 1st class of Metrology and gas supply service', 'employment_type': 'Full-time'}, {'location': 'Tashkent, Uzbekistan', 'date': {'start': {'month': 5, 'day': None, 'year': 2007}, 'end': {'month': 11, 'day': None, 'year': 2007}}, 'company': 'Uztransgaz JSC', 'description': None, 'title': 'Planning Engineer of the Department of self-need consumption and technological losses assessment', 'employment_type': 'Full-time'}]}, {'company': {'id': 18770091, 'name': 'Ministry of Public Education of the Republic of Uzbekistan', 'logo': 'https://media.licdn.com/dms/image/C560BAQF1BKjt8QXekg/company-logo_400_400/0/1534352491893?e=1700697600&v=beta&t=b4Dy-mPas86zUWNyohe8lRqzunDNRTzXd_wMXH0NDA4', 'url': 'https://www.linkedin.com/company/uzedu/', 'employees': {'start': 51, 'end': 200}}, 'date': {'start': {'month': 5, 'day': None, 'year': 2002}, 'end': {'month': 2, 'day': None, 'year': 2007}}, 'profile_positions': [{'location': 'Tashkent, Uzbekistan', 'date': {'start': {'month': 5, 'day': None, 'year': 2002}, 'end': {'month': 2, 'day': None, 'year': 2007}}, 'company': 'Ministry of Public Education of the Republic of Uzbekistan', 'description': None, 'title': 'Computer Teacher', 'employment_type': 'Full-time'}]}]",[],"['Project Planning', 'EPC', 'Shutdown Manager', 'Project Management', 'Strategic Planning', 'Oil & Gas', 'Primavera P6', 'SAP ERP', 'Microsoft Excel', 'Microsoft Office', 'Outlook', 'PowerPoint', 'Maintenance Planner', 'Shutdown management', 'Нефтегазовая отрасль', 'Инженерное дело', 'Менеджмент', 'CMMS', 'КСУТО', 'Shutdown planner']",,,
